index,title,created_utc,selftext,subreddit,author,permalink
23,"Basic strain derivation, cannot work this out (result answer is incorrect magnitude)",1521696674,"I'm struggling with this very basic equation, hopefully someone with a fresh mind can help me out:

So Eulers beam theory for a simply supported load with 2 equal symmetric point forces is given by:

δ=Pa(3L^2 −4a^2) /24EI in relation to this diagram (http://www.structx.com/Beam_Formulas_009.html)

Using a given a=0.005 m, L=0.017 m, P = 207N, E of 3.8E9 Pa, and I of 1.257E-11 m4 , I can calculate δ=1.39E−03, where P is calculated using a known yield stress.

Now, if i want to work backwards to derive strain from a given displacement, i can do the following:

σ=Eε=PA, I=πr^4 /4, A=πr^2 Rearranging Beam theory above, I get:

P=24EIε/a(3L^2 −4a^2) Subbing in the above 3 into the rearranged beam theory, I should get:

ε=6r2δ/a(3L^2 −4a^2) Now using the same yield stress used above to calculated the force, I get ε=4.342E−03.

Using Hookes law: E=σε, I get a calculated E value of 3.8E10, a result 10 times greater than the E i started off with.

I CANNOT workout why this is happening, if anyone could shed some light on this, my headache will really appreciate it.

Thankyou",AskEngineers,dsx2,/r/AskEngineers/comments/8696v4/basic_strain_derivation_cannot_work_this_out/
24,"Can an Engineering degree ""expire"" after, say, 10 years of not working in Engineering?",1521694061,,AskEngineers,idontknowwhatiscool,/r/AskEngineers/comments/868zhx/can_an_engineering_degree_expire_after_say_10/
25,Can a BSEE do a BSEET's job? Who would win in a hiring if two people from the same college with those degrees were competing for a technical position?,1521693448,,AskEngineers,idontknowwhatiscool,/r/AskEngineers/comments/868xkg/can_a_bsee_do_a_bseets_job_who_would_win_in_a/
26,Engineers with Student Loans. How long has it/will it take you to pay off your loans?,1521690685,"College has been fun, and I'm excited for graduate school. I'm pursuing a masters in structural engineering, but I am worried about how long it will take to pay off my loans. I'm estimating 30k of loans by the time I graduate. 

The optimist in me is saying the Return in Investment will be worth the debt. My program is 1 year and an engineer's entry level pay is higher than other majors. Maybe I can pay it off in 3-4 years if I work hard enough and keep up the frugal lifestyle that I am used to in college.

The realist in me is saying I'm being naive. Even if I make 60-70k a year, interest will accrue, life-shit will happen, and I will be paying off loans for 10 years. My friends will be buying cars, getting married, traveling the world, and I will not be able to keep up the dedication to live a frugal life in my 20s. 

For those who pursue engineering (not just civil engineers), how much debt did you take and how long did it take (or will it take) to pay off your debts? 

",AskEngineers,toppingunashi,/r/AskEngineers/comments/868oua/engineers_with_student_loans_how_long_has_itwill/
27,Check my Slope Density Analysis?,1521687285,"I'm doing a slope/density analysis of a plot I'm intending to buy. This is in Southern California, I'm trying to verify the plot can be split.
My math is here: https://i.imgur.com/sQnzeWN.jpg

Width is the contour interval. I'm using 40 foot, and then at the end 20 foot. (OK I just divided the length of that contour in half, sue me.)

I used a measurement tool to get the length of each contour from one end of the property to the other, also shown in the picture.

Area is from records.

Can any civil engineers verify I'm doing this calculation correct?",AskEngineers,thegreedyturtle,/r/AskEngineers/comments/868cuz/check_my_slope_density_analysis/
28,"What is a ""true"" engineering discipline?",1521686742,"Good day,

I am currently a first-year student going to my second year. By the end of the year, we have to submit a form deciding on 10 programs we would like to pursue, with #1 being our top priority.

My problem is that I currently want to choose the discipline Computer Engineering - Software Option, but my dad (an electrical engineer) states that I should pick something else as a ""Computer Engineer - Software Option"" isn't really a engineer, but rather just someone who Computer Science. When my dad (who is pretty old now), took his bachelor's of engineering, they only had civil, mechanical, chemical, and electrical. Therefore, he believes that this are the only discipline considered as ""true"" engineers. I was just wondering if this was true, and whether I should just edit my priorities? I was also wondering what is the difference between someone with a computer science degree and a computer engineer with a specialization in software (because the more I think about it, the more I believe my dad)? Should I just remove the Computer-Software to just Computer?

My List is currently:

* Computer-Software
* Computer

* Civil

* Electrical

",AskEngineers,JinRoTan,/r/AskEngineers/comments/868ap5/what_is_a_true_engineering_discipline/
29,Engineering Disciplines,1521686133,,AskEngineers,[deleted],/r/AskEngineers/comments/8688em/engineering_disciplines/
30,Engineers of Reddit:Why did you pick your current discipline? What is your current role at the company?,1521675994,[deleted],AskEngineers,[deleted],/r/AskEngineers/comments/86730o/engineers_of_redditwhy_did_you_pick_your_current/
31,What hotplate has the most accurate temperature control (and some other questions)?,1521674872,"Lets just cut through some bullshit really quickly. Despite all sorts of strange advertising There is only one basic technology for an electric hotplate that I have seen mass produced. An induction heating of iron. Some of them include a ceramic plate on top and call it infrared some just dont include the iron and heat up the pot directly. They should all be basically the same price because they all do the same thing and im getting tired of having to guess who fucked up and who actually built it right. The only real variation is if there is a decent temperature measure onboard and if it is programed to accurately turn off and on to maintain some temperature. So which one does the job? Also, how hot does a 7.5 inch iron coil get at (pick whatever pressure you want i dont care) given some amount of time at some amount of watts. the only variable that should change here is the watts in increments of whatever they actually increment it by.",AskEngineers,aquestionforreddit12,/r/AskEngineers/comments/866y82/what_hotplate_has_the_most_accurate_temperature/
32,Have I chosen the wrong Eng. Course?,1521674051,"TL; DR: I'm thinking about transferring from Automation to Physics Eng. because I'm not eager thinking about what I would work wit, if I achieved this course. However switching would cost me a year (I would have to start the first year again). What would you tell me?

Hi there, I'm going through my first year in University this year. I've enrolled in Automation Engineering in Italy (here we have 3 years Bachelor and 2 years Major, I'm attending the first one). Even though I don't dislike the subjects, I'm afraid I may have chosen the wrong path. I think I may have chosen it because it's ""future applications"". I've had a big crisis period where I didn't know if I did wrong choosing engineerig. After a couple of weeks of despair I've realised tha I want to be an engineer at every cost. Anyways now I'm thinking I may have chose the wrong engineering: I have thought about Mechanical or even Civil as substitutes because the first one is very ""wide"" and the second one ""somethinf different"". After some thoughts I've evaluated Civil wouldn't do for me and that Mechanical may have the same appeal as Automation. The day I selected my course on the online form I had some uncertainties whether I should take Automation or Physics  Engineering. Now I started reconsidering Physics again: I like the subject, radiation has always fascinated me as well. They are obviously no solid reasons but I'm afraid that this thought could be just ephemere as the other two. I realised that I'm not particularlu entusiast about Automation job's possibilities: working with robots, industrial robots, self driving cars, intelligent refrigerators etc. Yes, they're cool stuff, but I wouldn't have new ideas or eagerness to deal with all that. Transfering to Physics Eng. is possible but it will probably require me to start over (something I wouldn't really dislike because of different things that prevented me from expressing my true potential) from the first year (as if I ""lost"" one) What could you tell me?",AskEngineers,suzepo,/r/AskEngineers/comments/866urm/have_i_chosen_the_wrong_eng_course/
33,I'm an Engineer to save some time let's assume I'm never wrong.,1521672489,,AskEngineers,[deleted],/r/AskEngineers/comments/866nlg/im_an_engineer_to_save_some_time_lets_assume_im/
34,Power transmission distribution reliability,1521672381,When there are issues with powerlines would there be any value in having additional data monitoring or video footage at the tower? I am curious installing small devices from remote locations would help utility companies.,AskEngineers,staceyco2019,/r/AskEngineers/comments/866n2f/power_transmission_distribution_reliability/
35,Is there a UK equivalent of The Order of the Engineer?,1521670802,,AskEngineers,xReyjinx,/r/AskEngineers/comments/866fj4/is_there_a_uk_equivalent_of_the_order_of_the/
36,"Example in this textbook is not making sense to me. (Reynold's Number, Prandtl Number)",1521670312,"Hello, I'm trying to understand why the two Reynold's numbers were assumed to be equivalent. It seems that the book says they are equivalent because the Prandtl numbers for both gases are the same, but the book seems to just gloss over it. [Here](https://imgur.com/a/UaLwR) is the example problem in question.",AskEngineers,OP_Wan,/r/AskEngineers/comments/866d9h/example_in_this_textbook_is_not_making_sense_to/
37,how would mechanical/chemical engineers go about testing or being able to tell relative durability of currently available disposable forks?,1521669201,"**problem:**

* many disposable fork seems to break easily even with pasta

**assumptions:**

* most disposable forks appear to be made out of plastic (please correct if this is inaccurate)

* likely almost all or all of them do not list or say what is the exact plastic material (please correct if this is inaccurate)

* the reason to not use metal forks  (assuming steel, all or most are) is to reduce the maintenance of the forks (aka: no cleaning cost over time)

**questions:**

* are there current current methods/ways for these types/kinds of testing?

* are there current current methods/ways for these types/kinds of valuing?

* are there current current methods/ways for these types/kinds of measuring?

* how would you go about being able to tell? or are we not able to in any simple or effective way?

",AskEngineers,nixos_learner,/r/AskEngineers/comments/866805/how_would_mechanicalchemical_engineers_go_about/
38,Why people mostly use cam shaped flame holders in DIY jet engines?,1521666842,"Hi, I recently have been reading a lot about jet engines and I see that a lot of people build they own, working constructions. Here is my question: why in homemade DIY jets they mostly use can shaped combustion chambers/flame holders and not a H-shaped, V-shaped or even this rearward facing step flame holders ?",AskEngineers,tomekb1999,/r/AskEngineers/comments/865wvh/why_people_mostly_use_cam_shaped_flame_holders_in/
39,"Mechanical design engineers, is an extreme attention to detail required.",1521664306,"I am in my first job out of school as a mechanical design engineer and was hired on a 1 year contract with the opportunity to stay on permanently afterwards, I have done design at my other jobs but this is my first product design position. All the other engineers here have a really extreme attention to detail relating to modeling and drawing practices that I can not keep up with very easily. That along with other reasons has caused me to not be offered a permanent position. Is this something that is required from design engineers in general? All of the design work I have done in the past I have had a close eye on detail but this place seems like it is on a different level. I want to make sure that design is a good fit for me at my next job and maintaining this level of scrutiny is very draining.",AskEngineers,QuentinTarinButthole,/r/AskEngineers/comments/865jsq/mechanical_design_engineers_is_an_extreme/
40,Thermodynamics relation of absorption to emissivity?,1521661186,"I was reading about the properties of selective surfaces used in solar thermal collectors, such as, nickle plated aluminum. These materials claim to have high absorption .90 for example and low emissivity like .10 

Isn't the rule absorption = emissivity and any energy not absorbed was reflected and/or transmitted?

If a material has an absorption of .90 and a emissivity of .10 where did the other .80 go?

Also reading I see mention of cool roofs made of metal that are both highly reflective and highly emissive. How can you have both?",AskEngineers,ly5ergic,/r/AskEngineers/comments/8653q7/thermodynamics_relation_of_absorption_to/
41,I need ideas for my GCSE DT project,1521656468,"I have to make something for my GCSE DT but have not came up with anything good, I want to do something fairly big, for example my friend is doing a working arcade machine. Do you have any ideas or any that you have done in the past suitable for this?",AskEngineers,LordBaconGod,/r/AskEngineers/comments/864f0h/i_need_ideas_for_my_gcse_dt_project/
42,"What has a greater density, a flaccid penis or an erect one?",1521651399,[removed],AskEngineers,Dex11405,/r/AskEngineers/comments/863p1l/what_has_a_greater_density_a_flaccid_penis_or_an/
43,Deciding between 2 universities (4 vs 5 year courses),1521650268,"I'm in Western Australia and trying to decide between Curtin University and the University of Western Australia (UWA) for mechanical engineering. 

The Curtin program is just 4 years of straight engineering with an honours component (major final year project). No broadening units and non-engineering electives.

UWA on the other hand is 5 years, with the first 3 being a BSc (Engineering Science) which leads into a Master of Professional Engineering in the final 2 years. As I understand it if you leave after the first 3 years (or don't achieve the 65% course average necessary to make it into the masters) you're basically stuck, because the 3 year program isn't accredited. You would have to transfer to another uni and would be placed in 2nd or 3rd year. The first 3 years also has a bunch of broadening units and electives (from any school). You can also double major with pretty much anything else, where at Curtin you can't.

From what I've heard, in the state the 2 courses are basically seen as equal by employers. However I would like to work overseas and UWA is better recognised both interstate (it's one of the Group of Eight unis) and overseas. In terms of international rankings, UWA is 93 and Curtin is somewhere in the 260's.

The actual content between the two is almost the same, just UWA is stretched out more to fit in some broadening units, but at the end you get a ""masters"" out of it. Is it worth spending an extra year doing the masters for what is essentially an image thing? ",AskEngineers,PANTSIR,/r/AskEngineers/comments/863j8h/deciding_between_2_universities_4_vs_5_year/
44,Got a PDF editor that you recommend?,1521648417,,AskEngineers,jury_rigged,/r/AskEngineers/comments/8639tr/got_a_pdf_editor_that_you_recommend/
45,Help with vacuum nozzle design for zerk fitting during powdered paint process,1521648361,"Hello everyone,  I would like to get some input on a new nozzle design for sucking the powder coated paint off of a zerk fitting tip.  Our current process uses a vacuum to suck the paint off of the tip of the zerk before it goes through the curing process.  It works about 90% of the time, but the other 10% leaves paint on top of the flat edge of the zerk.  I believe this issue can be resolved if we used a similar nozzle that has the capability of pressing the zerks plunger down, to provide better air flow along the zerk. I don't really know how to go about making a nozzle that can do that though, and would like to get some opinions on my idea, and then hear some of yours.  I have attached an imgur link below so you can view our current nozzle and the zerk it mates to. Looking forward to hearing from you guys.

https://imgur.com/gallery/nLufD
",AskEngineers,TrapDaddyReturns,/r/AskEngineers/comments/8639je/help_with_vacuum_nozzle_design_for_zerk_fitting/
46,Can old hardware be open sourced or reverse engineered?,1521643530,"After asking on /r/nostupidquestions, I was suggested to post here, so I'll repost what I wrote before!
So I've got old stuff like an OQO model 01, using Transmeta CPUs. I know they're basically useless, but I was curious since even the CPU company went under, would it be possible to make it truly open hardware? What would be the setback to it?

I would've asked about the second model running a VIA cpu, but since that company is still around I assume it'd be a lot harder or something, thanks!",AskEngineers,Nebucadnzerard,/r/AskEngineers/comments/862mib/can_old_hardware_be_open_sourced_or_reverse/
47,UnansweredCan old hardware be open sourced or reverse engineered?,1521642928,[deleted],AskEngineers,[deleted],/r/AskEngineers/comments/862jlz/unansweredcan_old_hardware_be_open_sourced_or/
48,Resources to learn the basics of material deformation?,1521641680,"I'm a graduate student in physics and I've been tasked with designing a part of an experiment. I need to characterize the deformation of a material under a given load. Essentially, if I hang a mass from the center of a rod of a given material, length and cross sectional area, how much will it bend?

I know things like Young's modulus, stress, strain etc are all quantities I might need to understand.

I haven't seen any of these ideas explained in my studies, I assume they fall more under the engineering umbrella as opposed to the general physics realm. Either way, I need to understand them so I was looking for resources.

Are these concepts generally explained in a mechanical engineering context? Materials science? Does anyone have any recommendations for sources where I could learn the basics of material deformation?

Thanks!",AskEngineers,ianmgull,/r/AskEngineers/comments/862dqh/resources_to_learn_the_basics_of_material/
49,What is the advantage of having larger diameter wheels on a push bike?,1521640850,"I saw a post about the latest dampers on a bike. Th article listed various parameters, including a maximum of wheel size of 29 inches. Why would you want 29 inches, instead of (say) 26 inches? What is the benefit?",AskEngineers,ShitInMyCunt-2dollar,/r/AskEngineers/comments/8629xg/what_is_the_advantage_of_having_larger_diameter/
50,Free Webinar: How to Test Air Conditioning Designs with Cloud-Based CFD,1521638249,[removed],AskEngineers,SimScale_GmbH,/r/AskEngineers/comments/861zjo/free_webinar_how_to_test_air_conditioning_designs/
51,I'm looking for a computer engineers to answer some questions.,1521637752,"Hi!

I'm Chris and I'm majoring computer engineering at the university of Linköping in Sweden. 
I'm interested in knowing about how work can look like and what your plans of the future can be. If you would please take a minute and answer these questions, it would mean a lot to me.

You don't have to answer everything, I'm grateful for whatever I can get.
Please list age, role, gender and company (remember, if you want to).

1. What do you do on a normal work day?

2. What skills/competences do you have most use for?

3. What challenges do you face in your work day?

4. What do you do to keep developing yourself?

5. How come you work with what you do today?

6. Where do you see yourself in three years?

7. If you had the chance to redo the last 5 years, would you have done anything differently and why?

8. What do you think I should have in mind in my studies and why?

9. What do you think I should do more now when I'm studying and why?

You can also PM me if you don't want to publicly display it.

Thanks a lot if you decided to take your time and answer my questions. :)",AskEngineers,Chris_At_LiU,/r/AskEngineers/comments/861xm7/im_looking_for_a_computer_engineers_to_answer/
52,Career Wednesday (21 March 2018): Engineering Career Paths &amp; Professional Development,1521633956,"[[Previously]](https://www.reddit.com/r/AskEngineers/search?q=career+wednesdays&amp;restrict_sr=on&amp;sort=new&amp;t=all)

Welcome to our weekly career questions thread! This is the place to ask for advice on engineering careers, including normally restricted topics such as job applications, résumé/CV and cover letter critiques, and undergraduate major selection. If you need to interview an engineer, refer to the list of engineers willing to be interviewed in the sidebar under **Resources** and follow the instructions inside.

We also recommend posting your questions in /r/engineering's latest [**Advice Mega-Thread**](https://www.reddit.com/r/engineering/search?q=ADVICE+Mega-Thread&amp;sort=new&amp;restrict_sr=on&amp;t=all) to get the most exposure.

###Guidelines

* **This thread is for career questions only.** If you have a technical question, make a new post with your question as the title, and be sure to follow our [submission guidelines](https://www.reddit.com/r/AskEngineers/wiki/rules#wiki_questions).

* Remember to follow the [Discussion Guidelines](/r/AskEngineers/wiki/rules#wiki_civility) in the sidebar — negative attitudes and comments will not be tolerated.
",AskEngineers,AutoModerator,/r/AskEngineers/comments/861j91/career_wednesday_21_march_2018_engineering_career/
53,Mechanical vs. Software Engineering,1521620958,"Hello, 
I am an American high school senior, and I was fortunate enough to be admitted into several great university programs for both mechanical engineering and computer science. I am interested in both majors, but I am extremely unsure about what path I want to take.
On one hand, the immediate job/wage prospects for software engineering seem to be extremely good right now. In addition, software seems to have the most unanimous relevance in the modern tech world, meaning that there are many possible career paths for software. And in my school, CS is known to be for the ""cool kids who are going to get the big bucks"". The question is, how long will the tendency for software engineers to make extremely high wages last? I understand that software engineers will probably be needed for a very long time, but will the career stay as ""in vogue"" and high paid as it is now in say, the next one to three decades? 
On the other hand, I've heard that mechanical engineering can be a more stable major to pursue; it won't be affected as much by the fluctuations of industry trend. In addition, I am very interested in physical engineering, engineering that exists physically rather than just in abstract code. But at the same time, I've heard from some that ME is the ""mental ditch digging"" of engineering, and that many ME's end up working on very menial, repetitive projects, and that it is near impossible to get a higher level job without some sort of graduate degree. 

Above all, (perhaps this thinking is naïve) I would like to do something ""meaningful"" with my degree, more than just money/job security, whether that means working with the latest technology or building something that can have an impact on the world.

Please, if you can answer, any answer would help a lot. I feel this will be a very pivotal decision for me, and I need many different perspectives. And feel free to correct me on any assumptions I may have gotten wrong.

Thank you,
a perplexed senior",AskEngineers,ckeng777,/r/AskEngineers/comments/860ifi/mechanical_vs_software_engineering/
54,Interview questions for entry-level CAD job?,1521612987,"Have an upcoming interview with a company where I'd be doing mostly CAD work in the oil&amp;gas industry. It's my first co-op job so I doubt the interview would be super technical, but is it common practice to ask industry relevant CAD questions during an interview?",AskEngineers,ChristmasKrunk,/r/AskEngineers/comments/85zy0f/interview_questions_for_entrylevel_cad_job/
55,Why do most heat transfer equations use a constant Heat Transfer Coefficient?,1521609478,"Doesn't heat transfer coefficient vary with temperature? Also, thermal conductivity varies with temperature as well? Therefore, when calculating the heat duty, using the heat transfer coefficient at a particular temperature is incomplete.

Correct?",AskEngineers,cheme1,/r/AskEngineers/comments/85zoa1/why_do_most_heat_transfer_equations_use_a/
56,Have you used your engineering background to earn side income from your 9-5 job?,1521597192,,AskEngineers,raybrignsx,/r/AskEngineers/comments/85yhmt/have_you_used_your_engineering_background_to_earn/
