index,title,created_utc,selftext,subreddit,media_only,author,permalink
0,How Electrical Signal/Memory Works?,1587318077,"So I was wondering with computers or any electronic device in general, how electric signals carry information that can be interpreted and utilized to perform certain actions? So perhaps this conversation has to address some fundamentals, say electricity. For a simple example, say a handheld calculator. How does me pressing the 6 button allow for that to show up as a ""6"" on the screen? Is it a certain electric current from the battery that is ran so that only the ""6"" button can align the magnetic elements in the screen to result in displaying a ""6""? If so, how in the world did they program it like that back when they first made calculators without all of our fancy computers and such today? Say you only had raw materials, battery, some metal wires, etc. In essence, how did they build that calculator and then have it compute equations using raw ""unprocessed"" electricity? If handheld calculators was the simple example, for a harder example, I was wondering about computer memory. How in the world do computers or usb drives ""save"" information that can be manipulated, deleted, changed etc. without an electric current constantly running through the device? Like how does information get ""carried"" across those usb wires to get be ""stored"" in a chip and retained to then be unplugged from a power source to then be plugged in again and then still retain all that information to be able to be accessed and manipulated? I'm just trying to understand how the electrical signals can actually communicate with each other.",AskEngineers,False,Greenleafs91,/r/AskEngineers/comments/g4btm1/how_electrical_signalmemory_works/
1,"When buying a stepper motor controller for a stepper motor, how much higher should the voltage and amp rating of the controller be to the motor?",1587317113,,AskEngineers,False,billybobjoe179,/r/AskEngineers/comments/g4bjeg/when_buying_a_stepper_motor_controller_for_a/
2,Chemical Engineering Student Feeling Lost,1587317106,"I'm a chemical engineering student who is completely lost on how I could get to my end goal. I did not know how tough the job market would be for us ChemE's before starting my education, it seems like the recession compounded with low oil prices has seemed to make hiring much more competitive. Add this to the fact that I have no desire to work in a plant far away from anything, and I am feeling really dumb for picking this major. I don't find the coursework bad as I like solving problems, but these problems don't have to be related to my ChemE coursework. I can find most engineering problems interesting. However, transferring between engineering majors at my college is almost impossible due to a large number of students already in these programs. On top of that, my family doesn't have the financial resources for me to pursue further education, I would have to work for a little to pay back my undergraduate degree. As a result, I feel lost. I don't know if I should just bite the bullet and pay my dues for a few years working in an environment I know I will hate, or if I should just transfer out to a local university and try and complete something else.

Sorry if my thoughts aren't coherent or are just outright wrong, this is an issue that's been keeping me up late sometimes. I haven't been able to think or study clearly recently due to my general uneasiness about what I'm doing.

I guess I'm just asking for general advice from established folk on how I should play my cards. Feel free to not sugarcoat it and be frank as that might be what I need right now. Thank you in advance.",AskEngineers,False,throwaway199324,/r/AskEngineers/comments/g4bjbf/chemical_engineering_student_feeling_lost/
3,"Instead of building the James Webb Telescope to unfold (which seems to have increased the complexity), couldn't they have build a larger space-ship to carry it to orbit?",1587316739,"It seems like all the components to protect the James Webb Telescope from the sun have to still be deployed, but (from what I understand) the biggest problems is the fact that it is composed of 18 hexagonal segments, which all have to have nanometer precision, and also be able to line up absolutely correctly so that the images it captures are clear. If it's off by the smallest amount then the images will be worthless.

This is obviously a huge engineering challenge, so why didn't they (instead) build a larger bay on a shuttle to bring it into orbit so that it doesn't have to be all folded up? Then it could've been one large mirror instead of 18 smaller ones without all the added complexity.

I figure for $8 Billion this would have been much easier to accomplish than it would've been to engineer a large unfolding telescope like this one.

It's too late now, but knowing this, do you think the next time they design one they'll do that instead?",AskEngineers,False,AlmostWardCunningham,/r/AskEngineers/comments/g4bfh6/instead_of_building_the_james_webb_telescope_to/
4,Can you tell me which country to move to? Do you have any details that google can’t tell me?,1587314900,"Has anyone been able to find jobs abroad in engineering? How difficult was it? Any unique challenges?

Background: I am an electrical engineer in the power industry in the US. I have some control systems experience as well. I picked engineering and my specialty solely to be able to have the flexibility to move wherever I felt like moving, still be able to maintain a decent quality of life, and still be able to save money with a family(pipe dream?). I’ve been to several countries in Europe, South/Central America, and Canada, so I’m generally familiar with international traveling and have always wanted to move abroad for a time. Learning a different language isn’t a deterrent either. I know a little French (2 years HS and 2 years in college) and am trying to learn Spanish currently.

Also, what are the most realistic countries to be able to do this in? I’m thinking Europe, South America, Australia, and some parts of Asia would be ideal but I’m open to other suggestions.",AskEngineers,False,bkobkabob1,/r/AskEngineers/comments/g4avdn/can_you_tell_me_which_country_to_move_to_do_you/
5,International Engineering Jobs,1587314541,[removed],AskEngineers,False,bkobkabob1,/r/AskEngineers/comments/g4arn9/international_engineering_jobs/
6,Help me secure a lens within a casing,1587313768,"Hi everyone, I'm looking for a way of securing a 6 mm diameter lens that is 1.5 mm thick into a 3mm thick aluminum casing, while also making it watertight, any ideas? Do you know of any engineering book where such a case is described?",AskEngineers,False,vl0ost,/r/AskEngineers/comments/g4ajmo/help_me_secure_a_lens_within_a_casing/
7,Mechanical PE Question: HVAC or TFS exam for unique situation,1587307445," 

Hello! I am in a pickle on a big decision here.

I have a BS in Mechanical Engineering, graduated about five years ago now. For my work I need a PE license. Trouble is I don't work in Mechanical Engineering at all, and haven't since graduation (I work in a very niche field in energy). My question here is, which exam is the easiest to prepare for and pass?

Also, in case I get laid off soon from my energy position (strong possibility since it is in Oil &amp; Gas) which PE focus would be more in demand for looking for a new job/career. I am not familiar with either field. I guess heat and air is always going to be in demand to some degree, I'm not sure what a TFS focused Professional Engineer would even be stamping. So I do want to take in to account the usefulness of studying for one of these exams as it relates to potential career changes and demand.",AskEngineers,False,clouds333,/r/AskEngineers/comments/g48sk9/mechanical_pe_question_hvac_or_tfs_exam_for/
8,Chipkit vs Arduino,1587305388,"Based on a thread about learning the roots of comp sci/EE, I noticed EE students suggesting the Chipkit boards- are they substantially similar to modern Arduino boards (post-Leonardo), or is there a hardware/programming reason to use Chipkits preferentially?

Thank for guidance Reddit Engineers!",AskEngineers,False,argybargy2019,/r/AskEngineers/comments/g489em/chipkit_vs_arduino/
9,"How factories work ""Book Recommendation""?",1587304422,"&amp;#x200B;

I'm majoring in structural engineering. But i applied for an internship in a plastic products manufacturing company. I suddenly have the urge to know more about factories and production engineering. Can anyone recommend any introductory book that could help me out?",AskEngineers,False,Blitzzkrieger,/r/AskEngineers/comments/g480ai/how_factories_work_book_recommendation/
10,How do computers actually work?,1587302352,"I want the specific details. I understand the basics of it but how does it recognize my input and then convert to machine code and do what I want? Sorry if I’m not being specific enough. 

Is there a video or anything that describes in detail?",AskEngineers,False,Moss_Piglet_,/r/AskEngineers/comments/g47j9n/how_do_computers_actually_work/
11,3D Software for Compliant Mechanisms,1587297432," Trying to find the right subreddit to ask this, hopefully this is the one.

I am working on designing a product using compliant mechanisms ([Explained here by Veritasium](https://www.youtube.com/watch?v=97t7Xj_iBv0)),  and would like to test my designs in 3D before starting to manufacture,  does anyone know of an engine capable of simulating  stresses/elasticity/strength of such models? I have come across [Disney's](https://www.solidsmack.com/fabrication/disney-compliant-mechanism-system/) tool that converts hinges to compliant mechanisms but it is out on the market.

Thanks for the help",AskEngineers,False,ImScoob,/r/AskEngineers/comments/g46i0v/3d_software_for_compliant_mechanisms/
12,Seeking Structural Analysis Report Guidance,1587294611,"Student here looking for some extra direction. For our mid-term in statics with the COVID-19 situation our class was tasked with group projects instead of a traditional exam. In short, were were given a complicated \[for us\] frame problem that involves quite a few frame members and distributed loads within the framework. No two force members, all frames are multi-force members with internal hinges connecting one another. One end of the framework is a fixed support while the other end is a hinge.

Anyway, we finished the analysis last night, balanced out all forces and the moment about the fixed support. Now I wanted to have some fun with the project and instead of just handing in a mess of scratch work with calculations and free body diagrams. I would like to put all this into a report that would mimic that of how a firm would expect a structural analysis of this nature.

Looking for any resources/references to take a peek at online that would give me some extra direction on structuring our results into an engineering report.

Of course as one would imagine, I had the common sense to google things like ""engineering analysis report"" which yielded photos and some articles on reports. However, there seems to be a very wide range of ways to do this, so I wanted to also take into considerations the feedback from the community on here.

Thanks in advance.",AskEngineers,False,CM_1986,/r/AskEngineers/comments/g45z3f/seeking_structural_analysis_report_guidance/
13,Structural Analysis Report,1587294542,[removed],AskEngineers,False,CM_1986,/r/AskEngineers/comments/g45ymb/structural_analysis_report/
14,Where to start? Trying to design/build a user interface to control pump solenoid valves.,1587290486,"Hi all!  I have very little experience with this type of work so I'm looking for direction.  I need a basic user interface to control turning on and off a basic pump system.  As basic as clicking an 'ON' and 'OFF' button on a computer.  Are there any fast track programs with hardware or should I jump back into Raspberry Pi and Arduino?  I will be creating a small demo at first, and then eventually scaling it up.  If this is the wrong sub, sorry.  Any help is appreciated.  Thanks.",AskEngineers,False,-DeliriousFX-,/r/AskEngineers/comments/g458fa/where_to_start_trying_to_designbuild_a_user/
15,"Looking for some guidance with this project involving data science and machine learning basics I suppose, but I don't have any background in these fields. Aim is to train an ML program from the data collected from surveys. Suggested method is given in the project details I've attached. Please help.",1587287914,Attaching the link to the project details here : https://imgur.com/a/wXtPb0Y,AskEngineers,False,zustdng,/r/AskEngineers/comments/g44rc8/looking_for_some_guidance_with_this_project/
16,Mechanical Engineering Student interested in 3D printing PPE,1587287583,"I’m a graduating senior and have very little knowledge about 3D printers. I saw that many companies, universities, and other groups are 3D printing PPE to help alleviate the shortage and would like to do my part to help as well. 

Are there specific types of 3D printers that would be the most appropriate to make these items? Should I be looking at any certain types of printers to purchase? 

Although there are many CAD files available online to download, as a student with very little 3D printing experience, how difficult is task? —is this something I can realistically execute? 

Any advise or guidance is appreciated. I just really want to help somehow!!",AskEngineers,False,ari9ishere,/r/AskEngineers/comments/g44p4d/mechanical_engineering_student_interested_in_3d/
17,"Table design that when spun, a different base comes up while the top opens to then close and have the base that was brought up be the new top?",1587275058,"I understand that my title was super confusing, I am not asking about a Fletcher Capstan table. I am designing a board game table and I want the top to be a regular end table, then when I spin the sides the top opens up and the board game (chess) to come up and the sides to close in so that now chess is the base. I was just wondering if there is any sort of design that already exists that matches that sort of description. If you have questions about my description please ask so I can hopefully make it more easily-understandable., I’m just hoping something exists already so I do not have to design it myself. I have little experience in mechanical design.",AskEngineers,False,Drewdster,/r/AskEngineers/comments/g42gb6/table_design_that_when_spun_a_different_base/
18,What is the difference between the two transformer types bellow?,1587270202,"I am especially challenged by the idea of a single phase transformer being connected in 3 phases

1)  Pole mounted transformers that are single phase connected in three-phase with KVAs of 100KVA, 300KVA, and 500KVA 

2)  pad mount transformers that are one unit with 3 coils for the three-phase systems that are rated at 500KVA, 1000KVA, 15000 KVA, 10MVA, 12MVA, 14MVA, and 20 MVA.",AskEngineers,False,CapacitorBank1,/r/AskEngineers/comments/g41h01/what_is_the_difference_between_the_two/
19,Find the Gauge pressure inside the tank,1587268437,"A raw water tank (RW) with 7-m diameter is utilized by a certain plant illustrated below. The RW tank has a supply pipe line dimension of 12” diameter. Two distribution lines are used as an outlet gates; one for direct Utility Water (UW) and one for Water Treatment Processing (WTP). Each distribution line is divided into two “Y” Junctions orientation for other different sections; also check valves are installed in ever line to permit the flow of water .

**Figure.** [https://imgur.com/cuuTy1K](https://imgur.com/cuuTy1K)

I'll place three of the questions that could help answer. This is by the way a question made by our professor himself and according to him barely anyone got the answers to this question. This question has also around 13 questions and I'm just providing three here.

**Questions.**

1. Find the Gauge pressure inside the tank, and also
2. The corresponding absolute pressure; assume that water level initially is at a column height of 32.815 feet.
3. Find the pressure difference inside the tank in absolute if the supply line adds 150 cubic meter of water.

**My personal Attempts:**

1. I know the Gauge Pressure formula for being ***Pg=mg/A***. I do also know it can be derived to ***Pg= density x gravity x height.*** Now this is my attempt answering Pressure gauge. Given that Liquid Density is water is *997kg/ m**^(3)*. Gravity is *9.81 m/ s**^(2)*. And height of the liquid in the tank is 32.815ft converted to 10.002m.     **Pg =** ***997 kg/m******^(3)*** ***x 9.81 m/s******^(2)*** ***x 10.002 m = 97825.26 Pa or 97.825 KPa***
2. My attempt on absolute pressure. **Pt = Pg + Patm** (atmospheric pressure). **Pt = 97.825 KPa +  101.3 KPa** (earth atmospheric pressure) **= 199.125 KPa.** I'm not entirely sure here because I used earth atmospheric pressure than the air left above the tank. I'm sure I'm not right but an explanation as to why I'm not would help me greatly.
3. I haven't tried to answer this, just want to make sure that this question states it added in **150 cubic meter** of water into the tank that is already filled with 10.002m of water. Converting 150m^(3) to meters it is 5.3133m, so the tank is now 15.3153 m filled. But isn't that .3153 extra from the figure? Tell me what I did wrong.

I know posting a question without attempts to answer is a butthole move so I tried and hopes anyone can explain to me what I did wrong or missed. Thank you! Keep safe out there.",AskEngineers,False,MatchaTealicious,/r/AskEngineers/comments/g4139h/find_the_gauge_pressure_inside_the_tank/
20,Should I major in chemical or civil engineering?,1587264503,"This fall, I'm hopefully starting college as a chemE major but I'm not sure if I want to switch to civil. I want to work in either biofuels, water management, or the environmental sector. What would be the best engineering field to major in? 

Also, I want to work in the Pacific Northwest or California, but I'm also okay with staying where I am now in Texas. How is the job market for civil or chemical engineers in these places?",AskEngineers,False,inoreen_chan,/r/AskEngineers/comments/g4084i/should_i_major_in_chemical_or_civil_engineering/
21,Self-taught programmer looking to deepen knowledge of computers. Where to begin?,1587263282,"I come from a medical background but last year I began working as a software engineer after teaching myself how to program for 6 months. 

My wheelhouse is web, and I'm pretty proficient in Python, Ruby, Javascript, and Go; but being from a non-academic background, I realize that there are a lot of gaps in my knowledge—particularly when it comes to how a computer actually works. 

I want to deepen my understanding of how the software relates to the hardware in order to demistify how my code is actually manipulating the machine. 

On the topic of RAM, CPU, machine code, computer architecture, what a bit actually is, and how electrostatics is involved in all this —my knowledge is nearly barren. These are things I want learn about.

I have a pretty decent background in maths and electromagnetism and wouldn't be opposed to material that is pretty physics and math focused, but I'd prefer a higher level perspective.",AskEngineers,False,solidiquis1,/r/AskEngineers/comments/g3zy6q/selftaught_programmer_looking_to_deepen_knowledge/
22,Career Change to MEP Engineering,1587263132,"I'm 14 years deep in a mechanical design engineering career in the medical device industry.  So, heavy SolidWorks useage, drawing detailing, GD&amp;T, manufacturing process development, prototyping, manufacturing equipment design, that sort of thing.  I'm in a very rural area in the US which I do like and am looking at moving in with my long-distance significant other in a similarly rural area.  In addition, I'm pretty burned out at my current job (have been with the same employer for the bulk of my career).  


Looking for job opportunities in the geographic area, the pickings are slim.  There are plentiful mechanical engineering jobs for HVAC however.  I last took thermodynamics and heat transfer back in 2005 in college, never a formal HVAC course.  I have a bachelor's in mechanical, a masters in industrial.  I have my FE but in my current industry nobody bothers with PE's so I only know one and don't have a PE myself.  Realistically, I don't have a prayer for any of these companies even taking a 2nd glance at me, do I?  I've never used revvit, have only some experience in ACAD, and obviously zero experience with HVAC or architecture applications.  Is it a pretty ""plug &amp; chug"" field as some suggested to me?  


Just out of curiosity, what would it take to make the switch to this field?  Obviously people can get entire bachelor's degrees in HVAC; I can't see myself doing a 2nd BS at age 37.  Is this a stable field, is it mind-numbing, is it always in demand?  (There always seem to be postings for these positions everywhere).  I've got to think my ME degree has to count for something, or am I essentially back at intern level and needing to pursue a major courseload to even be viable?",AskEngineers,False,uofdoboe,/r/AskEngineers/comments/g3zwzm/career_change_to_mep_engineering/
23,How do I climb the Defense Industry Ladder?,1587262874,"Howdy!  I'm a EE Junior interested in building a career in the Defense Industry. Assuming I've already gained a clearance and internship with the government, how should I go about getting better jobs in terms of interesting projects and pay. Would you recommend working for contractors or government organizations?

Thank you!",AskEngineers,False,Dr_Prof_Good,/r/AskEngineers/comments/g3zutj/how_do_i_climb_the_defense_industry_ladder/
24,Should I switch my university to electrical/computer engineering after 3 years?,1587262762,"Hi, I am asking this question for 3 times. I'm still undecided. I am overthinking on this problem and that makes me depressed and undecided. I'm 21 yo and about to finish 3rd year in med school (it is 6-year program after highschool without a preparation year. Engineering degrees are 5 years program with a preparation year.). But I started to hate it and I have very unpopular opinios about medicine. Now want to switch to electrical engineering. I always was good at math/physics and I would like to work in robotics or defence industry. Yet I'm still unsure, I have a few concerns and this major change is making me very stressful. 

I am not sure if it is worth it. I have too few decision that I didn't regret afterwards. I am sure I hate medicine but I have already lost 3 years here and staying here to complete degree is much more easier than switching to engineering. I don't need to do anything extra to find job as a doctor, I just have to pass classes. But if I switch, I have to study hard for 5 years and due to my goals, probably I will need more education like ms or phd. I want to be good at what I do, so I must work hard but it is too risky since I have already lost 3 years for nothing. (I don't find medical field worth to be good at). I am considering this as a huge disadvantage because my goals may be too high and this field is too competitive. 

Also I don't want my parents to pay my bills when I am 30. 

Actually, all problem is lost of 3 years and I lost self-confidence. But if I could get back in time to 3 years ago, I would go for engineering.

Forgive me if I made any grammer mistakes, this writing probably doesn't sound natural. I am not good at english, this is why I need a preparation year. I hope you can understand. Thanks in advance.",AskEngineers,False,8jan,/r/AskEngineers/comments/g3ztwn/should_i_switch_my_university_to/
25,"Aside from Python, what is the most valuable coding language to know?",1587258095,"Every time I try and research it the internet gives super general answers that basically include everything. I'm a Junior at university right now and I can pick an elective this semester and I wanted to do coding. I already know Matlab since it was required. Aside from python, since I can't seem to find a class that teaches it at my university, what is the most valuable language to have experience with in the field of engineering?",AskEngineers,False,DraconTiger,/r/AskEngineers/comments/g3yqx7/aside_from_python_what_is_the_most_valuable/
26,College and career questions from an incoming college freshman,1587255730,"I'm a current high school senior that's looking to study engineering in college. I'm currently deciding between UT Austin and the University of Toronto for chemical engineering and probably a minor in business or public policy or something along those lines. I'm looking to go into the green tech/renewables industry after graduating. 

What school would be better for my career aspirations? I know that most opportunities for chemical engineers coming out of UT are in o&amp;g companies in Houston. However, I'm not sure how well known the University of Toronto is to employers in the US. Would going to UT still benefit me here or is there not much of a difference? Also, could anyone in the renewables industry speak to what it might look like in the next couple of years?",AskEngineers,False,slamosaurus,/r/AskEngineers/comments/g3y664/college_and_career_questions_from_an_incoming/
27,Master degree options for Mechanical Engineering Technologist,1587253406,I recently (2018) graduated with a bachelor's in Mechanical Engineering Technology and would like to get a master's in material sciences. Unfortunately I don't think I have the appropriate background to continue with that dream. Are there any other master degree programs that you would recommend for someone who would like to stay in the engineering field?,AskEngineers,False,eatingsoupwithaknife,/r/AskEngineers/comments/g3xl7q/master_degree_options_for_mechanical_engineering/
