index,title,created_utc,selftext,subreddit,author,permalink
67,How tall shout be a residential tower to have economical opening windows?,1522329847,"Hi all, I'm reading about residential towers and the many concerns about them. One thing that I've read is that it's expensive to build tall ones and allow them to have opening windows. Is it true? How tall should be a tower to have economical windows? Is it a proper response to increase residential density?

On the side: Do you think increasing residential density will allow to fix the gentrification problem in european cities? 

Is there any examples of residential tower developments that are cheap and good looking?",AskEngineers,iagovar,/r/AskEngineers/comments/88180b/how_tall_shout_be_a_residential_tower_to_have/
68,Engineer &amp; Nurse,1522315118,[removed],AskEngineers,epicninja115,/r/AskEngineers/comments/87zv5i/engineer_nurse/
69,How to prepare for Plant Design &amp; Piping Engineer Job?,1522305838,"I am about to graduate and was given an offer for a title of Plant Design &amp; Piping Engineer. I have a good idea for the job description such as site/building arrangements, generate calculations and drawings for pipes and supports, work in 3D model to develop designs for piping etc... How can i best prepare for this job? I want to immediately impress and excel at this job if i do accept. 
In the future, if i desire a career change, what kind of potential jobs can this experience open up for me? Are there any PD&amp;P engineers out there that can tell me a day in the life? Daily tasks?
",AskEngineers,bobbyjeann,/r/AskEngineers/comments/87z60q/how_to_prepare_for_plant_design_piping_engineer/
70,How are crew capsule abort procedures triggered during a launch explosion?,1522305034,"How are crew capsule abort procedures triggered during a launch explosion?

Awhile back, the last time SpaceX lost a rocket during launch they claimed that the crew abort procedure would have safely jettisoned the capsule before harming hypothetical astronauts in a crewed scenario. Obviously a human monitoring the launch would not have been able to react quickly and reliably enough to trigger that sequence, so I am wondering what types of sensor data triggers the abort procedure and how they would avoid an expensive false positive?

I’m interested as a software engineer but I have no tangible experience with hardware and robotics outside of turning a servo on a raspberry pi. I imagine you would have a process running externally to the standard launch sequence/navigation processes that is monitoring data from heat, sound or perhaps air pressure sensors that could detect various effects of an explosion but I lack any real knowledge in this field so I can only speculate. 

I’ve only been able to find info about how the rockets and landing procedures work after the abort is triggered. I can see how abort could be triggered if telemetry veered too far off course, but I’m interested in the event of a sudden explosion like the SpaceX rocket. The main propulsion method itself is a controlled explosion so detecting an uncontrolled explosion reliably without false positives seems very challenging.

https://www.floridatoday.com/story/tech/science/space/spacex/2016/09/02/spacex-blast-reminder-crew-risks/89787470/",AskEngineers,b_rad_c,/r/AskEngineers/comments/87z3m7/how_are_crew_capsule_abort_procedures_triggered/
71,Help with problem 2.26?,1522298865,"The book says a safety factor of 1.31. In order for that the equivalent stress needs to be about  6106.87 psi. Can anyone help/see what im doing wrong?

Problem:
http://imgur.com/lOu6ieZ

Attempt:
http://imgur.com/Qkbldpl


I chose that point because it seemed like it would be easiest to write the stress tensor. Sigma T is pressure matrix due to torque. Also final sigma E is in psi.",AskEngineers,FappyMcPappy,/r/AskEngineers/comments/87yl5w/help_with_problem_226/
72,What’s your opinion on technician job as first engineering experience?,1522298429,"I know some people have a tough time including myself finding an internship, some companies have tech jobs that don’t require too much experience? What do you think , are these good for gaining engineering experience and then move up through the company?",AskEngineers,EngineerEnthusiast,/r/AskEngineers/comments/87yjnh/whats_your_opinion_on_technician_job_as_first/
73,I'm looking for a computer engineer to answer these 5 simple questions.,1522298047,[deleted],AskEngineers,[deleted],/r/AskEngineers/comments/87yig7/im_looking_for_a_computer_engineer_to_answer/
74,Suitable methods for quickly drying box of gravel?,1522294370,Hello. I'm trying to build an apparatus but have encountered a problem I have no clue how to solve. I will have a box filled with a mixture of gravel and water. Can anyone think of any methods to quickly extract the water from the mixture and collect it? I was thinking about some sort of suction or pressure but I don't know how that would work. Thanks,AskEngineers,Hserrpid,/r/AskEngineers/comments/87y63y/suitable_methods_for_quickly_drying_box_of_gravel/
75,What type of engineers travel the most?,1522293730,,AskEngineers,procrastinatingpeter,/r/AskEngineers/comments/87y3qy/what_type_of_engineers_travel_the_most/
76,"Anybody ever thought of submerging a quantum pc in a pressurized nonconductive liquid to assist cooling? pros, cons.",1522292444,"The question is in the title. I was thinking about building a mineral oil PC, just for the cool liquid effect. i have been doing a little research in quantum computers (chips, etc),because the ideas behind the technology really interests me. and was wondering what the benefits would be of submerging one of these in a liquid with a lower freezing point and then keeping it cool with that method. I'm no expert in computers quantum or otherwise, I'm just really curious about the application of the combination of ideas.",AskEngineers,leroidelamort,/r/AskEngineers/comments/87xz5e/anybody_ever_thought_of_submerging_a_quantum_pc/
77,Would any Aerospace/Mechanical Engineers mind answering a few questions for a 3rd year ME student?,1522292293,"Hey everyone! I'm about to register for my final year where I get to take 2 electives per semester. I am still figuring out exactly which niche I want to pursue in the Aerospace Industry, so I could use some help from any Aerospace Engineers or Mechanical Engineers currently in industry and willing to spare a few minutes to answer some of my basic questions.

1. What team are you part of where you work and what is your official title?

2. What is a typical day like for you in the industry and what types of tools/programs do you implement to succeed?

3. What did you wish you knew before coming into the field or getting your first job in the aerospace industry?

4. How is the workload and stress level?

5. What some of the typical tasks you are asked to perform and how much freedom do you have to solve a problem?

6. Do you enjoy the industry? What do you like most about it? Do you find the work rewarding?

7. Do you see growth in the industry? Would you recommend it to a fresh graduate?

8. How much do you feel you learned on the job versus what you knew from school? Did you have a mentor?

Thank you in advance for your time! I am hoping your feedback will help me decide what types of teams I want to pursue in the industry which will also help me tailor my senior electives to those respective teams.",AskEngineers,sweat-e-sac,/r/AskEngineers/comments/87xyll/would_any_aerospacemechanical_engineers_mind/
78,Stress tensor for closed thin walled cylindrical pressure vessel?,1522292045,"So i guess im asking what are the stresses in xx,xy,xz, yy, yz, and zz directions on the outer surface? Any help would be greatly appreciated.",AskEngineers,FappyMcPappy,/r/AskEngineers/comments/87xxqv/stress_tensor_for_closed_thin_walled_cylindrical/
79,Is there a technical outcome difference between hydrostatic pressure testing and helium pressure testing?,1522290255,"This is related to a high purity soldered copper pipe assembly. We are testing the assembly for 225 psig using helium because we do not have the capacity to do a hydrostatic test. The primary concern is testing for deformation (as well as leak, but obviously helium leak testing will be more pronounced).",AskEngineers,jarrettal,/r/AskEngineers/comments/87xr4h/is_there_a_technical_outcome_difference_between/
80,Help finding the stress tensor/matrix?,1522287221,[deleted],AskEngineers,[deleted],/r/AskEngineers/comments/87xfkb/help_finding_the_stress_tensormatrix/
81,What makes a fluid optimal to be used in hydraulics?,1522286544,I know that theoretically you can use any fluid for hydraulics but what makes a hydraulic fluid so specific to its function? ,AskEngineers,chaloobin,/r/AskEngineers/comments/87xczf/what_makes_a_fluid_optimal_to_be_used_in/
82,"Should I even list my associate's degree on my resume anymore, now that I have my BSME?",1522281310,[removed],AskEngineers,cqez,/r/AskEngineers/comments/87wsbd/should_i_even_list_my_associates_degree_on_my/
83,I am about to finish my foundation year and will progress onto chemical engineering MEng. Is it worth doing a masters in ChemE or should I just opt for the Bachelors?,1522280219,"So I will be doing chemical engineering at a highly reputable uni in the UK next academic year but was wondering whether I should do the MEng or BEng? Just want to also make sure that chemical engineering has good job prospects (as far as I know it does but just want to make sure I've done my research properly since I'm coming across pages like these, https://www.reddit.com/r/ChemicalEngineering/comments/71nlnz/i_recently_graduated_and_i_cannot_find_a_job_in/ ). Thanks for the help.

Edit: Due to my lack of revision in high school, are my poor A Level grades of ABC in Chemistry, Maths and Biology respectively going to affect my job applications in the future?",AskEngineers,asudfhbadgb,/r/AskEngineers/comments/87wns6/i_am_about_to_finish_my_foundation_year_and_will/
84,"I need to make a small piece of paper move when a motion sensor detects movement, powered by renewable energy. Can someone please help?",1522278628,"Hello everyone! I need to design a bus stop shelter model that's self-sustained using renewable energy for lighting, cooling and opening and closing automatic doors. If there is no one inside the bus stop shelter, the system light should be switched off. Fans should work automatically when temperature reaches certain degrees and be off below certain temperatures.

I need to make a small model of this, not an actual sized bus stop shelter. Let's say to fit a 50 cm by 50 cm model.

My questions are the following: 1- All power must be from renewable energy. The lights, the moving of the door, and the fans opening when it hits a certain temperature. What is the most efficient and easiest that can power all these at once..?

2- I think i need an arduino to connect it to the motion sensor and for opening of the doors and lights. Does anyone know any recommended arduino motors i can use? And does it require a lot of knowledge in programming or is the task i'm asking quite easy..?

also any recommended motion sensors? cause all i can find are motion sensors that emit light when it detects motion. Is there a motion sensors where it can be programmed to do a specific task when it detects motion..?

Any help will be really really appreciated, might buy you a drink or two for whoever helps :)",AskEngineers,music2169,/r/AskEngineers/comments/87wh9h/i_need_to_make_a_small_piece_of_paper_move_when_a/
85,Is there a physical reason attraction between bar magnets should double with antiparallel polarity?,1522275642,"I am doing finite element modeling of bar magnet interactions. [Here is a pretty picture of what I am looking at](https://imgur.com/a/u4H1G). Those are two objects with a large, constant magnetization and permeability next to one another. What I am seeing is that the magnets repel (attract) when parallel (antiparallel) like I would expect, but when they are antiparallel the magnitude of the force on the axis directly between them doubles!

I have found no good mathematical treatment of this type of problem, but a 0th order point dipole model of the interaction (not valid because the magnets are physically large and nearby one another) does not predict this force doubling...I think...! Does anyone have a physical reason this force doubling occurs or a physical reason it should not occur?

Thank you!",AskEngineers,rAxxt,/r/AskEngineers/comments/87w4oh/is_there_a_physical_reason_attraction_between_bar/
86,"Need a parts list for a fictional, analog TV super antenna, for a story.",1522275468,"I'm writing a story that takes place before the U.S. switched over to digital television broadcasting.

Remote Northwest United States, summer of 2008. 
The main character is a tinkerer with a lot of time on his hands. 

What would be the parts list for his very powerful analog TV antenna?

OVERKILL IS KEY. 

Character isn't rich but is willing to put some money into his project. 

Thanks in advance. ",AskEngineers,thejivemachine,/r/AskEngineers/comments/87w3yo/need_a_parts_list_for_a_fictional_analog_tv_super/
87,Informative books for casual readers,1522275043,"I am not an engineer or an engineering student, but I am someone who is interested in many engineering topics.  I want to pick up some books on different engineering subjects, but my search returns are full of highly technical books or text books.  Do you guys know of any books that cover your field for educating a layman like myself and others?  Lately, I've been trying to find stuff on power generation/distribution and on water treatmetn/distribution, but replies certainly don't have to be limited to those.",AskEngineers,Snite,/r/AskEngineers/comments/87w226/informative_books_for_casual_readers/
88,"Electrical Engineering has a 0% job growth rate over the next years. Does that mean that I won't be able to, or will have a difficult time finding a career in Electrical Engineering if I graduate with a BSEE?",1522273230,"I would like the opinions of actual graduates, not students. Thanks.",AskEngineers,idontknowwhatiscool,/r/AskEngineers/comments/87vtyy/electrical_engineering_has_a_0_job_growth_rate/
89,Student paying his way through college in a tight spot...,1522270124,"So I'm 21 and working my way towards getting a mechanical engineering degree. My parents paid for my first 2 years and now I pay for the rest. I interviewed with 2 full-time jobs this week and have gotten a call back and offer from both. The first is a door/window installation family-business (not my family) who I feel will take really good care of me and they are gonna start me off at $100 a day until my training it over and then I'll be making upwards of $25 an hour.

The other job is a leading engineering firm specializing in thermocouples in the gasification industry. However my job there will basically just be a shop bitch (sweeping floors, organizing tool cabinets, etc.). I have a feeling I will be making less than $10 an hour. 

I'm not sure how to choose. I can either work at a job where I will have a good time, learn about woodworking, make a lot of money and basically enjoy being at work. Or I can work at the engineering firm where I will be a shop bitch, not make as much money, but be able to put that I worked at an engineering firm during college on my resume, which when later coupled with whatever internship I get down the road, will look really good to future employers. ",AskEngineers,warminthesnowstorm,/r/AskEngineers/comments/87vfpr/student_paying_his_way_through_college_in_a_tight/
90,Question about the slow implementation USB C,1522269679,"Are USB type C/Thunderbolt 3 ports extremely expensive or difficult to install? It's 2018 and I'm still finding high end desktops with USB 2.0, $400 headphones with micro USB, and limited USB C accessories.I know people are slow in adopting superior standards, but what's taking so long? Apple's lighting connectors killed 30 pin firewire in under two years.",AskEngineers,terrybytehasryzen,/r/AskEngineers/comments/87vdiw/question_about_the_slow_implementation_usb_c/
91,Why use 2F rather than just F in this problem?,1522268576,"https://gyazo.com/ce3ed3ad6988094cd564df4b018a5a51 here's the problem. 
The motor just produces F, why would attaching more cables make it 2F?",AskEngineers,TheZkiller9,/r/AskEngineers/comments/87v82x/why_use_2f_rather_than_just_f_in_this_problem/
92,Proportional control pneumatic valves,1522268223,"Hi AskEngineers,

I have a low pressure (20psi-ish) pneumatic source from which I need to control a flow between 1-5 l/min.  I am wrapping a control loop around this, so ideally this is an electrically controlled valve.

Is it possible to get good proportional control of airflow through a piloted solenoid valve like this?
http://en2.airtac.com/upload/201508030122179106.PDF

Do you have other parts you would recommend for this application?  Thank you in advance.

EDIT:  Thank you guys for the help, I'm probably going to use one of these guys:

http://www.smcpneumatics.com/PVQ31-5G-23-01.html",AskEngineers,jwhat,/r/AskEngineers/comments/87v6ct/proportional_control_pneumatic_valves/
93,How does a lever pull to spring release mechanism work?,1522263981,I was looking online to figure out how a lever pull mechanism works? Like a slot machine or like those classic Fischer Price toys where the person using it pulls down a lever and spins a wheel. ,AskEngineers,jeremyscats,/r/AskEngineers/comments/87ulsr/how_does_a_lever_pull_to_spring_release_mechanism/
94,How to model an Infra red range sensor,1522263007,"I want to model a sharp Infra red sensor for simulation purposes. 

Do you know how the beam shape is? 
Is it an arc or is it football shaped? 
How many rays will it have at a time? 




",AskEngineers,mew_bot,/r/AskEngineers/comments/87ugz7/how_to_model_an_infra_red_range_sensor/
95,Plastic Choice for Snap Fit,1522261584,"Hello,

I am machining a small feature out of plastic that will snap into place. I know that snap fit are general molded features, but I just need a plastic I can easily machine for now. This piece also needs to be ESD safe.


I have tested with ESD Delrin, but it seems to be too stiff for the snap fit. Do you have any material recommendations for other materials to test? I was considering ESD UHMW to test.

Any suggestions on materials to look into would be much appreciated.

Thanks!",AskEngineers,Speccount,/r/AskEngineers/comments/87u9p2/plastic_choice_for_snap_fit/
96,"Tattoos, yay or nay?",1522261249,I’m a sophomore Mech E student at the moment and I’m looking to work in Aerospace. I really want to get a tattoo but the main thing that’s keeping me from doing it is the possibility of it screwing up a job. If i wanted it somewhere discrete i wouldn’t need to ask but i want it on my forearm lol. I know tattoos are becoming more generally accepted these days. What are your experiences with this subject? ,AskEngineers,andrewchesser,/r/AskEngineers/comments/87u81x/tattoos_yay_or_nay/
97,Weibull accelerated testing: how close does my accelerated beta need to be to my original beta to accept the accelerated test?,1522260274,,AskEngineers,me9million,/r/AskEngineers/comments/87u32t/weibull_accelerated_testing_how_close_does_my/
98,What are the pros and cons of a civil/structural engineer working in an office (like 3D modeling and programming) and one who is on site?,1522259477,"Why would you say one is better for example?

P.S I am asking this question because very soon I will have to choose between working on the site and working for a company where my work would be mainly in the office playing around with Rhino and coding in Python. Since I have very big interest in computers and programming overall, the office job tips the scale a little bit. However, I do not know if I can survive working every day in a confined space and eventually will get bored.",AskEngineers,todorove,/r/AskEngineers/comments/87tz2r/what_are_the_pros_and_cons_of_a_civilstructural/
99,Deciding Between Two Positions,1522259417,"Hi Everyone,

I am trying to decide what to do this summer and beyond. Currently, I'm an M.Eng. student studying Aerospace Engineering at UMD. I got my Bachelor's last May from UC Berkeley in Mechanical Engineering, and I could not find a job after graduation, so I decided to do the Master's degree. To be honest, I want to work full-time, and do my Master's part-time, as I think that it would be the most efficient option allowing me to get a Master's and also full-time experience.

As of now, I have two offers. The first is for a structural engineer position at a defense contractor building submarines in eastern CT. That position works more on the manufacturing side of it. The salary is $67,500. The second position is as a systems engineering intern with a aerospace defense contractor in northeastern MD, and the hourly rate is $35/hour with $2000 relocation.

In the future I would like to work with CFD and FEA if possible, hopefully in commercial aviation, but I'm pretty open to different opportunities. Does anyone in industry have any idea about which would be a better idea?

Thanks!",AskEngineers,bhojo95,/r/AskEngineers/comments/87tyrj/deciding_between_two_positions/
0,Where to find a lever to control a motor,1522258073,"I am trying to control a small vehicle with three motors (two motors for treads, one motor for a scooping mechanism). I want to control each motor individually by a lever that controls to torque for each motor.


(I'm not really sure how to describe what I want which is why I'm having trouble finding it. It's sort of like a variable toggle switch... Point is, at resting position, the motor would rest. If I pushed the lever forward, the motor would go one direction. If I pushed the lever backwards, the motor would go the other direction.)


Does anyone know where I can find a product like this? I'm trying to spend as little as possible for each lever (preferably under $10)",AskEngineers,Dr_Delfino,/r/AskEngineers/comments/87ts5q/where_to_find_a_lever_to_control_a_motor/
1,Best country to be an engineer,1522256751,"Hi everyone! A little bit about myself: I'm a 25 year old mechanical engineer within the automotive industry designing molds. I've been in this field for 2 years now and wondering if there's something more out there for me. I live and work in Ontario, Canada. Am I just be stir-crazy or what?

What country or countries would you consider the best to be an engineer? In terms of work-life balance, opportunity, pay, benefits, etc?

Edit: Rephrasing my question, taking everything into account (pay, environment, taxes, politics, etc) Which country would be the best for an engineer (this is open to all branches of engineering))",AskEngineers,MarMurray,/r/AskEngineers/comments/87tlsy/best_country_to_be_an_engineer/
2,"If we needed to build an interstellar space ship to carry people, what methods of propulsion should we consider using?",1522254213,"What technology would we use if we had to build it now? If we had to build it in 20 years, what research should we invest in?",AskEngineers,I_love_swiss_cheese,/r/AskEngineers/comments/87t8xo/if_we_needed_to_build_an_interstellar_space_ship/
3,"PE exam prep classes: School of PE, PPI2Pass or ??",1522253084,"I'm looking into the possibility of taking a prep class for the PE exam and wanted to get some input on the various options. So if you've taken the PE: Did you take a prep class? If so, which one? Did you feel it was a major factor in helping you be successful (assuming you passed)? Aside from the classes, how did you prepare for the exam? When you took the PE exam, how long since you'd passed the FE exam?

* I'm planning to take the October 2018 exam.
* I passed the FE exam in 1998 
* My employer will pay for the prep class 
* I'll be taking the ME - Machine Design and Materials exam, so if you have experience with prep classes for that particular exam, your input is especially appreciated. ",AskEngineers,DLS3141,/r/AskEngineers/comments/87t37g/pe_exam_prep_classes_school_of_pe_ppi2pass_or/
4,Younger engineer questions,1522252758,[removed],AskEngineers,DJGingivitis,/r/AskEngineers/comments/87t1mg/younger_engineer_questions/
5,Is an associates degree and experience enough to get a good job in the field?,1522252641,"I'm currently going to school to get my associates degree in mechanical engineering and have about a year of experience working and maintaining manufacturing equipment. I was wandering if this would be enough to get my foot in the door at a job in the field. If so, what kind of pay should I expect?",AskEngineers,ncgunny,/r/AskEngineers/comments/87t12e/is_an_associates_degree_and_experience_enough_to/
6,Creo question (dual dimensioning),1522251471,"I can’t for the life of me figure out how to override this driven mm dimension to change it to 0,02 tolerance instead of 0,03 in this drawing:

https://imgur.com/a/46d5Q

Using Creo 3.0 parametric. There’s gotta be a way.",AskEngineers,AccountOfMyAncestors,/r/AskEngineers/comments/87svkp/creo_question_dual_dimensioning/
7,Civil or Electrical Engineering?,1522245555,"My first year of engineerking is coming to a close, which means program placements are upon us. And I have no clue what to choose.

I'm split between electrical and civil engineering. So I've got some questions for engineers working in these fields:

What do you do in your day to day job?
How is the pay?
How is the job market? Is it easy/hard to find jobs in these fields?

Any other advice for choosing is welcome. And if it matters, I would probably take a computing minor if I went into electrical, and a transportation minor if I went into civil.",AskEngineers,StetsonTuba8,/r/AskEngineers/comments/87s3qx/civil_or_electrical_engineering/
