index,title,created_utc,selftext,subreddit,media_only,author,permalink
19,Automotive emergency extrication diagrams?,1570750022,"I have a layman's interest in how modern car bodies are assembled, particularly diagrams that show the various grades of steel or aluminum for each part. 
Finding clear diagrams of the bare unibody, sans fenders, can be hard to find. So far I have only found a few examples from two sources: the first was a slide show from a major steel mill, showing the various grades of steel one of their biggest customers use. That one was great because it had colour coded regions to mark the steels used. It was poor because, being a sales aid, the pictures were small and low resolution.

The other source was chassis diagrams with marked cut points for emergency services to refer to when cutting victims out of a wreck. But I've only found one or two examples online. I don't know if my lack of terminology is giving me poor results or if auto OEMs are avoiding making these accessible to the general public. 

Question: Do you know of a publicly accessible resource with lots of bare chassis diagrams from major automakers?",AskEngineers,False,barbarian818,/r/AskEngineers/comments/dg6ev8/automotive_emergency_extrication_diagrams/
20,Is there ANY type of EMF that can get through tin foil ?,1570749068,Is there ANY type of EMF that can get through aluminum or tin foil ?,AskEngineers,False,BlueSweetTooth,/r/AskEngineers/comments/dg67oz/is_there_any_type_of_emf_that_can_get_through_tin/
21,Can we?,1570745765,,AskEngineers,False,appleorangesbanana,/r/AskEngineers/comments/dg5hma/can_we/
22,What do entry level mechanical engineers make in the bay area?,1570745693,Does it even come close to compensating for the increased cost of living?,AskEngineers,False,Nat9523,/r/AskEngineers/comments/dg5h5n/what_do_entry_level_mechanical_engineers_make_in/
23,What is the implications of these three Different welds? Can you tell the tool and technique used as well as the implications and use?,1570745380,"[https://cdn1.imggmi.com/uploads/2019/10/11/ccda3951ac5c7c7a3d03093f766b66ea-full.jpg](https://cdn1.imggmi.com/uploads/2019/10/11/ccda3951ac5c7c7a3d03093f766b66ea-full.jpg)

\[URL=https:///\]\[IMG\][https://cdn1.imggmi.com/uploads/2019/10/11/ccda3951ac5c7c7a3d03093f766b66ea-full.jpg\[/IMG\]\[/URL\]](https://cdn1.imggmi.com/uploads/2019/10/11/ccda3951ac5c7c7a3d03093f766b66ea-full.jpg[/IMG][/URL]) \[URL=https://imggmi.com\]upload\[/URL\]

\[URL=https://imggmi.com/full/2019/10/11/ccda3951ac5c7c7a3d03093f766b66ea-full.jpg.html\]\[IMG\][https://cdn1.imggmi.com/uploads/2019/10/11/ccda3951ac5c7c7a3d03093f766b66ea-prev.jpg\[/IMG\]\[/URL\]](https://cdn1.imggmi.com/uploads/2019/10/11/ccda3951ac5c7c7a3d03093f766b66ea-prev.jpg[/IMG][/URL]) \[URL=https://imggmi.com\]upload\[/URL\]

&lt;a href=""[https://imggmi.com](https://imggmi.com)"" target=""\_blank""&gt;&lt;img src=""[https://cdn1.imggmi.com/uploads/2019/10/11/ccda3951ac5c7c7a3d03093f766b66ea-full.jpg](https://cdn1.imggmi.com/uploads/2019/10/11/ccda3951ac5c7c7a3d03093f766b66ea-full.jpg)"" border=""0""/&gt;&lt;/a&gt;

&lt;a href=""[https://imggmi.com/view/2019/10/11/ccda3951ac5c7c7a3d03093f766b66ea-full.jpg.html](https://imggmi.com/view/2019/10/11/ccda3951ac5c7c7a3d03093f766b66ea-full.jpg.html)"" target=""\_blank""&gt;&lt;img src=""[https://cdn1.imggmi.com/uploads/2019/10/11/ccda3951ac5c7c7a3d03093f766b66ea-prev.jpg](https://cdn1.imggmi.com/uploads/2019/10/11/ccda3951ac5c7c7a3d03093f766b66ea-prev.jpg)"" border=""0""/&gt;&lt;/a&gt;",AskEngineers,False,ThankyouThanksSmiles,/r/AskEngineers/comments/dg5eye/what_is_the_implications_of_these_three_different/
24,How to program cell phone to take images every 5 to 10 m based on gps coordinates.,1570745336,"Hi I have no idea where to start, I have an android cellphone it has all we need but is it possible ?",AskEngineers,False,afzalwas,/r/AskEngineers/comments/dg5ekj/how_to_program_cell_phone_to_take_images_every_5/
25,How do you adapt and face challenges independently at work?,1570740954,"Weird question probably. 

I'm a co-op, have previously interned last semester at another company so I understand behaving well and not being a nuisance in my position. 

My issue that I faced before and am facing now is the feeling of panic and doom when something goes wrong, might be filling out some documentation, might be a CAD issue that has turned into a monster from hell, just something where I don't know how to fix it. I usually feel hopeless and immediately want to run to my supervisor, who is a good person and is available a lot. But this isn't what full-timers do, or engineers in general. We figure it out and learn. My supervisor doesn't run to his boss when he has CAD problems or a file gets fucked up, he solves it. I want to be able to work through things without losing my shit. 

I thought this panic would go away over time but I still feel lost and stuck when I face a challenge, do you have any tactics for remaining calm and fixing the issue?",AskEngineers,False,TellTheTime,/r/AskEngineers/comments/dg4eq8/how_do_you_adapt_and_face_challenges/
26,Just graduated college and struggling in work.,1570736907,"Hi I'm 22 and just recently finished college. I did an internship at a company and they hired me after completing my degree.

So 1 month into working they make me project lead of a pretty big project. So it's my job now to plan everything out and make sure all the work is done and to work with others to overcome problems.

That's all great, I appreciate that it's a good experience to get at a young age and I am learning but I really feel I've been thrown in the deep end. I went from basically giving a little input (when I was an intern) in meetings to having to talk about my own project in large meetings. I find it hard to talk in front of everyone, especially when I'm not 100% confident about the material I'm speaking about as I don't know it well enough. I really feel like an idiot. 

Has anyone experienced anything similar? I feel like I don't know what I'm doing and it's disheartening. 

Oh and btw the work I am doing now is completely different to what I did as an intern so everything is new to me.",AskEngineers,False,throwaway1692010,/r/AskEngineers/comments/dg3g9i/just_graduated_college_and_struggling_in_work/
27,Is it ever acceptable to shear across the threads of a bolt?,1570736683,"Hi everyone. At my job I'm currently designing a walkway system and I'm having to attach a crossbeam to a vertical strut. I am developing rough concepts for this and I can either attach the crossbeam using a channel nut like [this one](https://www.unistrut.us/product-details/p1006-thru-p1010) or drill a hole through the strut and stick a bolt through it which attaches to the crossbeam end which is shaped similar to a clevis joint. I'm examining the second option because the crossbeam might be meeting the post at an upwards variable angle and can't use a premade angle fitting, and it's the technique that my company has been using in less critical applications.

In this case, I don't expect the bolt to have to carry much load, maybe 100 lbs for the walkway section and a couple hundred for humans on the walkway, but I've always been wary of using a bolt in pure lateral sheer especially due to the safety considerations.

I've tried to find any information on shearing across bolts but can't find anything. I understand that they are not designed for this purpose but I expected to be able to find something. Should I just abandon the bolt idea? Should I use a clevis pin system instead? Thanks for any input.",AskEngineers,False,grigby,/r/AskEngineers/comments/dg3e9a/is_it_ever_acceptable_to_shear_across_the_threads/
28,Switch to mech,1570736674,"Hey guys, im currently a structural engineer but im definetly interested in working as a mechanical engineer. Is it posisble to switch into it without going back to school? Has anyone here ever made any switch into a different engineering field? How did it turn out?",AskEngineers,False,Zari9000,/r/AskEngineers/comments/dg3e64/switch_to_mech/
29,Organizing AutoCAD files in excel?,1570736630,"Good afternoon all,

Im looking for some thought/guidance on how you guys all organize your dwg library. At the company I just started working for a few months ago, we have a few thousand drawings that are pretty much all over the place. Luckily, we have an excel sheet that lists the detail and drawing number of the part, along with the part name. But they only put in about 400 of those few thousand parts...

Fast forward to me doing some digging around. The past two days I've been trying to figure out how to recreate a master library. Ideally, id still like to use excel since everyone uses it here, and its somewhat easy to work with. I made a document with a few hundred drawings, with columns for the drawing number, part description, and then a column with a hyperlink. So when you find the drawing you want, you can open it up right from excel and not have to do another search in the file explorer for it. This works great.

The issue ive found is that alot of the drawings weren't named consistently. Ti make my process easier ive found that I can use the autocad data extraction tool to pull out information like dwgname, dwgno, file location, and file path, which I use to make the hyperlinks. However, Ive found that the data extraction tool doesnt seem to happy when you try to scan hundreds or thousands of drawings.

Has anyone found a good tool or way to organize their drawings in a manner similar? I wanted to use the data extraction tool since it pulls the info I want from the title blocks, but since the tool hasnt seemed to work the past few runs I want to see if there are any other easier options or ideas out there.",AskEngineers,False,CommonEngineer,/r/AskEngineers/comments/dg3dq8/organizing_autocad_files_in_excel/
30,I need help to fix missing surfaces on solidworks cad,1570736271,"Hello fellow engineers, I seek your help!

I am a member of one of the teams that compete in the FSAE Formula Student, my role is focused on the CADs for the engine assembly. I was recently asked to fix some missing surfaces in our engine block CAD model ( (here's a pic of how it looks)\[[https://imgur.com/kZFuMgT](https://imgur.com/kZFuMgT)\] ); this model is made of surfaces only because, I'm told, it was imported into Solidworks a few years ago from a script downloaded directly by the manufacturer's website. While converting the file they indeed obtained a decent result but some surfaces are completely missing and I am now tasked with recreating them. I tried to use the function ""surface with boundaries"" while selecting the borders of the missing surfaces and sometimes it works but mostly I get the message ""error: surfaces intersecting"": \[here\]([https://imgur.com/zwlMz0n](https://imgur.com/zwlMz0n)) in red a detail of what I managed to do. Right now, I am at loss, I need advice/other ideas on how to fix this. I initially tought of asking the Reverse Engineering professor to help me with a 3D scan but I was told it's a too complicated geometry to replicate without having the necessary knowledge/hours of work to put into it so now... here I am.

Thank you in advice for any input this will get, it'll be greatly appreciated!",AskEngineers,False,pantograph23,/r/AskEngineers/comments/dg3ak7/i_need_help_to_fix_missing_surfaces_on_solidworks/
31,Would anyone know of companies willing to take on a mechanical engineering graduate from Ireland? (no sponsorship needed),1570735292,"To put it bluntly, provided I can find an internship/employment by the end of January 2020, I have the opportunity to get a graduate visa for 1 year to the USA, and therefore **will not need company sponsorship.**


I'd love to take this opportunity, but I'm having trouble researching companies that seem like they'd be willing to take on non-citizens as interns or employees. 


My USA equivalent GPA is 3.3 and my degree was in mechanical engineering. 



Would anyone here know any companies big small or otherwise that would be willing to take on foreign graduates?",AskEngineers,False,EngIntIre,/r/AskEngineers/comments/dg31gm/would_anyone_know_of_companies_willing_to_take_on/
32,How to maximize the vacuum effect?,1570732765,"There is a table with a strong vacuum but it can't hold down a warped wooden board. With this jig it will work because the air can't escape directly from the edges but there is still some warping towards up in the corners.

Anyone have any tips how to change the design to maximize the flatness?

https://i.imgur.com/fmmiciV.jpg",AskEngineers,False,balstestrat,/r/AskEngineers/comments/dg2dxm/how_to_maximize_the_vacuum_effect/
33,Are there any applications for me to see what i'm capable of?,1570728571,"Are there any platforms that i can test myself(skills, my capability)?

I'm talking about tasks i can try to do or see what i have to be able to do if i wanna do the job or do something in that field.

For example:

I wanted to be an sap consultant.
There would be a consultants tasks beginning from easy o hard. 

Are there any examples of such sites,apps,platforms? I'll try building one if there isn't any!",AskEngineers,False,alpello,/r/AskEngineers/comments/dg1e4j/are_there_any_applications_for_me_to_see_what_im/
34,Looking for resources on gearbox design,1570725837,"Kind of a ""vickers industrial hydraulics manual"", but for gearboxes.

I prefer physical books, but I'd appreciate anything y'all can give me.

Thanks in advance!",AskEngineers,False,zoidao,/r/AskEngineers/comments/dg0q2m/looking_for_resources_on_gearbox_design/
35,Looking for resources on Lifting Equipment Design,1570725773,"By ""lifting equipment"", I'm meaning cranes or hydraulic lifting kit (forklift, etc), not shackles and slings.

I prefer physical books, but I'd appreciate anything y'all can give me.

Thanks in advance!",AskEngineers,False,zoidao,/r/AskEngineers/comments/dg0pj7/looking_for_resources_on_lifting_equipment_design/
36,Adding yaw to ultrawideband positioning system - sensor fusion or beacons for angle detection,1570723999,"Hello everybody, new to reddit and I believe this is the right spot for this question, otherwise I'm sorry.

I have a system of ultra-wideband transcievers (using chips from Decawave) that allows me to de accurate indoor positioning (20mm max deviation when also using the IMU). I'm using this sytem to locate a kind of remote control (eventually I want it to plan routes for an indoor flying drone). The thing is, I also want to know in which direction this remote control is pointing while moving it. To be more precise, I want to know what the spot is that it is pointing at using its inbuild lidar sensor. The angle therefor needs to be pretty precise, as the spot could be several meters away.

Using an IMU I am able to accurately calculate the roll and pitch, but yaw is a problem. A magenetometer on its own is not that accurate too, but using sensor fusion algorithms such as the madgwick algorithm will help of course. But you still have the problem of chasing magnetic fields inside of a room. So as far as I know, there is no 9DOF sensor that allows for reliable yaw detection within 1 degree deviation when moving trough an indoor space. But I would love to be wrong!

So to solve this, I was thinking of ways to integrate the beacons in the orientation algorithm. Possibly using directional antennas, either using the ultra-wideband signal or adding another signal to (some of) the beacons. But I can't seem to find much on this. Are there any terms or commercial solutions I can google?",AskEngineers,False,huub8,/r/AskEngineers/comments/dg0asz/adding_yaw_to_ultrawideband_positioning_system/
37,What is your pen of choice and why?,1570723935,Just a little curious if anyone has specific taste for what they use to write with.,AskEngineers,False,thegman001,/r/AskEngineers/comments/dg0a7x/what_is_your_pen_of_choice_and_why/
38,electrical engineers what are some things to know going into the discipline?,1570723584,I am a graphic design student currently working on a magazine project. Each issue of my magazine is focused on a different major. My first issue is over electrical engineering and I wanted to get some insight from you all who have firsthand experience. The goal is to inform people who are looking at changing or going into this major. What are some things you wish you knew before you majored Electrical Engineering? What are the top companies you would aspire to work at? What made you choose Electrical Engineering? What advice would you give to someone looking into this major? What does life look like after college?,AskEngineers,False,HELLveticaNo,/r/AskEngineers/comments/dg071e/electrical_engineers_what_are_some_things_to_know/
39,"Looking for infrared ""transparent"" material",1570722042,"I am working on a sensor project. The sensor I am using is a OSOYOO obstacle avoidance IR sensor. 

I am building an enclosure and I need a material that I can place in front of the sensor that does not interfere with the IR signal. I have tried different types of plastics, and resins, but they have all interfered with the IR signal. 

I have looked online for a specific IR ""transparent"" material but have had not luck.  If you look at a paper towel dispenser in a public bathroom, they often have a darker ""brownish"" material that covers the sensor. Maybe that kind of material is what I am looking for.

Any input on material options would greatly appreciated. Thanks!",AskEngineers,False,_YOU_ONLY_YOLO_ONCE_,/r/AskEngineers/comments/dfztz9/looking_for_infrared_transparent_material/
40,Medical device engineers- career advice?,1570715674,"Dear medical device engineers, my career is at a crossroads and I need some advice, I hope you can chime in: 

Some context: 
About myself: Live in Singapore which has a rather small medical device industry, but reasonably big pharma one. 

Education: Bachelors in Mechanical Engineering with a specialisation in Biomechanics; Masters of Engineering in Biomedical Engineering. 

Career so far: I've worked for 6 years in Academia, first as a biomechanics researcher in a university hospital and for the last four years as a 3D printing Engineer in a University 3D printing Research Centre, specialising in biomedical 3d printing applications.

Skills: CAD, FEA, some CFD, wide variety of 3d printing and machining experience, some project management and quality systems, IP and contracts. 

Career goals: I'd like to go on to be a design engineer in implants, primarily orthopedics. The possibilities that 3D printing has for custom medical devices also interests me so if there is a crossover between the two that would be the ideal place I'd like to work. Something like a custom implant designer.

The problem: 
I have a year left on my contract at the university, but I feel I've outgrown the place and I don't get as much opportunity to learn anymore- I've become the go-to guy for project management and other administrative stuff like contracts, getting around review and ethics boards, getting grant funding etc, which while important I dont get as much time to practice and develop technical skills and I don't see this changing in the immediate future. However, I've done a good job of securing strong collaborative projects with a leading global implants manufacturer (was the lead engineer for one project) and also kickstarting ISO13485 QMS for my university. There is a strong possibility that the global implants manufacturer will be starting a small scale plant in about a years time. If I remain working on the projects I may be a good candidate for them to hire eventually, but this is a risk. 

On the other hand, I have recently received two other offers: 

1) A leading global pharmaceutical firm is offering a position as a 3D printing engineer. This is not the ideal path I would take- it would be more of a parallel move but to my mind industry experience is useful (medical device and pharma are similar industries) and I think it would give me the chance to grow technically. It would, however, entail me giving up working on the current collaborations with said implant manufacturer. 

2) A metal 3D printer manufacturer is also offering a position as a research engineer into optimisation of 3D printing parameters for production. This is less enticing for me, but is also a chance to grow technically.

Both new offers are offering a significant bump in salary. 

What would your advice be?",AskEngineers,False,ghostofwinter88,/r/AskEngineers/comments/dfyceo/medical_device_engineers_career_advice/
41,Help! Calculating stability &amp; amount of tilt (list and trim) of a Barge,1570708576,"I am looking into a project and I have need to use a 2 person manlift that is able to reach 70 feet off the side of the barge to a bridge. I am trying to determine what is the maximum amount of reach we can have before the barge becomes unstable and could potentially overturn the manlift. Here are the inputs that are known:

Assume stability of water from wind and waves as that barge will be stationary and in steady water.

Snap together barge will be used for a total length of 80 feet x 24 feet wide x 4.5 feet deep.

JLG 1850SJ Manlift with weight of 45,000 lbs

The manlift will need to be positioned 2 feet from the front edge of barge in order to achieve the length needed.

JLG recommends only using manlift on barge when list is 1 degree or less

Assume 500 lbs of persons + equipment in manlift + 500 lbs of basket weight = 1000 lb load

&amp;#x200B;

Can anyone point me in the right direction here on how to determine the max weight &amp; reach that can be supported before you would get the 1 degree of list? 

I was able to find some helpful information here but I am still drawing blanks:

[https://www.flexifloat.com/ReferenceLibrary/TechnicalDocuments](https://www.flexifloat.com/ReferenceLibrary/TechnicalDocuments)",AskEngineers,False,godsey23,/r/AskEngineers/comments/dfwx7w/help_calculating_stability_amount_of_tilt_list/
42,How to visualise slowly-flowing air?,1570706103,"I have a specific setup of furniture in my room with air ventilation (very slow) in a corner \[[sketch](https://i.imgur.com/kq6QL8V.png)\] and want to see how the air flows to determine what is up with my weird dust patterns...

I imagined I could trace similar to how aerodynamicists trace the air flow on cars. The thing is that my air flow is really weak and I imagine this 'smoke'ish air will not really follow the air flow because it is relatively weak (it's not even bending a sheet of paper). 

Do you have a suggestion on to how to track the air-flow in this room/situation?",AskEngineers,False,HillTheBilly,/r/AskEngineers/comments/dfwhr7/how_to_visualise_slowlyflowing_air/
43,"Having a company come in to spec a camera, learned they can’t offer the engineering support of a different company, what should I do?",1570705663,"First year co-op here, like the title says, I scheduled one company to come in and spec a camera for a vision system, but have since learned of a competitor that can offer much better engineering support. Should I go ahead and cancel the first company that I scheduled or still just go through with it so I can get more experience?",AskEngineers,False,Sublethal_Panic,/r/AskEngineers/comments/dfwf0b/having_a_company_come_in_to_spec_a_camera_learned/
44,How is integration different from summation?,1570702182,,AskEngineers,False,nitezche,/r/AskEngineers/comments/dfvurd/how_is_integration_different_from_summation/
45,"Engineers working with boilers and steam turbines, is there any relationship between pH and dissolved oxygen?",1570700816,"An engineer once asked me, a chemist, if the dissolved oxygen in boiler water affects its pH. In pure water, as far as I know, it doesn’t, nlike carbon dioxide that ionizes to produce carbonate ions that lowers the pH. Naturally, my answer was, no, the DO has no significant effect on the pH of the water theoretically. Was I wrong in my response?",AskEngineers,False,King-Kemiker,/r/AskEngineers/comments/dfvnai/engineers_working_with_boilers_and_steam_turbines/
46,How can I cover a metal rod with a silicone layer?,1570698960,How can I cover a long thin metal rod with a diameter of 0.12-0.14 mm with a silicone layer 0.015 mm?,AskEngineers,False,st273554,/r/AskEngineers/comments/dfvdm4/how_can_i_cover_a_metal_rod_with_a_silicone_layer/
47,Should I change degrees?,1570692259,"Hi guys, sorry to be straightforward but I need some advice. I'm currently doing mechatronics right now and I was wondering if I should change to civil. From what I hear, doing civil engineering provides more job opportunities and high salaries. I'm just finishing first year so there's still time for me to switch. Both civil and mechatronics interests me so what do you think I should do?",AskEngineers,False,VeritasUmbra,/r/AskEngineers/comments/dfugw9/should_i_change_degrees/
48,Is there a program to quickly check functionalityt of stick diagram mechanism?,1570691486,"I am taking a planar machinery class and I have to design 2d mechanisms. Currently, I have been using fusion360 or Solidworks to check if the machine is functional, but this process involves me to create actual linkage shapes, holes, mating and extruding; in short, a long time to do. 

Is there a program where I can animate stick diagrams of these mechanisms? Right now, the mechanisms we are creating are quick return mechanisms, crank and rockers, double cranks, double rockers",AskEngineers,False,ferrouselm,/r/AskEngineers/comments/dfucsr/is_there_a_program_to_quickly_check/
