index,title,created_utc,selftext,subreddit,media_only,author,permalink
33,What engineering discipline should I choose if I want to pursue mechatronics engineering?,1586305222,"Well the title says it all. I'm a first year engineering student at the University of Alberta and unfortunately, they do not offer mechatronics as a discipline. I am required to pick a discipline by the end of this month and I narrowed down my choices to mechanical and electrical engineering. If I want to pursue mechatronics engineering in the future, which of these two disciplines should I pick.",AskEngineers,False,Yasar7799,/r/AskEngineers/comments/fww24n/what_engineering_discipline_should_i_choose_if_i/
34,Asking for advice,1586305001,[removed],AskEngineers,False,Yasar7799,/r/AskEngineers/comments/fwvzzo/asking_for_advice/
35,DMLS 3D Printing,1586304020,[removed],AskEngineers,False,Skay2000,/r/AskEngineers/comments/fwvqsk/dmls_3d_printing/
36,How to Decide if it's Worth Relocating for a Job?,1586303810,"A little background. I graduated last May with a Bachelor of Environmental Engineering and have my EIT. I started applying for jobs during my last semester but didn't have much luck(couple interviews no follow ups). In July I ended up landing a job at a small lab, which well better than being unemployed but is otherwise very crappy. The pay is bad($17/hr), I don't get any benefits (insurance ect) and it has hardly any relevance to my degree. I've kept applying for jobs while working there and last Friday I was offered a job in Baltimore. The position is in stormwater management and waterway restoration which is something I'm pretty interested in( though it's hard to say if I'll really enjoy it because I have little real world experience). It has a pretty good salary and good benefits. I know how lucky I am to even have this opportunity given what is going on in the world but I'm still not sure if I want to accept it. First off, it's a conditional offer because they're not doing background checks or drug tests right now due to COVID-19. Also I currently live in Minneapolis so it's a pretty significant relocation. My Dad is from Baltimore so I spent a good amount of time there as a kid and also did a summer REU on the eastern side of the Chesapeake bay so I know that I like the area. But, I don't have any friends or relatives there so if I did move out there I would be pretty much on my own. Lastly, I'm pretty close with my parents(actually currently live with them) and I'm getting the vibe that they really don't want me to take it. I know in the end it's a desicion that I have to make on my own regardless of what my parents think and maybe I'm just using their input as an excuse for me not being able to decide. I have until friday to accept or decline. That seemed like a long time a few days ago but now it's been like 4 days and I feel like I haven't made any progress toward making a desicion. One question I have is would it be bad to ask for an extension to decide? It's with the government so I feel like they probably wont give me one anyway. Bottom line I'm looking for advice or input from anyone that might have made a similar desicion. Sorry for the long post but I'm at a loss and pretty soon I'm gonna just have to flip a coin. Any input would be greatly appreciated!",AskEngineers,False,GopherCat96,/r/AskEngineers/comments/fwvosj/how_to_decide_if_its_worth_relocating_for_a_job/
37,Should I go back for my Master's Degree during job market stagnation? Interested in Flight Test Engineering.,1586303431,"Hello all,

So, some background. I am a recent ME graduate (December 2019), and I have been hitting the job search pretty hard starting around January. In late February I got an interview with a company as a tooling engineer. The interview went very well, HR even reached out to me and confirmed everyone thought I would be a great fit. I was told I should expect a call the following week to confirm if I got an offer or not... I'm guessing you can figure out where this is heading.

To cut it short, the position at said company was put on hold due to COVID-19. I've been in contact with the HR rep, and I was told that if he hears anything about the position (or any other openings) I will be the first person he calls. However, I am holding back too much hope something will come of this any time soon.

My job search has gotten progressively more bleak as time has passed as well. Many positions I was being considered for have been put on hold or fully canceled.

After all of this, I am beginning to consider other options. Currently, I am debating going back for my master's degree while the job market is a bit stagnated. I viewed the tooling engineer as a great opportunity to expand my technical skills as an engineer, but it was not a position I wanted to pursue long term.

Most of my experience is in manufacturing, but I recently achieved my Private Pilot License and have gotten deeply more interested in aviation. From job searching, A flight test engineer (FTE) sounds like a very interesting position and something I am heavily considering working towards.

So, here are some questions I would like to bounce off you guys. Would you considering going back for your Master's during this uncertainty in the job market? What would be the best course of action to pursue a position as a FTE? Should I go for a Master's degree in Aerospace? Should I just stick to job hunting and find a position that will build experience towards becoming a FTE?

Any opinions would be appreciated. Thanks.",AskEngineers,False,Peace_of_paper,/r/AskEngineers/comments/fwvku3/should_i_go_back_for_my_masters_degree_during_job/
38,Is it possible to create a bed that can charge phones wirelessly?,1586300355,"Dear engineers of reddit,

Is it possible to create a bed that can wirelessly charge your phone without being hard or slowly kill you with radiation?

This would be extremely useful for those nights when you fall asleep with your phone in your hand and it isn’t on charge.",AskEngineers,False,BahamaQueen242,/r/AskEngineers/comments/fwuphh/is_it_possible_to_create_a_bed_that_can_charge/
39,Getting a master's degree OR going straight into a career after undergrad?,1586300219,"I am currently a college student and have been really giving graduate school some consideration. However, I have heard a lot of talk that getting a masters isn't necessary (I know talk is misleading). That you can easily graduate from undergrad with internship experience, find a decent job, bulk up your resume, and move on to other great companies in the future. I need some perspective, in your opinions as professionals, what do you recommend or what is your experience as engineers. 

Thanks.",AskEngineers,False,bekbana,/r/AskEngineers/comments/fwuo64/getting_a_masters_degree_or_going_straight_into_a/
40,Charging Beds,1586300162,[removed],AskEngineers,False,BahamaQueen242,/r/AskEngineers/comments/fwunm1/charging_beds/
41,How to get into wind farm development/renewables?,1586299704,"I've got 3 years experience post grad with a BSME, working on the manufacturing/mining industry. 

I want to get into renewables, namely project engineering. 

I'm currently learning QGIS, and researching power/electrical concepts (reactive power etc), but I feel this will be immediately looked over in favour of an applicant who has actual industry experience, and I'm trying to stay positive especially since I've been unemployed for the past 3 months since I moved cities.

Does anyone have suggestions on what to learn, or how to successfully land a job in renewables?",AskEngineers,False,shadowofsunderedstar,/r/AskEngineers/comments/fwuj0f/how_to_get_into_wind_farm_developmentrenewables/
42,Can you hurt yourself by sniffing electronics using an AM radio?,1586299028,"I've been using my AM radio to sniff for EM noise for when I'm like recording stuff with microphones/guitars and I hear buzzes. I'd like to ask if there were any safety hazards with this process. I'm only sniffing stuff like light bulbs, charging cables (for phones or laptops) and walls (if a wire is going behind it). Obviously I'm not going to stick the antenna into the wall, but is there a scenario where I can get shocked by this? Like maybe a capacitor or something in a device just suddenly transfers its energy to the radio coil? Is this a plausible thing that can happen? Again I'm not walking into a substation with this. I'm more concerned about wall outlets and stuff like tram cables or something, or maybe an old CRT TV, I've always been scared by them. The closest thing I got to something like that is when I was a kid I touched an exposed ceiling lamp cable with the tip of an FM radio antenna and it tingled my arm.",AskEngineers,False,StateSquatter,/r/AskEngineers/comments/fwubvx/can_you_hurt_yourself_by_sniffing_electronics/
43,"I'm a Jr Systems Engineer, who works mostly in operation and not much technical work. Should I jump ship when things are calm down a bit?",1586297867," 

I'm currently a junior systems engineer, working for a small defense firm (\~150) for the past 9-10 months.

For the first 3 months, I was doing some small technical work until they pulled me out and put me on a contract. Since then I have been doing nothing but ensure the smooth operation of my team (around 15 people), I feel like a babysitter with a glorify engineer title. When the customer or the boss wants something done, I either get it done myself or I can quickly form a group with relevant people and make sure we get it done before the deadline. So far I think I have been doing a fairly decent job, I know my team well enough to make sure they don't drop the ball. Or if my team needs something, I know who we can talk to and reach out to them. Even a couple of govies commented on how we could whip up a team and have a fast turn around time. It is nice to get compliments from the managers sometime, but tbh It wasn't me who did the job. I didn't really produce anything, I just put together whatever someone else is doing, translate it a bit so non-technical customers can understand, and turn it in

Growing up poor, my biggest insecure is job security. This is also my first job so I don't how other companies work. It seems like all the management position (project manager) requires years of technical experience. I'm just afraid that by not having any technical skill and experience, I might shoot myself in the foot in the long run by becoming unemployable, unable to find anyone who would hire me. That's why I'm debating if I should quit and find another job where I gain my technical skills before jumping back to project management in 7-10yrs from now",AskEngineers,False,yellow_smurf10,/r/AskEngineers/comments/fwtzt4/im_a_jr_systems_engineer_who_works_mostly_in/
44,"I'm a Jr Systems Engineer, who works mostly in operational and not much technical work. Should I jump ship when everything goes back to normal ?",1586297239,"I'm currently a junior systems engineer, working for a small defense firm (\~150) for the past 9-10 months. 

For the first 3 months, I was doing some small technical work until they pulled me out and put me on a contract. Since then I have been doing nothing but ensure the smooth operation of my team (around 15 people), I feel like a babysitter with a glorify engineer title.  When the customer or the boss wants something done, I either get it done myself or I can quickly form a group with relevant people and make sure we get it done before the deadline. So far I think I have been doing a fairly decent job, I know my team well enough to make sure they don't drop the ball. Or if my team needs something, I know who we can talk to and reach out to them. Even a couple of govies commented on how we could whip up a team and have a fast turn around time. It is nice to get compliments from the managers sometime, but tbh It wasn't me who did the job. I didn't really produce anything, I just put together whatever someone else is doing, translate it a bit so non-technical customers  can understand, and turn it in

Growing up poor, my biggest insecure is job security. This is also my first job so I don't how other companies work.   It seems like all the management position (project manager) requires years of technical experience. I'm just afraid that by not having any technical skill and experience, I might shoot myself in the foot in the long run by becoming unemployable, unable to find anyone who would hire me. That's why I'm debating if I should quit and find another job where I gain my technical skills before jumping back to project management in 7-10yrs from now",AskEngineers,False,yellow_smurf10,/r/AskEngineers/comments/fwtsyy/im_a_jr_systems_engineer_who_works_mostly_in/
45,Need Help with Calculating the Average Roughness of Cloud Gate in Chicago,1586296505,"Hey y'all!

I am stuck with an assignment, and I can't seem to find any information online. My assignment is to calculate the average roughness of the cloud gate in Chicago; however, I was given no resources besides my textbook. My textbook uses the formula:

Ra = ∫(|y|/Lm)dx, from 0 to Lm

where Ra = average roughness, Lm being the specified distance over which the surface deviations , and y being the vertical deviation from the nominal surface.

From my understanding, the microscopic measurements of the surface are needed so a graph can be created, but I cannot find any sources that will help me do this. All I know is that the Cloud Gate (correct me if I'm wrong) was electropolished, meaning the Ra value would be between 0.10-0.80 (according to International Stainless Steel).

Any help would be appreciated! Thank you!",AskEngineers,False,nubproof_,/r/AskEngineers/comments/fwtl32/need_help_with_calculating_the_average_roughness/
46,I am at a huge pivotal point in my engineering career and could use some advice.,1586295507,"So I need to choose an engineering field and I'm really confused about what to choose. I have changed my desired field about 5 times in the last two months, mostly between aeronautical, mechanical and software engineering (right now, I've set Software Engineering as my current desired field). Disregarding passion or desire to join a field and looking from a strictly lucrative point of view, what would the most desirable field right now?",AskEngineers,False,introvert15,/r/AskEngineers/comments/fwta90/i_am_at_a_huge_pivotal_point_in_my_engineering/
47,Do you think your company will relax WFH policies after covid-19 calms down?,1586292319,"WFH seems to be a mixed bag among engineers of different disciplines.  Some people say it has vastly improved their productivity and gives them that extra time to spend with family.  Or the social isolation of WFH and home distractions has brought productivity down.

I'm more in the hardware/software overall computer engineering field.  Some FAANG level companies like Apple/Google/Amazon for engineering I've heard generally frown on WFH, and would like everyone to come into office.  I'm wondering if these companies will notice any productivity boost and while I think allowing everyone to WFH 24/7 is not feasible, it would be prudent to allow employees at minimum 2 days out the week to WFH.  It could have so many benefits.  What do you think?

In an ideal scenario in my head for software engineering, a company of 100 could lease office space for only 50 employees.  They could have flexible workstations and stagger who comes into the office on certain days.  It'd reduce traffic and give everyone more time to spend outside of commuting.  The area where you live and real estate wouldn't matter as much if you don't have to commute everyday.  A downside I can think of is employees fighting each other over which days they would want to WFH vs. coming in.",AskEngineers,False,someonesaymoney,/r/AskEngineers/comments/fwsc0n/do_you_think_your_company_will_relax_wfh_policies/
48,What's the difference between a Mechatronics BE and a Mechanical ME specialized in Mechantronics?,1586292139,"Basically the title. I am currently an Mechanical Engineering Student who wants to specialize in Mechatronics. I know there are Mechatronic BEs, I assume there are MEs, but apparently my college offers a specialization into Mechatronics as a Mechanical Engineering Specialization, in my Master's program.

Figured I'd might as well try to prepare myself for the recession market.",AskEngineers,False,genericQuery,/r/AskEngineers/comments/fwsa0o/whats_the_difference_between_a_mechatronics_be/
49,"What is the name of the ""mechanism"" that allows controlled cable release by wrapping multiple times around a stable anchor?",1586290197,"I feel like this has a name but cannot place what it is. Basically, if you need to do a controlled release of a tensioned cable load, you wrap the cable/rope around a non-moving ""pulley"". You can control very heavy loads without needing much force.

Half a loop will get you little force, and if you need more force you can add more wraps. I could control the lowering of a piano without much trouble by just wrapping more turns. (Note: I'm not lowering a piano, just an example).

I believe this is what they use for climbing belay systems to let light people belay heavy people. This would be the thing at the top of the climb, not what the person holds on their body. I think they also use this in boating applications but I don't know enough about boats to Google it.",AskEngineers,False,BScatterplot,/r/AskEngineers/comments/fwrod3/what_is_the_name_of_the_mechanism_that_allows/
50,Is There A Automated Way To Measure Weight For Test Specimen Over Long Period Of Time?,1586289328,"30 test specimen are placed inside of climate chamber and it's humidity is changed through time. My goal is to measure their change in weight over test period of time. Right now measuring their weight is manual by taking them outside of climate chamber and measuring them on scale.
My plan is to measure their weight inside of climate chamber with load cells and arduino and send results to server. But my question is, if any system like that already exists?",AskEngineers,False,NSVL,/r/AskEngineers/comments/fwrepn/is_there_a_automated_way_to_measure_weight_for/
51,Could medieval tools and materials be used to build a wooden roller coaster?,1586288974,"Is it theoretically possible for medieval engineers to construct a functioning wooden roller coaster?  


If so, what would the limits on this be, could they make it loop for instance?",AskEngineers,False,doclazarusNSEA,/r/AskEngineers/comments/fwrasm/could_medieval_tools_and_materials_be_used_to/
52,Has anyone switched from a finance career to engineering? Need all and any advice!,1586288040,"Hi all, I’ve been working in finance as a sell-side quant for the last three years and have realized it’s not something I want to keep doing for the next 40 years, despite the career and pay trajectory...

Been working on figuring out what interests me and I’ve realized I very much like working with my hands and the types of problems engineers solve. Has anyone made the switch from a similar finance job to engineering before? How did you do it and what was it like? Do you find it fulfilling? Any advice for a newbie like me trying to figure things out? I’m thinking about something in the rewnewables/electrical space.

Thank you!!",AskEngineers,False,wandering-peach,/r/AskEngineers/comments/fwr091/has_anyone_switched_from_a_finance_career_to/
53,"I am applying to pursue a chemical engineering MS and on the off chance that I get in, what are the odds that I can still get licensure even if my undergraduate degree is not in engineering (Bio, minor in chem)?",1586287504,I’ve read somewhere that licensure in ChemE is rarely required or even beneficial so if that is the case that will help me feel better as well. I also have tried to find the answer on ABET’s website but they don’t seem to recognize that MS degrees exist or something.,AskEngineers,False,Beopenminded16,/r/AskEngineers/comments/fwqu54/i_am_applying_to_pursue_a_chemical_engineering_ms/
54,Best way to learn structural engineering?,1586285305,"Does anyone know of any good online courses for learning basic structural engineering?  I’m currently a mechanical engineering working in a manufacturing plant and often asked to design different structural platforms to be fabricated and used in our facility.  I enjoy the design and CAD aspect of it, but don’t have a whole lot of knowledge in structural design and often feel as if I over-engineer the structures and/or pay a PE to design/stamp them. I’d love to find a useful online course that would teach the basics of structural engineering to be more effective in my job. TIA.",AskEngineers,False,bbqengineer12,/r/AskEngineers/comments/fwq4xs/best_way_to_learn_structural_engineering/
55,Digital copies of thousands of physical documents?,1586284825,"Hello everyone!

We have an Engineering File Room at my work with thousands of documents dating back to the early 1900s. With COVID-19 and work from home policies, I’ve realized how useful it would be to have access to those documents in a digital format on a shared drive.

Does anyone know of a time-efficient method for scanning these documents? Our first thought is to hire summer help whose primary job is to scan each document but I don’t want to bore them to death. 

Thoughts? 

How has your company dealt with old engineering files that didn’t have digital copies? 

Thanks a bunch!!",AskEngineers,False,vincently,/r/AskEngineers/comments/fwpzn9/digital_copies_of_thousands_of_physical_documents/
56,Does it make sense to own a small electric oven for small dishes if you already have a large one?,1586284445,"Sorry for such a mundane question, but I didn't really know where else to put it, given that it has to do with electric design and physics more than with actual cooking.

I have an [IKEA Matalskare](https://www.ikea.com/gb/en/p/mataelskare-forced-air-oven-stainless-steel-colour-10368781/) oven in my kitchen. It's pretty big, and can cook two or even three large dishes at the same time.

It only rarely happens that I have that much food to cook. The majority of the times I turn it on it's to cook a refrigerated pizza, or a plate's worth of chicken. Nothing that needs the full size of the oven, or its full power - depending on setting it usually runs at 1800 (fan heater) or 2650W (top and bottom elements). 

Having a fairly spacious kitchen, I'm thinking I could add a small countertop oven - generally called ""toaster"" oven - to it. A fairly small unit - say, 26L, about what's needed to fit a supermarket pizza or large plate - would be very cheap. 

The idea would be that this way I'd use less power for smaller dishes, but I wonder if I'm just misunderstanding physics. 

A toaster oven usually has around 1500W worth of heating elements. I don't usually run the Matalskare at its full top-and-bottom 2650W setting, rather I prefer to use the fan element which runs at 1800W while still heating uniformly (I'd use less power with just one of the top or bottom elements, but then the food would get more heat on one side). So watt by watt I'm not really saving very much - but then you can't really make such a linear comparison, because the heaters aren't on all the time; once the set temperature is reached they're switched off until needed again.

I'm thinking a small oven has less air within itself to heat and significantly smaller metallic surfaces through which to disperse heat to the rest of the kitchen. In theory, would this not make for more efficient use of those 1500W?

---

To make a long question short, what I'm wondering if within the limits of common household units (that is, without considering professional or industrial ones) an oven is an oven is an oven, or if it makes any sense to size the oven according to what you need to cook; basically if it makes sense to acquire a smaller one to cook smaller dishes, or if the big oven would use about the same amount of power to achieve the same result and I'm worrying over nothing.",AskEngineers,False,IronMew,/r/AskEngineers/comments/fwpviv/does_it_make_sense_to_own_a_small_electric_oven/
57,Determining if actuator can move my part,1586283082,"Working on a little home project and it's been a long time since I've been in any physics classes. Can someone help me out? 

Not looking for just an answer but how I can get there on my own in case I change some of the variables.

I'm looking at [this](https://www.festo.com/us/en/a/download-document/datasheet/1845722/) actuator, using a bolt-on flange that they provide... and bolting an ""arm"" onto the top that flips back and forth (imagine something like a pinball bumper). It has a round hub with a bent piece of sheet metal welded on.

[Here's a quick sketch of what I have] (https://imgur.com/rb5Q4Z2). My ""arm"" and the flange it's bolted to weigh about 5.5 lbs.",AskEngineers,False,steelbydesign,/r/AskEngineers/comments/fwpg66/determining_if_actuator_can_move_my_part/
58,What jobs can Mechanical Engineering get me?,1586282989,"I'm currently a freshman in college, and I'm looking at majoring in mechanical engineering, but I'm not 100% sure what my opportunities would be after graduation. I would like to do something along the lines of product design, would this be the right major? Any advice or general tips would be amazing, thank you!",AskEngineers,False,Austin4239,/r/AskEngineers/comments/fwpf3v/what_jobs_can_mechanical_engineering_get_me/
