index,title,created_utc,selftext,subreddit,author,permalink
37,Starting to be put into a sales role. Sales manager says his division already pays for %20 of my salary.,1522993169,"I'm a design engineer at a small company. We have two divisions, materials sales and engineering. I'm part of the engineering group and have done a few cad drawings for the sales guys. 

Recently, the sales manager has asked me if I'd like to start getting into sales and I said yes as long as there's opportunity for commission/ salary increase and he seemed to agree that would be possible.

The next day, he tells me I can start doing sales on one afternoon per week so my engineering duties aren't compromised. He also said that his division pays  for %20 of my salary so might as well make it count. This is the first time I'm hearing this and this was never indicated to me on my job description/offer.

The thing is, I've never actually sat down with him and gone over the specifics of how this will work. Should I go talk to him and lay down my expectations and the ""rules"" of this? I want to be compensated extra for this work because now I'm doing work that was outside my job description. The thing is, this year our company didn't hand out bonuses since a lot of projects fell through. Is it still fair to ask for better compensation?

Thoughts?",AskEngineers,UnfazedButDazed,/r/AskEngineers/comments/8a72r6/starting_to_be_put_into_a_sales_role_sales/
38,Can you use clay to temporarily patch a gas line?,1522992903,I have an old stove at my restaurant where one of the gas lines inside the stove has corroded away and gas leaks out of it so that in the middle of the stove there's a flame where there shouldn't be. Repair guy said it would cost more to repair than to get a new one(it has multiple problems) We ordered a new stove but it takes 2 weeks to ship. If I can take clay and patch up the hole I feel like that should hold up for a little till the new one comes. Does anyone see anything wrong with that or have any better suggestions. I know this sounds dangerous but the stove basically always has high flames when they are cooking so it's really just an extra one in the middle of the stove top.,AskEngineers,whatsup4,/r/AskEngineers/comments/8a71y4/can_you_use_clay_to_temporarily_patch_a_gas_line/
39,Where you always good at math or did you struggle?,1522984952,"I was a bad student in high school and I never studied. I was always in trouble. I got my first job after getting my GED and I feel in love with it. I’m a CNC programmer at a company that makes parts for Exxon, BP and some military products. This job gave me the direction I never had in high school and I do my job very well. I have my limits though. My company has been very good to me and is willing to pay for 100% of my education. I’m really scared about going to engineering school. I never took anything higher than college algebra so I wanted to know if any of you started this way?",AskEngineers,houstonmilfs,/r/AskEngineers/comments/8a6ab8/where_you_always_good_at_math_or_did_you_struggle/
40,Composite Elevon/Aileron trailing edge bonding method,1522980054,"How would one go about assembling the trailing edge on a composite elevon/aileron?

I know one method is to simply bond the upper and lower skins together at the point they meet at the end of the trailing edge. Unfortunately, this method is prone to cracking or delaminating.

In the past, I've assembled trailing edges large enough that allowed me to design a spar (or wedge). The top of the spar bonded to the upper skin, and the bottom to the lower skin. 

This time, the trailing edge is incredibly narrow, so I can't fit a sort of wedge or spar to couple the skins together. 

How would you go about bonding an incredibly narrow trailing edge together? Essentially the airfoil is ramping down to a single edge that creates the trailing edge. Maybe somehow filling it with an expanding foam?

Thanks, sorry for the long post!",AskEngineers,here4fun111,/r/AskEngineers/comments/8a5qk1/composite_elevonaileron_trailing_edge_bonding/
41,Upcoming Internship Interview (EGR),1522975344,"I have an upcoming interview (my first - pretty nervous) at a company that specializes in EGR and EGR coolers. I've been researching the company quite a bit since setting up the interview, but still feel slightly unprepared.

The phone interviewer mentioned how the thermodynamics classes I've completed were relevant to the internship work.

My question is what thermodynamic sections/process is most relatable to EGR/cooling so that I can brush up. (Also, if you have any general interview advice, I'd really appreciate that).

Thanks!",AskEngineers,Trenmasterbol,/r/AskEngineers/comments/8a573m/upcoming_internship_interview_egr/
42,How do jet engines handle rain?,1522973701,How do jet engines handle/dissipate excessive water when they fly through rain or are forced to inhale water in other high water scenarios? ,AskEngineers,hangemhigh21,/r/AskEngineers/comments/8a4zwc/how_do_jet_engines_handle_rain/
43,Project ideas to break into controls engineering or embedded systems development as an ME?,1522973683,Currently an ME senior who has done an internship in systems engineering and web-app/general-app software development. Trying to think of a great way to allocate my time in order for me to market my skills to a company doing embedded systems programming or controls. Any advice?,AskEngineers,curiousengineerdude,/r/AskEngineers/comments/8a4zt8/project_ideas_to_break_into_controls_engineering/
44,Jet engines,1522972357,[removed],AskEngineers,hangemhigh21,/r/AskEngineers/comments/8a4u18/jet_engines/
45,What laser distance meter is best for measuring small displacements over time?,1522969394,"I'm doing a simple project for my engineering experimentation class.

I want use fourier transforms to find the fundamental frequency of some basic objects, like a spring, metal ruler, plastic knife etc.

I was thinking of putting the objects in a vice and just flicking them, letting them oscillate.

I think the easiest way to do this is to get a laser distance meter and use that to measure the displacement.

I'll need to put the displacement into excel vs time.

My question is, what is the best LDM for this?
Preferably the resolution of would be less than 1/10th mm, but smaller would be better, and it needs to plug into a computer and record the data and put it into a  .txt or  .xlsx file or something. Cost is a factor because we're all poor students.

What do you guys think? ",AskEngineers,germannhoering,/r/AskEngineers/comments/8a4h62/what_laser_distance_meter_is_best_for_measuring/
46,Taguchi Orthogonal Arrays Question,1522962219,"I am learning about Taguchi Method for Design of Experiments. 
I understand that there are set arrays for certain notations. For example a system with 4 factors and 3 levels will use a L9 array and that can be found as a standard array which you fill in. However what if my system has 5 factors and 2 levels? That results in L6. I can't find any L6 orthogonal arrays. What am I missing?

Thanks",AskEngineers,crasy8s,/r/AskEngineers/comments/8a3isc/taguchi_orthogonal_arrays_question/
47,Advice on refreshing my engineering knowledge after directly going to grad school for MBA,1522961739,I graduated in May of 2017 with a BS in ME. Directly after in the summer I began grad school for my MBA and have been a full time student since. I plan to graduate in August 2018 but will start working part time at a government contracting company in about a month suspecting I'll be doing general CAD with a little technical tasks as well. I've started to question if this was the best plan because I feel like my technical knowledge and skills have maybe depreciated a little bit being away from the field during this time. I've basically been a full time business student with no focus on any engineering work or projects since last May. Do any of you have any advice on ways I could best prepare myself to hop back into this field? Any feedback is appreciated. ,AskEngineers,JonStarkaryen998,/r/AskEngineers/comments/8a3gdh/advice_on_refreshing_my_engineering_knowledge/
48,Using differential gears to eliminate bump in a variable shaft,1522960616,"Hello, I am hoping someone can help me ""fill in the box"" in the image below. I would like to find a set of gears that would allow the two shafts to drive each other independent of the rotation of one shaft about the other. I think a differential gearset that uses an input from the fixed chassis would accomplish this but am struggling to demonstrate exactly how. 

https://i.imgur.com/OP6bnJ2.jpg

Thanks for your comments.",AskEngineers,politicsBgone,/r/AskEngineers/comments/8a3ar3/using_differential_gears_to_eliminate_bump_in_a/
49,What's the boundary line between electrical engineering and computer science?,1522958880,"I'm a CS student currently studying basic computer architecture as a required part of my degree. A decent amount of the material I'm learning is also stuff EEs would learn, and the course is even taught by an EE who worked as a chip designer for many years, and is quite fluent in multiple programming languages. 

I had never realized the two disciplines had so much in common before--but it certainly makes sense. It leads to wonder, is there a sharp dividing line between the two fields, or do things get kind of fuzzy in places?",AskEngineers,kovlin,/r/AskEngineers/comments/8a31t8/whats_the_boundary_line_between_electrical/
50,Bumpless gearset,1522957918,[removed],AskEngineers,politicsBgone,/r/AskEngineers/comments/8a2x0n/bumpless_gearset/
51,Tools of Scientific Discovery,1522956160,"I was wondering what fields have the most potential for scientific discovery, and what are some barriers that are preventing us.",AskEngineers,Teodor1374,/r/AskEngineers/comments/8a2o8w/tools_of_scientific_discovery/
52,What should you include on your resume?,1522955838,[removed],AskEngineers,oFishalJr,/r/AskEngineers/comments/8a2mnr/what_should_you_include_on_your_resume/
53,"Closed Cell Foam - Oil/Lubricant Resistance, Density and Compression Rate",1522953166,"So I'm working on a project in which I'm trying to use closed cell foam as a volume reducer in an air spring. The environment is ballpark about 150ºf, with lots of compression cycles per second with small amount of lubricant interacting with the volume reducer. 

My first question: what type of closed cell foam would be best as to not deteriorate due to synthetic lubricants?

2) Has anyone seen a ""sample pack"" of closed cell foam (with oil resistance) of varying densities and compression rates? 

3) What is the spectrum of density and compression rates common in closed cell foam? I've seen density listed like ""Density: 1.20"" and ""Compression Rate: 33lbs"". 

What I'd like to find is someplace where I can order a few 6"" x 1"" squares of varying densities of closed cell foam.",AskEngineers,Pollymath,/r/AskEngineers/comments/8a28wq/closed_cell_foam_oillubricant_resistance_density/
54,Anyone know the drug policies of major defense contractors? (e.g. Lockheed)?,1522952428,"I am pursuing an offer with Lockheed. Recently, they sent me a security questionnaire to see if I would be able to qualify for a clearance in the future. 

i have used marijuana once or twice, but that was 2 years ago. I have no interest in using again. Tbh, I almost forgot about it, but I didn't want to accidentally lie on any part of this form. 

If I admit my use,  am I DQ'ed? I know I will pass the drug/pee test and background check. I have no record. But if I lie here, won't I have to lie when getting a security clearance? ",AskEngineers,_Lebron_James-,/r/AskEngineers/comments/8a24ue/anyone_know_the_drug_policies_of_major_defense/
55,Why are heat sinks not designed like fractals in the same way antennas are if surface area exposed to fluid flow is key to heat dissipation?,1522952321,,AskEngineers,Idontknowhowtobeanon,/r/AskEngineers/comments/8a24d1/why_are_heat_sinks_not_designed_like_fractals_in/
56,Looking for feedback on this PID implementation,1522950959,"I implemented PID for my quadcopter and it flies better than I thought. However, I only use the P term for both stages of the PID cascade (on angular rate and on angle). The I and D terms were actually decreasing controller performance (note that I did not do any filtering on the D term).

I decided to turn my PID algorithm implementation into a library for Arduino. I would like some feedback and criticism on this:

https://github.com/barafael/variPID

Especially, are there clues why the I and D terms might not work that well? The D term resulted in very short bursts of change and the I term lead to oscillations or was not noticeable. Just with P, there is no discernable steady-state-error, and there is almost no overshoot and only slight oscillations when the system is really brought to the extremes. The IMU sensor in my application is extremely good, so that might be a reason why the controller is so stable.",AskEngineers,rafaelement,/r/AskEngineers/comments/8a1x5v/looking_for_feedback_on_this_pid_implementation/
57,Post grad plans advice,1522948947,"Let me know if there's a more appropriate subreddit to ask this question, like /r/engineeringstudents or /r/askacademia

I'm a senior BME/EE graduating this year that is fortunate enough to have two appealing post grad options but I've been having trouble deciding on which one to focus on. I would like to know your thoughts about my situation. 

As background, I'm interested in a career in R&amp;D ideally in the medical device space, whether its in academia or industry or some other lab. To achieve this, I applied to master's and doctorate programs and managed to get into some good schools, one of which that I think would be awesome to attend for a particular advisor and their research project. However, by luck I also managed to land a summer internship at a university-affiliated research lab that does a lot of interesting government-funded work. The project itself is also relevant to my research interests, and from what I remember the researcher interviewing me mentioned potential for part-time work during the school year. I'll mention that since I'm graduating, I would be completing a MS the next academic year which made me eligible for the internship in the first place due to having graduate (either at university or other grad school) student status. While its obviously not guaranteed, many folks I know who work at this lab get return offers so I believe it would be likely to work there after finishing a MS. To sum it up, I'm trying to figure out how to proceed within the next week/before 4/15 by these paths:

1) Commit to the PhD in BME. I really liked my first impression of my choice advisor and their project is really interesting and impactful and would allow me to get a strong skillset in signal processing/machine learning which is relevant to both BME and EE. They've only had a few graduate students since they're a fairly young professor so its hard to tell about post-grad options. However, my impression of the school for some other aspects wasn't that great as the city the school is situated in is definitely smaller than places I've lived in and the weather was more harsh, which I think showed in some of the grad student's mood during the visit weekend. I think I would acclimate to living there but can't deny that the winters there would have an impact.

2) Stay for another year at my university for a MS in EE and try to work at the research lab afterwards. It seems like a more risky move since I won't know how this summer goes, and consequently won't know whether I like working there or if I get a return offer or not, but I also would only have to do one more year of schooling and would have the chance to earn more than a doctorate student's stipend. Even though its not really meaningful, I've always been interested in working at this lab during the summer but have not had luck landing a spot there until this year. For doing the MS, I'd also would be able to focus on learning signal processing and control theory and have more flexibility in employment options as EE even though I want to pursue medical device-related work. I'm fortunate enough to not have to worry about funding the MS but I do aim to supplement finances with TA'ing.

I would like to know what y'all think. Let me know if you want to know any more details. Any opinions are welcome!",AskEngineers,StrangeNeuron,/r/AskEngineers/comments/8a1mk0/post_grad_plans_advice/
58,Anyone in the Renewable Energy industry?,1522946038,"Hello, I am currently part of a 4 year ME program and I am finishing up my 2nd year very soon. But I have decided to change my program to Renewable Enegery Tech as I want to get into power generation and do alot of travel. I was hoping to get some insight on the industry and I have a few questions about the Renewable Energy industry if some of you would'nt mind answering for me perhaps?

1. What is your role/job?

2. How is the career development in the field? Is there alot of oppotunity?

3. How frequently do you travel in the industry?

4. What is a typical day on the job for you?

5. What are some of the pros and cons of your job?",AskEngineers,XHuntsX,/r/AskEngineers/comments/8a17i5/anyone_in_the_renewable_energy_industry/
59,Are there food grade centrifugal pumps I can use to transfer a juice form a tanker?,1522945074,Most of the options available are positive displacement pumps. I am looking for a pump that I can get a maximum flow rate of while still keeping FDA rules and Other Standards Rules. So my questions is should is there a pump standard that I should look for when choosing my pumps and what pump would you recommend. Thank you,AskEngineers,Melesani,/r/AskEngineers/comments/8a12mx/are_there_food_grade_centrifugal_pumps_i_can_use/
60,Does anyone know the etymology of inconel?,1522942031,"I know inconel is a genericised trademark or proper name that *Special Metals Corporation* chose for a certain family of their (previously patented) nickel-rich alloys, but does anyone know the origin of the word? I.e. if it ever stood for anything in particular and what the name was derived from? Industrial-cobalt-nickel-something?

Again, I am NOT asking what it is, but what the origin of the name for it is.",AskEngineers,PM_me_UR_duckfacepix,/r/AskEngineers/comments/8a0n2f/does_anyone_know_the_etymology_of_inconel/
61,Engineers- How to be more knowledgeable?,1522941425,"Recent grad, electrical engineer here. My coworker, who’s been in the industry for 30-40 years, talked about how it was much more rigorous to graduate college back in the days. When he mentors people, he starts out with a highschool student textbook, and calculus/ circuits/ etc. He is the lead engineer in the team (not my team), and he is a key member in design engineering team. 
How do I stay sharp and keep progressing in engineering in a corporate environment?

Currently, I rarely study anything aside from work. And at work, only 5-10% of my time is being used for technical &amp; engineering skills. 

Specifically asking for self-study tips, helpful fundamental EE material recommendations, or thoughts on whether self-study is necessary or not. 
Thanks.",AskEngineers,roalgifxrl,/r/AskEngineers/comments/8a0k12/engineers_how_to_be_more_knowledgeable/
62,Where to find PLM spreadsheet alternatives?,1522936243,"I'm working with a small group on engineering a complex widget. At work, i'd normally use Teamcenter as the plm, but i need something that isn't a $$$$ plm where I can manage CAD and the subsequent stiffness, failure, normal modes and CFD CAE revisions as they are made Is there a site where people upload simple spreadsheets like this? I'd make my own, but I'd rather not reinvent the wheel if there's an example of someone who has already done it better. ",AskEngineers,brainguy222,/r/AskEngineers/comments/89zukz/where_to_find_plm_spreadsheet_alternatives/
63,Can someone recommend me a book regarding the Wright brothers?,1522929777,"Specifically regarding all the R&amp;D process they did to get to their plane. I went to the Science Museum in London some days ago with a volunteer guide who explained to us how these guys were so calculated compared to other in their time, going through the whole design process, possibly also inventing some fundamentals of wind tunnels and CFD and other concepts of field testing.

Is there any book about them that goes extensively through this whole process? or videos or anything else? Thanks ;)",AskEngineers,mamacita68and1,/r/AskEngineers/comments/89z3oj/can_someone_recommend_me_a_book_regarding_the/
64,Worried About Future Prospects?,1522924898,"Not sure if this belongs here, but I wanted an engineer's perspective. 

I keep reading that a lot of us engineers do not necessarily get the engineering job title and do not really work in an engineering position. I am kind of in that boat. I will be graduating this Summer with a chemical engineering degree, but I have been working at a company for 2 years as a product analyst. The company has been great and I've learned a lot and I am still learning.  The company is more of a startup so I do a lot of correspondent work, reviewing contracts, help manage operations etc , but I do not really have any engineering experience. I am hoping that will happen soon as this company manages some plants that product metals. 

I guess my question is if in the future I have to apply to future jobs would I not be able to apply for chemical engineering jobs  in general? My ultimate goal is to get a MBA and  land a management role.

I am sure I probably left some important details out, but I ll post whats needed based on comments,",AskEngineers,Optimisticz,/r/AskEngineers/comments/89ymyl/worried_about_future_prospects/
65,How does a mechanical engineer become a marine engineer?,1522916850,How does a mechanical engineer become a marine engineer?,AskEngineers,auvvvv,/r/AskEngineers/comments/89y0ew/how_does_a_mechanical_engineer_become_a_marine/
66,What type of Engineering degree is best for space study/exploration or renewable energy?,1522911918,I am in my first year of university and deciding between engineering and physics. I am deeply in love with space but I feel like engineering can get me more. Also which field is best for renewable sources. I know space and renewable sources are very different but any feedback is awesome. Thanks!,AskEngineers,bgrewal,/r/AskEngineers/comments/89xmue/what_type_of_engineering_degree_is_best_for_space/
67,What is wrong with this perpetual motion machine?,1522911532,"First, I'm not suggesting it would work, just that I can't see the rub yet. 

A vacuum at 1 atmosphere of pressure  has potential energy right. As the surrounding air seeks equilibrium it exerts a force that could be captured.  

So in a sense you could use vaccum chambers as a kind of battery.  

If we had a space elevator that could drive traffic up and down at the same time, using the downward momentum to offset the cost of raising cargo on the other side. 

So an array of vacuum batteries could be raised into space (offset by the energy of the batteries coming down). They are then ""Filled"" with vacuum by closing them while out of the atmosphere then lowered back to earth and when their deep in the atmosphere the potential energy of the vacumm is extracted and they are raised back up. 

I know its impractical and if we had a space elevator we could do better stuff with it. 

Its just a thought experiment, and its annoying me that I can't see why it wouldn't work. ",AskEngineers,mrDecency,/r/AskEngineers/comments/89xlpz/what_is_wrong_with_this_perpetual_motion_machine/
68,What to study along with Geology?,1522901567,"I'm doing a BSc in geology and am unsure where to specialise, whether it be in engineering geology, petroleum, anything really. I'm at UC in NZ and I have two spare subjects for semester two in 2018. What are the differences between petroleum geologists and petroleum engineers? If I were to go into the petroleum industry what maths and physics papers would benefit me? I can take any first or second year papers if anyone can help me decide! The options for physics are Relativistic and Quantum Physics and Electromagnetism and Materials. There is also a waves and optics paper which I would have to wait until next year to take which would be fine. For maths there are Linear algebra, DE, multivariable calc, mathematical modelling and computation. Also any other recommendations that are not included here will help! Thanks in advance!",AskEngineers,Tyzp,/r/AskEngineers/comments/89wp94/what_to_study_along_with_geology/
69,"How can I design a similar cross brace system on an underfloor system to resist 2500 plf, with a length of 19 ft to work with?",1522901192,[https://i.imgur.com/WTENCGz.jpg](https://i.imgur.com/WTENCGz.jpg),AskEngineers,bigb0ned,/r/AskEngineers/comments/89wnul/how_can_i_design_a_similar_cross_brace_system_on/
