index,title,created_utc,selftext,subreddit,media_only,author,permalink
60,Master’s Thesis with a company,1571279681,"Hi all,

Young engineer here looking for some advice! I’ve recently started my Masters of Science in ECE this past September at a Canadian University. My professor/supervisor is very lenient on what I can choose my thesis focus on. The focus of my thesis will be in the field of Deep Learning and Image Processing.

I was hoping to approach companies to see if I could collaborate on a research project with them. I’m interested in autonomous driving or space applications so I’m trying to find companies within those industries to collab with.  At the moment, I’m just trying to connect with people on LinkedIn and seeing if they’re able to meet with me about it. 

Has anyone here successfully pulled something like this off? Is it a possibility, if so, how did you go about achieving it?",AskEngineers,False,ryeng_stark,/r/AskEngineers/comments/dj00ep/masters_thesis_with_a_company/
61,Comparing non-magnetic metals.,1571279661,[removed],AskEngineers,False,NoMoreGonnaDo,/r/AskEngineers/comments/dj00am/comparing_nonmagnetic_metals/
62,From an engineering role to management consulting?,1571278108,"Has anyone here worked in an engineering role for a few years and then transitioned to a consulting company? 

Why/how did you do it? Did you need an MBA? Was the cost of that MBA worth it in the end?

I’m asking because it’s my last year as a mechanical engineering senior and didn’t get offers from any consulting companies...so looks like I’ll have to accept my offer from this construction company (solar, project engineer). But, I feel like I’ll want to eventually work in consulting.",AskEngineers,False,futurequestionmarks,/r/AskEngineers/comments/dizow5/from_an_engineering_role_to_management_consulting/
63,How safe is it to have a robust home gym in your apartment? What is the maximum amount of weight that apartment floors can handle before failure?,1571276327,"

I live in China. I just moved into a new apartment. The closest gym is a prohibitive distance away. I would like to purchase a power/squat rack for my apartment. Noise is not an issue.

I live on the 15th floor, and the apartments are made from concrete similar to [this](https://imgur.com/8XayOQk). The floors are tile. I am planning on purchasing a couple layers of plywood or particle board panels for the floor along with rubber mats. Peak mass between me, the [squat rack and accessories](https://imgur.com/MO2tpOP), and the weights is probably 450kg. But its probably going to be mostly below 350kg.

Is there any risk of failure of the floor from this much weight? What is the best way to mitigate damage to the tiles? What location in a 3/2 with a large living room would be the best bet? Is one of the spare room okay, or should I make room in the living room instead?",AskEngineers,False,LessWeakness,/r/AskEngineers/comments/dizc6w/how_safe_is_it_to_have_a_robust_home_gym_in_your/
64,Biomed!,1571276302,[removed],AskEngineers,False,TheKiwiCaptain,/r/AskEngineers/comments/dizc05/biomed/
65,"Transmission Line Engineers, I have a few questions for you if you don't mind...",1571269900,"I am graduating with an electrical engineering degree this December and I am currently on the job hunt. I have an interview for a Transmission Line Engineer position and the job sounds pretty interesting to me, but I have a few questions. I realize that some of these can be answered during the interview but I am eager to know.. Thanks in advance!

1. Why do they accept EE's for this job when it seems like they prefer CE's? 
2. If I work as a t-line engineer while holding an electrical engineering degree, can I still pursue an electrical PE license, or will I have to pursue a civil PE license?
3. How much of a disadvantage will I be at considering I haven't studied civil engineering? It seems like a majority of the work is civil related. I definitely enjoy studying electrical, but I find structural/material studies interesting also.
4. Is the salary and potential growth close to what I would expect in a more typical electrical engineering job role?",AskEngineers,False,Jtstien,/r/AskEngineers/comments/diy26v/transmission_line_engineers_i_have_a_few/
66,ANSYS Curve Fitting Model for Ogden Models,1571267220,"Hello

Does anyone know what method ANSYS use to solve curve fitting for Ogden 1st order models and estimate the MU and ALPHA parameters?

Thanks",AskEngineers,False,StefanIstas89,/r/AskEngineers/comments/dixi6a/ansys_curve_fitting_model_for_ogden_models/
67,Discussion: Mid-career engineers - What non-technical activities helped your career grow and rewarding?,1571266710,Just curious what worked for people.,AskEngineers,False,bdafsi91,/r/AskEngineers/comments/dixdrw/discussion_midcareer_engineers_what_nontechnical/
68,Clarification on how exhaust gas flow spins a turbocharger's turbine. (Automotive applications),1571266423,So I'm getting conflicting answers on whether or not the turbine converts heat energy from the exhaust gas flow into kinetic energy on the turbine which then drives the compressor etc. Or if it's due to the drop in pressure of the flow as it expands when the flow leaves the volute of the turbine housing and onto the turbine blades themselves?,AskEngineers,False,KyogreHype,/r/AskEngineers/comments/dixbj1/clarification_on_how_exhaust_gas_flow_spins_a/
69,"Amazing gas engineers, hot zone regs!",1571265149,"Does any one know the regs that have the ‘hot zone’ dimensions for gas cooker installation Info in them. Been looking for a few hours now and can’t find anything apart from pictures online, HSE also came up blank, (I also need the regulation details so just pictures won’t do) decided I eventually need help before I go crazy, thanks guys!",AskEngineers,False,reddit-lordy,/r/AskEngineers/comments/dix13q/amazing_gas_engineers_hot_zone_regs/
70,Non-engineering careers for engineering majors?,1571263567,"I chose mechanical engineering as a major not because I had any specific career interests but because I’m strong in math and science and wanted something that would at least make me highly employable on paper. I may not be interested in a serious career at all (very committed to my hobbies), but I do love what I’m studying and think I’d be even more satisfied at my job if I got to apply these skills. Is there some kind of job that’s less of a time/life commitment than engineering, but will still make use of problem solving, design, math etc? Pay not a factor",AskEngineers,False,a_surreal_goat,/r/AskEngineers/comments/diwo0t/nonengineering_careers_for_engineering_majors/
71,Suggestions for mechanical parts?,1571263277,"I've been having a hard time matching up mechanical parts for a prototype I'm making which will require a high degree of precision. The base of the machine will turn a large cylindrical plastic (UHMWPE) bearing (lubricated with PTFE dry lube) with axial load of a couple hundred pounds. This seems like a better option than spending thousands on a slew bearing. The motor and the gears need to be about 15 inches away (radially), so it seems to me that ideal power transmission would entail using an HTD Timing pulley system or pulling a chain. Here is a simplified schematic of the section of the machine which is troublesome:  [https://imgur.com/a/l0KPP5k](https://imgur.com/a/l0KPP5k) 

&amp;#x200B;

Here's where I'm having trouble. At the end of the belt that is 15 inches away from the axis of rotation, obviously I'll need the other HTD pulley wheel. What is not so obvious to me are choices of components and parts. I want to attach the shaft (C2 in the figure) to both a pulley wheel and a gear. The problem as I see it is that pulley wheels are attached to bushings which take a key, so I need a shaft with a key slot. However, if I want a gear on the same shaft, it would need to have a key slot of the same size as well. The shafts for gears rarely have keys though.

&amp;#x200B;

I've been searching and searching on the McMaster Carr site, but it seems to me that shafts which fit pulley wheel bushings are different from shafts for gears. If I want a gear and a pulley wheel on the same shaft, how is best to achieve this without coupling 2 different shafts? Also, at the intersections of C2 and C3 with P1 and P2, how should I set the rods to rotate? Should I use sleeve bushings? Bearings? How is this done in practice? Or, am I going about this all wrong? Please note that gear boxes are not an option for me. I need large strong gears which are cost effective. 

&amp;#x200B;

Any suggestions are welcome. Thanks.",AskEngineers,False,Quality_Salt,/r/AskEngineers/comments/diwlc9/suggestions_for_mechanical_parts/
72,Powering a TEC cell with a TEG cell,1571259892,"m doing this project where Im trying to power a TEC to make a little cooler, by generating power from a TEG in a car engine. Im a big noob on this so Im not sure how viable it is. Im planning on using a  SP1848-27145 as my TEG and a TEC1-12705 as my TEC, as that is what I can get at the moment. The lable states that the TEG can generate 4.8V at 669mA; and TECs that voltage is 12V, Umax 15.2V and Imax 5A.

My main question is how much TEGs would a need to power the TEC, and whether it is posible to feed the TEC with values lower than the ones stated, and still being able to lower the temperature.

I would apreciate any further advice you can give me",AskEngineers,False,tobe01,/r/AskEngineers/comments/divs8w/powering_a_tec_cell_with_a_teg_cell/
73,Which of the following typically provides a tighter fit?,1571259481," Interference fit

Slip fit. 

Lube fit 

Bore fit",AskEngineers,False,Jacksonace99,/r/AskEngineers/comments/divoj0/which_of_the_following_typically_provides_a/
74,Environmental Engineering,1571258571,[removed],AskEngineers,False,lizzard121,/r/AskEngineers/comments/divgmc/environmental_engineering/
75,Help! Specific question about Space capsule for a presentation - High School,1571258335," Hi there,

I'm still in high school (17) and have a presentation to make about space travel (and it's not going to be my last one). So I chose a less chosen theme to talk about which is the returning of the astronauts back to earth from space. While collecting some info I stumbled on something that somehow isn't clear enough to me: (since I'm interested in it as well outside of school)

While entering the earth's atmosphere with the capsule/command module, which has a heatshield on its bottom to protect the people within, the shield protects the model for several minutes from the enormous heat until it's through the atmosphere enough to deploy the parachutes at an altitude of ca. 2 miles. According to Wikipedia ""the surface of a capsule can get to 1480 °C (2700 F) as it descends through the Earth's atmosphere. ""

**Apollo 15 splashdown:** [**https://youtu.be/0T5t8eBnjS4**](https://youtu.be/0T5t8eBnjS4)

**SpaceX Dragon capsule splashdown:** [**https://youtu.be/\_zF7PF7tpGI?t=243**](https://youtu.be/_zF7PF7tpGI?t=243)

I don't get why there is no steam (in all splashdowns as I've seen on the net) from the water that vaporizes due to the hot shield. How is it possible that it isn't even a 100°C hot to make some little steam around the capsule? Even Lava is between 700° and 1,200°C and it steams like crazy when it comes into contact with water. What amount of time would the heatshield and the rest of the module have to cooldown from almost 1500°C/2732°F in a standard procedure between entering the atmosphere and till final splashdown? Is there a way to calculate the temperature approximately by knowing the heatshields construction and airspeed after the parachutes are deployed? So that we could say for example ""after the parachutes are deployed, the shield cools down with ca. x°C per second"".

I mean like, **for example**, the module has a speed of 30 mph after the parachute deployment which happens at 2 Miles altitude, which would give the shield a timeframe of 4 minutes to cool down below min. 100°C to not make any steam on contact. Meaning, the shield has to cool down 370°C /min. or 6°C /sec.

Is there a specific answer to that? Can I find a kind of a *detailed* protocol of the whole procedure with exact numbers? (documents preferred over video) Like an explanation of how this happens? I can't find any specific answer to special material or ""space capsule heatshield cooling system"" that could deliver such a cooling rate.

I found some helpful pdf here ( [https://www.hq.nasa.gov/alsj/CSM06\_Command\_Module\_Overview\_pp39-52.pdf](https://www.hq.nasa.gov/alsj/CSM06_Command_Module_Overview_pp39-52.pdf) ) to copy some info for the presentation, but still, not exactly what gets my attention the most. I can find some articles about the capsules, but what I'm looking for are numbers from a source like NASA. (i posted this in another subreddit as well in the hope to get faster answers)

I hope some people here could help me out somehow since I'm really into it. Thanks in advance!",AskEngineers,False,Abitlostindigo,/r/AskEngineers/comments/diveig/help_specific_question_about_space_capsule_for_a/
76,Need to interview a civil engineer,1571257617,[removed],AskEngineers,False,mhh1997,/r/AskEngineers/comments/div80u/need_to_interview_a_civil_engineer/
77,"Please, could you give me advice for my undergraduate final project on automation?",1571256054,"Hello.  
I've  been working on my final engineering project this year, and working partime as  well. For my final project I choose to automate a gypsum/plaster  production system, with a rotary kiln, pretty much like those plants to  produce cement, but at a medium scale. Gypsum happens to be produced at  more or less 150°C, so requeriments are not so extreme as cement or  quicklime/lime.

I'm happy about my  theme, but it is quite extensive, and I'm begining to lose focus. I  have to work on the mechanical, electrical, and control systems. How  deep I dive on any of those subjects is on me... just one machine is  enough to write a project/paper about, let alone a complete process, so  I'm a bit lost and afraid about the presentation being too  rushed/superficial. The time to do the presentation is quite short, 45  to 50 minutes. I also need to show parts of the systems working on that  time. I'm going to show the scada with a funtional model of the kiln,  but even then time is my concern.

What  are the most important points of showing how to automate a process?  What should I focus on? What would you like to hear when somebody says  that he/she is automating a system? what would you ask to that person to  see if he/she knows what is he/she doing?",AskEngineers,False,lenniad,/r/AskEngineers/comments/diuui5/please_could_you_give_me_advice_for_my/
78,Any packaging engineers out there?,1571255157,"I'm graduating with a mechanical engineering degree this December and have a full-time job offer as a packaging engineer, which I had never heard of before. 

What's it been like for you? 

What should I try to learn about before I start?

Any input is much appreciated!",AskEngineers,False,MrMagistrate,/r/AskEngineers/comments/diumjx/any_packaging_engineers_out_there/
79,Could you use a barrel full of water to draw a powerful vacuum?,1571254654,"A 50 gallon drum for instance, holds more than 400lbs of water. If the top was sealed, and the bottom of the barrel was open, and that barrel was submerged in a larger container (like a garbage can) how many lbs of vacuum could you pull? Would that be dictated by the diameter of the vacuum line attached to the top of the barrel?",AskEngineers,False,stonep0ny,/r/AskEngineers/comments/diui42/could_you_use_a_barrel_full_of_water_to_draw_a/
80,Helpful Resources for Material Science,1571252929,"Hey all, I'm kind of struggling in Material Science and I'm wondering if anyone knows any good resources. I tend to learn best through videos but I can't really find many on YouTube. Usually I just do practice exams and then go back and learn what I didn't know through videos. Any help is appreciated!",AskEngineers,False,idonthaveklutch,/r/AskEngineers/comments/diu2py/helpful_resources_for_material_science/
81,Experience or potential mental health?,1571252276,"Hello! Myself and two friends are all having quite a dilemma right now. We are all seniors and have received job offers in our college towns (upper Midwest cities), all from our internship employers. However, we were hoping to move somewhere out of the Midwest. Would taking these jobs for experience and then searching for something else be better than declining and doing the entire job hunting process? I know there's a lot of variables involved but I am dying to get out of the Midwest. And advice is appreciated.

TL;DR Should I take a good job offer in a boring place or decline and go job hunting somewhere I want to live?",AskEngineers,False,innovgte,/r/AskEngineers/comments/ditwrc/experience_or_potential_mental_health/
82,Which engineering project would be better? Night Vision or an Alarm Clock,1571252070,For our high school engineering project our solutions have been narrowed down to affordable night vision goggles and an alarm clock that appeals to 4/5 senses. In your opinion which one is better?,AskEngineers,False,Gleach999,/r/AskEngineers/comments/dituxv/which_engineering_project_would_be_better_night/
83,Engineering Project,1571251442,Which engineering project is better? Affordable Night Vision Goggles or an alarm clock that appeals to 4 of your 5 senses.,AskEngineers,False,Gleach999,/r/AskEngineers/comments/ditpi0/engineering_project/
84,Suggest me a sensor to determine the level of liquid in a 90ft silo,1571248995,"I am looking for a sensor which is easy to use and can be used with a microcontroller, I want to know the level of fluid in a 90ft silo. Don't want to go for a high end industrial sensors because this is just a hobby project.
Any suggestion is welcome",AskEngineers,False,iwannalearnchemistry,/r/AskEngineers/comments/dit586/suggest_me_a_sensor_to_determine_the_level_of/
85,What percentage of what you learned in college do you actually use in your job?,1571248577,"Just became a freshman in Engineering Physics and there are some subjects that seem pretty irrelevant, hence why I'm curious.",AskEngineers,False,lauralvilela,/r/AskEngineers/comments/dit1gb/what_percentage_of_what_you_learned_in_college_do/
86,How can I measure the diameter of a small hole?,1571248186,"Hi, I’m getting a duplicate made of a part that I have found and need to produce a sketch to take to the guy who’s machining it but there is a small hole on the part that I can’t measure with my callipers, if I measure the size of the screw that’s in the hole will that work? The screw has a flat end rather than a pointed one
Thanks",AskEngineers,False,balance_arc,/r/AskEngineers/comments/disy2b/how_can_i_measure_the_diameter_of_a_small_hole/
87,Good linear encoder vendors? Looking 50 micrometer precision.,1571245458,"Looking for a 500mm range and 50 micrometer accuracy incremental linear encoder. Any good vendors you guys recommend? Looking for something around 500$, max 1000$",AskEngineers,False,6weekcycle6,/r/AskEngineers/comments/dis9yh/good_linear_encoder_vendors_looking_50_micrometer/
88,Reading an incremental linear encoder output to my laptop?,1571242921,[removed],AskEngineers,False,6weekcycle6,/r/AskEngineers/comments/dirnbm/reading_an_incremental_linear_encoder_output_to/
89,Portfolios for job applications,1571242753,"Quick background:  I have 5 years experience in structural engineering.  I've worked for the same company since I graduated, and have designed exclusively electric utility structures. 


The question:  I have recently started to look into new jobs, with the intent of moving from electric utility design into building design.  A couple companies have the option to upload a portfolio as part of their online applications.  What kind of information are hiring managers hoping to see in this portfolio?  Maybe drawings to go along with some of the major projects listed in my resume?  Pictures of completed structures?  Any advice yall could give would be helpful. 


Thanks!",AskEngineers,False,NCbeans,/r/AskEngineers/comments/dirltb/portfolios_for_job_applications/
90,Hydrogen/Chemical/Refinery Plant Process Engineering - For Hydrogen purification looking to calculate PSA electricity consumption. Help!,1571241448,"Hello everyone.

**TLDR: I need help finding how much energy a PSA specifically consumes in a hydrogen purification plant at multiple scales (SMR)**

I turn to you o' ever wise internet for help. [I'm an entrepreneur](https://www.linkedin.com/in/andrelorenceau), working with a [pretty damn cool Scientist](https://www.linkedin.com/in/ali-naderi-01/) in [an awesome program](https://www.joinef.com)

Ali (the Scientist) has developed a Hydrogen purification membrane that is truly multiple factors of much better than anything we've been able to find both commercially and in research papers. He's combined multiple of his polymeric inventions together to make one that has far better selectivity (read: efficiency), heat and pressure tolerance (read: major cost savings on cooling/depressurizing gas) and even high permeability (flow-rate-ish). So much so, that we think we can really replace a large amount of PSAs with higher capacities. 

If you know how SMR/PSAs works, skip this paragraph - To get hydrogen, basically you take natural gas, you put it in a 'steam methane reactor' (SMR) which does chemical stuff (science term) to the gas, pass it through another 'water gas shift reactor' to enhance the amount of hydrogen, then through a heat exchanger to cool it down so you can put it in a 'pressure shift adsorber' or PSA which separates the Hydrogen from it. Voila, pure hydrogen from Natural Gas. Believe me, this is the easy version of this explanation.

We know our 'total cost of ownership' at 100 / 1,000 / 10,000 / 100,000 Nm\^3/H but we are struggling much more on calculating the price at those same volumes for a PSA system. 

We have extrapolated from an old DOE study ""DTI Task 2 Report HFA, Archive of the internet, NREL DOE"" but for reasons, that's a bit of a stretch. Overall we have not managed to find a consistent way to calculate Energy expenditure for PSA systems. Chemicals like Zeolites we can figure out by size of bed, and size of bed, straight up from Alibaba, but energy of PSAs is a mystery, especially since you have to include the necessary heat exchanger.

Cost of the whole PSA (minus shipping install and maintenance) is hardware (bed) + chemicals (Zeolite) + Energy. I can't figure out energy, please help. I find the energy expenditure of a whole SMR process, but it's proven extremely difficult to find a reliable method for pricing PSA energy expenditure for a 100 / 1,000 / 10,000 / 100,000 system. I realize they have different design and vary, but there's gotta be a rule of thumb. or at least raw data. 

Any comments are welcome but if the internet gods would be kind enough to give me a way to talk to an expert on the topic I would be forever thankful.",AskEngineers,False,Lorandre,/r/AskEngineers/comments/dirafs/hydrogenchemicalrefinery_plant_process/
91,Best way to sense water level in a small tank?,1571240315,"I have a firefighting robot project. 

One of the requirements is that it must be able to take on 300ml of water into a tank of some sort. When it senses that 300ml has been added, it must indicate so, by LED. 

My issue comes with measuring the water. My thinking is to use one of the red strip sensors like what come with Arduino kits. 

Problem is that I want to measure the top level where the LED comes on but also a level that is ‘almost empty’ to tell the pump to turn off so it doesn’t run dry. Those sensor strips cannot be submerged in water. 

Any ideas or thoughts would be appreciated.",AskEngineers,False,apricotcarguy,/r/AskEngineers/comments/dir11i/best_way_to_sense_water_level_in_a_small_tank/
92,"Do you have any research papers that you think are particularly interesting, and well laid out?",1571239203,"I'm about to start writing my dissertation (3rd year Engineering). I want to get a feel for how good, interesting papers are written. Some shorter papers would be good I guess. But any topic, I don't mind.",AskEngineers,False,CrimzonGryphon,/r/AskEngineers/comments/diqrhu/do_you_have_any_research_papers_that_you_think/
93,How to learn Fusion 360 as a novice?,1571239149,"I want to design a computer case and someone told me Fusion 360 would be the best choice. I know a little bit about SketchUp and Blender, so I'm somewhat comfortable using a 3D interface, but that's about it.

So where should I start? YouTube, the integrated manual, or maybe there's a book?

Also, I have no engineering background but I did really well in calculus.",AskEngineers,False,ObviousLocal2,/r/AskEngineers/comments/diqqzp/how_to_learn_fusion_360_as_a_novice/
94,Thermal expansion - does it ever make things 'smaller'?,1571238389,"If I heat up a washer, the inner and outer diameters are increased slightly by thermal expansion. But if it was a hole in a large sheet and only the hole area was heated, would the thermal expansion decrease the size of the hole?

This has lingered in my head for a while. I can see how heating a whole washer increases both the inner and outer diameter, as the net area of the new shape is greater, but are there situations where heating and expanding a material results in an undesired (or desired?) tightening effect?

Would you use extreme cold in some situations to enlarge a 'contained hole'?",AskEngineers,False,thefonztm,/r/AskEngineers/comments/diqksj/thermal_expansion_does_it_ever_make_things_smaller/
