index,title,created_utc,selftext,subreddit,media_only,author,permalink
2,"So, pre covid 19 I (firmware engineer) was gearing up to argue for a promotion at my work. Now I do not know what to do?",1586643565,"I am a firmware engineer at a company...that is experiencing this economy like most other companies. Luckily we are in a position to weather the short term, but our CEO has been super honest with us, and the future uncertainty is a serious issue. He has told us he is considering everything from raise freezes, deferring matching contributions for the 401k, to, if it really goes bad furloughs. None of this is happening now, and none of this is happening in the next month or so, but, essentially the company is worried about a potential slowdown in new work over the next 3 months. Before all of this I was going to talk to my management about a promotion. My task leads have all hinted that I deserved one etc., but given the current circumstances I want to look like a real team player, and not like an ass demanding things when I'm lucky to have a job. What do I do?",AskEngineers,False,nocomment_95,/r/AskEngineers/comments/fzkclp/so_pre_covid_19_i_firmware_engineer_was_gearing/
3,Should I switch from my BSMET program to BSME?,1586643241,"First post.

A little bit of background on my situation. I am a senior in highschool and am currently dual enrolled my local community in a mechanical engineering technology program and have over a year of credit under my belt that transfers directly to the local university( Old Dominion University). All programs are ABET accredited, both MET and ME. I am also in the process of Initial entry training (IET) for the National Guard, and plan on getting commissioned as an officer after I graduate.


Having this in mind, I've been thinking about whether or not I should switch from MET. I know that there are different types of engineering functions that can be done by both, and the different job opportunities of both. And I feel MET is more suited to me and enjoy it emencly. Though I like the outlook of ME better. Simply put, after I'm done with the military I think I'll have more opportunities as an ME. 

I've been told that I ask theorieticial questions in classes like statics and have been told that I'd be suited for both programs. This is why I'm split.

Other concern of mine is time over money, being that it will take around 1-2 more semesters to graduate. Though with various scholarships and tuition assistance with the National guard  I have no money or loan concerns, all is paid for. 

This being said, would switching be worth it? Or should I stick to MET and graduate on a shorter time table and start working as an officer sooner? 
 
All comments and advice will be appreciated.",AskEngineers,False,The_Big_E_,/r/AskEngineers/comments/fzk9lr/should_i_switch_from_my_bsmet_program_to_bsme/
4,I'm not an engineer or a student or anything I'm just a normal person. I wanted to know how complex really were pre-ww2 era mechanical computer/calculator/[other computing machine] for a normal person that is curious about how it works.,1586643215,"If we go for a mechanical calculator (not a handheld one) I mean one that can at \*least\* multiply/divide/add/substract.

Also: for personal purpose. Is it possible to build one of these things out of wood/carboard/\[other home-easy-to-find material\]?

&amp;#x200B;

Edit: What is happening with this post? Why does it get so many upvotes?",AskEngineers,False,SpartanU42,/r/AskEngineers/comments/fzk9dd/im_not_an_engineer_or_a_student_or_anything_im/
5,How limiting will my career aspects be if I pursue a degree in environmental engineering technology vs. environmental engineering?,1586642505,"To clarify, the environmental engineering technology degree offered by my university is a four year degree and not to be confused with a technician.  The program is ABET credited and I would qualify to take the FE with this degree.  I've been told it is less theoretical based and more hands-on, which I would like, as I like the outdoors.  For example, I would only take a year of calculus and one semester of physics.

My question is just how much of a difference will this make in my career options?  If I were to go on and get a masters in environmental engineering down the road, would I be just as competitive with other engineers with masters?  

For some more context, I would like to be able to work with an organization like Engineers Without Borders and do humanitarian work with water and sanitation.  Any suggestions on strengthening my resume to obtain a career like that would be welcomed as well.  Any advice would be appreciated.  Thanks!",AskEngineers,False,sugapopcatdaddy,/r/AskEngineers/comments/fzk2ao/how_limiting_will_my_career_aspects_be_if_i/
6,Is pure math important for engineering?,1586637711,"I am a current high school student, heavily considering a major in mechanical engineering. I studied math and physics HL in the IB program and my favorite area in physics was mechanics, which is why I am interested in doing a major in ME. While I generally like math, I am mainly passionate about its applications and not very interested in pure math. For example, I love the applications of calculus in physics but find areas in math such as Number Theory a bit boring. Hence the title - how much pure math do engineering students do and how important is pure math and mathematical proofs in engineering?",AskEngineers,False,marko_v24,/r/AskEngineers/comments/fzipy3/is_pure_math_important_for_engineering/
7,How can engineers help fight COVID-19?,1586635855,It's obvious how doctors and drug researchers are helping fight COVID-19. How can engineers from each discipline help?,AskEngineers,False,thesensorshack,/r/AskEngineers/comments/fzhjgy/how_can_engineers_help_fight_covid19/
8,"Since intensity decreases with distance, how do thermal cameras accurately measure the temperature of distant objects?",1586634418," 

and on a related note, how do they convert intensity measurements into temperature information?",AskEngineers,False,gereedf,/r/AskEngineers/comments/fzgi7d/since_intensity_decreases_with_distance_how_do/
9,Looking for Information on Reliability Engineer,1586634180,"I am looking for someone who is a reliability engineer. I currently work for an airline as a Continuing Analysis Surveillance System Manager. My Bachelor is actually Mathematics and currently working on my Masters in Aviation Management and Safety. After using Weibull for component reliability, I have become very interested in Reliability Engineers and the other applications. Just looking for any information on the matter.",AskEngineers,False,Master_Tao,/r/AskEngineers/comments/fzgc0r/looking_for_information_on_reliability_engineer/
10,Procurement processes for parts sourcing in product development,1586633776,"Since I am frustrated with our procurement / sourcing processes at my company (&gt; 500 employees automotive supplier), I am curious on if the processes/ tools are any better at other companies. I am working as an mechanical design engineers developing new products for our customers (OEMs).

It takes for ever to order a sample part, which I am required to order via the purchasing department even if it is directly related to a new product we are developing. After we fixed the BoM there is a dedicated sourcing person for each part and we have to communicate back and forth via Mail for the whole RFx process despite having already a few suppliers we agreed upon. If the supplier has a question the sourcing person just forwards me everything. I kind of feel like the purchasing department is just slowing down everything. We do not use any tools for the whole process other than our PLM for some supplier collaboration and SAP for ERP. But since our purchasing department does not work with our PLM, we still have to send everything via Mail all the time.",AskEngineers,False,soulio9,/r/AskEngineers/comments/fzg1p3/procurement_processes_for_parts_sourcing_in/
11,High school project help with a basic circuit,1586630861,"Hello all, I have a 9th grade project I had some help with :( Project is trying to connect answers infront of a board so when you touch the right ones with a buzzard it lights up. So we have a little metal pin underneath each answer. The back of the metal pin are connected with wires. 

The next part we are a little confused on. We have little LED pins that we want to connect to a battery and the wires. If the LED is too complicated then maybe just the buzzard. But the problem is how would the buzzard differentiate between all the pins and wires if that makes it? I feel it would just buzz since all pins connected to batteries even if I have separate batteries. Same issue would go with LED. I feel I'm missing a component but not sure what. This is done with basic stuff from a home Depot nothing fancy. 

Anyways any advice appreciated!

Thanks",AskEngineers,False,Nefariousmg,/r/AskEngineers/comments/fzdy4g/high_school_project_help_with_a_basic_circuit/
12,What antenna is best for the AD8310 High Speed High Frequency RF Detector,1586629875,"   
level 1[**BlueSweetTooth**](https://www.reddit.com/user/BlueSweetTooth/)1 point·[11 hours ago](https://www.reddit.com/r/electronics/comments/fyy1fi/what_antenna_would_be_best_for_this_ad8310_module/fn2em1x/)

I want to use this AD8310 module ([ebay item 264288737796](https://www.ebay.com/sch/i.html?_from=R40&amp;_trksid=p2380057.m570.l1313.TR0.TRC0.A0.H0.X264288737796.TRS5&amp;_nkw=264288737796&amp;_sacat=0)) to try to capture EMF I expect to be between 3 GHZ and \~10 GHZ. I have little analog knowledge - but want something that would work with that range of frequencies. Thanks",AskEngineers,False,BlueSweetTooth,/r/AskEngineers/comments/fzd8y2/what_antenna_is_best_for_the_ad8310_high_speed/
13,"I'm 100% sure this answer is right, but it's counting it wrong (Double integrals polar form problem).",1586629098,[deleted],AskEngineers,False,[deleted],/r/AskEngineers/comments/fzcp4l/im_100_sure_this_answer_is_right_but_its_counting/
14,How do graphics card driver updates improve performance in certain games/programs?,1586628676,"Do the driver updates just correct errors or does the driver make the hardware do different things based on which game is running to ""fix"" poorly written game code? I thought a driver is just a way to access the hardware and should work the same for all games. Also why are  graphics drivers huge (400MB+ file size for the installer)?",AskEngineers,False,JarJarAwakens,/r/AskEngineers/comments/fzcev3/how_do_graphics_card_driver_updates_improve/
15,I’m a civil engineering major ending his Junior year but I don’t have an internship setup for this summer and it’s very unlikely that I can get one at this point. What are some specific options I can do this summer to not fall behind my peers?,1586628427,"To be honest though, I enjoy being an engineer but it wasn’t until the middle of junior year that I’m not interested in civil engineering at all. I’m stuck on how I can strive as a civil engineer when I don’t have passion for it at all. I’m very unsure of my career path but I’ve already wasted so much time and money.",AskEngineers,False,Kockerbocker,/r/AskEngineers/comments/fzc86i/im_a_civil_engineering_major_ending_his_junior/
16,CREO/ProEngineer PTC Expert to do contract design work.,1586628026," 

I retired 6 years ago after 40 years of Mechanical design/drafting. I have been doing contract work for the company I retired from all this time. The work has trickled down due to reduced customer base.

However, I miss the design work (Mechanical) and using PTC's Creo/ProEngineer.

Does anyone have suggestions on how to ""Go it on my own"" as a contractor on a part-time basis.

I have expertise on the following:  
40 years of mechanical Design/Drafting using PTC's ProEngineer/Creo, Windchill-PDMLink.  
Creation of very complex mechanical drawings  
ASME Y14.5-2009 GD&amp;T

Any Suggestions?",AskEngineers,False,bodacious-215,/r/AskEngineers/comments/fzbxep/creoproengineer_ptc_expert_to_do_contract_design/
17,need help to prepare bleach 5% concentration for floor cleaning,1586627199,"Hi all,

I need to know how can I make sodium hypochlorite (bleach) atleast 5% concentration easily, in scale . it is needed for cleaning processes . any guidance is really appreciated.

Thanks",AskEngineers,False,black_frost_byte,/r/AskEngineers/comments/fzbbrm/need_help_to_prepare_bleach_5_concentration_for/
18,"As an Environmental Engineer, specifically in Water Resources/Wastewater, what certifications should I look at acquiring?",1586622296,"Got my bachelors in Water Resources and currently doing my masters in Environmental Engineering, specifically in Water/wastewater, what certifications should I look at acquiring once I graduate?

Bonus: haven’t seen much in regards to Environmental Engineers, but do ENVE really need to take FE/PE?",AskEngineers,False,K4G5,/r/AskEngineers/comments/fz8qqy/as_an_environmental_engineer_specifically_in/
19,Convection Coefficient of Water at 20C?,1586622164,"Hi all, I'm working on a SolidWorks simulation for heat treatment/quenching of steel. I'm all but ready to run my simulation, but am having trouble finding one key value. I am submerging a steel shaft previously heated to 800C into water at 20C, so to simulate this I am running a transient thermal analysis with water as the convection medium. However, I am having trouble finding any reliable information for the convection coefficient of still water at 20C. I'd appreciate any help!",AskEngineers,False,halfbeard7,/r/AskEngineers/comments/fz8p1y/convection_coefficient_of_water_at_20c/
20,Is there something about transport on water that makes it cheaper than by wheels or air?,1586619309,"Say you got a boat, you can push on it and it will float in a certain direction in the water, you can also push on a wheeled vehicle and it will move in that direction.. Which requires the least amount of energy to push a certain distance? What about air transport?

Thanks",AskEngineers,False,PlasticGears,/r/AskEngineers/comments/fz7o5z/is_there_something_about_transport_on_water_that/
21,How do you inspire elitism in an engineering workplace?,1586616195,"I want to stir up some conversation:

&amp;#x200B;

In some ways, elitism can be **bad**. I get that. But when you look at people who work in finance, the feeling of elitism surely **motivates and drives** people to perform at their peak. In your experience, how has elitism played out in the field of engineering? What can I do to gain a significant edge over people in my field? *How can I use elitism to motivate my team*?",AskEngineers,False,imkindareallysad,/r/AskEngineers/comments/fz6mrt/how_do_you_inspire_elitism_in_an_engineering/
22,Does it make sense to have a LLE that’s really wide and not very tall?,1586616132,"I have to design a LLE for my design project for removing glycerol from FAME using water. Glycerol is slightly soluble in FAME and very soluble in water. I’ve read in papers that it’s 0.5 -3 ratio FAME to water but I’ve only found one set of equilibrium data and I think I only need one stage, making it not very tall but I’ve also read that LLE is used regularly to clean FAME for biodiesel? It doesn’t seem to make sense to me.",AskEngineers,False,Doughty201,/r/AskEngineers/comments/fz6m2k/does_it_make_sense_to_have_a_lle_thats_really/
23,Any specific practices when tackling a shopping store front?,1586614494,I'm doing a store front for a new shopping centre and they're asking for a wow come inside lighting design. First time I've heard of that. Does anyone have any ideas? Was thinking about using a couple Eurolux PR24 2×22.5W LED T8 for the Luminaire. The front of the store must be at 500 to 700lux. Can someone help?,AskEngineers,False,The-Corruptor,/r/AskEngineers/comments/fz63w0/any_specific_practices_when_tackling_a_shopping/
24,"I have an Internship and accepted a job offer at Company A, having second thoughts about potential at Company B... How do I navigate this professionally?",1586612360,"Hello! I am an Aerospace Engineering student graduating in a month. I'm in a bit of a crossroads deciding what I should do. I want to maintain professionalism and not screw over anyone but I also don't want to handicap my career early on. I'll attempt to keep this brief without leaving out too many necessary details.

&amp;#x200B;

I currently work at Company A as an intern in Department A. I've been here for the past 1.5 years. I love the team I work with and I have accepted a (rather good) job offer a few months ago that starts right after I graduate in May. Problem is, Company A is a big Semiconductor, so the work itself isn't terribly relevant to anything I've learned in school, most of what I do is related to Industrial Engineering. The first maybe half of the internship was a bit of a mess, I was in the first round of interns this particular Department ever hired. Due to that and my lack of background in IE, I find myself struggling to understand a lot of stuff that our newest hire (Who's been here 6 months as a full time engineer, was an IE student) has picked up on much quicker. My department had hired 5 interns with me and only kept me, they sent off the rest to other departments within the company for various reasons. They've been training me to take over a lot of functions of one of the more senior engineers to free him up for other stuff too. Due to all of that and the fact that I really like the people I work with, I'm very hesitant to leave. 

&amp;#x200B;

However, like I mentioned I'm not an IE or EE/ChemE major so it's hard for me to get a grasp on a lot of what's going on. There's a large Aerospace Defense Contractor a mile up the street from me (Company B) that is hiring like mad. I know this because I have a professor that's one of the higher ups in that particular company. He teaches my capstone class and he told me this and suggested I go apply. I hold this company in very high regard and was planning  on trying to get a job there anyway. Once all the Corona stuff hit I lost hope but it looks like they're going strong according to my professor, a couple people I know that work there, and their stock. I am much more interested in the work they do and would take a pay cut to work there too. 

&amp;#x200B;

I don't yet have a solid offer from Company B yet, so this is all hypothetical. I just don't know what to do. I don't want to screw over my current team by going back on the job offer I accepted but I also VERY much want to start off in the Aerospace industry ASAP. I've had a passion for aerospace in general since I was like 7. If I do get a decent job offer from Company B I think I'd take it over the current offer I've accepted at Company A. How should I go about navigating this? Do I wait for a decent job offer from Company B before saying anything to my current manager? I don't think I should say anything before I have anything solid, but on the other hand I feel I owe a little bit of extra notice to these guys who've treated me so well over the past year plus. Especially since I accepted Company A's job offer sometime back in February (granted it was all I had at that point, hadn't even had an interview with any other company).",AskEngineers,False,jfizzle232,/r/AskEngineers/comments/fz5ftq/i_have_an_internship_and_accepted_a_job_offer_at/
25,Quick release fasteners / flexible materials,1586610522,"Hi all, I am working on an electric go kart type project to enter into a competition called Greenpower, and I have hit a bit of a wall with my side panels. My problem is that I need to make the side panels detachable so that the wheels are accessible, and my original plan to use thin 2mm flexiply on the sides will not work because it is not flexible enough. I have made ribs that are riveted on but I was thinking of getting long strips of this 2mm plywood that I have at the moment and stick those to the sides and then vinyl wrap (or oracover) over the top to create a skin. But then I have the problem of not being able to access the wheels, so my question for you engineers out there is are there any small quick release fasteners that could be applicable here and what would be the best way to apply them to an outer vinyl skin with thin ribs? Additionally, are there any other materials that you would suggest I look into?
Photo to the car at the moment: [Photo 1](https://gyazo.com/4a4137969ce11a69f512b6ceec95fcb5) [Photo 2](https://gyazo.com/c76c871693d509488730e59b1cabf714)
(Also apologies for the poor formatting, had to write this on my phone)",AskEngineers,False,ArrowGames1,/r/AskEngineers/comments/fz4w74/quick_release_fasteners_flexible_materials/
26,Calculate how far a line is pulled automatically,1586609069,Hello everyone. I did search and looked online but I couldn't find anything that matched what I was looking for. Is there some electronic that's cheap that can measure how far a line is pulled. I know that there are ways to measure acreage by walking around it while dragging this line that has a measuring tape on it. But I ny uses will be for measuring how far a limb is from resting position. With a few of these I should be able to feed that information into a computer that spits out the location of a limb relative to its resting position. Any idea what I'm talking about? Or other ways that I could go about this?,AskEngineers,False,Mierdo01,/r/AskEngineers/comments/fz4gcu/calculate_how_far_a_line_is_pulled_automatically/
27,Why did Coca-Cola go with OLED to light up their Star Wars electronic label?,1586607756,"https://www.packworld.com/design/materials-containers/article/13376770/coke-explores-printed-electronics

https://www.designboom.com/technology/coca-cola-star-wars-bottles-oleds-lightsabers-12-09-2019/

[http://techg.kr/26336/](http://techg.kr/26336/)

&amp;#x200B;

I'd assume flexible OLED is expensive. What are some pros and cons to using OLED vs other technologies?

&amp;#x200B;

What other options were out there?

&amp;#x200B;

Thanks.",AskEngineers,False,joeguard9760,/r/AskEngineers/comments/fz4281/why_did_cocacola_go_with_oled_to_light_up_their/
28,I'm thinking follow other career because think that civil engineering will be stopped for many years.,1586590221,"In this pandemic, I was thinking about my future. I'm finishing my career but, this title won't give me a job.
construction,projects, supervise etc will be stopped around the world. Digital marketing, e-commerce and digital devices will live.
The world is changing and the technology is evolution quickly. How will survive the Civil engineering?
Help please.
What do you recommend me?
I should Continue and think about a master or choose a new career. Which career would you recommend me?",AskEngineers,False,Plableins,/r/AskEngineers/comments/fyz507/im_thinking_follow_other_career_because_think/
29,Would it be possible to create a tiny gps tracking device.,1586587347,The device would connect to a phone that will show the location of said device with an option on the phone to play a sound from the device.,AskEngineers,False,SuperSaylor,/r/AskEngineers/comments/fyyas3/would_it_be_possible_to_create_a_tiny_gps/
