index,title,created_utc,selftext,subreddit,media_only,author,permalink
44,Starting salary for new grad with 7+ years management experience?,1570382097,"I am graduating with my BSEE in the Spring in Atlanta. I'm trying to get an idea what I should ask as a starting salary. I'm interested in building Power Systems, and typical starting salaries for new grads are upper $60's to low $70's.

However, I also owned 2 restaurants, and have 7+ years of management experience. I did a 3-semester co-op for an MEP firm (ended at \~$19/hr), I have a 3.5 GPA, and I am in the Master's program. I am hoping to negotiate a better-than-average starting salary. I don't want to push too hard though...  
Any advice? I'm sure my management experience will help later in my career, but is it worth anything as a new graduate?

Thanks!",AskEngineers,False,Pizza_Guy8084,/r/AskEngineers/comments/de64zn/starting_salary_for_new_grad_with_7_years/
45,Best Graphic Tablet for studying,1570381525,"Hello redditors and engineers!  


Does someone has experience with graphic tablets, which you use for making notes, homework, or to prepare for exams?

I am kinda tired of all the papers I have and I would like to have all my notes and lectures in pdf, well organized and easy to find, since papers sometimes just disappear :D.

Could someone recommend me something? The cheapest one I have found is Wacom Intuos S, but I don't know if it feels comfortable looking at the display and writing stuff somewhere aside.

P.S. Have this idea since I've started watching Khan Academy and similar channels.

&amp;#x200B;

Thank's for helping!",AskEngineers,False,litvinik,/r/AskEngineers/comments/de60bh/best_graphic_tablet_for_studying/
46,How to find the friction on a rotating shaft?,1570380714,I’m working on a project that involves modelling the frictional force of a steel axle passing through bronze bushings. I have been able to find frictional coefficients but I cannot find any consensus online on an equation for modelling the frictional force. I assume it is not as simple as F=μN. I am in somewhat of a bind right now and any help would be appreciated. If any other information is needed let me know.,AskEngineers,False,omletteman77,/r/AskEngineers/comments/de5tgf/how_to_find_the_friction_on_a_rotating_shaft/
47,Why don't I get shocked when touching a car?,1570380608, I learned recently that all the electrical components in a car have a positive terminal bringing electricity (I think it should be negative but on cars it’s opposite for some reason) to components from the alternator or the battery which are then grounded to the cars body. The battery and the alternator are also grounded by the negative terminal to the body. Does that mean a current is flowing through the entire car when components are running? If so why don’t I get shocked when I’m touching a car? thanks!,AskEngineers,False,9Epicman1,/r/AskEngineers/comments/de5sgt/why_dont_i_get_shocked_when_touching_a_car/
48,Looking for first job after university,1570378308,I graduate in December from a well ranked 4 year ABET university and I’m searching for my first job. I have a lower end gpa (3.12) and I’ve never had an internship. Is this a giant turn off to companies hiring? I’ve passed my FE exam and the only project experience I have is my senior design capstone. What can I do to make myself more marketable?,AskEngineers,False,reddithellyeah,/r/AskEngineers/comments/de59oh/looking_for_first_job_after_university/
49,How difficult would be it be to find a part-time job in an engineering related field at 17?,1570376571,"Hi all,

I've been doing tutoring for about a year now but due to some unforseen circumstances I'm gonna be looking for another job soon. I'm 17 but am proficient in CADCAM, CNC, 3D printing, myoelectric control, electronics and mechanics. I just wanna use my skills in something more productive - problem solving.

Do you think companies would be looking for someone like me? I'm not looking to actual be a fully fledged engineer, I just want a job that relates to the above fields. Don't care about the pay since I'd rather do something I genuinely enjoy.",AskEngineers,False,AgentL3r,/r/AskEngineers/comments/de4vra/how_difficult_would_be_it_be_to_find_a_parttime/
50,What would the process of designing a whole factory full of processes like these?,1570370892,,AskEngineers,False,trueloveskissss,/r/AskEngineers/comments/de3p6j/what_would_the_process_of_designing_a_whole/
51,Differences between soft and cold launch -missile-?,1570365332,"Hey everyone, for a job interview presentation of a friend of mine, he has to make a research about the fundamentals of soft and cold launch. Although we found some documents about those terms, we couldn't really get the difference between them. They both seem to be the same thing?

Could there be any chance that they both might be the same thing?",AskEngineers,False,fightermafia,/r/AskEngineers/comments/de2nqr/differences_between_soft_and_cold_launch_missile/
52,Do you know of any good building toys for making geometric shapes?,1570352867,Do you know of any good plastic building toys that are good for making different kinds of geometric shapes ?,AskEngineers,False,Billjohnson99,/r/AskEngineers/comments/de0v97/do_you_know_of_any_good_building_toys_for_making/
53,Why aren’t turbocharger compressor impellers double shrouded?,1570351764,"I’ve been looking into constructing a gas turbine using turbocharger parts and, in my research into radial compressor impellers found that the Dyson ‘bladeless fans’ use fully shrouded impellers and wondered why this wasn’t the case for turbochargers?",AskEngineers,False,Beaventhrust,/r/AskEngineers/comments/de0pq4/why_arent_turbocharger_compressor_impellers/
54,Effect of Pre-Loading Bolts and the Reason for Pre-load,1570342386,"Hello,

I've been going back and forth for a few hours on this trying to read my textbook. 

It seems that putting a pre-load on a bolt increases the total load that the bolt faces such that: 


Force in bolt with preload and the external load &gt; Force in bolt with only the 
external load

Is this correct? I've read several times online that ""a bolt can hold a significantly higher load when the correct amount of tension is applied."" 

Source: https://www.albanycountyfasteners.com/blog/2018/12/17/what-is-bolt-preload/

It's my understanding that a bolt is preloaded only to give you a greater resistance to joint separation, rather than decreasing the total load the bolt takes. Any insight would be appreciated.",AskEngineers,False,sparkpioneer,/r/AskEngineers/comments/ddzg5r/effect_of_preloading_bolts_and_the_reason_for/
55,Third-year engineering student feeling overwhelmed and burned out,1570338874,"I’m an engineering student in my junior year and I feel burned out already. I constantly study and work. It’s a never-ending circle. I study and work during the week  24/7 and study on weekends. I need to maintain a great GPA because I’m on a scholarship and overall I love doing everything perfectly. Also, I’m currently looking for internships and it’s taking so much of my time and energy. 
Also, I’m in a club in a leadership position (been there for 2 years) and at this point I am forcing myself to do the work because it’s a good way to make connections, but the people in the club are very toxic and I feel that the work I’m doing is not worth my health. But it is a good position for the resume and I have made a few useful connections through that club.
I just feel so tired all the time and I don’t know how to get rest. If I take a day off, I have so many assignments that I won’t be able to finish on time.
I’m tired and exhausted and don’t know what to do and enjoy my days.
I love engineering and this is definitely what I want to do but I’m so overwhelmed at this point that I don’t know what I should do (dropping courses/taking a semester off is not an option).",AskEngineers,False,falcon23space,/r/AskEngineers/comments/ddyzbd/thirdyear_engineering_student_feeling_overwhelmed/
56,Overwhelmed engineering student,1570338393,"I’m an engineering student in my junior year and I feel burned out already. I constantly study and work. It’s a never-ending circle. I study and work during the week  24/7 and study on weekends. I need to maintain a great GPA because I’m on a scholarship and overall I love doing everything perfectly. Also, I’m currently looking for internships and it’s taking so much of my time and energy. 
Also, I’m in a club in a leadership position (been there for 2 years) and at this point I am forcing myself to do the work because it’s a good way to make connections, but the people in the club are very toxic and I feel that the work I’m doing is not worth my health. But it is a good position for the resume and I have made a few useful connections through that club.
I just feel so tired all the time and I don’t know how to get rest. If I take a day off, I have so many assignments that I won’t be able to finish on time.
I’m tired and exhausted and don’t know what to do and enjoy my days.
I love engineering and this is definitely what I want to do but I’m so overwhelmed at this point that I don’t know what I should do (dropping courses/taking a semester off is not an option). I would really appreciate if you could give me an advice.",AskEngineers,False,falcon23space,/r/AskEngineers/comments/ddywsn/overwhelmed_engineering_student/
57,Advice to interview with high level position person,1570337799,"Hi guys, I'm an equipment engineer from third world country which the industry focus on manufacturing. 3 days ago, I've got an offer to be from US based company who manufacture their item in my country which the position will need me to travel between my country and US. This Wednesday, I'll have one phone interview with global director of that company (medical equipment company). I never been interviewed by very high position person before especially from outside of my country. Can I have some advice what normally people from corporate always ask about? I'm more of technical person who does not involved much with management people. I don't know what I should expect from the conversation.",AskEngineers,False,Mhs27,/r/AskEngineers/comments/ddytpu/advice_to_interview_with_high_level_position/
58,Since 80% of engine wear happnes during startup due to lack of oil circulation. Why don’t manufacturers use a small electric oil pump to circulate oil before starting the engine.,1570333396,,AskEngineers,False,Andrew7330,/r/AskEngineers/comments/ddy4tp/since_80_of_engine_wear_happnes_during_startup/
59,Power Systems Refresher,1570332686,[removed],AskEngineers,False,MNSIZZLE,/r/AskEngineers/comments/ddy0ab/power_systems_refresher/
60,"Any Microelectronics books that are actually good? I'm currently using neaman, reading it page by page, and it is terrible. Can someone recommend me a good book on MOSFET's, Diodes, BJT's, and etc that clearly explains topics like frequency response, and etc? Thank you.",1570329306,"I am currently using Microelectronics 4th edition by Donald A Neaman and to put it lightly it is not a good book. For example it teaches a method of solving Bode plots that isn't time efficient and therefore isn't practical to be used on a timed exam. I found quicker methods through online sources and this just annoys me that those methods aren't ever stated in the book. Another topic called the miller effect, which is a really easy topic, is explained in the most obscure way I could ever imagine anyone explaining it. Can someone recommend a book that explains these topics in a way that is clear and easy to understand but also is comprehensive? Thank you.",AskEngineers,False,moonflow1,/r/AskEngineers/comments/ddxf35/any_microelectronics_books_that_are_actually_good/
61,Which shape would be able to withstand the largest amount of force when dropped top-first into water?,1570326001,"I’m not an engineer and only took one semester of physics at uni, but I’m trying to design some basic roofing for a writing project taking place in a world where rain falls all at once (in flat sheets).

My hunch is that a tall cone or pyramid (supported in the centre) might work best, as the tip could break the surface tension and the steep angle would allow the impact to be spread out more, but it was recently suggested to me by an actual physics student that a hemisphere might work better, although I’m not sure why.

What might the logic behind this be?  Is there another shape (maybe one of those weird origami-like things) that might be able to take some more brunt?",AskEngineers,False,nebulaeandstars,/r/AskEngineers/comments/ddwsyk/which_shape_would_be_able_to_withstand_the/
62,Junior year aerospace student feeling very discouraged and seeking advice,1570322158,"I’m a junior year aerospace engineering student at an accredited 4 year university. I have a 3.338 GPA as well as over 2 years of relevant project experience, including the mechanical design of a launcher system for a microgravity payload experiment on a 10k foot apogee student researched and developed rocket. I am having a lot of trouble finding internships, or even getting interviews. I have friends who are getting internships and interviews, and I feel like I’m really behind. I’m currently taking analysis and design of aerospace structures and modeling methods, as well as a couple other classes. I’ve already taken (and passed) thermodynamics, solid mechanics, fluid mechanics, and other major-specific courses. I have never failed a class and I have lots of project experience. I’m starting to feel very discouraged and I don’t know what I’m doing wrong. I already visit all on-campus career events and I meet with recruiters at all these events. Does anyone have any advice?",AskEngineers,False,aerospacejake1969,/r/AskEngineers/comments/ddw26s/junior_year_aerospace_student_feeling_very/
63,Junior year aerospace student looking for advice about resume building and internships,1570321716,[removed],AskEngineers,False,aerospacejake1969,/r/AskEngineers/comments/ddvz1v/junior_year_aerospace_student_looking_for_advice/
64,How to calculate how much battery is needed to power something for say 10 minutes? Maybe 1 hour?,1570318402,"Like say I have a circuit consisting of 2210 kV Motors, a 6V Electromagnet, an Arduino, etc, all connected together to a PDB and Battery? How would I know how much mAH I need to power everything for 1 second, and then for longer?

Is there some formula?

Freshman so sorry if this is common knowledge!",AskEngineers,False,billybobjoe179,/r/AskEngineers/comments/ddv8yt/how_to_calculate_how_much_battery_is_needed_to/
65,Can CMOS image sensors vary amplification gain values at each photo detector?,1570318295,"Idea being that you can underexpose the highlight values and over expose the shadows in a single exposure? Is the amplification circuit on each photo detector or is it downstream the detectors, and a single amplifier circuit amplifies the signal?",AskEngineers,False,davidthefat,/r/AskEngineers/comments/ddv887/can_cmos_image_sensors_vary_amplification_gain/
66,Most important math topics to excel in Engineering and Physics?,1570315645,"This is random and I'm curious of your inputs.

I personally noticed that the basics of all phyiscs, and Engineering lies in Sinousoids, calclus(especially taking a slice or applied calclus), probability(perm and comb), basics of vectors and matrics. Like if you have a good understanding of these, it is very easy to move on in the vast majoirty of Engineering and physics related problems.

Am I correct or not, if not what should be focused on to get better fundementals.",AskEngineers,False,abond0082,/r/AskEngineers/comments/ddun1u/most_important_math_topics_to_excel_in/
67,New engineer going through a rough patch,1570314021,"Hello fellow engineers,

I wanted to see if I could someone else's input on my situation. My background is in Electrical Engineering and Computer Science. I graduated a little over a year ago and started working as a Field Support Engineer for a large industrial automation company. 

I love to travel so that was the draw to this job coming right out of college. However, now I'm starting to feel that this job is more a technician job and not a true engineering job. I do not really get to design control systems. Basically, I go to customer sites with their systems already in place and my job is to babysit an installation, install software or troubleshoot an issue by referencing tech support or documentation. There is not too much ""thinking"" involved. If we are not at customer site, the expectation is that we help out with technical support but we do not have any access to hardware like main tech support people. This is really starting to demoralize me as I feel like I am losing touch with my degree. 

The company relocated me out to the West Coast and did not give me a COL adjustment so now I am also starting to struggle financially. I am about to bring up these two issues to my manager:

1) How can I get a COL adjustment so I can enjoy the same financial stability I had in the Midwest?

2) How can I get more exposure to design type work?

I think it is important to mention that I recently got some certifications that other colleagues have not obtained so I will definitely use this in my favor. The company also spent about six months training me in a college-like program. 

I am wondering if anybody else has had a similar situation and if so, were you successful in negotiations?

I would also just appreciate anyone else's thoughts. 

&amp;#x200B;

Thank you!",AskEngineers,False,jfa27,/r/AskEngineers/comments/ddu9n0/new_engineer_going_through_a_rough_patch/
68,"streamliner question again, could a streamliner be street legal if it used the special vehicles laws?",1570313336,"Koenigsegg managed to fit their headlights on a moving piece of bodywork, thereby skirting the law stating that states that the lights must be immovable.

Ariel Atom doesn't have any front bumpers unlike the Prowler and that's because it gets past the law using the special vehicle/kit car category to have more lenient laws applied to it.

so that begs the question, could a bonneville streamliner become streetlegal using said laws?",AskEngineers,False,MLPorsche,/r/AskEngineers/comments/ddu3we/streamliner_question_again_could_a_streamliner_be/
69,How important is Mechanics of Material course for my future career?,1570305601,"I'm a Mech Eng student. I did well in Statics and Dymanics but for some reason Mechanics of Material is so hard for me. I am taking it now this semester. So I'm just wondering how important it is gor my future career. I might work in the design field (Solidworks related) though. That's my plan but things might change.

Thank you for the input!",AskEngineers,False,piece_ofmined,/r/AskEngineers/comments/ddsfgx/how_important_is_mechanics_of_material_course_for/
70,Concrete Slab Deformation,1570304314,[removed],AskEngineers,False,Mark_Messa,/r/AskEngineers/comments/dds4oi/concrete_slab_deformation/
71,Any Engineers out there also have this issue?,1570304007,"I'm a biomedical engineer and throughout my life I've focused on school and getting a job because my family literally drilled it in my head that if i just finish school and get a good job, like the one i have now, it will be so easy to settle down and find a mate. Well I graduated in 2014 and I still have yet to find someone! Its gotten to the point where I hate even logging on to social media  because it seems that every second one of my peers from high school or college are getting married or having gender reveal parties... I even pass up opportunities to go to gatherings because everyone there always seems to be coupled up and I'm usually the only one whose single. I really want to find someone already! All of my coworkers are already in relationships. Literally my days consist of waking up, going to work, coming home and going to sleep. And on the weekends I just stay home and tinker with some projects I'm working on. How do I even start? I feel like time is running out. I'm 29 freakin years old! I have a good job! What the hell man! Can anyone help guide me in anyway or at least share your experience and what you've been trying to do to get over it? I love being an engineer and love it's rewards but I am still missing the real prize I feel like!",AskEngineers,False,OrdinaryWorldDDR,/r/AskEngineers/comments/dds23p/any_engineers_out_there_also_have_this_issue/
72,Is Scientific Literacy a social issue?,1570303683,"I'm a space engineering student doing some work on a humanities course. I have to write a fairy tale that is either set in modern times or focuses on a social issue. Being a STEM student I believe that scientific literacy is a very real, serious (and quite honestly, a terrifying) issue. I take scientific literacy to be a social issue that affects us all, but I know others (perhaps without the bias I do) don't consider this a large problem in society.",AskEngineers,False,atamanje,/r/AskEngineers/comments/ddrzhm/is_scientific_literacy_a_social_issue/
73,"I love math, so should I go into Mechanical Engineering?",1570303205,"I really love math. Like a lot. And I am currently in Matric (the South African equivalent of final year in high school) and I am not sure what field to go into. My options are between Mathematics, Actuarial science and Mechanical Engineering. I would really like to know: is there any jobs I could get as an engineer where I would be required to solve challenging math problems regularly? If not, what kind of problems do you solve?",AskEngineers,False,GymReaper17,/r/AskEngineers/comments/ddrvrb/i_love_math_so_should_i_go_into_mechanical/
74,Colleague trying to mark territory - how do you counter?,1570302851,"I have a colleague who is slightly senior and has been a great friend before I joined his department. I worked with him after moving to his department. Many times I have given the benefit of doubt when there were instances of competing for resources, people or projects. ""Hey.. great idea, we can work on it"" and I enjoyed the technical aspect of it. 

In the recent past we were trying to hire someone and he quietly diverted the new hire to his other project. I was not happy, but let it go. I have been exploring a new project and he sends his junior engineer to me and asks me to work on a task that he has no idea where/how to approach. I say ""I am working on this, you can work on this other thing"" to the junior engineer. But, I later confronted and told him that I didn't appreciate this method. He has been resentful. 

How do I counter such behavior?",AskEngineers,False,fershey17,/r/AskEngineers/comments/ddrt10/colleague_trying_to_mark_territory_how_do_you/
75,About Math...,1570302750,[removed],AskEngineers,False,GymReaper17,/r/AskEngineers/comments/ddrsaz/about_math/
76,Stuck on a career decision...,1570300890,"I am an Industrial Engineer graduated last year and I am currently employed on my first job at an OEM automotive company as a quality engineer. It has been 7 months. 
for last 4-5 days, i had been contemplating a lot about my prospectus of higher studies abroad. 
Do you guys think it is a high time i should leave my job and go for MS and subsequently pursue my PhD? If yes then what subjects should i focus on? (My FYP was about six sigma productivity improvement).",AskEngineers,False,IjlalRizvi,/r/AskEngineers/comments/ddrcmh/stuck_on_a_career_decision/
77,Setting up a FBD of a mechanical system and can't figure out how to describe the motion,1570298485,"[Here is an image of the problem setup](https://i.imgur.com/XFRAqCd.png)


A,B,D are constant lengths, C is variable (linkage connected to a clutch).

A &amp; D are always parallel (push rod and clevis - sorry in the drawing they look crooked)

D is getting pushed from the bottom straight up (pneumatic cylinder / air chamber), but has a hinge at 'd'.

When D gets pushed upward, C will increase, and corner 'c' will make an arc path.

I can use the law of cosines step by step if I know angle 'c' to find C, but I'm not sure how I can incorporate the constant D and it's movement into this calculation.

Any ideas?",AskEngineers,False,djdadi,/r/AskEngineers/comments/ddqr7v/setting_up_a_fbd_of_a_mechanical_system_and_cant/
78,How to control 2 DC motors?,1570297847,"Hi everyone,

I'm starting a project using 2 DC motors, and I wanted to know how I'd go about controlling them. Specifically, the project has 5 main steps (in sequence):

1. The first motor rotates for x number of rotations
2. The second motor rotates for y number of rotations
3. The first motor rotates for x number of rotations
4. The second motor rotates for 2y number of rotations in the opposite direction
5. The first motor rotates for x number of rotations

x and y are variables that I need to define, but those are dependent on whatever gear ratio I end up using

So, what kind of equipment would I need and what tutorials should I watch to make this happen? I've never worked with actually controlling motors before, as I'm very new to the hobby of building robots, and I've only ever just directly powered motors before.

For my motors, I was just going to use some extras that I had lying around from a previous build because I need a lot of torque. They can be found [here](https://www.amazon.com/Greartisan-Electric-Reduction-Centric-Diameter/dp/B071KFT4P7/ref=sr_1_2?crid=D59BUN0YMPBC&amp;keywords=greartisan%2Bdc%2B12v%2B550%2Brpm&amp;qid=1570246818&amp;sprefix=grearti%2Caps%2C128&amp;sr=8-2&amp;th=1). They're 12 V 30 RPM motors that draw 1.1 amps.

Thank you all for your help!",AskEngineers,False,BOOleanIllogical,/r/AskEngineers/comments/ddqm38/how_to_control_2_dc_motors/
