index,title,created_utc,selftext,subreddit,author,permalink
19,"State of AskEngineers: work experience thread wrap-up, and what we're planning next",1471990507,"With the work experience threads concluded and all listed in the [FAQ page](https://www.reddit.com/r/AskEngineers/wiki/faq#wiki_what.27s_an_average_day_like_for_x_engineers.3F), I want to thank everyone that contributed. We were able to collect over 200 replies across 14 different engineering disciplines — something I haven't seen done anywhere else on the internet, which is amazing!

If you missed the initial posting, some of them haven't been archived yet and you can still add your comments to them for a while longer.

## Reports: how YOU can make AskEngineers way better!

Before I talk about anything else, I briefly want to mention the **report** function.

**Right now, almost nobody submits reports.** This is bad because it lets a lot of low-quality posts slip past the moderator queue (which we look at on a daily basis). I encourage everyone to start using reports — if you've judged that a post or comment doesn't belong in AskEngineers, report it. We'll evaluate them case-by-case.

**Note:** reports are not ""super downvotes"", so don't use them that way.

[**Here**](https://www.reddit.com/r/AskEngineers/about/rules) are all the reasons you can report a post or comment, which are conveniently the same as the guidelines in the sidebar. If a post doesn't break one of these rules, consider whether your judgment is correct or not; we're always available by [mod mail](https://www.reddit.com/message/compose?to=%2Fr%2FAskEngineers&amp;subject=Report) if you aren't sure.

### Lessons learned

The work experience threads were first started 2 years ago by nosjojo, and came out of the need to make the FAQ page able to answer common questions from the inevitable waves of engineering students and freshly graduated engineers every season; it's our [eternal September](http://www.catb.org/jargon/html/S/September-that-never-ended.html) and something we have to deal with on a regular basis whether we like it or not.

When I decided to run the posts again, I organized them a little differently and shilled the post in other subreddits to gather outside interest. This worked well, but there were problems which became apparent after the first few. Originally each thread was supposed to last 2 weeks or if 20 responses were gathered (whichever came first), and the next thread would be posted. As I continued, I found that I would either forget to post them, or didn't have time to. This didn't end up being a huge deal, but it was a pain for the mods to keep on top of.

After this experience, we've pinned down how to make these threads consistently more organized simply by adding them to Automoderator's schedule. Moving forward, because reddit archives posts 6 months after posting, there will be several yearly posts on rotation:

Thread|Frequency
:--|:--:
Work experience threads|once per year
Engineers available for interview|once per year
Panel of Engineers (flair application)|twice per year

### Career threads

Some users have expressed that they really dislike seeing career-related questions on AskEngineers. Career questions have always been allowed, with a mixture of quality ranging from fantastic ([1](https://www.reddit.com/r/AskEngineers/comments/4fa4hn/im_a_junior_engineer_and_im_facing_an_ethical/), [2](https://www.reddit.com/r/AskEngineers/comments/3pwc4w/dealing_with_a_toxic_employee_is_tough_how_do_you/), [3](https://www.reddit.com/r/AskEngineers/comments/4rtxzx/engineering_managers_of_reddit_what_drove_you_to/)) to [annoying](https://www.reddit.com/r/AskEngineers/comments/4z7ojj/how_to_get_a_google_software_engineering_job/). Many of you only want to see technical content. I get it.

This policy was inherited when I joined as moderator, and we haven't taken any huge measures to cut down on the number of them outside of having weekly threads and improving the FAQ. This is intentional, mainly because AskEngineers is one of the few places on the internet where you can get real information about a career in engineering, and have honest and valuable discussions on how to navigate the pitfalls. I think that's relevant and valuable to many of you, so career questions are here to stay.

However, we'll try to do a better job of cleaning up low-quality posts by locking them and warning users to read our Content Guidelines before posting. How well we do depends on you helping us out by reporting bad posts. Repeat offenders will be subject to temporary and/or permanent bans. I get the feeling that we're letting too many of the ""annoying"" threads have a free pass without any consequences, but I'd like to hear everyone's thoughts on this.

If you're looking for technical content, here are numerous forums that are strictly for this purpose, such as [engineering.StackExchange](http://engineering.stackexchange.com/questions), [eng-tips](http://www.eng-tips.com/), and various subreddits (listed in the sidebar).

---

That about covers everything new for now. We're still working on getting everything integrated, but stay tuned for a new flair application thread soon. We're also recruiting new moderators in the near future.

And as always, any other feedback about the subreddit is welcome.",AskEngineers,dangersandwich,/r/AskEngineers/comments/4z9449/state_of_askengineers_work_experience_thread/
20,What weight would be required to lower an elevated leg from a 60º angle to the floor over t time?,1471989140,"I'm looking to build a stretching tower that slowly lowers a given leg or legs from the 60º angle to the floor while someone is strapped into this thing and lying on the floor. My best idea so far is a pulley system with a dialed-in weight where the weight was tuned to be just light enough to allow the leg to slowly pull the weight up over the course of 60 minutes.

That being said, I've never understood pulleys as well as I would like. I also think I need to ask for a formula so I can build appropriately. So... here's the problem. 

[diagram](http://mirkmanea.com/sLowerDiagram.jpeg) 

* Assuming a leg length of *Y* inches
* a weight at the ankle of *A* lbs
* an elevation of *X*"" to bring the leg to 60º relative to the floor
* a single pulley (feel free to expand on pulleys as much as you think necessary)...

What amount of weight *B* would be required at the opposing end of the pulley to allow the leg to descend *X* inches over the course of *Z* minutes?",AskEngineers,MirkManEA,/r/AskEngineers/comments/4z906m/what_weight_would_be_required_to_lower_an/
21,What Kind of Wood Screw is Best for High Cycle Count?,1471988258,I have an application that requires the same screw to be driven into a fresh piece of wood over and over again. What type of screw would make it the most cycles before failure?,AskEngineers,tkulogo,/r/AskEngineers/comments/4z8xk5/what_kind_of_wood_screw_is_best_for_high_cycle/
22,Is there any way to build a mecha like Overwatch's D.Va?,1471976817,"Basically, I want to know if there is a way to build a mech like [Overwatch's D.Va](https://www.google.com/search?q=D.va%27s+mech&amp;safe=off&amp;source=lnms&amp;tbm=isch&amp;sa=X&amp;ved=0ahUKEwjck9-VltjOAhUSgx4KHU3iAlkQ_AUICCgB&amp;biw=1366&amp;bih=698#imgrc=R4P6oAp_1GtiNM%3A), without thrusters and weapons. I don't mind not having them, nor the Defense Matrix. I just want something like that. I don't imagine it would be too difficult, once you get past the leg operations, because I suppose it could have like a [marching walk](https://www.google.com/search?q=marching+military+walk&amp;safe=off&amp;source=lnms&amp;tbm=isch&amp;sa=X&amp;ved=0ahUKEwjenPnYldjOAhVGKh4KHZZzDx0Q_AUICigD&amp;biw=1366&amp;bih=698#imgrc=UUfcp-zlxxSnEM%3A) to it. I'm also asking how much it would cost. It doesn't even have to look nice, honestly, I just want functionality.

My only concerns would be

A)How much of an engineering nightmare would it be to make it?

B)How hard would it be to have joysticks controlling the arms, Sure, you could hook up the parts to it, but how hard would it be to program the joysticks to control it, like you would say, a helicopter?

C) In what way could I have moving legs? And if too difficult, what alternatives are there? Tracks get stuck too easily on hills (I live in a very hilly area so if I wanted to do a field test, it would be difficult), so if possible I would rather not add tracks.

Finally,

D) How would I keep it powered? Assuming I'm using an engine, where would I put the panel to add gas, oil, etc? If battery, where would I charge it? I assume it would require a lot as I wish (if possible) to add A/C. Not required, but requested.

**Thank you in advance for your input.**",AskEngineers,noah21n,/r/AskEngineers/comments/4z7yqf/is_there_any_way_to_build_a_mecha_like_overwatchs/
23,How can I relate the torque I apply to a bolt to the clamping force it produces?,1471974296,"I want to mount a sheet of aluminum to an aluminum heatsink with a sheet of TIM in between. The higher the clamping force, the greater the efficiency of the TIM. The data sheet specs of the TIM are at 681kPa, but it performs better with more pressure up to 4.4MPa. I am looking to use M4 x 0.7 or M5 x 0.8 bolts along with washers (I have d=1cm washers, but could get larger ones). They are grade 8.8 steel. I have a decent torque wrench to torque the bolts with too. I do not know the alloy of either the aluminum heatsink or the sheet, but it's probably something cheap and basic.

I understand that it might be hard to calculate exactly because of the unknown properties of the TIM, other than its a soft graphite material. So ball parking is fine. I just need to know what equations to use to put me within rough distance of the true value.",AskEngineers,ItsDijital,/r/AskEngineers/comments/4z7qu1/how_can_i_relate_the_torque_i_apply_to_a_bolt_to/
24,How to get a Google Software Engineering job?,1471973580,"Hi guys. 

I just turnt 18 and going to study BSc Maths and wondering how hard is it to get a Google job? I live in the UK.  Would I have to do an internship and how long will this be for? ",AskEngineers,SOCIALREBELLION,/r/AskEngineers/comments/4z7ojj/how_to_get_a_google_software_engineering_job/
25,Software engineering starting salary,1471971276,[deleted],AskEngineers,[deleted],/r/AskEngineers/comments/4z7h1t/software_engineering_starting_salary/
26,[Mechanical] Solving for stresses in beam that is elastically supported,1471969838,"http://imgur.com/a/q98CM

Assume the faces of the tubes are fixed and the green arrow is a known force. 

Can anyone give me some insight on how the stresses in this sort of steel weldment frame would be solved for? 

If the beams were rigid I could solve for the forces in each beam as they should all be equal, but because of the elasticity of steel each beam will take on a different amount of the load based on its position.",AskEngineers,CSTMechanical,/r/AskEngineers/comments/4z7ci8/mechanical_solving_for_stresses_in_beam_that_is/
27,How is the load distributed along this beam and connection configuration?,1471968210,"Hi Reddit,

I have a question to ask.  I am working on a structural support plan and would like to run a support scenario by you.  I can't understand how a load will be distributed along the length of a beam with multiple connection in-between the loads.  

Loads are located on the outside of the beam and are distributed over an unsupported length. 

There are various connection points for the beam, which are in-between the loads.

Loads on outside of beam would be equal to each other.

[Load Diagram Here](http://imgur.com/a/mnkv2)

I can understand that if there were only two supports under the beam, the load would be directly applied to those supports, but what happens if you add supports under the beam and connect them via weld or bolts?

Would a portion of the load be applied to the two outside supports and exponentially be distributed to all other supports in-between?

Would the outside supports see a downward force and the center supports see an upward force?

Thanks in advance for the help! 
 ",AskEngineers,bnich11,/r/AskEngineers/comments/4z77hw/how_is_the_load_distributed_along_this_beam_and/
28,Internships in Australia,1471961604,"I'm currently in Melbourne, Australia with a month left before I got back to Uni. I was going to get a normal backpacker job but I thought i might try to get something more helpful to my long term career. Are internships easy to come by, and are they usually paid in Australia? I'm doing a general degree so I still need to decide my specialism, so any field is fine.Thanks for the help",AskEngineers,obg_,/r/AskEngineers/comments/4z6nia/internships_in_australia/
29,Brewery Concrete Floors (xpost from /r/thebrewery),1471957791,"Suggested to post here: Brand new Concrete Floor under the brewhouse (1000 sq ft, 1/4"" per foot slope toward center) with most likely some very light sealant when was first poured (saw a blue glossy product being rolled on after it was poured).

Obviously if I had unlimited funds I'd look at a professional operation with a purpose poured Urethane flooring on top of my existing floors but like most of us, money is not unlimited and some costs need to be pushed to future projects. The urethane will be done properly, just not yet.
I want to make this floor last until the urethane is possible, so what half measures will get me to that point? So far I've looked at Densifiers like Lithi-Tek 9500 which should at least waterproof the floor, prevent bacterial growth, and mitigate some of the chipping. What are some other/better options for now?

Brewhouse is being cleaned with Diluted Caustic as well as infrequently with a Nitric/Phosphoric Blend.  Any Wort (Unfermented beer) that finds its way out of the tank is relatively acidic as well.  The Fermenter space could have Caustic, Nitric/Phosphoric Acid, or Paracetic Acid dripping out of them during cleaning.  Any of these leaks would be rinsed at the end of the day, but the damage would already be done if it seeped into the concrete.",AskEngineers,TestingAlter,/r/AskEngineers/comments/4z6dav/brewery_concrete_floors_xpost_from_rthebrewery/
30,Is it possible to make a photomath equivalent for electric circuits?,1471956931,"Basically an app that scans the diagram of a circuit using the device camera, identifies components and connections and simulates them.",AskEngineers,alectprasad,/r/AskEngineers/comments/4z6b4u/is_it_possible_to_make_a_photomath_equivalent_for/
31,"Can you turn the whole desert into one giant block of glass by applying heat? (e.g. laser beam, atomic bomb etc)",1471954138,"I was thinking about the problem of dust storm, and the problem of rapid evaporation of water.  

So then I thought, why don't they just cover the whole desert with a tarp, but then I thought about how hard it would be to make a tarp big enough, transport it to a desert, unfold it without breaking it, and keep it from breaking down in the desert extreme condition.

But they have sand, can't we just turn all the sand into glass with heat so that they don't get blown around, and you can make water tanks with the glass, and keep ground water from evaporating, reflect more sunlight thus cool down the planet, and also make it easier to build infrastructure on top.

Is this impractical?  Is it difficult/ expensive/ unethical to heat a desert until the whole area becomes a single glass slab? ",AskEngineers,Hongkie,/r/AskEngineers/comments/4z64w1/can_you_turn_the_whole_desert_into_one_giant/
32,Fellow aspiring Engineer student here. Help me out by answering questions regarding your work.,1471951595,"Hi! I`m a Computer Engineering student and I have been tasked to interview an engineer/s with a short few questions.

1. What kind of English do you use in your work?
2. Describe your community at work.
3. Does your field have any kind of culture that is different from the normal or quite striking

Examples of these are
-Structure
-Rules
-Organization
-Freedom,Religion (For Example the lack thereof or the freedom of doing anything)

4.In your words. How is language important in your field.

If you wanna include personal details like nicknames to help me reference you go ahead.

These are all of it :) 

I was wondering if This goes against  ""Requests to interview engineers"" 
All i have are good intentions and would like to be warned before deletion. Thank you!





",AskEngineers,buzing,/r/AskEngineers/comments/4z5zeo/fellow_aspiring_engineer_student_here_help_me_out/
33,"What qualities, processes, and/or materials make toilet paper soft?",1471951189,,AskEngineers,scatteringparameters,/r/AskEngineers/comments/4z5yms/what_qualities_processes_andor_materials_make/
34,What is the torque of each individual 'planet' in an epicyclic gear system?,1471942313,"I’ve recently looked into the operation and physics of Epicyclic (planetary) gearing. Most of the information I have encountered is somewhat comprehensive, although I have a question that remains answerless.

What is the torque of each individual planet within an Epicyclic gear set? 

I have a thorough understanding of gear ratios but am unsure about this. Mostly because all information related to this is, conflicting.

I would assume that within an Epicyclic gear system (where the sun is the driver) that the planets would each experience an equal rotation speed and torque, that determined by the basic gear ratio concept. But I found this…

“The load in a planetary gear train is shared among multiple planets, therefore torque capability is greatly increased. The more planets in the system, the greater the load ability and the higher the torque density.”
 
Does this mean that each planet experiences the same rpm yet a torque of 1/n (where n is the number of planets), so that the total torque of the planets adds up to the torque determined by a 1planet to 1sun gear ratio.
Thanks in advance.
",AskEngineers,c-menz,/r/AskEngineers/comments/4z5j0o/what_is_the_torque_of_each_individual_planet_in/
35,How does beam underloading change when a beam deforms?,1471936034,"For example, if I have a simple beam pinned at one end, roller at the other, and there's a constant, straight down, distributed load on it.  Usually this is not very difficult to calculate the deformation along the beam.  However, the basic model doesn't really take into account the beam deforming and how that affects how the beam would actually deform, since when the beam deforms, the distributed load is no longer straight down, and possibly no longer uniformly dense in terms of loading.  I.e. Your initial picture is not what's actually happening.  The beam is not straight, and the constant distributed load is not constant, nor evenly distributed.

So, my question is, how do you account for this?",AskEngineers,lepriccon22,/r/AskEngineers/comments/4z58pe/how_does_beam_underloading_change_when_a_beam/
36,Can someone explain why a piano mechanism is so complicated/what each part does?,1471935823,,AskEngineers,lepriccon22,/r/AskEngineers/comments/4z58cj/can_someone_explain_why_a_piano_mechanism_is_so/
37,Could a battery powered steam mop work? Is a steam cleaning 'Roomba' scientifically viable?,1471929808,"I am wondering about the viability of a battery powered steam mop so that a steam 'roomba' could work. Assuming the steam mop originally heats the water up at a power station first, could a battery powered steam mop work?

A steam mop on average contains probably about 500ml tank capacity. How much energy is required to Keep 500mL water at 120°C for 20 minutes?

I am wondering if the idea of a compact, steam cleaning Roomba is actually scientifically viable or if the 'Roomba' would have to be plugged in to have enough power to operate for a decent time.",AskEngineers,matthat15,/r/AskEngineers/comments/4z4x3t/could_a_battery_powered_steam_mop_work_is_a_steam/
38,What were your senior year Engineering projects?,1471929725,,AskEngineers,Ericr___,/r/AskEngineers/comments/4z4wxj/what_were_your_senior_year_engineering_projects/
39,What is the thread size of this common thermocouple ?,1471929281,"Hi,

I keep seeing this very common thermocouple on ebay.

https://i.imgur.com/uNbRKma.png

I ordered some and hope to get them in a month.

However the thread size isn't list.

I would like to order some weld bungs so I can use them right away when I receive them. (exhaust gas temperature sensor on a turbo'd car)",AskEngineers,shodanx,/r/AskEngineers/comments/4z4w0j/what_is_the_thread_size_of_this_common/
40,Underwater oil drilling platform like the one in Jame's Cameron's *The Abyss*? Could something like this be possible? Or necessary?,1471924397,"I just watched this movie again, and it got me thinking about the engineering requirements to build something like this. Would an underwater habitat be able to work at those depths? Would there be a need to have the crew literally on the ocean floor near the drilling site? Can you have open water that leads to the outside? What happens to the people who go outside? Can people actually survive down there if they were swimming outside.

I wasn't able to find any papers written about it, so I figured I would ask here.

Thanks!",AskEngineers,theorymeltfool,/r/AskEngineers/comments/4z4lmd/underwater_oil_drilling_platform_like_the_one_in/
41,Next week I start my senior year and graduate in May. When should I start sending out my resume?,1471920797,[removed],AskEngineers,Brucelee58,/r/AskEngineers/comments/4z4d1g/next_week_i_start_my_senior_year_and_graduate_in/
42,What has facilitated the expansion of the # of gears in an automobile transmission in recent years?,1471909614,"I can remember when I was a kid my grandpa had an old Ford F100 (like 1950s era) and it had a 3 speed transmission. My first car was a 1985 Chevy Cavalier (blah) with a 3 speed transmission.

It seems that for a majority of the history of automobiles, 3 or 4 speed transmissions were the norm.

In the past 20ish years, we've seen rapid progression to 5, 6, 8 speed transmissions.

What has allowed this expansion? Or, what was the limiting factor before?

Is it due to more precise modeling through CAD? More precise machining capabilities (on a mass scale, aka CNC machines)? Changing to ""shift by wire"" systems where a computer can better/faster switch gears?",AskEngineers,utspg1980,/r/AskEngineers/comments/4z3jea/what_has_facilitated_the_expansion_of_the_of/
43,Gas Mixing Dilution,1471903917,"Trying to calculate a gas flowing into a room with ventilation. Say I am constantly bleeding CO2 into a room how much general ventilation (dilution) do I need?

I keep getting mixed results depending on the sources I look at.

Concentration = CO2 Rate (M^3/hr) / ( Room Volume (m^3/hr) x Air Exchanges Per Hour)



In a small room does it infinitely build up? When you start looking at it numerically, in a moment of time you add some CO2 and it gets mixed into the room, then in the next moment you remove a chunk of air and replace it, but there remains some CO2 in the room. Then you repeat and the concentration goes up a little. so is the steady state concentration = CO2 Rate / Vent Rate?",AskEngineers,plz_b_nice,/r/AskEngineers/comments/4z33qn/gas_mixing_dilution/
44,Bending of pipe with internal pressure,1471903621,"Mechanical engineers of reddit, what effect does a ""significant"" internal pressure have on the bending STIFFNESS of a pipe. I understand that the resistance to buckling/collapsing is significantly increased via the internal pressure assisting the pipe maintain its circular cross section, but does the pipes stiffness increase? I would have expected it'd be harder to bend the pipe...",AskEngineers,superstevethepirate,/r/AskEngineers/comments/4z32wp/bending_of_pipe_with_internal_pressure/
