index,title,created_utc,selftext,subreddit,media_only,author,permalink
0,What training would a recent engineering graduate receive?,1571776411,"Hi,

I'm a recent graduate and I'm looking for something as a mechanical engineer. I was wondering what training have you seen recent graduates get when they first start out and is it in the form of 'here's a specific resource to learn this topic go study it' or is it more like 'here's a topic, go search the web and learn about it'?

Also what do you think someone who would go straight to create their own startup out of uni would miss our on that they would otherwise get by working for an SME or a corporation?",AskEngineers,False,chocalypse,/r/AskEngineers/comments/dlnzi0/what_training_would_a_recent_engineering_graduate/
1,Welding Standards for Machinery,1571774967,"So I've got a machine, well more like a spindle rack, at work that my workplace wants me to draw up and make a build package for so they can shop around for some bids to make a few more. Me, being a somewhat diligent recent MechE graduate, decided to run some numbers to check the safety factors of all the joints on the frame. I've run into a little bit of a snag as the thing is made of A500 rectangular structural steel and is dropping into a pretty low safety factor according to the methods I've used to calculate them (Chapter 9 Shigley's) so I was wondering if anyone could point me in the direction of any welding standards for machine design or crane-able structures that they know of? And if anyone has any reference for what an acceptable safety factor would be for somthing along the lines of 5 tons that is going to be lifted and moved by crane?",AskEngineers,False,JJTortilla,/r/AskEngineers/comments/dlnm9t/welding_standards_for_machinery/
2,Looking for advice,1571774893,[removed],AskEngineers,False,fartgun42,/r/AskEngineers/comments/dlnlif/looking_for_advice/
3,Did I just make a big mistake with my career?,1571774754,I graduated with a bachelor of engineering technology a few months ago. I just took an entry-level manufacturing job because I need the money. I hand no prior manufacturing or engineering experience. Did I just make a big mistake? What is the thing I can do to further my career as an engineer at this point?,AskEngineers,False,OlleyatPurdue,/r/AskEngineers/comments/dlnk8s/did_i_just_make_a_big_mistake_with_my_career/
4,Negotiating Salary for Entry Level Position,1571774047,"Hi, I just recently graduated with B.S. in Electrical Engineering. I don't have any internship experience or experience in work relating to EE other than just my Senior capstone projects and whatever lab assignments I've done during the program. While I am looking for an entry level position for EE, I am wondering when the question about salary comes up, is it okay to negotiate salary? If so, any help in negotiating? As for me without internship or professional experience, I have no right to negotiate.",AskEngineers,False,gaybananasftw,/r/AskEngineers/comments/dlndtc/negotiating_salary_for_entry_level_position/
5,"“Show movement, not progress”",1571770748,"Recently there has been a shift in management in my workplace putting me in a position where I love what I do and the team  I work with, but am struggling with my manager. It seems what is being expected of me is not to bring value to the company or accomplish tasks, but instead limit myself to “showing movement” on my assignments. My senses are telling me this person wants to show her higher-ups that the team is buried in work. 

This is straining on me because I am a young professional who wants to grow. I am developing strong relationships with upper management too, but I am goal driven and my boss seems to recognize me for showing “what is wrong” and wants me to embrace team failure, while ignoring me when I share feasible solutions.

I want to discuss this with him but he is chronically stressed and in a very bad place right now, I’m afraid of the consequences. 

Any insight?",AskEngineers,False,BigRiddimMonster,/r/AskEngineers/comments/dlmk43/show_movement_not_progress/
6,Quitting first job out of college 6-12 months in,1571769083,"I just started working a few months ago as a Jr. Mechanical engineer, but my position is basically just a FEM and script monkey job. I've been trying to give the position some time to branch out into more interesting things, but my day to day routine is incredibly boring and repetitive, even compared to past internships I've had. In addition, the salary is not competitive, there are almost zero expectations (one of my coworkers had been here 2+ years and watches YouTube videos all day instead of working), and the discipline is my weakest/least favorite area.

I also think that it is important to note that this company is essentially a glorified staffing agency that hires new grads for cheap and offers no career opportunities beyond the opportunity to quit and directly work for the on-site client. Typical retention time is 1.5 years.

On the other side, I have a 'dream' company that I had an amazing intern experience at (summer/winter and part time during fall semester) but they were unable to hire me directly out of school due to the type of contract they get. Their next hiring period could fall anywhere between December and next August. 

How bad would it look for me to drop my current job before a year had passed to work with this new company? I can definitely see myself working at the new place for at least 2 years, and the difference in my interest between the two positions is night and day.

TL;DR: I dislike/abhor/hate my current job but have (a great) one lined up from a past internship that would open in 6-12 months. Is that too early to quit?",AskEngineers,False,Throwawayengineer174,/r/AskEngineers/comments/dlm580/quitting_first_job_out_of_college_612_months_in/
7,Looking for Some Career Path Advice (Student),1571768762,"I am a mechanical engineering student nearing the end of my degree. I'm looking for some advice on how to get myself going down a career path I'm actually interested in. I've worked as a co-op ( intern ) student at both a refinery, doing small maintenance projects, and at a consulting firm, working on building services designs and doing a lot of auto cad. I'm coming to realize that there are a lot of different types of jobs an engineer can do, and that I definitely don't want to work in consulting ( not building services at least ). ( It's not a bad industry, its just not for me )

I feel like for me I would be very interested in a quality control or testing roll, or perhaps working as a materials engineer in some sort of metallurgical industry, something more involved than sitting at a desk and picking parts from catalog or similar menial tasks. 

My issue is that I don't have a clue how to go about getting into these types of roles. Most people around my neck of the woods simply graduate and work for the same company ( once company pretty much runs every major business in the city/industrial park ) so its hard to find guidance in perusing anything different. 

I'm more of a hands on type of person, I like to be involved with the work I'm a part of beyond sitting behind a desk and sending emails about it, I like the technical aspect of things. 

Any professionals out there that might be able to give me a bit of guidance?",AskEngineers,False,ItsYaBoiNick4456,/r/AskEngineers/comments/dlm2hg/looking_for_some_career_path_advice_student/
8,Impact Force (Impulse Force?) Calculations of an Object Falling,1571768688,"I was trying to work out the impact load of an object falling onto a steel cage/  tunnel.  Seems pretty straight forward.  I was trying to work through calcs to see if a given load rating was acceptable, more so for my own curiosity.   

I have a 82 kg object falling 0.343 m on a steel cage. With a 1"" deflection (an initial guess at this point) I'm getting a huge impact force value (23.6 kN) which doesn't seem to account for the uniformly distributed load.  Just trying to figure out how to relate this to a given load rating  I'll admit, dynamics wasn't my favorite subject in school.  

Any suggestions or links you could point me to?",AskEngineers,False,EngineerIT757,/r/AskEngineers/comments/dlm1wf/impact_force_impulse_force_calculations_of_an/
9,Is there value to a +1 MBA program for Engineers.,1571764346,"So a little background, I am pursuing a degree in Engineering Management and Industrial Engineering. With transfer credits I am set to graduate in 3.5 years but I am a college athlete and would like to stay all 4 years. My school offers a +1 MBA program and with some summer classes I could complete that along with my bachelors in 4 years. I’ve heard that an MBA out of college is useless and some places won’t even hire you since they don’t want to pay more. So I guess I’m asking if an MBA is worth getting before any full time experience in the engineering world?",AskEngineers,False,randal1999,/r/AskEngineers/comments/dlkz8s/is_there_value_to_a_1_mba_program_for_engineers/
10,Can anyone explain crimp terminal size numbers? Like SV5.5-5 or SV1.25-3.5S or KS5.5-4,1571764187,"Or a chart or something. Can't seem to find anything definitive on google.

I'm looking for supplies on Aliexpress and local equivalents to amazon since I'm not from America. Chinese listings tend to vague with not a lot of specs or dimensions but these numbers keep popping up on titles and on images of the terminals. 

I need fork terminals for my 3D printer power supply. All I can seem to find locally for 12AWG terminals are for ""#8-#10 studs"". Problem is that it's too wide for the PSU screw terminals which max out around 7mm so hopefully there's a smaller option available. All I can seem to find are those three up there in the title. 

Thanks.",AskEngineers,False,iman7-2,/r/AskEngineers/comments/dlkxul/can_anyone_explain_crimp_terminal_size_numbers/
11,How do you use Neodymium strength values in calculations?,1571762423,"I'm trying to calculate the voltage induced in a copper coil by a Neodymium magnet. Based on the formula: 

emf = N\*(BA)/t

N = number of turns

A = cross sectional area of the wire

t = time to pass through coil

B = magnetic field

So if I have a, say N52 magnet, traveling through a coil, what would be the corresponding value for B?",AskEngineers,False,programmalfunction,/r/AskEngineers/comments/dlkiy4/how_do_you_use_neodymium_strength_values_in/
12,Anyone has experience with building fluorometer?,1571761782,We want to measure fluorescence intensity and need to build one.,AskEngineers,False,zyxthh,/r/AskEngineers/comments/dlkdky/anyone_has_experience_with_building_fluorometer/
13,Angles ?? Wtf,1571759486,[removed],AskEngineers,False,csnicole,/r/AskEngineers/comments/dljtv9/angles_wtf/
14,Business casual with steel toe boots?,1571758898,I have a job interview in a manufacturing environment.  They asked that I wear steel toe boots. What do I wear to the interview? (I'm a woman by the way),AskEngineers,False,fox__in_socks,/r/AskEngineers/comments/dljorq/business_casual_with_steel_toe_boots/
15,Resources on designing a bell crank?,1571757191,"I have a project where I need to design a bell crank, I was wondering if there are any useful resources that I can use to design one?",AskEngineers,False,chakara1234,/r/AskEngineers/comments/dljaie/resources_on_designing_a_bell_crank/
16,What's the best way to learn embedded system.?,1571753863,"I started learning embedded system when i was a freshman with Arduino. Now i have 3 years of experience in designing system with AVR,ARM and ESP through side projects, reverse engineering and internship.

Now i am a president of college robotics club. My day to day involves teaching my club members how to design the circuit. So i was wondering if Arduino is the best way to help my club member learn how to design embedded system?",AskEngineers,False,kchaix,/r/AskEngineers/comments/dlikae/whats_the_best_way_to_learn_embedded_system/
17,Engineering Response Letter,1571752440,[removed],AskEngineers,False,throwaway102220191,/r/AskEngineers/comments/dli9dy/engineering_response_letter/
18,How do I properly use this Hall Effect sensor?,1571748629,We're trying to use [this](https://www.seeedstudio.com/Water-Flow-Sensor-YF-B5-p-2882.html) Hall effect turbine flow sensor.  It outputs a pulse signal based on the rotation rate and we need to convert that to a 4-20ma signal.  Is there a quick and dirty way to achieve this?,AskEngineers,False,ashrak94,/r/AskEngineers/comments/dlhh6v/how_do_i_properly_use_this_hall_effect_sensor/
19,What method do you use for saving 3D model files?,1571746774,"Our folders are a mess where we save 3D model files. Our workflow is to receive customer model, redesign for plastics, make tool file. Dealing with part updates and customers not giving unique names to their files throws us off. 

What kind of methods are you using to keep this all straight?",AskEngineers,False,Athleco,/r/AskEngineers/comments/dlh3zk/what_method_do_you_use_for_saving_3d_model_files/
20,Do crank-slider mechanisms require some value of momentum to move?,1571742035,"I've been doing some reading into spinning wheels and old-fashioned sewing machines and so far as I can tell, they use a system similar to a piston in an engine. The main difference being, the oscillation is coming from a treadle. It got me wondering about something though. With the way the linkage works, rotation to oscillation should work fine at any speed. That being said, couldn't oscillation to rotation be messed up if the oscillations are happening too slowly?

If the connecting rod doesn't pass the middle point (where the rod is angled at 0°), another oscillation might cause the connection rod to push backwards, reversing the rotation. Also, if the rod is angled at 0° (almost exactly), the linkage might jam because the oscillation isn't being directed one way or another? If that is the case, the crank/wheel would need to have enough momentum to pass that spot when the next oscillation happens?",AskEngineers,False,Shjepkojaad,/r/AskEngineers/comments/dlga0p/do_crankslider_mechanisms_require_some_value_of/
21,"Need a ME for a rack and pinion design, what should they do exactly for the job and what info do I need to provide?",1571741213,"I need a ME to design a rack and pinion system where both gears are plastic (type chosen through discussion) and rather small (5mm diameter for the pinion and 6mm length for the rack). The rack is moved by a spring loaded button press and the goal is to rotate an axle the pinion is attached to for X degrees.

&amp;#x200B;

I don't know what specs/requirements need to be provided to the ME for this job nor do I know what simulations I need to ask a ME to perform other than providing CAD drawings to verify the design will work (low likelyhood of physical damage from stress, durability to ensure long-lasting operation, amount of expected backlash, etc)",AskEngineers,False,niyoll,/r/AskEngineers/comments/dlg5ar/need_a_me_for_a_rack_and_pinion_design_what/
22,Engineers with an education in Economics,1571737703,"Hello group!

I'm just looking to satisfy some curiousity here. For those of you that have studied both Engineering and Economics what do you now do career wise? I have a degree in Mechanical Engineering and Management, experience in mostly systems/electronics and project management, and I am currently studying Economics remotely. The Economics is to an extent to challenge myself but also stems from a deep interest I have in the world, policy and the political economy. Have any of you fellow engineers combined the two fields explicitely in a career?",AskEngineers,False,sisyphushappy20,/r/AskEngineers/comments/dlflyj/engineers_with_an_education_in_economics/
23,Are there any good resources for sourcing industrial robots?,1571733222,"I'm part of an industry sponsored capstone project that requires we purchase an industrial robot. Theres a number of specs that the robot has to have: range of motion about 2 ft. Preferably SCARA, though cartesian and articulated arms work too. About 0.05mm accuracy or better is preferred. We're looking for one with lots of documentation so we don't have to spend as much time on this part of the project. Budget is around $10,000. At least ISO6 and must be ESD safe.

Don't expect anyone to choose one for us but a nudge in the right direction would be appreciated.

tl;dr: Are there any places that catalogs industrial robots and their specs/prices?",AskEngineers,False,azcalg,/r/AskEngineers/comments/dlezj2/are_there_any_good_resources_for_sourcing/
24,Variable Diameter cirlce. Reverse Iris?,1571730809,I have a project coming up that needs a variable drag coefficient around a circle and was wondering if there was anything like a reverse iris that could expand the area of a circle uniformly?,AskEngineers,False,miniluigi321,/r/AskEngineers/comments/dleo1e/variable_diameter_cirlce_reverse_iris/
25,"Help: Accepted one job offer, just asked to interview for another company in the same day.",1571729188,"Hey Reddit,

A few weeks ago I posted about needed help preparing for an interview I had with a highly ranked company, we’ll call company A. Well, during the few weeks in between I hadn’t heard any news, so I attended a career fair at my college to see what other opportunities I had. I talked with another great company, we’ll call company B, and they took a picture of my resume. I didn’t think much of it other than they would hold it if I were to apply for any jobs. 
Today, around noon I received a call from company A extending a job of which I accepted. This position is technically an internship for 3 months with opportunity for full time hire afterwards. About two hours ago, I just got another email from company B asking me to attend an on campus interview and to apply to a position then set up the time slot for the position. As far as I can tell this is a 12 month program that can lead into more opportunities within that company. Company A already gave me a pay rate and bonus, and location is perfect. For context I live in the Central Valley of California. Company A is in the Central Valley with competitive pay. Company B is right in the Tri-Valley area which would mean I have to hit altamont traffic (awful but generally more pay). Anyway long story short I don’t know what to do. Both are great opportunities but I just accepted one offer. I am just looking for guidance and help. Thank you guys!!",AskEngineers,False,chewyfranks,/r/AskEngineers/comments/dlefja/help_accepted_one_job_offer_just_asked_to/
26,Calculation for Screw Turbine,1571728213,"We are designing a screw turbine to produce electricity from water for final year project.
We are blank on the calculation part as mostly Kaplan, Francis and Pelton Turbine calculations are available 
Can anyone please provide the calculation for Screw Turbine , need to provide Theoretical Proof as well.",AskEngineers,False,big_daddy_007,/r/AskEngineers/comments/dlea1o/calculation_for_screw_turbine/
27,Crush depth of a concrete pipe,1571724504,I have been wondering if a person was to take one of those massive 20 foot diameter concrete pipes and seal the ends and sink it how deep could it go before it imploded? Assuming 1 atmosphere of pressure for the inside.,AskEngineers,False,The_Zay,/r/AskEngineers/comments/dldoh5/crush_depth_of_a_concrete_pipe/
28,Developing prototype for commercial licensing/selling?,1571721954,"I have a practical idea that adds value to a consumer product. Said product sells a units in the millions every year, many players, and large price ranges.

My idea does not exist and I can't find any patents on it

I'm a new grad mech engg and have business sense. The numbers make sense imo for licensing.  Conservative numbers say 500k -1M in yearly licensing fees as it is a strong value add and will entice customers to buy higher end version. I've discussed the idea with a few experiences and smart people,very well received across at different age groups, from 20s to 60s 

Solves a real problem

Anyways, it's a mechanical, and software problem with some electrical but does not seem terribly complex even though I don't know much about it  

Have any of you had a successful product taken to market? Licensed it?

I would definitely need to patent this, a provisional and full patent imo. Imo its practical enough to add onto existing manufacturing of said device. 

I'd just like to hear some general guidance, words, or insights from anyone been down this road. 


I will look into Grant's and assistance from my city, specifically without giving up a portion of profits. Its not an expensive idea to prototype, just needs some effort but definitely doable",AskEngineers,False,Mirinfromupclose,/r/AskEngineers/comments/dld92i/developing_prototype_for_commercial/
29,How well does Loctite work on fiberglass nuts and threads?,1571721051,"Hello all,

I am currently building a performance model rocket which requires me to watch my weight very closely. As a result, i am using a lot of composite components such as fiberglass and carbon fiber.


I have opted to use fiberglass screws and nuts for my avionics bay and I wanted to ensure that the nuts stay secured throughout the flight. In addition to torqueing them, I would like to use Loctite Blue 242.


Does anyone have any experience with how well Loctite Blue 242 is at restricting fiberglass components from losing?


Also, does anyone have any recommendations or sources they can point me towards?


Sincerely,
-Nameo0",AskEngineers,False,Nameo0,/r/AskEngineers/comments/dld3a4/how_well_does_loctite_work_on_fiberglass_nuts_and/
30,HVAC for mechanical engineers,1571717560,"Hi, I'm trying to study and learn about HVAC system. What aspects of HVAC should a mechanical engineer focus on ? For example, wiring transformer, checking out thermostat with jumper are these things done by mechanical engineers ? Or designing,flow rate calculation etc.  should be the main focus ?",AskEngineers,False,Berserker_Durjoy,/r/AskEngineers/comments/dlchfm/hvac_for_mechanical_engineers/
31,Excess material removing in hardware designing process?,1571716648,"Hi all, I saw this video once {few seconds in larger  piece} where there was an object designed in 3d and then pieces were removed to the moment where properties of the hardware were not changed but used material was reduced. Is it real process or I mixed something up and it was something totally different? If it's real does this designing part/process has a name?",AskEngineers,False,geshertm,/r/AskEngineers/comments/dlcbg5/excess_material_removing_in_hardware_designing/
32,Hoe to calculate axial buckling of a steel pipe fixed at one end and free at the other?,1571714646,"Realistically in real world, expecting sudden load at the free end which won't necessarily be perfectly perpendicular, yet having to be as thin as possible due to weight requirements.

Thank you",AskEngineers,False,waciwa,/r/AskEngineers/comments/dlbxvw/hoe_to_calculate_axial_buckling_of_a_steel_pipe/
33,Do you think I should I get a Masters in Electronics Engineering or get a PhD Systems Engineering?,1571714125,"Some back ground information: I graduated undergraduate university with a B.S. in Chemistry and have been working as a Military  Officer in Communications/Information Technology since then. During the last few  years, I fell in love with Engineering and truly wished I had majored in an engineering in my undergraduate studies. Therefore I decided to take a chance and apply for graduate school in engineering. I am currently doing distance learning schooling for a Master's in Systems Engineering through the Navy's graduate school. When I applied, they said I qualified only for S.E. so I took it. Therefore, when I leave military service I  have a chance to go to the civilian world and be a Systems Engineer. Although I do not know how much of an ""engineer"" I would be as a Systems Engineer.

I really want to be one of those engineers who can get their hands dirty and build awesome new technological inventions. Like in engineers in NASA, Silicon Valley, etc...I really don't know if System Engineers really do that or not. I am concerned about my chances in terms of getting accepted to an EE program at a good engineering university or I should just apply for a PhD in Systems Engineering since I will already have my MSSE by then.

Thank you for the advice.",AskEngineers,False,sechumatheist,/r/AskEngineers/comments/dlbua6/do_you_think_i_should_i_get_a_masters_in/
34,Mid-late 20's BSMET graduate seeking advice after 3 year career change (travel). Resume attached.,1571713349,[removed],AskEngineers,False,Hal__9000__,/r/AskEngineers/comments/dlbos4/midlate_20s_bsmet_graduate_seeking_advice_after_3/
35,Defense Industry Vs Private,1571709404,"I currently work i the defense industry in the Bay Area as an embedded software engineer and i have no motivation anymore. I was full of energy and motivation 4 years ago coming in and now I don't want to go to work and may just quit without a job lined up so I can spend time studying to fix my atrophied brain. I have learned no useful skills from the job that would even translate to the private industry and I am afraid if I don't quit soon I will become one of those lifers. 

Is the the private industry that much better than defense especially in the Bay Area? Everyone says work life balance would be worse, but the pay at defense in the Bay Area is low... like $96k for 4 years experience. Processes are slow and a lot of red tape. Also anyone who knows even a little about something becomes a subject matter expert, which I think is ridiculous.",AskEngineers,False,hatemyjobokaie,/r/AskEngineers/comments/dlavvm/defense_industry_vs_private/
