index,title,created_utc,selftext,subreddit,author,permalink
0,[Question] Is there any biomedical engineering projects a freshman student could work on?,1523500855,"I wasn't too sure where to post this, so I'd be happy to move this somewhere more fitting if this isn't correct.

I'm a freshman EE student with a concentration in biomedical, so far I've just taken digital design. I was hoping to work on a project somewhat related to engineering this summer (all my past ones were all software), but I can't think of many that would connect much to biomedical.

I was debating on taking some well-known biosensors or devices, and trying to recreate it and documenting what I learned.

On the non-biomedical side, my only other ideas were to make a mini-rover, or a clock with a rotating LED stem that you can change brightness from a keypad, with a little display that tells you the range.

Is there any recommendations for projects that could semi-relate to the biomedical field?",AskEngineers,episha,/r/AskEngineers/comments/8bmwn1/question_is_there_any_biomedical_engineering/
1,Biomedical Engineering Projects?,1523500196,[removed],AskEngineers,episha,/r/AskEngineers/comments/8bmu8j/biomedical_engineering_projects/
2,Best references on hydraulic cylinder/system design?,1523497892,"Looking for any helpful literature relating to hydraulic cylinder design, especially when incorporating it within a hydraulic system on a piece of equipment (i.e. construction, mining, agricultural.) Ideally looking for design references relating to welded body double acting cylinders but open to any information about the hydraulic cylinder design or hydraulic system design world ( esp. piston joints, buckling, cushions, capscrews, plumbing systems, rephasing grooves). Thanks in advance.",AskEngineers,TheExplicitEngineer,/r/AskEngineers/comments/8bmldc/best_references_on_hydraulic_cylindersystem_design/
3,Is linkedin telling current my employer I'm looking for a new job?,1523497032,"Is this possible to know? It would be terrible that they were doing something like, keep tracking the amount of jobs I have seen, how many I have applied and how many of  those were looked by someone. In that way they could be selling that info, like a data to big companies or even selling the indicator of which of your employeers are looking for work.

There is anyone who was part of Linkedin, worked in there \(area of Marketing, BI, Developing, etc\) that can tell if they have done a product like this to sell or it will be made. 

Just to know how careful I should be with my jobs seeks and maybe I will eventually use it when too.",AskEngineers,ferne17,/r/AskEngineers/comments/8bmi0l/is_linkedin_telling_current_my_employer_im/
4,Is Power Engineering a Dead-end for Innovation?,1523495862,"I'm a junior electrical engineering students, during my last year I have to make a decision whether to specialize in power engineering or communication &amp; electronics engineering, specialization will be in the form of taking 5 courses in the chosen field. Most students choose to follow the power engineering path, mostly for the reason it is less math-extensive and it slightly tackles renewable energy topics. I did very poorly in every power course I took before this point (e.g. circuits II, electrical machines), mainly because it was just too abstract and boring, like literally, it's the same circuit but in different configurations. Not to mention there was zero motivation to investigate problems such as power factor correction. And worst of all, instructors at my school are not qualified properly to teach such courses at this level; for instance, I never learned what is the real meaning of reactive power, until I had to google that, and before that I used do abstract calculations. When I realized that I know nothing about power engineering, I decided to read on my own, and that's when I came to the conclusion that power engineering isn't interesting at all. 

The generators, motors, transformers and transmission lines used these days are the same used 50 years ago, what happened over the course of 50 years are little optimizations, and they are largely driven by the material and computer revolutions, not something original nor classic in power engineering. Perhaps that's how it will stay for a while. Don't get me wrong, these machines get the job done, they solve the problem they originally were designed to solve, but that's just about it. I think any new power engineers are actually ""maintenance"" engineers, they don't add any new value to the field. Any problem to arise in this field, probably its solution has already been found in the past. 


On the other hand, in communication &amp; electronics engineering, your imagination is the only limit. Basically it is the contrary to power engineering. That's how I see both fields, how accurate my vision is? Is power engineering a dead-end for innovation.",AskEngineers,tpapah,/r/AskEngineers/comments/8bmdeo/is_power_engineering_a_deadend_for_innovation/
5,"Home Automation Design Engineers, How To Get Started in This Field",1523495568,"Hey AE,

I’m finishing up my 4th and final year in EE and have recently taken an interest in home automation. Does anyone have some resources to get into the design of home automation systems. Not looking at the DIY wireless stuff but the hardwired solutions.

Thanks!!",AskEngineers,MyHomeboyML,/r/AskEngineers/comments/8bmc9e/home_automation_design_engineers_how_to_get/
6,Vibration Damping for Indoor Cycling,1523494681,"I live in an apartment building and occasionally use a [fluid trainer](https://www.cycleops.com/product/fluid2) or [rollers](https://www.cycleops.com/product/rollers) to train for bike racing.

Recently my downstairs neighbor made some comments about the noise, which I believe is more a result of vibrations sent through the trainer into the building than the actual noise that I am able to hear in my apartment (which, according to advertising materials/product reviews is probably a little over 60 decibels).

The first thing I have done is purchase [these](https://www.amazon.com/Diversitech-MP4-V-Anti-Vibration-Pack/dp/B00BVEMLR4/ref=pd_bxgy_328_img_2?_encoding=UTF8&amp;pd_rd_i=B00BVEMLR4&amp;pd_rd_r=E86020JY0NDBY642WTB9&amp;pd_rd_w=LxqfN&amp;pd_rd_wg=AmWab&amp;psc=1&amp;refRID=E86020JY0NDBY642WTB9).

I downloaded a Vibrometer app onto my phone and measured the floor vibration near the rollers earlier tonight. Without those pads I was getting vibrations of about 3 on the Modified Mercalli Intensity Scale (I know nothing about this, its just what the app uses), with the pads it was measuring between 1 and 2.

This seems to be pretty low intensity vibrations, but I think the machines are resonating (again not sure this is accurate) and causing a low rumbling I can hear in my apartment and may be much louder in my neighbors.

What can I do to further isolate these vibrations? My thought is to make some kind of ""sandwich"" of vibration isolation materials, but I am having a very difficult time understanding the specifics of how this should work.

For example some materials are rated for a certain weight, usually in pounds per square inch. I assume me (165), plus the bike(15), plus the trainer (15?) weighs  about 200 lbs. 

Is a material going to behave differently if I place in directly under the 8 feet (about 1.25"" diameter each, so I figure about 25 lbs/inch) than if I put it between two 2'x2' sheets of MDF and set the trainer on that (so I would have 200 lbs distrusted over 4 4""x4"" pads putting me at closer the 3 lbs per square inch).

1) Do you think I have correctly identified the source of the noise?
2) Do you think my ""sandwich"" idea will work? 
        If not what would be better/easier?
        If so, could you offer me some information (I am happy to do some reading if you can guide me to it) on what materials I would want to use and some specifics of how it would be constructed?

I work in a woodworking shop to I have access to good variety of saws and presses (if I want to do any gluing) as well as some metal working equipment (MIG Welder, small mill) to actually put this together.

And a solution that took 4 hours to build (or 3 clicks on Amazon) would be much preferable to something that took 40.

Thanks


",AskEngineers,christiantree,/r/AskEngineers/comments/8bm8uo/vibration_damping_for_indoor_cycling/
7,Engineering Physics with a software focus? Has anyone done this?,1523494383,I was wondering if it is possible to do an engineering physics degree focusing on software while building a portfolio in such a manner that you are taken seriously for software related jobs at the end of your degree?,AskEngineers,does_thou_even_hoist,/r/AskEngineers/comments/8bm7pz/engineering_physics_with_a_software_focus_has/
8,Question about Pumps and NPSH,1523493178,"Why is the formula for NPSH equal to pressure head + velocity head - vapor pressure head? How was it derived? To me, it looks like the Bernoulli Equation was used to get this formula, but everywhere I look, the resources just say that this is the formula for NPSH and move on.  ",AskEngineers,Kaio-ken_x10,/r/AskEngineers/comments/8bm31w/question_about_pumps_and_npsh/
9,Can O-rings be used for joints? (i.e. triple corner joints on a box),1523490316,"I have looked about and can't find any examples of this. Is it even possible?

If not, how would you seal a box of 6 separate plates?  
 - With and without miter  
 - Kept basic/low-tech  
 - Not glue or caulk  

If you can, how would the sealing channels/joint look?  
 - With and without miter

Cheers",AskEngineers,NopeDK,/r/AskEngineers/comments/8blrop/can_orings_be_used_for_joints_ie_triple_corner/
10,Medical Device Internship Question,1523489844,"I recently accepted an manufacturing internship with a medical device company in MN. Medical devices is a large industry here, so it's good experience for my career. I've had previous intern experience in part design, but now i get to explore the intricacies of manufacturing in a strict environment. For the engineers that work in medical devices, what would you say was the biggest learning curve i.e, FDA Compliance, lean, etc? What do you enjoy about the industry? What experience helped you grow the most? Thanks!",AskEngineers,MasterTown,/r/AskEngineers/comments/8blprg/medical_device_internship_question/
11,Field service engineer in medical devices,1523489255,"Hello, I'm currently interviewing for a field service engineer position for a company located in Massachusetts as a fresh graduate in ME. Anyone have experience working around Boston as a field service engineer for medical devices? The biggest worry is that I'll be more of a technician and won't gain engineering skills out in the field and as a result won't have much experience if I wanted to change positions/companies. Along those lines, I'm also wondering what the career progression of a field service engineer. Should I just stick to finding a normal engineering job? Any feedback or experiences would be appreciated.

",AskEngineers,Clearlylazy,/r/AskEngineers/comments/8blnac/field_service_engineer_in_medical_devices/
12,Medical Device Internship,1523489238,,AskEngineers,[deleted],/r/AskEngineers/comments/8bln8b/medical_device_internship/
13,How do you know if you can make it into robotics,1523488812,"Hello! I am a college mechanical engineering senior and I am going to be taking some time off mechanical engineering. Thats only because I found a job that offers more networking opportunities and free travel!!. Just no engineering.... 

I love control systems and want to pretty much build robots. With me being out if school and with no engineering insight within my career; what are some valuable resources that have taught you what you need to be able to succeed 

Thanks!!!",AskEngineers,ahmed38,/r/AskEngineers/comments/8bllh7/how_do_you_know_if_you_can_make_it_into_robotics/
14,Mechanical Designer wages in your country,1523487198,"Hello,

I am interested in knowing how much money do recent graduates in mechanical engineering make working as mechanical designers. (Master Graduates)

Please specify the country and industry! (bonus if you post the wage in € or US$ and extra bonus for reference to some statistics)

Do you feel this job is rather overpaid or underpaid?",AskEngineers,wirelesspattern,/r/AskEngineers/comments/8blekn/mechanical_designer_wages_in_your_country/
15,What’s an Industrial Engineer like?,1523485563,"So from what i’ve heard Industrial engineers are the “business” side of engineering. Is this basically the same as a sales engineer? What does this entail? 

I’m going to be a freshman in college next year and I am heavily considering it, I am extremely good with people and general knowledge but love math more than all. 

Would this be a good pick for me? and lastly, What is the typical day like for an IE?",AskEngineers,Grantjones11,/r/AskEngineers/comments/8bl7nv/whats_an_industrial_engineer_like/
16,Is it alright to attend this ASME meeting,1523484970,"Hey all. Im attending my first asme event tonight and I'm,still not sure if im really supposed to go to this one.

It's called a ""fellows dinner"" and I didn't recieve a confirmation to my RSVP, and I wasnt sure if it was only aprpved fellows who were supposed to attend, or not.

Any guidance, lest I walk into a restaurant for big shots and make a fool of myself?",AskEngineers,bdazman,/r/AskEngineers/comments/8bl520/is_it_alright_to_attend_this_asme_meeting/
17,Designing a fan heater using finned heating plates?,1523480592,I am designing a box fan heater. The heating elements of the heater are these aluminum plates that have a bunch of fins underneath and a silicone rubber heating element on the top. I will have 8 of these plates mounted inside the box with a fan blowing air through the plates. I was wondering if this design will work efficiently? Is there a better method for air heating? Ideally I am trying to achieve a faster time to heat up a enclosed area from ambient room temperature to 100F.,AskEngineers,hawtdumplings,/r/AskEngineers/comments/8bkl3q/designing_a_fan_heater_using_finned_heating_plates/
18,I really need hepl with my solar system.,1523475269,"Can I wire this panel: https://www.amazon.com/gp/aw/d/B071CZXHD3/ref=ox_sc_act_image_4?smid=AAIYHHUK2PORT&amp;psc=1

Directly to this pump: https://www.amazon.com/gp/aw/d/B00C6XNB50/ref=ox_sc_act_image_3?smid=A1ZOSWHLB9AJEY&amp;psc=1

It's a 50w solar panel.
 Product Specification. 
Peak Power (Pmax):50W 
Open Circuit Voltage(Voc):22.7V 
Optimum Circuit Voltge(Vmp):18.5V 
Short Circuit Current(Isc):2.84A 

Power Tolerance Range:±3% 
Maximum System Voltage DC:1000V 
Wind resistance:2400pa 
Weight:9.9LBs 
Dimension:24.8*21.3*01.2 Inch 
Application Class:Class A 
Test condition:1000W/m², AM1.5,25℃ 

And a 12v oil pump:
Power consumption: 13.2W 
Rated voltage: 12V 
Rated current: 1.1A ",AskEngineers,Mrhorny247,/r/AskEngineers/comments/8bjwf8/i_really_need_hepl_with_my_solar_system/
19,How to switch branches?,1523475154,"It was hard leaving computer science (I love coding) for mech in my freshman year. 
Now I'm a senior year mechanical engineering student. I was quite excited to learn about mech in the beginning but now when thermal and fluids came into the picture I'm loosing interest in mech. At the same time I've been reading a lot about machine learning, neural networks, genetic algorithms all these are quite interesting. And thanks to my prof I've taken up my final year project in ""multi agent system"". 

This is the thing. I'm into robotics but I'm quite into the mechanical engineering aspects of it(like kinematics, dynamics) but I'm more interested in the general logic, path planning, (basically things that a computer science engineer would handle).

What should be my future course of action..
",AskEngineers,mew_bot,/r/AskEngineers/comments/8bjvvs/how_to_switch_branches/
20,Could you build a lightweight and waterproof boat out of paper mache?,1523473161,"My sister is a water-resource scientist and her organization is having a raft building competition. The catch: IT MUST BE BUILT OUT OF RECYCLED MATERIALS. Of course there the 55-gallon-drum raft that everyone will do. I’ve looked at cardboard as well and there’s potential there. My idea was paper-macheing a canoe with a lot of layers then pulling it off as a shell and coating is with something waterproof. 

Anyway, any other novel ideas we could try?",AskEngineers,MadSkillsMadison,/r/AskEngineers/comments/8bjmbs/could_you_build_a_lightweight_and_waterproof_boat/
21,I have no idea what I'm doing.,1523473108,"I started a job as an EIT about 2 months ago in a field unrelated to my major in college. My manager is out of the office 90% of the time at meetings and keeps very little contact with me. I've been given very general instructions on what to do, and no deadlines. I'm basically sitting in my office with a thumb up my ass reading old projects and messing around in excel to get random design values. My manager doesn't return my calls, and I feel like I'm going to be outed as a fraud and fired. Is this a normal feeling for new engineers?",AskEngineers,postkip,/r/AskEngineers/comments/8bjm4y/i_have_no_idea_what_im_doing/
22,I need help with learning/studying engineering :),1523471979,"I am thirteen years old and really interested in computer science/engineering. I want to get some type of course to learn more about it- does anyone have any recommendations for books/courses/resources/programmes that I can use to learn more to get a head start? Something to help me become more of an electronics engineer. (I live in the UK if that helps you) 
Thanks :)",AskEngineers,Faarisimo,/r/AskEngineers/comments/8bjgwc/i_need_help_with_learningstudying_engineering/
23,What is the manufacturing culture like in countries outside of the United States?,1523471954,"I am an engineering student in the United States, and for a project our professor wants us to design a simple production model for a toy if it were to be produced in another country. We cannot use google to learn about another country’s culture, we must contact people.
My team came up with some questions that will help us get an understanding of how we should design our model to fit the strengths of another country. 
1.	What are the production strengths of your country? 
2.	If a product is going to be highly customizable and mass produced, what methods or techniques would you use to handle that?  
3.	What kind of testing would you do on this product? 
4.	How do you determine where you get your raw materials from (what country or company)?
5.	What are the policies with humans working with harmful chemicals? 
6.	Language barrier with customers? How do you handle this? 
7.	The type of process (machine or person or both) that is widely used? 
1.	Example: work in India is primarily human-based. Using a lot of machines does not work for that culture, but what does work is a lot of cheap labor 
8.	Are there certain things that your country’s culture values specifically in the workplace (ex/ work-life balance and a certain, enforced number of vacation days; lifelong employment (Lean system), etc.)? 
9.	How are language barriers dealt with on manufacturing floors? (ex. Will directions be given to floor workers then translated or translated initially, etc)
If you live in another country and can answer a couple of these questions, please do!
",AskEngineers,Acatt123,/r/AskEngineers/comments/8bjgre/what_is_the_manufacturing_culture_like_in/
24,Please Help Me,1523471343,[removed],AskEngineers,Faarisimo,/r/AskEngineers/comments/8bjdrw/please_help_me/
25,HVAC question about blower pressure,1523470388,"Hi there folks! I've been tasked with improving the air supply for a small foundry furnace (little 12"" hobby cupola for iron) and I have a few questions. 

We're currently running the thing off a leaf blower, but they've taped half the intake shut because ""we want high pressure air but not a lot of air volume"" going into the burn chamber. I have my doubts that this is working as intended. Wouldn't the pressure drop as the motor can't pull in as much from the intake? 

I'm finding results for squirrel cage blowers online with a big beefy 1/3 HP motor attached, but comparing that to the 700 W leaf blower it looks like it would actually be a downgrade in wattage. How is this possible, when the leaf blower motor is not much bigger than a soda can? Also, we don't have 220v as an option. Can you get better than 1 HP from single phase power? 

Finally, my overall question is just how to get more pressure than a leaf blower from some cheap used HVAC equipment. If there's a better option than a big rotating blower I'm not aware of it.

Thanks! ",AskEngineers,Amadameus,/r/AskEngineers/comments/8bj93k/hvac_question_about_blower_pressure/
26,"Just for fun, what's the least satisfying mechanical sound?",1523470292,,AskEngineers,nullcharstring,/r/AskEngineers/comments/8bj8mk/just_for_fun_whats_the_least_satisfying/
27,Just for fun: What is the most satisfying mechanical sound?,1523468810,,AskEngineers,AcuteMtnSalsa,/r/AskEngineers/comments/8bj1a9/just_for_fun_what_is_the_most_satisfying/
28,Technician experience vs internships?,1523468211,"I'm a sophomore engineering student having a hard time finding interships for the summer, but there are a lot of technician positions out there. How does technician experience stack up against interships in the eyes of an employer?",AskEngineers,PainFlavoredBaby,/r/AskEngineers/comments/8biygx/technician_experience_vs_internships/
29,What's the deal with the conflicting surface roughness values I am being told?,1523464855,"A general google search tells me that waterjet/laser cutting produces better surface finish than (form) milling. Although, the literature I have reviewed tells me otherwise. For 10 mm sheet thickness of the same material at comparable cutting parameters, for laser cutting and waterjet cutting a surface roughness Rz of 50 and 27 micrometers is obtained respectively. For milling, however, sheet thickness 20 mm (which I assume would result in even greater roughness, but have read depth of cut is negligible to roughness in form milling) a surface roughness value Rz of 8 micrometers is obtained.

Am I comparing Apples with Oranges?

These are my sources:

Milling - The influence of tool-surface contact on tool life and surface roughness when milling free-form geometries in hardened steel, Scandiffio

Laser - Experimental Investigations on Fusion Cutting Stainless Steel with Fiber and CO2 Laser Beams, Stelzer

Waterjet - Investigation of the Effect of Cutting Speed on Surface Quality in Abrasive Water Jet Cutting of 316L Stainless Steel, Loshcner",AskEngineers,simplesef,/r/AskEngineers/comments/8biia8/whats_the_deal_with_the_conflicting_surface/
30,Question about wall thickness calculation method,1523464278,"Hi

I'm trying to calculate the wall thickness of a vessel. The vessel is made out of stainless steel and only subjected the stress of its on weight and contents.

In coluson and Richardson I found an equation for the vessel dead weight but it includes wall thickness which I want to calculate

Can someone clarify how to preform this calculation? ",AskEngineers,Baltazar17,/r/AskEngineers/comments/8bifrs/question_about_wall_thickness_calculation_method/
31,Wall thickness calculation,1523463970,[removed],AskEngineers,Baltazar17,/r/AskEngineers/comments/8biea4/wall_thickness_calculation/
32,Applied Engineering Degree worth it?,1523463546,I am currently getting a AAS in CNC manufacturing Technology. My school just signed an agreement that I can transfer into an BAS of Applied Engineering. I am thinking I want to become a Manufacturing Engineer. I can not find a lot of information about the differences between a Applied Engineering Degree and other Engineer Degrees. I would like some opinions on the Applied Engineering Degree and if it is a worth while investment.,AskEngineers,Miquizbe,/r/AskEngineers/comments/8bicb9/applied_engineering_degree_worth_it/
33,What software and approach do you use to make isometric kinematic diagrams?,1523463332,"[I've uploaded an example of what kind of diagram I mean here](https://i.imgur.com/m844lvg.jpg).

My mates tell me to just use Solidworks 3D sketch and then edit it in AutoCad, but that just seems silly. There clearly has to be a software for these kind of tasks, some drag and drop type of diagram maker?

Anyhow, I'm interested in how you tackle 3D kinematics.
",AskEngineers,PresidentOfLatvia,/r/AskEngineers/comments/8bibad/what_software_and_approach_do_you_use_to_make/
34,Automating Straightness Measurement Of Small Rods,1523461812,"I have a project that involves measuring different sized tungsten carbide rods for length, diameter, roundness and straightness. The smallest size of rod is 1mm diameter and 100mm length, largest 40mm dia and 500mm length. We are using a laser micrometer and was wondering if this setup in this video (0:31) https://www.youtube.com/watch?v=zvuP4Usis-M would be appropriate (or similar). A linear actuator would push the rod from the back along a trough lined with circular supports to rotate the rod simultaneously. My concern is that the rods would be too light to rotate properly since the circular supports need to be smooth to allow easy sliding and avoid the rods 'bouncing'. Any help on this would be appreciated.",AskEngineers,Montags25,/r/AskEngineers/comments/8bi3xz/automating_straightness_measurement_of_small_rods/
