index,title,created_utc,selftext,subreddit,author,permalink
50,Help me with my 11th grade engineering project.,1469763045,"So I'm about to be in the 11th grade. I chose to take AP Physics because I think I'll liked to be challenged in a fun class. We are assigned to do an Engineering/Science Fair Project. As an aspiring engineer I chose to do an engineering project.

Here's where the help is needed. I plan on doing a project about wind turbines since renewable energy is a great area to do. But I need to improve or create something in my project for it to be considered an engineering project. I have no idea what to improve or create and I'm hoping you guys could help, Thanks.",AskEngineers,_Dustyyyy,/r/AskEngineers/comments/4v4n31/help_me_with_my_11th_grade_engineering_project/
51,(Soon to be) Aeronautical Engineer: Need advice on career direction,1469755613,"Long post, sorry. Here's a TL;DR: Big vs small company. Big company offers career advancement and a chance at ""maybe"" getting amazing job after slogging through 3-5 years of an un-ideal position. Smaller company offers happiness and great career alignment, though it may result in me straying away from ""true"" structural/aero/manufacturing.


I'm currently finishing my final internship at a large aerospace company before I head off to finish my final year of university. I'll start my post by saying, I'm very fortunate to have the issue I'm having. However, it's been a large source of stress for me, as I have a very tough choice to make about my future career. To make this long post easy on the eyes, I'll explain the pros and cons of each option, and then my thoughts comparing the two.


**Company 1:**


Prior to starting at this big company, I worked at a small, albeit quite well known design company in the aerospace industry. Enjoying art and creative ""things"" outside of engineering, this was a really cool fit for me doing design prototyping and interfacing with industrial designers to make concepts real. I spent two summers with the company, and they have seemed very excited and open about the possibility of bringing me back full time. The pay is competitive, and personality wise, I fit in better with small companies. I know I would be (very) happy there.


Pros: 

* Proven to have talent and genuine interest in the work

* Heavy design focus

* Like the people, benefits and facilities

* Behind the scenes, but makes huge impact on aerospace, feels like work ""matters""

* Customer-facing though not so much as the second option

Cons:

* Small company, lack of possibilities for lateral moves, other career directions
* Rather specific role in industry, could see myself shoehorned into a corner career-wise


**Company 2:**


On the other hand, I have spent this summer in production engineering, just to get a taste of the industry from another light. Quite frankly, I was not enjoying it, and planned not to return post-graduation. However, I recently had the opportunity to shadow flight-line production engineers, where they prepare aircraft for test and then delivery. Being very interested in customer-facing jobs and fleet-side engineering/operations, it was an awesome experience. I love learning about aircraft routes, fleet operations and testing, and to literally be able to meet returning aircraft at the gate and address engineering problems on the spot was *amazing*. However, I was told it is rarely a first job for college-graduates. The advice I was given was to initially gain experience in factory-side production (maybe 3-5 years?) and then I might see the opportunity to come to the group arise. This is likely my only chance to get my foot in this door, as the only other place to really do this kind of work is in Toulouse.


Pros:
* Very unique line of work, genuine interest in flight ops/test
* Close to planes every day
* Opportunity for immense career growth, company name recognition
* Chance to work on new aircraft programs
* Customer-facing, cool opportunities for travel, networking

Cons

* More rigid company, not as enjoyable culture
* More stress, and mandatory overtime
* Must work a few years in an un-ideal job just to ""maybe"" get position I want
* Focus on paper-pushing rather than real engineering
* No design aspect (i.e. no CAD used at all)



When it comes down to it, I really don't know what to do. I have the chance to really boost my aerospace career by staying at the big company. I've been told that by staying there I essentially ""pay my dues"" and can find myself able to realistically go anywhere from there (including the smaller company). However, I know I will be the happiest at the smaller company in the long run. Pay and location are basically the same in both cases.


Thoughts, life advice, words of encouragement? I realize that it's very obvious which companies I'm talking about. So, if you have specific advice/notes about the companies in question, please PM me. I appreciate all the advice I can get.
",AskEngineers,Spiah,/r/AskEngineers/comments/4v44hp/soon_to_be_aeronautical_engineer_need_advice_on/
52,Something that controls the size of a hole like a camera aperture?,1469755420,"I'm building something and I need something that has a hole and you can control the size of the hole - sort of like a camera aperture. Like I'm guessing the hole size can be controlled with a knob. It can go from like a .25 inch diameter hole to an inch 1 inch diameter hole. The hole is circular. 

Is there anything out there like this?",AskEngineers,lqcnyc,/r/AskEngineers/comments/4v43yz/something_that_controls_the_size_of_a_hole_like_a/
53,(Soon to be) Aeronautical Engineer: Looking for guidance on my post-graduation career trajectory,1469753975,[deleted],AskEngineers,[deleted],/r/AskEngineers/comments/4v409n/soon_to_be_aeronautical_engineer_looking_for/
54,What is planning&amp;improvement engineering? What material can I study to be better at it?,1469746697,[deleted],AskEngineers,[deleted],/r/AskEngineers/comments/4v3hwn/what_is_planningimprovement_engineering_what/
55,Does centrifugal force exist?,1469741973,"I know it is used in a rotating frame of reference, but is it a real force? And if it is, what type of force is it? It has to be a long range one, right? But i can't find any of the four to fit. Not gravity, not electrical, not the strong force, not the weak force. 

Edit: I have done a bit of research, but i got many sources saying it exsist, and many saying it does not. Would appriciate if you could say what degree you have with your answer. English is not my native language.",AskEngineers,SgtBjarne,/r/AskEngineers/comments/4v35bq/does_centrifugal_force_exist/
56,[Civil Engineering] Been pouring over this beam for days; confused about methodology,1469741033,"Hi all,

I've been working on this problem for the past 2 weeks and it seems like every time I attempt to come to a solution, I find I'm not doing the correct methodology. I've tried to follow examples in two textbooks (Design of structural elements by Chanakya Arya &amp; another book I forgot the name of at the moment) but I get more confused especially when I attempt to cross reference to EC2 or BS8110. 

Here is the example I'm struggling with:

http://i.imgur.com/WvS9ZLq.jpg

2,000x2,000mm beam. Doubly reinforced in both compression and tensile zones. 9 bars in two rows in each zone; All bars are 40mm dia and each row is separated at a distance of 40mm from each other. 

Overall the beam is 7m long and the load, w= 359.1kN/m 

It is C32/40 concrete and the bars are grade 435N/mm2

I need to find out the maximum bending moment applied by the load and the moment capacity (i.e. the maximum moment the beam can withstand before failing).

I have attempted this a number of ways, but I don't think either way is correct. I want to know how others would do this as I am at a loss with the pages of working I have done! Please please show working as I've come across so many examples which seem to skip a few steps or look incomplete because they have not got any working! 

Thank you in advance! ",AskEngineers,Jetblast787,/r/AskEngineers/comments/4v32mf/civil_engineering_been_pouring_over_this_beam_for/
57,Killing Ants with Compressed Gas,1469735370,"Greetings folks,

I recently went on a hike to a local nature area, it sits on lake Ontario between a marsh and a bay. It is infested with the invasive European Fire Ant. I'd like to take a stab and throw some ideas at the local conservancy organisations to see if we can't deal with this situation. 

Lets ignore pesticides for the time being.

I read a paper on using liquid nitrogen to kill the Red Imported Fire Ant, by some Taiwanese grad students/professors. It seems to work very well. Their initial testing shows that at -12.5C there is a 10% to 20% survival rate, but at -15C it drops to near 0%. So using LN works great, obviously.

But using LN like that doesn't seem feasible on such a huge area. So I was thinking, you can get 4500psi HPA tanks for paintball. If I was able to attach a regulator to it, to drop it down to say 50psi, and then with a long stainless steel nozzle, jam that into the ground and blast. Do you think it would freeze them? 

How would I go about calculating the temperature drop? Or would the temperature drop only happen in the regulator?

I'm wondering if I would just end up blasting ants all over the place. So any help would be appreciated. Even telling me the names of formulas to look for would be appreciated.",AskEngineers,adaminc,/r/AskEngineers/comments/4v2m8r/killing_ants_with_compressed_gas/
58,Can i do anything with a MET degree?,1469727869,"So basically i was ill advised and didn't do my homework in college,  and I went for a BSMET instead of going to a larger school and getting a BSME. I graduated in 2012 and since then only worked in construction and doing drafting and cnc work.  It's very boring to me and seems a dead end anyway,  only so far you can go just doing CAD. 

My current job,  the company is closing down in a few months.  Not a big deal i was planning on looking soon anyway.  I'm just getting a bit discouraged looking up jobs. Most listings mention only bsme and want a lot of experience i don't have,  either in fields i can't get into without the experience beforehand it seems,  or just with programs with which I only have a cursory knowledge.

So i push around the idea of getting a master's degree,  but I'm told by people often that it's a waste of time and money unless a job specifically wants it/will put me there,  or i want to do research. Also looking up schools several will flat out say that technology degrees don't meet their requirements.

Sorry if this is the wrong sub to ask in but idk where else would be better. Just wondering if anyone knows if i can get any kind of actual engineering position with my degree, and if so do i even have a shot being so far out of school with no actual engineering experience.  Otherwise if i would be aided by going back to school if i could. ",AskEngineers,Iamahumanwaste,/r/AskEngineers/comments/4v1zbv/can_i_do_anything_with_a_met_degree/
59,Anyone who has competed or knows about SAE Aero Design Micro class have any tips or information on how to design a micro class plane?,1469726192,"Hello,

I'm an aerospace student that will be competing in SAE Aero Design Micro class, and this is going to be my first year doing it. I have competed in the regular class competition, but I'm completely new to the micro class.

Does any one have any tips from past experience? any do's or don'ts that might be helpful? 

Currently I'm thinking about starting and basing whatever design I make off of stall speed. Since launch is one of the most important aspects, I want to design a plane that has a very low stall speed, from that I can get a Cl value for the airfoil and work from there. Does this approach make sense? are there other parameters or things I should consider?

Making a plane that is compact and can lift a lot involves maximising these parameters:

Cl

Cd

Span

Empty Weight

Thrust

Stability and Control Derivatives

Modularity

Are there any other very important parameters I should account for?

Thank you for the help!",AskEngineers,Destroctokon,/r/AskEngineers/comments/4v1tza/anyone_who_has_competed_or_knows_about_sae_aero/
60,How much silicon (mass) goes into a solar panel?,1469726086,"Obviously there are going to be different sizes of solar panels, so I'm asking for something like the ratio of silicon to wattage or something like that.",AskEngineers,shivering_rectum,/r/AskEngineers/comments/4v1tn1/how_much_silicon_mass_goes_into_a_solar_panel/
61,Is the money better staying with one company or jumping ship?,1469724630,"I just left my first job after college after one month. It's for a leadership development program at an energy company. I know, after one month, it's not good. I'm wondering how much commitment to a company is worth. This question is for those later on in their careers: would commitment to one company pay you more or does changing companies? I imagine changing companies be the harder of the two because one who stays would know a lot about how the company functions.

Also, can anyone advise on where to move on from here? I will continue looking for another leadership development program.

EDIT 1: thank you everyone for all your answers. It seems like the better idea is stick through it; stick with the devil you know.",AskEngineers,winndixie,/r/AskEngineers/comments/4v1ozd/is_the_money_better_staying_with_one_company_or/
62,If I major in Mechatronics can I be hired as any of its disciplines?,1469717866,"If I major in Mechatronics can I be hired as any of its disciplines? In other words can I go to an employer with a degree in mechatronics and get a job as an electrical, mechanical, or computer engineer?",AskEngineers,READERmii,/r/AskEngineers/comments/4v14a9/if_i_major_in_mechatronics_can_i_be_hired_as_any/
63,Free Software Engineering Courses,1469716643,"Could free online courses (such as what is offered by MIT) be used as experience or possibly help someone get into a software engineer position?

I am currently a quality engineer with a degree in mechanical engineering and am looking to get into the software engineering side of things.  I stumbled upon these free courses online and was curious if this could help me make the switch into software QE or if there is a better path I should take?

Edit:  Thanks for all of the advice!  I have decided to sign up for Harvard's CS50 course and aparently just in time being that the first assignment is due August 12th.",AskEngineers,sports3278,/r/AskEngineers/comments/4v10na/free_software_engineering_courses/
64,Industrial Engineers at a Tech Company,1469716582,"Hi Reddit, 

I am going into my final year of University for Industrial Engineering. I have always been interested in new technology, constantly following tech news and always tring to find out how the big 4 do the things you do. I decided to choose industrial engineering over computer science or electronical because I enjoy the manufacturing side and the business side of engineering. 

My questions are if you are an industrial or manufacture engineer at a Tech company (either one of the big 4,  a start up, or something similar) 

1. What do you do there? 
2. How did you find the opertunity there? 
3. What don't you like about your job? 
4. What do you like about your job? 

Thank you reddit!",AskEngineers,Helpmyfriendzach,/r/AskEngineers/comments/4v10h2/industrial_engineers_at_a_tech_company/
65,Usage of solar-powered vehicles in the Arctic,1469713236,"Hey all,
For a university project, the group I belong to have to design a solar -powered vehicle for South pole exploration. We need to 'research the market' and because this is a pretty niche area, I was hoping you guys could provide some aid.


We need some information on the type of work or research fields that could most benefit from a remote terrain vehicle as well as any extra requirements a user of the vehicle might require, like specific tools or equipment.


Completing this survey would also be of great help.
https://docs.google.com/forms/d/1B4FOZHdUVgJFpgbVaf8pwCtwAvsDcBoS5biHaSC43vE/viewform?edit_requested=true



Thank you all, any bit of information would be much appreciated. ",AskEngineers,Lenstar995,/r/AskEngineers/comments/4v0qtf/usage_of_solarpowered_vehicles_in_the_arctic/
66,"wireless communication over long distances, Hollywood-style",1469712574,"So this is kind of a silly question, apologies in advance.  It'[s for a tabletop game campaign, so *actual* realism is only partially required, but I like to be at least close to the real thing. I'm looking for the ""When Hollywood actually does their homework"" level of accuracy, but not it doesn't necessarily have to be 100% realistic.

Concept: If someone was designing a set of cell phones that needed to only talk with each other, but had to be capable of doing it over long distances (Across the United States, or even internationally), what would be the best way to do this? I was thinking HF radio waves, but the reading I've done suggests transmission rates are pretty low, even at theoretical maximums. The idea is that one device is the ""master"" and the others all connect and relay their information through that one. I dont want them using regular cell towers because privacy is the key reason we're building them anyway.

How would you connect these devices across the globe if you were writing a TV series? Bonus points if you explain how the signals are encrypted!


Edit: this sub is awesome, several great ideas already! Suggestions are always appreciated!",AskEngineers,forte_bass,/r/AskEngineers/comments/4v0p5x/wireless_communication_over_long_distances/
67,Degree Question - Interesting Situation,1469709881,"Hello,

I graduated in 2010 with a BA in Marketing/Entrepreneurship and after working in the ""real"" work I developed a love and passion for engineering and good design (I worked heavily with an R&amp;D department).  After much debate I went back to school for a degree in engineering.  Currently I will be completing my associates in engineering this fall and I'm split on what to do next. 

I know I want to work in an engineering department and my days of marketing are behind me.  

But there are two options at this point.
1)finish the BS in Mechanical Engineering 
2)Get a graduate degree in Mechanical Engineering 

But my question is - would anyone hire someone with such a diverse degree background?  Or am I shooting myself in the foot?  Or am I over complicating things?  

Thoughts?

Thank you.",AskEngineers,Bobbagonuggetesh,/r/AskEngineers/comments/4v0idb/degree_question_interesting_situation/
68,Key to success? Any tips for a recent-grad?,1469709125,[deleted],AskEngineers,[deleted],/r/AskEngineers/comments/4v0gkj/key_to_success_any_tips_for_a_recentgrad/
69,Questiond about becoming a computer hardware engineer,1469686304,"Hi, I'm currently going into grade 12, and have found a passion in computers, from writing code for games, to building computers. What interests me the most is designing actual computer parts, such as processors (computer hardware engineering). I am pretty smart, got 85% in physics 11, 83% in pre-calc 11, and 83% in chemistry 11 this year (although I could have done better if it werent for playing hockey and working, which is why I'm choosing to quit hockey so i can focus on getting better grades next year). so next year I am taking Pre-calc 12, physics 12, and chem 12 (also, next year will be my 4th year taking Drafting).

My dad works at Trinity Western University, so I get tuition for free, but they only have 2 years of pre-engineering. Will this be helpful? Or should I just hop right into computer engineering right out of highschool at, say, UBC, or UVIC (both universities in British Columbia, Canada). I want to use the free ruirion to my advantage, but if it is just a waste of 2 years when I could be done two years of computer engineering already, whats the point?

Also, I have a good work ethic, but I also do need a social life. Will studying for computer engineering take any chance of social life away from me? Or is the workload not as bad as other Engineering programs, that I hear have insane work load. 

As well, is a bachelors degree in computer Engineering all I need to find a job as a Computer Hardware Engineer? Or do I need a masters? Because more than four years would be very expensive And too much time for me I think.

What  affordable universities have good computer engineering programs that don't completely take away social life?

Hows the job market for a computer hardware engineer?",AskEngineers,kieranc14,/r/AskEngineers/comments/4uz90k/questiond_about_becoming_a_computer_hardware/
70,"How do you quantitatively determine when to keep checking a design, vs. when to just make the darn thing?",1469668823,"How do you determine how many times you should check a design before you make a prototype?  Is it better to check and review a design several times, and try to get it right the first time?  Or just check and review once or twice, and account for making two prototypes if necessary?

Is there some quantitative way of determining the scenario that is optimum given the cost of fabricating a prototype, and the information gained from a review, and a prototype?

Let's say the cost of your labor is L/day, the cost of having someone check and review your design is C/day, with a review time of R days, and the cost of fabricating your prototype is M, with a turn-around time of T days. 

Has anyone...like in management.....done something like this before?",AskEngineers,jubjub7,/r/AskEngineers/comments/4uy5eg/how_do_you_quantitatively_determine_when_to_keep/
71,What is the optimal way to detect when a rotating cylinder is at x deg?,1469664441,[deleted],AskEngineers,[deleted],/r/AskEngineers/comments/4uxtxa/what_is_the_optimal_way_to_detect_when_a_rotating/
72,Average time to move up from Engineer I to Engineer II?,1469662020,"Hey all, newly employed soon-to-be grad here. I'm excited to be starting my first job at a major defense contractor with the title Systems Engineer I. I'm just curious, how long did it take you (or someone you know) to move up from Engineer I?

I understand this might be highly company dependent, but I'd just like to get an idea of other people's experiences. I'd appreciate your insight.",AskEngineers,Requiiem,/r/AskEngineers/comments/4uxn4p/average_time_to_move_up_from_engineer_i_to/
73,Precooled Jet Engine,1469661847,What does the precooler do in a jet engine? Why would you want to cool air in the engine? ,AskEngineers,atlaspaine,/r/AskEngineers/comments/4uxmoj/precooled_jet_engine/
74,Methane to run a Turbine,1469660411,Can methane be used to run an aircraft turbine? ,AskEngineers,atlaspaine,/r/AskEngineers/comments/4uxirw/methane_to_run_a_turbine/
75,Unsure if new job sucks or if its just growing pains...i also have another offer...,1469653195,"I have to make a job decision.

I am currently working in the automation manufacturing industry for a small company that develops composite materials for automation. Currently working on some pretty cool project developing a composite transport vehicle. I have worked here for a few weeks now.

However, management is absolutely awful. There has been no real attempt to formally induct/introduce me to the project and instead im left twiddling my thumbs doing the occasional piece of work, however its very menial stuff which to be honest is all im capable of due to their refusal to properly train or mentor me. I feel long term I may get more involved and be actively involved in the project a lot more. I do stress though, management is dreadful. The project manager is a yes-man who spends most of his time away and leaves the project to the hands-on tooling guys. There seems to be a lot of conflict of interest regarding the development of this project. Despite them hiring me and me making it very clear i would require time to learn, i am ultimately a fresh grad, there seems to be some kind of expectation that im more capable than i am. I worry i will lose my job soon, however this could just be new job nerves speaking.


My other offer is again a design engineer role, however its for a company that specializes in electronic components. The company is bigger albeit less forward thinking/ground breaking. The projects will be a lot more standard due to the companies experience and the fact its a branch of a larger subsidiary. I imagine there will be more formal training on hand.

Im stuck between a frantic yet rewarding position that may lead to a very specialist career path, assuming i dont get fired. Or a slightly more structured company/role working on less exciting projects. However there seems to be more structure, no shitty management and an easier opportunity to develop at a reasonable pace.

Any insight appreciated. I guess ultimately my question is whether its worth sticking it out with a job because the project is very exciting and it has good prospects despite piss-poor management, shit training and a concern that they hired me and expected more (despite me making it very clear i was a complete newbie) which may lead to losing my job soon.",AskEngineers,Swagkingcole111,/r/AskEngineers/comments/4uwxqo/unsure_if_new_job_sucks_or_if_its_just_growing/
