index,title,created_utc,selftext,subreddit,author,permalink
0,What exactly are the real world applications of computer engineers?,1472873597,"I want to one day, hopefully, make some great innovations in the technology space. Would this be a good degree to pursue? As I know the theory of computer engineering, but what are some of its real life applications?",AskEngineers,Natsu_Firefox,/r/AskEngineers/comments/50x42c/what_exactly_are_the_real_world_applications_of/
1,Why hasn't an unsinkable boat been invented?,1472863527,There a plenty of materials that are less dense than water.  ,AskEngineers,civgarth,/r/AskEngineers/comments/50wh2m/why_hasnt_an_unsinkable_boat_been_invented/
2,Combustion engine friction in function of speed and load,1472856835,"I am unsure what happens with piston and crank assembly friction at high speeds for different loads. Assuming hydrodynamic lubrication, [Stribeck curve](http://assets.materialstoday.com/wpimg/float/98ad1df6-b300-43fa-baf0-fb044c41c594.jpg) says friction decreases with increasing load at constant speed. However, does viscosity increase with increasing load to such an extent that the decrease in friction is neutralized? ",AskEngineers,CatInTheWallEh,/r/AskEngineers/comments/50w01z/combustion_engine_friction_in_function_of_speed/
3,A case for software engineering,1472854521,"Anyone who has spent time in the engineering realm knows about the flame war between traditional engineering disciplines and software engineering. I've been undecided about the classification but am becoming increasing more accepting of software engineering being a legitimate engineering discipline. I am looking for thoughts, opinions, criticisms, etc.

Software engineering fits the broadest definition of engineering: the branch of science and technology concerned with the design, building, and use of engines, machines, and structures. Instructing a machine to operate in a certain way definitely concerns the design and build of that machine.

Software is becoming increasingly more important in our society, and there are millions of life-critical systems. Software engineering is often critiqued for being an immature field and not having the rigor of other engineering disciplines. For many systems this just isn't the case. Additionally, I work with several MechE's who work on designing and developing swimming pool liners. Their work isn't life-critical and therefore you cannot say software engineering isn't a legitimate engineering simple because not all systems are critical.

Software engineering's generally come from computer science backgrounds, and a computer science curriculum is just as rigorous and mathematically challenging as (if not more so) than many traditional engineering disciplines. Some core classes at most universities: Calc I, Calc II, differential equations, linear algebra, discrete mathematics, discrete probability, statistics, numerical analysis, calc based mechanical physics, calc based elctromagnetism, thermodynamics, ethics related class, etc.

Software engineering is quickly becoming extremely well regulated and there are a lot of compliance mandates similar to other engineering disciplines

I agree that the field is immature in it's methods, but after reading Kuhn's, Structure of Scientific Revolution I began to look at SE in the same way as chemistry in it's post alchemy phase. I think that in 100 years there is going to be no debate about whether SE is a legitimate engineering field or not. It is going to become much more relevant than any other engineering discipline other than EE or CpE",AskEngineers,KingCrocoDucking,/r/AskEngineers/comments/50vtqz/a_case_for_software_engineering/
4,"Why are ""Maintenance"" &amp; ""Engineering"" separate areas in most big companies?",1472845887,"I mean, why give the responsability of designing a system to someone who won't need to fix it. I know that separare areas  should work together and all that, but you know what i mean. Also, sorry for my shitty inglés",AskEngineers,hechopercha,/r/AskEngineers/comments/50v4tt/why_are_maintenance_engineering_separate_areas_in/
5,Does anyone know the relationship between Nvidia Quadro video card performance on CAD rebuild time for Solidworks. Or maybe a better way to ask is does a super high end card rebuild an assembly faster than a middle of the road Quadro card?,1472842468,"Currently have a 4Gb nVidia Quadro M2000, but thinking about a M4000 or maybe even a M5000 if the time savings is significant",AskEngineers,chriswlezien,/r/AskEngineers/comments/50uugm/does_anyone_know_the_relationship_between_nvidia/
6,What is european equivalent for MEP engineer?,1472842352,[deleted],AskEngineers,[deleted],/r/AskEngineers/comments/50uu2q/what_is_european_equivalent_for_mep_engineer/
7,Going contact to direct,1472837086,"So my supervisor told me today that my company will be converting me from contact to direct after my 90 day review.   I am working for an American automotive OEM doing ISO 26262 work.  What should I expect as a pay increase, and what should I ask for? I have been in the industry for almost 13 years, seen my pay almost triple since graduating, and want to know what someone in my position should be compensated with. Should I get 4 weeks of vacation? And how much over my current contract rate should expect? And what if they come back with less than I want? 

I am currently doing ISO 26262 work, and have been doing it for 2.5 years. There are very few people in the company with my level of experience or knowledge. How can I best leverage that? ",AskEngineers,unclerudy,/r/AskEngineers/comments/50udgo/going_contact_to_direct/
8,A question from my 8 year old re: The Flash,1472835649,"Assume that someone can run (or float or whatever) at any arbitrary speed. What is the safe limit of speed without additional protection or equipment needed for safety (e.g. air friction burning their face off, air pressure making it impossible to breath).

My curious 8 year old son thanks you in advance.",AskEngineers,timlin45,/r/AskEngineers/comments/50u8yb/a_question_from_my_8_year_old_re_the_flash/
9,Trying to calculate battery requirements for AGM/Lithium,1472829706,"Hey guys,

I'm comparing AGM to Lithium right now for power. Lithium is stupidly easy. You just look at the output of the battery, and as long as it's not super hot or super cold, it's relatively consistent on output power. Many testers have actually found that the output for lithium batteries is even better than they are rated for.

The example I'm looking at is an espresso machine with a 4000 watt 220 volt boiler. Roughly 18 amps. And it will be running about 1/3 of the hour during the busy times to keep the temperature up.

[Using this guide](http://www.powerstream.com/battery-capacity-calculations.htm)

18*1200/3600 + 0.5(2400)/3600 = 6.3 amps average current. 6.3AH During busy times.

18*600/3600 + 0.5(3000)/3600 = 3.4 amps average current. 3.4AH During slow times.

But that seems really low.

I did notice that AGM batteries are rated at 20 hours. So a 400 AH AGM is rated to have that 400 AH drawn over the course of 20 hours. But they also shouldn't go below 25-30%. So 

400(ah) * 70% = 280 AH over 20 hours. Or 14 AH per hour.

So if I'm busy for 4 hours a day and slow for the other 4, that's (6.3 * 4) + (3.4 * 4) = 38.8 total AH drawn over 8 hours. Well under the 280 AH rating. And under the per hour draw.

---

Does that all seem correct so far? It's way off some other calculations I was doing. Probably the wrong way. Before I was going off kwh based off the wattage and probably messed up the volts.

---

So to power the same setup on lithium, I'd need a 40 AH battery correct? In a perfect world where usage is exactly what was stated above.

For a AGM battery, I'd probably need a 100 AH battery to get the same usage.

100(ah) * 70% = 70 AH over 20 hours. Or 3.5 AH per hour. So with the draw being higher (6.3 AH) in the busy hours, it will tax the battery more and cause the 70 AH rating to fall off.

---

Does this all add up? If so, it's really really good news because I'm way under what I was calculating before.

The setup I did before was use [this site](https://lazycackle.com/Convert-from-Ah-to-KWh-Online-Calculator.html).

I was trying to get the AH requirements for the machine. Based off 4 hours of 1/3 power, 1.2 kwh per hour. 4.8kwh. But I didn't know what volts to use so it was probably a useless calculation going off kwh.

Ah I think I figured my issue. I didn't sets the volts correctly. The machine is 220 volt. If I'm drawing 1.2kwh on average during rush, it's showing as around 5.5 AH.",AskEngineers,darrenphillipjones,/r/AskEngineers/comments/50tqup/trying_to_calculate_battery_requirements_for/
10,Question regarding getting into the Solar Panel industry,1472825360,"Hello, I'm aspiring to begin college rather soon to get into the creation of solar panels (such as actually building them or designing them). I've noticed some colleges have started up specific degrees into renewable energy, still requiring a degree in mechanical or electrical engineering. My question is thus: Going into the engineering field, would it be better to strive for a bachelor's degree in engineering, either mechanical or electrical, with focus on solar panels, or a more specified degree offered for primarily solar energy these colleges are offering? ",AskEngineers,Sam-sara,/r/AskEngineers/comments/50teey/question_regarding_getting_into_the_solar_panel/
11,Civil and city planners: How common is it to 'tweak' traffic plans to give certain individuals better commutes or less traffic issues. (yourself as a designer or others who may be more likely to fund the project if it makes their life easier),1472824459,"Ive always wondered why some highways have a entrance or exit ramp in a funny place, why some lights seem to have a better right of way, even though it is a side street, or exit and entrance ramps are removed for large swaths of road. I always wondered if there wasnt some back room deals going through to secure funding",AskEngineers,callmeon,/r/AskEngineers/comments/50tbzv/civil_and_city_planners_how_common_is_it_to_tweak/
12,Help me build a Raspberry Pi Cluster.,1472824058,"(If this is in the wrong thread could you tell me where to post?) 

Hello. I am in College studying Cyber Security. I am in a group of colleagues and Teacher that are building a Raspberry Pi Cluster. We are going to connect 65 Pi's together. Does anyone have any tips or usefull info related to this. We are divided up and everybody is looking up certain aspect of this project. For example a friend of mine is looking up the cooling aspect. What do you guys think would be the best option for this type of build? He is thinking of water cooling, but I believe we should just buy a server cabinent thing to cool it. 

So yeah if you guys have any info related to this project just let me know.  Thank you. 

Tldr: I am building a raspberry pi cluster. Give me tips or usefull links in how to do this project.",AskEngineers,Aqueous_Hexia,/r/AskEngineers/comments/50taxk/help_me_build_a_raspberry_pi_cluster/
13,Mechanical Principals Questions (Fluids and Thermodynamics),1472823636,"I'm a tad short on time. So I'd appreciate if people could help me out.

3)	A submarine floats submerged in the sea, its mass is 1750 tonnes (1750,000kg). The total volume of the sub is 2000m³. Calculate:
-	The mass of water in its ballast tanks.

-	The up-thrust on the submarine.  	
(P6)






4) A pipe contains a gradually tapering section in which its diameter decreases from 400 mm to 250 mm. The pipe contains an incompressible fluid of density 1000 kgm−3 and runs full. If the flow velocity is 2 ms−1 in the smaller diameter, determine the velocity in the larger diameter, the volume flow rate and the mass flow rate.
(P7)




5) A turbine impeller in a turbo-supercharger is made from a stainless steel and has a diameter of 60mm. Its outer casing is a cast aluminium alloy and has an internal diameter of 62mm. The ambient air temperature is 15ºC and has an operating temperature of 250 ºC.
	The coefficient of expansion for the aluminium = 22 x10-6
	The coefficient of expansion for the stainless steel = 17.3 x 10-6

Determine the percentage increase in area of the gap between the turbine blade and outer casing.
(P8)




6) The radiator on a water-cooled engine has brass cooling fins each 50mm long when cool at 10 ºC.  By how much do the fins expand when the engine reaches its maximum operating temperature of 110 ºC?	
(P8)





7) Heat is supplied to a 10kg mass of oil of 1.6 kJ / kg K, at a rate of 11kW.  What is the time taken to raise the temperature from 8 ºC to 102 ºC?
(P9)




8) A “Calor gas” bottle containing Propane  (gas constant (R) is 8.3144 J/mol K) has a diameter of 500mm and is 1200mm tall. 
 The gas is pressurised to 120psi and is at 20 ºC.
-	Find the mass of gas in the bottle.
-	If the bottle is left out in the sun its temperature increases to 60 ºC , what will be its final pressure?								

Notes:	To convert from psi to Pa (N/m²) = x 6895
		To convert ºC to ºK = + 273
(P9)




9) Dry steam is compressed isothermally from a pressure of 1 bar to 4 bar. If the initial volume of the steam is 0.5m3, calculate the volume of the steam after compression
(P9)




10) The temperature of 1m3 of air is 20°C and is compressed to a volume of 0.8m3 whilst maintaining a constant pressure of 1 bar . Calculate the final temperature of the air 
(P9)




11) An air compressor operates with a compression ratio of 6:1. If the air is at a pressure of 1 bar and a temperature of 20°C before compression and the temperature after compression is 200°C, what will be the final air pressure?
",AskEngineers,Slcetin,/r/AskEngineers/comments/50t9pu/mechanical_principals_questions_fluids_and/
14,What kind of conversion table is this on the back of my digital caliper?,1472821356,[deleted],AskEngineers,[deleted],/r/AskEngineers/comments/50t3ip/what_kind_of_conversion_table_is_this_on_the_back/
15,"Failure Friday (September 02, 2016): Did you break something recently? We want to hear about it!",1472817804,"[[Previously]](https://www.reddit.com/r/AskEngineers/search?q=failure+friday&amp;restrict_sr=on&amp;sort=new&amp;t=all)

Today's thread is for all the recent explosions, broken parts, vendor headaches, and safety violations at your workplace. If no explosions occurred at your workplace recently, we also accept stories about terrible management and office pranks on the interns.

### Guidelines

* Here are some examples of stories that might appear in this thread:
  1. https://www.reddit.com/r/engineering/comments/1o1qpr/that_day_when_your_boss_almost_dies/
  1. https://www.reddit.com/r/AskEngineers/comments/39kp18/failure_friday_june_12_2015_did_you_break/cs4pe6e
  1. https://www.reddit.com/r/AskEngineers/comments/37plk5/failure_friday_may_29_2015_did_you_break/crp3zsn

* Pictures are welcome, but please include a story with it.

* **Please share your stories *without* revealing your identity or workplace, or violating your security clearance!** [We assume no responsibility](https://www.reddit.com/r/AskEngineers/wiki/rules#wiki_legal_disclaimer) for anything that results from your writing here.

* As usual, moderation in this thread will be relatively non-existent — jokes and light-hearted banter are welcome.
",AskEngineers,AutoModerator,/r/AskEngineers/comments/50svde/failure_friday_september_02_2016_did_you_break/
16,Discreet dash cam case to be mounted on the back of the rear view mirror,1472809956,"Here's my situation:

- I've bought a [Midland cam corder][1] (HxLxP = 53x59x32 mm);

- I want to create my own mounting system for it so that I can attach it directly to the rear view mirror (on the back of the mirror, obviously) - something similar to [this picture][2];

- I'd like to avoid any potential thieves (this is a common crime in my area) so I'm going to build a (plastic) case for the camera so that it will not be obvious that it's a actually camera. It should look just like a plastic bump on the back of the mirror;

- There should be some mechanical system that would allow me to slide the front side of the case so that the camera can record while driving;

- I have no prior knowledge on how to design cases or the tools that I would be needing for something like this.

Here's how I think I can do it:

- Buy a plastic rectangle; melt it somehow so that it will bend; make a cube out if it (probably apply some glue); make the front side detachable/slide-able somehow (maybe by making two small grooves on the sides); use some adhesive magnetic tape so that I attach it to the back of the rear view mirror.

And here are my questions:

- **What tools to I need to design this (plastic) case so that it will be as discreet as possible**? **How can it be done**? I've tried to customize some gadgets in the past but I never came up with a decent prototype (the design is always bulky and you can see that there are many manual adjustments there);

- I already have a 5V cable there; **is there any small electrical component that would be able to slide up/down the front panel of the case when it receives current**? (something like an electromagnetic lock, but, obviously, a lot smaller); this would be useful so that I don't have to remember to slide up the front side each time I go in to the car and slide it down each time I leave the car.

  [1]: http://www.midlandeurope.com/en/product/155123--p-street-guardian-gps-p-telecamera-per-auto-full-hd-con-gps-c1174-01
  [2]: https://dashcamtalk.com/forum/data/MetaMirrorCache/thumbnails103.imagebam.com_23839_cc9c85238383703.jpg",AskEngineers,throwaway2016aaa,/r/AskEngineers/comments/50sgp6/discreet_dash_cam_case_to_be_mounted_on_the_back/
17,Time to Pressurize a Tank,1472799761,"Hi guys,

I need to calculate the time required to pressurize and depressurize a storage tank using air.

However, I am unsure on how to go about accounting for real world losses during the delivery of the air.

The tank's volume is ~ 4100 m3.

I have access to an air compressor with a 390CFM rating. 

I need to pressurize the tank to 50 kPa.

I can calculate an how long it would take assuming all 390 CFM goes into the tank from the compressor using P1V1=P2V2.

However, the problem is that the outlet of the compressor is in 2 sizes, 3/4"" and 2"". And the length of hose I am required to lay is about 100m. How do I account for any losses that may occur between the 2"" outlet and the 100m of hose to the tank ? Any help would be greatly appreciated. Thanks.",AskEngineers,woohwaah,/r/AskEngineers/comments/50s08n/time_to_pressurize_a_tank/
18,"Is there a clean and reliable way of regulating voltage/amp from a battery to motor, without electronics, like a powerful potentiometer?",1472794097,"IE minimal parts, probably mechanical, a potentiometer but for higher voltages/amps.

Ideally as an alternative to digital control for electrical vehicles.",AskEngineers,1980sumthing,/r/AskEngineers/comments/50rp5e/is_there_a_clean_and_reliable_way_of_regulating/
19,What effect would adding airfoils to the helicopter mast above or below the non-lifting part of the main rotor disk have on a vortex ring state?,1472791054,[deleted],AskEngineers,[deleted],/r/AskEngineers/comments/50riml/what_effect_would_adding_airfoils_to_the/
20,What do you believe is the most reliable type of level switch?,1472790774,"I need to make a level control system that must be reliable. We can discuss baffling the sensor to prevent false switching due to sloshing, as well.",AskEngineers,TugboatEng,/r/AskEngineers/comments/50rhzv/what_do_you_believe_is_the_most_reliable_type_of/
21,Material for Getting into CPU Design,1472788599,"I'm an EE student who's, after working with several different CPU architectures lately, very interested in getting deeply into processor architectures and processor design.
My University doesn't really offer good classes on this topic and its quite difficult to find information online.

What are good materials (e.g. text books) to dive into the topic? 

My goal is to awnswer questions like, What i have to consider about the instruction set?, What seperates a mips from an x86 and why did they designed it that way? What are the impacts of the design decision on a higher level? How are caches and interfaces designed? Whats different in an special application like a GPU or a DSP?",AskEngineers,mja23,/r/AskEngineers/comments/50rd85/material_for_getting_into_cpu_design/
22,Hydraulically extendable axle? Would it be possible?,1472783019,"Building a large military truck on 750/65/R25 tires but its going to be a street rig and an offroad rig but the axles are going to be extremely short due to tire width would it be possible with an extremely large amount of funds to make an axle that can be 8'6"" when non extended but a foot or two wider at the push of a button for offroad? ",AskEngineers,Ibexe666,/r/AskEngineers/comments/50qzq0/hydraulically_extendable_axle_would_it_be_possible/
23,How long should I prepare for case interviews in consulting?,1472777974,"I've recently kind of discovered consulting. I've always known about it, but really delved into it as a prospective career choice. Consulting career fairs are starting to pop up and will go into about mid-October at my Uni.

I'm wondering if it's even viable to study case interviews in this short window or if I should maybe start a job and pick up more technical skills to pivot into consulting.

Advice and opinions welcome.",AskEngineers,hard-enough,/r/AskEngineers/comments/50qmur/how_long_should_i_prepare_for_case_interviews_in/
24,"Engineers who get their hands dirty at work, what do you do?",1472766063,"I graduate this year as a chemE, have solid internship experiences, but in office settings. I love getting my hands dirty. Wrenched on cars and engines my whole life. Where are the opportunities in industry to get my hands dirty?",AskEngineers,twostroke1,/r/AskEngineers/comments/50pptw/engineers_who_get_their_hands_dirty_at_work_what/
25,How much of a future is there in engineering?,1472765024,"What kind of work do engineers do in their 30s and 40s? It seems like they're just going to be replaced by some recent grad soon after that age. Also, engineering has good starting salaries but I heard they get stuck there, whereas nurses, accountants, etc get higher pay as they progress and their experience is actually respected. 
So what's the real situation like?",AskEngineers,watevs_holmes,/r/AskEngineers/comments/50pmue/how_much_of_a_future_is_there_in_engineering/
26,Strain gauges for material testing,1472761965,"I am currently developing a strength test procedure to determine the strength of polypropylene products. Without going into too much detail, quality concerns about the end product have led to me investigating a more effective way to determine if the foam will be up to scratch.

The product production process is as follows:

* raw ingredients are mixed in a extrusion process to produce the stock foam
* foam is extruded into large rolls 
* quality metrics are collected from extruded roll
* roll is left to degass for a set number of days
* foam is thermoformed into the product
* quality metrics collected from thermoformed product.

What I'm currently trying to do is collect strength data from the thermoformed product and plot against a metric collected while the foam was being extruded.

I want to perform a standard tensile test and determine how the end product's tensile strength changes relative to the first metric collected. However, the facility does not have that kind of equipment, and only wants to perform tests that directly tie to a customer use (I designed such a fixture, but it does not really provide the data I want).

Would I be able to collect the same kind of data that I would get performing a standard tensile test using strain gauges?

I have little experience with electronics. What kind of equipment would I need?

Thanks for the help.

TLDR - Can I used strain gauges to approximate a tensile test?",AskEngineers,riceball2015,/r/AskEngineers/comments/50pdpm/strain_gauges_for_material_testing/
27,Large Used Granite Surface Plate Network,1472759589,"I have a pretty large granite surface plate or table that I am trying to get rid of but I'm not sure where to start. The plate is 110x96x24 in. and weighs around 25,000lb, located in upstate SC. 

Is there a network I could tap into to sell used tables such as this?  I called a manufacturer and it seems shipping is often as expensive as manufacturing these things anyways.  Where would one go to reclaim any value left in the table?  Or is it going to cost me to give it away just to get it off the property?",AskEngineers,blurrymind,/r/AskEngineers/comments/50p6gj/large_used_granite_surface_plate_network/
28,Damped vibrations and the time period of a bouncy ball.,1472758336,"I'm having trouble getting my head around this.

I've only studied vibration briefly so my knowledge is limited.

From what I have learnt so far in a simple damped system the time period or peak to peak time of the displacement is constant all the way until the mass comes to rest, with only the amplitude decaying.
And that makes sense as the natural frequency is a result of the mass and spring constant which don't change in the system.

My question is why does the time between bounces when the ball is dropped seem to shorten especially right before it is about to stop.

The mass isnt changing, so is it something to do with the heat generated in the ball dissipating some of the kinetic energy that is dynamically changing the spring constant of the ball itself?",AskEngineers,Sinttini,/r/AskEngineers/comments/50p2dz/damped_vibrations_and_the_time_period_of_a_bouncy/
