index,title,created_utc,selftext,subreddit,media_only,author,permalink
77,What defines the the point at which a car engine will transition from idling to actually moving the vehicle? What is the mechanical critical factor that will trigger movement?,1586950179,,AskEngineers,False,npjprods,/r/AskEngineers/comments/g1q68q/what_defines_the_the_point_at_which_a_car_engine/
78,What are some good books to study synchronous generators?,1586949792,,AskEngineers,False,Captain_Ambiguous,/r/AskEngineers/comments/g1q3bb/what_are_some_good_books_to_study_synchronous/
79,[Discussion] Would you use mortar as render in your project? [Read-not typical],1586949544,"**EDIT1:** **~~Render~~** **Plaster** 

I made a post before about mortar with lightweight aggregates and phase change materials. With corona etc going on, labs got shut down so I cannot get lab data to support this theory. So here's the direction my project is heading: making a ~~render~~ plaster inside of buildings that can store heat energy.

Info: Phase change materials (PCM) that are shelled and look like lightweight aggregates are added to cement, sand and water, along with polystyrene beads (or any other LWA to make it light). The PCM absorbs thermal energy to change phase (so the temperature remains the same). That energy absorbed is a lot cause it is latent energy and therefore, reduces the heating/cooling you will need. It also reduces fluctuations in temperature (thermal comfort) and can delay the time when heating/cooling is required (smaller durations)

The PCM I am using is as expensive as sand and works at a temperature suitable for both summer and winter (well two pcms).

Benefits: much better thermal conductivity than normal mortar - 50% at the proportions I'm using. '166% more thermal energy storage than normal mortar'

What are the problems/challenges I am overlooking?

The compressive strength of the ~~render~~ plaster according to British Standards (I need to confirm this) is minimum like 3MPa and currently, the sample with 55% sand (45% PCM and polystyrene) should have a strength of 10MPa+. So strength should not be an issue - It won't be used for structural purposes

Some previous research looked into it and the payback time for one of them was around 30 years. Another research concluded a 24% reduction in annual electricity cost. It is obvious that those two numbers are very different but we will be conservative and consider the 30 years one as the realistic outcome. (it may be closer to 15 years)

Of course, there are bigger factors like you lose more heat through a window. Finding a solution to that would greatly reduce the 30 years payback time.

Personally, polystyrene was quite horrible to work with. My samples had a lot of holes because the surface polystyrene would just break out. It can be swapped for another lightweight aggregate or no lightweight aggregate at all if needed.

The ~~render~~ plaster does not change air content. So additional mechanical ventilation is not required just because of the ~~render~~ plaster.

TLDR: Would you use a ~~render~~ plaster that would decrease heating/cooling required and have a payback time of 30 years? If not, why so? On the long term, you could describe it as 'sustainable'. Well this is arguable.

Thank you for your input!

&amp;#x200B;",AskEngineers,False,Harunoooo,/r/AskEngineers/comments/g1q1k2/discussion_would_you_use_mortar_as_render_in_your/
80,Servo Drives &amp; Servo Motors,1586948811,"In order to control a drill bit' movement, is the most efficient way to use servo drives and servo motors ? what's the block order between the PLC and the final drill bit action.",AskEngineers,False,Mu_umin,/r/AskEngineers/comments/g1pw5k/servo_drives_servo_motors/
81,Best University/Institute for Computer Engineering?,1586945783,"Which university has best Computer Engineering classes? I know answer may not be one single university, so name several of them. By the way, does MIT have Computer Engineering? I googled it, but it didn’t show up.",AskEngineers,False,OmniKingBoss,/r/AskEngineers/comments/g1p9qx/best_universityinstitute_for_computer_engineering/
82,How to enter the defense industry?,1586944358,"First of all I'll say if you want the actual question and not the rant/venting of personal concerns skip these first two paragraphs.

With Coronavirus slowing hiring for the Automotive industry to a standstill I've become pretty worried about job security, I live in Michigan, go to school in Detroit so I always assumed when I'd graduate I'd enter a field that I'm passionate about(specifically Powertrain engineering) , but it's become clear to me it's an extremely volotile industry and having a job at all is more important to pursuing my interests and passions than waiting for a job to arrive that people way more qualified than me will probably be jumping on. 

The only thing I can think of is defense. Government contracts and the need for weapons to counteract foreign development doesn't stop

Now that I've for some reason vented my thoughts and frustration out to people who can probably understand, the main question is, How do I get in? What kind of classes should I be taking at the very end of my degree?(1-2 semesters left) Should I be afraid of telling the truth that I used smoke weed in Highschool (referring to security clearance, I had a MI issued Medical marijuana card in HS that's why I'm especially worried)?

Sorry if these are stupid questions, it's hard to get a hold of people that can give me real advice",AskEngineers,False,XxRoyalxTigerxX,/r/AskEngineers/comments/g1ozf3/how_to_enter_the_defense_industry/
83,are cheap aquarium chillers able to made tank water really cold?,1586943355," Hi,

There   are plenty of aquarium chillers on aliexpress  which are in the range  of  $60 to $150. many of them come with a water-pump and pipes, so the   entire set. They claim they can adjust the water in the range of 5c to   38c, but I'm skeptical.

My tank is 45L, and the temperature is around 36c. I want to make it as cold as possible.

Do   you think these will help? what is the realistic temperature  result  if  I use one of these chillers? What if I use two of them at the same   tank?

[https://www.aliexpress.com/item/32919620855.html](https://www.aliexpress.com/item/32919620855.html)

[https://www.aliexpress.com/item/33017300747.html](https://www.aliexpress.com/item/33017300747.html)

[https://www.aliexpress.com/item/33009889590.html](https://www.aliexpress.com/item/33009889590.html)",AskEngineers,False,wtr5000,/r/AskEngineers/comments/g1osgn/are_cheap_aquarium_chillers_able_to_made_tank/
84,How do you enter the defense industry?,1586943166,[deleted],AskEngineers,False,[deleted],/r/AskEngineers/comments/g1or2j/how_do_you_enter_the_defense_industry/
85,Studies about Regenerative Braking ?,1586941351,"I have to write a paper on regenerative braking can anyone suggest good reading material for this ? Papers, studies, etc.",AskEngineers,False,charsie_godha,/r/AskEngineers/comments/g1ods3/studies_about_regenerative_braking/
86,How many interviews did you go to before getting your first engineering job?,1586936233,.,AskEngineers,False,almightyjew,/r/AskEngineers/comments/g1nd3u/how_many_interviews_did_you_go_to_before_getting/
87,SEARCHING FOR ONE PLACE OF COMMON INTEREST ?,1586931500,[removed],AskEngineers,False,srawat45,/r/AskEngineers/comments/g1mdqp/searching_for_one_place_of_common_interest/
88,How to future proof oneself now that the job market is down?,1586931388,"Hi everyone, I hope all of you and your friends and loved ones are safe and taking care of this wild situation we're finding ourselves in.

I have graduated with a Bachelor's in Mechanical Engineer with a decent 2.97/4.00 GPA. Real-life experience includes a 6-month stint as a systems engineer at a startup and currently a 1-year internship at a renewables energy company. I evaluated my technical skills recently and they are poor because I am doing what I already learned but not really learning and applying anything new.

I have gotten the feedback from those older than me and friends far along the line that, the only way I can secure my future is by planning for the future. Robotics, Data Science, 3D Printing, Additive Manufacturing..etc there are countless possibilities in engineering. This is where I run into trouble, how do I future proof myself if I don't know where to go? Where can I take courses and grow as an engineer so I can at least find the answers to where I want to head? What would be a good starting point and how would I go about setting realistic goals to reaching there?

Does anyone have any suggestions and feedback on this? Anything and everything is very appreciated. Thank you!",AskEngineers,False,MovieLover1996,/r/AskEngineers/comments/g1mcur/how_to_future_proof_oneself_now_that_the_job/
89,Need suggestions for good online courses to study and implement Genetic Algorithms,1586928038,,AskEngineers,False,Noone449,/r/AskEngineers/comments/g1ln50/need_suggestions_for_good_online_courses_to_study/
90,"Thinking of pursuing another MS/MBA, thoughts?",1586926245,"Hello all,
Given the current climate I was thinking the best way to advance myself so I can come out ahead once this pandemic/recession is over. I’m currently working as a Quality Engineer and currently have a BS and MS in Engineering ( BS ChemE/MS ME). I’d like to stay in QE and wanted to learn more about systems and processes but I also want to move into management in the future. I was considering some dual MS Industrial Engineering/MBA dual programs ( online since i want to keep working). I know it may seem tasking on top of a heavy work load but I finished my entire MS ME while I was working even completing a thesis and published a paper to boot. I know I can handle it. My main question is how would this set me apart in the future? That means if I’m successful I’ll have 2 MS Engineering and MBA. I’m not looking at Stanford or University of Michigan but rather ASU Online or Auburn Univ. Etc( still need to do more research)? Is it worth the investment? Classes are pretty expensive ( $900-$1250/unit)for 60 units in the dual degree program plus it’ll take at least 4-5 year commitment. I’m currently 29.",AskEngineers,False,larrythetarry,/r/AskEngineers/comments/g1l9d3/thinking_of_pursuing_another_msmba_thoughts/
91,Anyone here pass the Civil FE without an engineering B.S.? What was your experience? Any tips?,1586923875,,AskEngineers,False,hisdudeness47,/r/AskEngineers/comments/g1kqfe/anyone_here_pass_the_civil_fe_without_an/
92,Is it worth looking for/applying for internships now?,1586922105,"I’m currently a sophomore studying Mechanical Engineering and minoring in Design/Industrial Design. I had an internship lined up for the summer, but it was cancelled last month.

After seeing other students’ jobs/internships get cancelled and engineers being laid off, is it worth trying to apply to internships or am I wasting my time? I keep getting automated emails from Linkedin, Glassdoor, etc. about companies hiring, but I kinda assume they are posting that haven’t been taken down?",AskEngineers,False,slate_er,/r/AskEngineers/comments/g1kbop/is_it_worth_looking_forapplying_for_internships/
93,Experienced engineers: How do you deal with a hostile colleague?,1586921407,"Hi, I have a colleague who has repeatedly stepped over my toes. After about 3-4 times, I gathered courage and talked to him and it blew up. I value this guy's experience, but since the incident he made my life difficult. I tried to talk to him once again and it didn't go well either. How do you extricate yourself from such a position? Our manager is not helpful (close to retirement).

Edit: As pointed out below - Hamlin's razor. I highlighted that it was impacting my work, not because he was intentionally doing it, but may be because he was busy. But still..",AskEngineers,False,jobFlimsyIce5,/r/AskEngineers/comments/g1k5qr/experienced_engineers_how_do_you_deal_with_a/
94,I will love helpy to produce the ventilator PCBA （main board）,1586918508,[deleted],AskEngineers,False,[deleted],/r/AskEngineers/comments/g1jgvt/i_will_love_helpy_to_produce_the_ventilator_pcba/
95,Where can i share a design project?,1586916584,"Hi, i am having some troubles finding a place to share a project that i am designing with some university friends. We designed a affordable PAPR for healthcare personnel that deals with COVID-19 patients.

It can be a subreddit or a forum. [I made a share copy on Drive.](https://drive.google.com/open?id=17V2qN0q9eA5dGd__1h4nQ5qbJzds-RN0)",AskEngineers,False,kpanga,/r/AskEngineers/comments/g1izv6/where_can_i_share_a_design_project/
96,"Don't know if this is the right place to post this, but I'll take it down if people say so.",1586916129,"Is it possible to take a racing wheel, such as a thrustmaster ferrari F1 wheel and convert it to attach to the steering collumn of a real car and have the speed shifters actually work, by rewiring them? And would it be possible so that I could switch between the real wheel and the race wheel but still have the gearstick work? Thanks. I know this is an odd question.",AskEngineers,False,SevenAcesGaming,/r/AskEngineers/comments/g1ivp7/dont_know_if_this_is_the_right_place_to_post_this/
97,Are job titles fairly meaningless at defense/aerospace companies?,1586914264,For the most part are job title fairly meaningless in terms of pay for defense and aerospace? It seems like the titles are there for time served or YOE rather than actual compensation.,AskEngineers,False,fuurbie,/r/AskEngineers/comments/g1ieib/are_job_titles_fairly_meaningless_at/
98,What type of engineers work for Nike when creating performance products? Or is it mostly fashion/footwear designers?,1586913486,"So currently I'm a 19 year-old engineer major (no specific type) at my local CC. As delusional as it sound, I've always dreamed about working for a company like Nike creating and testing out new products. Ever since I was young, Nike has always impressed me with what they bring out to the table especially in the running, soccer, and football world. They don't have the ""just to change"" type of mentality when improving next gen. models, which I don't really see from other brands. 

These are just examples of products they've created in the past 5 years:
- https://www.youtube.com/watch?v=Vi3QzA-h1Rs
- https://news.nike.com/news/mercurial-superfly
- https://news.nike.com/news/2016-football-vapor-kit-aeroswift
- https://news.nike.com/news/nike-zoomx-vaporfly-next-official-images-and-release-info

I know there is some type engineering that goes into this type of work, although does anyone know which type specifically? Chemical? Materials? Textile? Mechanical? Or is this more so Footwear design? I live in NY so I was wondering should I just go to a school like FIT for designing? Or a school that offers multiple types of engineering once I transfer? 

Note: I know a job at a very big company like Nike is very exclusive and requires years of experience, I won't be heartbroken if my dream doesn't pan out, although it would be nice to gain some information :)",AskEngineers,False,laalvarez6,/r/AskEngineers/comments/g1i7as/what_type_of_engineers_work_for_nike_when/
99,How can the study of thermo-fluids be applied to reduce COVID-19,1586911239,"A question that's been on my mind is how can one use knowledge such as turbines, pumps, combustion, HVAC, gas power cycles and possibly create a device or modify an existing device such that cases been reduced. Does anyone have any suggestions, kinda interested in what people have to say. More of a professional engineering question but 4th year students can voice their thoughts as well.",AskEngineers,False,AstroSolutions,/r/AskEngineers/comments/g1hmev/how_can_the_study_of_thermofluids_be_applied_to/
0,Engineering careers with mix of desk and field/shop work?,1586911214,"Title pretty much covers it - seeking ideas for careers/jobs that include both desk/computer based work and field/shop work. Would also appreciate any suggestions on how to get there from where I'm at (see below)!

&amp;#x200B;

Some background, in case it helps:

 I've been a programmer analyst working in the data science/data engineering space for two years. I have an undergraduate degree in math and a graduate degree in data science. I like programming and my job is fulfilling and challenging at times but I've realized getting out of the office is important to me (enough that I'm considering making a move to ensure it is part of my work life). 

Previously, I wrenched on my frankenstein of a car as a teenager and, more recently, I mess around with basic electronics. Also worked in civil construction running a shovel and doing some basic QC stuff between undergrad and grad school. My impression is that I'd enjoy electronic engineering or mechanical engineering but, having never taken classes or worked in either, I could misunderstand what they entail. 

One route I've looked at is pursuing an electronics engineering technology program (two years). It offers lots of hands on training and also permits bridging to a full four year program if I'm really into it. The jobs that motivated my considering of this program were all titled something like: 'Control/Automation Systems Engineer/Technician'.

I'm open to any potential careers (and routes leading to them!) that include the opportunity to both hack away at the computer and actually build/fix something with my hands. 

Hope this is the right place for this question and thanks for your time!",AskEngineers,False,AccurateSleep9,/r/AskEngineers/comments/g1hm4q/engineering_careers_with_mix_of_desk_and/
1,What’s your opinion on planned obsolescence?,1586908938,"I had an interesting conversation a while ago with a guy who worked designing lawn mowers with a large manufacturer. His job was to design the blades for the lawn mower in a way that it would break after 5 years of regular use and render the entire lawn mower unfixable. I for one hate the idea of designing something to break for no other reason than to get people to buy more of your crap, and now I’m interested to do some digging. Anyone here do anything similar? What’s your take on this?",AskEngineers,False,SoupzNation,/r/AskEngineers/comments/g1gzeq/whats_your_opinion_on_planned_obsolescence/
2,Planned Obsolescence,1586908665,,AskEngineers,False,[deleted],/r/AskEngineers/comments/g1gwse/planned_obsolescence/
3,"Is there an advantage to using a zinc containing coating to prevent rust on metal, such as for a car, as opposed to a paint or other coating that does not contain zinc?",1586906596,,AskEngineers,False,BobRossSaves,/r/AskEngineers/comments/g1gbrw/is_there_an_advantage_to_using_a_zinc_containing/
4,Hoping to do a bit of Science™ with my a mavic mini drone. Need light weight sensor advise.,1586906301,"Hi y’all. I’ve been killing the boredom of the coronatimes by flying my drone more. I’m in a pretty decent sized city but have been driving to some parks out of town too. 

I was hoping to add some light weight sensors to my drone in order to do some “science” for my own amusement. I have a mavic mini, so the payload capacity is pretty low, only about 50g safely. 

Wondering if any of you guys had advice on a sensor circuit I could build that would be able to contain it’s own power supply and record/store data while staying very light weight. I’m interested in particle/pollution levels especially. I would be interested in many different kinds of atmospheric/electromagnetic sensors for collecting data at various altitudes. I assume the limiting factor here is weight. 

I’m a ME in over my head in the electronics world. Any help in fighting my boredom and giving me a new project is much appreciated!",AskEngineers,False,Ford456fgfd,/r/AskEngineers/comments/g1g8v7/hoping_to_do_a_bit_of_science_with_my_a_mavic/
5,Hoping to do a bit of Science™ with my a mavic mini drone. Need light weight sensor advise.,1586906278,"Hi y’all. I’ve been killing the boredom of the coronatimes by flying my drone more. I’m in a pretty decent sized city but have been driving to some parks out of town too. 

I was hoping to add some light weight sensors to my drone in order to do some “science” for my own amusement. I have a mavic mini, so the payload capacity is pretty low, only about 50g safely. 

Wondering if any of you guys had advice on a sensor circuit I could build that would be able to contain it’s own power supply and record/store data while staying very light weight. I’m interested in particle/pollution levels especially. I would be interested in many different kinds of atmospheric/electromagnetic sensors for collecting data at various altitudes. I assume the limiting factor here is weight. 

I’m a ME in over my head in the electronics world. Any help in fighting my boredom and giving me a new project is much appreciated!",AskEngineers,False,thetelltalehart,/r/AskEngineers/comments/g1g8mt/hoping_to_do_a_bit_of_science_with_my_a_mavic/
6,What to do after a BS in mechanical engineering?,1586904919,"Hi everyone,

I'm a senior one semester away from graduating my undergrad. I am going for a Master's degree but unsure what to do it in. I love engineering but I want to broaden my scope and want to get a degree outside of engineering. What would be the best type of degree to pursue and why? Thanks for your help in advance!",AskEngineers,False,Selint567,/r/AskEngineers/comments/g1fuhw/what_to_do_after_a_bs_in_mechanical_engineering/
7,How long will GPS infrastructure last without human intervention?,1586903903,"Will the GPS satellite network still work without upkeep from the ground?

If so, is it something that can last for a prolonged amount of time?",AskEngineers,False,philandering_pilot,/r/AskEngineers/comments/g1fjya/how_long_will_gps_infrastructure_last_without/
8,"Do ""rust converting"" paints actually work? If so what is the chemistry of how this is accomplished?",1586903660,,AskEngineers,False,BobRossSaves,/r/AskEngineers/comments/g1fhax/do_rust_converting_paints_actually_work_if_so/
9,"Is there some electrochemical advantage to using a zinc containing coating to prevent rust, over a regular coating that simply seals out wate?",1586903237,,AskEngineers,False,BobRossSaves,/r/AskEngineers/comments/g1fcsy/is_there_some_electrochemical_advantage_to_using/
10,What jobs could one pursue after obtaining an MSc in Space Engineering / Space Systems (or a related degree)?,1586901089,I am wondering what sorts of jobs a graduate with an MSc in Space Engineering could pursue? I am interested in mission design and orbital mechanics but I am open to any space-related jobs. Has anyone here done an MSc in a similar degree or pursued jobs in the space industry? I live in the UK for reference. Thanks,AskEngineers,False,Mandrillbit,/r/AskEngineers/comments/g1ep9h/what_jobs_could_one_pursue_after_obtaining_an_msc/
11,How is the life of someone working in nanotechnology?,1586900693,"I mean, did you study the career or later did a master's degree ? And what exactly do you do at your job? 

Asking for a person dear to me. Thanks in advance!",AskEngineers,False,Silver-Alchemist,/r/AskEngineers/comments/g1el0t/how_is_the_life_of_someone_working_in/
12,"Designing a game with realistic melee items and tools, how do I handle impact depth (D=L(A/B)) for lower velocities or with sharpness?",1586899318,"___This is my understanding aforetime of post___
Inside Newton's equation for impact depth it says it only applies to a blunt impactor at high velocities for materials without fibers (cohesion). This is because at higher forces solids act as a fluid. Though it's possible sticking with just base forces is better than this detail for the game.

__my questions thus far___
Sharpness is the radius of the edge, honing aligns the edge. How does the angle of an edge change this? How does the radius of an edge change this?

How do I handle lower velocities knowing that the upper limit for the speed of a punch is 45mph ~ 20m/s (truncated values here thereafter), a boxing athletes punch is 11m/s, and an average punch is 9m/s? What equations are out there, what material properties do I look for?
However as additional notes average foil tip speed and swing speed for a fencer seems to be at about 36m/s &amp; 49m/s respectively, and the fastest golf club head speed was at 57m/s. 

__Why I want to know__
I am trying to establish how deep the item can penetrate, when thrusting with a sword or using a bec de corbin on the back swing given a targets armor stats.",AskEngineers,False,Dorokiin,/r/AskEngineers/comments/g1e5yk/designing_a_game_with_realistic_melee_items_and/
13,It would be great to study or research few interesting topics during this period. What do you have in mind?,1586899158,[deleted],AskEngineers,False,[deleted],/r/AskEngineers/comments/g1e4av/it_would_be_great_to_study_or_research_few/
14,Looking for a special pneumatic handle,1586897745,"Hello,

&amp;#x200B;

I'm looking for a pneumatic handle that clip on a shaft or tubing.

It's the same thing that a brake on a normal bike but pneumatic. 

&amp;#x200B;

Do you know where I could find these types of handle ?

&amp;#x200B;

Thank you !",AskEngineers,False,Drinkabeer2,/r/AskEngineers/comments/g1dorm/looking_for_a_special_pneumatic_handle/
