index,title,created_utc,selftext,subreddit,media_only,author,permalink
52,Life advice. [Still trying to get into EE],1551059572,"I was accepted into university for my undergraduate in electrical engineering. Unfortunately over the first 1-2 years of school my adviser somehow influenced me to switch to mechanical engineering before I could really get into the EE curriculum. (I did seriously consider a career in mechanical design + areas of research for maybe 6 months but ultimately I don't identify or have any desire to follow that path). 

I have some experience in electro-mechanical design (batteries), working with data, and after my undergraduate degree worked for about a year in the field of solar arrays, semiconductors, p-n junctions, basic electronics, and was writing software most days (in aerospace). I think I have used every bit of electronics/electrical related education I learned (what little of it), and don't have an interest in pursuing mechanical engineering. While it was interesting, at the time I did not envision focusing on the solar industry for the rest of my life.

During this time I was accepted into a 2-year EE masters program with full funding which I was pretty excited for. But before I could start my program I had a severe medical problem that basically put my life on hold for a while. Ultimately, I had to drop out and will need to re-apply.

I'm fine now, and am currently working in a test lab. It was the first job I could find at the time (without relocating) and while it is to an extent open-ended, it is still very much in a 'mechanical' lab, which is a little depressing, (mostly environmental testing). I also didn't apply to very many places. My current role doesn't add anything really to my desired career goals or technical knowledge. It was offered that I switch to an EMC/EMI testing lab under the same company (but the only location that is hiring right now is in a state that sees more snow that I might be able to handle haha). I'm also trying to do a decent amount of self-study outside of work to catch up everything I missed out out in undergrad + work on EE projects. Virtually the only interaction I have right now with people in any sort of electrical field has been joining the local amateur radio club.

The shortest timeline I could have is re-applying to grad school this autumn. Assuming I get re-accepted at some point, I could apply for internships or other jobs after accepting a program at least for the summer or spring or so before I start school. Some people have also said to find a company and work there for several years before grad school. I also don't intend on getting anything beyond a masters right now. It would also be exciting to take part in research but based on my experience or lack of experience we'll see what happens. I think in order to get accepted for research I'll need to move positions.

I'm not quite certain of what field I will want to pursue. Eventually I want to get out of test (at least based on my experience I like design). Most likely in PCB or board design. Or maybe in RF. There's also a lot of EE I haven't really discovered. For example, I haven't had very much exposure to signal processing, but I do have a natural liking of Fourier transforms. Maybe I'll even go full software.

Basically, I don't think my current job is beneficial to my life goals or being prepared for grad school and beyond. I'm not sure what I should do right now or if I should switch jobs.

If you have any advice on how to prepare for a career in EE, how to interact with more EE's, or anything else I should be doing right now, let me know! (Also if you have any class materials, textbooks, or electronics blogs feel free to comment!!)",AskEngineers,False,Flysohigh7,/r/AskEngineers/comments/aufgp3/life_advice_still_trying_to_get_into_ee/
53,Acoustics of an Ultrasonic Talk Box,1551058633,"I'm in the beginning phases of a personal hardware project I've wanted to do for a while: an ultrasonic talk box. Basically I want to make a [talk box](https://en.wikipedia.org/wiki/Talk_box), but instead of acoustic waves in the audible range, I want mine to be silent. I want to drive visual effects by modulating the ultrasonic sound, but I am worried that the pitch shift will destroy the talkbox effect.

The eventual goal is to use this hardware to drive a visualizer of the waveform, and make a sort of music-ish game where you try to match a target waveform presented to you on screen by shaping the sound with your mouth. Something about using visual feedback instead of the usual talkbox auditory feedback seems really interesting to me.

I'm just not sure if the physics works out and I want to have a sort of mathematical proof of concept before I start designing. Essentially I don't know how I would figure out whether shifting the frequency up out of the audible range removes the ability to modulate the sound with mouth shaping. 

 I have a degree in math, but very little insight into the acoustic physics relevant here. If someone could help me understand how to approach this question, and maybe point me towards some of the tools that may help I'd really appreciate it!",AskEngineers,False,BRANrickMAN,/r/AskEngineers/comments/aufbau/acoustics_of_an_ultrasonic_talk_box/
54,Why muffin trays aren't made using draw-forming by pressing metal against a die?,1551058521,"I'm having a hard time understanding why a manufacturer would choose a complex process for such a simple thing as a muffin baking tray.

As the pictures show, each of the cups have been formed separately and then welded on to the tray with holes punched in it.

That's a multi-step process as opposed to just pressing the metal sheet against a die, just like aluminum cans are made?

[!muffin tray bottom view](https://i.imgur.com/Wy4T8ho.jpg)
[!muffin tray top view](https://i.imgur.com/7IAhZtG.jpg)",AskEngineers,False,filth_overload,/r/AskEngineers/comments/aufann/why_muffin_trays_arent_made_using_drawforming_by/
55,Would it be possible to mix Cob (adobe) in a large PVC pipe? Funneling material into one end and having it come out the other mixed and ready for building.,1551052497,"Cob/ Adobe is a building material 
Typical proportions= 1 part clay, 2 parts sand, straw, water
Traditionally laid out and mixed by hand or machine.
PVC idea would be to funnel this into a large pipe with teeth inside that help mix the materials together. Out comes ready to be other end ready to be used for building.",AskEngineers,False,certavi_et_vici,/r/AskEngineers/comments/auec5j/would_it_be_possible_to_mix_cob_adobe_in_a_large/
56,Chemical Engineering Graduate Trying to get into Project Engineering,1551049161,"&amp;#x200B;

Hello world,

I graduated last spring and have had a hard time getting an engineering job. I have had one interview so far for an internship position, but unfortunately have not had a success full time. I know had I have done everything I should have to get a job, but I can't cry over spilled milk. A couple of things

1. I graduated with a low GPA (2.7)
2. I never got any internship experience
3. I have a very good senior design, which gave me a background in designing a manufacturing process from start to finish. I got ample experience in cost analysis and equipment selection. This is what has given me the motivation to step into project engineering.

Those things have placed me incredibly behind. I have moved across the country to a new state to hopefully start a new life, but have had to take a restaurant job to make ends meet while I still search. I want to get into project engineering, but I need help.

\- Should I go ahead and get my Chemical FE exam done. I want to do project, but didn't know if I really should be focused on getting the eventual PE.

\- Should I look into getting more certifications (Six Sigma, etc.)

I am just lost and need help. Any advice particular to my situation would be greatly appreciated.",AskEngineers,False,GOEVALLS1,/r/AskEngineers/comments/auds3n/chemical_engineering_graduate_trying_to_get_into/
57,Anyone know what this is or how to remove it?,1551047419,"https://www.reddit.com/r/whatisthisthing/comments/audc6q/can_anyone_tell_me_what_this_is_andor_how_to/

Seems to be an anchor for a pin, there are 8 of them on a record player from the 60s. I'm trying to take it apart and clean it, not sure if I should try some BFI or if theres a tool I can use to remove it. My google fu isnt getting me anything helpful",AskEngineers,False,FullAutoGaySpaceCom,/r/AskEngineers/comments/audha1/anyone_know_what_this_is_or_how_to_remove_it/
58,How do you decide on the planform and cross-sectional area for rockets?,1551045569,"Hey everyone, first off, thanks in advance for any help or direction that I could be led in.

I just joined a rocket club where we are working to build a rocket that will go around mach 3 to 4. Our club is more or less starting from scratch so we are still very much in the preliminary design phase. My question is if anyone knows any good information on fin aerodynamics and planforms for the rocket. We have been looking at similar rockets to our potential design like MITs but their rockets are much more advanced than what we plan to build and it often doesn't say their reasoning for their choices.",AskEngineers,False,BrosBrews,/r/AskEngineers/comments/aud5eq/how_do_you_decide_on_the_planform_and/
59,Systems Engineering Cyber Security Viewpoints,1551044725,Has anyone dealt with Cyber Security from a Systems Engineering viewpoint? I'm looking for some inspiration to determine what data needs to be represented for a conceptual viewpoint. ,AskEngineers,False,wrestledude363,/r/AskEngineers/comments/aud006/systems_engineering_cyber_security_viewpoints/
60,How screwed am I? (Security clearance),1551044001,"Recently made a pretty big mistake that im regretting really hard. I currently do not have a security clearance and a recruiter recently contacted me about a position im interested in that requires one. The problem is i recently ate a marijuana edible 3 days ago. Prior to that edible 3 days ago, i hadn’t used drugs in 4 years... my curiosity and boredom got the best of me and now I feel i have thrown away the past 4 years of sobriety away and have disqualified myself for any clearance jobs. Does anyone have any similar experience? I told this recruiter I am eligible and i at least want to continue with the interview process. ",AskEngineers,False,bobbyjeann,/r/AskEngineers/comments/aucvbt/how_screwed_am_i_security_clearance/
61,Supersonic Rocket Fins,1551043154,"Hey everyone, first off, thanks in advance for any help or direction that I could be led in. 

I just joined a rocket club where we are working to build a rocket that will go around mach 3 to 4. Our club is more or less starting from scratch so we are still very much in the preliminary design phase.  My question is if anyone knows any good information on fin aerodynamics and planforms for the rocket. We have been looking at similar rockets to our potential design like MITs but their rockets are much more advanced than what we plan to build and it often doesn't say their reasoning for their choices.

&amp;#x200B;

Thanks!",AskEngineers,False,BrosBrews,/r/AskEngineers/comments/aucpu0/supersonic_rocket_fins/
62,How can I effectively mentor a senior engineer who's more experienced than I am?,1551042985,"Long story short, I'm in the process of mentoring a senior engineer who's new to scripting languages - over the course of the past 10 months they're started to learn how to write safe, and readable Python code, but there's still a long way to go.

They didn't have any experience in object-oriented programming, the basics of Windows and POSIX operating systems, or debugging before I started working with them - they used to be a kernel developer, or, something, but, they don't know what blocking vs. nonblocking calls are.

Anyway.

Any tips for mentoring engineers who are significantly more experienced than you?",AskEngineers,False,bpp256r1,/r/AskEngineers/comments/aucos0/how_can_i_effectively_mentor_a_senior_engineer/
63,How do I size steel tubing for a given span and load?,1551041925,"I'm designing an indoor playground for my kids. The center will be a span of 10', which should support 300 lb live load above and below (monkey bars). There are several calculators and rules of thumb for wood, which suggest that 2x8s in a decent hardwood should be good (four beams, 18"" apart, so a total area of about 40 square feet and 40 linear feet of wood).

However, I'd like to use steel pipe rather than wood for this span - easier to grip than an I-beam or J-beam, let alone a 2x8. How can I determine an appropriate size? 2"" outer diameter, 1"" inner diameter *feels* reasonable, but that's not even an educated guess.

Thanks in advance for taking a moment to share your experience!",AskEngineers,False,DJTilapia,/r/AskEngineers/comments/auchp1/how_do_i_size_steel_tubing_for_a_given_span_and/
64,Do you wish you had access to a PM/UX designer for your side projects?,1551040937,Sorry if this isn't the right place to post! ,AskEngineers,False,untetheredcamper,/r/AskEngineers/comments/aucb8u/do_you_wish_you_had_access_to_a_pmux_designer_for/
65,What is the complete process to design a jet engine?,1551040729,"As in a small jet engine designed for a small remote control plane, how would you go about designing the engine? 

Assuming you had a rough idea of the dimensions and requirements, how would the actual internals of the jet be designed and optimised for the required purpose?

What design programs would be used to mathematically work out the most efficient configuration of parts and such?",AskEngineers,False,oliver8365,/r/AskEngineers/comments/auc9wf/what_is_the_complete_process_to_design_a_jet/
66,"EROEI for energy sources: Fossil fuels, renewables, and nuclear. Best, least biased, sources for this data and your opinions sought.",1551039428,"Greetings engineers. 

First:  Thanks for keeping civilization functioning.  You brainiacs don't get anywhere near enough appreciation. 

The topic of EROEI, or Energy Returned On Energy Invested for various sources of the energy we need to run our posh life styles is somewhat difficult to determine.  

There are many different ways of looking at what should be included in the energy investment.  

Another, more confounding factor in making this determination, is the presence of the many highly-motivated and very well-funded ""interested parties,"" each of whom wish to influence the results of such analyses... Each industry has the equivalent of influence operations out there, shilling for data and analytic results which will make the case for more inve$tment in their sector or company.

The mind of the layperson boggles.  And so I turn to you, noble engineers, high priests of dispassionate data presentation and interpretation.  


#THE QUESTION, AT LAST

What, in your opinion, is the best source for unbiased data concerning EROEI for various kinds of energy sources for humanity going forward including the various fossil fuels, the many kinds of renewables, and nuclear?  

BONUS QUESTION: Since we're at it, if anyone wants to offer their own personal opinions regarding what kinds of energy sources we should be pursuing that would be great.  

SECONDARY BONUS QUESTION: Any [thorium / LFTR / MSRE](https://www.youtube.com/watch?v=tyDbq5HRs0o) fans in here... or is that just nuts?  

Thanks for reading this far.",AskEngineers,False,Notorious_VSG,/r/AskEngineers/comments/auc1f5/eroei_for_energy_sources_fossil_fuels_renewables/
67,Behavioral Interview Advice for Entry-Level Engineer?,1551038241,"Hello, I am in my final semester of Computer Engineering and have my first on site interview ever. I’ve been reading up on the STAR method and how to answer behavioral questions but would like some advice from engineers.

The basis of the STAR method is to provide examples. What are some good examples that someone with no internship experience can have? I only have one project, and a few part time jobs completely unrelated to the field to pull from. 

What are some things to absolutely avoid?

What are some uncommon tips? 

Any input is greatly appreciated.",AskEngineers,False,Pheanix9249,/r/AskEngineers/comments/aubtgl/behavioral_interview_advice_for_entrylevel/
68,Help with 3DExperience by Dassault Systemes,1551035867,"Hello, I am new to the 3DExperience software and am struggling a bit to figure it out. The first issue I’ve run into is that the Collaborative Space is not supporting the upload of Solidworks files, yet the integrated Solidworks experience requires that our files be in the vault / Collaborative Space in order to save them. Does anyone have any solutions or tips for this issue?

Also, in general, does anyone have any tips or resources for learning to best use the 3DExperience?

Thanks! ",AskEngineers,False,traffic__cone,/r/AskEngineers/comments/aubdmv/help_with_3dexperience_by_dassault_systemes/
69,[MATH] What does Concentric Wave Singularity when expressed mathematically?,1551034912,"I am dying to know how to exactly derive whatever is responsible for this https://m.imgur.com/jEhOcma?    
  
I've got my thermodynamics and fluid dynamics text books in front of me. I've been taking stabs at it but whatever is happening in that gif has me so amazed that I don't think I even know what is happening on a fundamental level. The spike is so perplexing I want to learn how/why it happens. ",AskEngineers,False,THEdROYAL,/r/AskEngineers/comments/aub77q/math_what_does_concentric_wave_singularity_when/
70,Gas spring mounting position,1551031052,"I am trying to design a metallic box with a 40kg lid (1010mm x 50mm). And i am having trouble calculating the positions of the gas spring in order to ensure that is needed about 2kg of force to open it and about the same to close it. The range of the lid is between 0 and 90 degrees.

I've tried to make an excel sheet, but when i try it on solidworks the geometry is off, any help?",AskEngineers,False,ArdianM21,/r/AskEngineers/comments/auahbc/gas_spring_mounting_position/
71,Advice for Choosing a Major,1551029450," I am currently torn between three majors:

1. Aerospace engineering
2. Biomedical engineering (Molecular Cellular and Tissue specialization)
3. Food, Ag, Bio engineering (biological engineering specialization)

I have heard a lot about not being able to get a job with the last two, or basically needing to go to grad school or get a PhD. Anyone have any insight into how true this is?

Also, is aerospace really just a lot of Matlab?

Any biological engineers have insight into what areas I could get into with that degree? I am worried about majoring in something that I don't really want to do, and ending up wasting 4 years of my life.",AskEngineers,False,JPVoltaire,/r/AskEngineers/comments/aua6np/advice_for_choosing_a_major/
72,Questions regarding the audio industry.,1551028925,"Happy Sunday to all, I’ll start off with a quick background. 

I recently received a coop position with a company focusing on loudspeakers, amplifiers, dsp, and control networks. A lot of the book knowledge required is regarding electronics and circuitry, but I am currently a sophomore in mechanical. I have gotten good experience with crossover networks, audio testing in an anechoic chamber, and have gotten to work on a mechatronics testing system we use. But a lot of this was picked up along the way, not topics I have seen in my major. I am only a sophomore and haven’t learned about vibrations or even taken intro to circuits yet so this might be why. 

I’ve come to the realization that I want to stay in this industry, anything related to audio, but I’m afraid that my degree isn’t suited. My coworkers are incredibly passionate, management is incredible, and the work is very hands on and exciting. 

If there are any non electrical engineers working in audio engineering, please tell me a little about your experience getting into the industry and general comments on what you work on. I would greatly appreciate it because I have had trouble finding information on this sub. 

Lastly, what can I do to put myself ahead in this field apart from researching in my free time? What personal projects would impress those hiring? Thanks all. 
",AskEngineers,False,iangrowhusky,/r/AskEngineers/comments/aua34o/questions_regarding_the_audio_industry/
73,Help with job hunting in the age of online applications,1551027868,"I posted [here](https://www.reddit.com/r/AskEngineers/comments/areegj/short_term_uhealthy_work_environment_may_end_with/) about a week back about my fears of being laid off/fired. I truly appreciate all of the advice you all had offered. Unfortunately, my fears came true. I used a combination of everyone's advice to start looking around and preparing for the worst, but also trying to make the situation work and be mature about things. I was told the extra work I had put in the past week was noticed and appreciated, but that this just wasn't the ""right fit"" and nothing to do with capability or performance. Despite all this, I was told by the plant manager he would give a reference if needed. Luckily, I prescribe to a lot of the advice over at r/personalfinance so I am able to survive for at least 6 months with no work, but I would hate to do so.  


So, for the first time in my life (since early high school) I am unemployed and still reeling with what this means and how to proceed. Prior to now, job hunting was a hit or miss approach as I didn't have much to include on a resume to spin towards each job, and now I am faced with including this experience or not. With every job listed online and all applications being sent in through what may be more recruiters, I am extremely gun shy. My questions:

&amp;#x200B;

1. Do I include this 3 months of experience given my manager has agreed to be a reference?
2. What is the most effective method for getting in the door in the most timely manner? If I can get in front of anyone I can almost always get the ball rolling.
3. Is it worth truly customizing your resume to the point of potential BS for every job? At times, the advice surrounding that seems vague because there is only so much customization that can truly happen.
4. Can I be proactive with each job listing and call the employer or stop by their offices? The idea of sedentary job hunting bothers me.

&amp;#x200B;

&amp;#x200B;

&amp;#x200B;",AskEngineers,False,myengthrowaway,/r/AskEngineers/comments/au9w7v/help_with_job_hunting_in_the_age_of_online/
74,"Since Head Gasket is such a pain to be replaced when it fails, why haven't we designed an engine without one?",1551027042,"I was trying to find out reasons why a head gasket is absolutely essential and why the industry hasn't designed around it yet? (Please ignore Electric Cars/Hydrogen Cars/Rotary Engines).  


I am talking about standard inline 4 cylinder engines.",AskEngineers,False,Shumayal,/r/AskEngineers/comments/au9r0q/since_head_gasket_is_such_a_pain_to_be_replaced/
75,Why the paper exploded when folded 7 times with hydraulic press?,1551025867,"[Here](https://www.youtube.com/watch?v=KuG_CeEZV6w&amp;list=WL&amp;index=300&amp;t=0s) is the video in question. I am keen to understand a material science perspective on what just happened. 

(video-a guy folds paper 6 times with hydraulic press. 7th time, the folded paper explodes making it hard and brittle.)",AskEngineers,False,SapienSaw,/r/AskEngineers/comments/au9ju3/why_the_paper_exploded_when_folded_7_times_with/
76,"If you love all the building blocks of engineering, will you like engineering itself?",1551024105,"Hi guys,
I'm a junior in high school and I'm struggling to determine what major to choose in college. I absolutely love math, physics, chemistry and biology, but am unsure if I would enjoy engineering. Is there a chance that I can adore the building blocks of engineering, but not engineering itself (which combines all the disciplines together)?",AskEngineers,False,Invalid_factor,/r/AskEngineers/comments/au99d8/if_you_love_all_the_building_blocks_of/
77,Is it Cal or Calc?,1551022083,My friends and I are having a debate on what the shortened version of calculus is called. Some say cal some say calc. Everyone agrees that the shortened version of Pre-Calculus is Pre-Cal. So shouldn't the shortened version of calculus be cal? Lol ik this is not the typical question on this subreddit but I know all engineers had to take calculus so what shortened version did you call it?  ,AskEngineers,False,moe101dew,/r/AskEngineers/comments/au8y8m/is_it_cal_or_calc/
78,I found myself writing in 'Inches' WHY?,1551020770,"What has happened to me?

At what point did I make the conversion?

From Engineering school, to... this, 8 years later.

I don't know if I can blame industry, our drawings are in mm. 

Curious if anyone knows why despite being brought into the metric world, we get creep?

",AskEngineers,False,canIbeMichael,/r/AskEngineers/comments/au8r1i/i_found_myself_writing_in_inches_why/
