index,title,created_utc,selftext,subreddit,media_only,author,permalink
53,Will it be easier/harder to get an engineering job in May?,1581461704,"I graduated in December with my degree in Plastic and Polymer Engineering. I also managed to minor in Mechanical Engineering.

I have submitted more applications than I can count. I’ve basically submitted an app for everything that I remotely qualified for. I wait a few days for more openings to come in and I apply for those too.

I have had so many interviews, both in person and over the phone. Initially I went with jobs in my general area but at this point I’m willing to go anywhere. 

I moved out of my parents house (they were getting really annoying and started blaming me for not having a job, and it was deteriorating my mental health so I left) and moved in with a friend. I got a small job working at a grocery store, in which I doctored a resume that had nothing to do with my engineering background and during the in person interview I lied through my teeth and told my boss that I dropped out of college. (This sub offered that advice, so I wouldn’t scare them away by the thought of me leaving for an engineering job.)

So yeah. It’s mid February, with zero job offers. So many interviews that have seemingly gone well. All smiles. The common theme is “we’re going to be reaching out to you here soon and talk to our hiring manager about going forward with you”. It’s almost like they’re FINDING something on my record that is scaring them away, but I’m squeaky clean. I don’t get it. I’d even say my references would all vouch for me.

I’m miserable, I’m barely making enough money to pay for my share of the rent, and I feel like a loser. I legitimately have never felt more dumb in my entire life. I’m walking around with an engineering degree pushing carts and stocking shelves. 

Also, I advise this to everyone and anyone: plastics engineering is a weak ass engineering degree. Don’t go down the path. It’s not enough chemical and not enough mechanical. I regret it entirely.",AskEngineers,False,epicgamesbad,/r/AskEngineers/comments/f2greo/will_it_be_easierharder_to_get_an_engineering_job/
54,"What would be the feasibility issues with building a cofferdam in the ocean and using it as pumped hydro storage(with the ocean around it being the other ""basin"")?",1581460462,"(I have never seen such an idea proposed, so I'm assuming there must be some major flaw with the idea)

Basically, somewhere where the sea floor is relatively flat, relatively shallow, and the wind is relatively consistent could have a giant cofferdam built in it(pick any location you like; the following is just an example, but off the coast of Texas near Houston, the sea floor is between 50-100 feet deep for several miles out to sea)

It seems to me that a wall could be built from the sea floor to the surface(let's say 50 feet) and then the inside could be dug out even further down(let's say another 50 feet) and reinforced around all sides with the dredged material, sloping down to buttress the new hole in the ocean like an embankment dam.

(In this hypothetical, feel free to adjust the wall height and dredging depth as you see fit)

Off-shore wind could easily be placed around the perimeter of the cofferdam, and excess power could pump the cofferdam empty. When there isn't enough wind, the process could be reversed and power would be generated by filling the hole with ocean water. 

100 feet obviously isn't very much head to begin with, and as the hole filled, the head would decrease, but even with an overall average of 50 feet of head height, a hole with a radius of 2 miles could power every home in Houston(860K homes I think) for 24 hours(average usage of 39kwh per home per day) if it filled at a rate of 35,000 cfs, which isn't out of the ordinary from what I can tell for other dams. 

So what's wrong with my idea? I'm assuming cost is part of it. Although, it's not like the concrete part of the wall would need to be very wide if it was surrounded by the dredged material --like an embankment dam-- to keep the ocean pressure away(or would it?). In fact, it seems like to me that such a project would require less than 10% of the material used in Three Gorges Dam(I'll admit, the biggest construction project in human history might not be the best reference point, but since I used Houston as my example, I'll use ""they like things big in Texas"" as my rebuttal to my own admission)

In the long run, that still seems like a good way to balance the load of renewables, especially in coastal areas where people tend to live and wind is plentiful.

What am I missing from the engineering side? I highly doubt I'll ever be the one to come up with a grand new idea that actually works, so I expect my idea to have holes poked in it. So please poke away.",AskEngineers,False,GeorgieWashington,/r/AskEngineers/comments/f2gg2e/what_would_be_the_feasibility_issues_with/
55,Taking an Employer out for lunch?,1581460135,"Heys,

Currently a Mechanical Engineering student looking for an internship. I have a specific company I really like and want to hopefully land an internship there and was thinking of asking an Employer out  for lunch and also hopefully get some of my questions answered as well. Any advice about this idea would be great!",AskEngineers,False,BSRosales,/r/AskEngineers/comments/f2gcz4/taking_an_employer_out_for_lunch/
56,Chemical Engineering in Seattle,1581459208,"
Hi so I’m a student who will be graduating this May from RPI in New York with my bachelors in chemical engineering. I really want to be in the Seattle area but I’m struggling a little to find jobs there. Most of the jobs that I see posted on LinkedIn and other job sites are for people who have 5+ years of experience, I have applied for the entry level positions I’ve seen but so far no luck. Is there something else that I should be doing in my job search or is there just not as many positions in Seattle as I thought?",AskEngineers,False,mathwhiz2097,/r/AskEngineers/comments/f2g49t/chemical_engineering_in_seattle/
57,Feeling discouraged about internship/placement hunting - UK,1581459205,"I don't know if this is the right place to post this since I can tell most of you here are US based but here goes.  


So I'm an EU national, 2nd year student studying Electrical &amp; Electronic Engineering (Sandwich course) in the UK meaning I'm supposed to get a year long internship/placement. I've started applying since September but since then I have only managed to get 2 interviews. The first one went badly and I knew I would be rejected. The second one went pretty great but it's been 3+ weeks since then and I haven't heard back from the company meaning I probably won't be considered for the placement. I also have 2 assessment centres coming up.   


I have been applying to everything and anything, tailoring my CV, writing different cover letters -basically using most of my time job hunting- practicing interview questions etc. I really want to get a placement and get some hands on experience before I graduate but I can't seem to figure out how. I'm in the Electronics society working on a project for a competition in Sweden, my grades are good (High 1st class predicted), and I really am keen on learning. But it seems like this isn't enough. I recently started thinking about searching for summer placements as well and go straight to my final year of Uni after.   


Any advice guys?",AskEngineers,False,dravenstormzxz,/r/AskEngineers/comments/f2g48y/feeling_discouraged_about_internshipplacement/
58,Ribs on plastic parts,1581455361,"How can I determine ""array"" of ribs on plastic parts? In guidelines there is explanation on rib thickness, height and draft angle, but I didn't manage to find what is good practice where to place ribs?  

[Example](https://www.nicoletplastics.com/wp-content/uploads/2019/01/DFM-Report-Image_Ribs-600x256.jpg) for this example I can understand ribs around bosses, it is designed to make boss stronger because of force made by screw. For other I doubt if I was given to design same part to make same ribs like in picture from link. 

When you design ribs, you design them based on FEM analysis or you place them just on your intuition?",AskEngineers,False,azzazil91,/r/AskEngineers/comments/f2f2zw/ribs_on_plastic_parts/
59,What's medical device industry like for engineers?,1581454571,I'm an engineer in the Aerospace industry and it's slow and bureaucratic. I want to do something good and make my career meaningful. I want to change my field to the medical device industry. Anyone in the medical device industry mind to share your experience? Thanks!,AskEngineers,False,SleepingOnMyPillow,/r/AskEngineers/comments/f2ev4x/whats_medical_device_industry_like_for_engineers/
60,Is there a difference between a TS/SCI clearance and just an SCI clearance?,1581449905,"I’m getting an SCI clearance, but I’m not sure what that means entirely. Some people have said that means I will get a TS/SCI. Or is it possible to have just SCI without Secret or Top Secret? And if so what are the implications of only having SCI? Thanks for the help, in researching I can only find info about TS/SCI.",AskEngineers,False,EngineerDude756,/r/AskEngineers/comments/f2dmzx/is_there_a_difference_between_a_tssci_clearance/
61,"Newer engineer: What should I do if I give a deadline to my boss, and he expediates the deadline from 96 hour turnaround to 24 hour turnaround citing ""you have the weekend""",1581446721,,AskEngineers,False,ElPasoRapids,/r/AskEngineers/comments/f2ctpr/newer_engineer_what_should_i_do_if_i_give_a/
62,Simulation software for sensors,1581446209,"So we have simulation softwares for circuits, namely spice tools. We also have simulation software for microcontrollers, Proteus. (Are there any other softwares for microcontroller simulation?) 
Anyways my main question is that are there any softwares for simulating sensors/transducers? My idea is like there are physics engine for games, there should be physics engine used for sensors' simulation. And that's how they test and manufacture them in the first place. Right?
(Asking for both Windows and Ubuntu)",AskEngineers,False,R0b0tg,/r/AskEngineers/comments/f2coyl/simulation_software_for_sensors/
63,Work/Education Balance for a Returning Student,1581444616,"Currently I am employed full time in a municipality working in public works under two engineers with the water &amp; sewer (and storm drainage) divisions. My role currently is the ""Engineering Technician"" though I have never taken engineering before. While I help with the engineers doing some stuff, I'm not one they rely on plan review, rather I help do GIS and inputting and building the GIS database and whatnot.

I have a BA in History and an AS in Geospatial Sciences for GIS, but I'm not interested in getting deeper into GIS nearly as much as I was 4 years ago when I graduated. Rather now that I've been in the field for 4 years, I'm finding myself interested in engineering. Also for note, while I don't have children to worry about, I am 35+ and trying to figure out how one would balance work, life, and school to try and get a BS in engineering.

Is there any advice on how to do this? Thankfully my muni will help pay for school. But I'm not sure how to balance taking courses and not being in school for 10 years. Has anyone here done something as such? I wouldn't call this a career change...but an upgrade. Thanks for any advice",AskEngineers,False,Teradoc,/r/AskEngineers/comments/f2c9uw/workeducation_balance_for_a_returning_student/
64,"Currently Majoring in EET, considering switching. Again.",1581444222,"There is a lot to cover here. Not even sure if this subreddit is the best place to ask but i'll give it a go.

&amp;#x200B;

right now, I am going to a Bachleors electrical Engineering Technology at SIUC. But what has led me to this major isn't really what I wanted to begin with.

&amp;#x200B;

When I was a little kid, I used to spend a lot of time sitting in my parents basement taking apart electronics, and putting them back together. I was using an oscilloscope, creating DC-DC converts and reading schematics and datasheets by high school, so I thought I would Major in Electrical Engineering. 

&amp;#x200B;

Then something strange happened senior year of high school. I stumbled into the IT asset revovery and resale business by accident upon visiting a scrap yard in Michigan, and ultimately started an ITAD business myself. I was making 70K a year just going to scrap yards and flipping computer parts in ebay, craigstlist, and Amazon and paying a couple of friends to pack and ship things for me. Of course all that ended my Senior year, when I went off to college. This is where things take a downturn.

&amp;#x200B;

I chose Electrical engineering as my Major, and ended up failing my first year of school at UofM Dearborn. The Calculus and Chemistry got me. I was put on probation, and for a complex list of reasons I do not want to explain here, Transferred to SIUC in Illinois.

&amp;#x200B;

Upon transferring to SIUC, I chose a Bachleors in EET becuase it seemed ""easier"". But Now i'm finishing off my second semester as a Sophomore at 21, and I'm still not sure if it's right for me. Recently as of October 2019, I've gotten into teaching myself Altium Designer, fusion 360, and I love my solidworks class. But I learned that we never cover any design work in EET, It's just technician work.

&amp;#x200B;

I'm considering switching back to EE again, since the classes my junior and senior year are more appropriate for what I wanted to do to begin with. unfortunently I would have to go back again and try to get those hard Math, Physics, and Chemistry classes out of the way. That would mean instead of graduating in 5 years, it would be 6 years. I didn't particularly feel like spending 6 years to get a college degree, but here we are. 

&amp;#x200B;

But on the other hand, I also am really into entrepreneuership and the business side of things, and am currently moniring in Economics, so I am not sure what to do at this point. I've been good with business, and I've been good with engineering. I'm not sure which one to pick.

&amp;#x200B;

There is a third option here; Industrial engineering. My School offers it, and it looks to be a good blend of Business and Engineering. It would still extend my school time to 6 years, but would require me to only retake my math classes.

&amp;#x200B;

Or, does any of this even matter? Maybe just stick with my major, and get something like a minor in Economics or business (I am halfway to meeting both of these). The goal is to be employable after all, whether the market is doing well or poorly. At this point, the chose I want to make seems like a dice roll.

&amp;#x200B;

TL;DR: I'm a second Semester Sophmore Student in EET who likes both Engineering and entrepreneuership, and has been good at both outside the classroom. Is it worth it to switch back to electrical Engineering, or even switch to Industrial Engineering instead given I would extend my time in school from 5 years to 6? Or maybe just stick with my major, and pick up one or two minors?",AskEngineers,False,CUDAcores89,/r/AskEngineers/comments/f2c63k/currently_majoring_in_eet_considering_switching/
65,Masters in Engineering - Canada - Salary?,1581443532,"I've completed my Bachelor of Engineering in 2018, it took 5 years, and it was co-op based. In total I had 5 work terms which means 20 months of engineering work experience. Immediately after finishing my Bachelor's I kept trotting on and began my Master's. I'm currently job searching and while there seems to be a good few opportunities in my field (marine) I am unsure where to expect my starting salary to be. From research on this subreddit/ elsewhere it seems that around $55-65k is an average starting salary for most engineers fresh out from their bachelor degree. 

&amp;#x200B;

Tl;Dr: I'll have my M.Eng soon, what salary should I expect from employers?",AskEngineers,False,LocalDork,/r/AskEngineers/comments/f2bzsu/masters_in_engineering_canada_salary/
66,Mechatronics Engineers,1581443512,[removed],AskEngineers,False,xBukhaari,/r/AskEngineers/comments/f2bzmu/mechatronics_engineers/
67,what are the topics that i should learn thoroughly to be a good manufacturing engineer?,1581443430,,AskEngineers,False,okonomiyakike,/r/AskEngineers/comments/f2bytv/what_are_the_topics_that_i_should_learn/
68,Deciding on an internship,1581442568,"Im a senior ME student graduating in May. I’m currently working as an intern in the automotive industry. I’m doing mainly hands-on work, taking measurements/dimensions and doing layouts. I also use a program to scan parts and import them into solidworks. I was informed that the likelihood of getting a full time position here is possible but not very likely due to limited space and the smaller branch.

My previous job was an internship at a transportation engineering firm. I enjoyed the job but it could get a bit dry. I’m enjoying my time at my current company so far. 

I was just offered an internship at a different transportation company, which would be paying me significantly more (almost 2X my current hourly wage) and with the intention to go full time once I graduate. This would definitely help given that I just got married and got bills to pay. I know it’s not exactly my field, but what would be my chances to land an ME job down the line, say in a few years with limited ME experience? Should I just stick to my current job? I just want to make the right decision and I wanted some more input. Thank you in advance!",AskEngineers,False,anthonygociu,/r/AskEngineers/comments/f2br9t/deciding_on_an_internship/
69,Heavy haul trailer constraints?,1581442470,"Hi all,

My question is how to practically model the suspension constraints on a heavy haul trailer (think lowboy or flatbed). These trailers have multiple axles. The way I see it, there are a couple of options, but I'm not sure which one is the most realistic for analysis purposes.

1. Pin the trailer at each axle location, either using a line or a simple geometric representation of the suspension hanger. 
2. Apply a pin at the middle of the rear axle group.
3. Apply a fixed constraint at each axle. 

Note that sometimes these trailers deflect upward at the rear bumper under certain loading conditions, which is why I don't know whether pinning/fixing each axle is a good idea.

Thank you in advance. I look forward to your input. 

&amp;#x200B;

Here's an example drawing of the air ride suspension:  [https://blog.xtralease.com/wp-content/uploads/2015/11/Thumbs-portion-of-infographic.jpg](https://blog.xtralease.com/wp-content/uploads/2015/11/Thumbs-portion-of-infographic.jpg)",AskEngineers,False,CTPwashere,/r/AskEngineers/comments/f2bqdh/heavy_haul_trailer_constraints/
70,How to connect servo motor with object.,1581441238,"Im currently prepping for University and need to do a project

I've been running through catalogues and can't really figure out how I could directly connect the servo to the object I want it to rotate.

Is it supposed to be friction based? I can't think of how it can be conveniently placed into the hole of the object without welding, heat-expansion of the hole or using some sort of glue",AskEngineers,False,Scar_Husky,/r/AskEngineers/comments/f2bf4g/how_to_connect_servo_motor_with_object/
71,Securing thermocouples without epoxy?,1581440782,"Hi Engineers, 

I am an engineer currently working for a design consultancy. I have been working on a subassembly within a larger project that is basically a convection heat/cooler for consumables that facilitates bacterial growth. This consumable has to operate within 5C - 41C. I am doing a lot of testing and have numerous thermocouples (TCs) installed within my consumable. I have been installing these thermocouples using a small thermally conductive epoxy to tac theses TCs to my surface of interest. 

I initially started out using kapton tape to secure these but since there is water/liquid within my consumable, the tape didn't hold up. I was wondering if anyone has some suggestions for different methods of securing thermocouples in place? The tip of my TC needs to be in contact with a metal component and it is difficult to tell whether they are currently in contact or just slightly above floating within the epoxy. Any advice would be deeply appreciated! Thank you!",AskEngineers,False,blacklabel7,/r/AskEngineers/comments/f2bb04/securing_thermocouples_without_epoxy/
72,Anyone here bored to shreds? I’m getting dumber by the day,1581440244,"I feel so bad but I can’t just quit this 100k job without lining another one up yet I find most job postings dull. I worked on many projects but it’s a super inefficient utility in America. The other day 6 people walked through our office looking for smoke sensors. So ridiculous. No one here cares about much and I honestly think half the people can be fired today and nothing would be effected. 

I really want to go and use my technical knowledge but can’t seem to figure Out who actually does any real engineering working in the utility world.",AskEngineers,False,g7x8,/r/AskEngineers/comments/f2b5zg/anyone_here_bored_to_shreds_im_getting_dumber_by/
73,What can an electrical engineer do that a mechanical engineer can't? What jobs prefer electrical over mechanical engineering degrees? What about licenses?,1581438441,Trying to choose between electrical and mechanical engineering and one thing I'm curious about is which doors will open and which ones will close on each path. I know MEs learn thermodynamics and fluid mechanics and EEs don't. I'm curious what areas EEs are on the EE only portion of the venn diagram?,AskEngineers,False,ctrl_alt_rip,/r/AskEngineers/comments/f2apuh/what_can_an_electrical_engineer_do_that_a/
74,I landed my first phone interview. Could use some advice.,1581438285,I have my first phone interview tomorrow since graduating in December. It’s just a brief phone interview as they had “a lot of candidates apply for this position and want to narrow down the candidates”. What should I be prepared to be ask? The job position is for Mechanical Engineer - Research and Development.,AskEngineers,False,DailYxDosE,/r/AskEngineers/comments/f2aoh9/i_landed_my_first_phone_interview_could_use_some/
75,Is the gas turbine industry worth it to get into?,1581435660,"I’m a mechanical engineer interested in the power generation industry, mainly turbines. 

With increasing renewable energy technologies being developed, will there be demand for gas turbines in the future? I don’t want to work in an industry that will decline in the future.",AskEngineers,False,dankdz,/r/AskEngineers/comments/f2a1lz/is_the_gas_turbine_industry_worth_it_to_get_into/
76,"Engr Project, Interviewing Engineers",1581430768,"Hi all! I’m an engineering student and have a class project where I need to ‘interview’ a couple of engineers (asking about 10 questions relating to the engineering profession, and that persons personal experience regarding ethic challenges, career accomplishments, and daily work life). 

I’ve reached out to multiple engineers who are local to me, and I’ve either received no response or that they’re too busy. My project deadline is fast approaching, and I need to have the ‘interviews’ done by this Sunday the 16th. So I’m turning to the wonderful engineers of reddit to see if anyone here would be interested in participating? 

It should only take about 10-15 minutes, and I can message or email the questions. Please be an engineer who is either currently working in any field of engineering or is retired.  The purpose of this project is to give us students a better idea of what it is to work in the engineering profession. 🙂",AskEngineers,False,rockthatboat,/r/AskEngineers/comments/f28xlu/engr_project_interviewing_engineers/
77,"When Antarctica melts and sea levels rise, will it be possible to protect the Mediterranean coast by building a barrier across the Strait of Gibraltar?",1581427803,,AskEngineers,False,contro2,/r/AskEngineers/comments/f28bx0/when_antarctica_melts_and_sea_levels_rise_will_it/
78,Looking for a tutorial on cables,1581417464,"I am to automate a small process and everything from programming the PLC to the wiring the control box is up to me. The most nebulous part so far is selecting the right cable for different jobs.  


I read my local standards on wire diameters (EN 60204-1:2009-12 Part 1, chapters 12 and 13; et al.) and the wiki entries on [cables](https://en.wikipedia.org/wiki/Electrical_cable) and [wires](https://en.wikipedia.org/wiki/Wire) as well as some high school technical books, but have found little useful information that goes into applicable detail. Several manufacturers offer cable selection guides, but those are rather lacklustre and obviously biased.

What I'm looking for is a guide on the various types of cables out there and when to use them.  

For example, I'm looking for a 5 wire + shielding cable that terminates to a 6 pin plug and has an outer diameter of no more than 7.5 mm. It's supplying and reading a  &lt;25 V sensor. Frequency, environmental factors are a non-issue and I don't expect a lot of EMC troubles. I checked rs-components, but the few cables that meet those exact specs are very expensive considering I need about 5 m of it in total. Could I use a S/UTP cat 5 cable for that and ground the unused wires?
 
How, besides experience and guidance of elders, which both isn't available to me, can I learn about cables?",AskEngineers,False,Arkeros,/r/AskEngineers/comments/f26mid/looking_for_a_tutorial_on_cables/
