index,title,created_utc,selftext,subreddit,media_only,author,permalink
98,Neural dust question,1585174829,[removed],AskEngineers,False,relapsing-playlist,/r/AskEngineers/comments/fozjsb/neural_dust_question/
99,Really Trying to Figure Out What to Do,1585173555,"I feel frustrated because I have a very hard time pinning down the kind of work I am good at. I feel like I am good at a lot of particular things, but they are particular.

* I'm generally very big picture in my mindset, but I am still very precise when it comes to solving technical problems.

* I love technical design of something. I'd love to design mechanical systems, but then incorporate a strong working knowledge of electrical subsystems. I get completely sucked into the process of design, as if nothing else even matters, from the interface of something to the ""how to make it"" to the ""what systems do I have available to integrate into this thing?"" It's like a disease and I can't stop when I get involved in something design oriented. I.e. something as basic as a personal project of designing a workbench that I could use in my apartment consumed me. I ended up making a shelf that doubles as a workbench, maximizing the utility compared to the space. 

* I am highly conceptual in my thought as well, so abstract problem solving is also one of my strengths even though I have a strong mechanical aptitude.

* Strong at coding. I've seen people who are quicker, but I tended to fall in the upper tier of people in my classes whenever there was coding to be done.

* I enjoy managing people less as a taskmaster and more as an organizer, i.e. this person is particularly good at this, that person is particularly good at that, and  I can leverage those abilities towards a ""grand vision.""

* Solving problems by how things interrelate on a grander scale. I.e. paying to and predicting TRL based on my understanding of physics.

I'm just kind of in pain about this right now, I feel like I have so much to offer and do but I've just been in a situation that hasn't panned out for a couple of reasons.

My degree is a B.S. in physics, GPA wasn't that great (I have ADHD/Generalized Anxiety Disorder/Major Depressive Disorder and did a lot of slacking in school). It really stung because when I managed to be motivated, I was actually one of the better students, getting scores on exams that are well above average. Medication was working wonders too for a while, but it was also causing problematic side effects. 

I don't need meds to be a creative designer of things, and honestly they'd probably hinder that particular ability.

I've done a bit of project management in aerospace and I was a coronavirus layoff, so now I'm really just trying to figure out my new path. They liked me a lot at the last job and want to give a letter of rec and said they'd take me back if they got more work, but I want something more technical than project management. The workplace was a strong environment for me since I always felt like I had to be doing something since I was on the clock, so that made it easy to actually work, and by actually working consistently I was a solid employee. And that was doing stuff that I'm not even particularly apt for. 

I feel like I just need to get myself into a technical role that is also creative/strategic and I'll knock it out of the park.

Unfortunately I'm still a little lightweight on engineering experience, though before I got laid off they were about to give me a basic engineering project to design a test setup.

Some stuff I've thought about working towards, based on what I've mentioned:

* Mechatronics.

* Design engineering.

* Systems engineering.

The subject matter doesn't matter so much, it's literally more of the technical problem solving. I.e. from mining to manufacturing to aerospace. I'm frustrated too because I LOVE mechanical design AND I LOVE coding, and I'd love to combine those things.

I have a lot of private student debt from the previously undiagnosed medical disorders.

We're all in this coronavirus boat too, so I might even need to do some interim work (or apply for a master's).",AskEngineers,False,Irredactable,/r/AskEngineers/comments/foz6cn/really_trying_to_figure_out_what_to_do/
0,"I recently accepted a Project Engineering internship with Lockheed Martin, I'm a Mechanical Engineering major, will this be a good first internship?",1585172672,"The title says almost all of it. I'm finishing my sophomore year as a Mechanical Engineering student and I landed a Project Engineering internship with Lockheed for the summer. I'm very excited about it especially since it's the only internship I have received an offer for. I've got a 3.7 GPA and a lot of hands on mechanical/electrical experience but I guess it's a competitive world haha.

Ok so this position is only partially technical, meaning minimal CAD, design, or analysis, if any honestly. But I should be working with design departments as well as the management side of things doing coordinating, budgeting, spreadsheets, and be exposed to technical work daily. I'm hoping it will give me a good overall understanding of the engineering and manufacturing process, since I'll be able to work with both sectors.

However, in the long run I am getting my degree to do engineering design work, at least that's my goal. I know since I have 2 years left I likely don't have have much to offer on the technical side of things so I'm figuring this will be a good starting point. 

Anyway, if anyone has experience with this role or did it as an intern, did you find it valuable for you career? Should this help me get other internships in the future (Next summer I am hoping for design). And lastly, if you have worked with Lockheed how do you like the company? Thanks!",AskEngineers,False,Charlie_thetunafish,/r/AskEngineers/comments/foyxaj/i_recently_accepted_a_project_engineering/
1,Reverse carnot cycle vs ideal vapour compression refrigeration cycle,1585172559,"In thermodynamics we are looking at these two processes. While I know the reverse carnot cycle uses a turbine instead of an expansion valve, I was wondering what the difference between the processes is in terms of reversibility, efficiency, or other areas?",AskEngineers,False,Ukuleilidh,/r/AskEngineers/comments/foyw41/reverse_carnot_cycle_vs_ideal_vapour_compression/
2,Soldier Piles: depth vs width -how much needed to compensate?,1585172517,"id prefer to pound 3x3 ibeams into the ground using a mechanical pounder on a steep hill for the soldier piles of a lagging wall

currently the plans call for 2"" pipes sunk in 12x12 concrete footing 1.5x deeper in the ground than the pipe is above the ground - used as piles supporting the laggingon the downhill side.

couple problems i see with this plan:

1- i learned the concrete has to fill up to the top of the post hole at ground level otherwise the earth on top can move and the pile can rotate.

2- an ibeam is stronger than a pipe- if i can sink the ibeam 2x into the ground with 1x above the ground will that .5x compensate for the lost width of the concrete footing? or would i have to go deeper?

we're building small retaining walls on a steep hillside to build pathways. the tallest a wall would be is 3 feet.",AskEngineers,False,urge3,/r/AskEngineers/comments/foyvmw/soldier_piles_depth_vs_width_how_much_needed_to/
3,Help identifying a component,1585172486,"Hi, 

In the picture attached there are three steel sections held together by two bars. These bars contain some sort of spring which pushes the other two steel sections apart. They can't be pulled completely apart. Essentially the outer two pieces are spring loaded, the whole section is compressed then pushed down the inside of a tube, it then expands and can be pulled out. I've tried searching online but I can't identify them.

Any idea what those bars are? Are they  specific components or just bars with a spring inside. 

Thanks",AskEngineers,False,Who_Is_U,/r/AskEngineers/comments/foyvb0/help_identifying_a_component/
4,"Recently accepted a Project Engineering internship position with Lockheed Martin, I'm majoring in Mechanical Engineering, will this be a good first internship?",1585172032,"The title says almost all of it. I'm finishing my sophomore year as a Mechanical Engineering student and I landed a Project Engineering internship with Lockheed for the summer. I'm very excited about it especially since it's the only internship I have received an offer for. I've got a 3.7 GPA and a lot of hands on mechanical/electrical experience but I guess it's a competitive world haha.

Ok so this position is only partially technical, meaning minimal CAD, design, or analysis, if any honestly. But I should be working with design departments as well as the management side of things doing coordinating, budgeting, spreadsheets, and be exposed to technical work daily. I'm hoping it will give me a good overall understanding of the engineering and manufacturing process, since I'll be able to work with both sectors.

However, in the long run I am getting my degree to do engineering design work, at least that's my goal. I know since I have 2 years left I likely don't have have much to offer on the technical side of things so I'm figuring this will be a good starting point. 

Anyway, if anyone has experience with this role or did it as an intern, did you find it valuable for you career? Should this help me get other internships in the future (Next summer I am hoping for design). And lastly, if you have worked with Lockheed how do you like the company? Thanks!",AskEngineers,False,unfafme,/r/AskEngineers/comments/foyqgb/recently_accepted_a_project_engineering/
5,I need a mechatronic engineer,1585171235,"
Hi! First of all, sorry for my English. I was wondering if someone could answer some questions for a homework assignment. I have to interview a professional in the career I want to study (mechatronic engineering). I would really appreciate someone answering me before April 2nd. Thanks in advance.",AskEngineers,False,09mnstr,/r/AskEngineers/comments/foyi9y/i_need_a_mechatronic_engineer/
6,How to achieve a gear ratio of 180 using the following gears?,1585170949,"I need to achieve a gear ratio of 180 and I have only the following gears (I have 2 of each type):

50mm gear with 50 teeth

40mm gear with 40 teeth

30mm gear with 30 teeth

20mm gear with 20 teeth

10mm gear with 10 teeth

14mm worm gear single thread

(Additional spur gears can be 3d printed but using only the ones mentioned above is ideal) I have to make this on both sides of the car that I am making so I need to make sure I can make 2 gear trains with the ratio of 180. I looked online for help to try it on my own but after a while of failing, I have decided I could really use some help. Thank you so much! Any information is useful!",AskEngineers,False,JageshP,/r/AskEngineers/comments/foyfbv/how_to_achieve_a_gear_ratio_of_180_using_the/
7,How much does Academic Distinction help find a job?,1585170334,"Due to the Coronavirus, our school switched to an optional pass/fail system. However, anyone who chooses this route disqualifies him/her from receiving academic honors such as Cum Laude, etc. My current GPA is only .06 away from Cum Laude, and my next year (senior year), should be significantly easier than my current semester. If I don't do too hot this sem, should I still go through with a pass/fail?",AskEngineers,False,e_expert,/r/AskEngineers/comments/foy8uj/how_much_does_academic_distinction_help_find_a_job/
8,Are there any engineers on here that have to deal with pollution/litter?,1585168660,"My partner, Mehak, and I are working on a prototype to assist with cleaning up pollution/litter on the coast. We're both in high school and doing this for a project. We need 100 people to take our survey in order to show that there's a need for our robot that will help with coastal litter.

Here's the survey: [https://forms.gle/BNQLZweNBAiwC8ny5](https://forms.gle/BNQLZweNBAiwC8ny5)

I'd really appreciate it if you took the survey. I usually don't go on Reddit for important projects like this, but we're trying to finish the survey portion of our project so we can move on to the prototype.

Thank you in advance.",AskEngineers,False,MKagel,/r/AskEngineers/comments/foxqqn/are_there_any_engineers_on_here_that_have_to_deal/
9,Common Software Used For IoT/Industry 4.0 Application,1585167742,"I'm relatively new in this topic, at least from a high-level point of view. What kind of software do companies usually use to have their system integrated?",AskEngineers,False,BubbleBobaTaroTea,/r/AskEngineers/comments/foxgzj/common_software_used_for_iotindustry_40/
10,Ocean Pollution Survey,1585167606,[removed],AskEngineers,False,MKagel,/r/AskEngineers/comments/foxff9/ocean_pollution_survey/
11,How to calculate the cooling load of a building?,1585167190,"Hello,

I am currently in mechanical engineering program and I am working on a project where I have to calculate the cooling load of a building. 

I have looked at a few resources I found online, but they are either too vague or too complicated. 

I would really appreciate your help.",AskEngineers,False,Ultima89,/r/AskEngineers/comments/foxb1k/how_to_calculate_the_cooling_load_of_a_building/
12,I'm likely facing unemployment this summer due to COVID. What should I do in the meantime to stay relevant? (EE Student),1585166603,"I'm a third year EE student and I was searching for a Coop position from May 2020 - September 2021, and that search has dried up largely due to COVID 19. My usual summer job was also cancelled along with most seasonal employment in my area. I'd love to take the summer off and spend some time camping and recoveriung from school, but it seems like most employers expect many technical personal projects on top of the degree, which I really dislike. What should I pickup in the meantime to stay relevant to employers?


Online coding (Python) bootcamp? I really dislike coding and I'm not confident in my ability. I also do not want a coding position but it's bleeding into every part of EE.


SolidWorks qualifications? Doesn't seem as relevant to EE but probably much more interesting to me. 


I'd prefer to work with my hands to build something, but I don't have an good project ideas nor so I want to spend a lot for parts while I'm unemployed.


I'm also considering extending my degree by another year to graduate in May 2022 in hopes of graduating during a better economic period. I really feel for students graduating this year and I'm doubtful the situation will be recovered by 2021. I'm also very afraid of the year long gap that will go on my resume because of this.

Any advice is much appreciated.",AskEngineers,False,riottaco,/r/AskEngineers/comments/fox487/im_likely_facing_unemployment_this_summer_due_to/
13,Urgently need to find components for a project to Combat COVID -19,1585165362,"Hello all , I want to create a system that gives us body temperature and i cant find the MLX90640 Component all out of stock due to demand , could you guys point me in the right direction or give me a similar module that could help.

deos this one read temperature accurately?

Much appreciated",AskEngineers,False,InventorWolf,/r/AskEngineers/comments/fowqd6/urgently_need_to_find_components_for_a_project_to/
14,Does NACE specify Strength Limits for Inconel 718 or just the Hardness ?,1585164256,"We make allot of stuff out of Inconel 718 condition NACE. But I'm not sure what the minimum yield strength of that is.

I thought nace was mainly concerned with hardness/corrosion? 

So I've been specifying Inconel 718 Min Yield Strength 150 Ksi. As I'm more concerned with it collapsing under pressure. I don't wanna spec NACE when I dont know what yield strength I'll be getting .",AskEngineers,False,NoMoreGonnaDo,/r/AskEngineers/comments/fowe94/does_nace_specify_strength_limits_for_inconel_718/
15,Lowering Tenement basement U.K.,1585163841,"I wish there was a flair for structural engineering haha. 

I’m just personally interested to know how you investigate to see how much a basement can be lowered by, and for a tenement flat, with walls on the upper floors continuing to the basement - is it easier to have internal walls subfloor replaced with steel support to open up the basement space?

Apologies if this is confusing, my terminology is lacking. I of course intend to hire a structural engineer down the line but I’m just fascinated by the process!",AskEngineers,False,vinniegreen,/r/AskEngineers/comments/fow9sq/lowering_tenement_basement_uk/
16,Switching majors late. Am I screwed?,1585163664,"I'm about to graduate with a BS in environmental management. Unfortunately I've realized pretty damn late that I'd like to do environmental engineering instead. It's not offered at my current school. 
Looking at various master's programs (inc ABET accredited) it sounds like I'd be considered for admission if I supplemented my transcript with subjects I'm missing, eg mathematics, programming, e.t.c. 

Apparently bachelor level ABET is the most important, though? So I'm unsure if getting an accredited master's on top of a regular science bachelor's would be seen as employable.

Anyone have experience with or advice for this situation?",AskEngineers,False,anxi0us_thrOwaway,/r/AskEngineers/comments/fow7xt/switching_majors_late_am_i_screwed/
17,"I have my decision, however, I am curious to know what other engineers would do.",1585162084,"Hi Everyone, I hope you are well. 

I graduated from university at age 24 as a mechanical engineer, so I took 2 years longer than I should have. I got a job immediately, in a graduate program. I was with a group of 2 Diploma electrical engineers and 1 Bachelor's electrical engineer. 

I was super bored as I finished my 2 year program in 8 months and it was honestly so boring. My bosses are all electricians and we provided maintenance to the chillers and generators at a bank and also maintained their data centres. I got really bored and I could see my future and it looked bleak. Something would go wrong and I'd pick up the phone and call the vendor, they'd come fix it and done. 

Hence, I constantly looked for a job and found one (still waiting for it in writing). 

Fell inlove with the job description: 
-Pump station
-Pump and mixer selections
-FEA reports. 

Nothing compared to my previous job. However, this job is R6000 (South Africa) less in salary. 


I decided to go for the experience and take the job. Money will come but an experience like this must be worth the loss. 

I am curious to know what this community would suggest?",AskEngineers,False,Darshp1394,/r/AskEngineers/comments/fovqxi/i_have_my_decision_however_i_am_curious_to_know/
18,"If we exclude the the state we are today, how good is the market for Acoustical (NVH) Engineers?",1585160731,"Apparently in my country (Sweden) there is an extremly huge demand for this kind of engineers and the institute at my school are doing everything they can to recruit students for this master program but at the same time I don't hear anything from this industry. 

People who are working there, how is it really? Can you find a job everywhere you look? 

Follow-up question: What do you do and would you recommend it?",AskEngineers,False,Tagination,/r/AskEngineers/comments/fovcew/if_we_exclude_the_the_state_we_are_today_how_good/
19,Santa Barbara Unit Hydrograph,1585160358,"If I have two different shallow concentrated flows (pervious and impervious), do I use a weighted average 'n' value based on their lengths?",AskEngineers,False,bubbletwink95,/r/AskEngineers/comments/fov8e6/santa_barbara_unit_hydrograph/
20,Problems coordinating with structural engineer in regards to my shop drawings,1585152508,"Hi everybody, I need a bit of advice/help.

My questions are at the end of this rant.

I'm working on new home that's being completely framed in steel.

I'm the fabricator and erector.

I have an outsourced team for the shop drawings whom I've been working with for about 10 years and I've had no issues on large steel projects until now.

&amp;#x200B;

The clients architecture and structural engineer are refusing to verify their own drawings.

At first in the beginning of January they issued stamped and signed completed structural and architectural drawings, as the weeks went by my outsourced engineer and his team who is working on the shop drawings kept finding mistakes, and the structural engineer kept sending updates as we progressed with the shop drawings. This forced us on March 9th to completely stop the shop drawings due to so many changes. 

We requested that the structural engineer and architect send us completed stamped and signed drawings. So they sent a surveyor, checked everything, marked center columns and spacing and what not.

Now we received these drawings, and we sent him some markups to verify dimensions.

&amp;#x200B;

This is what he said:

 \-Please provide shop drawings signed and stamped by your engineer.  Sorry, these are the rules. 

&amp;#x200B;

I don't get it anymore, the structural engineer along with his architect doesn't review the mark ups that we sent him and doesn't confirm to anything...

&amp;#x200B;

From what I'm understanding is he wants us to complete all of the shop drawings (which we can't due to some unverified beams/columns/ dimensions) sign and stamp them and send to him?

&amp;#x200B;

So my question is, who's responsible for verifying dimensions and confirming to existing drawings and why?

Is this standard practice in Canada to send all the shop drawings stamped and signed first? and then the structural engineer reviews and confirms everything?

What action can I take if the structural engineer is still refusing or ignoring my mark up requests?

  
Thank you",AskEngineers,False,paulshagy,/r/AskEngineers/comments/fosw2i/problems_coordinating_with_structural_engineer_in/
21,(Canada) Why do mechanical design engineers get payed so little?,1585151119,"I'm really trying to wrap my head around some of the salaries I see as I'm job searching. I've seen CAD design positions that only pay 60k (40k USD) for 5 years of experience. Positions involving mechanical design for things like designing machines, fixtures, etc don't pay well either. From my experience these skills are not easy to develop, and there aren't many people around with them. So why the low pay? Is it because of outsourcing? High supply (doubtful)? Just curious and want to understand the industry I want to get into.",AskEngineers,False,runedude29,/r/AskEngineers/comments/foshap/canada_why_do_mechanical_design_engineers_get/
22,Solving for head using Bernoulli's equation,1585150088,"I have posted in this forum before and the answer was very useful. I apologize if this isn't the correct location to post a question like this (avoid homework questions) and even though this isn't a ""homework"" question , it is a problem I have for a senior project where I am designing a water tank.

My question is this:

\-How can I solve for the total head right before the pump (location 4). My initial idea was to say that the total head at 4 (HT4) is equal to : HT4=HT1+HT3-HT2-head losses (by the conservation of energy). I have done quite a bit of research on the limits of Bernoulli's equation and I believe that because it is derived from the conservation of momentum and not conservation of energy then it would be invalid to solve for the total head as specified above. Is there a way to solve this problem without using software?  Let me know if this question isn't totally clear and I will be happy to elaborate more on it. I will post a sketch of my problem too.",AskEngineers,False,packattack1129,/r/AskEngineers/comments/fos6z3/solving_for_head_using_bernoullis_equation/
23,Question about working exactly versus more than 40 hours per week.,1585147716,"Hi engineers,

I had a quick question I wanted to ask you. I’ve had a few internships back in college that were in engineering consulting. I was hourly, so I was encouraged to work no more than 40 hours, but I remember seeing my coworkers put in 45/50/55 hours per week.

Fast-forward to now, in my first full-time job (salaried; started back in January before COVID-19 screwed everything up), but now working in the defense industry. I work alongside a lot of brilliant engineers, but I had noticed that they tend to leave the same time every day (and rarely, have I heard people working more than 40 hours). I wanted to make my boss aware that I’m always available, and want to contribute. If that means staying late, then so be it. He said he’ll keep that in mind.

Is this industry-dependent? I’m scared that I’m not putting in enough hours as I think it’s necessary. It also doesn’t help that I’m still a new employee, and incredibly confused anyway.",AskEngineers,False,HeheYoItsYaBoi,/r/AskEngineers/comments/forixi/question_about_working_exactly_versus_more_than/
