index,title,created_utc,selftext,subreddit,media_only,author,permalink
0,Is there a portable device that give you WIFI?,1582631552,"I don't know a lot about this stuff, but I was wondering if there is some kind of product that could connect my phone to the internet that is portable.",AskEngineers,False,TreefrogJ,/r/AskEngineers/comments/f994s4/is_there_a_portable_device_that_give_you_wifi/
1,What material would be most suitable for making a mould that can withstand 100kpa?,1582630982,"I'm a university student doing a uni project that requires us to compress a certain mixture at 100kpa. I was wondering, what kind of material would be best suited for the task? Obviously some form of metal alloy would be the go-to material for making moulds but most of the material I found online are designed for injection moulding that includes heat dissipation. That is not really a concern for my project and I was wondering what other options I have.",AskEngineers,False,CepoiAiman,/r/AskEngineers/comments/f991dh/what_material_would_be_most_suitable_for_making_a/
2,"Why don't air planes have traffic lights to signal runway clearance, like we have in cars?",1582627183,"So, me and wife are big on NatGeo's Airplane Crash Investigations, and we just watched the episode on the Tenerife Crash in 1977 that killed 583 people.

Obviously, the lesson is don't take off without explicit command by traffic control!!!

However,

Why isn't there a light signal to enhance radio comm? A nice big light in the cockpit that's controlled by traffic control. Takeoff permission - light up green and stay red at all other time.

I mean traffic lights work great for cars and handle much more complicated traffic rules.

How come pilots only rely on radio communication?",AskEngineers,False,blackbeauty17,/r/AskEngineers/comments/f98f6l/why_dont_air_planes_have_traffic_lights_to_signal/
3,"Textile, materials, and environmental engineers: DIY for PM2.5 and spit aerosol protection?",1582623390,"Pardon my alarmism, heat maps for the pandemic are looking grim. N95s are being picked clean, and at some point effective DIY respirators will become required.

First of all, PM2.5 is modeled as mineral dust, not aerosols. Intuitively layers seem important not nominal particle diameter filter.

What is better than nothing?
What is counter productive?",AskEngineers,False,mathUmatic,/r/AskEngineers/comments/f97uhr/textile_materials_and_environmental_engineers_diy/
4,Sharing Monthly Salary with your parents.,1582619712,"I am a fresh graduate in mechanical engineering. I joined a company around 4 months ago. I earn a decent income but the problem is that my parents take away all my salary. I just receive around 10% of my income. I do not feel really good about this. I feel like a slave. I am living with my parents.

Have you guys been in such a situation. Please share your thoughts on this.",AskEngineers,False,fresh_graduate,/r/AskEngineers/comments/f97a43/sharing_monthly_salary_with_your_parents/
5,What did you specialize in mechanical engineering?,1582618319,"What do you specialize in? Do you find it fulfilling? 

Over my last two internships it’s become very apparent that not all mechanical engineers are the same. My boss during my last Internship told me that one of the most valuable things that I could do was to sub specialize in something. 

He warned that if I chose a less useful area to get experience in it could be a waste of time and non-transferable. But, if I knew what I wanted to focus / become an expert at, it could make an invaluable engineer.   

So, I was wondering what you guys do for a living, if you specialized in something and if you enjoy it? Is the skills you learned transferable? And finally any big regret working in a certain field?",AskEngineers,False,Tehgoldenfox,/r/AskEngineers/comments/f972d2/what_did_you_specialize_in_mechanical_engineering/
6,What can cause tube erosion?,1582618130,"Hi, What are all the factors that can cause erosion to the tubes? Can solids cause erosion? If so, how? I would like to please know all the ways that erosion can happen.",AskEngineers,False,aBodizeR,/r/AskEngineers/comments/f971bk/what_can_cause_tube_erosion/
7,Could a small bus motor home conversion handle the weight of a small bath?,1582615159,"I’m thinking of converting a small bus (Toyota coaster, Mitsubishi Rosa size) and putting in a narrow bath (under a counter and used to store large items when not in use). It would be on the side, over the wheel, would it be too heavy?",AskEngineers,False,bekastrange,/r/AskEngineers/comments/f96jt2/could_a_small_bus_motor_home_conversion_handle/
8,Should I include this video in my LinkedIn profile?,1582614818,"I am graduating in December and I am trying to update my LinkedIn profile to be more appealing for an entry level position. My school got some news coverage awhile back and I got a little bit of time on air: [https://youtu.be/pgDzv90W2mk](https://youtu.be/pgDzv90W2mk)

Is this a video that I should put in my profile?",AskEngineers,False,ATP_Synthase_Machine,/r/AskEngineers/comments/f96hsi/should_i_include_this_video_in_my_linkedin_profile/
9,Calculating time to lower temperature of stainless steel tank by certain temperature,1582613903,"Hey guys, odd question here. I’m working on a paper involving propellant conditioning of Nitrous Oxide. I’m a freshman AE major, so I’m lacking knowledge on thermo and heat and mass transfer. 

I am researching a way to use a variant of spray cooling on our school’s rocket oxidizer tank when it reaches high temps during launch. How would I be able to calculate the time/water needed over time to lower a cylindrical tank’s temperature by a certain amount? I was given a few equations by some professors, but they’re way over my head. Any help is appreciated.",AskEngineers,False,TurtlyMage007,/r/AskEngineers/comments/f96bz1/calculating_time_to_lower_temperature_of/
10,First job for a Civil Structural Engineer?,1582611033,"Hi, I’m from Mexico, I’ve graduated from college and I’m in process to getting my bachelors degree (it’s in process). So my question is, what kind of job can I apply for? What are your recommendations?",AskEngineers,False,StolenJam210,/r/AskEngineers/comments/f95tsg/first_job_for_a_civil_structural_engineer/
11,"Trying to decide between switching my major to aerospace engineering or computer science, and could use some insight",1582608298,"Hi everyone, I hope this is the right place to ask and that I’m not breaking any rules. 

I’m currently a first year music composition student working on my undergrad, however I’m most likely changing my major to either aerospace engineering or computer science (I know music to engineering seems like a pretty drastic switch, but they’re the two things I’ve been interested in most of my life, so I’m pretty capable in both areas). I can’t seem to decide which would be best for me though. 

I’ve always been fascinated by aircraft and spaceflight, I used to take flight lessons, and flight simulators were always my go to games. I also fell in love with Kerbal Space Program when I was in early teens (gotta start somewhere, right?). Being able to create something and see that creation fulfill its purpose is always some I’ve loved, which is true for music just as much as it is for engineering. At the same time, I started to develop an interest in coding. It first started with downloading a mod for Kerbal Space Program called kOS, that I used to try and automate my voyages, which I also thought was fascinating. This then expanded outwards to learning a bit of actual programming. I’ve also always wanted to delve more into video game design, as I think it’s something where I could use my artistic talents in tandem with my more technical abilities. 

Of course, all this leaves me not sure where I should go. I feel like computer science would give me more versatility and more options, and likely more ability to still utilize my artistic abilities in the future, but I also think aerospace is something I’m more certain that I could enjoy. While certain parts of comp sci are super interesting to me (machine learning, AI, video game design, automation, even exploring the overlaps between music and computer science), there are also aspects I find less interesting. Aerospace, on the other hand, I find interesting in pretty much all regards. 

Most people I know say to go with comp sci as it would allow me to more easily continue doing music to some extent, however I also just find rockets and planes and all that incredibly interesting and I think there’s a huge future in space flight, and it’s a future I’d love to be a part of. 

Any advice would be greatly appreciated. Thank you.",AskEngineers,False,yodelingpterodactyl,/r/AskEngineers/comments/f95ayw/trying_to_decide_between_switching_my_major_to/
12,What is the purpose of a 'Pulmonary Function Test' for working in a Utilities Plant?,1582606511,"I don't know if this is the correct place to ask this question, but there's a job I want to apply for where this test is a condition.  Is it because there is something harmful in the air or do they possibly wear some type of mask that can make it harder to breathe for someone with weaker lungs?",AskEngineers,False,moleculemanfan,/r/AskEngineers/comments/f94xw9/what_is_the_purpose_of_a_pulmonary_function_test/
13,"Is it okay to have a thread in ""bearing"" for a tensile load?",1582606045,"The [NASA fastener design manual](https://ntrs.nasa.gov/archive/nasa/casi.ntrs.nasa.gov/19900009424.pdf) that is posted online mentions that ""Standard design practice is to choose a grip length such that the threads are never in bearing"". Basically, there should not be threads inside of the hole carrying a shear load. 

This makes sense because you have a sharp inside radius in each thread as well as a fastener radius reduction for each thread in the direction of loading.


However, there is no mention of design practice for threads inside of a hole when the bolt is carrying a nearly pure tensile load. Essentially, same situation as above, but tensile loading instead of shear.

I was told at work to select a different fastener for my application to not have threads in bearing for a tensile load. However, from what I have seen, internal threads in tensile loading should not cause problems. I was also told that even in tensile loading the edges of the threads could be sources of cracks on the edge of the hole. 

Can someone please fact check me here or provide some resources to read? I'm not finding much in the way of the Internet. Thanks!",AskEngineers,False,PM_ME_YOUR_BlCYCLE,/r/AskEngineers/comments/f94uhq/is_it_okay_to_have_a_thread_in_bearing_for_a/
14,Why do engines come in random displacement?,1582604206,"I know this might sound like a silly question with probably no actual legit answer but why do motors come in random cubes numbers? Like a 302, 331, 427, 454, 358, 554,440, 632, 401, ect ect ect 

Im mainly using American motors as a example but why did companies stick to these numbers over long periods of years and never changed them to like a more simple rounded number? Like is there a reason a company makes a 554 instead of a 560 or 580? or does this just have to do with marketing?",AskEngineers,False,Universalis91,/r/AskEngineers/comments/f94gjc/why_do_engines_come_in_random_displacement/
15,Hydrostatic Testing Allowable Pressure Loss,1582600241,I'm working on a project where we are doing a hydrostatic test on a large diameter PVC line. We tested the line at 120 psi for two hours. During those two hours the pressure dropped 1 psi. Do we still need to test for allowable leakage?,AskEngineers,False,MericanDipper,/r/AskEngineers/comments/f93kml/hydrostatic_testing_allowable_pressure_loss/
16,This might be a stupid question and this might not be the place to ask. Would a turbo-like pinwheel mechanism attached to the driven wheels of a vehicle add performance? Or even work?,1582600198,"I'm not an engineer and I feel like I know just enough about each subject to be wrong. Also I can illustrate this if it turns out I do a bad job at describing it. 

I was thinking of how to add mechanical performance to an electric car and I had the idea of a mechanism attached to each side of the axle that has an enclosed pinwheel with an air intake to drive it so the incoming air can be used to add supplemental power to the driven wheels. Think a turbo that skips the whole exhaust part of the system with F1 style sidepods. 

I feel like there's probably going to be a really simple reason this can't work because I can't be the first person to think about it but I couldn't find anything describing any such mechanism anywhere.",AskEngineers,False,CokeHeadRob,/r/AskEngineers/comments/f93k7h/this_might_be_a_stupid_question_and_this_might/
17,How can we increase our chances to be attractive? (Electrical Engineering Technology),1582597081,"Hi guys, 

I am a graduate in Electrical Engineering technology (3 year accredited degree BengTech) in my country which is eligible for an engineering license after 1 year practical work under a licensed engineer doing approved engineer work. I know for a fact that I'm at a disadvantage when it comes to other graduates who got \*actual\* degrees in Engineering (4 year accredited programs) but thats fine and that's the decision i made going into this. I'm interested in automation and would love to join the industry but im flexible and like the look of field applications engineering too, in any case I would like to eventually become a ""real engineer"" and make good money to become financially stable.

I'm more interested in what I can do to become better, so I'd like to make a thread where we can get the help of other Engineers (or engineering technologists/technicians any field is welcome) or employers to give us advice to make ourselves attractive to work for you guys. So these are some topics I would like to cover, please feel free to add any other advice that isnt covered by this list, thank you:

1) Resumes /Cover Letter: 

\-What can we put on our resumes/cover letters to make it attractive? How should we present it etc. 

\-Should we include any relevant tertiary experience, what should we leave out/include? 

2) Skills: 

\-What skills can we learn at home to become more attractive? What type of programming should we learn from free online courses? Should we (in the electrical industry) just do random circuitry and soldering at home that we can add on our resumes to indicate our passion for this industry? Since most of us have no relevant experience? What home/freelance projects have been helpful in your experience? 

&amp;#x200B;

3) Networking/Linkedin: 

\-How should we take advantage of our linkedin or networking contacts? For some of us who don't have any friends in the industry how can we make some? Should we hit the pavement? Should we cold call or cold message people we want to be like on linkedin? 

&amp;#x200B;

4) Any alternative ideas: 

&amp;#x200B;

\-I've spent most of my time applying to jobs online to no avail, I've called employers about their job listings to show my enthusiasm even asked for other jobs they're offering and cold emailed recruitment staff for work. Should I start door knocking and handing out my resume? How else can I get oppurtunities besides applying for every single new job on the internet everyday. My guidance counseller says that only 10% of jobs end up on the internet, but I'm not sure how to access the other 90% that I'm willing to put in work for. 

&amp;#x200B;

Thanks in advance guys, please comment if you have any suggestions or queries.",AskEngineers,False,HopefulEngineer123,/r/AskEngineers/comments/f92uam/how_can_we_increase_our_chances_to_be_attractive/
18,Extracurricular question about engineering in Chicago Illinois,1582596379,"I was wondering if I do enough extracurricular activities related to engineering. I do science olympiad and robotics at my high school, as well as National Association of Rocketry. Is this a good amount of engineering extracurriculars? My goal is the uiuc engineering program, or the purdue program.",AskEngineers,False,InternationalDinner7,/r/AskEngineers/comments/f92oe8/extracurricular_question_about_engineering_in/
19,Extracurricular involvement?,1582596234,"I was wondering if I do enough extracurricular activities related to engineering. I do science olympiad and robotics at my high school, as well as National Association of Rocketry. Is this a good amount of engineering extracurriculars? Thanks.",AskEngineers,False,InternationalDinner7,/r/AskEngineers/comments/f92n4i/extracurricular_involvement/
20,I Invented Something... Now What?,1582595276,"Hello,

&amp;#x200B;

I'm a senior year Aerospace Engineer major that works at a semiconductor (and probably will work there after graduation for a while). I think I might've just ""invented"" something extremely useful for a rather large market. I've done a bit of research and there doesn't seem to be much (or really any) products that fulfill the same purpose and the one I found that does is VERY expensive and kinda ugly. Outside of that there are plenty of DIY guides on how to build something similar, but I think if I can develop something not too expensive it would sell like hotcakes (maybe). 

&amp;#x200B;

But, I'm not sure where to go. I'm baking up a CAD model currently but that'll be under a student Solidworks license which I'm sure has some restrictions on commercial use. Step 1 in my mind if I can figure out my design would be some market research. Assuming I get a positive response of a bunch of people saying ""yes I would buy that for $x!"" where do I go from there? As I said, I work at a semiconductor which is an entirely different industry than the one I would be targeting so I'm not sure if I could do something through where I work. What options do I have?",AskEngineers,False,jfizzle232,/r/AskEngineers/comments/f92f2o/i_invented_something_now_what/
21,How do you account for compliance and error in robot positioning?,1582594558,"Hi, I have a robot with 5 degrees of freedom at the end-effector. I'm vaguely familiar but a bit rusty with coordinate transformations and inverse kinematics, and fine with vectors and matrices. Not so good with controls.

The goal is multiple arc-seconds of precision, making use of feedback and absolute encoders. 

My task is to account for all sources of mechanical error. How do I account for things like the joint compliance, the servo accuracy and errors due to manufacturing tolerances? I think I want to first come up with a static model, find a way to calibrate, then take into account dynamic stresses and assess vibration modes to make sure no lower frequencies are hit.

It would be good if there was a reference to a paper or text on the subject? The results that keep appearing for me rely on quarternions, which I'm not at all familiar with.",AskEngineers,False,Aerothermal,/r/AskEngineers/comments/f928zu/how_do_you_account_for_compliance_and_error_in/
22,"Been looking into a coil gun project for a while now, but need lots of clarification and help with some circuit design",1582594221,"for some background: I am a mechanical engineer (with some electrical and computer expertise), So back at christmas time, I got a couple of arduino kits for chirstmas, and was looking into what i could maybe do with them. I already got most of their usage figured out for the rest of the project, but the part that I need help with is basically designing a coil gun. a strong one. a really strong one. but I've been running into lots of difficulty figuring out the info beyond a tiny weak nail shooter. So if this is going to be controlled by an arduino, it will most likely be triggered through an SCR and/or a relay, but thats beyond the scope of this question, just some context.

In general with the coil gun design and circuit behind the coil gun, i have multiple questions:

I've done a lot of looking into this, and it seems to be very similar to how a solenoid works. Where the more amps and the more turns you have, the more force that gets imparted to the projectile. However, I've read that you want to keep the impedance as low as possible, (but this is DC so do you mean resistance?), but have as many turns as possible. I was originally looking at a coil that would be 3 inches in diameter and 4 inches long, but i'm running into issues trying to figure out whether to go with low gauge wires and focus on high current and lower resistance but less turns, or go with high gauge wire with tons of turns, taking a very long time to make, and having a very large impedance (resistance?). I've also read that the force in general just depends on the overall mass of the whole coil, it just becomes a tradeoff between current and voltage when powering it.

There isn't really a set voltage that I want to use with it, but from what i've read, I just need to discharge a film capacitor (a capacitor thats designed for something like this) over the coil. but I'm having a hard time trying to figure out how to size it beyond ""get the highest voltage you can reasonably find that doesn't fry the relay/SCR"", particularly on the capacitance side. I've read 100uf for every amp, but considering this is just an instantaneous discharge, how should I size it? Also, wouldn't something like this break an SCR or a relay with the extreme current caused by said discharge? or would I need to place that switch to discharge the capacitor elsewhere in the circuit?

How would I go about generating such a high voltage to charge the capacitor? I'm trying to stay away from playing with live mains voltage, and i do have power supplies from various consumer electronic devices such as old laptops and old desktops (just got a 750w desktop computer psu, probably super overkill), and I do know how to get a set DC voltage out of them. But the issue I am running into is moreso trying to step up that voltage to charge the capacitor. I've looked at boost converters (which dont seem to go very far since many MOSFET switches i've found have very low current/voltage ratings, and I am wondering if I can use an arduino to control the MOSFET), or a couple other circuits that seem to have the problem of dropping off in terms of voltage once current is actually drawn from them. What is the easiest (and if possible, safest) way to do this? I've found a ""capacitor charger circuit"" from linear that uses a chip, but it seems to top out at around 500-600 volts, and charge fairly slowly, and I was hoping for something I could scale up, or would at least be higher.",AskEngineers,False,TimX24968B,/r/AskEngineers/comments/f9264m/been_looking_into_a_coil_gun_project_for_a_while/
23,Questions that I have,1582593015,"1. What textbooks should I read to get a basic grasp of engineering?
2. How do I learn about hardware/tools used to create stuff?
3. What do engineers do? Do they just create stuff? 
4. How much do engineers have to work on hand?
5. How similar is it similar to programming and computer science?
6. How much programming is used?
7. How should I prepare for engineering?
8. What science is involved in it?
9. What does aerospace engineering exactly specialize in?

Sorry for all the questions. I just realized that I didn't really know a thing about engineering and that it could be interesting to study.",AskEngineers,False,Rough-Juggernaut,/r/AskEngineers/comments/f91vxd/questions_that_i_have/
24,Idea for a different space elevator design than just the tower one we usually see.,1582592410,"I dont know if somebody has alrwady come up with this or not, and I dont know if this would even work cus I know anything about this stuff really, but would it be better to have a space elevator that has two hefty ass cables connected to the poles, and those connect to a big space station and swing it around, and to get up there you take like a gondala type thing? That way you could have it actually swing around. It seems like it might be better but I have no idea, maybe thats stupid. Maybe it would be better to just have a big ol guyed mast. Hope I made you think at least!",AskEngineers,False,challahciabatta,/r/AskEngineers/comments/f91qtx/idea_for_a_different_space_elevator_design_than/
25,experience with Pymetrics for hiring?,1582592383,"Hello, I recently completed one of those assessment links that company's send you during the application process, I thought there would be a series of math and shape shifting questions but this was different, it tries to predict your personality traits.

I am not happy about some of the results, and wonder if companies prioritize these kind of tests over your resume and letter, for example, I got low on ""learning"" although I spend about 20 hours a week studying different industries and subjects and believe this should be one of the higher traits.

Now this will definitely affect my job prospect as employers think that I cannot learn well. it is quite insane, I wish there was a recruiter at the company I can reach out to and explain this situation.

Can anyone else share their experience with pymetrics?",AskEngineers,False,Which-Trainer,/r/AskEngineers/comments/f91ql8/experience_with_pymetrics_for_hiring/
26,Career Change Advice,1582591792,[removed],AskEngineers,False,massisconserved,/r/AskEngineers/comments/f91lh9/career_change_advice/
