index,title,created_utc,selftext,subreddit,media_only,author,permalink
28,Is it a good idea to go through a staffing agency for an engineering job?,1581800602,"I have a BSME, have worked for 1 year after graduation, did 1.5 years of internships while still in school, and 6 months of side hustles designing plastic injection molded parts. I also did \~1.5 years of research at the university before dropping out of grad school. It is a good idea for someone like me to go through a staffing agency? what are some things to look out for? I have heard they charge a substantial fee for their services, sometimes $5-10k of first year's salary, but are there anything other than that I should be careful about? 

&amp;#x200B;

Thank you for your help!",AskEngineers,False,AvrgBeaver,/r/AskEngineers/comments/f4fogo/is_it_a_good_idea_to_go_through_a_staffing_agency/
29,What to expect from a pre employment assessment test?,1581798904,"I recently had an interview with a power utility company for an entry level substation engineer , it went well and now they have sent me a pre employment assessment test.  I am wanting to know what to expect from the test.",AskEngineers,False,MNcomicGeek,/r/AskEngineers/comments/f4f9mo/what_to_expect_from_a_pre_employment_assessment/
30,Can Linear Actuators be installed into a ceiling and used to pull weight up/down?,1581796441,"Hi there, 

I am a product design student. I am attempting to create a ceiling storage unit that can be accessed with electric linear actuators (if possible.)  I understand that linear actuators are used for things like heavy desks, and can push a lot of weight, but if they are installed upside-down and have weight hanging off of them (in my sketches this is illustrated with some lines that might be cables of some kind) would this work?  I also understand that there are issues with synchronizing more than one actuator. 

Any help or advice would be great

Thank you so much",AskEngineers,False,ihmstun,/r/AskEngineers/comments/f4eo40/can_linear_actuators_be_installed_into_a_ceiling/
31,I love tinkering and at home engineering but money is extremely tight right now. What low cost things could I do to satisfy the itch,1581795217,,AskEngineers,False,supadupachop,/r/AskEngineers/comments/f4edhh/i_love_tinkering_and_at_home_engineering_but/
32,Engine tests for oils (Gasoline and Diesel),1581793841,"Hello 

I am looking for documentation for engine tests for oils such as gasoline and diesel engines. The information needs to confirm different properties (such as anti-wear as an example for one of them). If you can help, please send the link to documentation that is open to the public that shows 2 different tests (one for each fuel)

Thank you",AskEngineers,False,confused_sausage,/r/AskEngineers/comments/f4e1hi/engine_tests_for_oils_gasoline_and_diesel/
33,Tolerances needed for 5G antennas,1581792771,"I have read that apple might build its own 5G antennas. I found some articles regarding tolerances needed on the antenna features (etching tolerance). [https://www.mwrf.com/technologies/components/article/21849917/addressing-size-and-tolerance-challenges-in-mmwave-filters](https://www.mwrf.com/technologies/components/article/21849917/addressing-size-and-tolerance-challenges-in-mmwave-filters)

But does anyone knows what tolerances are really needed?",AskEngineers,False,LogOf,/r/AskEngineers/comments/f4drym/tolerances_needed_for_5g_antennas/
34,Need help working out forces on hinges!,1581792390,"Hello my statics analysis skills have gone rusty and can really use some help on my problem. I am designing a 3 hinges door and am trying to work out the horizontal forces on each of the hinges. Due to design constraints I have to move the the second hinge off centre and are unequally distributed. How do I go about working it out if I can't ""zero"" the second hinge?

My diagram on the door:  [https://i.redd.it/pnn0ye7ju4h41.jpg](https://i.redd.it/pnn0ye7ju4h41.jpg) 

\*The centre of mass is at exactly the middle",AskEngineers,False,justsomevisitor,/r/AskEngineers/comments/f4dole/need_help_working_out_forces_on_hinges/
35,Anyone else having issues getting through to interviews due to lack of knowledge about your degree?,1581791281,"I'm a materials engineer who's been on the hunt for a full time position for some time now. I recently went to a career fair, and managed to get an interview after talking to an engineer there. 

Some of you out there might be familiar with the fact that materials science is a lesser known major when compared to MechE, ChemE, CS, etc. 

I'm worried that unless I get my resume in front of a fellow engineer who can extrapolate how materials science fits in the STEM world, then my resume will inevitably end up in the trash can. Every online application I look at for a job that would be a good fit for me, usually omits materials science in favor of ChemE or MechE, and I fear that might be causing issues for getting past HR and ATS as the degrees doesn't ""match up"" with the job requirments.

Is there any way around this issue?",AskEngineers,False,dumbest_engineer,/r/AskEngineers/comments/f4dejq/anyone_else_having_issues_getting_through_to/
36,Can someone identify those tools?,1581790623,"I have found these pictures of [tools](https://i.imgur.com/g5ihFUM.png) in my study folders, but I have absolutely no idea what they are used for. Can someone tell me where or for what are these used?",AskEngineers,False,TaZ_DeViL96,/r/AskEngineers/comments/f4d8n5/can_someone_identify_those_tools/
37,What do Mechanical Engineers do in Aggregates?,1581790079,"I am referring to the  [aggregates industry](https://en.wikipedia.org/wiki/Aggregate_industry_in_the_United_States) specifically. (crushing up rocks 'n stuff)

Do mechs work as plant engineers? Waste treatment? What other options are available in this space?",AskEngineers,False,ATP_Synthase_Machine,/r/AskEngineers/comments/f4d3y0/what_do_mechanical_engineers_do_in_aggregates/
38,Why is it so difficult to engineer a battery that actually lasts long and holds a charge?,1581790011,"I'm seriously confounded by this. It really can't be that hard to construct a good battery, can it? I have several robotic vacuum cleaners and I've had to replace the battery on them consistently. They are all iRobot roombas, so not just some cheap off-brand. the battery is definitely don't last. Absolutely poor engineering and construction. But what I don't get is why batteries are so difficult to engineer. 


Here's an example of an incredible battery. I bought this external power pack battery called ravpower on Amazon four and a half years ago. I've only used it a handful of times and guess what? I swear to you I have never charged it. Never. it still has a full charge after four and a half years and a handful of uses. I press the button on it, and it says the battery is completely full. Plug my phone in and it will charge. so how is it that there's a $20 battery on Amazon that can last four and a half years without even ever needing to charge it. But you buy something that's $800 and then you have to buy several batteries over the next few months or years? I just don't get how it can be so difficult to construct a good battery",AskEngineers,False,FloppyGrandmaTitties,/r/AskEngineers/comments/f4d3cq/why_is_it_so_difficult_to_engineer_a_battery_that/
39,How is civil engineering in Canada,1581789095,"I'm interested in civil engineering. I was wondering:
1. how much a civil engineer makes on average per year
2. how many hours they work
3. public or private
4. What kind of benefits or bonuses do you get?
5. How has your salary grown over the years
5. and how many years of experience you have? 

Just a disclaimer, I have been looking online a lot but the answer to this question is kind of hard to find. The numbers vary drastically. For example on the alis Alberta website it says they make about 100k a year working 40 hours a week. But I've seen a lot different saying the salary is around 50k-60k. I am asking to hear from people working in the field. Thank you so much for reading this. I appreciate any advice :)",AskEngineers,False,brownprincess99,/r/AskEngineers/comments/f4cvgb/how_is_civil_engineering_in_canada/
40,Were the twin towers wider at the top due to the curvature of the earth?,1581787779,,AskEngineers,False,motor47,/r/AskEngineers/comments/f4ck8x/were_the_twin_towers_wider_at_the_top_due_to_the/
41,"A121 with only 3 blades, 5VDC",1581787014,Is it actually possible to have a fan designed like the AP121 using only 3 blades at 5VDC (=&gt; \~ 2000rpm I guess) setting aside the aipressure?,AskEngineers,False,mikaelarhelger,/r/AskEngineers/comments/f4cdoc/a121_with_only_3_blades_5vdc/
42,Dealing with over confidence in new engineers. New grads that are 3 weeks into the job.,1581783373,"I just recently moved into a tech lead position and I am struggling with some of the newer personnel.  We have 1 or 2 newly graduated engineers that are very enthusiastic to dive in but from my perspective, they are lacking in some key specialized skills.  This is completely expected with anyone new coming in. In general we dont expect much productivity  out of new grads for 6-12 months until they understand our tools, methods and projects.  I have been working with them on training and providing them with reading materials to start filling the gaps.  Right now, I am working to send them to some developmental courses to help fill these gaps as well. Overall with the new guys, I am facing 2 major problems.

1. They are clearly skimming materials and are not taking the time to try to comprehend.  Ex. Asking for more material to read 1 day after being given approximately 400 pages of technical material regarding a topic I know they are not familiar with (specifics of aerospace design).

2. Over confidence. Ex. I brought them to a final project review meeting with the head of engineer (2 levels of management up) so they could get a feel for what the process is like.  Despite some discussion before hand, they spoke up with their opinions regarding the project during the final review with management.  Mind you, they have never seen this project before and were not familiar with the broader topic area.

How do I get them to understand they are not experts day 1 with a BS in mechanical engineering without destroying their enthusiasm?",AskEngineers,False,stand_in,/r/AskEngineers/comments/f4bi59/dealing_with_over_confidence_in_new_engineers_new/
43,I am really confused about the specializations of engineering,1581779173,"I am first year engineering student and universities have very limited options
Mechanical engineering 
Basic science engineering
Chemical engineering 
And im planning to get my masters after the bachelor but i dont which specialization i should go for",AskEngineers,False,joe61620,/r/AskEngineers/comments/f4ak5e/i_am_really_confused_about_the_specializations_of/
44,How hard did you think Engineering really was?,1581777205,"I graduated about 7 months ago w an aerospace engineering degree from the university of Arizona. And honestly, it wasn’t that hard. I just kind of skated by, sure I did the homework and studied for the tests pretty diligently, but at the end of the day it wasn’t that hard at all. There wasn’t anything really I had trouble of understanding and I feel like people over exaggerate the difficulty. Honestly, I just want hear other’s perspectives.",AskEngineers,False,arossboss,/r/AskEngineers/comments/f4a58i/how_hard_did_you_think_engineering_really_was/
45,"Just because I suck in some of my major classes even though I work hard, does that mean I’m gonna suck as an engineer?",1581771324,,AskEngineers,False,wchamoun,/r/AskEngineers/comments/f491vq/just_because_i_suck_in_some_of_my_major_classes/
46,"Offered a CFD testing role, not sure whether to accept",1581763715,"I'm a student in the UK, and I've been offered an year long internship as a CFD test engineer at a well known company, but I'm deliberating over whether to accept or not. These are the pros/cons I've got so far:

Reasons why I don't want to take it:

* Although I find CFD very interesting, I don't think it's something I purely want to do for a year. I'd worry it'd get monotonous
* I don't really fancy sitting in front of a computer for a year, I'd prefer to have something with at least a little bit of variety
* When I leave university I want to go into more of a design role where I'd be designing actual devices/systems, ideally within the aerospace sector. I'm not sure how well this internship would align with this goal

Reasons why it might be good:

* I might not get another internship offer, and I would hate it if I turned this offer down to not receive another one. However, I am on a 1st (I think this is equivalent to a 4.0gpa) and I have good experience from a previous summer internship and student engineering teams. Careers advisors at my university have said that I should be able to choose what internship I'd like to do with credentials like this
* I'd have a really good knowledge of CFD by the end which might be useful in design roles
* I don't have to stress about finding another internship

Any advice would be greatly appreciated, thanks!",AskEngineers,False,Eucastroph,/r/AskEngineers/comments/f47vzn/offered_a_cfd_testing_role_not_sure_whether_to/
47,Is it time I called it quits on this job search?,1581760856,"So long story as short as possible, I graduated in Biomedical Engineering in 2017 from my home country, Ireland. As part of my studies I did a year long co-op at a large orthopaedic multinational. After graduation I have been travelling all over the world doing odd jobs. (Always wanted to do some travelling after uni). 


Now I'm in Canada, and trying to get my first engineering job. I've been here since October and had been job searching while working getting two phone interviews that lead to nothing. I then this past two months have stopped working to job hunt full time. In that time I have been going tooth and nail with job applications and trying to get recruiters to even look at me, only to get one email back which did lead to two subsequent interviews but I got rejected today. 


My point is I think I've bitten off more than I can chew. I wanted to keep my traveling lifestyle going and have always had a great interest in living in Canada. However after two months full time job searching and months prior to that, and have barely anything to show for it. Back home I have contacts in good companies and if I'm completely beaten I can go back and do my masters (1 year). Should I just cut my losses and head back home, give up on this dream to be an engineer in Canada for now until I have some experience? 


I've just been taking stock recently... My last relevant experience is nearly 5 years ago and why would an employer pick me over a recent grad from their own country. This is starting to get me down. I don't want to go back to working construction, it was depressing me, I didn't train years to do that. 


I'd appreciate any thoughts or advice",AskEngineers,False,doonspriggan,/r/AskEngineers/comments/f47hqv/is_it_time_i_called_it_quits_on_this_job_search/
48,How I became an embedded systems engineer and why I started questioning this field?,1581756863,"I am an Embedded Systems engineer from India with formal degree of Electronics and Communications.

My story in short -   
Got inspired after attending a Line Follower Robot workshop in first semester. Joined a crash course on Embedded Systems afterwards. Started making simple projects like gesture controlled Robot, LED chaser, etc. Then I started trying register level programming. But then because I was not able to find any reason/a good project, so I got distracted or disinterested in this and kinda wasted my college time. Got Internship in a startup that works in Embedded system domain in my last semester of college. There I got exposure how to make actual working prototypes. Learned how to Google open source codes and hardware and use them, get knowledge/exposure with actual electronics and how to make your own hardware which I think no college in India can tell you. Then I started my Full time in another startup which also works in the same field. There my main work is to make firmware for a lot different types of prototypes and products. But in this startup I didn't get any exposure to core hardware projects because they are not into core hardware. 

My concern -   
This company is into how they can scale their products faster. Just like how software scalability these days have become so easy because of all these tools, frameworks, new languages that you can learn in no time. (Not a software guy so do not know much about it but that's the summary on software side I suppose). Hardware is also becoming similar in that way. Not only there are so many libraries of hardware interfacing on Github and other platforms, hardware itself have become so modular that you can find modules which need no programming and  that can be used right away. You just need to read the analog/digital input and you are good to go. Now I am not anti about this rapid change in how embedded system have changes so much in past 5-6 years or so. But I am starting to think that you don't need to have much knowledge about it and anybody can be trained to do this work. So what I am doing? Should I be changing my field of work? But I don't know any other options since I am not exposed to any other fields.  I am always a practical person so I hated all that theoretical knowledge they teach us in college and so I choose this field. But now I am kinda tired of learning things myself. But at the same time I know that learning by own is the best way. But still I want to work in an environment which have streamlined protocols and so that I can learn them and try to implement on my own personal projects. That way learning will be faster then try to learn by hit and trial. Learning on own is taking too much time that I thought at the start. Plus there is a growing family pressure about earnings and all. So I am confused what to do.",AskEngineers,False,R0b0tg,/r/AskEngineers/comments/f46y4r/how_i_became_an_embedded_systems_engineer_and_why/
49,Which minor specialization should I choose along with Chemical Engineering?,1581753229,,AskEngineers,False,Supernova008,/r/AskEngineers/comments/f46fqs/which_minor_specialization_should_i_choose_along/
50,SOS How could a circuit board that functioned properly for days develop a short?,1581741091,"Hi fellow engineers. I'm not the most adept circuit board solderer and am troubled by an issue that threatens my master's thesis.

I have a small pcb that was running off a coin cell. It was potted in silicone if that makes a difference.

It ran for a few days without issues but is now dead, battery discharged, about 8 months earlier than it should be. I have three other duplicates that work fine.

When I dug it out of the silicone, desoldered the battery and use a multimeter I see the Vin and GND pins are now shorted together which is tremendously frustrating.

How could this happen? The board was operational for about 2 days after being potted in the silicone. I have two others in the same silicone for 2 days and one unpotted which has been running for a couple of weeks. Are the others at risk of going bad too?",AskEngineers,False,Cleftex,/r/AskEngineers/comments/f44hkj/sos_how_could_a_circuit_board_that_functioned/
51,What might be the best plan of action after graduation in the case an Engineering Job doesn't magically pop up?,1581740268,"Background : graduating with ME/AE double, no internships, or anything spectacular, some senior projects experience, \~3.55 GPA. No plans on family and no strong location commitment. My lack of direction is kind of killing productivity and motivation at this time. Family support is pretty available

Work Part (or full) Time low skilled labor (fast food, grocery store, etc.) &amp; work on CAD work and 3D printed toy-esque mechanical projects, programming projects ; C++/embedded (especially hard to learn on your own but giving it a try) or python or maybe even webDev. At this point I wouldn't bother learning anything alligned with random MechE topics since there is little promise in that. I wonder if it would be even worth trying to pursue MechE with this route and instead just try to break my way into a software role in the future. The nice part about this is I would be happier not thinking about my employability as an engineering for a while           

Go all out on trying to find entry level CAD  jobs by shopping everywhere for a position and starting a bunch of CAD work on my own right now,  and do the same thing as above. Not sure how much I would be in demand for these, I have a little bit of experience in Solidworks and a few class projects/parts I can show in a portfolio and passed the CSWA but not much overall.  It is something I could rev up gears on and try to learn well though, even after graduation using Fusion.            

Try to find a machining job? I here constantly about these, and how an engineering job gives you a large pallette of options, but I can't figure out for the life of me why they'd pay someone who has touched a manual lathe and mill  under the guidance of an instructor in a single class to work in a machine shop. But I do hear this has some value in experience. I do here constant advocating for these positions, but definitely not on where to get yourself into one of these roles

Try really really hard to find whatever low paying start-up job as an entry level engineer, even these seem ruthlessly competitive though.  In theory, a company might be more likely to hire me as an ""intern"" based on cost-risk alone, but post-graduation internships to degree-in-progress internships seem to be available at somewhere at like a 1:250 ratio.        

Try with Reverature or WITCH",AskEngineers,False,PlasticSystem,/r/AskEngineers/comments/f44c3k/what_might_be_the_best_plan_of_action_after/
52,making lapping plates need the finer details on how grooves affect the process.,1581734182,"using 3 ten pound plate weights theres a pretty big hole in the center obviously so how much will that help and should i still cut grooves?

ive been told grooves are largely because the center of the plates have a harder time getting rid of the removed material which makes sense but how much does it matter? on a smooth plate with no grooves or holes would the material removed from center just get smeared around until theres contact again?

would i lose more of the abrasive from it falling into the grooves? im low on money and shipping for this stuff would basically double the price so i want to savor it as best i can without wasting tons of time. if you've red this far could you capitalize the first letter of the second word please? i dont trust reddit wanna see how many peeps actually read before commenting.

thanks for your time and have a nice day",AskEngineers,False,dankflame_memestur,/r/AskEngineers/comments/f435hc/making_lapping_plates_need_the_finer_details_on/
53,Critique My Resume Please,1581728028,"Title pretty much sums up what I am asking. As most graduates have found out finding jobs is not easy; It's common to apply and never hear back from places. Everyone keeps saying if you're not getting interviews and you're applying then your resume needs work and sadly I am doing just that. I have applied for more than 40 jobs of which atleast 30 I was well suited for and have only heard back from maybe five of which all but one were to say no within three days of applying and that single job that it actually felt like I had a chance for lasted for nearly two months of considerations before hearing back last week that it was a no. I graduated in December and had always been told ""Engineers are just as needed as medical field workers"" and foolishly I believed this and actually expected to find a job within a month or so of graduation. My only downside I can see for applications is that I have no internship/direct experience because I decided to graduate in three years rather than the typical four to five years. My Resume: https://imgur.com/a/IRD4tDf",AskEngineers,False,King_Liam,/r/AskEngineers/comments/f41x29/critique_my_resume_please/
54,Monitor performance with mismatched screens and Freesync?,1581726197,"Anybody know about monitor/computer performance when using freesync with mismatched screens?

Specifically,  I'd like to run triples for sim racing -- buy a really high performance center monitor, and then flank it with cheaper monitors at a lower resolution/refresh rate.

For example:

|Left Monitor|Center Monitor|Right Monitor|
|:-|:-|:-|
|1080p, slower hz monitor|1440p, 144hz, 1ms awesome monitor|1080p, slower hz monitor|

This would be great to save costs (and side monitors for sim racing only matter for peripheral vision any way, so performance doesn't matter much)

The issues that I'm curious about are...

* Will this lighten the load on my GPU and help me obtain better overall performance?
* Will I be able to achieve high framerates and resolution quality in the center despite the lower capacity of my side monitors? ...or does the GPU have to render the whole thing anyway?
* Would my center monitor be ""limited"" to the upper capacity of my crappy side monitors?

&amp;#x200B;

Thanks!",AskEngineers,False,ChiefGentlepaw,/r/AskEngineers/comments/f41imu/monitor_performance_with_mismatched_screens_and/
55,"What is ""engineering specialist""?",1581725842,"I applied for an entry level position and im under offer but they changed the title to engineering specialist. The pay is competitive and the job description is engineering tasks but now im confused. Is ""engineering specialist"" a term that is looked down on? Is it not true engineering?",AskEngineers,False,Nat9523,/r/AskEngineers/comments/f41fy5/what_is_engineering_specialist/
