index,title,created_utc,selftext,subreddit,media_only,author,permalink
62,Company I'm interviewing for drug tests. How do I withdraw my application?,1573076799,"I recently got invited to my second interview on-site at an avionics company for a software position. However, I just found out that they're a ""drug-free company"" and conduct a drug test for all recently hired employees, as well random drug tests throughout the year. As a habitual marijuana user (in a legal state), this causes a problem. I'm not a daily user and don't mind taking a break from smoking if it means landing this job. However, from what I've gathered, it can take up to a month for all traces of THC to leave your body. 

Sadly, given how my chances of passing the drug test (assuming I'm hired) are slim, I want to withdraw my application. I was wondering if I could get any advice on how to do this? I don't want to tell them the real reason and ruin any future chances of getting employed there, nor do I want to burn any bridges.",AskEngineers,False,ECE_NOOB,/r/AskEngineers/comments/dsn6db/company_im_interviewing_for_drug_tests_how_do_i/
63,Technical Interview Questions for FEA and Stress Engineer,1573075670,"I have a panel interview with a company that I am really excited about and want to nail. It is an entry level position requiring structural analysis and being able to conduct finite element analysis. I have covered most of the common behavioral questions but I am worried about technical questions and what I should be covering. If anyone have advice from their experience that would be great.

Background: I am a mechanical/aerospace graduate and am currently reviewing my statics and material properties notes in preparation for the interview.",AskEngineers,False,sn_ch0c0b0,/r/AskEngineers/comments/dsmw91/technical_interview_questions_for_fea_and_stress/
64,Graduating Mechanical Engineer looking to work for Aerospace Industry?,1573074171,"Hello Engineers,

A little background.Only after finishing two years  of school  i had to drop out from school because of  family issues.I returned to school   after 4 year hiatus to complete my degree as a Mechanical Engineers and set to graduate 2019 December.While i was away, i  worked as an aquarist and had no mental capacity to engage with school with a particular goal.However, currently i have 2.91 GPA and i have no internship experience (i tried but didn't get any) or any project experience other than my senior design project . I was super overwhelmed and focused on passing the classes rather  than preparing for employment and i was not sure which area i wanted to get involved with but now i'm sure its Aerospace.I have an ongoing project that is related to aerospace which i can add to my resume ,also i recently managed to get a job at a machine shop(mostly aerospace parts) to learn manufacturing as i thought it would help to beef up my resume. I really want to work for the Aerospace industry and hopefully as a service Engineer ( propulsion, landing gear etc) for an Airline  .Am i too late to get what i want? Any advice is helpful. 

&amp;#x200B;

Thank you for your time.",AskEngineers,False,spac3funk,/r/AskEngineers/comments/dsmij3/graduating_mechanical_engineer_looking_to_work/
65,"Project Management: is there a guide, format, or system that works better for engineering projects?",1573073321,"My projects tend to start off with a clear purpose, then some hair-brained mistake that's never been addressed is discovered that causes them to spiral into very large, ill-defined and expensive monstrosities.

I'm positive this partially due to my lack of skill in project management, but I really want to improve! The company has zero dollars in the budget for training, but my supervisor has approved my use of company time to search for free or cheap programs and train myself. 

I've come across a few theories, but some seem better suited for non-engineering industries. I'd like to not waste my time, so here's my question to the group: 

What project management system works best for engineering projects; specifically product design and development?",AskEngineers,False,Pwn_Scon3,/r/AskEngineers/comments/dsmb8h/project_management_is_there_a_guide_format_or/
66,Can aircraft mechanic course can count as college credit to become an engineer?,1573072529,"Hello I’m 26M and I’m just about finishing up trade school to get certified as an a&amp;p mechanic. I was wondering if my credits would count towards an engineering degree? Like mechanical or aerospace engineering, I’m going to school on the gi bill from serving in the army. I want to use the rest of it wisely. Initially I feared studying engineering because I didn’t have much confidence in my brain to absorb the knowledge because I never had any good grades in high school which was why I joined the military. But now that I’m getting older I really want to challenge myself I really hate the mindset I’m around that we’re apart of an uneducated field. I want to earn my way as an engineer and apart of the smart crowd I never fit in before.",AskEngineers,False,cesar2drunk,/r/AskEngineers/comments/dsm4eq/can_aircraft_mechanic_course_can_count_as_college/
67,"From an engineering perspective, why are some cars much more reliable than others?",1573070964,"I happened to just watch a YouTube video of a Land Rover owner document 14+ faults they experienced over the 6-12 years of his ownership, all paid by the warranty company. My Honda Integra is 18 years old, once in a while it develops faults but I'd hardly say it's excessive. I ditched my 1988 Nissan Sentra in 2012 because repairs cost more than its value.

From an engineering perspective, why is that Land Rover so much more unreliable than my experiences?",AskEngineers,False,stinkypinky5,/r/AskEngineers/comments/dslr4v/from_an_engineering_perspective_why_are_some_cars/
68,How important is the prestige of your university? Should I finish my non-engineering degree before transferring?,1573069426,"Apologies in advance if this is a common question.

I'm a fourth year non-engineering major university student at the University of Washington. I'm your typical example of someone who did really well in high school without trying, and was too slow to adapt to the pressure of university. I wanted to be an engineer all my life but in my second year my advisers told me that with my grades (\~2.70 with retaken classes) no engineering program at UW would accept me, and I would need to look into transferring to a smaller state school. But, instead of transferring I decided to join an open non-engineering major in something that I found interesting (Earth and Space Science) just so I could UW on my resume. Turns out I don't like ESS as much as I thought I would, and I just have this nagging feeling that I'm going to regret not pursuing a career in engineering for the rest of my life.

My parents are always bragging about how they have a ""UW student son"" and put a lot of pressure on me to get into a prestigious school, so I always thought it must be really valuable, but now I'm starting to think otherwise. Back then I thought it would be a better idea to get a degree in something I don't care about from a big school than to get a degree I want from a small school. Every single one of my friends that came to UW for engineering ended up joining an open major (like I did) and getting a degree they never wanted *just* so they could say they are UW alumni. Now they're all  unemployed living at home. That sounds awful to me, and after a year of ESS I decided it wasn't what I wanted to do. When I told my mom I wanted to transfer, she told me that I should finish my degree at UW and then maybe look into getting into engineering, but frankly that doesn't make any sense. 

I have 43 credits left in my ESS degree, and conversely 43 credits left in an ME degree if I transferred. Regardless of which path I take I would have a year left to graduate, but I don't see how spending an extra year and accruing another \~$30k in student loans to get a degree in something I don't plan on using is worth it. I have no plans of working for some ""cutting-edge start-up"" or anything, I just want something stable, but the way some people act makes me feel as if transferring would make me unemployable. I feel lost. Am I going to regret not having a piece of paper that says UW on my wall?

TL;DR: I'm going to a fairly prestigious university currently for a degree in something I don't care for, but people in my life seem to believe the prestige of your university is more important than your degree and that I should pursue engineering after I graduate. Is this true?",AskEngineers,False,SlimyGrimySimon,/r/AskEngineers/comments/dslf5f/how_important_is_the_prestige_of_your_university/
69,What are harmonics exactly?,1573069305,"And how do they affect the grid/system and how are they linked to resonance?

Thanks!",AskEngineers,False,ameri9595,/r/AskEngineers/comments/dsle5y/what_are_harmonics_exactly/
70,Roof drain pipe sizing,1573069143,"Hello,

My facility is redoing a (mostly) flat roof that is ~2700 Sq ft that is slightly inclined towards two roof drains.

This facility is in the NYC area.  I found that the 90% confidence interval extends from 2.81-3.63 inches of rain/year, but I'm not sure if that value is helpful.

Regardless, I want to ensure that the drain lines are sized appropriately.

Does anyone have any input or suggestions?

Thanks for the help!",AskEngineers,False,schismtomynism,/r/AskEngineers/comments/dsld1a/roof_drain_pipe_sizing/
71,Relocating to the US from the UK - Advise Needed,1573068481,"Hello,

I have a Masters in Aerospace Engineering and 3ish years in industry, with a specialty in composite materials. I'm highly competent and I interview great.  I'm hoping to relocate to the US. I'm working with the premise of go-anywhere-do-anything to keep my options as open as possible. At first glance, looking for work seems very daunting- like I need a visa sponsor and most companies explicitly state they want US citizens only on the job ad.

If there any of you out there who have achieved this feat in any context- I'd love to hear your story, and any advice you may have for me.

Warmest regards,

An ambitious engineer",AskEngineers,False,Bristol_Aero_Student,/r/AskEngineers/comments/dsl87i/relocating_to_the_us_from_the_uk_advise_needed/
72,Relation between spectral leakage and the frequency of harmonics of a signal,1573067371,,AskEngineers,False,MischiefManaged97,/r/AskEngineers/comments/dskzo7/relation_between_spectral_leakage_and_the/
73,Spectral leakage harmonics,1573066721,,AskEngineers,False,MischiefManaged97,/r/AskEngineers/comments/dsku16/spectral_leakage_harmonics/
74,What matters more when going into engineering. Skill in mathematics or interest?,1573065069,"I’m a student who is thinking about engineering, and although I’m not incredibly strong (75-85), it still interests me",AskEngineers,False,The_Wal_Russ,/r/AskEngineers/comments/dskg6r/what_matters_more_when_going_into_engineering/
75,Friends call me stupid for wanting to transition to Software Engineering from Chemical,1573064492,"  

I am 27 years old working at a chemical engineering consulting firm doing process engineering as an EIT. I took some programming courses in college and was a TA for a programming class for a few years, but that is the extent of my current knowledge. I regret not choosing software engineering as my major as I really enjoyed it in school and now I see all of my software buddies making almost double what I make in my field. I thought I would be able to make a comparable salary with ChemE, but that’s seeming to be very hard as I look at my 10 year projection in this field. I really want to work at Microsoft with my other two friends I am close with, but I don’t know if the company would ever take a ChemE. I went ahead and enrolled in some online programming courses to learn some core skills I don’t have now, but my Microsoft friends are calling me stupid for wasting my money and time, and that Microsoft wouldn’t even accept a ChemE without programming experience. 

&amp;#x200B;

What are your thoughts? I want to pursue my goal and I’m willing to put in the time taking the courses, I just don’t have any experience yet.",AskEngineers,False,chemthrow142,/r/AskEngineers/comments/dskbbc/friends_call_me_stupid_for_wanting_to_transition/
76,Struggling to stop pump leakage. Please advise if you have hydraulic/pneumatic experience / expertise.,1573063419,"We have a reciprocating pump that feeds off 2 gear pumps with highly viscous sealer. There is one line coming off of the main reciprocating pump, tees off at the front gear pump and goes another 20ft to the rear gear pump. The reciprocating pump works at the same frequency throughout the cycle of 30 seconds from start to finish. The problem is, the rear gear pump finishes its job 5 seconds earlier than the front gear pump. Looks like, as soon as the rear gear pump closes, all the flow is directed to the front gear pump which increases the internal pressure and causes the sealer to leak out of the shaft seals. We have had sealer leakage out of front gear pump since we installed it. We can't reduce the rate/pressure of the reciprocating pump as it would starve the system. If I put pressure regulators just before each gear pump, would that prevent pressure surge at the front pump after rear is done ahead of time? Or do I need to put flow control valves to limit amount of sealer going into both gear pumps? If I put flow control valves, and reciprocating sealer pump is working at the same rate, how do I protect the system from destroying itself? I can't put pressure release valve on a line full of sealer… How do you think this leakage can be prevented?",AskEngineers,False,hungry_kid,/r/AskEngineers/comments/dsk28a/struggling_to_stop_pump_leakage_please_advise_if/
77,Senior design project,1573063180,[removed],AskEngineers,False,sk8rg99,/r/AskEngineers/comments/dsk02z/senior_design_project/
78,Switching from ME into something related to biomechanics?,1573063050,"I graduated last year with a bachelor's in mechanical engineering and now work at a large aerospace company, mainly working with metrology (measurement) in sort of a project manager role. I've always been very interested in fitness and how the body works, playing sports in high school and weight lifting being my only consistent hobby. Especially lately from taking a work-provided fitness class led by physical trainers to prevent injury. It makes me realize I might want to work in something related to biomechanics of fitness/injury, or potentially even switch to a physical therapist position. What sort of positions are out there for a mechanical engineer in this field? I took a biomedical class in college, but it was mainly about designing prosthetics which I'm not as interested in.",AskEngineers,False,sivret20,/r/AskEngineers/comments/dsjz04/switching_from_me_into_something_related_to/
79,Could you use ducted fans to replicate the effects of compressing and decompressing air as seen on rocket motors?,1573062409,"I've been sitting on an RC plane design that I would really love to push forward. The design attempts to push as much as I can out of a purely battery powered engine using ducted fans. The idea, as I have it, is a 3 layer system where the first layer at the front of the fuselage is a low compression ducted fan. Directly behind it would sit a re-enforced higher compression ducted fan with more blades. Beyond that is a low bypass re-enforced high compression ducted fan. To begin with, I'm not sure if this 3 compartment system would actually do much good, but my focus for this question is what comes afterwards.  


So is the effect that we see with rocket motors where air compresses down to the choke, traveling at mach 1 and then decompresses after the choke, trading compression for speed and leaving the nozzle at mach 2+, possible in this environment? With the above mentioned series of fans, could I potentially compress air enough to increase the output by choking and then expanding the outlet of my RC plane?  


I wasn't sure if I should list this as Mechanical or not, so I just flaired it as Discussion.",AskEngineers,False,HellKnightRob,/r/AskEngineers/comments/dsjtkw/could_you_use_ducted_fans_to_replicate_the/
80,Do companies really use punching for manufacturing anymore? Aren't they all being replaced by laser methods?,1573061804,I haven't come across a punching press in a long time in my internships and we've been spending a long time on it in my manufacturing class. Is this really applicable to the real world or is it more of a hold-over from before fiber lasers were a thing?,AskEngineers,False,CapitalismAndFreedom,/r/AskEngineers/comments/dsjoda/do_companies_really_use_punching_for/
81,Career path decision,1573060981,[removed],AskEngineers,False,mateuszowskiinz,/r/AskEngineers/comments/dsjhfk/career_path_decision/
82,Did the contractor fix this basement correctly?,1573060695,"Basement Bowing **help**
Hello, new here but I am in need of some advice. I am in the process of purchasing a home that had its basement wall repaired because of bowing. The homeowner hired a contractor to dig out the load bearing wall and brace it with the steel I beams. These beams tie to a smaller beam that is about 4 feet long inside the basement. My question is, is this done right? The same contractor also tried to secure one of the corner quoins with a steel cable. This cable goes from the front of the house all the way to the back corner. (The entire width) Is this a house to stay away from? More images in comments
https://preview.redd.it/y85opt3a82x31.png?width=1125&amp;format=png&amp;auto=webp&amp;s=2bb3c0a972cdf121c13f407d7e21dbb2793ff1a1",AskEngineers,False,JBGroupKY,/r/AskEngineers/comments/dsjeuw/did_the_contractor_fix_this_basement_correctly/
83,How do I ask job to sponsor my FE Exam and practice materials?,1573060432,"I am a fresh graduate from college (ABET) in May 2019. I just started at a new job 2 months ago, and the company has told me they would like me to pursue my PE license. The company is very generous in other areas, but I'd like to know how can I ask politely to see if/what they would cover with the exam fee, practice materials, PTO, etc. Also, if it is common practice for employers to do this.",AskEngineers,False,Kerbal27,/r/AskEngineers/comments/dsjco2/how_do_i_ask_job_to_sponsor_my_fe_exam_and/
84,Basement bowing **Help**,1573058601,"Basement Bowing **help**

Hello, new here but I am in need of some advice. I am in the process of purchasing a home that had its basement wall repaired because of bowing. The homeowner hired a contractor to dig out the load bearing wall and brace it with the steel I beams. These beams tie to a smaller beam that is about 4 feet long inside the basement. My question is, is this done right? The same contractor also tried to secure one of the corner quoins with a steel cable. This cable goes from the front of the house all the way to the back corner. (The entire width) Is this a house to stay away from? More images in comments
https://preview.redd.it/y85opt3a82x31.png?width=1125&amp;format=png&amp;auto=webp&amp;s=2bb3c0a972cdf121c13f407d7e21dbb2793ff1a1",AskEngineers,False,JBGroupKY,/r/AskEngineers/comments/dsiwcf/basement_bowing_help/
85,I want to learn Mechanical Engineering but I don't want to be an Engineer?,1573058392,"The thing is, I want to learn how to build things, and I find most of the upper year lectures and labs in my engineering degree very intriguing, however, the actual work life of most engineers seems monotonous, and quite frankly, boring.

It seems as if I really want to *learn* engineering, however I don't want to *be* an engineer.

I basically just really want to learn *how* to build things, and *why* things work the way they work. 

Should I pick a different field? Has anyone else had the same dilemma?",AskEngineers,False,Ghestis123,/r/AskEngineers/comments/dsiuh2/i_want_to_learn_mechanical_engineering_but_i_dont/
86,Asking advice after CE,1573057748,"I'm finishing a bachelor in CE and in these years I decided that I want to get a job in the research field.
Now I should choose a master but I'm a little bit confused as I see so many courses and option and I don't know each one.
Actually I'm considering automation engineering, electronic engineering or computer engineering with a path on embedded systems or networking.

But today which of them is more convenient? Which of them is in greater expansion and is better for reasearch?
Thanks for the answers",AskEngineers,False,ceci_12,/r/AskEngineers/comments/dsip16/asking_advice_after_ce/
87,Attention Power Engineers With SEL Relay Experience!,1573057075,"I'm a EE controls engineer thrust into a project where I'll be modifying programming and designing topology diagrams around SEL relays.  For the past 6 years I dealt with water/water controls...but for the first time ever with little power background I get to deal with SEL relays!

I’m looking for guidance on:

* What training course(s) to take from SEL's University  [https://selinc.com/selu/course-calendar/?category=selu](https://selinc.com/selu/course-calendar/?category=selu) 
* Videos I could watch to give me some basic understanding of what these components do, and give me some basic theory BEFORE I take the SEL University courses.

Here is a list of components I will be interacting with in the future:

* SEL-3530 Programmable Automation Controller
* SEL-311L  Line Current Differential Protection and 
* SEL-2440  DPAC Discrete Programmable Automation Controller
* SEL-751  Feeder Protection Relay
* SEL-487B  Bus Differential and Breaker Failure Relay
* SEL-787  Transformer Protection Relay
* SEL-3622 Security Gateway
* SEL-3620 Ethernet Security Gateway

 In general, I’m looking for:

* Training with the RTAC and the Accelerator Software 
* Training on the Quickset software and “general” relays. 
* Info on GOOSE messaging, IEC 61850, SEL protocol. 
* I do not necessarily need to learn a ton about the theory.   
* I’m most interested in: 
   * How the components work, 
   * how I can make them talk, and 
   * how I am able to communicate with them.

Thoughts on this?

Thanks!",AskEngineers,False,sitegnalp,/r/AskEngineers/comments/dsijae/attention_power_engineers_with_sel_relay/
88,Why do many residential buildings have Stoops?,1573056002,"I am not sure if stoop is the right world but I am wondering why many residential buildings have entrances a few feet higher than ground level, needing stairs to reach the entrance.  While many commercial buildings are at ground level.    


I have a few ideas such as minor flood prevention and street leveling but I have seen many stoops/ raised front porches where those are negligible factors if at all.  If any civil engineers or architects can quench my curiosity, I would be grateful.",AskEngineers,False,MercenaryOfTroy,/r/AskEngineers/comments/dsi9zu/why_do_many_residential_buildings_have_stoops/
89,What is a class-e type valve?,1573054363,"In EN 624:2011 (E) the regulation reads,

""Where the heater is equipped with a class E type valve, it shall give advice to the installer to check that any pressure more than 5 times the working pressure is avoided a t the appliance inlet connection by suitable means.""

What is a Class-E valve? Google gives me conflicting results. The heaters in question are LPG or Diesel powered heaters.",AskEngineers,False,helloboys-imbaaaack,/r/AskEngineers/comments/dshw4v/what_is_a_classe_type_valve/
90,Help me find this type of screw,1573050203,"Hello,

I need help with finding the type of screw:

 https://imgur.com/undefined 

&amp;#x200B;

Thanks for your help",AskEngineers,False,mr_bomastik420,/r/AskEngineers/comments/dsgz3w/help_me_find_this_type_of_screw/
91,Any teachers turned engineers out there?,1573049505,"I’m sort of at a crossroads right now and obviously turn to reddit for advice. I’ve been teaching for 5 years and absolutely love the job, but looking at my future financially is a little scary. Even the administration jobs that I could take eventually would be ~$60k a year, and that’s years and years away. 

A handful of my friends got into engineering (mostly mechanical) and they all seem to love the job. I know being pragmatic can be worrisome with careers, so I’m searching if anyone was in a similar position as I’m currently in. I would love to hear a story where you loved your job, but just didn’t realistically make enough money and switched to engineering. How did that work out?",AskEngineers,False,j_palazzolo,/r/AskEngineers/comments/dsgtuw/any_teachers_turned_engineers_out_there/
92,Australian Engineers-job search sites and Adelaide question,1573048586,"I have the opportunity to move to Adelaide and am wondering what the best job search site is for engineers in Australia? In the US I typically use indeed or linkedin.  Are these widely used in Australia or are there better sites? I found an Australian site called Seek, is that one widely used?

Also, what's the story on engineering/physics jobs in Adelaide, is this a decent are for that, or not so much? Searches haven't turned up a lot, but it's possible I'm using search terms that aren't typically used in Australia (I'm American, but have right to work in Australia).  I'm an electrical engineer with experience in optics, lasers, sensors, radar, etc.  Is there an industry for this there, or would that be more likely in other parts of Australia? What about programming? Not really my forte, but I could learn.  I need to make a quick decision, so any thoughts are appreciated. tia",AskEngineers,False,YoYo31415,/r/AskEngineers/comments/dsgmud/australian_engineersjob_search_sites_and_adelaide/
