index,title,created_utc,selftext,subreddit,media_only,author,permalink
27,Graduate Engineer - advice on learning to build stuff,1584779974,"TLDR: I am looking for advice on learning how to build things. Can I learn online? Would you recommend going to a trade school part time (considering TAFE engineering course in Australia). Anything else?

&amp;#x200B;

Hi all, first post. 

&amp;#x200B;

Short Version: I feel like my chemical engineering degree is great for designing things with the high level knowledge I gained (e.g. heat and mass transfer, fluid mecahnics, process control etc) but I have no clue on how to make and build the things I design myself. I would like to build some a[lgae photobioreactors](https://www.google.com/search?q=algae+photobioreactor&amp;rlz=1C5CHFA_enAU731AU732&amp;sxsrf=ALeKk02TtFyBzj9D83Evcm6KS9e4fFdFng:1584779091353&amp;source=lnms&amp;tbm=isch&amp;sa=X&amp;ved=2ahUKEwjE-qWWkqvoAhXtILcAHaj4AY0Q_AUoAXoECA4QAw&amp;biw=1280&amp;bih=585) \- but not sure on how to piece together materials (e.g. plastic / glass), weld things, do basic programming (arduino? PLC?).

Should I enrol in a trades degree part time? Any advice on self teaching? I've never used power tools or machinery. I want to become more practical.   


Background:

I graduated in Chemical Engineering a few years ago and worked as a Project and Process engineer in a few different manufacturing factories (food/beverages &amp; personal care products like deodorants/shampoo) for a few years. I did a few projects where I designed factory upgrades, but the mechanical fitters and electricians basically did all the building for me, and my electrical engineering colleague did the programming. 

I then decided I want to work on sustaianble tech. So I started a PhD working on algae biotech (trying to make bioplastics from algae biomass). I have some cool ideas for photobioreactors (transparent reactors that grow algae by allowing sunlight to penetrate the liquid medium full of nutrients) - but I want to build prototypes myself. I am not a very hands on person, but want to change this. I want to build and tinker but for example, I wouldn't know how to cut wood, weld metal etc for myself.

How can I bridge this gap and become a better engineer? I feel like I'm all theory, and I feel embarassed by this. I wouldn't be able to tinker around with my car engine or fix a broken pump myself.

Any advice on what to do? I feel like a trades school (mech eng / electrical eng) would be useful and I would get trained up on different equipment. However, it would not be tailored to what I need to know - though I feel like I need a foundation anyway. Or should I try just learn online? I don't have own any tools myself though.

&amp;#x200B;

Anyway, thanks for your help in advance.

&amp;#x200B;

Cheers

Shawn",AskEngineers,False,GriffithEternity,/r/AskEngineers/comments/fmbzni/graduate_engineer_advice_on_learning_to_build/
28,Should I major in ChemE or ECE?,1584775528,"Hi guys,

So I am a freshman in engineering that is undecided. I am really interested in working on renewable energy in the future. I am really interested in solar energy and discovering a new energy source just as algae-based solutions. These two majors have caught my attention. My concern is that if I do ECE I will just end up in a coding job, and if I do Chem. I will end up in the oil/gas industries. I have also seen that ChemE's end up going to research, but I am really interested in working with a team in the industry sector after college. 

Any advice on how I should decide my major would be greatly appreciated!!",AskEngineers,False,SurveyPuppy,/r/AskEngineers/comments/fmbanv/should_i_major_in_cheme_or_ece/
29,"Stuck in a rut, don't know what to do with my career, need some advice?",1584771248,"This post is more of a rant than anything. 

It took me about 6 yrs to get my undergrad degree in ChemE in 2016. I switched majors a few times in community college and eventually went to a state school. Fortunately, I graduated with only $14k in loans. After I graduated, I was unemployed for a year. By spamming my resume everywhere I found an R&amp;D Technician job paying $22/hr at a company unrelated to my degree (fabrics manufacturing). Spent a year and a half working there, got depressed about my situation then got fired. Found an Engineering Technician job so I would not have a gap in employment paying $23/hr, also unrelated to my degree in semiconductors (lasers). I have worked there for a year and now I'm at a risk of losing my job due to this stupid pandemic. I also have no health insurance and if I get sick I'm fucked. So I have about ~4 yrs experience doing tech work getting paid similar to my sister who has a high school diploma and sits on her ass all day taking phone calls. 

I'm interested in an engineering role, one with actual technical challenge, but I don't know how to get one. I have previous experience in validation studies, equipment procurement and qualification, programming in python, and using solidworks to design fixtures. How do I find an engineering job?",AskEngineers,False,998fiftyseven,/r/AskEngineers/comments/fmakkx/stuck_in_a_rut_dont_know_what_to_do_with_my/
30,"What makes a ""No Touch Hologram Button"" so expensive?",1584768191,"I came across an [article](http://www.globalconstructionreview.com/news/demand-china-surges-no-touch-hologram-buttons/) outlining the heightened demand in China for this type of button given the situation with Covid-19 to eliminate touching surfaces. The article claims that one device is \~$2000, and I am curious as to what makes this (presumably relatively new) technology so pricey. Thank you!",AskEngineers,False,DonnyT1213,/r/AskEngineers/comments/fm9zv4/what_makes_a_no_touch_hologram_button_so_expensive/
31,Is it true that engineering consulting firms operate at a very little profit margin?,1584763110,"I recently got laid off within two weeks of getting hired at an engineering consulting firm. Prior to this I worked in aerospace manufacturing and before that at an OEM. Both of my previous companies are on hiring freezes due to the recession and corona virus but haven’t laid off anybody yet. Yet the consulting company laid off at least 5 people this week ( including me) and a couple more next week and so on. The reason given is that these companies do not want their employees billing to their overhead. 

This begs the question are these consulting firms operating in such low profit margin that they can’t have their engineers ( especially new hires) bill to the overhead ? If this were the case why is working for a consulting firm highly sought after ( at least that’s what I’ve been led to believe). I would rather work for a company with a healthy budget than work for some firm who can’t keep their employees more than two weeks cause they fear that their overhead is getting charged too much. 

Also who the heck lays off their new hire employee 2 weeks after hiring them from out of state ?",AskEngineers,False,larrythetarry,/r/AskEngineers/comments/fm8yzv/is_it_true_that_engineering_consulting_firms/
32,"if a craft were stripped of everything but a radio beacon and power source, and direction did not matter, how fast could a spacecraft get using planetary slingshots and then a xenon ion thruster? Think Voyager but with the sole intention of speed.",1584761637,,AskEngineers,False,calypsocasino,/r/AskEngineers/comments/fm8npn/if_a_craft_were_stripped_of_everything_but_a/
33,"Sophomore interested in analog design, what internships/research or skills to build?",1584758409,"I'm looking for any type of advice, personal experience getting there, projects, day in the life, internships you did, research etc. regarding being an analog designer/the way to being an analog designer. 

I'm a sophomore EE, currently in circuits 2. I decided I'm very interested in a role in design, mainly because of my love for my circuits classes. (Though I've only taken the two). 

I have no idea what's ahead of me, or what I want to design, and not really sure what's the right path. I just know I like circuits and math. 

I have a co-op lined up where I'm a manufacturing engineer; details of the work I do is unknown but I know I will be able to write code/work with robotics if I'd like. Otherwise, my personal projects have been in CS and I have a CS minor. 

I want to do research with a professor because I think that'll help me get into analog design, and I intend to get a masters. My gpa isnt too hot; 3.4.",AskEngineers,False,infengineer,/r/AskEngineers/comments/fm7xqc/sophomore_interested_in_analog_design_what/
34,What is the expectation of a newly hired Field Engineer on the first few weeks of the job? I am just starting a new job and feel as if I'm expected to know everything.,1584755999," Firstly sorry for the long post, i tried to give as much detail as i could to make my question clearer. TLDR at the bottom. 

 It is currently my second week on a large civil projectas a Field Engineer. Firstly, my first two weeks have started out during the Covid -19 pandemic and i have logged a total of 110 hours while my site super has been self isolating for 100 of 110 of those hours. 

 The first week the assistant super has had me attempt to memorize every detail and drawing of the 22 floors of building we will be erecting, if i ask any questions he will not answer with anything of use and will just say ""i don't know everything"", leaving me to fend for myself. Now i would not mind this if it wasn't for the fact he has me doing his job as well, i am measuring and ordering concrete, finding the specified mix types and strength, dealing with emails i have no business dealing with, organizing large pours and locating material he had shipped to site, forgot to log and lost, while he surveys! (An aspect of the job i should be doing), i have also been logging all material tickets, legal documentation on inspections and filing it in the complicated system they haven't had a second to explain to me.   

 Tomorrow on saturday we are working. I have scheduled in a large pour, that he expects myself and a co-op student to be there to coordinate. He will be there too though, so I'm not sure why he would need our help, or expect us to coordinate. 

 Granted, I understand the fact that its a tremendous opportunity for me to show my worth at this company, but i can't help but feel like I'm being thrown into the fire with no direction, and my first instinct is to think that maybe i am being set up to fail. I haven't received any pens, paper, books or anything to log notes in, i had to buy those myself because when i asked they just said ""we don't have any"". 

Oh and im making 16$ an hour after all is said and done these past two weeks because i am salaried while having to pay 115$ per 2 weeks to get to work by transit. 

 Can anyone explain to me what should be expected of a straight out of college field engineer like myself? And am i over reacting or am i being thrown into a fire? I would like to change the dynamic we have to make everything more efficient but i am not sure where to start.  

TLDR: I am, in my opinion doing the job of the assistant super (Ordering Material, coordinating trades to schedule work, making emails &amp; being forced to make emails) while the assistant super does what i expected to be my job (surveying, data management, and miscellaneous work.) When i ask questions, i am told that he ""doesn't know everything"" and basically tells me to figure it out myself. All this while our site super is ""working from home"" due to going out of the country during the covid-19 pandemic. I haven't been taught anything yet, have just had to fend for myself, is this what is expected of a new graduate, or am i being thrown into the fire? And how can i change this dynamic for the better?",AskEngineers,False,Orangatation,/r/AskEngineers/comments/fm7dpz/what_is_the_expectation_of_a_newly_hired_field/
35,Winch strength needed for equipment in mud,1584754857,"Hi! 
I am working out a project for our farm where I’d like to pull equipment out of the mud. 
When I arrive I’ll lower my blade into the dirt and start winching. I’ll move towards the equipment first but by pushing dirt with the blade I become heavier than the force needed to pull the tractor with seeder. 

Now, worst case scenario is a 109,000 kg (109 metric ton) combination on approximately 14-ish wheels. I calculated the newton needed to be between 6800N and 27,250N (at 0.25 - 0.5 m/s) but that’s assuming I need to pull the full weight and I don’t think that that accounts for lack of friction with wheels and the tractor helping as well.

I’d guess lessening of frictions by wheels is offset by the wheels pushing mud but my question to you is how do I account for the tractor helping to move? Do I really need a winch rated for 109,000 kg/240,000lbs or can I get away with a lighter one from for example the back of a bulldozer?",AskEngineers,False,ImportedCanadian,/r/AskEngineers/comments/fm73vo/winch_strength_needed_for_equipment_in_mud/
36,Could you change the configuration of an internal combustion ?,1584748290,"Could you change the configuration of an internal combustion ?

What I mean by this is it possibly to change the layout of an engine ?

Can you modify a v6 into a an inline 6. An inline 6 into a flat 6, etc ?",AskEngineers,False,Drax343,/r/AskEngineers/comments/fm5gqc/could_you_change_the_configuration_of_an_internal/
37,Finding job in recession,1584739484,"In the next few months the economy will go on a recession or even depression. I'm also expected to graduate in the next few months, and feel so demotivated now since my job chances are basically blown. To those who managed to survive the 2008/2009 recession (or any other recession), how did you do it? I'm also having an online interview with a company in the next few days, however the company is not really in line with my major; they picked me probably because of my involvement with the uni's Formula 1 team. Should I force myself to find common ground with this company and hopefully get a job (even though not what I want), or wait for one that is in line with my interest (which I think will be very hard given the condition now)?",AskEngineers,False,aldosebastian,/r/AskEngineers/comments/fm32qc/finding_job_in_recession/
38,Is a double major in management worth it?,1584736340,"I'm a mechanical engineering major at UCF with goals of working my way into operations management. I am considering taking on a second major in management with UCF's college of business administration, and I wanted to hear from some others to see if they think it would be worth the investment.",AskEngineers,False,RandoMan37,/r/AskEngineers/comments/fm26ob/is_a_double_major_in_management_worth_it/
39,What are the radial loads in a perfectly-balanced vertical shaft spinning at around 1000 rpm?,1584736009,"I am trying to select bearings for a vertically orientated shaft which has a high axial load but I can not identify anything that would be causing radial loading in the bearings. Its for a prototype flywheel energy storage system, so its basically a steel shaft with a very heavy wheel attached at it's midpoint. 

I am planning on using a thrust bearing at the bottom of the assembly, which is pretty simple, but I can not seem to do any calculations for the bearing which is positioned above the flywheel, as all analysis methods require a radial load. The very top of the shaft will be connected to a motor so another thrust bearing at the top isn't really ideal.

If anyone knows of any bearing analysis or design methods that are specifically for vertical shafts could you let me know? All the textbooks I've looked at only deal with horizontal shafts, where the majority of the load is radial. Is another bearing even required in the assembly?

Any help is much appreciated. Thanks!",AskEngineers,False,Mup_I_Said,/r/AskEngineers/comments/fm2384/what_are_the_radial_loads_in_a_perfectlybalanced/
40,I need help picking out a correct DC Motor for my project.,1584732521,"I'm trying to complete a DIY pottery wheel. I think small DIY pottery wheels are kind of a niche thing so I haven't been able to find much information online. The wheel heads are replaceable and most of the structure has been completed I'm just having trouble with picking a motor.   


The largest wheel head is 15 cm in diameter. I want the speed of the motor to be consistent with up to 15 pounds of weight applied on the wheel head. I figured this should be enough to account for \~1 lb of clay + the weight of me manipulating the clay. I currently have a 12V DC motor with about 10,000 rpm, and I'm using a speed controller to adjust the speed, but I don't think this will have enough torque to support that applied weight and maintain the speed.   


I'm terrible with physics and figuring out torque / speed and whatnot so please don't throw equations at me. Just looking for some motor recommendations! Thanks in advance!",AskEngineers,False,ThwartedRomantic,/r/AskEngineers/comments/fm12wo/i_need_help_picking_out_a_correct_dc_motor_for_my/
41,How do I convert from an acceleration vector in spherical coordinates to acceleration components in Cartesian?,1584732413,"Hi, I have calculated acceleration components for an aircraft using spherical coordinates `a_r, a_θ, a_φ, where `a_r` refers to the acceleration in the `e(hat)_r` direction, etc. Spherical was most sensible since I was given various kinematic data in terms of roll, pitch, yaw, and interested in the forces on components a distance ρ from the aircraft CoM.

I'd like to convert the acceleration into Cartesian (basis i, j, k), to get the Cartesian acceleration vector. This is so I can add linear accelerations in the i, j or k direction, add gravity in the k direction, and multiply by component mass to get the inertial forces on individual components.

There seems to be no easy way to convert `a_r, a_θ, a_φ` spherical components into `a_x, a_y, a_z` Cartesian components. Anyone done this before?",AskEngineers,False,_Kinematic_,/r/AskEngineers/comments/fm11pq/how_do_i_convert_from_an_acceleration_vector_in/
42,Field engineer working at robotics company looking to learn more about mechanical and electrical engineering.,1584732293,"Hello,  I currently work at a robotics company as a field engineer that makes robots in-house for inspections.  I currently have a petroleum engineering degree.  I would love to learn more about both mechanical engineering and electrical engineering so I can understand more low-level concepts within the robots.  I was recommended Shigley's Mechanical Engineering Design and I just purchased Practical Electronics for Inventors.  Does anyone else have any helpful resources or suggestions for me?  Thanks!",AskEngineers,False,Busch_Jager,/r/AskEngineers/comments/fm10ge/field_engineer_working_at_robotics_company/
43,How to Make a Skateboard Propel Forward with no electricity?,1584730716,"What if, instead of either pushing off with a skateboard (and falling on your ass countless times) or buying a ridiculously expensive electric skateboard with no controller, you could simply bounce on your board to propel the wheels forward? Many longboards and skateboards have thin frames that add bounce, so is it possible to transfer that energy with no electricity? 

My first ideas were a pump mechanism such as what a salad spinner uses (possibly called a spiral plunger?). The corkscrew could spin and go downwards as the board is pushed down, and the board would slowly come back up as the wheels spin until all the energy is released. Another question that arises would be how to transfer that spinning energy to the wheels in an effective way. Would gears under the board, belt, or chains work of some sort? Or would too much energy be lost? Pumping down on the board has been used in many carving longboards to make the boards go faster, but that requires skill and moving side to side to pick up speed. Is there any possible way the energy from simply pumping or bouncing down on a skateboard could possibly make the wheels go faster? Not sure if the spiral mechanism would work. 

I would love to try this out by trial and error and eventually create one myself, but I just can't wrap my head around what mechanism could accomplish spinning the wheels. Friction motor maybe? I am a student at USC and wanted to do this with help from resources at college, but COVID really set everything back. Thank you for your responses, it really means a lot.",AskEngineers,False,Murkium,/r/AskEngineers/comments/fm0js4/how_to_make_a_skateboard_propel_forward_with_no/
44,Job transition,1584730109,[removed],AskEngineers,False,HumanAllergy,/r/AskEngineers/comments/fm0da1/job_transition/
45,Is there any type of engineering that uses advanced math?,1584727658,"I don’t know anything about engineering, so please be patient. Essentially I’m wondering if there are engineers that use advanced math? Like beyond just ode’s, pde’s, and some linear algebra?

I’m not asking about applications of advanced math, I mean do you or other engineers actually use it in your understanding of things?",AskEngineers,False,helllppppppp,/r/AskEngineers/comments/flznd6/is_there_any_type_of_engineering_that_uses/
46,Best calculus and programming books?,1584725774,"I'm looking to top up my calculus and programming skills, but I've struggled with the books I've used on college, namely Stewart for calculus, and Deitel for programming. What are the best calculus and programming books and resources you know of? Thank you.",AskEngineers,False,Tallerdrop,/r/AskEngineers/comments/flz3nb/best_calculus_and_programming_books/
47,How similar are GNC Engineering and GPS Engineering?,1584724991,"Wanted to know the similarities/differences between Guidance, Navigation, and Control Engineering and Global Positioning System Engineering. Does the latter heavily involve Control Theory?

Currently planning out my graduate coursework for mechanical engineering; I aim to focus on the advanced controls side and am currently looking at my career options. 

&amp;#x200B;

Also be safe out here everyone!",AskEngineers,False,Voltimeters,/r/AskEngineers/comments/flyvf5/how_similar_are_gnc_engineering_and_gps/
48,Fixing an anemometer - do the cup sizes matter?,1584723046,I have an old weather station that has had one of the cups broken off from the anemometer. I have found replacements to print but they are a different size and weight - would this alter the speed with which a given wind speed would turn the axle?,AskEngineers,False,wirral_guy,/r/AskEngineers/comments/flyar1/fixing_an_anemometer_do_the_cup_sizes_matter/
49,What do you need to take into consideration when cutting an access hatch (2’ x 2’) in a suspended rebar floor?,1584722123,"I’m curious to see how feasible this would be in a 6” concrete poured floor... I know it can be done and have no intention of doing myself! But I’d like to see how the pros would tackle this, equations and all!",AskEngineers,False,vinniegreen,/r/AskEngineers/comments/fly166/what_do_you_need_to_take_into_consideration_when/
50,What kind of problems do you use simulation e.g. FEM for in solid mechanics and where are the boundaries regarding the scale of the problem?,1584722062,"I have worked as a structural engineer in the civil sector and have a grasp on what kind of problems we solved with the help of simulation.

I am curious how you do it in different kinds of industry. When is a problem too complex for hand calculations and how large problems can be solved using said techniques. Are you feeling limited by the capabilities of today's computers?",AskEngineers,False,MarcusAndreasS,/r/AskEngineers/comments/fly0jh/what_kind_of_problems_do_you_use_simulation_eg/
51,Marine engineering to environmental engineering,1584720565,"Hello everyone! I'm a marine engineer (BS) and looking to get into the environmental engineering field possibly via MS. Does anyone have any recommendations as to the best path for that, such as taking online MS courses at a particular program. Any guidance will help!",AskEngineers,False,ilovebuffyandspike,/r/AskEngineers/comments/flxky1/marine_engineering_to_environmental_engineering/
52,The Complete Beginner's Guide to Autodesk Revit Architecture (Online Training Course),1584719568,[https://bit.ly/2Qz55Ay](https://bit.ly/2Qz55Ay),AskEngineers,False,joelfx25,/r/AskEngineers/comments/flxaco/the_complete_beginners_guide_to_autodesk_revit/
53,Where can I find a free ISO 1924-2:1994 pdf?,1584716164,,AskEngineers,False,Austin_Lopez,/r/AskEngineers/comments/flwc8d/where_can_i_find_a_free_iso_192421994_pdf/
