index,title,created_utc,selftext,subreddit,media_only,author,permalink
0,Jacobs vs Northrup Grumman Job Offers,1585928066,"A family member is graduating this May with his BS EE this May from a Florida university.  His work experience includes two in-field internships and naval service in ship board communications test and repair.  He is receiving two offers, one at Jacobs Engineering at NASA Kennedy Space Center, another at Northrup Grumman Mission Systems down the coast in Melbourne.  Would any of you have any input on either of these firms and their operations at these locations?  Thanks!",AskEngineers,False,FLfitness,/r/AskEngineers/comments/fuahsa/jacobs_vs_northrup_grumman_job_offers/
1,Methods and devices to stabilize AC power when large AC motors start?,1585927860,"I have a 240V, single-phase air compressor on a dedicated circuit. When it kicks on, the lights dim and some sensitive devices will reboot or show other problems. I've installed expensive power conditioners on the most important equipment. Is there something I can install compressor-side to smooth out the start-up load (in this case a ""soft start"" is not something I can add as it is incompatible with this type of compressor).",AskEngineers,False,fakeproject,/r/AskEngineers/comments/fuafpn/methods_and_devices_to_stabilize_ac_power_when/
2,Scanner for Copper Granules on roof shingles?,1585926356,"Hi All,

Anyone know of a simple method to check if roof shingles have copper / zinc granules in them? Manufacturers include some as an algae prevention method.

  
Is there an inexpensive way to tell if they are there? Metal detector that would be sensitive enough for the granules but wouldn't go off due to roofing nails? Some other scanner?

&amp;#x200B;

Thanks!",AskEngineers,False,shueymvm,/r/AskEngineers/comments/fu9zvw/scanner_for_copper_granules_on_roof_shingles/
3,Has has your company adapted to WFH in the product development life cycle?,1585926063,"With a lot of engineers working from home due to COVID, companies have had to adapt quickly (literally over the course of 2 weeks) to working virtually. How has your company and project team adapted to working remotely? 

I have been pushing for project management to utilize Visual Management (VM) techniques more frequently during daily and weekly meetings. In the past 2 weeks, I found that being peppered with information through emails and phone calls have been leading to a lot of confusion among the team.  

What has worked for your project based team? Do you have advice/suggestions?",AskEngineers,False,THEbigSCHNOZZZ,/r/AskEngineers/comments/fu9wrf/has_has_your_company_adapted_to_wfh_in_the/
4,Any ideas for a product that would combat climate change?,1585925401,How would you address the effects/causes of an aspect of climate change? Any ideas would be greatly appreciated :),AskEngineers,False,382crabs,/r/AskEngineers/comments/fu9pxr/any_ideas_for_a_product_that_would_combat_climate/
5,"I have absolutely no employment, I’m kinda freaking out, constantly being rejected on my applications. Spiraling into depression and need your guys help.",1585925341,"I graduated in December 2019 with my degree, and I have filled out hundreds upon hundreds of applications. In that span, I’ve had several dozen responses from companies that weren’t automatically “no”. They’d call me, and we’d have a number of conversations. Sometimes I’d get in person interviews if they were local. Regardless, it always lead me down the same path: rejection.

I have fine tuned my resume after speaking to numerous recruiters and resume experts. I have had mock interviews. I don’t think I’ve bombed a single interview, i answer questions calmly, concisely, and honestly, and I try to remain quick on my feet. The furthest I ever got was a third interview with a company, after they flew me across the country to interview with them. They gave me a tour. Multiple people spoke with me. And then we had lunch. And I was rejected.

At some point my parents implied I was being kicked out. This was before the pandemic. I got a couple retail jobs that weren’t hiring full time, and I also started driving for Uber. I still tried to stay on top of applying for engineering positions. I just really needed income right now. I moved in with my buddy for really cheap (thank god).

Since the pandemic, both of my retail jobs being non-essential caused me to be laid off. Uber is all I have, and it’s slowed down tremendously to the point where it’s almost not even worth it to waste the gas and waste the time getting in my car.

I have had suicidal thoughts about all this. I’m not going to go into detail about those because this is an engineering sub, not a psych help sub. I’m mainly feeling as though 4 years of college was a compete fucking waste. I took these hard courses and lost sleep to study for exams and it all ended up for nothing. My GPA is even a 3.5 for crying out loud, I assumed that was really good. I dunno anymore.

Do you guys have advice? What do I need to be doing differently? Should I aim for grad school? That almost makes me puke considering all the money I already spent and assuming I could get a job with a bachelors.",AskEngineers,False,epicgamesbad,/r/AskEngineers/comments/fu9pc3/i_have_absolutely_no_employment_im_kinda_freaking/
6,Do you think Manufacturing is making/will make a comeback in the Western World (and Japan)?,1585923842,,AskEngineers,False,HedgeFundsAreAScam,/r/AskEngineers/comments/fu9ali/do_you_think_manufacturing_is_makingwill_make_a/
7,Return of Manufacturing?,1585923647,,AskEngineers,False,HedgeFundsAreAScam,/r/AskEngineers/comments/fu98pl/return_of_manufacturing/
8,"When you create a prototype in CAD software and have it fabricated and receive it, does it usually come out how you want?",1585922803,"I am curious if parts usually come out like you imagine them when you make them in CAD software.  If you then place an order for someone to fabricate the part as a one-off process and you receive the part in the mail, does it usually come out as you expected?  (In any medium, from plastic to metal.)

Or are you usually surprised by how it behaves in real life or you need to make more adjustments after physically handling the first prototype part?",AskEngineers,False,mechnewwwwwb,/r/AskEngineers/comments/fu90g0/when_you_create_a_prototype_in_cad_software_and/
9,Who to contact about Turning my Factory into Mask Manufacturing,1585920606," 

Hi all,

I apologize if this is not in the right subreddit, if not please point me in the right direction. I own a small manufacturing company ( light manufacturing/ optical sorting/ distribution/ engineering). We deal mostly in the automotive industry, but are right now helping a few customers with urgent respirator components.

Of course business is down due to all the shut downs, but we are still an essential company and have to be up and running. We are a family company and we are doing everything possible to avoid layoffs etc ( myself and management have taken pay cuts to keep all of our employees whole and at full pay).

With this extra time we are going to have on our hands, a few of us were thinking of starting to make surgical masks ( non N95 100% cotton with a insert for the user to put in a filter of choice). We would donate a major portion to hospitals , fire, police etc., but look to sell to the public and other companies that are requiring their employees to be at work.

Does anyone have any suggestions on who to contact or where to even start as far as getting into the marketplace? We are located just north of Chicago.

Hope you all are staying safe",AskEngineers,False,Snakwellz,/r/AskEngineers/comments/fu8gaa/who_to_contact_about_turning_my_factory_into_mask/
10,Should I learn to code?,1585919965,"I am currently a mechanical engineering student, I have limited experience with java and matlab from previous education. I am wondering if learning to code fluently(?) In any particular language would help, or be essential to a career related to my field of study. Would I need any credentials for sufficiency in programming or can I just stick the skill on my resume? Are there jobs that require an engineering graduate that can code?",AskEngineers,False,paulyvc26,/r/AskEngineers/comments/fu8abv/should_i_learn_to_code/
11,Need your opinion. What free ebook or course you can suggest to start study mechanical engineering?,1585919785,"I am 34, I am interested in studying by myself mechanical engineering. Could you please suggest by your experience which free ebook or free course should I start?.",AskEngineers,False,periculuminmora,/r/AskEngineers/comments/fu88ri/need_your_opinion_what_free_ebook_or_course_you/
12,AIR POLLUTION CONTROL SYSTEM FOR TILE MANUFACTURING INDUSTRY,1585919183,"Hi, I am engineering student. Can you suggest to me any air pollution control system that are suitable and are used in the tiles manufacturing industry ? And what are their purpose, in a way to remove what ?",AskEngineers,False,sumiiiiiii,/r/AskEngineers/comments/fu83bo/air_pollution_control_system_for_tile/
13,Rotating Cantilever Beam Load Calculation,1585914016,"Hey guys. I was wondering, how would one go about calculating the load of a rotating cantilever beam with a mass at the end?

Imagine if you've a cuboid as you cantilever beam and a mass at the end of the beam. Then the cantilever rotates at a certain RPM assuming it doesn't snap or fail in anyway. How would you calculate the load acting the beam where the mass is while it's rotating assuming the mass sticks to the beam?

Appreciate any suggestions.",AskEngineers,False,Vitreiant,/r/AskEngineers/comments/fu6w7o/rotating_cantilever_beam_load_calculation/
14,Rotating Cantilever Beam,1585913487,[removed],AskEngineers,False,Vitreiant,/r/AskEngineers/comments/fu6sbe/rotating_cantilever_beam/
15,How much power is lost through a standard motorcycle 6 speed gearbox?,1585912805,,AskEngineers,False,average_dankster,/r/AskEngineers/comments/fu6n5y/how_much_power_is_lost_through_a_standard/
16,Failure Friday (03 April 2020): Did you break something recently? We want to hear about it!,1585911901,"Today's thread is for all the recent explosions, broken parts, vendor headaches, and safety violations at your workplace. If nothing exciting happened at your workplace this week, we also take stories about terrible management and office pranks on the interns.

&gt; [[Archive of past threads]](https://www.reddit.com/r/AskEngineers/search?q=failure+friday&amp;restrict_sr=on&amp;sort=new&amp;t=all)

Here are some good stories from past threads:

  1. [*""That day when your boss almost dies""*](https://www.reddit.com/r/engineering/comments/1o1qpr/that_day_when_your_boss_almost_dies/)

  1. [/u/DoctorWhoToYou talks about his time as the Maintenance Manager at a Tier 1 automotive supplier in the mid-90s](https://www.reddit.com/r/AskEngineers/comments/39kp18/failure_friday_june_12_2015_did_you_break/cs4pe6e)

  1. [/u/Hiddencamper talks about that one time when the Emergency Trip System didn't work right at a BWR nuclear power plant](https://www.reddit.com/r/AskEngineers/comments/37plk5/failure_friday_may_29_2015_did_you_break/crp3zsn)

### Guidelines

* **Please share without revealing your identity or workplace, or violating your security clearance!** [We assume no responsibility](https://www.reddit.com/r/AskEngineers/wiki/rules#wiki_legal_disclaimer) for anything that results from your writing here.

* Pictures are welcome, but please include a story to go with it.",AskEngineers,False,AutoModerator,/r/AskEngineers/comments/fu6g8x/failure_friday_03_april_2020_did_you_break/
17,"What technology could be used for a ""waste to energy"" system applicable to a liquid effluent waste heat stream at 50 ºC?",1585911378,"It can be considered that the effluent has similar properties as water.

Available flowrate of 1800 m3/h.",AskEngineers,False,cwlopes,/r/AskEngineers/comments/fu6cdm/what_technology_could_be_used_for_a_waste_to/
18,Need help identifying screw,1585899862,"Not exactly a big engineering question... Screw for my chair broke and I need help identifying it so I can get a suitable replacement. Thanks!  

[https://i.imgur.com/9WooHxO.jpg](https://i.imgur.com/9WooHxO.jpg)  

 [https://i.imgur.com/ccqUBAr.jpg](https://i.imgur.com/ccqUBAr.jpg)",AskEngineers,False,Kessa713,/r/AskEngineers/comments/fu44fz/need_help_identifying_screw/
19,Need help choosing a Yearly Project,1585893092," Hi, i am a mechanical Engineering 2nd year student and i need help deciding a NTCC course for this year ( its like a minor project we have to submit every year). Can anyone suggest projects possibly design related.",AskEngineers,False,charsie_godha,/r/AskEngineers/comments/fu2t2f/need_help_choosing_a_yearly_project/
20,Advice,1585893001,[removed],AskEngineers,False,charsie_godha,/r/AskEngineers/comments/fu2sfl/advice/
21,Repurposing old vcr feed and eject mechanism to squeeze a manual hand pump ventilator?,1585888758,I was trying to think of something that is abundantly available to utilize to help make ventilators. Tons of people have old vcrs. Seems like it would have enough force to do it. Does this seem plausible?,AskEngineers,False,StevanWhite,/r/AskEngineers/comments/fu1ued/repurposing_old_vcr_feed_and_eject_mechanism_to/
22,"Looking for cool projects involving automotive components. I have access to anything from electronics to mechanical parts. Mostly domestic vehicles (Ford, Chevrolet, Dodge,etc.) from 1995-2006.",1585888371,,AskEngineers,False,gasshampoo,/r/AskEngineers/comments/fu1r5f/looking_for_cool_projects_involving_automotive/
23,Is this open source face mask design practical?,1585886090,Here's my quick sketch and throw together of how I think a cloth face mask should be made. Take two square pieces of cloth and fold them kind of like when you're making a paper plane but stop part of the way. The +++++++++ drawings are where the stitches go. The black dots are where you attach the ties or elastic band ends. The top two dots are where the top parts of elastic band attaches to on each side of mask and are under the flaps which should help posture the fabric better around the nose with how the flap is stitched over top of it. The bottom two dots should be under flaps I messed that up there. The tie or band ends should feed through the stitch loops too. If anyone has anything to add to this design or ideals let me know. Will prototype soon.[photos](https://imgur.com/gallery/ZMzxGHV),AskEngineers,False,StevanWhite,/r/AskEngineers/comments/fu17jo/is_this_open_source_face_mask_design_practical/
24,Is this open source face mask design practical?,1585886086,Here's my quick sketch and throw together of how I think a cloth face mask should be made. Take two square pieces of cloth and fold them kind of like when you're making a paper plane but stop part of the way. The +++++++++ drawings are where the stitches go. The black dots are where you attach the ties or elastic band ends. The top two dots are where the top parts of elastic band attaches to on each side of mask and are under the flaps which should help posture the fabric better around the nose with how the flap is stitched over top of it. The bottom two dots should be under flaps I messed that up there. The tie or band ends should feed through the stitch loops too. If anyone has anything to add to this design or ideals let me know. Will prototype soon.[photos](https://imgur.com/gallery/ZMzxGHV),AskEngineers,False,StevanWhite,/r/AskEngineers/comments/fu17ir/is_this_open_source_face_mask_design_practical/
25,How to Convert a CATIA.model File to a .stp File?,1585884748,"A customer provided a few CATIA models instead of drawings. Now usually this isn't a problem. However, they provided a CATIA.model extension versus the usual .CATpart extension. When I go to Save As, the option is faded out. I cannot convert these files to another format such as a .stp file. My question is simple. How do I convert a CATIA.model file to a .stp file? I have googled this question to no avail. The file seems to be a read only file that cannot be altered. Is this possible?",AskEngineers,False,EagleWolf9,/r/AskEngineers/comments/fu0vuy/how_to_convert_a_catiamodel_file_to_a_stp_file/
26,Converting CATIA Files,1585884569,[removed],AskEngineers,False,EagleWolf9,/r/AskEngineers/comments/fu0u7e/converting_catia_files/
27,Can a Civil Engineer work on film industry?,1585883479,"Hi! 
I’m going to be a engineer freshman in the next year and I really want to work for the film industry, movies are my favorite subject and I want to be part of the making-of, specially in horror movies. Some people said I should change to mechanical engineer, but I don’t know.",AskEngineers,False,caroldenbrough,/r/AskEngineers/comments/fu0kd3/can_a_civil_engineer_work_on_film_industry/
28,How can a quantum computer beat the rules of basic probability?,1585879458,"I was watching [this IBM video](https://www.youtube.com/watch?v=pYD6bvKLI_c) which said that in a scenario where four cards are faced down, with only one of the four cards being a queen, a quantum computer can accurately guess the location of the queen on the first try. Using basic rules of probability, wouldn't we just be guessing and have a 1/4 random chance of finding the queen? Could a quantum computer actually guess the queen with accuracy on the first try, or am I misinterpreting the video?",AskEngineers,False,SilphRoadPokemon,/r/AskEngineers/comments/ftzjf6/how_can_a_quantum_computer_beat_the_rules_of/
29,Interning at niche field - advice?,1585879127,"Hey there engineers! I'm a third year ME student and I've been interning in a manufacturing company for 10 months. My work has been mostly CAD, and I just recently accepted an internship offer to a (much) bigger company on a very niche field. The thing is, it's the field I've always dreamed about working at! Beyond that, they seemed confident on keeping me on their team throughout my senior year and after graduation...

 I'm very excited about it but I am aware that the things I'll learn in this field can't really be applied in any other fields, or industries for that manner. Do you have any advice for me regarding this internship/experience?  
Thanks!",AskEngineers,False,PSCoso,/r/AskEngineers/comments/ftzg9d/interning_at_niche_field_advice/
30,Chemical Engineering or Electrical Engineering?,1585876424," I'm in the process of selecting my engineering stream, and I'm really stuck between electrical engineering and chemical engineering. I think I'll enjoy both, but the real deal breaker is more so how difficult it is to find jobs, and what you actually *do* on the job. If you have time to spare (probably not as you're an engineer) would it be possible to walk me through your average working day? Any help would be greatly appreciated!",AskEngineers,False,Anomalix,/r/AskEngineers/comments/ftyqx2/chemical_engineering_or_electrical_engineering/
31,How does a zero turn lawnmower hydrostatic transmission produce the torque output of a 4l60e silverado transmission.,1585875853,Was looking at hydrostatic transmissions for zero turn lawnmowers and came across the zt3100. It has stated that it has a maximum output of 350 foot pounds. reading some more i saw some zero turn mowers have an actual rated output of 245 ft lbs with them. How does a lawnmower have the torque similar to a chevy silverado truck with a 4l60e transmission rated at 285 ft lbs? What is it that im not understanding about this? Surely a zero turn couldn’t have the “power”of a truck.,AskEngineers,False,scootles1,/r/AskEngineers/comments/ftyll5/how_does_a_zero_turn_lawnmower_hydrostatic/
32,What design error have you caught that could have resulted in major failure?,1585873246,"As per the title.   


For me, I caught a mix design that had aggregate larger than the rebar spacing for a huge pour - not major, but something.

What have you caught?",AskEngineers,False,BlisteryStar101,/r/AskEngineers/comments/ftxwe2/what_design_error_have_you_caught_that_could_have/
33,Cantilevered cement deck structure,1585870895,"Hi everyone, my brother and I are building a deck outside his home. I’m pretty sure we have it under control but I’m definitely not an engineer. So we have an overhang of 60” of 4” concrete on metal decking. We have 4 beams w8x24# for the main support of the overhang, another 20’ of framing and deck is in solid ground. The overhanging portion is set to be 28’ wide by 5’ deep. These beams should be able to take that weight or are we making a death trap? The beams will welded to a 1/4”x12” pourstop plate in front of them and blocked between them with the same beams.",AskEngineers,False,peterlikes,/r/AskEngineers/comments/ftx9y0/cantilevered_cement_deck_structure/
34,Is it possible to do a physics undergrad followed by a master's in an engineering field?,1585869417,"I'm currently a physics major, and recently I've been thinking about naval architecture as a potential career path. My school doesn't have a program in this field, only a few in the US do. There's the Webb Institute, University of New Orleans, UMichigan, and some maritime academies. Looking into these schools, I'm getting the impression that they're kind of selective. and I really don't feel like I've done well enough in my academic career to stand a chance at being accepted to any of them. Anyway I'm still unsure if I want to go into this field. I'd hate to transfer to a new school only to find that ship design isn't my thing.

So I'm wondering if I can just complete my physics degree and pick up a master's in naval architecture later. That brings me to my question: will graduate engineering programs accept students who don't hold an engineering bachelor's degree? I've thought about switching majors to mechanical engineering to give myself a better shot at grad school, but I'm really into physics and I don't think I'll have a chance to take the cool upper-level physics courses like quantum mechanics and such if I do ME. And, as I said, I'm still unsure if engineering is what I want to do, so I'm reluctant to change majors at this point.

Any advice on this would be greatly appreciated!

tl;dr: I want to know if I need a bachelor's in an engineering field to get into a naval architecture master's program, or if the physics degree I'm working on would suffice.",AskEngineers,False,TheNewMe20,/r/AskEngineers/comments/ftwv1b/is_it_possible_to_do_a_physics_undergrad_followed/
35,Project manager with experience in making process maps and flowcharts.,1585868919,"I have to do a job for the university where I have to make a process map and various flowcharts (sales, production and launch and development of a new product).

The work is about a company that produces a technological product. More information in private",AskEngineers,False,LucaDina,/r/AskEngineers/comments/ftwpxm/project_manager_with_experience_in_making_process/
36,Online Circuit Theory Classes,1585867879,"Does anyone know where I can find some classes on circuit theory online? I studied mechanical engineering in college, but have been getting more into electronics as a hobby. I have looked on sites like Udemy, but they seem to skip over most of the theory as the classes are typically for people of all skill levels. I have tried local community colleges and have not had any luck either. Is purchasing a textbook online and teaching myself that way the best way? Thanks in advance.",AskEngineers,False,rsbryson32,/r/AskEngineers/comments/ftwf61/online_circuit_theory_classes/
37,Should I go back to school to obtain a Mechanical Engineering Technology diploma? Need help,1585866611,"So let me start off by apologizing for any grammar issues as I’m on my phone. 

So, I recently graduated with my b.eng from an accredited university in Ontario. I majored in biomedical engineering with a split in mechanical engineering. I noticed the job market hasn’t been great and have been having a difficult time finding work (most jobs require experience). This made me think about going back and doing a technology diploma. 

My question is, is it worth while to go back to school and do either a mechanical engineering technology diploma or biomedical engineering technology diploma? I’m considering this option to gain better hands on understanding of the diverse technology out there, as well as I am a very hands on person (while I also love math and theory based problems). 

Any information would be great, I’m just having a hard time figuring out what I wanna do with my life and how to get my life started (m24). 

Thanks in advance.",AskEngineers,False,QuanPablo,/r/AskEngineers/comments/ftw24d/should_i_go_back_to_school_to_obtain_a_mechanical/
38,Need help understanding total power consumptions of a theoretical system.,1585865169,"Let’s say I have a power supply that takes in 120 Vac from a standard outlet and provides 12 Vdc to 2 other components. Component A’s data sheet says its power consumption is 0.3 A @ 5 V and component B’s data sheet says its power consumption is 0.4 A @ 12 V. 

So for component A, the power consumption is just 0.3 A*5 V = 1.5 V-A? Even though it is being supplied 12 Vdc by the power supply? Does that mean component A in reality is drawing 0.125 A from the power supply (1.5 V-A / 12 Vdc)? 

And for component B, the power consumption is 0.4 A*12 V = 4.8 V-A? 

Do I have to take into consideration the power consumption of the power supply itself as well? Would that be the 120 Vac (from the outlet) multiplied by the current consumption of the power supply?

Thanks for your help. Electronics is not my strong suit",AskEngineers,False,ByleBuzma,/r/AskEngineers/comments/ftvmwh/need_help_understanding_total_power_consumptions/
