index,title,created_utc,selftext,subreddit,media_only,author,permalink
55,Bad engineering boss might be threatened by me? Advice?,1585583761,"Hey, all! Long post ahead. Here's some background:

I'm a 24-year-old man, graduated in May 2019 with my Bachelor of Science in Mechanical Engineering. Spent a few months in a PhD program at my alma mater, found it wasn't for me so I went into industry. This is where the fun begins.

Made the dumb mistake of biting at my first offer in December; very small company that makes electrical cables and assemblies. Place covered in red flags: management was openly sexist and a ""boy's club"", a 2960's ""we've always done things this way"" mentality for starters. Interviewed by then-retiring senior engineer who had been with the company for a few decades, another engineer we'll call ""Steve"" (my to-be boss, 23-year-old with a mechanical engineering technology degree), and a sleazy car salesman type we'll call ""Dave"" (in his 50s, not qualified to manage a company but pleased CEO enough to be let in).

They offer me a role for fair pay and benefits, I accept (unfortunately). Get into the role and start in early January. Hell begins.

See, Dave is a sweet guy if you're a man -- so thankfully, he liked me. He would bullshit about his horses and his lawnmower and his Mercedes, I'd smile and laugh, et cetera. He respected me for my background and I respected him for his kindness towards me.

Not the case with Steve. See, Steve was the only engineer at the company besides me and the now-retired engineer. He was now responsible for everything -- product design, quality control, manufacturing support, etc. He was a cool guy when I met him, liked Call of Duty and was part of a frat at his university which he missed (no surprise). He was also now my direct report.

Wasn't so cool when he started to realize how much I brought to the table. When we got audited for ISO9001, I offered to Dave to create standard work documents for all our processes and manufactured assemblies. In private, Steve said ""you haven't been here long enough to do something that complex. You still have a lot to learn"", etc. Keep in mind Steve had only been with the company for a year and my degree and experiences made me more technically qualified than him.

Dave loved the idea; in his words, a ""fool proof way"" for production to work. I agreed to make one to start. Half way through that document, Steve started to stack up other, less relevant work for me to work on -- like cleaning and sweeping the engineering area, or helping production make assemblies (which definitely wasn't my job, I wouldn't have spent 40k on schooling if I knew I'd be doing that!).

With crunch time, I managed to make the standard work documents and finish all my assigned tasks. Auditor liked them too (big surprise) for their controllability and accountability. Steve was stone-faced as we walked around the plant with the auditor and Dave.

That was in February. Since then, my tasks have only gotten more demeaning -- more assembly than ever (typically all week), he doesn't trust any drawing or customer quote I make despite those things being in my job description (and, therefore, has basically revoked that activity from me).

Since the virus hit the US, we haven't closed our doors as we're considered ""essential"" by our manager, Dave. I do some work from home, but only under strict supervision. At this point, the only thing I do is create datasheets for our products, all while Steve watches my screen AND webcam (so yes, he is currently being paid to watch my screen the entire day). He's cut my lunch break from 1 hour to 30 minutes, and tries to make it clear to our now other engineer that I'm not to be trusted with ""anything technical"". The other engineer has analyzed the situation and in a parking lot after work, has explained that Steve is a douche with a power complex and poor managerial skills (to which I agreed)

Another idea is that he's threatened by me in some way. Not only is Steve not very smart or capable, he's lazy. He spends most of his day in his office on his phone or playing games on his PC, and only works unless truly necessary. He might be worried that because I'm more technically versed than him, more motivated to go above and beyond, and older than him that I may take his job (which absolutely isn't my desire).

What does one do in this case? My work life is miserable. I haven't touched a drawing or technical document in weeks and has been demoted to assembler and datasheet writer. I'm trying to find a different job already, but with COVID-19 comes a huge hiring freeze. Hell, I took the day off because I don't feel well and he's holding me accountable ""still expecting work to be done"". Let me know what you guys think.

TL;DR: Boss hates me, making my life hell, feeling powerless. Advice?",AskEngineers,False,idlespoon,/r/AskEngineers/comments/frtclu/bad_engineering_boss_might_be_threatened_by_me/
56,Experience with hiring engineers,1585583009,"Does anyone have experience with hiring engineers. If so, may I pm you specific questions? 
Thank you!",AskEngineers,False,digital-snowflake,/r/AskEngineers/comments/frt4h2/experience_with_hiring_engineers/
57,Question about Solar inverter systems (solar edge &amp; LG Chem battery),1585581913,"I am temporary off grid on a grid tied system with a backup pannel, I'm running on backup.

My system is an 8kw solar, tied to a 7.5kw commercial version solar edge 240V inverter with a LG Chem 10kwh battery.

The question is

How can I reduce ware and tear on the inverter and battery?

Every night the small load on the system drops the battery to 90% and every morning at 8am it charges to 100% in 1 to 2 hours. 

Is using a small load bad on the inverters or would a bigger load be better and easier on the inverter?

Would draining the batter over night more be better?

What kind of loads do inverters dislike? Dc/dc switching power supplies, motors/inductive, resistive?

I will eventually connect it to the grid, but I am building my house and using this as construction power, LED lights, battery chargers and saws.

Would running a motor with a weight provide voltage stabilization, inertia to the system?

I can't seem to draw the battery down during the day as my 8kw solar is more than the 7.5kw inverter can output. The battery voltage is 400v dc.

My inverter battery and auto transformer are all mounted in my basement where it's 60 degrees year round. So I don't think thermal will be an issue. Just trying to make my system last longer.

Edit system specs

Optimizers P320

Inverter SE7600-A

Battery RESU10H

Auto transformer SEAUTO-TX-5000

Auto disconnect D222NRB",AskEngineers,False,spikes2020,/r/AskEngineers/comments/frsshv/question_about_solar_inverter_systems_solar_edge/
58,Job offer rescinded when negotiating salary?,1585581473,"Hi,

I was recently offered a position at Raytheon and I am planning on taking it switching from my current position. I was emailed an offer and then emailed my corresponding recruiter at Raytheon asking for a 10% bump in the salary. I havent recieved anything back yet, not even a confirmation of my request. Is it possible or has anyone ever had it happen where an offer was subsequently rescinded when asking for a higher salary? Thanks!",AskEngineers,False,Sovietdrewski,/r/AskEngineers/comments/frsnmn/job_offer_rescinded_when_negotiating_salary/
59,Looking for a reference book/database for phasediagrams of ceramic systems?,1585579166,"I'm looking for a good reference book to buy that has all the common phase diagrams for various ceramic systems.  I'm currently looking for something for SiO2 with fluxes but I think it would be a useful book to have in general.  

Anyone have any recommendations? I found the NIST one online but its $1000 and since I dont need super up to date or highly advanced ceramics I was hoping I could pick up some book from the 90s for cheap",AskEngineers,False,G0DatWork,/r/AskEngineers/comments/frryu1/looking_for_a_reference_bookdatabase_for/
60,Has anyone else's entry level job been a trial by fire with lack of technical training or am I in a bad work environment with poor management?,1585578988,"I'm a 23 year old woman. I currently work for a Fortune 50 company, and I have been at it for about a year. I make about $87k after bonuses in a low-cost of living area after college with a B.S. in Chemical Engineering, which affords me a comfortable security blanket.. I've done a combination of smaller capital projects ranging from 50k to 150k but every project has been a mess of me guessing what to do based on what people tell me since none are based on what my degree told me. Sometimes there is tribal knowledge that everyone knows but no one knows to tell me, and I have no guidance on what to ask until I later make a mistake. I'm told to ""not be afraid to ask questions,"" but I don't know where to even start if I don't have some guidance. 

Sometimes operators are dismissive, jaded about the low pay rate, and don't want to help me. Others go out of their way to help me but sometimes tell me conflicting things compared to other operators, so I'm left confused. I don't want to generalize to how women such as myself act, but I defer to being agreeable and wanting to make others feel validated so I agree with everyone but I want to find some right or safe conclusions about how to do things. The plant supervisor often tells me ""I'm asking YOU - figure it out yourself."" The operators being unhelpful, it's not exclusive to me - the plant supervisor has issues asking operators to help him perform lock-out-tag-out testing during an equipment fire in a timely matter.

I have no basis of comparison to work off of what is expected but I am often thrown into projects and then expected to know what I'm doing with little to no training of safety or how things work. I'm worried that I'm picking up bad habits concerning safety, time management, people skills, and learning right-from-wrong with the lack of appropriate training and oversight. The lack of communication is concerning, and the fact that corporate cancelled the official engineering training about three months in, stating that it's postponed, and hasn't followed up yet is scary. There is a 24.7% turnover rate at my company. 

The good news is that I've been actively recruited by other companies on LinkedIn and have reached final interview stage. **I just want to ask -- is what I'm experiencing common? Has anyone else been through this?? I know I don't have it the worst - I'm compensated rather well, but having this astounding lack of guidance as well as experiencing**",AskEngineers,False,LostAudience4,/r/AskEngineers/comments/frrwzi/has_anyone_elses_entry_level_job_been_a_trial_by/
61,Multiple variants test station automation concepts,1585577651,"Hi, I wonder if any of you guys have any experience within concepts of testing stations that handle multiple variants of a product? 

For example lets say we're producing motherboards in a computer, 5 types that all have different dimensions and we need to test these towards electronical standards and make sure they actually work with recieving and transmitting data. The test stations and procedure look alike, say connecting 2 cables in the back and both of them in the computer/device that tests the boards. Although since the boards have different dimensions they all fit differently in this testing device hence the need for multiple device stations/easily movable fixtures (that are dimensioned for all these 5 types) that connect into the stationary testing device.

I'm interested in concepts that removes the need for having several stations/fixtures with the result of only having 1 station that can handle all 5 types of mobo's tests. Any of you have any experience from this or seen any concepts or know where I can find inspiration on this?",AskEngineers,False,almightyjew,/r/AskEngineers/comments/frrjdn/multiple_variants_test_station_automation_concepts/
62,How can we help healthcare professionals during the COVID-19 outbreak?,1585576548,"Doctors and nurses are running out of PPE and essential medical equipment, is there anything we can do to help them? The last thing we need is our frontline falling sick. I've talked about some ideas here, but definitely open to more!

[https://youtu.be/JxTljY6mas8](https://youtu.be/JxTljY6mas8)",AskEngineers,False,crazymedusa,/r/AskEngineers/comments/frr8a9/how_can_we_help_healthcare_professionals_during/
63,The attitude of UAV using quaternion,1585574462,"Hello!

Currently, I am working on a project connected with the UAV control system. And I am using this scheme

[Current control scheme](https://cloud.mail.ru/public/382h/3wZeDvn1c) (matrix below in the red circle, this matrix multiply by angular velocities(omegas))

1  sr \* tp  cr \* tp

0     cr        -sr

0  sr / cp   cr / cp

cr = cos(roll)

tp = tg(pitch) 

sr = sin(roll\_

cp = cos(pitch)

as a result, this block (matrix\*omegas) recalculate angular velocities from body frame to euler

The main problem is cp and tp because they located in denominator and not able to be 0.

I want to ask, how to avoid this cos and tg in denominator?

I know, that I have to use quaternions, but I don't know how to use them in this case(if somebody can explain to me it will be great). 

Thanks!",AskEngineers,False,svam4ik,/r/AskEngineers/comments/frqoc7/the_attitude_of_uav_using_quaternion/
64,"Being that XRays of lungs can detect COVID and airports are shutdown, can TSA scanners be converted to detect COVID?",1585574459,,AskEngineers,False,whitedsepdivine,/r/AskEngineers/comments/frqob5/being_that_xrays_of_lungs_can_detect_covid_and/
65,Could anyone recommend some notes or videos that would steer me in the right direction about a control systems project,1585574018, I currently have a project in control systems that requires the modeling of a controller of a known plant so that the system (submarine) follows a target under conditions as to where it is facing and distance....i would appreciate if anyone could recommend some notes or videos that would steer me in the right direction as i cannot find the correlation between a PID controller and limitations as to the systems output. Thanks in advance:),AskEngineers,False,SteliosInferno,/r/AskEngineers/comments/frqkem/could_anyone_recommend_some_notes_or_videos_that/
66,Control Systems Project,1585573875,[removed],AskEngineers,False,SteliosInferno,/r/AskEngineers/comments/frqiyc/control_systems_project/
67,Question regarding a formula one engines efficiency claims.,1585573683,"So I was recently given an assignment in thermodynamics and it discussed Carnot engine etc and then progressed into doing research on formula one engines.

It got me thinking... formula one teams now claim that a formula 1 engine is up to 50% efficiency which is incredible. Although I do have one question, does the efficiency claim involve the use of utilising the exhaust temperature etc to generate electricity which is sent to motors that add additional power? 

As realistically I don’t doubt for one second that the engines are more efficient than previous years or your standard car engine. 

Although my thinking is the core engine is still exhausting a lot of useful energy.. let’s say it’s 30% efficient and by utilising the exhaust to create electricity of an additional 20% then that’s where they are getting the 50% from. 

So to speak it’s the formula 1 car as a package that is 50% efficient not the engine? Or am
I looking at this all wrong.",AskEngineers,False,bauterr,/r/AskEngineers/comments/frqh3p/question_regarding_a_formula_one_engines/
68,Engineering - Uni or Apprenticeship,1585570364,"Hi I'm currently in college in the UK and studying a Btec diploma in Engineering. Im not sure where to go after college though, whether to go with an apprenticeship or pay for University. Do any of you have any advice, I'm more interested in automotive and mechanical engineering but do jobs in these sectors require you to go to university? Any kind of information or advice on how you got into similar jobs would be great!",AskEngineers,False,EasterRS2,/r/AskEngineers/comments/frpo2s/engineering_uni_or_apprenticeship/
69,bearing shield choice for vacuum cleaner 2Z or 2R,1585568826,"hi 

i am rebuilding bearings in electric motor of the vacuum cleaner  


  
due to current corona-lockdown event it is far more convenient for me to get 2RSH shielded (rubber) bearings instead of 2Z

the original bearings had 2Z shields, so far i hadread the 2R shields better from the ingress of contaminants, but the original decision oem was 2Z why? longevity?  
so what do you think?  
is it really necessary to go with 2Z, well its high rpm and you could say high dust ingress problem  
no matter how good filter you have, there will always be abrasive airborne particles going trough motor.  


i am making this post since i am in lockdown and dont have anything else to dabble with

  
it is classic 1000w motor with turbine, this picture is for easier understanding, if perhaps someone is not familiar wit them  
 [https://builtinvacuum.com/graphics/motor%20callouts%20flat.jpg](https://builtinvacuum.com/graphics/motor%20callouts%20flat.jpg)",AskEngineers,False,Darth_Trumpf,/r/AskEngineers/comments/frpbft/bearing_shield_choice_for_vacuum_cleaner_2z_or_2r/
70,"Complex exp. Fourier series, finding x(t) when X(jw) is given as magnitude and phase plot",1585568059,"I'm watching Neso Academy series on Signals and Systems, and in one of the videos the problem is to find x(t) when magnitude and phase plot are given. The plot looks like [THIS](https://i.imgur.com/ywJEFv7.png), when he finishes calculation he gets 

4 + 4cos(3wt+pi/2) + 8cos(4wt-pi/2)

I understand the steps that are required to get this, but I don't understand why is it cosine? When you look at magnitude plot you have just 3 components: DC offset = 4 and 2 harmonics. 

As far as I know the values on magnitude plot represent sine value and phase plot represents just phase shift of that sine wave. Without doing anything but looking at the plot I would write following:

4 + 4sin(3wt+pi/2) + 8 sin(4wt-pi/2)

And it's completely wrong, why is it so?

BTW link to the [video](https://www.youtube.com/watch?v=14B-3mU66Rg&amp;ab_channel=NesoAcademy)",AskEngineers,False,Healow,/r/AskEngineers/comments/frp5co/complex_exp_fourier_series_finding_xt_when_xjw_is/
71,Is Environmental Engineering still viable?,1585567614,"Hello fellow Engineers,

I currently live in Finland and there is the Coronoa crap and hope it goes away soon.

Anyways I want to know is tehre a demand for Environmental Engineerins in modern days. I wish to work in many places, Germany, US, Egypt, Africa, etc...

As an Environmental Engineering, with master degree water sciences that includes fish farms, wetlands, fisheries and water physics

Where and how to apply in Finland and abroad, is Env. Engieering currently important or is the skills replaced by technology and other Engineering fields. What as an Environmental Engineer do I have to sell...I really dont know? Especially for the fact that my certificate came from a Unvierity of Applied Sciences and the fact I have little work experince, with few interships here and there.

Courses included, physics, math, economics, marketing, soil and morphology, GIS, water, waste water and waste management, Environmental Technology etc....

I want to recoginse what kind of skills can I sell as I dont know what companies want...I worked in alboratories, I worked in 3 countries, I worked with excel and a bit with data but nothing all that impressive.

Your thoughts",AskEngineers,False,abond0082,/r/AskEngineers/comments/frp1rd/is_environmental_engineering_still_viable/
72,Can emulsified oily water be separated?,1585566082,"Oily Water Help?

Well I’ve ran into an issue and an entire plant is halted until it’s solved. Hopefully you guys could help with separating oily sludge from water? 

The waste is collected from gapvac trucks (marine tank cleaners), through a set of solid boxes into a vacuum reservoir, then pumped through metal strainers into a baffled storage tank. From here water is pumped into a set of 5 frac tanks for discharge and the oil is pumped to a liquids package that is divided into 6 separate tanks with one tank as a hot water tank for our boiler. 

We can discharge some of the water, but here recently we run into black water/oily water pockets. I’ve done research, but I haven’t found a way to completely drop the water from the oil, eliminate the emulsion layer, and achieve a clear water for discharge. Any suggestions?",AskEngineers,False,OleGrizzy,/r/AskEngineers/comments/fropel/can_emulsified_oily_water_be_separated/
73,Oily Water Help?,1585565185,[removed],AskEngineers,False,OleGrizzy,/r/AskEngineers/comments/froivc/oily_water_help/
74,Looking for a 1-day online tutor for systems and control,1585564656,I am looking for someone to help me understand some systems and control problems online for 2 hours.,AskEngineers,False,dkwhwrkxekdlstod,/r/AskEngineers/comments/frof2b/looking_for_a_1day_online_tutor_for_systems_and/
75,"Pressure, humidity and temperature sensor + datalogger and alarm for pressure vessel",1585555444,"Hi,

I need to solve a tricky problem. I have a pressure vessel (with valves) and I need to measure pressure, humidity, and temperature. The measured data shall be stored in a data logger and accessible to download. The datalogger shall also have an alarm to indicate if any of the limits are exceeded or bellow. there will be around 30% overpressure against the atmospheric pressure, so the pressure probe shall be pretty accurate.

Do you have any suggestions for this? I am not able to find any solution in means of commercially available sensors+data logger",AskEngineers,False,DifficultSquash6,/r/AskEngineers/comments/frmqmc/pressure_humidity_and_temperature_sensor/
76,Confused about what to do,1585555324,"As mentioned in the title, I am confused about what to do next.

I am currently working in a big organisation as a Failure Analysis Engineer mainly dealing with Automobile ECUs. I have done my Bachelors in Mechanical Engineering and currently 9 months into my job. I want to study further but am unclear what to do?

I want to know what my options for Masters degree would comprise of? I was interested in Fracture Mechanics during my bachelors and wanted to know if there is any programme offering the course.

Thanks for your help in advance and pardon my grammar.",AskEngineers,False,morvolo_riddle,/r/AskEngineers/comments/frmpt5/confused_about_what_to_do/
77,Do engineers have free time?,1585554824,I'm a high school student that wants to be a mechanical engineer. I want to know if engineers are busy with work or do they have time for family and hobbies. Thanks :),AskEngineers,False,SupahColdIcee,/r/AskEngineers/comments/frmmkr/do_engineers_have_free_time/
78,Is it better to present problems to management where no solution exists (yet) or wait until a solution has been found?,1585554174,Especially if this problem means that they will continue to do the wrong thing or use the wrong information every day.,AskEngineers,False,EssentialEngineerign,/r/AskEngineers/comments/frmihv/is_it_better_to_present_problems_to_management/
79,Physics in engineering / programming,1585553920,I am currently a Canadian highly student looking into pursuing an engineering degree. My main concern at the moment is the difficulty of university level physics as my current physics teachers does projects based learning meaning we learn by doing and have no tests or anything. I feel like I don’t actually know how to do physics stuff. I am scared that I will not succeed with the physics lectures and the use of formulas etc. I also suck at programming but I’m trying to tell myself the reason why you’re going to uni is to learn how to and that there are probably other people who also don’t like programming.,AskEngineers,False,DuePerception5,/r/AskEngineers/comments/frmgyb/physics_in_engineering_programming/
80,0.3μm particulate medium for testing the effectiveness of COVID-19 face masks and filters?,1585553748,What would be a suitable substance for use as a test medium? Has to be inert and easily detectable. Preferably available in third world countries at low cost.,AskEngineers,False,mud_tug,/r/AskEngineers/comments/frmftu/03μm_particulate_medium_for_testing_the/
81,How to become a Game Developer ?,1585553384,[removed],AskEngineers,False,bcsexorg,/r/AskEngineers/comments/frmdcs/how_to_become_a_game_developer/
82,Could nuclear cargo shipping be possible?,1585552811,"I understand why putting small reactors in each ship isn't viable due to cost, not allowing docking, regulation, and increases in crew size. However if you build a very large ship and put a commercial gigawatt reactor in it you could ameliorate these issues. Running electric cables and doing ship to ship refueling but constant and with electricity seems plausible. Have ships with electric motors and some batteries to go 12 miles to dock and come back to international waters. Chain 10 ships together on both sides of the nuclear ship and cross oceans in a convoy. 

Searching on the internet I am getting a levelized cost of nuclear at ~90 dollars per MW/h and shipping fuel at $340/t gives a cost of ~85 dollars per MW/h. With a moderate carbon tax on shipping it seems viable.",AskEngineers,False,wtboriginalthought,/r/AskEngineers/comments/frm9mq/could_nuclear_cargo_shipping_be_possible/
