index,title,created_utc,selftext,subreddit,media_only,author,permalink
2,Calculating drag on a vehicle in a tunnel?,1548829738,"so, I've been reading about Hyperloop and Loop, which are both vehicles moving in tunnels. hyperloop pushing mach 1 or above (with a low density of air), and Loop roughly 150mph with standard temperature and pressure air. these vehicles are going to experience more drag per unit density in the tunnel compared to an open space, due to having ""pushback"" from the air against the tunnel wall as you pass. 

&amp;#x200B;

one thing I was wondering: if the Loop system had a vehicle that was 4ft diameter in their 12ft tunnel (passengers would have to be single file) how much additional drag would there be relative to open air? 

&amp;#x200B;

I sound this paper on the subject:

[paper](http://www.fem.unicamp.br/~phoenics/EM974/PROJETOS/PROJETOS%202%20SEM-13/TURMA%20A/G5%20-%20Deslocamento%20ar%20em%20tunel/(4)%20Referencias%20bibliograficas/Aerodynamic%20characteristics%20of%20a%20tube%20train.pdf)

but they never showed full density air vs a variable ""blockage ratio"" and I has having a hard time calculating it from their work.",AskEngineers,False,Cunninghams_right,/r/AskEngineers/comments/al9xe5/calculating_drag_on_a_vehicle_in_a_tunnel/
3,"For Rational Method, anyone know the Rubin coefficient (C) for gravel?",1548823336,Civil ,AskEngineers,False,cjpineda,/r/AskEngineers/comments/al93lq/for_rational_method_anyone_know_the_rubin/
4,1Watt can move 1Kg 1 meter (laterally on a frictionless surface)? Mainly asking so it is obvious exactly what 1Watt can theoretically do when powering a perfect machine. Thanks in advance!,1548823118,,AskEngineers,False,GOD_INFINITY,/r/AskEngineers/comments/al92k0/1watt_can_move_1kg_1_meter_laterally_on_a/
5,Do you have any ideas for a functioning prototype?,1548821486,"Aerospace student from Mexico here, recently got notified I have free choice final project for this semester (3 months to make it work).

It can involved any discipline required p.e. electronics, structural mechanics, aerodynamics etc. 

 I'd like to see if anyone has a challenging idea, personally I like to learn a lot from making functioning prototypes so, if you have something in mind I'm eager to hear your thoughts.",AskEngineers,False,SherlockHoles,/r/AskEngineers/comments/al8um1/do_you_have_any_ideas_for_a_functioning_prototype/
6,No Transmission on cars ?,1548821250,Hey guys I wanted to know if it would be better to get rid of the transmission and just replace it with a electric motor  on the rear end and have the engine spin a generator that way you would have instant torque at all time with no slipping.  ,AskEngineers,False,wtfaistp,/r/AskEngineers/comments/al8tf5/no_transmission_on_cars/
7,"1N of force applied to 1kg mass to move it 1 meter (laterally, no friction) transfers 1 joule of energy to the 1kg mass. That is known as a ""newton meter"". If happens in 1 second, that is a ""joule second"", which is also 1 watt. Correct?",1548820818,,AskEngineers,False,GOD_INFINITY,/r/AskEngineers/comments/al8r4f/1n_of_force_applied_to_1kg_mass_to_move_it_1/
8,Need some advice if I should drop my math minor,1548820456,"I'm a Mechanical Engineering student on my last semester. Currently, I'm taking my last math course to finish my minor. The course is Modern Geometry and its not something that I'm really interested in as its very proof heavy. Also, my gpa will drop if I don't do good in the class. 

Is a math minor something that employers look for, or will it factor in my future job applications?

P.S. I'm not going to grad school. My school requires two extra math courses for a math minor. One of which I have taken already. ",AskEngineers,False,allhailthechow,/r/AskEngineers/comments/al8p94/need_some_advice_if_i_should_drop_my_math_minor/
9,"Civil/Environmental Engineers who have done water research, What kind of work did you do? What sort of systems did you work with at the beginning, and what kind of work do you do now?",1548817664,Let’s discuss,AskEngineers,False,sammyboy854,/r/AskEngineers/comments/al8agn/civilenvironmental_engineers_who_have_done_water/
10,"Civil/Environmental Engineers who have done water research, what kind of work did you do? What were the responsibilities you had starting at the bottom? And where have you gone with that?",1548817043,Let’s discuss this guys!,AskEngineers,False,sammyboy854,/r/AskEngineers/comments/al8712/civilenvironmental_engineers_who_have_done_water/
11,Need help understanding Tube/pipe scheduling (need thinest wall possible),1548815454,"I am trying to order 0.75in (19mm) OD tube with the thinest wall thickness reasonably available. I found [0.028"" on grainger.](https://www.grainger.com/product/GRAINGER-APPROVED-3-ft-Welded-304-Stainless-31TT41?searchBar=true&amp;searchQuery=31tt41) I would like to know if there are charts available showing OD and WALL. I want the thinest i can find, maybe 0.010""... Thanks for the help. I know what I want, just not how to ask the question. ",AskEngineers,False,nomoreimfull,/r/AskEngineers/comments/al7yg7/need_help_understanding_tubepipe_scheduling_need/
12,Challenging project ideas?,1548815136,[removed],AskEngineers,False,SherlockHoles,/r/AskEngineers/comments/al7wn7/challenging_project_ideas/
13,What are some questions an interviewer might ask about wireless industry standards or baseband signal processing algorithms at the PHY and MAC layers?,1548814173,"I have an interview coming up and these were the two main topics I was told are ""nice to have"". The position is for a new bachelor's graduate/someone with little experience which is what I am. I don't have any experience in the wireless space so I was hoping maybe you guys could help me come up with some basic information I should know.",AskEngineers,False,prettyborrring,/r/AskEngineers/comments/al7rev/what_are_some_questions_an_interviewer_might_ask/
14,Where can I fin the longevity of car parts?,1548810850,Does someone know of a source where I could find how long some car parts can last? I am looking for something like a handbook or a catalog to do a project.,AskEngineers,False,emcry,/r/AskEngineers/comments/al79b4/where_can_i_fin_the_longevity_of_car_parts/
15,Is it feasible to apply interframe lossy compression with Long GOP to non-demosaiced RAW motion picture footage?,1548806672,"I read a 2009 research paper on the idea of applying lossy compression to non-demosaiced color values from a camera that uses the Bayer CFA. The link to the paper is below:

https://arxiv.org/pdf/0903.2272.pdf

The paper proposed this idea to make more efficient use of storage space. It did not mention the idea of applying interframe compression with Long GOP (group of pictures). I know the Red Cinema cameras uses lossy compression on its RAW format. I also know Long GOP raises the quantity of calculations required for coding and decoding.

If the codec is HEVC then it's possible to use 12 bits per channel for Long GOP but 14 or 16 bits only allows intra frame. If the device is very small, then it's only feasible to use 12 bit ADC. A workaround is to use logarithmic or gamma compressed ADC.

Is applying Long GOP feasible for non-demosaiced images? Why or why not? What issues must be dealt with besides the increase in computing requirements?",AskEngineers,False,cpu5555,/r/AskEngineers/comments/al6lgd/is_it_feasible_to_apply_interframe_lossy/
16,What are some good dissertation research topics for CDM Regs?,1548804744,"Doing my dissertation on CDM Regs, just wondering if any of you have any good research topics relating to CDM regs??",AskEngineers,False,dispit5,/r/AskEngineers/comments/al6aj0/what_are_some_good_dissertation_research_topics/
17,"SASE, SWE, AICHE, Theta Tau... What organization should I join that will better my career prospects/opportunities as a chemical engineer?",1548802298,"I am a 2nd year chemical engineering major and I currently do undergraduate research. What engineering organization should I join that will help me make valuable connections, build my skill set, and get the most involved?

&amp;#x200B;

\-SWE (Society of Women Engineers) and SASE (Society of Asian Scientists and Engineers) are the most active of the organizations at my school. 

\-AICHE is smaller and not as well organized/established. 

\-Theta Tau is mainly mechanical and civil engineers. They don't have any chemical engineers at the moment.

\-SHPE (Society of Hispanic Professional Engineers) or NSBE (National Society of Black Engineers) although I am not Hispanic nor Black?

&amp;#x200B;

Which org is most beneficial for my career trajectory (reputation, connections, resources, name recognition... etc.)? And how do I make the most out of being a part of these organizations on campus?",AskEngineers,False,fuelcellsfuelsells,/r/AskEngineers/comments/al5vg8/sase_swe_aiche_theta_tau_what_organization_should/
18,Masters in Engineering Management or MBA?,1548801466,If I want to move into upper management,AskEngineers,False,mard-e-momin,/r/AskEngineers/comments/al5q5q/masters_in_engineering_management_or_mba/
19,Increase in air pressure from suspended particles during dust storms?,1548801092,"I am working on a project that needs to estimate wind pressure on a structure during a dust storm. I have been looking for estimates of atmospheric density during dust storms, but have come up empty. If suspended particles increase the overall density of the air, how can I relate this to an increase in wind pressure? Are there basic design cases used around the world?",AskEngineers,False,RealDiels,/r/AskEngineers/comments/al5nrs/increase_in_air_pressure_from_suspended_particles/
20,Electrical Engineering and being Transgender,1548801055,"I think I'm transgender, and I would like to know if being transgender will kill my career in engineering before I come out of the closet. 

&amp;#x200B;

I'm 23, majoring in Electrical Engineering and minoring in Computer Engineering and I'm going to graduate in March.",AskEngineers,False,TRANS_ENGINEER,/r/AskEngineers/comments/al5nju/electrical_engineering_and_being_transgender/
21,Where do you start with idea for a prototype?,1548799009,"Hello!

I recently have come up with an idea or variation (of something that already exists), that is basically a ring with bluetooth capability through a pressed button. I have tried doing some research on reddit and google but it is very complicated to understand from a non engineering mindset. I'm talking about getting this project started because its something I'm passionate about but people are saying the costs are upwards of 5k or 10k just to get something that works. Is it a better bet to get a dummy prototype that just lays out the design and then move on to pitching to investors? Or is there a better way? ",AskEngineers,False,DrowningWater33,/r/AskEngineers/comments/al5a9e/where_do_you_start_with_idea_for_a_prototype/
22,Should I study a BEng even though I would like to work in a technician role?,1548798360,"I'd like to study electrical engineering but i'm not sure as to whether i should go to college and study there for 2 years (which would earn me a HNC/ HND (UK), equivalent to an associates degree in the USA (i think)), or go to university and spend 4 years completing a BEng. I would like my next job to be working as a wind turbine technician.

I can definitely see myself moving into design and innovation within the wind energy sector, and into a variety of other fields (like solar or hydro, and i'd like to work in providing/ distributing power within developing countries eventually), but the main reason for wanting to study it at degree level is that i absolutely LOVE the subject (i was enrolled in college last year but had to withdraw for a personal reason) and studying it at degree level would mean that i'd gain a much stronger, deeper understanding of the subject.

On the other hand, i'm still young (22 and i already have a degree in a non-engineering field), it might be too big a jump into engineering, and perhaps i should study at college, then work, and then go to university to build on that knowledge i've gained through practical working experience. I'd also like to know, might having a degree have a negative impact on my application when applying for a technician role given that i'm arguably ""over-qualified"" - i personally don't think it would but i've heard others say that it could. Additionally, i've heard that electrical engineering at degree level veers to the design side, whereas at college you're taught the subject on a more practical sense, so having a degree might not even prepare you for a practical role (though i suppose that's the case for ANY job, you always need to be trained wherever you are).

The thing is, i am currently working a fantastic job in the renewable energy sector (specifically, recycling and waste treatment) and i'm pretty sure my employer would be willing to let me go to university (there's a university which provide a part-time degree requiring attendance of one day per week) since the degree would actually be of benefit to my work. Given that i've already had my full-time university experience, i cannot do full-time again (i have to and want to work), so part-time is my only option, this seems to me like the only possible chance i'm ever going to get to go for the BEng.",AskEngineers,False,joshuagordon99,/r/AskEngineers/comments/al562w/should_i_study_a_beng_even_though_i_would_like_to/
23,Engineering Ladder,1548797275,[removed],AskEngineers,False,Engineeryman,/r/AskEngineers/comments/al4yzk/engineering_ladder/
24,How common are entry-level international engineering positions? What's the process like?,1548796595,I am an Undergraduate Mechanical Engineering student and research assistant who is in their Junior year here in the U.S. My fiance is in her senior year at her school and is planning on going to Scotland to get her masters and Ph.D. I am trying to explore my options for either Job opportunities or post-graduate educational opportunities. The problem I have is that she is looking at 3-4 years total and I will need to start working in a full-time position soon so that I can pay off my undergraduate loans on top of whatever money I would need to take out if I did a masters degree also. I haven't found any clear information on what types of positions are out there that are willing to hire someone who is staying only on a visa and what to look out for. Does anyone have experience working as an Engineer Internationally? If so what advice can you offer? Any guidance is much appreciated!,AskEngineers,False,lilloftis,/r/AskEngineers/comments/al4uq0/how_common_are_entrylevel_international/
25,Am I being exposed to X-Rays living above a dentist office?,1548792964,"I recently attended a hazmat operations course for my work (public safety field) and received a lot of information about radiation. We talked about the different types that cause damage to our health - especially over continued exposure times. Of course, the instructor mentioned X-Rays and gamma rays and that these types of rays can penetrate certain materials.

I live in an apartment above a relatively busy dentist office. It seems that dental x-rays are more ""targeted"" and that they're only on when they're being used. But I was curious if I was possibly being exposed to even a small amount of rads that over time could possibly cause health issues. Thanks for the help.
",AskEngineers,False,gruss577,/r/AskEngineers/comments/al46so/am_i_being_exposed_to_xrays_living_above_a/
26,Why cant you drill trough a weld?,1548791522,Doing some modifications where we have to  field drill and bolt up to an existing structure. Some holes are aligned with a weld and now we got a whole new run around. I'snt  the weld supposed to be stronger that the base metal anyway?,AskEngineers,False,chikkichakka,/r/AskEngineers/comments/al3x73/why_cant_you_drill_trough_a_weld/
27,HVAC systems project and design. Autocad vs Revit?,1548790847,"So I saw a post here a couple months ago that got me really interested in trying out Revit.

 I started my career earlier this summer, and I'm currently working on hvac.

 When I started at my company, I got put straight away on autocad 2d design and manual calculation of pressure drops, drafts, air concentrations, etc...

Is revit the best solution to this type of work? Would i gain an advantage if I start to learn how to master revit? Is it able to provide the 2D floor plans of my design with the same Autocad layouts (legal obligation in my country)? Is there any function added to Revit in regards to load calculation/thermals and flow simulation? 

In college I got really good at 3D modelling with Autodesk Inventor and SW, and I would much rather do that than design 2d like i am right now. ",AskEngineers,False,lmc11brg,/r/AskEngineers/comments/al3sq0/hvac_systems_project_and_design_autocad_vs_revit/
28,I Am In Need of Some Advice,1548790289,"I'm a senior in highschool, and have narrowed my college choices down to two colleges: Ohio State and Case Western Reserve.

I intend on majoring in mechanical engineering as an undergrad and then proceed into nuclear engineering. My problem is deciding which school to go to. 

At Case, I feel like I could get a more personal education and better research opportunities, but Ohio State offers a minor in nuclear engineering which could be beneficial. 

I guess my question is where would you choose and why. I'm looking into every aspect I can and would like to get actual engineers inputs. Thanks in advance. ",AskEngineers,False,S0rtah,/r/AskEngineers/comments/al3ozp/i_am_in_need_of_some_advice/
29,"Question from a High School Student: How do we pick an engineering program that emphasizes ""making things"" over ""research?""",1548789257,"My 15 year old brother is a high school sophomore who is interested in pursuing engineering with the goal of working in the aerospace engineering. Since my family has no background in engineering, do you mind if I asked a few questions here? He's read articles and advice columns, listened to podcasts, and spoke with an engineering graduate, but we have more specific questions we're not sure how to word:

My brother is more interested in ""making things"" instead of ""conducting research"" and pursuing a graduate degree. The idea of working in a machine shop is more appealing to him. However, in the process of conducting research on colleges, we've found that engineering programs tend to brag about their research opportunities instead of machine shops, teams that build vehicles, and rockets, and other offerings that ""make things.""

Are we missing something? How can we identify colleges that best support his interest of making things instead of conducting research? Is conducting research something all engineering students should pursue?

Or is our idea of ""research"" wrong? Can research also involve ""making things?"" If so, what are some examples?

Thank you for your time! We sincerely appreciate it. :)",AskEngineers,False,notbidoofin,/r/AskEngineers/comments/al3i4l/question_from_a_high_school_student_how_do_we/
30,How far can you progress in a company without going into management?,1548786226,"I don’t want to get stuck in a position, but I don’t want to get into management because I like the hands on engineering work.

Do any of you have any experiences where you’ve been able to stay valuable enough that a company will keep shoving out money for you (other than just yearly cost of living increases) and just give you more responsibilities? 

Or is the only true way to succeed in engineering without management level, is to go off on your own starting a company or developing a product?",AskEngineers,False,stumped711,/r/AskEngineers/comments/al2xs4/how_far_can_you_progress_in_a_company_without/
31,What resources have you utilized or actions have you taken to go to the next level?,1548784999,"Looking to take my knowledge and experience to the next level by becoming a “better” electrical engineer. I’m about 5 years into my career. I want to stand out at as employee, progress my career for a better position and more money or a possibly a more interesting and challenging job elsewhere. Just be an overall more valuable asset in the field of engineering. I’m electrical but I imagine a lot of of these translate across disciplines.

What have you all done to go from a nobody in the field to a somebody?

Below are some of my initial thoughts, and I want to know if you have suggestions to add or would advocate for one over another because of an experience you had:

Do home projects 

Higher education (masters/certificates)

Inventing/patent

Specific Books/websites/ YouTube channels?

Networking with higher level engineers

Figure out a specific specialization",AskEngineers,False,stumped711,/r/AskEngineers/comments/al2pio/what_resources_have_you_utilized_or_actions_have/
32,Why does my car exclude coasting in it's MPG calculation?,1548783265,"I'm trying to understand if there is some mathematical or engineering reason for this, or if it's just a poor design. This might be more of a mathematics question, but I asked it here because I thought an engineer's perspective might be useful.

On a 2012 Dodge Caravan I found it was actually driving about 50% farther than the MPG and DTE suggest. With more testing I noticed that it was not including the mileage when I'm coasting down a hill and not actually using fuel. I can reproduce the problem by resetting the average MPG at the top of a hill, the average will say 0 MPG the whole way down until it gets a reading below 99 to use in it's average calculation. If I reset the MPG going up the hill, it immediately starts calculating the new MPG.

This throws off the MPG significantly where I live because it is a very hilly area. There are more hills than flat space, so the car is constantly either climbing a hill or coasting down it. The car says it gets 19 MPG average, but counting the miles I actually drive it's getting closer to 30.

I know the car is technically getting more than 99 MPG when coasting down a hill, but isn't using 99 more accurate than just tossing the number completely?",AskEngineers,False,jandsm5321,/r/AskEngineers/comments/al2eae/why_does_my_car_exclude_coasting_in_its_mpg/
33,"Engineers who went from entry-level technical role to an Executive level role, what was your career path like?",1548779479,,AskEngineers,False,vegan-crossfitter,/r/AskEngineers/comments/al1qb1/engineers_who_went_from_entrylevel_technical_role/
34,Whats the future like for R&amp;D engineers in terms of job stability and salary?,1548779053,"I'd like to know if research and development as a field for engineers is safe to get into? By safe I mean job stability and of course salary increments.

Or is it a stale market and I shouldn't get into it? ",AskEngineers,False,10PsP01,/r/AskEngineers/comments/al1no9/whats_the_future_like_for_rd_engineers_in_terms/
35,Opposed Caterpillar Puller Balance,1548777308,"There is a machine at work that pulls a linear part out of an extrusion process. It consists of an upper and lower caterpillar consisting of a chain with rubber cleats mounted to every other set of links. Each cat is driven by a VFD in a master/slave configuration. The cats are load balanced by setting a speed ratio on the slave. A coworker and I are trying to figure out why changing cleats on one cat that differ in height would cause a load imbalance. 

Initially, I assumed that the effect was like changing the rolling diameter of a tire on a car. My coworker pointed out that this shouldn’t make a difference because the cleats are mounted to a chain and since the speed of the chain that the cleats are mounted to doesn’t change there isn’t a change in the speed of the pulling surfaces of the cat. That makes sense. What could explain a load imbalance between the cats with differing cleats on the top and bottom?",AskEngineers,False,Dannicus80,/r/AskEngineers/comments/al1csk/opposed_caterpillar_puller_balance/
36,How do I tell my boss I have no ambition of getting my PE?,1548776623,"I got my engineering degree because ""you can do anything with that"" and I knew I wasn't engineering material. I got a lab job which is something I enjoy, but my boss has a new boss who saw that I have my EIT certificate and wants to transition me to work towards PE licensure. He's a really great guy and I think his motivations are equally for my own good and also to be able to add one more PE to his team. I'm not cut out for that, and I wouldn't want that responsibility anyway.",AskEngineers,False,Captain_Japan22,/r/AskEngineers/comments/al18ln/how_do_i_tell_my_boss_i_have_no_ambition_of/
37,Looking for a precise inductive distance sensor,1548774640,"It's for a project I'm working on and all the ones I found don't offer the accuracy I need for my task.

Measurement distance should be around 0mm-8mm with an error of +0.00X mm and -0.00X mm.

Is there something fitting for me or is that accuracy impossible due to the inner workings?",AskEngineers,False,HeisZoidberg,/r/AskEngineers/comments/al0won/looking_for_a_precise_inductive_distance_sensor/
38,"Why is the axial pitch of a spur gear infinite, not zero?",1548774538,,AskEngineers,False,Akainu18448,/r/AskEngineers/comments/al0w41/why_is_the_axial_pitch_of_a_spur_gear_infinite/
