index,title,created_utc,selftext,subreddit,media_only,author,permalink
9,Maximum Power Theorem - why is maximum power of the load only 50% of power source?,1572624019,"Maximum Power Theorem states that maximum possible power transferred to the load is only 50%. And that is only possible when the R internal and R load are equal. Why is this so? When we plug in the formula for voltage divider we see that only half of power source's voltage is applied to load. If we increase load's resistance we will get greater voltage drop across it and greater current, which will increase total power percentage consumed by the load. I'm pretty sure that it is possible to achieve more than 50% efficiency and I can't find the answer for what this theorem actually stands for. I know that if we differentiate power expression we would get peak when Ri=Rp, but I want some more intuitive explanation of this.

Thanks.",AskEngineers,False,Healow,/r/AskEngineers/comments/dq674s/maximum_power_theorem_why_is_maximum_power_of_the/
10,Masters Selection: Engineering Management vs. General Engineering vs. Specific Discipline,1572622528,"I have a bachelors in chemical engineering and have been working as a process engineer for about a year. Now that I have a relatively stable grasp on the work I am doing, I want to apply to a masters program. I am going to try online so that I can continue to work while I do this (3-6 credits/semester) and also keep moving toward my license. I know that I want to move into some kind of management far in the future. My career goal is either to be a plant manager or president/vice president of an engineering company. 

One idea I was looking into doing a masters in Chemical Engineering (specific discipline), but I keep going told that a masters just leads to more technical work. I am fine with now, but I do not want to work in this for my entire career. A second idea that I have been looking at is getting a masters in General Engineering. I never really liked the idea before, but I may use this to accumulate more expertise for the and also give a broader view since I know little about the other engineering disciplines. The last idea I was looking at is the Engineering Management masters. I do not think that this will help me in the short term and this makes me slightly wary, but my boss seemed helpful when I told him that my goal was in management and said if learning opportunities come up that he would let me know. 

Also, I do not mind having to get a second masters as long as I can continue to work while I do through it. But, I really do not know if any of these ideas would even be the best to lead into management. Any help or advice is greatly appreciated.",AskEngineers,False,ThyAlbinoRyno,/r/AskEngineers/comments/dq5us4/masters_selection_engineering_management_vs/
11,(Career) What to do as an Engineering Consultant without a project?,1572619228,"I started this job about three months ago as a Mechanical Project Engineer for a company that contracts their engineers to other companies, normally in the oil and gas industries. I’m salaried, so no matter what I get paid at the end of the week, but so far I haven’t been given any projects. I’ve assisted others with reports and drawings here and there but I myself don’t have anything yet. I know my boss has submitted my “resume” (inter company resume, not my professional one) to at least one company but they haven’t responded. 


Basically more often than not I do nothing all day. I read up on old projects others have done sometimes, and I’ll send emails asking if they have anything for me to help with or anything I can read, but lately there hasn’t been anything. And because most people are contracted out there really aren’t many people actually working on my floor in the office for me to learn from. 


What can I do to fill my days? I’m worried that I enjoy being on reddit and my phone all day too much but I really need this job and want to do well. I just don’t even know where to start.",AskEngineers,False,RoboDonaldUpgrade,/r/AskEngineers/comments/dq54j8/career_what_to_do_as_an_engineering_consultant/
12,MEP engineers - who checks your work?,1572617520,"MEP engineers, do you only self check, or another engineer peer review your work?",AskEngineers,False,Summoner322,/r/AskEngineers/comments/dq4rh0/mep_engineers_who_checks_your_work/
13,P.E. Mechanical vs. P.E. Environmental,1572617436,"P.E. Environmental vs. P.E. Mechanical

Hi all, I’m new to the thread. I hope some of you could share your opinions on a question I have. 

I don’t have a P.E. And I haven’t taken the F.E.  I have a B.S. in civil engineering and an M.S. in water, sanitation, and hygiene engineering. I did not really enjoy most of civil engineering except environmental - my passion is water. 

I’m currently in the water disinfection equipment manufacturing industry, heavily on the mechanical side.  I’ve learned I enjoy the mechanical side a lot. 

I want to earn my P.E. License. 

What are career prospects for an Environmental P.E. vs a Mechanical P.E.?
I live in the greater NYC area. 

Also, I’m earning $70k, which I think is low considering my qualifications and the region I’m in.  What do you think?",AskEngineers,False,amerilady,/r/AskEngineers/comments/dq4qtx/pe_mechanical_vs_pe_environmental/
14,Can someone explain to me in simple English without the corporate jargon,1572615377,"A hiring company wrote this for the job profile. can anyone explain without the corporate jargon it has?

 

***Purpose:*** *Implement company’s service standards &amp; policies at dealerships to improve customer satisfaction in assigned territories &amp;  improve business.*

***Role Description:*** 

***1****. Dealer Business growth &amp; profitability:*

*a) Improve service business of dealer by taking counter measures to increase free service redemption and overall service inflow.*

*b) To improve service operational efficiency in workshop to improve profitability.*

*c) Diagnose critical technical issues.*

*d) Sale of Service business enabling instruments like  Assurance penetration etc.*

***2****. Improve CSI Score:*

*a) Improve CSI through service process audit &amp; take corrective actions to improve service standards at dealership.* 

*b) Improve the capability level of dealer’s service team and give on the job training in areas of product knowledge, service repair standards, special tools, customer handling skills&amp; customer satisfaction, updating of knowledge through SIB.*

*c) Recover dissatisfied customers &amp; take corrective actions.*

*d) Implement recall policies as applicable.*

***3****. Product Quality*  
*a) Product feedback to be given regularly to HO   to improve product quality.*

***4****. People Effectiveness:*  
*1) Ensure the availability of trained manpower across the network*  
*2) Control attrition*",AskEngineers,False,big_daddy_007,/r/AskEngineers/comments/dq4brc/can_someone_explain_to_me_in_simple_english/
15,Design considerations for manufacturing facility with large quantities of flammables (Ethanol)?,1572614732,"So I've been asked to look into facility that process large quantities of marijuana and performs extractions using Ethyl Alcohol. Now, I've worked on similar projects, but never as automated and never with the quantities this one is going to employ (&gt;12,000 gallons). My initial design probably wouldn't differ too much from a small, standard extraction lab in that I'd follow NFPA 30 guidelines for storage and NFPA 69 for with my explosion prevention system (mostly gas sensors to increase ventilation and limiting any spark causing appliances). 

My additional suggestions for a facility like this would probably be to look at where providing a minimum of 6 ACH where the ethanol is being pumped per NFPA 497 and probably design a drip pan/leak detection system to shut it down in the event of a leak.  Beyond that, I'm not sure if there's something I'm missing regarding the best design practices or potential code requirements for a facility like this since the scale is so much larger than my previous experience where they typically moved a few gallons at a time by hand. Because of that, any suggestions for design manuals or code references to read thought would be appreciated!

&amp;#x200B;

Tl;Dr: They're pumping a lot of flammable material through a building, what should I look into apart from the IFC, NFPA 30 &amp; 69?",AskEngineers,False,DenverEngineer,/r/AskEngineers/comments/dq4774/design_considerations_for_manufacturing_facility/
16,Transformer single phase 230V question,1572612977,"I'm in the US and we have a 208V supply.  We have a European piece of equipment that calls for 230V +/- 10V, single phase.  

I contacted the manufacturer and he specified that a split phase system (no neutral) will cause our machine to act erroneously and that 208V is too low.

We have a step up transformer to 230.  The Inlet nodes are the two 120v lines from the panel.  How can I wire it to be single phase 230v?  As it stands now, I'll have 2 hot leads coming out of the secondary.  There is no neutral tap in this transformer.

I can bond either node to earth/ground, correct?  I've been told this, but I'm unable to find that written in code anywhere.",AskEngineers,False,schismtomynism,/r/AskEngineers/comments/dq3v10/transformer_single_phase_230v_question/
17,Ozone as an energy source?,1572611012,"
Would an engine that electrically generates ozone from the oxygen in air then uses it as fuel be efficient or possible? (This is not a Newtonian question – we’re talking chemical reaction not conservation of energy.)
Or what if ozone was used as an additive to the air intake for possible better fuel mileage on gas vehicles? (Those electric arc lighters produce ozone and are marketed as being wind proof so I wonder if an arc were safely maintained within the air intake if that would provide any boost?)


Ozone will combust in certain concentrations and even when in a solution of water if temperature is raised to the combustion temperature (which is quite low.)


As for the use of ozone as an energy source I believe the safest way to do so would be to make it on the fly and not store any amount that is not immediately used because it is a strong oxidizer and unstable.
Years ago I remember using a small van der graaf generator and recall that particular smell of ozone that is emitted while it runs. It doesn’t take long — maybe just a few seconds before I could smell the ozone in the air after turning on the machine. Also, with those electric arc lighters you can smell ozone being generated when you use. 


So ultimately I’m asking: would it be possible to use a mix of ozone and air as the source of combustion inside an internal combustion engine? Or what about an ozone and water solution plus air for use as combustion source for combustion engines? What would be the byproduct of this?


Ozone as energy source for electric automobiles, jets, air planes etc?



#Disclaimer: If you’re reading this please do not try at home. Ozone is dangerous at certain concentrations.",AskEngineers,False,StevanWhite,/r/AskEngineers/comments/dq3i2u/ozone_as_an_energy_source/
18,Failure Friday (01 November 2019): Did you break something recently? We want to hear about it!,1572606303,"Today's thread is for all the recent explosions, broken parts, vendor headaches, and safety violations at your workplace. If nothing exciting happened at your workplace this week, we also take stories about terrible management and office pranks on the interns.

&gt; [[Archive of past threads]](https://www.reddit.com/r/AskEngineers/search?q=failure+friday&amp;restrict_sr=on&amp;sort=new&amp;t=all)

Here are some good stories from past threads:

  1. [*""That day when your boss almost dies""*](https://www.reddit.com/r/engineering/comments/1o1qpr/that_day_when_your_boss_almost_dies/)

  1. [/u/DoctorWhoToYou talks about his time as the Maintenance Manager at a Tier 1 automotive supplier in the mid-90s](https://www.reddit.com/r/AskEngineers/comments/39kp18/failure_friday_june_12_2015_did_you_break/cs4pe6e)

  1. [/u/Hiddencamper talks about that one time when the Emergency Trip System didn't work right at a BWR nuclear power plant](https://www.reddit.com/r/AskEngineers/comments/37plk5/failure_friday_may_29_2015_did_you_break/crp3zsn)

### Guidelines

* **Please share without revealing your identity or workplace, or violating your security clearance!** [We assume no responsibility](https://www.reddit.com/r/AskEngineers/wiki/rules#wiki_legal_disclaimer) for anything that results from your writing here.

* Pictures are welcome, but please include a story to go with it.",AskEngineers,False,AutoModerator,/r/AskEngineers/comments/dq2piq/failure_friday_01_november_2019_did_you_break/
19,"Except for pi, e and sqrt(g): What else can be ""confidently"" estimated as being equal to 3?",1572605701,,AskEngineers,False,cabaaa,/r/AskEngineers/comments/dq2m4s/except_for_pi_e_and_sqrtg_what_else_can_be/
20,"What is the optimal distance senor for me (20 - 200 mm measuring range, precision of +- 0,1 mm is enough)?",1572600888,"I would have attached a picture but unfortunately this is not possible. So here we go:

As my bachelor thesis I build a machine which can be used to scan the inner contour of prosthesis shafts. I m using a laser distance sensor (OWLG AE S2) within a movable bracket to take the measurements and hence calculate the coordination of a measured point. The problem is that I'm only able to measure average size shafts due to the 22 - 120 mm measurement range of my sensor. Preferably I would like to use a sensor which is smaller and has a range of about 20 - 200 mm. It does not have to be a laser sensor and it can be much less precise than the current one. A precision of +- 0,1 mm is accurate enough. I searched for TOF Sensors or infra red sensors but could not really find something. Does anyone have an idea?",AskEngineers,False,freezyAndHaze,/r/AskEngineers/comments/dq1xke/what_is_the_optimal_distance_senor_for_me_20_200/
21,Large Scale Hydronic Heating and Piping/Fluid Flow Reference Needed,1572590262,"My work has me designing Hydronic Heating systems for commercial greenhouses. We use heated water running through steel pipe as the only source of heat input to the greenhouses. The pipes run along the roof and walls and each heating loop are often ~200m(~650ft), and on larger projects, there can be hundreds of heating loops in different zines.

I'm looking for a reference that I can use to help me calculate how much heat is output from the pipes for known water temperatures, and what flow rate is needed to achieve the required heat output. I also need a reference for determining optimal pipe size, pressure drop, fluid flow etc. 

My company has had methods for determining this but the reference textbook is in German and there isn't a translated version, and we're too busy for in house training to occur. There are excel calculators but no documentation or references. 

Any help is much appreciated.",AskEngineers,False,Kynd9,/r/AskEngineers/comments/dq0kpr/large_scale_hydronic_heating_and_pipingfluid_flow/
22,Electrical Enginners: Do you use solidworks electrical?,1572581821,I'm putting out feelers to get an idea of whether or not solidworks electrical is prevalent in industry. If you don't what do you use?,AskEngineers,False,Braeden151,/r/AskEngineers/comments/dpzcvb/electrical_enginners_do_you_use_solidworks/
23,Does such job exists?,1572581702,,AskEngineers,False,iamgayafoo,/r/AskEngineers/comments/dpzc9l/does_such_job_exists/
24,Meeting with a university IE advisor committee tomorrow for lunch. Anything to keep in mind? Things to ask?,1572579439,Title. Sorry this is the first time I've been invited into something like this and I'm kinda nervous. I was mainly invited because someone who will be there is an IE in the auto industry (my interest) and an advisor there wanted me to talk to him. Honestly I'm not too sure what I would be able to talk about with the committee.,AskEngineers,False,cswaloft,/r/AskEngineers/comments/dpyy7d/meeting_with_a_university_ie_advisor_committee/
25,Bachelors in Mechanical or Mechatronics?,1572579099,"I am currently in a dilemma as to what type of Engineering I should specialize into in my university.

For some context I am a freshman currently taking an engineering course which takes 4 years to complete, with the first year focusing on the fundamentals of all the types of engineering specializations my university offers (e.g. programming, mechanics, design, electricity, mathematics, material science etc), whereas the 2nd year is where we decide to choose what type of engineering to specialize into for the rest of our degree.

My university offers Mechatronics engineering, along with Mechanical Engineering as their own specializations. I have always wanted to go through the Mechatronics route as it seems more appealing to me, but I have been told many conflicting answers with choosing Mechatronics being either beneficial or detrimental to my job opportunities once I head out of university. 

Another thing which has made me unsure of what to choose out of the 2 specializations are the courses they teach in the 2nd-4th years. Mechanical teaches the usual in-depth courses in the Mechanical Engineering Field, whereas Mechatronics  sacrifices *some* subjects in Design and Manufacturing, Thermofluids and thermal Engineering for software design, analog/digital circuit design and sensors &amp; actuators in the 3rd year.  The overall feel I am getting from this is that getting a Bachelors in Mechatronics gears me up to become more of a generalist, rather than becoming a true specialist in an engineering field like mechanical engineering. Does this truly affect me in the long run?

It would be great if I got some insights from people in the work force, or who were in a similar situation as me. I am fairly open to answer any questions regarding the course if you need for information. Thanks.",AskEngineers,False,MycroMlTH,/r/AskEngineers/comments/dpyw0z/bachelors_in_mechanical_or_mechatronics/
26,When do I know that I am a skilled engineer?,1572579012,I am currently a third year undergraduate student in mechanical engineering  and I would like to know if it is possible to be an expert by the time I finish my master's?,AskEngineers,False,iamgayafoo,/r/AskEngineers/comments/dpyvgh/when_do_i_know_that_i_am_a_skilled_engineer/
27,How hard is to get into the aerospace and defense industry in engineering?,1572578729," How hard is it to get an engineering job at a defense contractor? I am interested in getting a job at one of the big defense contractors. Lockheed Martin, Raytheon, Northrup Grumman, or Boeing. I have applied to a few engineering positions. I have a bachelor of science in electrical engineering technology with a GPA of 3.6 and graduated this past May of 2019. I live in Vermont and took a technician position here out of convenience because of living situation and Vermont has absolute jack nothing for engineering. I have applied to a few jobs and heard back from a few jobs saying that other candidates were chosen. I have applied to a couple of system engineer positions even though I knew I probably wouldn't get chosen for those positions because my degree is in EET. I have also applied to a couple of EE jobs last time I remember or am in the process of applying. I have changed my resume and cover letter around so they are better. I have been contacted by a couple of recruiters at Northrup Grumman about a couple of positions in Maryland, which is more North of where I want to be located also it's very expensive to live there. I applied to one position that a recruiter told me about and that I am qualified for in Maryland but I feel that getting into one of these companies is hard. I have talked to some more recruiters for the same company some, but I need to talk to them more and need to make more time to apply to more jobs. I know I should be fine with that they are even contacting me about applying to a job even though I don't like the location. I also don't have a security clearance or never have had one. I am 24 years old and am not in the military. I have heard some on the internet that these companies prefer to hire people that are in the military or at least that is more attractable to them. My feeling is that it is hard to get into the defense and aerospace industry. Does anyone have any insight into what it's like getting into one of these companies and have any tips? I have done some research on the web but would like to get more info from an online community.",AskEngineers,False,travelseeker1,/r/AskEngineers/comments/dpytrk/how_hard_is_to_get_into_the_aerospace_and_defense/
28,Going back to uni and doing a Master's as an Electronics Engineer - need opinions/advice,1572576513,"tl;dr - Have a BEng in Electrical &amp; Electronics. Worked for 6 years mostly in small company doing interesting but low paying work. Currently in well-paying but boring job so considering doing a Master's in order to get more skills for more interesting and well-paying opportunities.

After coming to terms with the reality that most well-paying engineering jobs involve mostly paper-pushing and work not really that technical, I'm strongly considering returning to uni to study a Master's degree. 

Previously I've worked at small companies that did ""real"" technical engineering that I found very interesting but were low paying and in niche industries which didn't allow for much career growth. Recently I've joined a large organization in a field with high salary opportunities and job security (clinical biomedical engineering/technology) but the work is nearly entirely documentation and very shallow technically (and therefore low skill required). My goal is to return my career back to the industry of my previous job. However, it's a competitive field as it's mostly in government research and science organizations and it seems most people getting these jobs are higher educated and have more diverse skill sets than what I was able to get through my experience.

My problem is I am unsure what is the best field to study in. I want to stick to engineering and I love electronics and digital systems so I'd like to do something that compliments my Bachelor. So far I've considered either;

* Software Engineering/Computer Systems - because I want to improve my programming and technical IT skills and have no experience with software development (which has cost me a job in a previous application). Looking back this is probably the major I should have done for my Bachelor. Or,
* Data Science/Engineering - with the high demand and growing importance of data it appears to be a good long-term career. I find myself more interested in the actual ""engineering"" part of the field (i.e. machine learning, databases etc) and I would probably aim to be a Data Engineer as opposed to a Scientist/Analyst. 

So yeah, if anyone has had similar thoughts or actually gone ahead and done this, I'd love to heard your opinions. I feel a bit lost at the moment so all input (even brutal honesty) is appreciated!",AskEngineers,False,interfectorem_ovium,/r/AskEngineers/comments/dpyfdo/going_back_to_uni_and_doing_a_masters_as_an/
29,Does anyone know how the supercapacitors are set up in the Lamborghini Sian?,1572574907,"Wouldn't they have to be in series, which makes their total capacitance drop to basically nothing?",AskEngineers,False,almondbutter4,/r/AskEngineers/comments/dpy44e/does_anyone_know_how_the_supercapacitors_are_set/
30,Interview Questions About Career,1572574681,"Hi y'all!  


I have a school project about the career that I want to go into which is mechanical engineering. However, anyone can answer these interview questions and it's only 18 questions. I am not sure whether it's a hw question, so I thought this would be okay. If it is, my mistake.  


Interview Question: [https://docs.google.com/document/d/1ElwELZE9AHgfD15W68yqI9VbLnt9oNpL1lqsW9tiA7I/edit?usp=sharing](https://docs.google.com/document/d/1ElwELZE9AHgfD15W68yqI9VbLnt9oNpL1lqsW9tiA7I/edit?usp=sharing)",AskEngineers,False,BaozerQ,/r/AskEngineers/comments/dpy2gm/interview_questions_about_career/
31,Energy Storage question,1572573415,[removed],AskEngineers,False,OneSalientOversight,/r/AskEngineers/comments/dpxtcw/energy_storage_question/
32,Where to source AirPod batteries?,1572572858,"Hey all,

I'm working on a project involving wireless hearing-aid type devices. I was wondering where I could possibly buy batteries used in rechargeable wireless headphones (like AirPods) online. I'm having trouble finding such small rechargeable batteries. Thanks for your help!",AskEngineers,False,alldaynikka,/r/AskEngineers/comments/dpxp94/where_to_source_airpod_batteries/
33,Chemical Engineering: what “clean energy” industries exist where you can work in?,1572572830,"I’m an (almost) graduated chemical engineer, originally going to minor in petroleum, but recently I have been reading more about climate change and have decided to instead focus on something that isn’t fossil fuel related. I was thinking Carbon Capture projects but I cant seem to find too many in North America, also it seems like the majority of engineers hired in solar/EV/battery tech are usually mechanical and electrical engineers.  I would like some advice on what you guys and girls point me in the right direction about where I should look, so I dont waste too much time re-starting from scratch.",AskEngineers,False,Lotus_towers,/r/AskEngineers/comments/dpxp2a/chemical_engineering_what_clean_energy_industries/
34,Eight technical standards of die casting mold that must be observed!,1572571992,[removed],AskEngineers,False,cmjackie1,/r/AskEngineers/comments/dpxiwe/eight_technical_standards_of_die_casting_mold/
