index,title,created_utc,selftext,subreddit,author,permalink
0,First Year Engineering Student with Multiple Questions,1444151472,[removed],AskEngineers,KeroseneEnvy,/r/AskEngineers/comments/3nq9d6/first_year_engineering_student_with_multiple/
1,How unprofessional is it to cold call an engineer I was referred to about a position? More details within,1444144167,"One of my professors provided me the contact information of a previous coworker of his who works for a company I would like to intern with. I emailed his former coworker, who passed me along to a more appropriate person based on my interests. I emailed this person two weeks ago about starting a conversation for internship opportunities next summer and received no response. I have his phone number, but I am hesitant to call because I don't want to be too pressing. Is it inappropriate to call this employee out of the blue, given that he already passed on an opportunity to respond to me?",AskEngineers,oneplusoneoverphi,/r/AskEngineers/comments/3npr0i/how_unprofessional_is_it_to_cold_call_an_engineer/
2,Ideas for home use of free thermal energy?,1444144111,"Ok so technically its not ""free"" but close enough. I am currently building a solar boiler using compound parabolic concentraters in a trough setup. Besides the obvious use of a steam engine to turn a generator are there any other cool ideas for using either hot steam or hot air? The limit on temperature is going to mostly be what type of pipe i can install and the pressure is going to be kept low for safety reasons at first.

One idea i have is attempting to melt metal with it, but im not sure i can get my working fluid hot enough for that without risking damage to the pipes/valves. And i don't want to do active tracking with mirrors to have a small solar power tower.

The other idea is a steam jet cooler if i can get a steam ejector. Seems like a cool idea for cooling in the summer and just needs power for the pump.",AskEngineers,RedEngineer23,/r/AskEngineers/comments/3npqvl/ideas_for_home_use_of_free_thermal_energy/
3,Engineers: what motivates you?,1444143198,do you feel like you're going through the motions? What do you find excites you? What kind of work stimulates you? And what is your ultimate goal?,AskEngineers,mademoisellehathaway,/r/AskEngineers/comments/3npor9/engineers_what_motivates_you/
4,I can't find a HV amplifier component for my task. Am I looking for the wrong components? Please help.,1444142619,"I want to amplify a signal (range: DC to 1kHz AC 10 Vrms) to about 300 Vrms (current &lt; 5 mA). Also, I have multiple independent channels that I want to work with. 

Let me start with what components, I have found: 

1. [Microchip HV256] (https://www.microchip.com/wwwproducts/Devices.aspx?product=HV256) - A 32 channel amp. 72V/V close loop gain ; max output 295 V.
2. [AD5372](http://www.analog.com/en/products/digital-to-analog-converters/da-converters/ad5372.html) - 32 channel DAC. 
3. [AD5535](http://www.analog.com/en/products/digital-to-analog-converters/da-converters/ad5535.html#product-overview) - 32 channel DAC with output range of 50-200V.

So my ideal device is device 3 but with bigger voltage output. I then considered using device 1 and 2 together, amplify the signals from the DAC. 

Now, I want a higher voltage output. I have been trying to find other such amplifier arrays or really high voltage amplifiers (or even multipliers) that I can use - I am willing to make my own solution. But, I can't really find amplifiers that give that high a voltage easily (I saw some really expensive ones from Apex - but they seem overkill).

If you have an idea of a decent component or really a better solution, I would greatly appreciate a pointer. I feel, I may be looking for the wrong components, because a 50x voltage amplification (for low power use) seems like a trivial problem.

FWIW, this is a for an lab experiment setup I am working on, so the requirements are a bit flexible and a non efficient solution is also ok. I just can't spend too much money and buy a custom solution.  

Thanks!",AskEngineers,lamdacore,/r/AskEngineers/comments/3npnfm/i_cant_find_a_hv_amplifier_component_for_my_task/
5,3rd year Aerospace Engineer needing some advice.,1444141936,"I'm currently in my 3rd year at university, and I need to decide on a final year project to undertake. I'm thinking about doing a project on something in the Aerodynamics area, however I am not very skilled at using CFD. How viable would it be for me to learn how to use CFD in order to undertake such a project? How many hours would I need to put in to become proficient enough to for example, analyse different shaped winglets?",AskEngineers,skittlemountain,/r/AskEngineers/comments/3nplu3/3rd_year_aerospace_engineer_needing_some_advice/
6,What is this power saving device in this video doing?,1444141920,"I was looking up ways to save on my electricity bill and came across this video.  Is this a valid way to save on electricity? 

[Link to video](https://www.youtube.com/watch?v=Y1H58wRKTE0)",AskEngineers,whoami4546,/r/AskEngineers/comments/3nplsm/what_is_this_power_saving_device_in_this_video/
7,Using Fiber Optics to transfer real time image,1444141818,"Hello r/AskEngineers!

I am contemplating a project to capture live images and transfer it (analogically for about 1 meter) to a computer with video camera to share it online. I look around and find that optic fiber cables seems to be expensive and in low resolution. Using current  price for hardwares, will I be better off using a high resolution camera and wifi it to the server instead? 

Pros: Instant images, no lag. No batteries needed.

Cons: Expensive, low resolution. 

Thanks in advance!",AskEngineers,wswhatever,/r/AskEngineers/comments/3nplkg/using_fiber_optics_to_transfer_real_time_image/
8,UK Engineers - What subfields of Electronics/Electrical Engineering have a good future in the UK (job-wise)?,1444126766,"I'm a 28 years old Asian woman, with a Bachelor's and Master's in Electrical/Electronics Engineering. I'd like to move to the UK for a PhD and try getting a job which allows me to stay there after completing my PhD. 
I'm interested in embedded systems, robotics, signal processing, bioelectronics, machine learning, speech recognition, using electronics/electrical engineering to develop artificial limbs and other medical devices, using MATLAB etc. I hope you get the idea what kind of field I'm interested in. 

But since I will **ONLY** be issued a work permit if there is a shortage of UK/EU citizens in that field, I thought it's worth considering what the UK wants?

If this subfield doesn't have a good demand/future in the UK, what other subfields do you think I should shift my focus to? I'm willing to learn if the job prospects are good in that subfield. 

Also, I'd like to ask if being a female in EE would be an obstacle in landing jobs in the UK? Will I get discriminated? There certainly is a discrimination in my home country, and it worries me.

Thank you so much.",AskEngineers,BlueSundress,/r/AskEngineers/comments/3noup3/uk_engineers_what_subfields_of/
9,"Acetic acid corrosion,",1444124457,"Hi /r/AskEngineers 

I need to find out some information on acetic acid/vinegar corrosion of copper, specifically in situations where it is flowing over a copper surface or through a copper pipe.

I'm not that knowledgeable in the corrosion field and I'm striking out on places to look for information. I have access to a university library system so I can access journals etc but I don't think I'm looking in the right places.

If any of you have knowledge in this field and could point me in the direction of useful resources that would be a great help. Thanks!",AskEngineers,BigKingBob,/r/AskEngineers/comments/3norjr/acetic_acid_corrosion/
10,Hopefully graduating March 2017. What do I do to prepare?,1444106138,"I am a Mechanical Engineering Student from the Philippines that will hopefully be graduating March 2017. What do I need to do to prepare for life after college? How do I choose what to specialize in? Currently, alternative energy generation and mechatronics seems appealing. I have been a mediocre student all my college life, only doing what is required to get by. How will I make up for my lackluster transcript of records? I also want to be able to work abroad, how do I start researching about the requirements to work as a MechEng in a foreign country?",AskEngineers,ToxicParadox,/r/AskEngineers/comments/3no29i/hopefully_graduating_march_2017_what_do_i_do_to/
11,Flow control on a centrifugal pump,1444088500,"For my senior design project, we have to pump water at a wide amount of flow rates through a system to measure pressure drop in a manufacturer's product. Ideally between about 1-60 gpm with up to about 100 psig in the system, so obviously way too much to just use motor control. We've looked into it and think an adjustable bypass line might work.

[This is a basic schematic](http://i.imgur.com/8i6degK.png) of what we've thought of, but we want a sanity check. Basics in case the diagram isn't clear: there is a bypass line feeding back to the tank controlled by an adjustable valve (we're thinking globe). There's another valve after this on the main branch, which we think may be necessary for pressure control, fine control, and possible shutdown of the flow through the system.

A few notes:

* This is for a test rig. It won't be running constantly or for process use so efficiency isn't a huge deal.

* We need to be able to vary both pressure and flow rate. Adding motor control is still an option too, to get the broadest range within our specifications that we can.

* Current design is to have the tank at atmospheric but we need the system under some pressure. Will we need to run the bypass to the suction line instead?

So, is this possible, or are we going to need to figure out a way to use several different pumps to cover that range?",AskEngineers,bigscience87,/r/AskEngineers/comments/3nn1ng/flow_control_on_a_centrifugal_pump/
12,Plastic Injection Q's - Smooth Part,1444088018,"Hello,
I am designing my first injection molded part. It essentially will be a frisbee around 10"" in diameter, 0.1"" wall thickness. The outer surface needs to be perfectly smooth and have minimal knitting or other marks as the part will be chrome plated.

Vendors in the US came back with mold costs around $15k but said that they would look bad, as getting a perfectly smooth 10"" surface would require intense consideration. For a mold that met those requirements it would cost around $70k.

The over-seas vendors have a more can-do attitude about it and claim the mold cost is more around $8k-$13k. I am however worried. Is it feasible to get a near perfect smooth surface? What types of gates should I consider? A ring gate?

Any advice helpful. Thanks.

Photo of part:
ABS Material

http://i.imgur.com/mDSLQnJ.png",AskEngineers,necrolop,/r/AskEngineers/comments/3nn0l9/plastic_injection_qs_smooth_part/
13,"getting a masters after 5 years, I feel like I need to relearn everything. studied my ass off and still did meh in the recent exam. ( EE )",1444087569,"so the title says it all. I dont have anyone to discuss this with because it's an online class but it seems many of the MS students are either full time coming from UG or UG taking MS classes.I feel that i might have forgotten a lot of core concepts that aren't necessarily gone over in grad classes. 

I spent several days studying for an exam and I still blanked out. It didnt help that the exam was 1:15 minutes with 4 very long questions. Just calculating things alone was laborious so I dont know what the teacher was thinking when she made that test. 

I find myself looking up DE, Linear algebra, Circuits 2, energy systems, complex variables ALL the time. it's very frustrating and making me questions my skills. 

how do I deal with this? any one going through this at all? im taking online engineering classes and this is at Uidaho- EO program. Really lost here. I feel like I need to redo my undergrad or will risk getting C's in classs with these averages being so high among other students.


PS. I have a technical job and do well but I dont flip out a calculator for my problems. You guys know what i'm saying...

",AskEngineers,backagain1234,/r/AskEngineers/comments/3nmzn7/getting_a_masters_after_5_years_i_feel_like_i/
14,"Charging a 12V battery with a 12V DC brushless motor. Once the battery reaches a full 12V, if the motor is continually turned, where does the charge generated by the motor go?",1444086602,For a project I'm working on. There will be diodes only allowing the current from the motor to flow into the positive battery terminal. Thank you for reading!,AskEngineers,BlackbeardKitten,/r/AskEngineers/comments/3nmxbs/charging_a_12v_battery_with_a_12v_dc_brushless/
15,ELI5: How does apple's 3d touch work?,1444085371,I asked this in [eli5](https://www.reddit.com/r/explainlikeimfive/comments/3nms9t/eli5_how_does_apples_3d_touch_work/) and they recommended I come here.,AskEngineers,sharkykid,/r/AskEngineers/comments/3nmuon/eli5_how_does_apples_3d_touch_work/
16,How can a building add more floors?,1444078970,"How is that done? I would imagine that the framework of the building would have to be designed in particular in case more floors would be added in the future.

And I apologize for my lack of terminology. I'm a greenhorn in this regard. Thank you.",AskEngineers,Joke_Insurance,/r/AskEngineers/comments/3nmfp7/how_can_a_building_add_more_floors/
17,Billions in Change,1444072127,[removed],AskEngineers,KrazyTom,/r/AskEngineers/comments/3nlyfj/billions_in_change/
18,Temperature control system without a feedback loop?,1444070810,"I overheard someone saying that a system that they're designing will be able to maintain a heated compartment to X degrees above ambient temperature through a wide range of ambient external temperatures (below freezing to hot summer day). They said that it requires no thermostat - the temperature difference is maintained by precisely knowing the wattage needed to maintain this delta above ambient and constantly running that wattage. I'm familiar with things like PID control, but haven't heard of a system like this running with no control at all. Is it possible because it isn't aiming for a specific target temp, just a delta?",AskEngineers,jdsee,/r/AskEngineers/comments/3nlv2s/temperature_control_system_without_a_feedback_loop/
19,I currently work in an office for realtors and I'm wondering how much of what I do now would relate to an engineering job,1444069469,"I delayed going to college due to financial reasons. I'm still young so I'm not worried about graduating in time.

However, right now I work as an administrative assistant in a realtor's office and a lot of my time is spent goofing off. There are a few minutes in the day where I'm doing actual work, like making calls and emailing people, but about 75% of the time I'm staring out of the window or reading Reddit.

I've taken two years of undergraduate college as a mechanical engineer major and it's very busy. I went to a competitive university and we like to laugh about how much pressure, work and stress we're under because that was our reality. I thought that once I finished school my engineering job would be about epic mathematics and being crazy innovative. I assumed I would be running around attending meetings and throwing ideas at my fellow engineers, discovering something enticing. But now that I've read a few posts here and worked an office job, I wonder if engineering will be filled with the same about of bullcrap.

There are several threads about what you guys do on a daily basis. But how much of your day is actually filled with work? Do you feel just as passionate about engineering as you did in school? How much do you enjoy your jobs?

Also, as a second part, let's say what our major was in undergraduate and masters",AskEngineers,bobthejapanese,/r/AskEngineers/comments/3nlrop/i_currently_work_in_an_office_for_realtors_and_im/
20,Looking for engineers to interview through email,1444068403,[removed],AskEngineers,mrwobles2,/r/AskEngineers/comments/3nloy8/looking_for_engineers_to_interview_through_email/
21,Any information out there on this type of wheel?,1444067376,"[Here](http://www.messer-felgen.de/portfolio-item/messer-me03-3-turbo-fan/) is the type of wheel in question. It's designed to pull air over the brakes &amp; help cool them. I'm sure there are other types of wheel that do the same thing, I'm just wondering if there's any real information out there on this general topic.",AskEngineers,Suspensorio,/r/AskEngineers/comments/3nlmct/any_information_out_there_on_this_type_of_wheel/
22,Michael Baker Chicago projects?,1444062975,"I am applying for an entry level position at Michael Baker's Chicago office. I'd like to find some of the projects they've done without asking them. So far the only projects I found out of that office was the new runway at O'Hare. 

Any other projects in the Chicago area?",AskEngineers,470vinyl,/r/AskEngineers/comments/3nlbfg/michael_baker_chicago_projects/
23,Plastic waste to energy- incinerator,1444062782,"So we have a process involving a lot of plastic waste we need to remove, but for pr reasons we cannot landfill. 

My boss asked me to look into a waste to energy system (specifically burning). However, most plastic energy recovery systems seem to require a large amount of equipment where we do no have much space.

We have other material in our waste stream making synthetic oil difficult to create.

Do you guys know any feasible alternatives?
",AskEngineers,tubaKhan,/r/AskEngineers/comments/3nlay6/plastic_waste_to_energy_incinerator/
24,Test for calcination? Specifically for sodium bicarbonate? - Help a mostly clueless MechE,1444053935,"Hi all,

I'm a mechanical engineer in the business of bulk material handling.  I move powders and slurries from point A to point B, and it's probably more of an art than a science most of the time.  Every once in a while we come across problems that send us back to the drawing board, and I've come to one such impasse.  We are currently trying to move sodium bicarbonate but have come across an issue where the material appears to be setting and clumping (to the size of a football).  There are the obvious external factors such as humid air or leaks in the silo, but I'd like to explore every option.  I've been brainstorming what could be causing this and am aware that sodium bicarbonate calcines at approximately 122F, yielding Sodium carbonate, CO2, and H2O.  My thought is that maybe this localized release of H2O in the storage silo could be causing/contributing to the clumping that we're seeing.   Some of my other reading has found that both the sodium bicarbonate and sodium carbonate are soluble in water, and titration of these solutions with HCl will let us approximate the mass of bicarbonate ions and carbonate ions, and ultimately the mass of calcined material. 

Am I missing something or is this a valid procedure?   ",AskEngineers,NorwegianPearl,/r/AskEngineers/comments/3nkrau/test_for_calcination_specifically_for_sodium/
25,"How to create 3D drawing of trailer made from steel (square stock, channel, round stock) of various profiles?",1444050772,"I am trying to model a homemade utility trailer in order to produce drawings. Rather than create each stock profile and then cut each length and assemble, is there a program where I can select a material (ex. 2"" square stock) and draw a shape with it? I want to bring these drawings to a welding shop. What should I include? ",AskEngineers,MechMatt1994,/r/AskEngineers/comments/3nkkzw/how_to_create_3d_drawing_of_trailer_made_from/
26,Is there such a thing as a turbine that spins the same way no matter side the air or water is coming from?,1444046699,"My coworker just told me about a turbine used in pipes that would spin when water rushed over it, and spin in that same direction when the water receded and air was sucked over it. I've got an idea in my head of how the profile could look, but he couldn't remember what they were called, and I'd like to read about them.

These aren't turbines that rotate to stay with the wind. They're found in pipes, I believe, so they can't rotate.",AskEngineers,[deleted],/r/AskEngineers/comments/3nkdog/is_there_such_a_thing_as_a_turbine_that_spins_the/
27,"Researchers/Professors with large number of Publications, What is your secret??",1444024112,,AskEngineers,zaraki_,/r/AskEngineers/comments/3njke7/researchersprofessors_with_large_number_of/
28,Do you know of any steam tables (thermodynamics) where linear interpolation is minimal,1444023852,[deleted],AskEngineers,[deleted],/r/AskEngineers/comments/3njk0e/do_you_know_of_any_steam_tables_thermodynamics/
29,I saw something odd while hiking in a timber/mining area.,1444021106,[deleted],AskEngineers,[deleted],/r/AskEngineers/comments/3njfrm/i_saw_something_odd_while_hiking_in_a/
30,"Vacuum pumps and Mercury, is it still used the way it is used in thermometers?",1444010956,"I am curious about vacuum pumps, a client at work recently brought up vacuum pumps how they work, wondering when they stopped using mercury and how much was used in the pump. I am curious  and apparently not using the Internet correctly! Much thanks!",AskEngineers,geobabe25,/r/AskEngineers/comments/3niwrg/vacuum_pumps_and_mercury_is_it_still_used_the_way/
31,2nd MS?,1444009497,"Happy Sunday evening all,

Got my BS &amp; MS in aerospace (with a emphasis in propulsion), but nowadays I'm fascinated by EM stuff (circuits and radar). My company offers $ assistance for schooling, and I'm thinking I just might get a second MS is electronics engineering!

What are your thoughts? Can you think of any reason not to do this? Have any of you all gotten 2 or more MS degrees?",AskEngineers,mdhttr89,/r/AskEngineers/comments/3nitni/2nd_ms/
32,Unethical or illegal contract negotiations,1444008277,"I am curious about regulations regarding kickbacks or gifts included while submitting a project bid. For example, a contractor submits a bid to a city engineer for a project. With their bid, they include a gift such as concert tickets, a paid trip, etc. Is this illegal? If so, who enforces this? Who should the city engineer report this type of activity to? Can the engineer reject the gifts and still accept the bid, if it is the lowest?

I am specifically curious about regulations in the U.S.",AskEngineers,tigerfan119,/r/AskEngineers/comments/3nir6j/unethical_or_illegal_contract_negotiations/
33,Can someone draw me a schematic of this sugar dispenser? I have no idea how it works,1444003963,"Here's the video:

https://www.youtube.com/watch?v=6XKOQzeTMCU",AskEngineers,davidattenburrito,/r/AskEngineers/comments/3nii5g/can_someone_draw_me_a_schematic_of_this_sugar/
34,How do self-driving cars know the speed limit of each road?,1444002323,Do they have a giant database that has the speed limit information of each road they are on?,AskEngineers,UnlimitedQuestions,/r/AskEngineers/comments/3nieip/how_do_selfdriving_cars_know_the_speed_limit_of/
35,I'm awful at using oscilloscopes and function generators. What would you recommend I do to get better at using them?,1444000689,"I'm still in college and won't graduate with my BS in EE until Spring 2017. I've taken a couple EE courses so far with labs yet I still can't do jack using our oscilloscopes and function generators, and it's beginning to worry me. I just let my lab partners do the labs while I return the favor by writing the lab reports.

Do you recommend I buy my own and play around with them at home? I tried watching some videos that really helped and I took notes but as soon as I got into the lab it's like I was a deer in headlights - I had and still have no idea how to use them.

Thoughts? I don't want to go into industry not knowing how to use these basic tools.",AskEngineers,[deleted],/r/AskEngineers/comments/3nib44/im_awful_at_using_oscilloscopes_and_function/
36,Where can I find a high head high flow water pump?,1443999577,"I need about 40,000 gpm and at least 270 m head",AskEngineers,superpocket,/r/AskEngineers/comments/3ni8up/where_can_i_find_a_high_head_high_flow_water_pump/
