index,title,created_utc,selftext,subreddit,media_only,author,permalink
11,"Deciding between Offers, Nuclear VS MEP VS water treatment (Mechanical Engineer)",1550292252,"I'm graduating soon in as a Mechanical engineer and I have an offer from a Nuclear energy company (government is their main client) 

and I am expecting an offer from an Architecture and Engineering firm as an MEP engineer 

and I have an interview with a ground water treatment company 

which industries are growing? where would I be making more money in 5 years? 

so it is Construction VS nuclear VS water treatment

which would you go with if you were in my shoes?

salaries are pretty much the same, relocating for Nuclear energy and would be in Virginia.",AskEngineers,False,engineerMEE,/r/AskEngineers/comments/ar5ehx/deciding_between_offers_nuclear_vs_mep_vs_water/
12,How important are the jobs one has in undergrad when studying Civil Engineering?,1550290985,"Hi everyone, 

I took some time off after high school and started college late. I am in community college at the moment. I am 23 soon so I don't have as much leeway to only work part-time and pay few bills. Also, I feel like it's time to move out of my parents' place, or at least be able to. So, I need a full time job. I don't want to push graduation back any further, so I can't get a 2 year cert and then a 4 year degree. 

So, will my next job have a significant effect and which jobs should I look for?

Thanks in advance. 

",AskEngineers,False,oddseazon,/r/AskEngineers/comments/ar58oe/how_important_are_the_jobs_one_has_in_undergrad/
13,Best Engineer Career for Me?,1550289796,"I am currently a high school senior, and I have had trouble finding out which Engineering major I want to go into. I know I have some time left before I have to decide, but it has been stressing me out and I figure it couldn’t hurt to ask the opinions of actual engineers. In terms of my skills, likes and dislikes, I am very good at calculations and I usually am very good at problem solving or troubleshooting the machines we build in my high school engineering class. I do not enjoy the actual building part of most of my projects, I’m more of a design and calculations guy. I know this isn’t a lot of information to go off on, but I appreciate any and all input!",AskEngineers,False,duhchineseguy,/r/AskEngineers/comments/ar52ug/best_engineer_career_for_me/
14,How do wood foundations perform compared to cement foundations?,1550288979,"I've been intrigued by the advocacy for wooden skyscrapers.   


Today, I caught this video by The Economist, which caused me to question my default acceptance that cement &amp; steel is the superior foundation material: [https://www.youtube.com/watch?v=2DPp2NcnTb0](https://www.youtube.com/watch?v=2DPp2NcnTb0)   


Without looking at CLT (I assume we don't have much data on that), how do wooden foundations compare to cement, in terms of functionality, durability, cost? ",AskEngineers,False,YDKWYGIATAGT,/r/AskEngineers/comments/ar4yrs/how_do_wood_foundations_perform_compared_to/
15,I need help with a Nintendo light zapper i'm trying to turn into a lazer.,1550288877,"&amp;#x200B;

I need help, I have a 4.2 volt lazer diode and control module and successfully inserted it into the light gun. However, I don't really understand how the small switch works as I am trying to use the original switch to get the same feeling if it was a working light gun. Help!!

 Btw, the diode and controller are generic and can be found in EBay green lazer pointers, the only difference is that The potentiometer on mine is at max power. Thanks for your time!!!",AskEngineers,False,ThanosShrekBoi,/r/AskEngineers/comments/ar4y4q/i_need_help_with_a_nintendo_light_zapper_im/
16,"Advice on ""Power pyramids"" -- solar on a lattice tower",1550285560,"Towards the end of this paper:  https://www.naturalfinance.net/2019/02/policies-to-enable-home-energy.html

is the idea of constructing fairly wide towers for the purpose of putting solar panels on them, and a windmill on top.

Also using them over houses, roads, and as part of the transmission grid.

Any problems/mistakes with the idea?",AskEngineers,False,Godspiral,/r/AskEngineers/comments/ar4hij/advice_on_power_pyramids_solar_on_a_lattice_tower/
17,What Toolboxes do I need for MatLab?,1550284106,"I am a ME student who ultimately wants to work for NASA and I am looking into buying the student version of MatLab. There seems to be many diffrent toolboxes that you can add on for $10's each. I want what I need but I am also trying not drain what little savings I have,  so I was wondering what sort of toolboxes do you guys use in your endeavors and which ones are must-haves.",AskEngineers,False,NASAismyshit,/r/AskEngineers/comments/ar4aar/what_toolboxes_do_i_need_for_matlab/
18,Design Problem,1550281493,[removed],AskEngineers,False,itsjustwright,/r/AskEngineers/comments/ar3x4p/design_problem/
19,Linear Algebra is kicking my ass,1550277586,How did you guys study proofs? My professor is so strict and heavy on these especially on tests. How did you guys study for these?,AskEngineers,False,D-trece,/r/AskEngineers/comments/ar3cw9/linear_algebra_is_kicking_my_ass/
20,First Time Post: Looking for currently employed engineers to answer some questions for a school project.,1550275628,"Hello everyone, I am currently a student studying in electrical engineering. I am doing a project called a Networking log and if anyone can answer the following questions it would be greatly appreciated. NOTE: If any of the following questions are too personal to be answered here feel free to PM me. No information given to me will be to anyone else any way shape or form besides my professor.

1) Name, Occupation, Organization, Phone Number(Can be any number, not personal number), Email

2) Anything you can tell me about your day to day job

3) How have you advance in your career? Are you where you'd like to be right now?

4) What are your thoughts/ advice for internships and for someone in a future in engineering

5) Is there anyone else you can refer to me to answer the same question?

Feel free to ask me any questions as well",AskEngineers,False,Indana45,/r/AskEngineers/comments/ar323d/first_time_post_looking_for_currently_employed/
21,Can everyone help me and fill out this quick survey for one of my engineering management graduate class please and thank you!!!!! (its about Uber),1550275051,[https://unt.az1.qualtrics.com/jfe/form/SV\_7WjBKnBvJnWGutn](https://unt.az1.qualtrics.com/jfe/form/SV_7WjBKnBvJnWGutn),AskEngineers,False,IVIcChicken,/r/AskEngineers/comments/ar2yyn/can_everyone_help_me_and_fill_out_this_quick/
22,"Terribly bored engineer at work, don't know what to think or do anymore but don't want to get fired, help?",1550273586,"Hi Redditors, if this is not the correct place to ask this question, sorry. If so then great! I feel like I am in a midlife crisis but I am only 24 years, this May I will be 3 years out of college. Majored in mechanical engineering. I currently work as a systems engineer at one of the big 3 defense contractors. No matter what I do I feel like I am literally about to be bored to death. I ask for more work, get on more projects, finish the work on time without screwing anyone over, but it brings me no satisfaction. It just bores me to death. And those familiar with the defense contracting world, we have to charge our time. Sometimes I spend days on Reddit without doing anything and I don't know what to charge that time to so usually it goes to overhead. I love my salary, but can't get into the work. I've done design, quality, and systems, and none of it excites me. The only thing that gets me up is the salary and it supporting my family and I. I am starting to get scared of getting fired too, people walking by seeing Reddit open all day. Even though I get all my work done and ask for more and get that done, I feel like people in the defense industry are literally constantly working during all hours, no breaks, no Reddit, time charged to each program accordingly. It has gotten to the point that I have begun to talk to military recruiters and exploring options with the CIA or FBI for job prospects because I feel like I can't be behind a desk my whole life. Is this normal to feel this way? Is it normal to be able to get all your work done and have days where all I do is Reddit? I am seriously so concerned and feel like a lazy piece of shit who doesn't deserve to work where I work and get a nice salary like I do. Advice is seriously appreciated. ",AskEngineers,False,superboredemployee,/r/AskEngineers/comments/ar2qk3/terribly_bored_engineer_at_work_dont_know_what_to/
23,"Why are roller bearings not used as skateboard bearings over traditional bearings. Wouldn't cylindrical bearings be better for axial loads, or does it really not matter that much?",1550273457,,AskEngineers,False,InvaderNate,/r/AskEngineers/comments/ar2ptm/why_are_roller_bearings_not_used_as_skateboard/
24,Can a barcode/QR scanner pick up a code from and e-paper display?,1550272166,I work at a company that has barcode scanners everywhere and we're constantly looking for ways to improve traceability on products/jobs moving through our production line. Do barcode scanners pick up barcodes displayed on an e-paper screen? Are there any unintuitive concerns with this i.e. how long the display can hold an image with power removed etc?,AskEngineers,False,theswillmerchant,/r/AskEngineers/comments/ar2iiv/can_a_barcodeqr_scanner_pick_up_a_code_from_and/
25,A question from an engineering student to all of the engineers out there. How can I succeed at university while still having time for myself and going out?,1550272122,,AskEngineers,False,itsemre,/r/AskEngineers/comments/ar2i9m/a_question_from_an_engineering_student_to_all_of/
26,What is the best Introduction to automated manufacturing (possibly mechatronics?),1550271093,"Hello r/AskEngineers. 

I’m a fourth year manufacturing engineer (mechanical background).  I have tons of experience in assembly tooling and was trying to figure out the best way to learn more about automated manufacturing.   

I’ve done a little digging and I have an ardunio and raspberry pi that I’ve used to experiment with simple I/O’s. I’ve also had some experience with six axis robots controlled through a pendant. 

From what I can tell the difficult part any automated system with be interfacing between computer/control systems like PLCs (which I have some experience with programming/ladder logic) and the electrical systems like sensors and actuators. However I am very new to the entire automated space and would like to learn as much as I can.

I was wondering if anyone has recommendations for an introduction to automated manufacturing or mechatronics? I’ve thought about a couple fundamentals text books on amazon, but maybe someone will know where to look and refine my search.

Any help you can provide would be great! I’d be willing to put up for some online courses but I don’t think I can commit to an entire program at this time.

Thanks so much, I really enjoy this community!",AskEngineers,False,oldstove740,/r/AskEngineers/comments/ar2cb7/what_is_the_best_introduction_to_automated/
27,"Eight months removed from grad, applying for internships a waste?",1550269878,"I graduated in May 2018 with a BS in Mechanical Engineering with a 3.5 GPA, but I messed up by not getting an internship before graduating. Been applying for entry-level jobs and internships and studying for my FE exam in the meantime, which I took a few weeks ago and passed (yay). 

My question is in your opinion, is it a waste to be applying for internships if i'm so far removed from being a student? My biggest gripe is that I genuinely believe that i'm not qualified enough to be full-fledged junior engineer, and I feel like is my only option is to take on debt just to go back to grad school for the sake of being a student again and have that internship option open 

Advice, opinions, thoughts?",AskEngineers,False,LiterallyNotJesus,/r/AskEngineers/comments/ar2583/eight_months_removed_from_grad_applying_for/
28,F. machine,1550267877,[removed],AskEngineers,False,glockdk,/r/AskEngineers/comments/ar1t3a/f_machine/
29,Diversity initiative in engineering recruiting - I’m concerned we are reverse discriminating.,1550266996,"Disclaimer: I am a white male in the US and enjoy working on a diverse team. I know this may be a touchy subject. My company has implemented diversity metrics in recruiting and management promotions.   I recently performed an exit interview with a Hispanic female engineer (a good friend of mine so she was candid). She recruited for her alma mater and was responsible for interviewing (only 3 years experience, so already seems like she is being exploited as a diverse employee). Anyways during the interviews, she and the other interviewer selected the top 4 candidates, the top 2 being white males. In order to meet diversity metrics for ethnicity and gender, the lead recruiter forced them to offer numbers 3 &amp; 4 positions despite lower grades and lesser qualifications. These two happened to be ethnic females. The employee admitted to me this made her feel she was selected because of her diverse background too. These metrics are required for us at the moment - over 50% of incoming interns are ethnic or gender minorities, despite our company located in an area with ~75% white male engineering candidates. In addition to recruiting, the company will not hire a leading white male candidate into a leadership position if there is an ethnic or gender minority in the running. In other words, it’s rare for a white male to replace a white male in a leadership position. I’m honestly concerned we aren’t going to have the engineering talent in the pipeline 10 years from now because we are lowering our requirements to meet the metrics. Has anyone else experienced this at their company? Is it normal or even legal? Sr. Management is convinced a diverse workforce leads to “35% higher productivity” based on a relatively recent study. 

Tl;dr: my company has diversity metrics and is recruiting lower talent because of it. Is it normal?  ",AskEngineers,False,blandsaw,/r/AskEngineers/comments/ar1now/diversity_initiative_in_engineering_recruiting_im/
30,What is a triple gear pump?,1550265538,"I was reading some specs for drill rigs and came across the term triple pump. What exactly is meant by this? And why would a triple gear pump be used for this application and what other applications is it used for? 

The pumps I believe are [these ones](http://www.gearpumpservice.com/gearpumpsp303150517576.pdf).",AskEngineers,False,ElCapivara,/r/AskEngineers/comments/ar1etm/what_is_a_triple_gear_pump/
31,"What is the typical job task responsibility difference between PHD, master and bachelor level civil engineer concentrate in different field. Share your experience.",1550262954,"Title said it all, Thank you in advance for reply.",AskEngineers,False,oceanwing13,/r/AskEngineers/comments/ar0ya2/what_is_the_typical_job_task_responsibility/
32,Not another career change thread...hear me out though please,1550262803,"I know these get boring to respond to, but hopefully you guys can help me and my questions are specific enough to interest you.

&amp;#x200B;

I am 28 years old, working as a Fire Alarm Systems designer for a young Fire Alarm contractor. My business card says Engineer, but as I will begin to explain I believe that's kind of a lipstick on a pig job title. I graduated with a BS degree in Fire Protection Engineering in 2013, and fresh out of college I chose to work for a sole proprietor who was interested in growing the company. The goal was never to get huge, but to expand to the point where we could handle large design and installation projects. I became the new company's first hire. Early on the plan was that I was expected to learn everything about the FA trade, as well as be able handle a lot of operations at the office (above and beyond just designing  FA systems). Less than a year in, it became obvious that I would be doing mostly CAD design work and creating our shop drawings and submittals. 

&amp;#x200B;

Less than 2 years into my new career, I was approached by an electrical contractor who wanted to hire me as an estimator and plan reviewer. In addition, they wished to teach me lighting and controls. I was making $22 an hour at the time, they offered me $57k and additional perks that I currently didn't have. My boss panicked and begged me to stay, and at the time I was 100 percent sure I loved working for this small company, and I took slightly less to stay ($25/hr,but could make it up with OT at $37.50). I believe that my boss learned he didn't want to have to compete again, because he now ties all of our field tech and CAD designers' pay to NICET certification level. I am currently getting my level 2 processed, and plan on getting 3 by the end of the year to increase my pay. I have not gotten a raise since my last job interview, and since the NICET policy was instituted. I also have 1-2 CAD techs working under me depending on the time of year, I am responsible for reviewing their designs before the owner of the company OK's them.

&amp;#x200B;

Here is the dilemma. After I sat down with the owner and said that I will max out my NICET to level 3 (not eligible for 4), however I want to grow as a manager, and be recognized as such. This was immediately shot down, I was told I'd have to get Level 4 before he would be even willing to consider the idea. I will keep investing my time to getting certified in the short term to increase my pay, but long term I believe that this company no longer provides me with the best opportunity possible. Why should I manage CAD techs underneath me, if they can make the same $$ by getting certified? Why should I cover for the owner when he's on vacation or overbooked, if I can't permanently have those extra responsibilities and get compensated for it? Why does my training say next in command, but my pay only reflects my work as a systems designer?

&amp;#x200B;

I am thinking of transitioning into Project Management or Sales Engineering. I sacrificed becoming a PE because I wanted to learn more about starting a business, and gain skill sets that go beyond just Engineering/ Design. I believe it's time to leverage what I've learned into a new position where I can be appreciated/compensated for such. Maybe someone who has been there/ done that could lend their insight. Thank you to anyone who can help me.",AskEngineers,False,r_silver1,/r/AskEngineers/comments/ar0xbe/not_another_career_change_threadhear_me_out/
33,Does it matter which edition of reference books for PE exam?,1550259533,I’m looking at purchasing the MERM and 4 ASHRAE books for the mechanical (HVAC) PE but I really don’t want to spend $800+ on new books. Does the edition of the book really matter? The new 13th edition of the MERM is $190 new on Amazon but the older editions (11th and below) are $100 or less used on EBay.,AskEngineers,False,ContentElderberry,/r/AskEngineers/comments/ar0cml/does_it_matter_which_edition_of_reference_books/
34,How to become a controls engineer,1550258610,"I'm an Electrical Engineer (not power) who's working as an Automation. I'm currently in working and living in the USA but would like to move to the middle east (the gulf countries).
Looking at available jobs in that region I have not found a similar job and have not gotten a single call back ( I have a very good resume written by a paid professional).
My thought process is that I should consider changing fields, controls engineering seems to be the closest match to what I do and enjoy.

 So I'm looking at training and certification from ISA.org .. is this the right path to finding a job in the controls field?   I'm looking for online options because my local university does not offer masters in controls or any engineering deciplin for that matter)",AskEngineers,False,Madco58,/r/AskEngineers/comments/ar06l5/how_to_become_a_controls_engineer/
35,Becoming Controls engineer,1550257866,[removed],AskEngineers,False,Madco58,/r/AskEngineers/comments/ar01lu/becoming_controls_engineer/
36,Quality Engineer Associate,1550252839,[removed],AskEngineers,False,yousefakil,/r/AskEngineers/comments/aqz4ro/quality_engineer_associate/
37,Design For Machining (turning and milling),1550251573,"Hi,  
I have been offered a trainee job in which I would be reviewing parts that are going to be manufactured by machining. 

To my understanding I should have good knowledge on what are good and bad designs regarding the manufacturability, so I can assess the design of parts coming from product design and ensure a well functioning manufacturing process.

&amp;#x200B;

In my studies I have attended a couple of courses that have dealt with machining in the following topics:

* Cutting theory
* Cutting forces
* Tool choice
* Mounting design
* Cutting path design for turning and milling

The courses have been good, but I feel like I have only touched the subjects on a surface level and would have a hard time assessing the suitability of parts in real life. It is hard to get a good understanding of certain things because I don't have hands-on experience of working with actual machining of parts.

&amp;#x200B;

I'm very interested in finding some books or other resources to learn more about designing parts for machining.  
I would think the following topics would be most important.

* Design rules for machining (what features are easy/hard, what machining operations are cheap/expensive, what are suitable materials...)
* CNC Machine choice (How many axis do I need?, How to utilize the possibilities of the machines?)
* Mounting design (what are best ways of mounting in different cases)
* Technical part drawings for machining.",AskEngineers,False,Zensor7,/r/AskEngineers/comments/aqywob/design_for_machining_turning_and_milling/
38,"Recent grad, now working as an Engineer and I feel like I am getting underpaid. Am I or not?!",1550250791,"Hello Engineers,

I am a recent grad from UCSD, with a B.S in EE. I stared to work in my field, or very closy related, about 4 months ago. I work with a pcb design and manufacturing company. It took me slightly over a year before landing this job. When I got hired, the company made it seem as if I can grow into a design role, which I can (and really want to, eventually), but we currently outsource our designers. We have the software to design pcb's but no experienced EE's are currently here to attempt such a role (only I am, but I'm an entry level EE). Now I find myself working heavily with machine calibrations, signing paperwork, and light maintnence. Every now and then I get to shadow our test engineer, and trouble shoot certain pcb's. This I LOVE VERY MUCH, because not only does it relate to my field, but I have learned so much, and it always presents a challenge. The basics of EE are a must to understand such a role. However, I can only shadow him from time to time because I was hired as a Junior Engineer, to work under an ""engineer"" who was grand-fathered into his role. I desperatly wanted to begin some sort of ""real life application"" experience and so I took this job at the most they were willing to offer me - $20 an hour.

&amp;#x200B;

Now before we get into the heat of this topic, I took this offer because the company tossed in some benefits from the get go, and because of their customers. We have conncetions to many well known companies such as Boeing, Northrop, Honeywell, L3, Syncardia, Axonics, Raytheon, RC Electronics, Richard MFG, L-Garde, etc. I see myself making connections with some of their engineers, and potentially transitioning into one of these places. Both reasons make me want to stay, and just a few days ago, I had a SURPRISE progress checkup. I have done so much in the 4 months that I have been here, and have asked for more workload. I have learned quite fast, and have exceeded the companies expectations thus far. I remember during the hiring process, the HR Manager had the audacity to say, ""although you have a degree and school experience, you are only worth around $16 an hr because you don't have much industry experience"". She was trying to justify why $20 an hr was more than enough. 

&amp;#x200B;

School has taught a lot of theory and most of it doesn't even apply to real life applications. But at the very least, school has done its job in exposing me to such topics and most importantly, giving me the capability of learning whatever material may come my way. I know I am an entry level EE and should not automatically expect the avg of 60-65k, a year, that school made it seem like we would get. Although it is possible. But if not this, then at least 55k would be nice right. And if not that, then I guess 45k would do lol, although I would not be as content. In reality, I am making anywhere from 41-43k a year. AM I GETTING UNDER PAID OR NOT? I am asking because my 6 month REAL check up is coming up, and I would like to bring up this concern of my hourly rate. But then again I don't know if should for the following two reasons. First, I dont have the all the experience they required, but it will come with time. Second, I should be thankful for even having a job. This is what keeps me at bay, but I would like to see what other engineers think. ",AskEngineers,False,aSpiderNerd,/r/AskEngineers/comments/aqyrpg/recent_grad_now_working_as_an_engineer_and_i_feel/
