index,title,created_utc,selftext,subreddit,author,permalink
69,I need some help understanding Team Work &amp; Leadership in an Engineering context.,1440639905,"I'm working on some work place leadership tasks and need some guidance on what a greater online community feels towards teamwork and leadership within the Engineering context. 

Your help is greatly appreciated.

1) Why does Team Structure/Set-up or Team Attitude (be it individual team members or the team as a collective) have a greater impact on the performance and cohesion of a team? Is it a combination of the two factors?

2) How does the allocation of a hierarchical order (superiors and subordinates) affect the dynamic of the team? How can such a structure affect the outcome of Project Tasks and the Project as a whole?

3) What has been the greatest/most influential driving force behind shifting leadership perspectives and leadership styles within the engineering industry? (If there has been a change)

Thank you for taking the time to answer the questions above, it is very much appreciated.",AskEngineers,MadHatter159,/r/AskEngineers/comments/3ijl6r/i_need_some_help_understanding_team_work/
70,Who sets the organisational culture of a business?,1440639192,"From your experience, what influence do the people who work for an organisation have on the organisational culture of that business?  Do some people have a greater influence on organisational culture than others?",AskEngineers,mattingram95,/r/AskEngineers/comments/3ijjqy/who_sets_the_organisational_culture_of_a_business/
71,Sociable vs. Knowledgable Questions,1440637968,"Hi,
I need some responses to some questions i have formulated for a University paper,  if you could spend a few minutes of your time helping me i would greatly appreciate it! 
Thanks :)

(1)  From your experience, how have you harnessed peoples’ individual strengths and applied them towards a project/organisational outcome?

(2)  If you were given the option between either being:

          - The popular and socially networked employee who knows everyone in the office; or
          - The highly intelligent employee with vast amounts of industry specific knowledge

Which would you choose to maximise your individual contribution to a project outcome? What proportion of the two abilities would be    better and why?

(3)  What aspects of the workplace environment have moulded/influenced your practices in light of your choice in the previous question? 





.",AskEngineers,jakeheth,/r/AskEngineers/comments/3ijh3f/sociable_vs_knowledgable_questions/
72,Which job would you pick out of these two and why?,1440636632,"You are given the option of these two jobs. Which would you pick and why?

1. An engineering company made up of people of many different races and cultures, and therefore lacking any significant national culture, but with a strong and well-established organisational culture.

2.An engineering company made up of people predominantly the same race as you, however lacking any significant organisational culture and practicing methods and values you don’t agree with.
",AskEngineers,mattingram95,/r/AskEngineers/comments/3ije8p/which_job_would_you_pick_out_of_these_two_and_why/
73,Being the minority race in an organisation,1440635993,"How have you seen people of different national cultures adversely affected by the organisational culture in which they work? In other words, have you seen someone of a minority racial group within the work place negatively affected by the way in which the organisation operates?",AskEngineers,mattingram95,/r/AskEngineers/comments/3ijcvp/being_the_minority_race_in_an_organisation/
74,ENGINEERS/PROGRAMMERS: What LANGUAGE should I learn?,1440633460,"programming languages are welcome,but I'm more inclined to know if I should learn German, Chinese, Russian, etc in the atmosphere and work field of engineering.",AskEngineers,ejusung,/r/AskEngineers/comments/3ij7dh/engineersprogrammers_what_language_should_i_learn/
75,breathable air into the newly completed NEAT Gotthard Base Tunnel?,1440632387,"I saw reports today about the completion of the 35-mile NEAT Gotthard Base Tunnel between switzerland and italy.  A diagram on wikipedia (https://en.wikipedia.org/wiki/Gotthard_Base_Tunnel) (not the best source, i realize) only shows one air shaft! Can that be right? How is breathable air ensured along the whole 35-mile corridor?",AskEngineers,maalco,/r/AskEngineers/comments/3ij53p/breathable_air_into_the_newly_completed_neat/
76,Could floofing be averted by deepening waterways and employing hydro-powered irrigation?,1440627190,"Let me preface this by acknowledging that I do not have any engineering background. I may even be directing this question at the wrong audience.

I'm asking this because the instances of flooding in parts of my country (Australia) appear to be increasing. Right now the central eastern state (New South Wales) is experiencing flooding in some regions. I'm not grinding a Climate Change axe.

COULD some flooding be averted by employing a combination of hydro-powered water redirection (such as that which I understand has kept Amsterdam above water) and some kind of artificial deepening of waterways?

That is, if the bed of a creek with an average depth of 1.5 meters could be artificially deepened by another meter or two, could this potentially alleviate some flooding?

Edit: Sorry to disappoint anybody hoping to learn what floofing is.",AskEngineers,teeebax,/r/AskEngineers/comments/3iitc4/could_floofing_be_averted_by_deepening_waterways/
77,Are there any up and coming alternatives to hydraulics that could potentially replace them entirely?,1440624165,"I work in heavy industry and we deal a lot with hydraulics. While it is amazingly powerful, there are a lot of downsides to it as well. Is there some other technology that has the potential to replace it entirely?",AskEngineers,sts816,/r/AskEngineers/comments/3iimae/are_there_any_up_and_coming_alternatives_to/
78,Help sourcing a part...,1440622519,"Hello fellow enginerds, I need help sourcing a part and could use some help coming up with the correct terminology/keywords. 

I'm looking for a purely mechanical version of the [quick connect coupling device](http://www.grainger.com/product/LEGACY-Coupler-Plug-Kit-1LRW5?gclid=CLvs4YHQx8cCFQQHaQoduwwGtA&amp;cm_mmc=PPC%3AGOOGLEPLAC-_-Pneumatics-_-Distribution+Equipment-_-1LRW5&amp;ef_id=VVuVfwAABRe4tpNG%3A20150826205029%3As) you find on the end of an air hose. 

The closest thing ive found is on the end of [this dog walking device](http://www.amazon.com/Walky-Dog-Exerciser-strength-Paracord/dp/B003OYIAW4/ref=pd_sim_199_1?ie=UTF8&amp;refRID=0Q4A3BKSPNFNZT2NPPRH)

Does anyone know where I could find something like this? Or what keywords could help me find it?

Thanks in advance!",AskEngineers,TheFreneticist,/r/AskEngineers/comments/3iii9y/help_sourcing_a_part/
79,What is a good way to stack two cards together like ∧?,1440622399,"Hello /r/AskEngineers, I've been thinking about building this mechanism for a while but cannot come up with a viable solution. How can I make two cards stack together accurately like with hands? Does it require high precision sensors and motors or just simple mechanics like pushing the cards out? Just curious..",AskEngineers,nanziqigai,/r/AskEngineers/comments/3iii06/what_is_a_good_way_to_stack_two_cards_together/
80,Looking for a Design that Works,1440621634,[deleted],AskEngineers,[deleted],/r/AskEngineers/comments/3iig3n/looking_for_a_design_that_works/
81,I just want to say thanks to this community for helping me move up in the world!,1440620120,"Hi everyone! Just wanted to say thank you to anyone who commented in my post a couple months ago about salary.

http://www.reddit.com/r/AskEngineers/comments/3cfx6v/just_got_my_electrical_pe_can_we_talk_salary/

Your comments were just the kick in the pants I needed to get myself back on the market again. I recently accepted an offer at a 26% pay increase, much better benefits, and an extra week for vacation time! Exciting times!

To any other engineers out there who aren't satisfied with their compensation, the market is hot right now! Get your resume online and you'll be getting calls in no time.

",AskEngineers,ElectricalPEThrowawa,/r/AskEngineers/comments/3iicdn/i_just_want_to_say_thanks_to_this_community_for/
82,"Anyone ever use an Ecotrons EFI kit on small engines, mowers, snowblowers etc?",1440618714,What was your experience with it? ,AskEngineers,4Sken,/r/AskEngineers/comments/3ii8yj/anyone_ever_use_an_ecotrons_efi_kit_on_small/
83,Is it possible to outfit guns with a device that automatically enables the safety catch?,1440618214,"Because of the shooting in Virginia I once again delved into thinking about gun safety and this idea popped up. Could there be a way to install devices that enable the safety catch of a gun, either through RFID or NFC or similar technologies? Say a gun carrier enters an area equipped with these ""sensors"" and their catch is automatically enabled and cannot be disabled until they leave. Barring a huge debate on gun laws, possible hacks, etc. is this feasible? Could current guns be retrofitted with these devices?",AskEngineers,VinceClortho138,/r/AskEngineers/comments/3ii7s5/is_it_possible_to_outfit_guns_with_a_device_that/
84,I've been assigned a potentially dangerous school project. Which may involve me making a 750VAC power supply and I need advice.,1440613320,"So this week I was assigned to a senior project that a group of Bio medical engineers came up with.  It is an Automated Microfludic Cell Separator.  Simply put, it induces a polarity in the cells that are trying to be sorted trapping them in a EM Field while the others will be swept away.  [Here is a video of what it should do.](http://microbioseplab.org/videos.html)

This didn't sound terrible at first until one of the BMEs showed me videos that had voltages ranging from 400VAC to 800VAC  to properly trap the cells with low frequency of around 1Hz.

I have experience with Voltages around that high from my internship with a subway system but how should I voice my concerns to the team and the professors?",AskEngineers,ksmash,/r/AskEngineers/comments/3ihvzh/ive_been_assigned_a_potentially_dangerous_school/
85,Is it possible to use diagrams from IC's datasheets in a public document as the final paper of a degree?,1440604241,"For context, I'm designing a salinometer and I would like to use the internal diagram of an IC(ADA2200) instead of making it by myself.",AskEngineers,lordjusto,/r/AskEngineers/comments/3ih9sx/is_it_possible_to_use_diagrams_from_ics/
86,"Are there realistic ways to harness energy from volcanoes? And if yes, are any of them being used?",1440602093,I imagine all that hot steaming lava could be put to good use. But how?,AskEngineers,our_best_friend,/r/AskEngineers/comments/3ih4o7/are_there_realistic_ways_to_harness_energy_from/
87,"Is there a device that could operate similar to a shear pin, but could be used multiple times?",1440598008,"I need something to release a device after a certain amount of force is applied. In this system, the condition is intentional so a shear pin would need to be replaced every time. Is there a device with a similar function?",AskEngineers,Barking_Giraffe,/r/AskEngineers/comments/3igvf5/is_there_a_device_that_could_operate_similar_to_a/
88,"Career Wednesday (August 26, 2015): Engineering Career Paths &amp; Professional Development",1440590535,"[[Previously]](https://www.reddit.com/r/AskEngineers/search?q=career+wednesdays&amp;restrict_sr=on&amp;sort=new&amp;t=all)

Welcome to our weekly career questions thread! This is the place to ask for advice on engineering careers, including normally restricted topics such as job applications, résumé/CV and cover letter critiques, and undergraduate major selection.

* **This thread is for career questions only.** If you have a technical question, make a new post with your question as the title, and be sure to follow [our posting guidelines](https://www.reddit.com/r/AskEngineers/wiki/rules#wiki_questions).

* **To ensure that every post has a chance to get answered,** consider adding *?depth=1* to the end of the page URL. Also consider sorting by 'new' rather than 'top' or 'best'.

* **Please do not make requests to interview engineers!** Instead refer to the list of engineers that are willing to be interviewed (in the sidebar), and message them directly.

* Remember to follow the [Discussion Guidelines](/r/AskEngineers/wiki/rules#wiki_civility) in the sidebar. This thread is strictly a troll-free environment so that anyone can ask a question without backlash. In other words: **Negative attitudes and comments will not be tolerated.**
",AskEngineers,AutoModerator,/r/AskEngineers/comments/3iggoa/career_wednesday_august_26_2015_engineering/
89,"If I was allowed to use 1 kilogram of copper wire to make an electromagnet, and any power supply, which wire size would give me the strongest magnetic field?",1440575684,"No fan cooling or anything fancy. No spacing out the turns, it has to be wound tightly.

Is there an optimum voltage/current/wire size for an electromagnet? 

Or will you get roughly the same field strength for a given mass of copper wire regardless of whether you opt for thousands of amps on thick wire,  or thousands of volts on thin wire?
",AskEngineers,eleceng-,/r/AskEngineers/comments/3ifwww/if_i_was_allowed_to_use_1_kilogram_of_copper_wire/
90,What can I do to smooth dirty power that doesn't require me buying a UPS for every outlet?,1440569316,"My new apartment seems to have some power issues, and periodically, the lights dim slightly, and the fridge's compressor gets a little quieter simultaneously. The breakers are unlabeled, and I haven't determined whether or not the lights and fridge are on the same circuit or if the issue affects my entire apartment. Is there something I can do to smooth over the periodic current drop-offs that doesn't require me to buy a UPS for every outlet that's affected?

**SOLVED-ish**: https://www.reddit.com/r/AskEngineers/comments/3ifo0d/what_can_i_do_to_smooth_dirty_power_that_doesnt/cup0lmh",AskEngineers,ericpruitt,/r/AskEngineers/comments/3ifo0d/what_can_i_do_to_smooth_dirty_power_that_doesnt/
91,Engineering with bad eye sight,1440566309,"Long story short I have kerataconus, it's a non correctable eye disease that could get progressively worst over time, have to wear custom glass/hybrid contacts and last ditch effort is cornea transplant, my vision will never be normal, with contacts it is good enough to drive.

My concern is I don't want to invest into an engineering field that is going to require perfect vision, I would prefer to get into an engineering field that can be done at a desk if my vision ever gets worst

Basically what I'm asking you guys is what engineering field are you in and how strict are they with eye exams on you guys? Thank you.",AskEngineers,ssjhook,/r/AskEngineers/comments/3ifjfu/engineering_with_bad_eye_sight/
92,Transformer wiring question,1440562747,"I am trouble shooting one of our old cnc machines and am unsure off I be of the transformers is giving the correct output.  On the above drawing we are getting 120v to ground on line 113 and 0v to ground on 114.  I think this correct but am not sure, csn anyone verify?  There is definitely an issue with the AC somewhere in the controls. Thanks.",AskEngineers,ImperialAle,/r/AskEngineers/comments/3ifdb5/transformer_wiring_question/
93,I'm an international student studying Petroleum Engineering. Seeking career advice.,1440559843,"Hello engineers of Reddit. I'm an international student studying petroleum engineering at Texas Tech University. I always knew that it would be difficult to get a job as an international student. But with the recent trend in oil prices, I've become unsure about my choice of major. My experience at job fairs has also been quite depressing. Even though oil companies never told me upfront that they do not hire international students, I have seen friends with far lower GPA getting internships. Is it likely going to be like this even after graduation? I have no problem working offshore or in any other country. Or should I jump ship and switch major?",AskEngineers,thug_bunny,/r/AskEngineers/comments/3if7ya/im_an_international_student_studying_petroleum/
94,"Electrical engineers, can you help me with Zelio Soft?",1440557956,"I'm no electrical engineer, i'm clueless about circuits and PLC's and i need to design  one (FBD) for class in Zelio Soft...and i dont understand this enviroment at all .. .. would you help me please in this assigment please?",AskEngineers,ecutter,/r/AskEngineers/comments/3if40c/electrical_engineers_can_you_help_me_with_zelio/
95,Why do medical device companies seem to favor electrical engineers and mechanical engineers over biomedical engineers?,1440552334,Most of the positions I see ask for a an EE degree or an ME degree,AskEngineers,throw_a_way_69,/r/AskEngineers/comments/3ies6t/why_do_medical_device_companies_seem_to_favor/
96,"In your opinion, which sub-field of engineering has the most inherent complexity?",1440549796,"I'm not talking about the difficulty of the maths involved or anything like that, just the raw complexity in terms of the number of factors to consider for the average task in that field. ",AskEngineers,666lumberjack,/r/AskEngineers/comments/3iemlw/in_your_opinion_which_subfield_of_engineering_has/
97,"Currently a quality control chemist, company wants to send me to school. Suggestions?",1440548025,[deleted],AskEngineers,[deleted],/r/AskEngineers/comments/3ieip5/currently_a_quality_control_chemist_company_wants/
98,What's up with General Electric making all their automation products in china?? (GE Fanuc),1440547920,"As far as I can tell GE has been sneakily making all their PLC products in mainland china since at least the 80's.  Is there something wrong with this picture?

I would need to do more research but I think American people would find it disturbing to learn if appliances under the GE name were being made in China.  GE promotes american made appliances, more people need to know about this.",AskEngineers,hoogityboogitiesRIP,/r/AskEngineers/comments/3ieigk/whats_up_with_general_electric_making_all_their/
99,Aircraft engineering books? Step one of a madman's quest...,1440546889,"Tl;dr Please recommend books on aero engineering. 

Long version: I've had this dream since I was a kid. A tiny airplane with no cockpit. Just a fuselage, wings, engine and tail. With the pilot riding on top, sport bike style. 

Recently I saw this video http://youtu.be/uGTZhDJ2mGg 
This is exactly my dream (well, I always pictured a tail dragger, but close enough)

 Watching the video I realized that since It has been done, it can be done again.I have enough sheet metal skill and experience that I'm sure I could build it, I also have a pilot's licence so I could fly it, but I don't know how to design it to be airworthy. I'm here trying to compile a reading list of aircraft design books. Any reccommendations? 

Thanks in advance.

",AskEngineers,Oilkul,/r/AskEngineers/comments/3ieg50/aircraft_engineering_books_step_one_of_a_madmans/
0,Slanted floor. Help!,1440546654,"Hi, first of all, I should preface this by saying that I'm looking for help and advice. I just moved into an apartment in a building that was built, I believe, in 2006. It's in San Francisco. I'm on the top (4th) floor. I didn't notice anything strange in the first couple weeks of living here, but suddenly I do notice something out of the ordinary. 

As I step from the hall into the kitchen, I notice that the floor seems to dip down. So I got out my level, and sure enough the floor isn't level. Then I looked up and noticed that the cabinets seems to be sagging on one side. I'm going to (hopefully figure out how to) attach some photos and a video.

Please let me know what might be going on. Is this safe? Unsafe? Is the floor going to collapse? There was recently a smallish earthquake (4.0) in San Francisco so I'm wondering if maybe that's what caused this? Any feedback would be great. This is mildly freaking me out.

[Image 1](http://imgur.com/GvPIyUt).

[Image 2](http://imgur.com/fi615Ix). Pretty sure this is how it's supposed to look all the way around.

[Image 3](http://imgur.com/ve6bp1J). You can clearly see some sagging, unlike in image 2.

[Link to video](https://youtu.be/IXxb-Rk7EYw).",AskEngineers,World_Series,/r/AskEngineers/comments/3iefl3/slanted_floor_help/
1,What are typical processes and paint specifications in industry?,1440544111,"I'm working for a small company that doesn't require any specifications for paint, and I'm tasked with recommending the best process and specifications that finishers need to meet. Information has been hard to come by and I'm wondering if you have any experience with what places like Bobcat, Caterpillar, or others might require in their finishing process or paint durability.

Thank you!",AskEngineers,SmallTymeR,/r/AskEngineers/comments/3ie9we/what_are_typical_processes_and_paint/
2,"I Have a Degree, I Hate It. What Do I Do Now?",1440539337,"I graduated in December of 2014 with a degree in [Radiological Health Engineering](https://engineering.tamu.edu/nuclear/academics/degrees/rhen). The original plan when I started my degree was to become either an health or medical physicist. While attending school I began to realize it wasn't for me. Now I believe I have a very specific degree and have dug myself a hole that I cannot get out of. My interest for my degree came from wanting to build things and to be able to help people. 

Since post graduation I have found myself very depressed because I feel lost. I want to get into a different field but having the hardest time doing that. One reason is that because I don't know what I want to do now. While in college I found that I have a knack of leading projects, I was in multiple organizations and held leadership roles in each. I have been told by many people that I have great personal skills. I thrive in high energy environments, mostly because it's difficult for me to focus on one thing for a long period of time. 

Are there any suggestions that you all may have for a career path to look into? I have gained interest in energy engineering, environmental engineering, project engineering, start-ups and careers that have nothing to with engineering such as management, marketing, and business. I am completely lost with absolutely no direction.

Any advice or help is greatly appreciated.

Thank you

**EDIT:** Guys thanks so much for words of encouragement and the help you have given me so far. I really want to answer each and everyone of your comments in order to actually show my appreciation but it blew up more than I ever thought overnight. I will still reply to comments just throughout the day. Again thank you guys so much I really needed this. ",AskEngineers,mheezy,/r/AskEngineers/comments/3idyqv/i_have_a_degree_i_hate_it_what_do_i_do_now/
3,Whats the best way to evenly space 20 holes in a circle?,1440537538,[deleted],AskEngineers,[deleted],/r/AskEngineers/comments/3idu9p/whats_the_best_way_to_evenly_space_20_holes_in_a/
4,"What's the cheapest possible rig I can build to run a single-phase, 120v Electric Chain Hoist in alternating directions?",1440534645,"Hello all,

Like the title says, I want to run an Electric Chain Hoist through some lifetime testing. The hoist has 15ft lift. I want the hoist to run through the complete 15ft, get to the top and reverse directions (lowering the load) all the way down to the bottom, reverse directions and start the cycle over again. I know you can do this in many ways, but what's the most cost efficient way to accomplish this? Thanks!",AskEngineers,JUGG3RN4UT,/r/AskEngineers/comments/3idmwa/whats_the_cheapest_possible_rig_i_can_build_to/
5,what's everyone's general opinion about architectural engineering? is the market okay for this field or more risky since it's smaller?,1440522897,"it sounds interesting to me and shares similar courses with civil/structural engineering, but would a degree in this still be nice despite being much smaller and less versatile than a civil engineering degree? how is finding a job with this degree compared to civil?",AskEngineers,sfw63,/r/AskEngineers/comments/3ictka/whats_everyones_general_opinion_about/
6,"Hey Engineers! You have $50,000 dollars at your disposal to start a business. What do you do?",1440522167,"I am currently working as an engineer for one of the major oil and gas companies in the US; with oil below $40/bbl, I have been all but directly told I will be laid-off come Q1 of 2016. And I couldn't be happier; I have been planning my exit from the oil industry almost as soon as I entered it. But before I just hire on with some other company, I really want to take a shot at starting my own.

I am fresh out of school (~3 years) and I have no immediate responsibilities (ie no wife/kids) making this an ideal time to try. I own a house, and when I sell it and pay off my bank loan, I should end up with $50,000 to $60,000 cash in hand. I would like to use this money for my new business.

But I'm struggling with developing a concept for a business. I've been flirting with a few ideas: building a algae bio-fuel plant, contracting to install solar panels and wall batteries into personal homes, even purchasing bee hives and renting them to farmers pollinate their crops.

I want to know what you would do? If you had ~$50,000 and 3-5 months to plan, what business would you create?

I want to hear about you, but for what its worth: I will most likely be located in Southern California, I love being outside and working with my hands. And what I do doesn't necessarily need to help the environment, but I don't want to be causing it harm",AskEngineers,smpl-jax,/r/AskEngineers/comments/3icrq6/hey_engineers_you_have_50000_dollars_at_your/
