index,title,created_utc,selftext,subreddit,media_only,author,permalink
66,Masters in Germany VS site work experience in UAE/Saudi Arabia first then masters in Germany,1582209155,"Hello.

I am a 27 year old Lebanese electrical engineer living in Lebanon who's been working as an oil and gas estimator at a major Lebanese oil and gas contractor (our projects are mainly in Saudi Arabia and the Emirates) 

As you may or may not know, Lebanon has recently been going through unprecedented economic and political turmoil with massive unemployment, inflation, corruption and currency depreciation.

I have saved enough money (around 25 k) with the intention to eventually do a masters in Germany with the hopes of emigrating. However, we just got word that since our company has won a lot of projects recently, they need on site engineers for those new projects in Saudi/Emirates and so I have an opportunity to go there on a project basis with a salary multiplier of 2.1 and experience of course. 

My question boils down to: 
Should I say no and just continue applying to a masters in Germany or should I take the ""safer"" route and go for a couple of years to gather more experience and money that might/might not help me in my eventual masters in Germany(engineering related)?",AskEngineers,False,Sisyphus_Redeemed,/r/AskEngineers/comments/f6tvqf/masters_in_germany_vs_site_work_experience_in/
67,Don’t know what to expect in a New Job,1582206370,"Hi everyone, So I graduated recently and starting as a Junior Electronics Engineer in a really BIG company next Monday. I am honestly terrified of what to expect and what is expected from me. The Job is for electronics/electric engineering graduates while I’m a Mechatronics engineering graduate ( I have minimal knowledge in electronics). I was interviewed by two engineers and Funny enough they didn’t ask me any technical questions. At the end of the interview, they told me I was ok but there should be another technical interview. The second interview never happened and I got the job. I’m just worried that I might disappoint as they have very high expectations of me. Any advice? 
Thanks",AskEngineers,False,YannyCuz,/r/AskEngineers/comments/f6tacu/dont_know_what_to_expect_in_a_new_job/
68,Any engineer that could answer these 6 questions?,1582204906,"1. What do you work with/ what specifically did you study?
2. What are some examples of duties you do in your job? (What specifically do you do during workdays)
3. What do you find fun and what are the advantages with your job?
4. Is there any downsides of your job?
5. What type of experiences and skills are important in your job?
6. If you could go back and give advice to your younger self as an engineering student, what would it be?

All responses are highly appreciated!",AskEngineers,False,monkaSman,/r/AskEngineers/comments/f6szgv/any_engineer_that_could_answer_these_6_questions/
69,"Hello, a teacher speaking...",1582204709,"Hey guys, I'm in a bit of a pickle, and I need help fast (7 days).

So the thing is I work for an international school and I'm trying to find someone that can do a Skype session with the kids about STEM or any engineering subject (Mathematics, Science, Technology, Chemistry, Physics, Biology).

The lesson should be at least 40 minutes, but if we can stretch the time to an hour that would be great. One session for a month, max 6 months, so 6 sessions.

I will provide you with a theme, and you would have to talk about it in the session. The students are young, a maximum of 14 years.",AskEngineers,False,Fr00dydud,/r/AskEngineers/comments/f6sy3w/hello_a_teacher_speaking/
70,Suspicious about my company’s “Modified Time” benefit. Should I just stay away from it as an employee that’s new to the workforce?,1582203513,"Hello! I work for a very well-known government contractor that has something called “Modified Time”. Basically, if you go over 40 hours in a week, WITH MANAGER’S APPROVAL, you can allocate those extra hours as “Modified Time” on our time sheet, and then take off those number of hours the following week.

I’m basically brand new to the workforce. This is my first full-time job. Should I just stay away from Modified Time for now and just chalk up any extra time worked as being a salary employee?

I didn’t mention this, but I’m salary exempt. Modified Time is only offered to salary exempt employees.",AskEngineers,False,HeheYoItsYaBoi,/r/AskEngineers/comments/f6spac/suspicious_about_my_companys_modified_time/
71,Opinions on a job change requested!,1582202295,"Hello all. I graduated with a BSME in December ‘18. Ive been working as a manufacturing engineer at a tier 1 auto supplier in the Midwest since January ‘19. My problems with the place are that I commute 62 miles each way (this is KILLING me) and that I still don’t feel like I do much “engineering” work. I look at job postings and feel woefully inexperienced because I don’t do any of that stuff at work. That said, I’m planning on a move out of state, to a more competitive job market in about 18 months. My original thought process was that 2.5 years at the same company would look better than a job hop. My question: do you think it would significantly impact my ability to find a job out of state 1.5 years from now if I switch to a job that’s closer to my house and then look for an out of state job 1.5 years from now? I really wanna work closer to home right now, but my number one priority is working where I want to work in spring of 2021. TIA",AskEngineers,False,ravenousmind,/r/AskEngineers/comments/f6sh3x/opinions_on_a_job_change_requested/
72,"The technical students applications at CERN are now open, I'm thinking about applying for the internship but it makes me extremely anxious, should I do it?",1582201068,,AskEngineers,False,progressEve,/r/AskEngineers/comments/f6s937/the_technical_students_applications_at_cern_are/
73,What do you guys think about buying a plain jane innerspring mattress and then just customizing it with layers of foam to dial in the softness?,1582199484,"I tried asking this in /r/mattress but all I got were replies from sales dudes telling me how pillowtop mattress are too ""complex"" to recreate with a DIY solution.

Obviously I'll understand if this gets deleted.",AskEngineers,False,6RFV,/r/AskEngineers/comments/f6rzay/what_do_you_guys_think_about_buying_a_plain_jane/
74,"If a micro-controller output is connected to the input of an SSR , and the micro-controller loses power, does the voltage input of the SSR float and switch it on and off?",1582199256,"I have an Arduino MEGA that I am planning to use with a custom PCB to switch this SSR:  [https://docs.rs-online.com/905a/0900766b8145727e.pdf](https://docs.rs-online.com/905a/0900766b8145727e.pdf) . The load being switched will be a set of 24V heater cartridges with a current of about 15A. 

I am planning to connect an output pin of the Arduino directly to the positive input of the SSR, and the other side of the input to the Arduino GND. I wanted to know if I should be connecting the positive input of the SSR through a large resistor to GND too, to pull it to 0V if the Arduino MEGA switches off, or if this is unnecessary. My concern is if the Arduino loses power and the SSR switches on/off at random.

Thanks for your help.",AskEngineers,False,Cartonaut,/r/AskEngineers/comments/f6ry1r/if_a_microcontroller_output_is_connected_to_the/
75,What engineering major suits me best?,1582197259,"I'll be graduating in a month for college and I keep on wondering what degree suits me the best, please help me out. Here are the things I love doing:

I love physics and math. I can handle chemistry and biology as well too, sometimes I find these two interesting but sometimes I don't. I love doing research and exploring new things, I have recently completed a research paper about nanoparticles this year, and I plan on doing more research in the future but I fear the low salaries if ever I get into academe. Albeit, I also love being practical and applying the things I learn to create new stuff. I was thinking of getting a double degree in mechanical and biological engineering, but would it be worth it? It is also in my interest to seek higher education after my bachelor's. My mind is all over the stuff right now and I can't manage to choose which one I should get. I live in the Philippines, engineering jobs here pay as low as 10k pesos a month - that's 200$ a month in the us, and I'm not even kidding.",AskEngineers,False,nadd29,/r/AskEngineers/comments/f6rm79/what_engineering_major_suits_me_best/
76,Mathematician being interviewed for a Stress Analyst position. First interview in 5 years. A little help?,1582196735,"So for a bit of background, I’m a mathematician but have been employed as a “jack of all trades” engineer for 5 years doing mainly stress analysis but with some thermal hydraulics work as well (exclusively in the civil nuclear sector).

The upside is that I’m good at math and believe I’m quite versatile. The downside is that I’m lacking in the foundation knowledge of stress analysis that some of my Mechanical Engineering colleagues have, and the company interviewing me is a stress analysis specialist consultancy.

So I have a couple of questions with regards to what to expect from the interview;

1. What kind of “first principles” type questions are common in stress analysis interviews, and where can I do more reading in to this? It may be that I don’t get asked a question like this but I want to cover my bases.

2. Any other general questions that are common in stress analysis interviews?

I’ll also be given a writing assessment where I’ll have 30 minutes to write a non-technical essay. This is completely new to me – does anyone have experience of this?

Thanks in advance 😊",AskEngineers,False,Mealprep_throwaway,/r/AskEngineers/comments/f6rix3/mathematician_being_interviewed_for_a_stress/
77,Is electrical engineering better than cybersecurity for the future?,1582186817,"I’ve applied for electrical and electronic engineering at a university and got an offer but lately, I’ve been thinking about going for cybersecurity instead. I’m equally interested in both. What would be better in terms of job prospects, salaries, or maybe starting my own business?",AskEngineers,False,DaddyBaphomet,/r/AskEngineers/comments/f6q1ts/is_electrical_engineering_better_than/
78,Electrostatics simulation software for an experiment,1582181172,I am doing an experiment in which two charged metal spheres collide with each other. Does anyone know any software or website that can give me the impact parameter/scattering angle of the spheres knowing their mass and charge?,AskEngineers,False,bigchungus1980,/r/AskEngineers/comments/f6p5g8/electrostatics_simulation_software_for_an/
79,Is this water combustion-like engine even possible ?,1582180833,"Please consider this idea and let me know if it is plausible or possible. 

Water 'combustion' engine and passive steam generator with zeolite and vegetable oil idea:

Water boils at 212 degrees Fahrenheit. You would need the vegetable oil to at least be that temperature (or higher) for this to work. 
Imagine the working principle and basic design of a combustion engine. Now imagine that the base inside the piston chamber would have a zeolite bottom that would act like a wick by soaking up hot vegetable oil from a channel below the piston cylinder. The hot vegetable oil would just wet part of the 'wick' so that the surface area of the inside of the zeolite could be utilized in the next part. Next a drop of water is dropped inside the piston cylinder and the drop falls onto the zeolite wick and due to the increased surface area and the reaction to the hot oil, the water rapidly expands into steam thus pushing the piston head up. On the upstroke the steam can be evacuated (like how the exhaust typically would in combustion engines) and used to power an auxiliary generator. A two for one deal. 
Recent research I found online shows that zeolite has the ability to store heat very well. Also zeolites unique nano cage structure and porosity, enable a massive amount of relative surface area. This process I've described is not technically combustion per se, however, it does provide the same effect since you have a way for the rapid expansion of water in a confined space.  
Heating vegetable oil to 212 degrees (and maintaining that temp) would not require that much energy and could be done via fresnel lens, or mirror reflectors of sunlight.",AskEngineers,False,StevanWhite,/r/AskEngineers/comments/f6p3dg/is_this_water_combustionlike_engine_even_possible/
80,Simulation Software,1582178826,[removed],AskEngineers,False,bigchungus1980,/r/AskEngineers/comments/f6oqd3/simulation_software/
81,Are you asked about your GPA after your first job?,1582178539,"I graduated a couple of years ago with a poor GPA. The company I interned with hired me and I've worked there since then. I have an interview next week for an entry-level position at a different company. 

Should I expect to be asked about my GPA? (it's not on my resume)

If so, what is the best way to field that question?",AskEngineers,False,_r_special,/r/AskEngineers/comments/f6oogt/are_you_asked_about_your_gpa_after_your_first_job/
82,Is plastics engineering a “bullshit” engineering degree?,1582178059,"I graduated with my Bachelors of Science in Plastics Engineering. It was overall a pretty easy process. I had one tough class that I had to retake but that was because of a bad professor. I got As and Bs.

Unfortunately I’m 3 months since graduating, and right now my degree is nothing more than a solid paperweight. As in, zero jobs so far. Not one. I’ve been working at a retail store making barely above minimum wage and having suicidal thoughts. My dad is pissed (not at me, but just in general) because he told all of his friends I was an engineer, and he was so proud of me, and when he sees me put on my uniform to go to work it just kills him. (And me.)

Now I’m wondering if I wasted 4 years doing a bullshit degree that was just called “engineering” for the fuck of it. And I should have gone with mechanical? Or electrical? Or chemical? What’s the consensus on this sub? (I mean ffs I can’t even flair my post with “plastics engineering”!)",AskEngineers,False,epicgamesbad,/r/AskEngineers/comments/f6olcn/is_plastics_engineering_a_bullshit_engineering/
83,In case of loading spouts how do inner cones behave during extension and retraction of loading spout,1582177897,,AskEngineers,False,praneeth9541,/r/AskEngineers/comments/f6okbb/in_case_of_loading_spouts_how_do_inner_cones/
84,How to ensure Im gonna do the right internship?,1582177840,"Recently interviewed for a summer internship as a mechanical engineering student and the manager of the company (who was interviewing me) was asking ME what my role would be at the company. Was not expecting that and I just told him what I am capable of and what I have learned so far in school. 

What should I have said?  It’s kind of a small relaxed company and I think he will hire me if I want the job but I want to make sure i am doing something that is productive to my career. What should I do between now and the time I want to begin interning to ensure that I’m not just making coffee in the mornings so to say.",AskEngineers,False,wildturkeydave,/r/AskEngineers/comments/f6ojxq/how_to_ensure_im_gonna_do_the_right_internship/
85,Career advice for disabled mechanical fitter.,1582176045,"Hope I'm in the right place, basically as the title says I was a mechanical fitter untill I got injured in the work place which has left me with greatly reduced function in my left arm. 

I'm trying to get into a meaningful career but I'm struggling for ideas where to go, what best courses to try and upskill etc

Any advice would be greatly appreciated.",AskEngineers,False,tyghhhfg,/r/AskEngineers/comments/f6o7fl/career_advice_for_disabled_mechanical_fitter/
86,What can I do to boost my portfolio?,1582174996,"So I have a pretty bad track record and I don't want that to disqualify me from getting a decent job. I've been having a rough time in engineering and I would like to know what advice would you have given yourself before you graduated?
Artist have a portfolio of accomplishments and works of art to show their employer what they've done and why they should hire them. What can an engineer do in the same right... I'm studying electrical engineering as a reference.",AskEngineers,False,the_dead_sea_of_fish,/r/AskEngineers/comments/f6o03y/what_can_i_do_to_boost_my_portfolio/
87,Linkage design for folding cup holder.,1582174541,"I'm trying to figure out how to make the upper platform go from 90 degrees to 180 degrees (down), while clearing the lower, rotating piece. Any advice/ideas is appreciated. Also, books that are related or websites will definitely help. (Photo's can't be attached directly, sorry.)

&amp;#x200B;

[https://postimg.cc/CRMSYzd3](https://postimg.cc/CRMSYzd3)\----&gt;OPEN

[https://postimg.cc/WhwTQMpm](https://postimg.cc/WhwTQMpm)   \----&gt;CLOSED",AskEngineers,False,FishingF00L,/r/AskEngineers/comments/f6nwvq/linkage_design_for_folding_cup_holder/
88,What university is best for mechatronics engineering in Melbourne Australia,1582170603,"I want advice on what uni to choose. I’m confused between Monash and rmit. But rmit’s degree is called manufacturing and mechatronics engineering . So for those who completed it or know about it, does rmit only focus on making systems good for the manufacturing industry or do they teach you how to make innovative devices and robots that use artificial intelligence. So I want to know what is the differences between the degree that Monash offers and the one that rmit offers.
Also in case I chose the wrong uni do I have to start the degree over in another uni or can I continue from where I left off .",AskEngineers,False,john91768,/r/AskEngineers/comments/f6n3al/what_university_is_best_for_mechatronics/
89,Why isn't hydrogen peroxide powering everyday cars?,1582170078,"I've done little reading on it but it seems viable. Theres some dragsters online that use it. It does seem dangerous in it's virgin form, how dangerous? Very little info on the interwebs, thanks!",AskEngineers,False,CowboyKiIIer,/r/AskEngineers/comments/f6mz93/why_isnt_hydrogen_peroxide_powering_everyday_cars/
90,What questions should I ask an interviewer?,1582167228,"I Have my very first internship interview tomorrow. I have researched the company, but not able to find much on what specifically i would do in the role, and not sure what i should ask my interviewer.",AskEngineers,False,sickricola,/r/AskEngineers/comments/f6mcct/what_questions_should_i_ask_an_interviewer/
91,How should I answer potential questions about my loyalty to a sinking ship company?,1582165487,"I’m a junior engineer at a company that’s been experiencing some cash difficulties and other problems over the last year. A huge chunk of employees and middle management has been quitting during this time as well. New hiring, promotions, and bonuses have been cancelled.

I don’t think I’ve been able to learn any technical skills. Almost all the sub-projects I was looking forward to working on to learn skills were postponed indefinitely due to money shortages.

My senior manager randomly pulled me aside one day to tell me stories about how the strongest engineers are created in times of difficulty and will rise to meet the challenge, are fortified by adversity, so on and so forth. He also mentioned how sticking with a company through thick and thin until it achieves success will be tremendous boost to my career.

It’s hard for me to see a future in the company and I feel like my career is tanking the longer I stay, but I don’t know how easily or quickly I can find a new job. If I stay, I don’t know whether or not things will get better, since all the company has done recently is struggle with fundraising. 

Now I’ve heard that, to address employee departures, management is now going around to employees to casually ask if they plan to stick with the company and whether they can be counted on to bring success to the company. How should I prepare for questions about loyalty if I’m asked?",AskEngineers,False,federaltart,/r/AskEngineers/comments/f6lyiw/how_should_i_answer_potential_questions_about_my/
92,Constant mix-ups and stupid mistakes,1582165360,"I work in an area where attention to detail and precision is virtually the #1 job requirement.  

However I consistently do something stupid like mix up similar numbers 22.3 or 23.2. Or maybe I write out a long detailed email to someone and forget that on this day it should actually be  sent to someone else.  Or maybe I get 10 AR's and I do one of the 10 that required following up with someone and I forgot to follow up. Or maybe I forget to check one of the 10 random things I'm supposed to check. 

I may make anywhere from 1-4 of these mistakes per week. They really piss me off and are virtually the only reason that people get pissed off at me.  As harmless as such small mistakes sound, they can cost a lot of stress and failure for us. 

Is this just a part of being a new engineer...? Am I being too harsh on myself? Should I be hard on myself and agonize to improve?",AskEngineers,False,OrganicMemer,/r/AskEngineers/comments/f6lxif/constant_mixups_and_stupid_mistakes/
93,"If i wanted to make a large pressure chamber (2 cubic feet) , would a thick resin or epoxy be an okay idea for strong walls, or should i go with welded steel ?",1582163176,"Im building a pressure chamber to cast resin molds in. Apparently some of these liquid polymers/ resins/ polycarbonate are rated at 8k psi and up. The pressure box would only need to hold about 50-60 psi . Am i missing something here?

Else i'll go the old fashion way and weld a steel box together. 

thanks so much for the help!!",AskEngineers,False,MrNomad101,/r/AskEngineers/comments/f6lg96/if_i_wanted_to_make_a_large_pressure_chamber_2/
94,"I just started my first full-time job in which I get every other Friday off (the hours in a two-week pay period still add up to 80). My dad (who’s also an engineer) told me that I should still show up to work on those off-Fridays anyway, to do more work and stand out. Is this reasonable?",1582160957,Title basically says it all. Do y’all think this is reasonable? I want to make myself look good for my new boss but I don’t know if it seems reasonable or ridiculous.,AskEngineers,False,HeheYoItsYaBoi,/r/AskEngineers/comments/f6kxtf/i_just_started_my_first_fulltime_job_in_which_i/
95,Does this flatness spec. make sense? Can the flatness be greater than the width tolerance here?,1582154971,"Example: https://i.imgur.com/jXjstY2.png


I've seen this in a few drawings at my current workplace and am having a hard time wrapping my head around it. I thought that flatness was supposed to be a refinement of the form, which in my example it is not. Can anyone explain why this makes sense or is it just a mistake?",AskEngineers,False,-SG,/r/AskEngineers/comments/f6jjpe/does_this_flatness_spec_make_sense_can_the/
96,"For those of you that have become engineering managers, what are the pluses and minuses? Are there some engineers that are better as managers than technical experts and vice versa?... how can we discover which we are better suited?",1582151494,"The large company I work for has two tracks for engineers: technical and managerial. They pay for and encourage engineers to spend about 5% of their time on further education wether technical and / or managerial type of classes through our local university or through online courses like MIT and eCornell.  
  
How did you decide to take the technical or managerial track?",AskEngineers,False,SunRev,/r/AskEngineers/comments/f6iob7/for_those_of_you_that_have_become_engineering/
97,Vacuum system to pick up and move small objects,1582151015,"Hi does anyone know if an off-the-shelf vacuum system exists that would allow small objects to be picked up and then moved/dropped elsewhere? The objects would weigh less than a few grams. Or if an off-the shelf vacuum system doesn't exist, does anyone know the best way to go about assembling such a small vacuum system?

I suppose the motor servos could be added separately. The system I am envisioning would be no bigger than the size of a small desktop 3D printer.",AskEngineers,False,bigchungusmode96,/r/AskEngineers/comments/f6ijyk/vacuum_system_to_pick_up_and_move_small_objects/
98,Reasons to Use a Flow Meter in Dental Implant Manufacturing,1582150485,"I have a technical sales interview coming up and I am going to have to pitch a $1000 flow sensor to ""manufacturing engineers"" who work on dental implants. 

The company sent me this video for reference:  [https://www.youtube.com/watch?v=\_v7AncbtMK0](https://www.youtube.com/watch?v=_v7AncbtMK0) 

I was thinking flow sensors could be beneficial in regulating coolant for the machining process and some of the sanitizing fluids they use to sterilize the implant. What other manufacturing processes could a flow sensor be useful for?",AskEngineers,False,CommonFace1,/r/AskEngineers/comments/f6if42/reasons_to_use_a_flow_meter_in_dental_implant/
