index,title,created_utc,selftext,subreddit,media_only,author,permalink
0,question on truck components,1549733861," i'm learning about the aerodynamics of wind deflectors &amp; wind breakers in trucks. i'm pretty new in this area, i apologise if my question seem really basic, are wind breakers and wind deflectors just different name for the same thing? or are they two different components?

are there any resources online that i can use to learn more about these truck components?

thanks in advance.",AskEngineers,False,spiral_and_sound,/r/AskEngineers/comments/aouhc0/question_on_truck_components/
1,Could use some advice choosing between internship offers,1549733622,"I’m a mechanical engineering student in the midst of a career change from corporate finance and accounting. I used to do financial analysis and modeling for manufacturing companies before deciding to go back to school. 

I’ve had two internships with Lockheed Martin doing mechanical (fatigue) testing, but being in my junior year of the degree plan and having only one summer before I graduate, I thought it would be a good idea to try for an internship supporting a design group, especially since my CAD skills at the moment are extremely limited. 

I tried like crazy to get a design internship at Lockheed and finally got an offer yesterday for their space systems division in Colorado (I applied to this position last fall). However, I already accepted a summer internship last month with a natural gas terminal company in Houston since I had already been rejected from so many other design internships, and wanted to be sure I secured something for the summer different than mechanical testing so I can expand my skill set. The natural gas terminal  internship seems like it will be heavy on project management vs. true engineering tasks, but it seems that it will offer more responsibility for an intern/entry-level engineer than Lockheed would. Based on my research, the natural gas terminal company would likely offer $10-20k more per year in starting salary, which I would assume is due to the nature of their respective industries. 

Do you think it would be detrimental to my career to not have a design/CAD-heavy experience on my resume before jumping into a project management type of role? Would you rather start your career with a company that makes products that are more interesting to you but would likely offer a significantly lower starting salary and slower career progression due to the large seniority-favoring bureaucracy that exists? 

My ideal career path would be to grow into a project management role with a company that makes truly interesting products, such as Lockheed, but as an older student it’s somewhat important to make up for “lost time” in my engineering career, but on the other hand, it’s been drilled into my head that every mechanical engineer needs industry design/CAD experience and I don’t want to shoot myself in the foot by missing out on that. 

I have 4 more days to decide, and I’ve changed my mind probably 4 times since I was notified about the Lockheed offer. 

Any thoughts on my dilemma would be appreciated and would help me along with this tough decision. Thanks!

",AskEngineers,False,mechewannabe,/r/AskEngineers/comments/aoufva/could_use_some_advice_choosing_between_internship/
2,Any environmental engineers?,1549733154,[removed],AskEngineers,False,Geojere,/r/AskEngineers/comments/aoud4h/any_environmental_engineers/
3,Is there any handbook/ website where I can find the physical properties of epoxy- ceramic powder composites ?,1549730845,I am looking for physical properties of SiC (10% wt)- epoxy and alumina(15% wt)-epoxy composites.,AskEngineers,False,test_77,/r/AskEngineers/comments/aotzg1/is_there_any_handbook_website_where_i_can_find/
4,Does associates degree transfer easily into bachelors?,1549729996,"I’m currently in the military working as a technician, and will be getting out once my contract is up. I like my job as a technician, but I want to use my GI bill to get an engineering degree when I get out. In the mean time, I’d like to get ahead by earning an associates degree while I’m still working in the military. Does an associates of engineering typically transfer well when later trying to earn a bachelors?",AskEngineers,False,AdmirableSwordfish,/r/AskEngineers/comments/aotukg/does_associates_degree_transfer_easily_into/
5,Am I an electrical designer or an electrical design engineer?,1549717955,"I've always wondered what my title would be in english, as I'm not from an english speaking country (Swe). When translated using translate or a Google search, I get both ""Electrical Designer"" and ""Electrical Design Engineer"" as answer. So let's /r/AskEngineers.

&amp;#x200B;

What do I do for a living? Keeping it short, I sit with AutoCAD or Revit day in day out and draw electrical wiring for all kinds of commercial buildings. Some times I'm told how to draw things and some times I have to figure it out by myself so to say. I don't lead projects.

&amp;#x200B;

I have an electrician education but not an engineering one. Although many of my colleagues who share the same ""non-english title"" do have some sort of engineering degree. Obviously, they have more responsibility other than just drawing, things like leading projects and management. But when it comes down to things we do in CAD,  we do the same things.

&amp;#x200B;

The question is, what's the difference between an electrical designer and an electrical design engineer and is anyone able to tell me what my title would be?",AskEngineers,False,Questions1Questions2,/r/AskEngineers/comments/aos7rv/am_i_an_electrical_designer_or_an_electrical/
6,How is it possible to get a shock by touching a single wire inside a building?,1549711295,It makes sense that someone who is standing on dirt can get a shock by touching a live wire. But how is this possible inside a building where the bottom is made of concrete which is non conductive?,AskEngineers,False,eimaikanenas,/r/AskEngineers/comments/aorioh/how_is_it_possible_to_get_a_shock_by_touching_a/
7,Can anyone think of an elegant way to create a lid to a box that will seal and hold atmospheric pressure inside while the box is put under vacuum in an antechamber?,1549710376,"It's easy to design a setup for the lid where you just tighten some fasteners to compress a gasket/o-ring on the lid to prevent gases from escaping the sealed box while the box is under vacuum. But I want to find a way to have the seal not rely on how tightly you compress a gasket with fasteners. Ideally the design would make it so the more vacuum you apply to the outside of the box, the more the gas pressure on the inside would ""set the seal"" (if you get what I mean). Kind of like positive reinforcement of the seal.",AskEngineers,False,Hemoglobin_Brah,/r/AskEngineers/comments/aorfgq/can_anyone_think_of_an_elegant_way_to_create_a/
8,How to write a problem statement for your manager ?,1549709440,"So backstory is that I am an IE student.  Currently working on a project with a group of 4 people to help a business we choose to improve their margins.  The problem is, no one wants to work with a couple of college students unless it's to pay them or they're their interns.

&amp;#x200B;

At any event, my professor gave us 2 more weeks to find a business and so I am trying to hit it out the park with one last business proposal to an animal shelter I volunteer at.  If we can implement a production flow analysis, supply handling audit, prioritization matrice, or even simply create a bill of material for them, I think they would be greatful just because every dollar counts in a business like this.  However, I don't know where to start.  I can't just walk into the manager's office without a gameplan.

&amp;#x200B;

Can anyone offer any advice in which they knew an opportunity was in front of them and found a way to communicate their idea to their boss in any way ?",AskEngineers,False,Ho_KoganV1,/r/AskEngineers/comments/aorc05/how_to_write_a_problem_statement_for_your_manager/
9,What does xv stand for in xv valves? Abbreviation of xv please anyone!!!!,1549706443,,AskEngineers,False,chinnick457,/r/AskEngineers/comments/aor1gq/what_does_xv_stand_for_in_xv_valves_abbreviation/
10,How to fix Flow Lines and Warping defects in INJECTION MOLDING?,1549705540,Please give me some best ways which really help me to get out of these problems ,AskEngineers,False,integrated_solutions,/r/AskEngineers/comments/aoqyjn/how_to_fix_flow_lines_and_warping_defects_in/
11,Need some advice - thanks!,1549702699,"Hi everyone, I’m 20 years old and from Australia, I have a few questions that I would greatly appreciate if anyone could answer some of them, thanks! 
What would be the best course to pursue a career as a race engineer or work in the world of Motorsport? 
I have seen suggestions of mechanical engineering and joining Formula sae/student. But I have also seen some courses in the UK called Motorsport engineering, would it be worth considering these? And moving to the uk to study? Also do you think starting a university course at 20 is too old? Thanks ",AskEngineers,False,lettuceerichannib,/r/AskEngineers/comments/aoqp4u/need_some_advice_thanks/
12,What are good resources on industrial drying?,1549701192,"I’d like to gain more knowledge in industrial(flash) drying, pneumatic conveyoring, fans and heat generation and transfer. What are good resources you could suggest for individual study? I have background in food processing technology but i feel that i need more knowledge in my current position. Thank you",AskEngineers,False,neptunereach,/r/AskEngineers/comments/aoqk4i/what_are_good_resources_on_industrial_drying/
13,Something simple for this sub; designing a book box.,1549700607,"I'm designing a book box for a very dear friend of mine. When it opens I want the books to come up on a corner for easier access and to make the spines more visible. I figured some sort of counterweight system attached to a bar stretching the length of the inside of the box. But then the problem is the lid would be exceedingly heavy and snap closed as soon as you let go of it. So a ratchet. But then it won't close without pulling something out of the way of the ratchet and it would still snap closed.

I have this vision but I have practically no idea how to make it happen. Calling myself a novice engineer would be stretching it. Any help at all whether it be in words or a certain book I should read or even a drawing on the back of a napkin would be greatly appreciated. Thank you.",AskEngineers,False,John_P_Morgan,/r/AskEngineers/comments/aoqi92/something_simple_for_this_sub_designing_a_book_box/
14,What courses to pursue Masters in Weapon Engineering? And what colleges are best for it?,1549695930,I just finished my Bachelor's degree in Mechanical engineering. I want to pursue Masters in weapon engineering and I am more interested in the Arms and ammunition and its design and manufacturing. What are the name of the courses for it? And which colleges are best?,AskEngineers,False,Kill-R_73,/r/AskEngineers/comments/aoq2ee/what_courses_to_pursue_masters_in_weapon/
15,What’s the best torsionally resistant shape?,1549693823,"For a given cross-sectional area I-beams can withstand bending loads better than rectangular beams (right?) but is there a shape that can withstand torsion better than a round rod, for a given cross-sectional area of course?",AskEngineers,False,xlRadioActivelx,/r/AskEngineers/comments/aopu9g/whats_the_best_torsionally_resistant_shape/
16,Is there a microfluidic flow simulation that simulates cell flow?,1549692545,"I’m trying to set up a simulation where I will wash cells settled at the bottom of a test tube with a buffer. Essentially the inlet is pushing fluid in while the outlet is pulling fluid out. The goal is to wash the cells with the new buffer without disturbing them or losing them in the process. A simulation would help optimize flow speed, time, inlet/outlet sizes, etc

What software would be the best for this? Any input is appreciated! Thank you ",AskEngineers,False,reddittor1212,/r/AskEngineers/comments/aopp4e/is_there_a_microfluidic_flow_simulation_that/
17,How do I know if engineering is for me?,1549690758,"  

Hello! I am a high school senior and I am seriously considering engineering but I am very nervous.

One reason I am hesitant is I don’t know if I am good enough for it. I have always loved math, science, and programming during high school and therefore began looking into engineering. I’ve always seen engineers as some of the brightest students and am doubtful I could ever work/learn properly alongside these students, but more importantly stay up to speed with them. Every time I ask the engineering students around me about their opinions of me getting into engineering, they always insist I am underestimating the difficult despite me *never* indicating I thought engineering was easy. I took an intro to computer science class and absolutely loved the little programming we were introduced to. Additionally, I'm in Calc 1 right now and I absolutely love it. Are there any courses I can take in college that might ensure I may do okay in engineering?

Additionally, how did you all decide on your field of engineering? I’m stuck between electrical and industrial at the moment. I leaned towards electrical as circuits were the most interesting aspect to me during physics but once again, when I asked those around me about electrical engineering I was told to “forget about it” because it was too hard for me. Additionally, I really leaned towards industrial engineering as I liked the idea of working in risk management (i.e. hedge funds) as I really liked that aspect of finance and also looked into getting a Masters in Financial Engineering. 

Also, is it impossible to have a high GPA? Once again, please forgive me if I come off as an idiot asking these questions but I was asking because I’m really interested in the research aspect of engineering and was really looking into getting a masters program. I’m coming out of high school with an AA degree with a pretty rough GPA (3.5) and wanted to try to keep my GPA reasonable during the next 4 years and was wondering if that was possible. I must also note, I spend hours and hours studying as throughout my years in high school I’ve had to resort to teaching myself. I’m graduating #6 in my school and while my stats are decent to an extent, I’m not the best test taker (I got a 1390 on the SAT and many of the upperclassmen around me have been shitting on me saying it clearly indicates I’m not cut out for engineering) but that’s a flaw I’m currently working on perfecting. Pretty much what I’m saying is that I’m willing to commit many hours to my work.

Once again, I apologize in advance if I sound uneducated about engineering, I must remind everyone, all those around me refuse to actually give me valuable information that might help me decide whether or not engineering is right for me.

Thank you all in advance for any piece of advice is unbelievably valuable to me!",AskEngineers,False,biancav56,/r/AskEngineers/comments/aophww/how_do_i_know_if_engineering_is_for_me/
18,Pneumatic air cylinder that can hit 100m/s,1549687339,"[https://www.youtube.com/watch?v=cYBIq74IikE](https://www.youtube.com/watch?v=cYBIq74IikE)

Looking to build something like this with the quick exhaust valves. I need the piston coming out of the air cylinder to hit max 100m/s. How possible is it to achieve this, and any tips on parts I need???

My undergrad research project requires the need of a piston like this to hit 100 m/s, should i scratch the air cylinder idea all together?",AskEngineers,False,TStolpe29,/r/AskEngineers/comments/aop32u/pneumatic_air_cylinder_that_can_hit_100ms/
19,Making an episode about Prosthetics. What would you like to see?,1549686535,"I host an engineering podcast called Everything Engineering, and we'd appreciate learning more about what you'd like listening about in the world of prosthetics. 

What topics would you like us to tackle in our episode?",AskEngineers,False,jarar14,/r/AskEngineers/comments/aoozfh/making_an_episode_about_prosthetics_what_would/
20,Work from Home for New Grad?,1549685789,"I am graduating this year with a degree in environmental engineering, and have been offered 2 jobs. Both would be doing fairly similar work, but one is at a traditional consulting company and another is at a ""remote"" company with no brick-and-mortar office. I am leaning towards the work-from-home job because it seems like a great company, and it would allow me to live where I want, have more free time and avoid the traffic/stress of the GTA (I live in Ontario). My only concern is that I may not get the same level of mentorship as I would from working in an office. Does anybody have experiencing working from home as a new grad? What are the pros/cons?",AskEngineers,False,hooblydoobly25,/r/AskEngineers/comments/aoow7g/work_from_home_for_new_grad/
21,Is it possible to build racing aircraft with steam turbine ducted fan engine?,1549684527,"Is it technically feasible to build a racing steam turbine ducted fan aircraft using modern technology and materials?
There were several studies on this subject in early 50s tand Pratt and Whitney engineers designed two engine 600 mph aircraft with supercritical water boiler and 49000 hp steam turbines with high pressure steam condensers.",AskEngineers,False,Dm2403,/r/AskEngineers/comments/aooqdc/is_it_possible_to_build_racing_aircraft_with/
22,Mechanical Engineer getting started in the utility industry?,1549677554,"Hi everyone! I'm a recent graduate with a degree in mechanical engineering, and Im currently working in the utility industry. My primarily role is in supporting power plants and I'm looking to learn as much about the job/industry as possible. I am hoping someone will be able to recommend some books or other resources that will help me learn more about mechanical design, applied thermodynamics, piping systems, pump system design, the electrical grid, gas turbines, and anything else related to power plants/the utility industry. Any input in greatly appreciated. Thank you!!",AskEngineers,False,stokes112,/r/AskEngineers/comments/aontpf/mechanical_engineer_getting_started_in_the/
23,Making an episode about prosthetics. What would you like to see?,1549677054,,AskEngineers,False,jarar14,/r/AskEngineers/comments/aonrbf/making_an_episode_about_prosthetics_what_would/
24,What do Ixx and Iyy mean? (Moment of inertia q),1549676109,"additional question:  what's the difference between Ixc and Ix?  

https://i.imgur.com/XpESQ9i.png",AskEngineers,False,egadsby,/r/AskEngineers/comments/aonmp2/what_do_ixx_and_iyy_mean_moment_of_inertia_q/
25,How do airplane carburators work?,1549671915,"Carburators in cars and motorcycles usually are very sensitive to hight. How was this problem overcomed by old airplanes?
Bonus question: how fuel injection worked before EFI? I've read a little about injected engines in WW2 airplanes, but I not sure how.",AskEngineers,False,DeepDay2,/r/AskEngineers/comments/aon14w/how_do_airplane_carburators_work/
26,"Doubting my abilities, need advice.",1549669897,"Hey all,

I'm having a bit of... how would you say it?  A crisis of faith in myself. This post is gonna be somewhat long and rambling and for that I apologize.

Some background: Graduated with a Materials Engineering degree, spent a little less than 2 years working as a pseudo engineering assistant manager on a big project in a big corporation.  It was interesting but I was doing no less than 70 hours a week and it was killing me (being hourly and getting overtime was pretty awesome though). Then I got a job as a mechanical/materials engineer for a small company.  40 hours a week has been great.  I learned a whole bunch very quickly, but almost immediately the engineers senior of me were let go.  I've been here for 5 years now and for 4 of those I've been the only engineer. This has had its pros and cons.  Pros: I've had to learn how to solve every problem myself, and have become quite resourceful.  I've engineered solutions for larger companies that we contract for and they've all been successes. Cons: I've been limited to what I can learn online or books I've purchased, also the inevitable mistakes along the way.  A few times I have had to admit defeat and tell my superiors that certain things are beyond my ability, but there's been no movement to enhance or augment my abilities (no money for that kinda thing).

This last part is what's getting me right now.  Since I haven't worked on a team or with people with more experience, I have no idea where I fall in terms of experience or skill level.  I don't know if there are some fundamentals that I've been missing out on and stuff like that.

The last couple years I've felt like I've stagnated and am no longer learning.  I've been looking at jobs but the doubts of my own abilities are causing me a great deal of anxiety.  What if I get a job and it turns out I can't do it or even the basics? My current position is boring , but stable.  I think after 5 years I've outgrown my salary, and am looking to advance in experience and pay.  (and before you say it, raises are completely out of the question, another reason I have to move on.)

I guess my question is really has anyone else experienced doubt in their own abilities?  How did you deal with it?

Any career advice going forward?  I obviously can't waste any more time here.  Should I be forthcoming about doubts in my abilities at a new position?  Or should I strive for an entry-level job to start from the ground up?

Thanks for taking the time to read.  I apologize if it came off as a pity party but I really do want to make some changes.",AskEngineers,False,DorkyChupacabra,/r/AskEngineers/comments/aompzh/doubting_my_abilities_need_advice/
27,Advice request about wages.,1549669235,I hoping to get some advise and perspective about my salary. Currently I am a sophomore  doing a mechanical engineering co op in Manhattan. My concern is that I feel that I am being underpaid because I only make $18 per hour while the minimum wage is now $15 per hour. At my previous internship I was making $15 per hour while the minimum wage was only $7.25 per hour. Thoughts?,AskEngineers,False,Wenry_Hill,/r/AskEngineers/comments/aommdi/advice_request_about_wages/
28,A materials relared question regarding motorcycle armor,1549669165,"I bought a set of riding jeans that are extremely comfortable, and since I'm prone to fall for the latest and greatest advertisements, I bought the thin armor inserts for the hip and knee pockets designed to hold armor. The material is advertised to use ""nano damping technology"" which I assume is marketing speak for a viscoelastic material. The problem I ran in to with these is while I don't doubt they provide the level of protection they're certified for, they're essentially 7mm thick sheets of rubber when I'm walking around, with regards to how easily they build up on themselves. I eventually got tired of having to go to the restroom to fix the placement and bought a different brand of more rigid knee protection with the same certification. These aren't going to be stealthy, but they'll easily pop into place if they move. 

After a bit, I got to thinking about whether there would be any additional protection from using both sets, the thin, pliable material on the further from my knee in the pocket and the more rigid armor closer to my knee where I can easily move it into place if needed. The resulting sandwich of materials would be human knee, foam reinforced with whatever the armor company uses to reduce impact force, viscoelastic sheet, covec pants liner, denim. I'm not asking how much difference the would be, I understand I'm not providng enough information to get that kind of answer. In asking if it would be at all beneficial or if I should set these aside until I buy another set of riding pants and use these as hip inserts. ",AskEngineers,False,shuvool,/r/AskEngineers/comments/aomlzu/a_materials_relared_question_regarding_motorcycle/
29,ISO: EE Help On a Home Project,1549668433,"Hello! I’m in the brainstorming process of building an automatic tennis ball launcher for my dog. These innocent creatures need the love of engineers. The basic launch mechanism I’ve chosen is a motor directly rotating a wheel which will be elevated slightly less than the height of a tennis ball off the ground, and essentially the tennis ball will be fed under it. 

I’m not too familiar with motors, but I’m assuming a simple AC motor will be good for my needs? My plan is to have a trigger midway through the feeding mechanism that activates a timer to run the motor for a set amount of time so that the dog can use it whenever he wants without the motor constantly running. 

A few questions:
1) As far as motors go, an i on the right track? What RPM/torque/hp would you recommend?

2) How would I wire a switch (which will only be momentarily activated) to a timer? I’m assuming the timer is simply part of the circuit connecting the power supply to the motor, but how would a switch fit into this circuit to activate the timer?  (here is what I’m thinking, open to suggestions: Lysignal 400w Trigger Cycle Timer Dual MOS Tube Control Board Time Delay Switch Circuit Replace Relay Module for Motor, Light Bulbs, LED Lights, DC Motors, Micro Pumps, Solenoid Valves https://www.amazon.com/dp/B073W7Q5FY/ref=cm_sw_r_cp_api_i_i9GxCbEDMQV8T)

3) I’m open to any and all suggestions/ conversations on the subject. Please ask questions if you don’t fully understand my thought process!

Thanks in advance for all help!",AskEngineers,False,atocha34,/r/AskEngineers/comments/aomhtq/iso_ee_help_on_a_home_project/
