index,title,created_utc,selftext,subreddit,media_only,author,permalink
95,"If a digital camera used logarithmic ADC by raising the analog gain applied to shadow regions and lowering gain applied to bright regions, what good or bad effects would appear?",1550674415,"I was brainstorming ideas on how digital cameras can increase the range between bright and dark that can be captured (dynamic range).

I know most digital cameras follow a linear curve then apply a compression curve (gamma or log curve) to fit it into a narrower number range. A solution I thought of was to have the sensor apply more analog gain to the darker regions and lower the amount of gain applied to bright regions that collect more photons. A fixed base will be used (such as 10). The same number range will be used at the AD conversion stage (such as 12-bit). The ISO can be raised (thus raising the gain applied).

For my idea, would it raise or lower the ISO/EI (exposure index) needed for optimal dynamic range? What new problems should be addressed? Is base 10 the best for the compression curve (this means 10^x is used to convert into linear after ADC stage)? What questions or comments do you have? Thanks in advance.",AskEngineers,False,cpu5555,/r/AskEngineers/comments/asp79y/if_a_digital_camera_used_logarithmic_adc_by/
96,How do you prepare for the technical portion of an interview?,1550671207,"I've been in the same position for almost 4 years and have started to test the waters and see what might be available for me out in the job market. I can generally talk well about what I do, how I do it, and how it relates to the job at hand. However, when thrown an abstract technical question that is meant to determine my understanding of some of the basics of engineering (things that I learned in school as a freshman or thereabouts) I'm generally left floundering. 

How would you prepare for an interview with that in mind?",AskEngineers,False,Crendes,/r/AskEngineers/comments/asoms2/how_do_you_prepare_for_the_technical_portion_of/
97,Justification for Robotics Master's to employer,1550669722,"I'm trying to justify my choice of Master's to my employer, so that he approves it for funding. Can you guys help me come up with ideas where I can autonomize production?


I have a MechEng degree, and I'm working in a military contractor facility as a Manufacturing Engineer. We work on low volume specialty power systems. The common denominator here is that we use a lot of wiring accross projects, and we recently purchased an automatic wire stripper and cutter. We are currently kitting wire, already cut to length and stripped on one end. Though, it takes a person to physically manipulate the computer GUI, take the cut wire and bag it, tag it, and kit it with the rest of the wires.


I suggested that we can purchase a robotic arm to do this manned process, and work overnight. But this was not enough for my manager. He wants to push systems engineering, but I'm not too fond on specializing in ""meeting requirements"" engineering.


Any automation engineers out there that can give first hand experience in common scenarios?",AskEngineers,False,tecatecs,/r/AskEngineers/comments/asodzt/justification_for_robotics_masters_to_employer/
98,Does anyone have any tips on finding a summer internship in any engineering orientated role? (I'm a first year mech eng student),1550669403,,AskEngineers,False,MugiwaraOtaku,/r/AskEngineers/comments/asoc4c/does_anyone_have_any_tips_on_finding_a_summer/
99,How to measure torque in a rotating system on a budget,1550668153,"I have a dynamometer at work that we use to test electric motors, both AC and DC. The Dyno is good for about 1500 ft-lbs @ 1800 RPM (~500HP).

My research initially pointed to an in-line torque transducer and I reached out to about 5 different companies. Initially, I oversized our requirement for 2500 ft-lbs and the numbers that came back were all in the neighborhood of $15k.

I've requested an update in pricing for the lower-spec'd unit but in the meantime, is there another method to measure and record the torque on these motors? Perhaps one that may save a few $$$$?

A few of the options I am considering:  
[Datum M425](https://i.imgur.com/mZGoHlH.png)   
[PCB 2650-NR](https://i.imgur.com/yaF8F5m.png)  
[Magtrol TM316](https://i.imgur.com/gDNSm49.png)  ",AskEngineers,False,YOURE_A_MEANIE,/r/AskEngineers/comments/aso4ys/how_to_measure_torque_in_a_rotating_system_on_a/
0,"If you were sent back (to the stone age) with just one item, what would leads to civilisations self-destruction the fastest?",1550664941,Just a spin on yesterday's interesting thread.,AskEngineers,False,DCFC_CFD,/r/AskEngineers/comments/asnnmx/if_you_were_sent_back_to_the_stone_age_with_just/
1,What is the typical starting salary for an new E.I. at a coastal engineering firm in Florida?,1550663461,,AskEngineers,False,flyguy305,/r/AskEngineers/comments/asng08/what_is_the_typical_starting_salary_for_an_new_ei/
2,How's the work of a commercial engineer?,1550659733,"Many companies on my region are looking for a commercial that has engineering background, which I was surprised, and intrigued. Is there any engineer on a commercial field that could give me a feedback, specially on things like:
Is it challenging and motivating?
Do you stop doing engineering to focus on more economical-social skills?
Do you evolve your knowledge in engineering, or just on the business field?

",AskEngineers,False,Belaized,/r/AskEngineers/comments/asmyb6/hows_the_work_of_a_commercial_engineer/
3,Performance of compressors if rebuilt into vacuum pumps,1550658156,Is there a relationship between the pressure a compressor can achieve at the outlet and the ultimate vacuum it can achieve at the inlet? Looking to do a modification similar to this one and I'd appreciate an estimate of how effective it will be. https://www.instructables.com/id/convert-a-tire-inflator-type-air-compressor-into-a/,AskEngineers,False,Wiz_Kalita,/r/AskEngineers/comments/asmrfr/performance_of_compressors_if_rebuilt_into_vacuum/
4,Year 12 student - looking for advice on the different engineering fields to study at uni,1550654505," I’m a current year 12 student looking at doing engineering for uni. Unfortunately I am very unsure what field of engineering to study, civil or mechanical looks very interesting to me at the moment. If anyone could tell me their opinions on the different fields as I am not very knowledgeable, it would be much appreciated. Thanks.

Also thinking of studying at RMIT so if anyone has information about what it is like there I would love to hear.",AskEngineers,False,samosthegod,/r/AskEngineers/comments/asmbc1/year_12_student_looking_for_advice_on_the/
5,Engineering Fields,1550652184,"I’m a current year 12 student looking at doing engineering for uni. Unfortunately I am very unsure what field of engineering to study, civil or mechanical looks very interesting to me at the moment. If anyone could tell me their opinions on the different fields as I am not very knowledgeable, it would be much appreciated. Thanks. 

Also thinking of studying at RMIT so if anyone has information about what it is like there I would love to hear.",AskEngineers,False,samosthegod,/r/AskEngineers/comments/asm0yj/engineering_fields/
6,"Why do round tubes got out of round when being bent? E.g simply supported, cantilever etc",1550651732,"As the title says, I’m wondering why tubes go out of round under a bending load.

E.g a simply supported beam will go most out of round at its midpoint.

Is this due to the poissans ratio of the material? Causing a circumferential expansion on top and contracting on bottom, thus changing the shape of the profile (“out of round”).

I’m talking about smallish loads within elastic lints and prior to onset of buckling...
Not talking about tube bending process. Just deflection..

This eventually has detrimental effects on the stiffness since the out of round tube has a lower Second moment of area value, and thus shows greater deflection than would be expected without taking this into consideration.

Thanks in advance!",AskEngineers,False,ayyydo,/r/AskEngineers/comments/aslyzy/why_do_round_tubes_got_out_of_round_when_being/
7,Springs in series question,1550647649,I’m a little confused about springs in series and how spring length relates to stiffness. I can make a long spring that has a K constant of 4. I can also make two. smaller ones with a K constant 4 with the same units. For some reason though if I attach them to form the same length as the longer spring the combination will still be weaker because of reciprocation? Is “longer springs are weaker springs” a fair statement? And where’s the line between attaching two short springs and buying a long spring. ,AskEngineers,False,IdaXman,/r/AskEngineers/comments/aslgnz/springs_in_series_question/
8,How can I introduce engineering to youths?,1550646503,"I’m a first year ME and I recently signed up to volunteer at my local RAF cadets squadron. After some background checks and interviews I’m starting my probationary period this Friday. 

During my interview we discussed what I could bring to the cadets and the suggestion of engineering was very positive. I might even take the role of a ‘STEM officer’. 

I feel a great responsibility to answer this charge and do the cadets and engineering proud, so I would really appreciate any suggestions/ideas of ways to inspire them into the field of engineering. The cadets ages typically range from 12-18.

I intend to spend some time developing this myself anyway but I would be silly not to reach out to you guys on Reddit 

I should also mention the OC is an EE by trade so I don’t expect much friction, at least in suggesting some ideas. 

Thanks",AskEngineers,False,pissening,/r/AskEngineers/comments/aslb9o/how_can_i_introduce_engineering_to_youths/
9,"Hello, I need help making a negative ion generator.",1550646185,"So I need to charge a powder with negative energy.
I don’t really know what to do but I was wondering if I could use an ion generator or something I could buy and modify.
I’d like to hear your suggestions on how to tackle this project.
Feel free to ask anything in the comments.",AskEngineers,False,Mrhorny247,/r/AskEngineers/comments/asl9rb/hello_i_need_help_making_a_negative_ion_generator/
10,How many of these thermo electric coolers would i need?,1550645465,"Hey, I want to try and cool a small storage container during the summer that is outside in the shade that is 2.5 feet tall, 2.5 feet wide and 3.5 feet long that wont require me spending too much money on an AC unit since its such a small space. how many of these thermo-electric coolers would i need to keep the storage container around 70-75 degrees F in 100-110 degree F weather and would it even work? ( [https://www.amazon.com/Northbear-Thermoelectric-Peltier-Refrigeration-Heatsink/dp/B07535M68N/ref=cm\_cr\_arp\_d\_product\_top?ie=UTF8](https://www.amazon.com/Northbear-Thermoelectric-Peltier-Refrigeration-Heatsink/dp/B07535M68N/ref=cm_cr_arp_d_product_top?ie=UTF8) ) or if you guys have any other ideas on achieving this without an AC unit, be free to let me know. thanks",AskEngineers,False,Aphrodisiatic,/r/AskEngineers/comments/asl61l/how_many_of_these_thermo_electric_coolers_would_i/
11,Helical bar for URM retrofit stitching?,1550643767,"The manufacturers only provide specifications like slot depth, recommended spacing, but not the added resistance. I can't find any design guideline anywhere, only the specification guideline. 

I have the applied loads, how do I calculate the added strength? I checked Eurocode, CSA, and FEMA.

Can any kind stranger direct me (or give me the link) to some kind of design clause for retrofit stitching? Do I look at it as regular ties?

Thank you

&amp;#x200B;",AskEngineers,False,helicaltieQ,/r/AskEngineers/comments/askxi8/helical_bar_for_urm_retrofit_stitching/
12,NEED MATLAB FOR PROJECT,1550642793,I need the latest version of MATLAB for a University project. Anyone who has the same or a little older version please send the link to me ASAP. Thanks!,AskEngineers,False,Yolo13452,/r/AskEngineers/comments/askskl/need_matlab_for_project/
13,NEED MATLAB,1550642037,[removed],AskEngineers,False,Yolo13452,/r/AskEngineers/comments/askome/need_matlab/
14,How do I unstick a zipper?,1550641419,"Ok engineers of reddit, my girlfriends zipper has been stuck for weeks on a pretty expensive coat, and as a second year mech eng student i thought i could think my way through it. But alas, the first idea was to grease it and that didnt work, the second idea was to cut the tooth that its getting stuck on but that would void the warranrt. She can get it sent out for repair but i thought id try here first, give me your knowledge",AskEngineers,False,bmcle071,/r/AskEngineers/comments/asklbr/how_do_i_unstick_a_zipper/
15,"I have a B.S. in ME, but went into construction project management for 4 years after college. I am interested in changing career paths and going into the automotive industry as an engineer, but am apprehensive of the change. Any advice on where to start?",1550640853,"Obligatory apologies in advance if this is the wrong place, but I couldn't find anything on Google that could help me.

&amp;#x200B;

A few key concerns and pieces of information I want to share:

* I am located in Bay Area, CA, US
* I haven't done any engineering work since college. No use of engineering fundamentals (dynamics, thermo, fluids, etc.), calculus, or physics.
* Where do I start with rebuilding/refreshing my engineering knowledge? Purchase a FE exam study guide and run through them until I feel confident to take the exam?
   * Or should I go back to each textbook from my core engineering classes and really take the time to learn everything (expecting this to take time that I'm afraid I don't have)
   * Night classes aren't really an option considering my job demands 12h+ a day
   * Youtube lectures?
* Do I even have a good shot at this? Non-engineering friends tell me yes, but I'm afraid I don't possess the technical knowledge and lost my chance at it. I am excited, but I'd like to be realistic.
* If I don't have a good chance at becoming an engineer in the automotive industry, I am still interested in the field, but don't know if or how I can get my foot in the door
   * Even if I'm not crunching numbers and solving equations, I want to be part of a team that can make an exciting product come to fruition
* What are companies going to be looking for and what kind of knowledge am I expected to have?
* I do love construction, but I want to leave my company. I don't want to/can't put up with the hours and work-life balance (or lack thereof).  I feel like now would be the best opportunity for me to get into another field
* Not sure if relevant but I'm making a little over $100K salary.

&amp;#x200B;

Again, I am a construction project manager. Although I don't feel confident in my technical knowledge, I love solving problems, putting out fires, and getting creative with it.

Even as I'm writing this, I'm a little anxious thinking about the judgement of anonymous redditors. But, I am extremely excited to work towards changing my life for the better. Or at least I can say I tried.",AskEngineers,False,fuckyouyouthehorse,/r/AskEngineers/comments/aski9u/i_have_a_bs_in_me_but_went_into_construction/
16,Would a modern music venue balcony be designed to withstand concert spectators jumping in sync to the beat of music?,1550639270,"Do modern designers of arenas generally take into account the possibility of spectators jumping up and down on a packed balcony in sync to the beat of music?

[This video post from the WTF subreddit is what prompts the question. It looks like a potential disaster. SFW](https://www.reddit.com/r/WTF/comments/ashlkm/stadium_disaster_just_waiting_to_happen/)",AskEngineers,False,infrikinfix,/r/AskEngineers/comments/ask9kj/would_a_modern_music_venue_balcony_be_designed_to/
17,Help finding first job,1550636944,"Graduated 10 months ago with B.S. Materials Science and Engineering with a 3.73 GPA (top 5 program) and have not even received a single offer. Have had 4 interviews. I'm not sure what more I can do right now.  Experience-wise I had one internship that I returned to for a 2nd semester and my Senior project. I've been working a survival job since graduating.

1. I need to get my application numbers up.

I regret picking my obscure major even though I loved the content. I can hardly find jobs to apply to between LinkedIn, Indeed, Monster, CareerBuilder, Aerotek, etc. Most technical positions are completely outside of my experience range. Where else should I be looking for jobs? How do I apply to non-technical roles my experience is pretty much just lab work?

2. How can I build a network if I don't have a job?

   Everyone keeps telling me to network but I don't even have many close friends. Who is it okay to approach looking for advice? How do I transition that into opportunities? How do I do this without being so desperate and transparent?

3. Am I considered toxic if I've been job hunting for so long?

   At this point, I'm competing with the next graduating class to look for a job. Is it a huge red flag that it's taken me so long?

4. What are my options if I'm just unemployable as an engineer?

&amp;#x200B;

&amp;#x200B;

&amp;#x200B;",AskEngineers,False,throw2964,/r/AskEngineers/comments/asjww7/help_finding_first_job/
18,With the how expensive it is in NYC would it be reasonable to use oil rig technology to expand the city?,1550636886,"Such as linking many of them together, or for questionable areas such as Dead Horse bay to build solid foundations?

Decades ago the military was toying with the idea of building a modular sea base that could be moved around. https://en.wikipedia.org/wiki/Mobile_offshore_base",AskEngineers,False,blakdart,/r/AskEngineers/comments/asjwky/with_the_how_expensive_it_is_in_nyc_would_it_be/
19,Should I consider switching to Mechanical Engineering?,1550636859,"I want to major in an engineering field. So naturally, I decided to try electrical engineering, which is the hardest one from what I’ve heard. Recently, I started taking a class called, intro to digital systems. Suffice it to say, I am not enjoying this class. I am not sure if it’s me or the professor, but I have a hard time understanding what I’m even supposed to understand. However, I have recently found out that I like to design things and use my powers of spatial reasoning. My question is essentially will I have to grapple with incredibly abstract concepts in mechanical engineering like in electrical engineering? Or, am I deluding myself? Also, is mechanical engineering easier in the sense that it doesn’t quite go as far as ee in terms of the math? I don’t look forward to slaving away over quantum mechanics or electromagnetism.",AskEngineers,False,saintlupin,/r/AskEngineers/comments/asjwfw/should_i_consider_switching_to_mechanical/
20,Meeting interviewers at conference after Skype interviews?,1550635473,"I've been interviewing with a company by having multiple Skype interviews with them. The final interview is this week. However, they are also hosting a technical conference soon that has nothing to do with our interviews, but this is over a week from now. From what they told me so far about when they think they'll decide to hire me or not, that date seems to be close to the date their conference will be held also

Is there anything I can do to use the upcoming conference as a way to improve my chances of hiring me? Maybe telling them that I plan to attend the conference and would like to meet them would give them a better chance to know me and thus increase the odds they'll hire me?
",AskEngineers,False,thraway14,/r/AskEngineers/comments/asjorx/meeting_interviewers_at_conference_after_skype/
21,make me feel better - tell me your overseas manufacturing horror stories,1550632848,"I work for a US consumer goods company. We make plastic injection molded stuff. Due to relentless cost pressures from retailers we manufacture in China. We work with four main factories and they're all so, so horrible. I'm sure there are great factories in China, but we can't afford them. Anyone with their shit together is undoubtedly out of our price range. 

&amp;#x200B;

**situation 1:** Factory A was out of spec on the snap features for a new product. I told them they needed to modifying the tool to get in spec. This takes a week and they shoot new parts, which we fedex to the other side of the Earth, which takes another week. I measure the parts and nothing has changed. I tell them nothing has changed, but they swear up and down that they revised the tool and shot new parts. I tell them to revise the tool again and send new parts. Two more weeks go by and same thing. I'm going ballistic and trying to get the people who control the money to put the fear of god into the factory, but instead I just get a lot of ""Maybe it's a language barrier issue? Have you tried sending pictures?"" Yes, we sent pictures. They're called tool release drawings. I also sent them photos, videos, illustrations, and all manner of emails. Rinse and repeat one or two more times and we finally get parts that work. 

&amp;#x200B;

Four months down the road and their sales rep was feeling chatty (drunk or whatever) and confides on Wechat to one of our employees that the actual problem was that Factory A just wasn't paying their toolmaker's bills, so the toolmaker wasn't doing any work. Instead of getting a business loan or whatever to smooth over their cash crunch, they just lied to us, causing us to waste hundreds of dollars in fedex fees, and more than a month of time, countless hours of my own time, and years from my life. 

&amp;#x200B;

**situation 2:** Factory B is awarded the contract to produce a product. All along we've been clear that the strap is supposed to be silicone. We get the first samples and notice that the silicone strap is an amazingly good color match for the TPR overmold on the product. Great! Then we notice that the strap is getting permanent elephant skin wrinkles, and has a permanent kink. It smells like a garbage fire and feels gross. ""This part was supposed to be silicone. Are you sure this is silicone?"" ""Yes, this is absolutely silicone."" 

&amp;#x200B;

I take the strap outside and heat it with a lighter. It melts, making flaming drips, and the strap catches fire and sustains it without the lighter. ""We think this is TPR."" ""No, I promise it is silicone, but it is injection silicone. \[i.e. LSR\] Maybe you don't like injection silicone? We can make it from pressed silicone instead."" Surprisingly they retool the part for pressed silicone without any charge to us. They send us new parts and they're exactly what we wanted. It only delayed our project by a month. 

&amp;#x200B;

A year and  a half later, we're discussing another new project with them. We ask if this product can be made from TPR. The sales rep for Factory B says they don't think that would be a good idea because it would wrinkle and form a permanent kink just like when they used TPR for that strap on that other project. He'd totally forgotten to maintain the lie. ",AskEngineers,False,designer_or_engineer,/r/AskEngineers/comments/asj9ed/make_me_feel_better_tell_me_your_overseas/
22,Is there any need to change the oil on a new car at 660 miles/1000 km?,1550632386,"Is there any truth to the ""run in"" period or the manufacturer putting a different type of oil in the engine that would require the oil to be changed as soon as 660 miles/1000km? It seems early to me, and the manual says to follow the manufacturer's guidelines (obviously) but there are a few people on the Internet who seem to think oil should be first changed on a new car after 1000km due to the excess of metal shavings that get in the parts during the manufacturing process. ",AskEngineers,False,Sm4cy,/r/AskEngineers/comments/asj6sj/is_there_any_need_to_change_the_oil_on_a_new_car/
23,Question about retrofitting existing home columns,1550629711,"Calling fellow civil engineers. 

How would I tie this column to the foundation?

Basically I was in my crawl space (house was built in the 60s) and noticed that the support columns in my house aren't physically connected to the beams above or the foundation below. I imagine that this was up to code 60 years ago, but given that I live in a fair high seismic zone I think it'd be good to at the least tie them in. The column to beam connection is fairly straight forward, but I'm mostly curious about how to attach the column to the foundation? Can I just drill in an epoxy anchor? What about existing rebar? Edge distance? What code would pertain to this? 

Thanks for any help.",AskEngineers,False,dangerous03,/r/AskEngineers/comments/asir0o/question_about_retrofitting_existing_home_columns/
24,Prolonged break from school along with a out of state transfers. Help me please...,1550628911,"I’ve been away from school a long time due to family issues I had back in 2014. I attended FAU In Florida for two years until around 2014-2015 and now 4 years later I’m in Southern California. La area to be exact. I’ve put it off too long since I haven’t found a steady job that would allow me the opportunity to go back to school. Now that I’ve found specifically that.  I’m looking to go back to school. 
I’m looking for a university with a thriving engineering department so I can pick up where I left off and be able to get my head back in the game. I’m trying to find the best school that is ABET accredited. Any and all advice and opinions are appreciated! ",AskEngineers,False,drealmuto1993,/r/AskEngineers/comments/asim6c/prolonged_break_from_school_along_with_a_out_of/
