index,title,created_utc,selftext,subreddit,author,permalink
74,I have dropped a USB drive down the gap between the external stairs and next door's fence. How can I fashion something to get it back?,1442152573,"Pictures are below. We have external steps, and the drive has fallen down this gap. The bottom of the gap is a storey below, so it is about 10-12 feet down,  the gap itself is about a foot/8 inches wide.

The drive is being suspended by some thick cobwebs, but there is potential for it to fall down further. I already tried a long cable with a laundry scoop attached to it to try and scoop it out, but it did not work. I need something to ""pinch"" or grab it really. 

Can anyone advise how to get this back? I'd really appreciate it as there is a lot of important data on there. Thanks all.

Images: http://imgur.com/a/gW4LM

See the little red pixel about 40% down on the first image? THAT'S the flash drive. Send image has it circled and zoomed in. The other images are just to show the gap.",AskEngineers,xenochria,/r/AskEngineers/comments/3ks7b6/i_have_dropped_a_usb_drive_down_the_gap_between/
75,"Would you rather work for a company you love with a job you hate, or work for a company you hate with a job you love?",1442147214,"Obviously it's not that black and white, but which would you?

I'm starting my career, and have two offers.

One for an awesome company, great vacation, benefits, culture (social events), etc. I think the job will probably be somewhat boring though, as it would be entirely documentation (but I would learn a lot).

The second for a decent company, okay benefits, okay culture, but with lots of stress and overtime. The job itself sounds really interesting, though, as I'd wear multiple hats in design and test.

Obviously the ideal is having the awesome company with the awesome job, but that seems hard to find. I also have no idea what either job will be like, but this is what I gather based on reviews of the work at each company. Which would you rather have, and what would you recommend? I am also a person who doesn't particularly do well under stress, so that's something to consider.

Thanks!

EDIT: This seems to be an important factor so I'm adding this: The awesome company is an electronics design software company, so pretty much all computer/desk jobs (there are sales jobs, but there's no design or innovation in that). This means I don't think they have jobs I'd be happy with long term. The second company I'd be working on electronic materials design and test which is what I want to do.",AskEngineers,imarealengineer,/r/AskEngineers/comments/3kryin/would_you_rather_work_for_a_company_you_love_with/
76,"Just got a research opportunity developing GN&amp;C systems for fully autonomous quadcopter drones. While I have an extensive programming and computational engineering background, this is still uncharted territory for me. Would love to hear any advice from professionals/hobbyists. Thank you!",1442144816,[deleted],AskEngineers,[deleted],/r/AskEngineers/comments/3krv1i/just_got_a_research_opportunity_developing_gnc/
77,"Very confused about my future, how should I proceed.",1442129471,"First of all thanks to anyone who takes the time out to answer this. TL;DR at bottom.

I am, or at least was, a student studying towards a degree in Aerospace Engineering from the University of Sheffield (relatively good British university), however I failed at the end of second year and only have 2/3rds of the credits required to pass though to my third and final year.

At this point I'm just looking for some advice on where to go from here. Should I try to complete my degree by perhaps repeating a year or moving to a different university. Should I stop with higher education and start applying to jobs, in which case what kind of jobs should I be applying to and what sort of salary should I be willing to accept. I have no previous job experience actually working in engineering but I have experience working in retail and also some awards that I received during university for producing winning concepts in group design projects.

For some background information about me as an engineer:
My practical skills and teamwork skills are excellent and I'm most comfortable when working hands on or with projects in a group. Unfortunately I had very little opportunity to exercise these skills during my studies which were heavily focused on theory and analytic skills, things I find it very difficult to engage with. I also performed best academically in my programming and materials modules and performed worst in thermodynamics and mechanics.

TL;DR: I've failed my Aerospace Engineering degree after 2 years and don't know what to do next.",AskEngineers,Pro_Procrastinator,/r/AskEngineers/comments/3krcvl/very_confused_about_my_future_how_should_i_proceed/
78,Should engineers become romantically involved with engineers?,1442124291,[removed],AskEngineers,crocodile_in_denial,/r/AskEngineers/comments/3kr6kk/should_engineers_become_romantically_involved/
79,How to calculate the life expectancy of a fan?,1442118604,"Hi guys, I'm trying to calculate the life of a fan, such as a computer fan or heat exchanger fan, at a certain given rpm. I feel like it would be a relatively straight forward equation but I wouldn't be surprised if it was way more complex. Any help is appreciated.",AskEngineers,Dreams_of_Flight,/r/AskEngineers/comments/3kqy2s/how_to_calculate_the_life_expectancy_of_a_fan/
80,What wattage laser would be sufficient for engraving ABS?,1442115345,"I'm building a laser engraving machine, primarily for engraving ABS plastic, but I'm not sure what wattage laser I should use. Would a 200mW red laser be powerful enough, or would I need something more?",AskEngineers,tupendous,/r/AskEngineers/comments/3kqsno/what_wattage_laser_would_be_sufficient_for/
81,I think i invented a perpetual motion device.(In theory) Can this really work for free energy?,1442114646,"imagine the wheel of fortune board, made of a metal magnetic material. Around the top it has saw teeth, but curved like a shark's dorsal fin, so the peg attached like the wheel of fortune clicker pointer thing at the top could only slide across the teeth in one direction. if the wheel and peg were given the same charge or polarity(not sure which word is correct) and the teeth were at the correct angle, size, shape, etc. Would it be forced to keep spinning around the center axis because the magnets repelling each other?


**edit** 

thanks for the info, i guess im not onto anything... but at least im not the only dummie to think of this",AskEngineers,Bashi_Hart,/r/AskEngineers/comments/3kqrds/i_think_i_invented_a_perpetual_motion_devicein/
82,is fracture of a brittle material always caused by tensile stress?,1442112955,"Greetings Engineers! I'm currently studying brittle materials such as concrete or adobe and i couldn't find a definite answer to this question. Is there a case in which the failure of the brittle material is not caused by tensile stress?
 
Thank you",AskEngineers,SnarkyPuppey,/r/AskEngineers/comments/3kqocc/is_fracture_of_a_brittle_material_always_caused/
83,How would I design an HVAC system for a tiny home?,1442107966,[deleted],AskEngineers,[deleted],/r/AskEngineers/comments/3kqeuo/how_would_i_design_an_hvac_system_for_a_tiny_home/
84,What are these paving and exterior cladding materials?,1442106796,[deleted],AskEngineers,[deleted],/r/AskEngineers/comments/3kqcmc/what_are_these_paving_and_exterior_cladding/
85,How strong is black iron pipes and how do they handle Canadian winters?,1442106503,"I built a simple free standing pull up bar using black iron pipes and black iron fittings. The pipes are all all 1 inch thick. I weigh 220 pounds.

Here is the setup http://imgur.com/i26rj68. 

My plan is to put it on my balcony and I'm hoping to leave it there pretty much forever. Is that possible? Also I want to add something under the T sockets in the middle, would wood be the best bet? Anyone have any ideas on how to make it stronger/safer?

EDIT: I think I'm going to do what /u/VengefulCaptain suggested and add in 2 2x4 to make the base a little stronger. I also saw some people mention elsewhere to put sandbags on the base and that should also help. So far it seems this should be fine for winter and rain. ",AskEngineers,SofaIsLife,/r/AskEngineers/comments/3kqc1p/how_strong_is_black_iron_pipes_and_how_do_they/
86,A mechanism to drive differing outputs based on input rotation?,1442091756,"Hey,

I've been poking around inside an old ""robotic"" toy (along the lines of a Furby, but older and less sophisticated), and one of the more interesting things about it is that while it can perform multiple different actions, it is all driven by a single motor.

So if the motor is driven one way, it rotates output shaft A and performs action A, but if the polarity of the motor is reversed, A is stationary and B rotates.  It seems like there's some degree of locking of the non-rotating output when driven, but I haven't forced the output sides very hard.

I'm sure there must be a variety of different ways to achieve this sort of rotation-dependent output splitting, but unfortunately the guts are in a sealed plastic gearbox that I doubt I can open without permanent damage.

The obvious solution I came up with would be a pair of opposing ratchet-type drives, so for a given direction, one slips and the other drives the output, but I'd expect some amount of noise from the pawls if that were the case.

Is there maybe some other form of directional clutch or cunning design that could be used here? I'm much more interested in *possible* ways of doing it, rather than the precise method used in this toy (which is almost certainly just the cheapest).

For bonus points, is there any way you could multiplex more than 2 output shafts for a single bidirectional input?

Thanks!",AskEngineers,shobble,/r/AskEngineers/comments/3kpgy6/a_mechanism_to_drive_differing_outputs_based_on/
87,Why are so many entry level engineering jobs asking for 2+ years of experience?,1442082801,,AskEngineers,[deleted],/r/AskEngineers/comments/3kovzs/why_are_so_many_entry_level_engineering_jobs/
88,What clear plastic is strong enough to support a person for my photography project?,1442075411,"I'm doing a photo project and want to make a clear stand for someone to get on top of while the camera is below them. Here is what the set up would [look like](http://imgur.com/jGLoEMp). This is what I hope the photo would [look like](http://imgur.com/MuaHEbH). I want to show the bottoms of peoples feet as well as various urban environments around them.

I need a sheet of clear plastic or glass that is 34"" x 18"". It has to be 15 inches above the ground, held up by wooden walls on each side. How thick does the plastic or glass need to be to be able to support about 250 pounds at the most, and where can I get something that size?

EDIT: Thank you all for your great suggestions. I decided to go with 1/4"" plexiglas and I screwed it down to a wooden support. No cracking or barely any bending when stepped on, though I'll need a stool to get people on it. Here's a photo of the [finished product](http://imgur.com/gAvl4Jv)! If you're interested I'll share the final photos with you when they're done",AskEngineers,ynthona,/r/AskEngineers/comments/3koff0/what_clear_plastic_is_strong_enough_to_support_a/
89,Need information about Phillips 66 and Chevron Phillips,1442070073,[deleted],AskEngineers,[deleted],/r/AskEngineers/comments/3ko3rh/need_information_about_phillips_66_and_chevron/
90,[civil] Why is it so common to have tunnels lined with tiles? Why is tile preferred over other options?,1442060325,"I've never gotten out of my vehicle in a car tunnel, but the walls look to have shinny tile on them. Is it actually tile, and if so why?",AskEngineers,thequbit,/r/AskEngineers/comments/3knnkv/civil_why_is_it_so_common_to_have_tunnels_lined/
91,"Help, needing life advice.",1442043440,[deleted],AskEngineers,[deleted],/r/AskEngineers/comments/3kn4hn/help_needing_life_advice/
92,How to make the best of a luncheon?,1442041471,"Senior EE student here.
I will be attending a luncheon with professionals in my field of interest, Power Systems, very soon. I am very anxious about it because I want to make the best of this opportunity, internships, co-op; so I wonder: 
- what types of questions should i ask?
- what should I do/ not do?
- how can I be interesting, make connections and make a good impression?
- what are some advice you can give me, from your own experience and perspective?
",AskEngineers,Corey110,/r/AskEngineers/comments/3kn27j/how_to_make_the_best_of_a_luncheon/
93,I'm going down the wrong road and continuing to gain experience in this field is limiting me to only this road.,1442037363,"I'll try to give as much detail as I can, but I can't get too specific. My true interests are in machining and true machine/part design. I like 3D modeling and designing parts or assemblies. Things that involve thinking about the manufacturing process needed to produce that part\machine and using that knowledge to come up with a good design. I have many years of hands-on machining experience and I know how to run lathes, mills, CNC's, bridgeports, etc. I absolutely loved it. I loved working in the machine shop. My time in machining was before and during school, but my senior year I ended up taking a job in MEP (HVAC and plumbing design). This is a totally different branch of engineering. I stayed there for almost 2 years and now I'm at a point where I really need to get into what I'm interested in and what I have experience in, but I've been on quite the search and it seems like the only jobs out there (in my area) right now are ""mechanical designer"" (a trick-word for plumbing/HVAC drafter). Back before school I really thought that spending time in the machine shop would really help me out after school insofar as getting a job that I enjoy. I just can't make myself enjoy MEP. I don't like the constant overtime, disrespectful emails and phone calls from contractors, mundane/tedious drafting all day, and I don't like that I'm not being challenged. It bothers me that I have so much hands-on experience, yet I'm spending 100% of my time drafting and doing response documents in MS Word. I could have easily done this job before my degree. I am using 0% of the skills that I learned in school and the skills that I purposely sought out in the machine shop.

I'm 28 years old and I understand that I should be happy to have a job, but I quit a good job that I had to go back to school so I could end up doing something that I enjoy. Now when I send my resume out there, the only companies that call back and send me offers are MEP consultants. Exactly what I'm trying to avoid. Lately this has been driving me crazy and it's starting to make me depressed when I get home and take off the happy work face. I'm just looking for a little advice... Maybe I'm looking in the wrong places or maybe I'm not searching for the right position. The other day I started looking for engineering tech positions hoping that it would be something a little more hands-on. Any helpful guidance from some senior guys or people in the field that relates to what I'm talking about would be greatly appreciated. Thanks for reading!",AskEngineers,Legalcat14,/r/AskEngineers/comments/3kmx97/im_going_down_the_wrong_road_and_continuing_to/
94,Mechanical engineering project,1442021202,"Hi all,
I am a mechanical engineering technician student and in this semester we have shop project. So i have to make a project. I am thinking of making a mechanical iris but I wanna make it so that I could do something using that iris. But i am unable to come up with something. Can you guys help me with some suggestions?
Thank you",AskEngineers,hardy2895,/r/AskEngineers/comments/3km7q5/mechanical_engineering_project/
95,Update: got shilled by HR,1442017958,"[Link here](https://www.reddit.com/r/AskEngineers/comments/3k5tk7/got_shilled_by_hr_what_are_my_options/)

To update. I just accepted the new role. I have more concerns over the market right now, and I cant afford to be unemployed for 6 months. I did however talk to my recruiter about how unhappy I was with the unprofessionalism. They sent a lengthy response that they were not aware of a change until recently, and that I was intended to go into product development, but unfortunately I am not on the budget for them at this moment. This somewhat confused me as Im a new hire, and really cheap. Could be a lie, but it is somewhat comforting.

My old managers and coworkers tracked me down. I explained my situation and they were upset that I was in manufacturing after helping with such a high-profile project, but they said that there were alot (4/5 ME's) of new hires were transferred or let go.

In fact I only recognize one other intern. Our projects were both successful. He was put into a more technical role, but hes a MechE, and I am a EE. 

Nonetheless my old mentor offered to mentor me still, and offered more technical projects to me (in my free time) so I can build technical skills as well as prestige in the company. He was promoted to a managerial position when I was in uni.

Nonetheless, it was really refreshing to see my old managers and coworkers, they were trying to look at the bright side of things. We planned lunches.

I looked into policies. I will be eligible for transfer after 1 year. But considering that I will be the only ME for that tool, means I will probably be stuck there for a while, so I may have to find a new job at that point. I would be okay with this if this job was a good fit for me. But it doesn't line up with my interests, nor personality. But I will give it my 100%, as my old role was that important to me, and I don't want to jeopardize that possibility.

TL;DR I accepted the role change, possble role change in the future.",AskEngineers,LolWut69696969,/r/AskEngineers/comments/3km1lb/update_got_shilled_by_hr/
96,Stribeck curve - lubrication fundamentals,1442008040,"I get it though I don't get it and could use a EL5. Ironically I'm a lubrication / oil guy. I understand all of the terms/parts just just not how they fit together.  I think it's the chart I don't get. 

[stribeck curve youtube](https://youtu.be/WQ8v-UcACTE?t=6m34s)

Thanks",AskEngineers,eftresq,/r/AskEngineers/comments/3klg8c/stribeck_curve_lubrication_fundamentals/
97,What is this called?,1442007019,"I am trying to find this type of tubing, but I have no idea what it's called. I know my desk lamp has it, which is how i got this picture. I'm talking about the part that connects the base to the lamp itself. Please help me figure out what this is! Thanks!
http://st.hzcdn.com/simgs/0be126150dea650a_4-6751/modern-desk-lamps.jpg",AskEngineers,FreightTrain5,/r/AskEngineers/comments/3kldsa/what_is_this_called/
98,Why didn't just the tops of the twin towers fall off above the damaged area? Why did the entire structure fail?,1442003863,,AskEngineers,clitbeastwood,/r/AskEngineers/comments/3kl5zq/why_didnt_just_the_tops_of_the_twin_towers_fall/
99,What would happen if I hooked up let's say 14 volt AC to 12 volt DC lead acid car battery?,1441998728,"I know you should have a diode to flip the field and I am not sure how that works, but if you didn't, what would physically happen in the battery? Would it do virtually nothing since it would reverse the flow of charge each cycle? Or would it discharge more than charge and eventually reach the same potential as the neutral from the main? Or would it heat up from some type of damage?",AskEngineers,kindalike,/r/AskEngineers/comments/3kktx9/what_would_happen_if_i_hooked_up_lets_say_14_volt/
0,Playstation Silver wired headset has shorted cable,1441997334,"Despite knowing I can't be the only one with this problem.....   I've looked all over and can't seem to find the answer to this question.  Everywhere seems to lead to a link that is selling that product rather than repairing it.
So the question is:  Can the cable leading from the headphones to the usb dongle be clipped and re-attached to a new (or the same) 3.5mm plug?  Are there actual wires inside there?  Or is it that thin loopy crap that falls apart if your cat sneezes across the room&gt;
i would really love to repair these, but I don;t want to completely ruin them in the process.

Any help or guidance (even a link) is greatly appreciated.
Thanks....",AskEngineers,modulusman,/r/AskEngineers/comments/3kkqcj/playstation_silver_wired_headset_has_shorted_cable/
1,"""Gun Barrel"" Drill Bits",1441996169,"Hey everyone, manufacturing engineer here working on aerospace doors. We apparently used to use ""Gun barrel"" drill bits in the past for back drilling. However when the Boeing surplus store shut down access to those bits seem to have disappeared. Any suggestions as to where to find something like this or if there's any alternative methods for backdrilling?",AskEngineers,BuffMcManlystud,/r/AskEngineers/comments/3kknjr/gun_barrel_drill_bits/
2,Help Needed with Pro E- Display Mass on Drawings,1441983771,"Is there any way to automatically populate a table within a Pro-E assembly drawings that would show the model mass? 

My coworkers typically do this manually by measuring each part and changing a note on each drawing.

I have a family table with 75 instances and need to do this more efficiently, there has got be an easier way. 

Using WF4.0 for 3 months now, I was formerly using inventor.",AskEngineers,masshole4life23,/r/AskEngineers/comments/3kjsn7/help_needed_with_pro_e_display_mass_on_drawings/
3,"Failure Friday (September 11, 2015): Did you break something recently? We want to hear about it!",1441972987,[removed],AskEngineers,AutoModerator,/r/AskEngineers/comments/3kj6mu/failure_friday_september_11_2015_did_you_break/
4,Which language is best to learn if I plan on programming robotics?,1441972950,,AskEngineers,UltraCondensedPotato,/r/AskEngineers/comments/3kj6ks/which_language_is_best_to_learn_if_i_plan_on/
5,Trying to find the best way to 'neatly' turn a short &amp; wide belt inside out. Simple concept but proving to be a complex process.,1441965163,"So at work we have short [ conveyor belts](http://imgur.com/YUIxEmf) that (like all belts) are joined inside out, so, once flipped the right way out, have a neat exterior finish. Due to the belts width compared to its length, it doesn't flip inside out creasing it. Some properties of the belt:

- 1mm thick,
- ZERO STRETCH (thanks to the polypropylene beading)
- flexible silicone tracking groove
- ~800mm long
- ~380

At the moment we are just bending and creasing it all over the place with no method, i know there must be a good way to do this i just haven't figured it out yet. It doesn't matter if it is creased, just long as it looks neat 

I have tried putting it through a roller to start a crease and roll it through (kind of like pulling a seat belt through the buckle) - didn't work, it just kept rolling back to its original shape.

the best idea i have that i haven't tried yet, is using a ring (think basketball hoop) and sitting it on the outside and somehow supporting all sides and pulling it though rolling it over a very small radius. This is good in theory but till unsure.

Any suggestions? 
",AskEngineers,kleynoli,/r/AskEngineers/comments/3kivgo/trying_to_find_the_best_way_to_neatly_turn_a/
6,Technical/engineering sales job,1441949689,"I'm about to be graduating with my bachelors in ME in December and I've been looking into different jobs. I sent my resume to a handful of companies for listed positions and the one I've most recently heard back from is for a job a ""technical sales representative"" (entry level) for a pretty large scale company. The base salary is well below the national average for ME entry level salaries but they claim the commission makes up the difference. I was just wondering if anyone out there had taken a technical/engineering sales job after graduation and what their thoughts are? Or just any thoughts in general?",AskEngineers,Winneroftheyear,/r/AskEngineers/comments/3ki9ux/technicalengineering_sales_job/
7,"More of an English question, but in project delivery, what is the correct name of the person who delivers the project and the person who receives the project?",1441947392,I need to have a (Project deliverer signature: _____) and a (Project receiver signature: _____) but these don't sound right to me. I'm also a non native speaker so I'm not really sure,AskEngineers,NeverGotWhooshed,/r/AskEngineers/comments/3ki631/more_of_an_english_question_but_in_project/
8,Really struggling wrapping my head around applied moments and axis of rotation. Can anyone help?,1441944526,[deleted],AskEngineers,[deleted],/r/AskEngineers/comments/3ki12v/really_struggling_wrapping_my_head_around_applied/
9,What to do with burned out blower motor,1441941897,"I recently replaced the 3/4HP blower motor in my furnace/AC.  now I have a big motor that apparently burned out.  the motor never really got hot enough to smoke, the bearings seem to be good, but it just wouldn't go anymore (and made loud buzzing).  
.  
so, what should I do with this thing?  scrap it?",AskEngineers,unrighteous_bison,/r/AskEngineers/comments/3khvxi/what_to_do_with_burned_out_blower_motor/
10,Heating question - sparging steam into a water tank,1441939641,[deleted],AskEngineers,[deleted],/r/AskEngineers/comments/3khrak/heating_question_sparging_steam_into_a_water_tank/
11,Recieved my first job offer of 63k as a Technical Writer with a BS in EE. Is this reasonable?,1441938201,[deleted],AskEngineers,[deleted],/r/AskEngineers/comments/3khoe9/recieved_my_first_job_offer_of_63k_as_a_technical/
12,How do subways survive earthquakes? Will I be safe in one during an earthquake?,1441932536,,AskEngineers,KingGorilla,/r/AskEngineers/comments/3khceo/how_do_subways_survive_earthquakes_will_i_be_safe/
