index,title,created_utc,selftext,subreddit,media_only,author,permalink
0,Automotive ME looking to move from EU to Canada,1551452495,"Hello,

  
I am a Mechanical Engineer working for about 6 years in Mechanical Design. For the first 3 years I worked as a Design Engineer in a Consultancy firm that took on some European automotive clients. The last 3 years I have been working in a fairly large Tier 1 automotive supplier Company as a Development Engineer. My work ranges from Designing and Developing automotive displays to their verification. I also did a masters in Product Design. Currently I am in EU.  


My biggest problem is that after 6 years of experience I am earning way less than I should be. (less than 27K Euros per annum). For exactly this reason I want to move to Canada. Firstly because of lower taxation and secondly because as a Pakistani national, immigrating to Canada is easier and opens the employment door for me to US.   


My questions are

1. What is the demand currently -if any- in Canada for Engineers with similar experience? I would be happy to talk to any ME who is currently working in the same region.
2. What are the ranges of salaries that ME's with similar experience earn in Canada? I have looked at some salary websites but I would appreciate if some engineers here share their numbers.
3. I want to transition towards consumer electronics and product design, are there any startups or small to medium enterprises that hire Mechanical Engineers in this sector?

Lastly I would appreciate if there are any job hunting websites that you would recommend, I already have a profile on [Indeed.com](https://Indeed.com/).

  
Thank you and I appreciate your response.",AskEngineers,False,Excelsior_i,/r/AskEngineers/comments/aw5use/automotive_me_looking_to_move_from_eu_to_canada/
1,Bachelors degree in Applied engineering?,1551449995,Does anyone know or heard of an bachelors degree in Applied engineering degree can it be useful in manufacturing? I am in between this and industrial engineering technology I would like to be a engineer or manager in the manufacturing and production world the classes are very similar to one another but Applied engineering is less credits they are both accredited programs and schools  any advice?,AskEngineers,False,Spartin23,/r/AskEngineers/comments/aw5f86/bachelors_degree_in_applied_engineering/
2,"Would you have install a refrigeration system to cool down a a cabinet or bedroom closet to remain anywhere from 35-55ish degrees Fahrenheit, assuming you can maintain a room tenperature of 60-70ish.",1551449709,"Or could some ice with a few fans and humidifiers sort of method do the trick. If the bottom was a tub of ice with fans to direct the air up an insulated and sealed open space, could the space be a cost effective replacement to building a giant fridge? How much ice per cubic foot of area would this need to maintain a near freezing temperature?",AskEngineers,False,yoyothrowowayy,/r/AskEngineers/comments/aw5dhl/would_you_have_install_a_refrigeration_system_to/
3,What unconventional or non engineering knowledge have you used in your work as an engineer?,1551449573,"I am frequently told engineering incorporates lifelong learning, and I am interested in the areas you have all had to educate yourselves in that college didn't prepare you for. I am wondering mainly about mechanical engineering but I'd love to hear about other fields too!",AskEngineers,False,sciencetaste,/r/AskEngineers/comments/aw5cll/what_unconventional_or_non_engineering_knowledge/
4,Does anyone know of any textbooks or online sources that show options for the internal and external structure design of a rocket?,1551446060,,AskEngineers,False,EngineerDude756,/r/AskEngineers/comments/aw4r4m/does_anyone_know_of_any_textbooks_or_online/
5,3D Model Pipe Scanning? Do you use it?,1551445906,Do any of you have any experience working with 3D modeling of piping using scanning technology?  I work at a small-ish old-school consulting firm that specializes in process and manufacturing engineering.  We work in some big plants with thousands of miles of pipe and I'd like to become more versed in the requirements and see if it would be beneficial for us to give it a shot. ,AskEngineers,False,bnich11,/r/AskEngineers/comments/aw4q9b/3d_model_pipe_scanning_do_you_use_it/
6,Is 5G dangerous too humans?,1551445097,,AskEngineers,False,Criatorm,/r/AskEngineers/comments/aw4lj8/is_5g_dangerous_too_humans/
7,Help with double hinges,1551444624,"I have a 38"" wide deck hatch that needs to lift vertically out of its recess in the deck (4"" deep) and then swing off to the side,  staying parallel to the deck. I know that this requires 2 arms both on pivots but I can't seem to build one without the second one binding somewhere. Does anyone have any tips or tricks, maybe a formula to help me determine the geometry of theses hinges (arms) 
please see this sketch of it helps clarify anything
http://imgur.com/gallery/6jM04qV ",AskEngineers,False,BombasticA-hole,/r/AskEngineers/comments/aw4iyg/help_with_double_hinges/
8,Failure Friday (01 March 2019): Did you break something recently? We want to hear about it!,1551441892,"[[Previously]](https://www.reddit.com/r/AskEngineers/search?q=failure+friday&amp;restrict_sr=on&amp;sort=new&amp;t=all)

Today's thread is for all the recent explosions, broken parts, vendor headaches, and safety violations at your workplace. If nothing exciting happened at your workplace this week, we also like stories about terrible management and office pranks on the interns. 

Some examples of stories that might appear in this thread:

  1. [""That day when your boss almost dies""](https://www.reddit.com/r/engineering/comments/1o1qpr/that_day_when_your_boss_almost_dies/)

  1. [/u/DoctorWhoToYou talks about his time as the Maintenance Manager at a Tier 1 automotive supplier in the mid-90s](https://www.reddit.com/r/AskEngineers/comments/39kp18/failure_friday_june_12_2015_did_you_break/cs4pe6e)

  1. [/u/Hiddencamper talks about that one time when the Emergency Trip System didn't work right at a BWR nuclear power plant](https://www.reddit.com/r/AskEngineers/comments/37plk5/failure_friday_may_29_2015_did_you_break/crp3zsn)

### Guidelines

* **Please share without revealing your identity or workplace, or violating your security clearance!** [We assume no responsibility](https://www.reddit.com/r/AskEngineers/wiki/rules#wiki_legal_disclaimer) for anything that results from your writing here.

* Pictures are welcome, but please include a story to go with it.

* As usual, moderation in this thread will be relatively non-existent — jokes and light-hearted banter are welcome.
",AskEngineers,False,AutoModerator,/r/AskEngineers/comments/aw44ff/failure_friday_01_march_2019_did_you_break/
9,Will my ABET accredited BSc. in ChemEng be recognised in Canada?,1551440735,Ive heard varying answers on this as im planning to move to canada after i finish this shitshow of a degree?,AskEngineers,False,Djentrovert,/r/AskEngineers/comments/aw3yk5/will_my_abet_accredited_bsc_in_chemeng_be/
10,What books do you recommend about RF design?,1551440527,"I'm a first year EE student and I'm working on a non school related project that involves a few RF components like a band bandpass filter, a low noise amplifier and a high frequency peak detector. I'm looking for a book that will help me design a circuit like this and lay out a pcb for it with proper shielding. Also I couldn't manage to find a peak detector circuit that works at such high frequencies. What books do you recommend? 

Note: the operating frequency of the circuit is about 1.4GHz.",AskEngineers,False,itsemre,/r/AskEngineers/comments/aw3xiu/what_books_do_you_recommend_about_rf_design/
11,SolidWorks or Siemens NX?,1551435407,Which one is a better design software for **3D CAD in mechanical engineering?** **SolidWorks OR Siemens NX?**,AskEngineers,False,shouryaveermehta,/r/AskEngineers/comments/aw39t0/solidworks_or_siemens_nx/
12,Why is it possible to have an afterburning turbojet? (detail inside),1551433303,"I understand the afterburn function on a turbofan. You have heaps of bypass air to supply the afterburner. Fair enough.

But a turbojet doesn't have a bypass fan. So if you are to afterburn with it, doesn't that just mean you are running it lean, in order to have air left to burn the fuel in the afterburner? And isn't running these things lean a good way to drive up the combustion temp to dangerous levels?

What am I missing?",AskEngineers,False,NightOfTheLongDicks,/r/AskEngineers/comments/aw30l6/why_is_it_possible_to_have_an_afterburning/
13,An appropriate master's degree path,1551431581,"I've been working as an electrical estimator for an oil and gas contracting company for about 2 years (based in Lebanon)
I've worked on huge projects for ARAMCO and other GCC companies.
Im thinking of pursuing a master's degree in Europe (I basically want out of the Arab region) in hopes of immigrating later on, so I'm considering doing a master's in something with which my work experience can help.
I'm also considering to broaden my horizon beyond oil and gas specifically, as the future seems to be for renewables.

Any advice?
",AskEngineers,False,Sisyphus_Redeemed,/r/AskEngineers/comments/aw2t43/an_appropriate_masters_degree_path/
14,Reliable Load Cell Brand/Company?,1551431312,"I'm looking to buy a single load cell for a research project, but I'm not sure which manufacturer/company/website I should be looking at. I'm looking at both tension and compression with loads that range from 40N to 70N of force. 

Any recommendations? I've never bought equipment by myself and have no sense for which manufacturers/brands are reliable/good/not going to steal my credit card number.",AskEngineers,False,NortheastFunnies,/r/AskEngineers/comments/aw2ryp/reliable_load_cell_brandcompany/
15,Can waveguide-coax Adapters be used in reverse?,1551428386,"Looking online there seems to be loads of adapters to transition from a waveguide to a coaxial cable. However I want to find a transition from a coaxial cable (N) to a waveguide (WR62), and I can’t seem to find any.

My question is, do these exist? Can I simply use a waveguide-coax adapter in reverse? As these are quite complicated components (in terms of the EM waves and physics) I am not sure if it will work in the other direction.",AskEngineers,False,marcolli,/r/AskEngineers/comments/aw2g03/can_waveguidecoax_adapters_be_used_in_reverse/
16,Aerospace graduate having trouble finding a job,1551427682,"As title suggests, im having trouble finding an engineering job. Before i rant or complain, i did make the mistake of not doing any internship during undergrad and i think that has costed me a lot. So ive been looking into how i can recover from that deficit. Ive graduated last april and moved back to my parents house to avoid paying monthly rents and etc until i get a job. But i feel like there were more aerospace engineering or engineering opportunity where i went to school and graduated. I feel depressed staying here unemployed yet i cant really move back out because i dont have any income or savings anymore. And my family is a very conservative asian family where i have to ditch some of my ""own priorities"" to help them out with things as if im a secretary. 

Any suggestions on what else i could or should do because i can feel myself getting more and more depressed and mad everyday. ",AskEngineers,False,Beguzii,/r/AskEngineers/comments/aw2d72/aerospace_graduate_having_trouble_finding_a_job/
17,Best material for university project? (undergrad student),1551425685,"This material is to be over molded (or adhered somehow) to the outside of  an aluminum wheel. It needs to be able to withstand HIGH rpm and a near vacuum pressure. Anyway.... I'm having an  extremely difficult time researching what type of material would be  best and cheapest. I'm new to the engineering manufacturing process and  was wondering if anyone had any suggestions for the best way of  determining this.  If there are any subreddit pages related to this  topic, feel free to link below. I originally posted in r/engineering but determined that my post is more suited for this sub.  Thank you, and if you have any  questions I am happy to answer. ",AskEngineers,False,couchkushin91,/r/AskEngineers/comments/aw24t8/best_material_for_university_project_undergrad/
18,Troubleshooting chinese servo drivers (Yuhai),1551419541,"So we ordered some AC Servo/Driver kits from a chinese crowd called YUHAI and are having mad problems trying to get the communications working.

They run on rs-485 / modbus but there's a load of weird stuff in the manual (broken engrish) and we're having trouble working out how to troubleshoot and how to interpret some of the weird behavior.  
Has a daisy-chain passthrough which gives weird garbled data out, and it refuses to respond to the sample packet format from the manual, so something is obviously going on.   


Servo drivers are not a thing I've played with before, would be great to have someone with experience to troubleshoot with? PM and I'll email you?  


Thanks fam.",AskEngineers,False,alcotron,/r/AskEngineers/comments/aw1aya/troubleshooting_chinese_servo_drivers_yuhai/
19,What type of engineer is this??,1551419237,"Hi Engineers of reddit, I just wanted to ask what type of engineer designs a miniature or rather a small scale version of a future project to be built, testing if it meets specifications so as to confirm the idea is feasible and therefore is up to par to be built as an actual project??",AskEngineers,False,Tryingh_my_best,/r/AskEngineers/comments/aw19do/what_type_of_engineer_is_this/
20,I’m new to working with Engineers and I need your help,1551413289,"I am working in direct hire helping engineers get places with some pretty awesome employers. My area Hs really low unemployment, so I have to “hunt” down most of the engineers I work with. I’ve done a pretty good job learning as much as I can to interview people well,  but I’m struggling to understand how to market/appeal to people who might want to leave a job. 

It seems like I come across a lot of people who seems really miserable in their jobs, and I have opportunities that pay more, have better benefits, etc. but they don’t want to leave a job they hate. 

What would make you want to talk to a recruiter?",AskEngineers,False,Emmagiorgiojordan,/r/AskEngineers/comments/aw0cv9/im_new_to_working_with_engineers_and_i_need_your/
21,"Current EE Undergrad nervous for Internship, any Advice?",1551412264,"Well like I said above, I'm currently an EE undergrad with a summer internship coming up. I'm very nervous because this is my first time doing anything in the corporate realm.

I guess I'm just curious with what to expect. I know that a lot of intern experiences are different, but what should I generally expect? And what can I do to stand out?

Also, I feel very unprepared to be placed into the business world where more is at stake then just my GPA. I feel like I've been studying for the purpose to have a high GPA, not necessarily to learn. With that, I believe that I may lack the skills to thrive in this position.

Last thing, It's not in the industry I want to end up going into after college. It was my first offer after applying for over a dozen internships, so I felt like I had to take it. Will this experience still help me find a good job in another EE industry?  

Any advice, or shared internship experiences would be greatly appreciated.",AskEngineers,False,steamy-gentleman,/r/AskEngineers/comments/aw0709/current_ee_undergrad_nervous_for_internship_any/
22,Material sciences and engineering vs Chemical engineering,1551411641,"I was wondering about the pros and cons of each discipline from actual engineers. I've been on the path for chemical engineering for a little while and almost have my associates. However MSE seems to be pretty interesting due to a little more experimental technology fields. I'm at the point where I could change. Anything y'all could could give me would be awesome, thanks! ",AskEngineers,False,Hunteraln,/r/AskEngineers/comments/aw03hk/material_sciences_and_engineering_vs_chemical/
23,Is double majoring in Mechanical and Aerospace worth it?,1551405989,"Just wondering, considering doubling up for college",AskEngineers,False,darkdesert31,/r/AskEngineers/comments/avz6l0/is_double_majoring_in_mechanical_and_aerospace/
24,Double Majoring?,1551404312,[removed],AskEngineers,False,darkdesert31,/r/AskEngineers/comments/avyx1m/double_majoring/
25,How do you date after engineering school?,1551402072,"There are no women in engineering, and the ones who are are already taken. I had a girlfriend from high school who just dumped me because of long distance and busy working hours. She was a wonderful person but now she hates me and she's an optometry student and found a new optometrist boyfriend. I can't believe I was just a status symbol to her. 

So I need to find new wuv. I don't want to use tinder because I'm not looking for hookups. And I'm finding that a lot of people on dating apps are either very sharp and judgemental or just kinda work at a grocery store and that's their life-long career. Do you know how to do this anymore? To find women who will listen to me about work and not glaze over and change the subject to something smalltalk?",AskEngineers,False,ABigMoo,/r/AskEngineers/comments/avyk0n/how_do_you_date_after_engineering_school/
26,Mechanical Engineer with a maritime background. What experience matters to employers?,1551401407," 

I graduated with a BS in Mechanical Engineering about 2 years ago and began working at a drone startup doing design, analysis, flight testing, cnc, and 3d printing. I got a part 107 drone license in the process. It has been a great experience but the company may not be in business much longer, which has me searching for jobs. 

I have almost 10 years of experience as a USCG licensed captain (100 ton). I work weekends captaining charters and have worked as a commercial fishing deckhand in Alaska. I’ve looked into becoming 3rd AE but months away at sea wouldn't fit into my life right now. I’ve been applying to mechanical and aerospace engineering positions but have gotten almost no responses. It may be possible that employers are confused by differing backgrounds.

Are there any specific sectors or companies that will find my combination of education and experience valuable? Also, am I better off to leverage my maritime experience or downplay it? Ideally, I want to continue working as an engineer in the  drone industry but I’m open to any career path that suits my experience.",AskEngineers,False,broatsndones,/r/AskEngineers/comments/avyg3r/mechanical_engineer_with_a_maritime_background/
27,How did you guys handle being burnt out in college,1551400825,,AskEngineers,False,Raezul,/r/AskEngineers/comments/avycqd/how_did_you_guys_handle_being_burnt_out_in_college/
28,What is the range of career options would I expect if I choice to get a degree for computer science?,1551395177,"Example: Would I be able to go into either robotics, AI, or software development.",AskEngineers,False,xChasex1,/r/AskEngineers/comments/avxdzd/what_is_the_range_of_career_options_would_i/
29,Does it matter where you get your engineering degree?,1551394266,"Title says it all. I've been working in IT for the past 18 months, and I want to go back to school for Electrical or Computer Engineering. Since it's unlikely that I'll make it into MIT or a school with a similar caliber, does it matter where I get my degree? Thanks in advance!",AskEngineers,False,countdown4,/r/AskEngineers/comments/avx85s/does_it_matter_where_you_get_your_engineering/
30,Why can't we maje roads out of recycled plastic?,1551394130,,AskEngineers,False,honey-bees-knees,/r/AskEngineers/comments/avx79q/why_cant_we_maje_roads_out_of_recycled_plastic/
31,Is there a way to leverage excellent PowerPoint and presentation skills?,1551389144,"I know it's going to sound crazy, but for whatever reason I'm incredible at putting together a good slide package and presenting it to people. It's gotten to a point where in every review or presentation I've had, I get explicit comments and compliments specifically about my slide package and how I present it. I'm an early-career engineer just 1-2 years out of school so I don't have much history, but I've had multiple performance reviews either in internships or full-time positions where this has been a particular strength brought up by people I work with.

I know that strong communication skills like this might be invaluable as a higher-level or C-level employee, but as an early-career engineer that seems way too far off and it would be more of a skill that's useful when you're in that position but not necessarily what gets you the position in the first place.

I'm decently proficient in the actual technical aspects of my field (mechanical), but probably only average if I had to rank myself. Any particular way I can play to my strengths to help out my career? Or should I be seeking out a specific type of career where I could use this skill?",AskEngineers,False,leo_27315,/r/AskEngineers/comments/avweq3/is_there_a_way_to_leverage_excellent_powerpoint/
32,Engineers with ADD/ADHD - Did you use or request accommodations to take your FE?,1551388378,"I am registering for the FE and I'm unsure if I should request for accommodation. From what I have found online, the disability is listed under the ADA. In university I took my exams in the Office of Disabilities because there was significantly less distractions and I had a more appropriate time. I'm concerned that this has put me at a further disadvantage because I have not developed any coping mechanisms for a testing situation. I don't like to use the disability as a crutch; therefore I am considering taking it without requesting accommodation to see if I can succeed. It seems like a lot of wasted time and money though if I don't.   


So, my questions are: Is accommodation even an option? Did you find the environment more or less distracting than a typical classroom exam? Is there anything you would suggest doing to prepare for the exam other than prep books? Anddd finally, are ear plugs an option?   


TIA for any feedback. ",AskEngineers,False,ehwrongwhole,/r/AskEngineers/comments/avwa2v/engineers_with_addadhd_did_you_use_or_request/
33,I've been a fearful flyer since 2005 ever since I learned about BOAC Flight 911 and similar accidents. Would a modern plane break up in severe turbulence like BOAC 911 did?,1551388166,"See my other post here - https://old.reddit.com/r/changemyview/comments/avw4bs/cmv_severe_turbulence_can_cause_a_modern_airliner/

Since I address my concerns here. I recently saw a video of a British Airways A320 rocking violently due to rotor turbulence and because rotor turbulence was mentioned it reminded me of the BOAC flight back in 1966. ",AskEngineers,False,DefiantVanilla,/r/AskEngineers/comments/avw8p7/ive_been_a_fearful_flyer_since_2005_ever_since_i/
34,Is it possible to use periscope optics to make an optical zoom for a camera similar to Light L16?,1551388107,"For background, I found out that Asus made a smartphone called the ZenFone Zoom (ZX551ML). It uses a periscope based optical zoom. Oppo made a prototype phone using the same principle. The problem is that it only uses one small digital camera sensor. The Light L16 uses many small sensors and lenses then stitches the images automatically. The problem is that the focal lengths are fixed.

A solution I thought of was combining many small periscope zoom lenses with many small sensors and image stitching. This is because the phone with the periscope optical zoom is still slim. I know periscope optics are used to see around or above. For example, if you want to look above a wall without popping your head up, you can pop up a periscope lens and look through. Is it possible to use the periscope principle to maintain the same level of overlap while adjusting the angle of view at an optical level? Can it support an aperture of f/1.4 or wider all while using 1/1.5 (2/3) inch sensors?

What research has been done on this? What problems should I be aware of? Is it feasible to begin with? What workarounds will be needed?

Thanks in advance.",AskEngineers,False,cpu5555,/r/AskEngineers/comments/avw8be/is_it_possible_to_use_periscope_optics_to_make_an/
35,[Mechanical?] Need a better-quality / lower-tolerance version of this part. Recommendations?,1551387651,"I have a CAD design for a mechanical assembly that relies on a turntable-style bearing (similar to [this one](https://www.amazon.com/gp/product/B01M0G7P04)). The problem with that part is that the tolerances are terrible. Screw holes are only approximately where they should be, for example.

Does anyone know where I can get a similar ring bearing part, but with an actual, accurate dimensional drawing and tighter tolerances to the drawing? I've already checked Boca Bearings and SDP.

thanks!",AskEngineers,False,xoxota99,/r/AskEngineers/comments/avw55p/mechanical_need_a_betterquality_lowertolerance/
36,What happens to engineers that basically fail in the profession...,1551387117,"....because I'm starting to believe I'm one of them.

It's not a lack of ability but rather a lack of desire.   I just can't do it anymore.   I mean literally.   I can't.  I try to push through it but I'm just out of steam. 

I'm just kind of realizing my days are numbered in this profession and I'm trying to get together a plan b before the ax falls.  

To be honest, I'm kind of scared of losing the security this career has provided.   I'm afraid I will lose my job and basically be unemployable at the age of 42.  

Surely I'm not the only one that has been here.  What has happened to those that got the boot mid career?  ",AskEngineers,False,jumpingbean98,/r/AskEngineers/comments/avw1gj/what_happens_to_engineers_that_basically_fail_in/
