index,title,created_utc,selftext,subreddit,author,permalink
39,Any EE's here working/have worked in the Space Science field?,1443120602,"I'm halfway through getting my BSEE, and will then go for the MSEE, and I've decided I want to work somewhere in space science. And it's a broad field.

Frankly, what specialization(s) would be good to learn in order to work on a project that's going somewhere that's not Earth?  ",AskEngineers,SuchACommonBird,/r/AskEngineers/comments/3m8egj/any_ees_here_workinghave_worked_in_the_space/
40,What does your part naming convention look like?,1443119788,"I'm trying to create a naming convention for a set of parts and can't seem to figure out a good system.

(for mechanical stuff but any ideas would help)",AskEngineers,tnied,/r/AskEngineers/comments/3m8cfq/what_does_your_part_naming_convention_look_like/
41,Any recommendations on Vacuum forming esd plastic?,1443111425,"My company is look to do some lean mfg, they want to make custom drawers for tools using diy vacuum forming, thing is that they want to use esd plastic, does anyone know of a material or supplier that they recommend? ",AskEngineers,TheDirtyDrunk,/r/AskEngineers/comments/3m7qy0/any_recommendations_on_vacuum_forming_esd_plastic/
42,Questions for internship/career fairs,1443110211,"I am attending an internship/career fair at my university later today and I am getting quite nervous. I know what questions to ask once the conversation is going, but I am always concerned how to start the conversation with the potential employers. I usually just ask for them to tell me about the company, even though I usually already know what they do. What else should I ask in order to seem more informed, but not too forward?",AskEngineers,danglennwang,/r/AskEngineers/comments/3m7ntw/questions_for_internshipcareer_fairs/
43,What types of distributors to contact to generate leads for my contracting business?,1443108675,"Hello all,

I believe this is an appropriate subreddit for this type of question. I recently started a 3D scanning and rapid prototyping business on the side that specializes in reverse engineering and first-article inspections. I've worked in the field for 5 years previous. 

Recently, an engineer at my current employer suggested that having manufacturer's reps pass out your info is a good way generate leads, and for the reps to make an easy comission. I get the concept and it seems like a great idea, but I am looking for food-for-thought on what type of vendor I am looking for. I currently get a lot of visits from electrical distributors (resistors, caps, etc) but these folks are unlikely to visit the mechanical engineers that I am looking to connect with.

So, I guess that I am looking for input on what types of reps you deal with as a mechanical design engineer, so that I may locate similar companies in my area (Milwaukee).

Thanks in advance for any input!",AskEngineers,kodex1717,/r/AskEngineers/comments/3m7k4j/what_types_of_distributors_to_contact_to_generate/
44,Electrical Socket Seems to Work with Hairblower but not PSU?,1443107838,"Let me give you the full story. PC A and PC B were both working. I decided to swap out the PSUs between PC A and PC B. PC B continued to work after the swap but PC A stopped working. I stripped PC A of everything except the motherboard and CPU and it still didn't work. I decided to return the original PSU back to PC A and it still refused to work. The mobo on PC A gives error code ""Power Supply Unit Failure"" but both PSUs worked with PC B so I know the issue isn't with the PSUs. I decided to move PC A to another electrical socket and it started working. So the issue is with the electrical socket that PC A was using. However:

1. the electrical socket was working fine before I swapped the PSUs.
2. I tested the socket and it reads exactly 120V on my multimeter.
3. I decided to plug in a hair blower which uses like 1000W+ and that worked fine.

So now I'm very confused. Is this an electrical wiring issue in my house?",AskEngineers,some_random_guy_5345,/r/AskEngineers/comments/3m7i0u/electrical_socket_seems_to_work_with_hairblower/
45,what's the proper way to ask for internship?,1443103694,"I had met this person at a professional event; After a short chat, they gave me their business card. They are working in a company that I want to intern at. I am a Junior Engineer student.
I sent them an invitation on Linkedin the next day and they accepted me.
I want to send them a message to ask help getting an internship in their company;  how can I do that without sounding too desperate or pushy?

Thank you in advance",AskEngineers,Corey110,/r/AskEngineers/comments/3m78ef/whats_the_proper_way_to_ask_for_internship/
46,Redirecting heat from a home server closet for maximum heating bill reduction in the winter,1443100987,"I'm a computer nerd by trade, and as such I have a lot of hardware in my home lab, including personal and corporate stuff. Since I own the place, I had 5 circuits brought into my server closet, and if I'm running anywhere near full tilt, it gets hot in my office, especially in the summer. This is exacerbated by the fact that I keep my office door closed to keep the cats out.

The closet sits on an external wall, so venting waste heat in the summertime should be pretty simple (especially if I can get a good seal on a one-way valve of some kind). During the winter, though, I'd like to capture that heat and use it to augment my HVAC, so I have to spend less money burning natural gas.

Directly below the server closet is an open basement. It's poorly insulated, since I'm in Georgia, and construction standards haven't exactly been great until recently. Above is the master bedroom and adjoining bath/hallway (lots of space to dissipate); to the side that's not the office, there's a very small bathroom, whose door to the stairwell/hallway area generally remains open. 

Given that heat rises I would guess that my best bet is the master upstairs, but since fans are also pretty trivial to run (and might be fun to plug into some sort of Raspberry Pi-based temperature control system in the server closet) I'm willing to be convinced that pumping it into the basement or the bathroom is a good idea.

Bonus points to anyone who can give an answer without all the relevant equations but then feels like referencing/discussing some of them so a non-physicist like me can follow along.",AskEngineers,schnarff,/r/AskEngineers/comments/3m72iu/redirecting_heat_from_a_home_server_closet_for/
47,[Help] Need good reference for training of artificial neural networks,1443095622,Hello friends.. I am studying machine learning course on coursera.. I understood that what are neural networks and how can i use them but i can't understand how to train them..i want to make mine in python but i stuck in training part.please if anyone is knows the procedure or any source please guide me. Thank you,AskEngineers,tankmohit11,/r/AskEngineers/comments/3m6t78/help_need_good_reference_for_training_of/
48,What kind of projects would be viable on a planet with 2/3 of earth's gravity?,1443082716,"Okay, so I am a hobby indie game developer. Although my goal is not realism, I would like the stuff to be at least somewhat truthy. So I am thinking of a planet with somewhat reduced gravity. 2/3 should not make character movement look substantially different (you won't need to skip around like on the moon) but should make everything look otherworldly enough.

What could be built there that can't be built here? I am guessing true VTOL planes, ticker armor on tanks, and tall buildings would be leaner. But apart from that, what do you think would look impressive? Would jet packs of some kind be possible?

Thanks for taking interest.",AskEngineers,cincilator,/r/AskEngineers/comments/3m6cyz/what_kind_of_projects_would_be_viable_on_a_planet/
49,"If everyone disappeared in a big city like New York or LA, how long would utilities continue to run for?",1443079903,Are any utilities sufficiently automated in emergencies to continue functioning for any length of time? Any ideas which would go first and which last? Would water work for a few weeks but the internet and phones would conk out immediately?,AskEngineers,SumDumScientist,/r/AskEngineers/comments/3m69jc/if_everyone_disappeared_in_a_big_city_like_new/
50,What is the best replacement of PC/ABS mixture material?,1443062638,"I have been always suffering for cut down the raw material cost.
we are a manufacturer of car mount for mobile devices in South Korea.
The problem is, the competition in this little market getting dense since China has been making reasonable quality product.
Now our strong point is only patented function mechanism and pure PC/ABS mixture material(not recycled) 

We hope that keep the quality but seeking good replacement of PC/ABS mixture for injection molding. 
Please give me several suggestion?",AskEngineers,jhk3180,/r/AskEngineers/comments/3m5gru/what_is_the_best_replacement_of_pcabs_mixture/
51,College Q's,1443059824,"Hi there,

I’ve been looking around for some feedback on the colleges I’m interested in for the engineering field. I would appreciate your thoughts on these subjects: what college did you go to, was the courses more hands-on or book work, did you get many internship opportunities through your school, is getting an internship required for graduating with an engineering degree, what do you think about your professors, and is there any programs/experiences for engineering that set your college apart from others?

Thanks for your feedback!",AskEngineers,isaysupalot,/r/AskEngineers/comments/3m5ap1/college_qs/
52,What's going to happen to the engineers working on the infamous VW engine and their superiors?,1443056550,"The whole affair seems unethical and should have been whistleblown?
Potential lawsuits? Loss of licenses? Future employment options? Penalties?

throw whatever you have at this question :)",AskEngineers,InvisibleBlue,/r/AskEngineers/comments/3m53fi/whats_going_to_happen_to_the_engineers_working_on/
53,Can you build your own Apple Pay system?,1443056106,"Can you use RFID or NFC and build a DIY contactless payment device? Not the reader, but the payment device.",AskEngineers,GuruMeditationError,/r/AskEngineers/comments/3m52ht/can_you_build_your_own_apple_pay_system/
54,Is anyone here familiar with Potter Security Magnet Contacts?,1443055837,"I've been looking at [this](http://www.pottersignal.com/products/10/security+contacts/51/high+security+contacts/107/bmc-33b), the BMC 33B, and wondering if anyone here knows if each magnet arrangement is individual or if the bar from one unit will activate the sensor of a different unit.

Thanks!",AskEngineers,Bluecat16,/r/AskEngineers/comments/3m51wt/is_anyone_here_familiar_with_potter_security/
55,"Sourcing a 150 ton, up-acting hydraulic press for compression moulding; supplier recommendations? Your experience?",1443054697,"Hi,

I'm in the process of sourcing a 150 ton up-acting hydraulic press for a compression moulding applications. I'm evaluating both domestic and off-shore sources. Obviously, the off-shore quotations are significantly cheaper than the domestic ones but - the age-old question - who to trust?

Does anyone here have experience sourcing this type of machinery? Can you recommend a supplier? Any suppliers I should avoid?

Thanks in advance for the help.",AskEngineers,baukus,/r/AskEngineers/comments/3m4zed/sourcing_a_150_ton_upacting_hydraulic_press_for/
56,Why did the Volvo decide to cheat the emission test?,1443049478,"As a recent mechanical engineering graduate, I find it difficult to see how this could happen. Why would someone or group even try and attempt something like this, knowing the consequences. It's unethical and a blatant case of malpractice. I can only imagine how many people internally would know about this. 

Has anyone ever been in a similar situation, being asked to push an inadequate product out the door?

Edit: Volkswagen not Volvo. ",AskEngineers,techy2010,/r/AskEngineers/comments/3m4nqt/why_did_the_volvo_decide_to_cheat_the_emission/
57,Help me settle an argument: Should the width of doors be included when measuring the width of a wall?,1443049359,"As in, you have a 50 meter wall, and you place a 10 meter wide door in it. Is the wall 50 meters wide or 40 meters wide?

Edit: The purpose is to find the perimeter of a rectangular house. Two of the four sides have 25ft long doors.",AskEngineers,Etellex,/r/AskEngineers/comments/3m4nhr/help_me_settle_an_argument_should_the_width_of/
58,What is the best way/ job title to describe my experience?,1443043409,[removed],AskEngineers,dahvzombie,/r/AskEngineers/comments/3m49ak/what_is_the_best_way_job_title_to_describe_my/
59,What is the strongest method of hanging a Torsion Box?,1443042994,"I’m overhauling my current master bedroom into a dual office for my wife and I. The plan is to make two floating desk attached to the wall (Torsion Box Style). Then have a bench spanning the far wall between the two desks that will have shelving beneath it and a torsion box top for seating.

&amp;nbsp;
&amp;nbsp;

I have a few concerns with the torsion box design with load capacity and wall attachment. First off I was planning on following the guide on torsion box from [thewoodwhisper] but he suggest using ½’ ribs and a ¾’ skin which seems like an overkill for a simple computer desk. I plan on doing two different desks, one is spanning 5ft and the other is spanning 8.5ft. Both will be 24in deep, the longer desk will have a wall on both sides and the back, while the shorter desk will have a wall on one side and the back of the torsion box.

&amp;nbsp;
&amp;nbsp;

With ribs being 3in tall and spaces at 7 ¼’in is this strong enough to support a computer, and the usually activities on a work desk? Do i need ¾’in mdf for the skin or would ½’in skin with ¼’in ribs be sufficient reducing the weight?

&amp;nbsp;
&amp;nbsp;

How would you attach the torsion boxes? My only two ideas would be either cleats attached to the wall, then the torsion box screwed into the cleats. Or ¼’ steel rods put into the studs and ¼’ holes into the torsion box for the steel rods.

&amp;nbsp;
&amp;nbsp;

My final question and concern is the torsion box bench. This bench will be spanning 7ft, will be 16inches deep and sit roughly 18inches off the ground. Currently there will be 4 shelves underneath this bench with a wider shelf in the middle(Making two shelves on each side of the wider shelf). With a back on the bench will this be enough support for people to sit and use?

&amp;nbsp;
&amp;nbsp;

Any and all suggestions are welcome, this is one of my bigger projects and would appreciate being able to do it right the first time.

Thanks.
",AskEngineers,WhiteShadoh,/r/AskEngineers/comments/3m4876/what_is_the_strongest_method_of_hanging_a_torsion/
60,What's the consensus for taking a contract/temp job as a fresh college graduate?,1443039181,"I've been getting callbacks from staffing agencies on entry-level contract/temp positions in the medical device industry and I am concerned that this is only temporary with ""some chance"" to become a hire. I've also read that there can be penalties if I choose to end my contract (e.g. quit) early. 

Has anyone taken a contract/temp position? Could you explain your experiences and is it worth taking up one as an entry-level right now? For what it's worth, I'm currently working part-time right now at a startup but I want a full-time position. ",AskEngineers,SizzlinKola,/r/AskEngineers/comments/3m3yhe/whats_the_consensus_for_taking_a_contracttemp_job/
61,Civil Engineering student looking to work as a Water Resource Engineer - What opportunities exist that do not require a Master's?,1443036827,"I go to McMaster University for Civil Engineering. I have interest in designing stormwater management plans and the like. I am told that if I want to get into that line of work, employers require a Master's degree. I am not keen on spending 2 more years in school, so what opportunities are available for someone without a masters?",AskEngineers,confusingphilosopher,/r/AskEngineers/comments/3m3sjd/civil_engineering_student_looking_to_work_as_a/
62,Trying to learn new drafting software: Solid Edge st6,1443035929,"The part is a flat plate with a protruding cylinder. I'm trying to draw a rib from the top of the cylinder to the edge of the part using the rib function. Anyone know how to do this? Or know of an online tutorial I can watch?

Your help is greatly appreciated.",AskEngineers,72scott72,/r/AskEngineers/comments/3m3q8p/trying_to_learn_new_drafting_software_solid_edge/
63,Any M-I SWACO (Schlumberger) guys out there?,1443034296,"Hi guys! I will be starting in December working as ￼￼￼￼Drilling Fluids Engineer Trainee at MI SWACO based in Midland. Haven't received lot of information on the contract. I have few questions that will really help me what to expect:

- What is the rotation like? I asked around and it all varied, some say 3wk/1wk or 15/6?

- I do not have a housing in Midland, so I may need to do some house hunting prior (via Cartus)? or can I do that while Im staying in trainee's house.

- How is the field / shop work in general? I know every segments in SLB are challenging both physically and mentally, but how does it compare? 

Any guidance will be helpful! Thanks in advance. ",AskEngineers,fracnoob,/r/AskEngineers/comments/3m3m36/any_mi_swaco_schlumberger_guys_out_there/
64,Best way to join two pieces?,1443034223,"I am a freshman mech e undergrad designing a frame for a personal project and I've reached a point where my research no longer helps. The parts total length is 12"" but due to 3D printing limitations, the part can only be a max of 8 inches meaning I have to cut the piece in half and join it together. I know I'll be epoxying them together but that's the best way to make them connect? A sort of groove and tongue joint or just interlocking teeth? Even just a &gt;&gt; joint ( cutting out a zig zag? 
Edit: Sorry forgot to mention the shape..it's a hollow rectangular prism, 12"" long x 3"" tall x 3"" wide

",AskEngineers,ic3man211,/r/AskEngineers/comments/3m3lxe/best_way_to_join_two_pieces/
65,clutch and master cylinder incorporated reservoir,1443031456,"What are the additional risks of incorporating the hydraulic clutch system into the  hydraulic brake system? I know all master cylinders have to be split to offer a back up, but besides the risk of moisture contaminating the brake  fluid through the clutch system are there any other dangers? ",AskEngineers,polkabats,/r/AskEngineers/comments/3m3eyh/clutch_and_master_cylinder_incorporated_reservoir/
66,Evolution of Data Storage?,1443031307,"I am trying to make an infographic type of thing that shows how engineering has allowed data storage to evolve. This ""evolution"" would describe how as data storage devices got smaller through the years, the amount of data they store grew.

My problem is finding data that describes this ""evolution"". Where can I find data like this?",AskEngineers,Im_an_Owl,/r/AskEngineers/comments/3m3elc/evolution_of_data_storage/
67,Double flush rivets: grip length variability for a standard size rivet?,1443029605,"If I am riveting two plates together with double flush rivets, but the thickness of the plates is between standard rivet lengths, how can I determine if the longer length rivet can be squeezed down to fit. In specifications I cannot find this dimension/tolerance listed. Can it only be used for a fixed thickness? ",AskEngineers,_diomedes,/r/AskEngineers/comments/3m39xp/double_flush_rivets_grip_length_variability_for_a/
68,Is a degree in Engineering Physics worth it?,1443027521,"Hello,

I am currently a ME student, but I have become really interested in Engineering Physics (or physical technology in German), as it fits my likings better at first glance (esp. job wise).  
This has led´me to thinking about switching my major but after some internet and irl research, I became a bit worried about this decision.

First of all, I have spoken to someone who has studied Engineering Physics and he told me that he has never done anyhting really related to that field in the many jobs he worked. [This really fits the information I gathered from a comment in another thread on r/askengineers](https://www.reddit.com/r/AskEngineers/comments/rf9o9/is_pursuing_an_engineering_physics_major_a_bad/c45c6ce): 
&gt; you probably won't end up with the job or work you expect anyway.

On the other hand, I am sure a degree in Engineering Physics can land you a job in fields like lasers/optics, scientific instrumentation etc. (as consecutive master degrees are suggesting)

Secondly, I was told that I can pretty much do anything in Engineering Physics as a ME. This is really odd to me because I didn't find a single master's degree which is for both MEs and EPs. For example, there isn't a master for laser technology that I can do with a ME degree. How am I supposed to work in this field then? o.O
If this point is really true, then Engineering Physics would be a totally unessential field.

Lastly, what are fields where a EP can shine and are those fields big/represented by many companies? 

So, is a degree in Engineering Physics worth it opposed to one in ME?

Thank you guys!


",AskEngineers,stormrat,/r/AskEngineers/comments/3m34jx/is_a_degree_in_engineering_physics_worth_it/
69,"Civil Engineering Technologist with 10 years experience, best way to go from P.Tech to P. Eng or Bachelors degree?",1443018696,"I am a Professional Technologist with 10 years experience in field inspection, project coordination and site planning for Bridge construction among other roles. I am also NACE Certified Coating Inspector. In my line of work I would like to move to more management role (provincial government) but management is all P.Eng. What steps would most benefit me? I have 2 small kids so school full time is out, I need a paycheck. Thoughts? ",AskEngineers,RadoZ71985,/r/AskEngineers/comments/3m2jat/civil_engineering_technologist_with_10_years/
70,"Career Wednesday (September 23, 2015): Engineering Career Paths &amp; Professional Development",1443009758,"[[Previously]](https://www.reddit.com/r/AskEngineers/search?q=career+wednesdays&amp;restrict_sr=on&amp;sort=new&amp;t=all)

Welcome to our weekly career questions thread! This is the place to ask for advice on engineering careers, including normally restricted topics such as job applications, résumé/CV and cover letter critiques, and undergraduate major selection.

* **This thread is for career questions only.** If you have a technical question, make a new post with your question as the title, and be sure to follow [our posting guidelines](https://www.reddit.com/r/AskEngineers/wiki/rules#wiki_questions).

* **To ensure that every post has a chance to get answered,** consider adding *?depth=1* to the end of the page URL. Also consider sorting by 'new' rather than 'top' or 'best'.

* **Please do not make requests to interview engineers!** Instead refer to the list of engineers that are willing to be interviewed (in the sidebar), and message them directly.

* Remember to follow the [Discussion Guidelines](/r/AskEngineers/wiki/rules#wiki_civility) in the sidebar. This thread is strictly a troll-free environment so that anyone can ask a question without backlash. In other words: **Negative attitudes and comments will not be tolerated.**
",AskEngineers,AutoModerator,/r/AskEngineers/comments/3m21mf/career_wednesday_september_23_2015_engineering/
71,Is induction the range (distance) of work a magnetic field can do?,1443009178,"Im having trouble understanding henries, and more or less just what to compare them to. High henry values obviously mean that they can induce current easily in other objects but is that because the distance of its magnetic field (for example a solenoid) is better? 

And what about superconductors or permanent magnets, what are the henries for them",AskEngineers,blackdowney,/r/AskEngineers/comments/3m20nv/is_induction_the_range_distance_of_work_a/
