index,title,created_utc,selftext,subreddit,media_only,author,permalink
36,Failure Friday (25 January 2019): Did you break something recently? We want to hear about it!,1548417898,"[[Previously]](https://www.reddit.com/r/AskEngineers/search?q=failure+friday&amp;restrict_sr=on&amp;sort=new&amp;t=all)

Today's thread is for all the recent explosions, broken parts, vendor headaches, and safety violations at your workplace. If nothing exciting happened at your workplace this week, we also like stories about terrible management and office pranks on the interns. 

Some examples of stories that might appear in this thread:

  1. [""That day when your boss almost dies""](https://www.reddit.com/r/engineering/comments/1o1qpr/that_day_when_your_boss_almost_dies/)

  1. [/u/DoctorWhoToYou talks about his time as the Maintenance Manager at a Tier 1 automotive supplier in the mid-90s](https://www.reddit.com/r/AskEngineers/comments/39kp18/failure_friday_june_12_2015_did_you_break/cs4pe6e)

  1. [/u/Hiddencamper talks about that one time when the Emergency Trip System didn't work right at a BWR nuclear power plant](https://www.reddit.com/r/AskEngineers/comments/37plk5/failure_friday_may_29_2015_did_you_break/crp3zsn)

### Guidelines

* **Please share without revealing your identity or workplace, or violating your security clearance!** [We assume no responsibility](https://www.reddit.com/r/AskEngineers/wiki/rules#wiki_legal_disclaimer) for anything that results from your writing here.

* Pictures are welcome, but please include a story to go with it.

* As usual, moderation in this thread will be relatively non-existent — jokes and light-hearted banter are welcome.
",AskEngineers,False,AutoModerator,/r/AskEngineers/comments/ajodnm/failure_friday_25_january_2019_did_you_break/
37,Need something equivalent to one of those USB toy fans that can run 24/7/365. Better suggestions than a $50 Maxon coreless?,1548416827,"I'm helping a buddy with an art project, and he's run into a bit of a problem - the little tiny [USB fans](https://ae01.alicdn.com/kf/HTB1ArtKX63z9KJjy0Fmq6xiwXXao/TYPE-C-FAN-New-Portable-USB-Cooler-USB-3-1-Type-C-Port-Mini-Electric-USB.jpg_640x640.jpg) that make it go eat power and don't last all that long. Finding a suitable replacement has been surprisingly difficult. 

1. High quality coreless motors (Maxon, etc) are suitable, but surprisingly expensive - $50USD for anything good for more than a few hundred hours. This is for a sculpture that's likely to never be turned off and must last at least a few months. 
2. RC 3-phase brushless DC motors would work, but the controllers are dreadfully noisy - there's an audible whine at low speeds. 
3. A shaded pole motor is the ideal solution, but it's far too large. (Next time, he's using one from a sous vide machine.)
4. PC case fan motors are ideal and have integrated controllers, but there's no shaft - the magnet assembly is integrated into the impeller. It's possible to retrofit one with a lot of surgery, and at present, this appears to be the best solution.

Any thoughts?",AskEngineers,False,jrshaul,/r/AskEngineers/comments/ajo92p/need_something_equivalent_to_one_of_those_usb_toy/
38,What is a PEXCL Gasket?,1548414601,"Working with Spiral wound gaskets and mixed up gaskets with a green Teflon coating (PTFE) and bare metal ones (PEXCL). Were breaking back flanges to replace them but i'm wondering what is the difference. Cant seem to find much info tru google. Was told that ""pexcl"" meant ""process excluded"" but I am not sure what that means either.

Another explanation was that they are the same but the green Teflon is to provide protection during transit, and should be peeled off (very wary of this) 

Any good resources to research these types of specialized questions would also be appreciated. I have found  that  most a lot of acronyms and terms used on the BOM of a isometric are not very easy to track down online. Mostly with valves but gaskets also.",AskEngineers,False,chikkichakka,/r/AskEngineers/comments/ajo06d/what_is_a_pexcl_gasket/
39,Who Designs Factories?,1548411015,[removed],AskEngineers,False,can-in-a-wine,/r/AskEngineers/comments/ajnn9b/who_designs_factories/
40,is it difficult to become an engineering professor?,1548408792,i recently saw that engineering professors have the highest (if not of the highest) median salary amongst colleagues. why is that the case? ,AskEngineers,False,TheBoyMcFly,/r/AskEngineers/comments/ajnfj3/is_it_difficult_to_become_an_engineering_professor/
41,"Engineers, working in construction field (Civil, Architects, MEP), welcomed ITT!",1548401242,"How you guys are dealing with void closure procedures (walls, ceilings)? We are trying to develop a strategy for that for our new project and trying to not fall into paperwork exercise. Something, which will meet mentionned below parameters:

* Will be effective in terms of time consuming and paperwork.
* Will be trackable and informative for other parties.

Any ideas, past experience etc. will be really appreciated itt.",AskEngineers,False,merchsmann,/r/AskEngineers/comments/ajmosz/engineers_working_in_construction_field_civil/
42,What kind of aspirations can I talk about in a company mentoring program?,1548394555,"My company has a mentoring program where they match up junior engineers (like me) with senior employees that can serve as good mentors in whatever area the mentee wants. I got assigned to a program manager and he knows a lot about the customer facing stuff and also the business stuff, both of which I don’t got much experience with. I intend to move up eventually and get to some kind of position like his or even higher; like I have really ambitious goals.

I’ve often heard that you shouldn’t speak too much about your aspirations cause it could make it seem like you aren’t dedicated to doing a good job at your current role and are only trying to climb that corporate ladder. Also, my mentor is really close with my manager, and I already get the impression that my manager doesn’t really see me as a serious engineer, even though I take my current job very seriously and want to become a better engineer before trying to move up. So what can I actually discuss about my aspirations with my mentor? Like how much would be appropriate to share and how would I phrase it?

Thanks!",AskEngineers,False,shazam405,/r/AskEngineers/comments/ajlx8z/what_kind_of_aspirations_can_i_talk_about_in_a/
43,You guys ever think about how a fart is just a SPST differential pressure switch?,1548390640,Just me? Alright. ,AskEngineers,False,Mallen2154,/r/AskEngineers/comments/ajldv5/you_guys_ever_think_about_how_a_fart_is_just_a/
44,Future ME (hopefully) with sights on the automotive industry.,1548389408,"In all honesty, the only job right now that seems even remotely fun would be to work/design cars and motorcycles. It's obvious that that's what mechanics do, but I care about money. Some people won't be OK with this but I'm just being honest, I want to basically have the role of a mechanic/designer but I don't want a mechanic wage. (working in F1 is like the pipe dream job that I don't even know how to start on)

&amp;#x200B;

Any MEs here who have gotten jobs in the automotive or similar industries who work on the floor and such, how is it? Is it a niche market or can I comfortably find this type of job if I apply myself during my undergrad and become a competent ME?",AskEngineers,False,osburhino,/r/AskEngineers/comments/ajl7r6/future_me_hopefully_with_sights_on_the_automotive/
45,How do I get to work on tunnel boring machines?,1548385226,"I'm a recent Mechanical engineering graduate. I've always had a deep fascination for underground construction, installations etc. Particularly are those fantastic enormous TBM's. 

Basically from what I keep seeing is that tunneling (from a graduates perspective) seems to be more directed to civil engineers. Yet I still want to get involved in the industry. A bit of advice on how to structure my career is what I'm looking for. ",AskEngineers,False,tackyblack,/r/AskEngineers/comments/ajkm8q/how_do_i_get_to_work_on_tunnel_boring_machines/
46,Job and school?,1548383329,[removed],AskEngineers,False,thefrosteesqueen,/r/AskEngineers/comments/ajkc1t/job_and_school/
47,"What are your favorite cheat sheets/reference cards, etc?",1548383000,My boss is always talking about the old days where suppliers always sent out cool quick reference cards and funky slide rule type gadgets.  If you could please post your favorites here I would love to see them.  If you still get them I'd love to know who still gives them out.,AskEngineers,False,wrestlrguy,/r/AskEngineers/comments/ajkabh/what_are_your_favorite_cheat_sheetsreference/
48,Any Civil / Traffic Engineer can advises on the maximum crossfall for private driveway on a very steep road (so cars would not tip),1548381582,Thanks,AskEngineers,False,thomasywy,/r/AskEngineers/comments/ajk2sv/any_civil_traffic_engineer_can_advises_on_the/
49,I was bored at the bus stop.,1548378517,"While waiting for my bus, I just witnessed something that moved me both literally and figuratively. A giant excavator with a demolition attachment rolls down a busy Boston road. The clanking sounds of the tread and shifting arm as it avoided stoplights had me staring the entire time as it passed at like 5mph. The police escort they gave this imposing behemoth of machinery just added to the fanfare of it all while crossing a busy Boston intersection. It was just so fucking awesome to see and feel the vibrations as it rolled along. You see these things from far away all the time but having it that close in such an out of place setting was an awesome experience.

Guys, I think I'm in love. How does one get in on this action? Could you imagine how amazing it would feel to design the circuitry/controls for this and know you had something to do with this almost unimaginably powerful machine?",AskEngineers,False,x0avier,/r/AskEngineers/comments/ajjmlh/i_was_bored_at_the_bus_stop/
50,Dropping out for a job,1548376661,"I woke up this morning late for a class, and fell back asleep after seeing I wouldn’t make it until it was already almost over. After that, I woke up to probably one of the bittersweet emails I’ve recieved. 

One of the recruiters of Boeing offered me a position as a mid-level software engineer due to some of the projects I did back in high school and middle school that I guess impressed him enough to find me. Along with papers I produced with a phd student over material design. The only issue with any of this now is that I realized I hated coding, and that I really want to be an electrical engineer and am currently in my second year.

My question is, what are the drawbacks to dropping out of college to take the job, and what could I gain from staying in college and finishing my degree?",AskEngineers,False,episha,/r/AskEngineers/comments/ajjcae/dropping_out_for_a_job/
51,Finding Tolerance Stackups,1548372434,[removed],AskEngineers,False,werb321,/r/AskEngineers/comments/ajiott/finding_tolerance_stackups/
52,PE Mechanical Freelancers in California,1548372073," 

I am taking my PE Mechanical in October 2019 because it will help be to advance at my current Job. But also, at some point in my career I want to start freelancing and work as an outsourced PE with companies that do not like to hold liability for engineering drawings. My concern is I know the highly demanded PEs are structural, civil then comes electrical and mechanical comes at the end of the list so I am debating which PE I should take. For those of you who are PE Mechanical Freelancers, at what stage in your career did you start freelancing and is the demand for PE mechanical getting higher or lower? Thank you",AskEngineers,False,migo1991,/r/AskEngineers/comments/ajimsj/pe_mechanical_freelancers_in_california/
53,Does CFD have any place in production engineering/manufacturing Engineering?,1548370544,,AskEngineers,False,ihavequestions92,/r/AskEngineers/comments/ajidmp/does_cfd_have_any_place_in_production/
54,Is it possible to build a platform which serves as both an aerial and underwater vehicle?,1548370314," 

I'm looking for a fun way to spend my next 18 months and was wondering if there were any thoughts on a platform that could function as both an UAV and AUV. I've built UAVs before and am familiar with some of their requirements but was wondering what would it be like from the AUV perspective and the tradeoffs encountered with that design. I think I'll design for a depth of 20ft underwater and celing of 250 ft above my launch to start with. Aside from the power requirements of likely having two different propulsive systems on board and finding a shape that would work in  both aerodynamic and hydrodynamic environments could you all thing of any hiccups or challenges I'll likely encounter?

**Comment** ",AskEngineers,False,GalacticHorizons,/r/AskEngineers/comments/ajic9f/is_it_possible_to_build_a_platform_which_serves/
55,"I have a job interview next week in a field i have little experience in, help me out? (Pressure Vessel and Piping)",1548367131,"Hello all,
   
I have a job interview next week (Thursday) for a CAD Design based role. I have all the relevant base skills, software capabilities etc however I am severely lacking in experience in their actual products/industry (they're willing to train hence why they're willing to interview). 
   
Not letting that stop me though. I need a crash course in pipework design, detailing, and the same with pressure vessels.
    
I was going to scour the internet and my textbooks for relevant information to give me a good an overview possible but ideally I'd like to leverage your guys knowledge to give myself the best possible chance of focusing on the most effective areas.
    
I'm not foolish enough to expect anything more than being able to recite the basics behind design, considerations, and features of pipework systems and pressure vessels. However I would be foolish to not prepare the best I can.
    
So my question is this; 
    
What are the best books, audiobooks, videos, guides, examples, professional standards or other resources that I can force feed my limbic system that will take me from ""novice"" to ""beginner"" regarding piping and pressure vessel design and detailing?
    
Feel free to make assumptions as anything will be better than nothing at this stage. UK based if that helps.",AskEngineers,False,MechMonk2,/r/AskEngineers/comments/ajhso7/i_have_a_job_interview_next_week_in_a_field_i/
56,Re-purposed 12v scooter motor to blower for incinerator. Best control circuit suggestions needed.,1548364297,"https://imgur.com/a/OdkLITO

I am building a blower, and would like to be pointed in the right direction for control.

I will be powering it with an 18v or 12v battery (TBD)

I don't have specs on motor. @18v it has more than enough rpm for my needs. I need a slow speed for the lighting and initial combustion (5 mins or less), and a high speed for the incineration  (likely 20-30 mins). I will need some practical testing to know those speeds. I would like an end solution that makes use of a control board I already have that has all the timings, safety circuits, etc. It has relays for the initial low speed and the high speed.

I know just enough about this stuff to get me in trouble, I'm more of an AC control guy. 

Should I be using a switching motor controller, or just a simple circuit? I'm throwing this together from salvage, and have a big pile of electronics to tear into, although most wont have much that can handle the high current parts.

Not asking for someone to design something for me, just hoping for some nudges in the most practical and economic direction. ",AskEngineers,False,Orwellian1,/r/AskEngineers/comments/ajhalw/repurposed_12v_scooter_motor_to_blower_for/
57,What is a tactful way to ask my manager if my internship will turn into a full time job?,1548361539,"I'm interning at a government agency. It's a great place to work, but hard to get a job here. Most interns don't,  and although I really like it here, I'm not gaining a ton of job skills and I kind of just feel like cheap labor with no job prospects.  

I got another internship offer at a private company that pays $10 more per hour, offers more job skills, even offers some benefits,  and they told me it may lead to a full time job when I graduate in the interview. (If they like me of course)

Before I sign the offer letter and give my 2 weeks notice, I want to at least see if there is any chance of getting a job here. The benefits are amazing (paid tuition, paid day care,  pension, etc) and it is a nice work environment.  I'm going to talk to my manager today. How should I put this? I dont want to tell him about the offer yet. ",AskEngineers,False,Hot_Fart_,/r/AskEngineers/comments/ajgmzq/what_is_a_tactful_way_to_ask_my_manager_if_my/
58,Should i take this job position,1548361343,"Currently I'm a second year mechancial student and the company that wants me is Siemens.

The job title is engineering and technology coop

I know your first coop job is usually you do nothing related to engineering

But my concern is It sounds like I'm going to basically be the secretary. And I don't think it will be a strong addition to my resume because the job description has no engineering task or responsibilities 

Should I take the this position for my first real engineering coop job or explore other options 

",AskEngineers,False,engineeringguy77,/r/AskEngineers/comments/ajglqv/should_i_take_this_job_position/
59,Is a weir turbulence really dangerous?,1548357689,"So, this was a highly rated comment on an AskReddit question. [\[The comment in question\]](https://www.reddit.com/r/AskReddit/comments/8vt1ex/what_could_kill_you_in_your_daily_life_that/e1qv1jp/) And I was wondering what the actual threat the water turbulence is and how dangerous these artificial constructions actually are. Also, does the water go in a circular current, or is it just plain turbulent.",AskEngineers,False,thebadtman1,/r/AskEngineers/comments/ajfyq5/is_a_weir_turbulence_really_dangerous/
60,Machine Shop or Assembly,1548357165,"Hello All,

I am currently going to school part time to earn a degree in Mechanical Engineering. I managed to get a job at a local aerospace company. I get to choose between 2 departments and I was wondering if one would specifically give me a leg up for future job hunts. Right now I can go into either the machine shop or into assembly of said machined parts. They are both entry level and I would be learning many different facets of each position. Would both positions look equal on a resume in the future? 

Thank you for your time!",AskEngineers,False,GermsAllOverMe,/r/AskEngineers/comments/ajfvce/machine_shop_or_assembly/
61,High school senior looking for advice,1548354064,"I'm a current high school senior who's looking to get a summer internship in ideally comp sci or ME.

Some things abt me
- I've already been accept to college as an ME major but I'm more than likely gonna change to CS
- I live in the San Francisco/East Bay Area in California so I'm not limited in opportunity 

For me, what I really care about is gaining SKILLS such as expanded experience with coding in different languages and the aspects of CS beyond programming.

So my questions:
- do internships with startups provide a lot of opportunities to learn technical skills?
- how important is it that if I do end up in an internship, it's in a related area e.g. I've seen an internship related to nuclear energy which isn't exactly what I'm interested in
- what are some resources to look for internships, preferably ones tailored to high school students
- will having an internship now increase the chances of landing when in college, because that is something I'm concerned about

Honestly, I just feel very incompetent and am concerned about being in an environment with little guidance, which is why I'm putting an emphasis on learning technical skills. 

Any advice is greatly appreciated!",AskEngineers,False,jtishere56,/r/AskEngineers/comments/ajfbel/high_school_senior_looking_for_advice/
62,Thoughts on online degrees?,1548354005,"Wondering thoughts on getting a online degree ( CS, or Electrical) thru a accredited school.

Background: Associates in Industrial electronics technology 9 years experience in controls/industrial maintenance

Wanting to get into controls design and PLC, I find this the most enjoyable and rewarding

Any thoughts would be great

",AskEngineers,False,kjd0323,/r/AskEngineers/comments/ajfb19/thoughts_on_online_degrees/
63,Product design help,1548353304,[removed],AskEngineers,False,phoenixscar,/r/AskEngineers/comments/ajf6jw/product_design_help/
64,The associated problems with hypersonic and ubersonic and beyond air travel on a planet with a thick atmosphere.,1548352136,"I've been wondering  about mach 5 travel i want to go even further i consider ubersonic to be mach 25 or mach 1 times 5^2 or 25 what sort of issues do you have at that speed  i  know the air would be even hotter and perhaps we don't know of a material that can withstand the heat stresses  the fuselage would be under, would the shock-wave be even larger at that speed? i really am looking for some intuition in this field of exploratory engineering.

i know a los angeles to new york trans continental supersonic flight path for concorde was scrapped because of the potential noise pollution and this as only mach 2.

what happens if you go even faster still?

thanks in advance
",AskEngineers,False,robespierrem,/r/AskEngineers/comments/ajeyvw/the_associated_problems_with_hypersonic_and/
65,How do you deal with a new job?,1548351386,"I've been working as an engineer for 9 years.  I recently took a position with a new company.  I don't know if I'm burned out, or if I'm homesick, or what it is.  My heart just isn't in my work anymore.  I miss the team I worked with at my old job I'm realizing that the level of teamwork and comraderie we had is uncommon.  

Have any of you fallen in this same rut?  If you did, how did you get out.  I can't really afford to switch careers (apparently kids need to eat everyday). ",AskEngineers,False,agates1001,/r/AskEngineers/comments/ajeu36/how_do_you_deal_with_a_new_job/
66,"I am looking to create a graph of available moment vs unbraced length (AISC Table 3-10) for a non-standard box-beam shape. Mp, Mr, and Lp all seem straightforward, but I am at a loss as to the calculation of Lr, specifically effective radius of gyration.",1548350944,"I've spent a couple of hours on this this morning.  I have my mechanics of engineering materials book out and my AISC code and my Steel Design Textbook out and the difficult to parse internet and I'm still having trouble finding all of the equations that I need.  Am I missing a resource?  

Specifically, in AISC Spec. equation F2-6: I am missing an equation for effective radius of gyration for round corner box beam.  

12"" X 10"" X 5/8"" is the section if anyone is intent on doing my homework for me. ",AskEngineers,False,Helicalpileman,/r/AskEngineers/comments/ajer5p/i_am_looking_to_create_a_graph_of_available/
67,Choosing software specialization,1548350910,[removed],AskEngineers,False,ZeeTANK999,/r/AskEngineers/comments/ajeqy2/choosing_software_specialization/
68,How to choose the right embedded processor,1548349727,"Hello,

I am doing a project where I have made a prototype with an arduino on a pcb with two analog sensor inputs and an arduino ble peripheral. I am doing some signal processing on the arduino but nothing too heavy, some simple filtering and analysis of the signals. I would like to move this to a embedded processor of some kind but I do not have any experience with choosing an embedded processor for a project and do not really know where to start looking. I have experience working on a CSR platform with both MCU, DSP chip and bluetooth radio but I am sure a platform like that would be overkill. So I am asking you guys :) Are there any go to processors for a ""simple"" task like this? Does any of them support BLE? Given this information (and more if you ask) what processors would you be looking at? (I would if possible also like advice on simply how to choose the right platform, is it simply by having the knowledge of what is available in the market or is it searching for the features you want (etc. BLE) at the different vendors?)",AskEngineers,False,ta2ine,/r/AskEngineers/comments/ajejng/how_to_choose_the_right_embedded_processor/
69,I'm looking for an engineering job after being out of college for several years. What's the best way to brush up on my engineering knowledge?,1548349403,"Long story short: graduated in 2015, went into the military for a few years, now applying for jobs. I studied Mechanical Engineering in college and want to make sure I'm familiar enough with the material I studied in college that I can function/not look like an idiot. I've thought about grabbing a review manual for the FE exam or something like that, as it seems to cover most of the stuff I learned in college, but I wasn't sure if that would be either cost or time effective. Any help is appreciated.",AskEngineers,False,WaffleAmongTheFence,/r/AskEngineers/comments/ajehfl/im_looking_for_an_engineering_job_after_being_out/
70,Rule of thumb to determine External Static Pressure,1548347297,"Good afternoon, I recently started working at an MPE firm as a HVAC designer. Is there a good rule of thumb to figure out External Static Pressure required for fan selections?

Thanks",AskEngineers,False,bob_the_kid,/r/AskEngineers/comments/aje3zm/rule_of_thumb_to_determine_external_static/
