index,title,created_utc,selftext,subreddit,media_only,author,permalink
59,Looking for a bit of help to characterize how well various materials can damp a force normal to the plane?,1549318058,"Hi All,

Thanks in advance for any help/pointers you may have! 

I have a system that consists of a 2x1/16x12"" bar of material supported by 1 inch circular supports on either end. These supports attach to the bar via a {washer-damping material-bar-damping material-circular support} sandwich compressed by a screw. A transducer oscillates the bar via a force normal to the bar/supports centralized at the midpoint of the bar. 

Now, I need to measure how well various materials are at damping the bar after the oscillation is removed and/or how well the systems absorbs an impulse (I have a way to measure the bar's oscillation over time). The way I see the system there are three key components:

1. How heavy the bar is
2. How flexible the bar is
3. How damped the bar is at either end

The biggest struggle I am having right now is how to characterize the damping ability of either end of the bar. I don't really have any restrictions as to what kind of material would be used to damp the oscillation and I would like to try several to find the best stuff for the job. Is there a material property that would be directly applicable for this kind of measurement? A combination of properties? Is there a handy table that has this property(s) tabulated for various materials? Ideally I would like to generate a formula that that can predict how these three components interact so it can be generalized for several sites. 

Thanks!",AskEngineers,False,thedancingman4321,/r/AskEngineers/comments/an70hh/looking_for_a_bit_of_help_to_characterize_how/
60,I want to work with renewable or drone based infrastructure in South America.,1549316515,"Hi, I'm a combat veteran, former track diesel mechanic, lived all over the country and in my late twenties I've settled down a bit and I'm attending college. A lot of this has been guess work on my part, a process which I've lived most of my life on. I've not had a lot of linear experiences in my life and I look forward to changing that with a formal academic background. Unfortunately I'm not initiated in the professional world and my social network lacks resources for my inquiries. 

I'm working on an EET AS before using the overlap credits to get a Engineering transfer at a local community college. From there I'll be looking to get a BSEE, possibly local here in Seattle but I'm willing to travel if the right program presents itself. As it stands I'd like some advice about my goals and some suggestions for my education/career path. 

&amp;#x200B;

I see a developing/expanding market abroad for work in renewables and drones. Lacking legacy infrastructure and rapidly industrializing/modernizing there are financial incentives to get off oil and create new logistical networks. Most if not all of you already know about the many uses of drones in agriculture, surveying, etc. but recently I've seen investment in the use of drones as long distance delivery as well as data transmission. These aspects are generating a lot of interest in countries with large mountain ranges or vast expansive wetlands. My ultimate goal is fieldwork and I'd prefer to work my way into consulting or working directly for companies based around these concepts.   


I'm interested in getting a Masters, as I'm starting the academic game late and have experience in leading projects as well as training individuals. I'm very likeable but do not posses the particular set of social skills to exist inside a fishbowl type environment for years on end. I'm not shy about remote work or harsh environments. I lived in the Interior of Alaska for years without running water. Right now I'm studying component level electronics which is a lot of fun. I want to believe understanding the basic construction will be useful down the road when it comes to maintaining machines and/or power systems.   


The BSEE is a given but are there minors to be considered for power management? For drones I assume a lot of software/coding knowledge, RF... really I'd like to know if anyone who reads this has experience working in South America as both an engineer and US citizen. What does that process look like? Obstacles? Challenges? Long term options? Are there are even companies out there for what I'm considering anywhere domestic or international.. As this is five or six years out, and I'm still in very early stages I'm just looking for guide post style resources. 

&amp;#x200B;

Hopefully with everything I typed out something will resonate and get a response. I understand very little of the variables regarding my education or this nebulous career path at this point, but I wonder what other people think. ",AskEngineers,False,justin8191,/r/AskEngineers/comments/an6qe7/i_want_to_work_with_renewable_or_drone_based/
61,Partially threaded screw on the top half? Like a reverse lag screw,1549314533,"Is there a screw i can buy or is there another use case that will solve the problem i'm having? I'm making [this clamp](https://imgur.com/gallery/Q2szyiU) (or something very close to it), and im only clamping to thin sheets of metal, so i only need the last couple threads up the shaft to engage to do the clamping. I dont want to have to thread 25mm of screw before actually making contact with the work piece. This is motion that will have to be performed hundreds of times, so ideally id be able to push the non threaded part through the threaded hole and then have the threads engage just off the surface of the clamped piece. 

The clamp 'U' has to be as wide as it is, as the sheet it's clamping to has a slight return at the bottom in an L shape. ",AskEngineers,False,mechguy768,/r/AskEngineers/comments/an6d65/partially_threaded_screw_on_the_top_half_like_a/
62,Are there careers that blend multiple disciplines of engineering?,1549313071,"Hello all, 

I am a mechanical engineering student, but I have found to really enjoy product development and building something from the ground up: mechanical design, wiring, coding, etc. I had a  cool project that blended all of these and I designed a PCB, wrote the code, designed/wired everything and it was tons of fun.

A professor who’s a good mentor of mine told me that this causes you to be “shallow” in your knowledge (ie jack of all trades). He said most companies have an ME department, EE department, etc and they all work together to interface but not mix, which kinda makes sense because in the industry, why would anyone let me code something when they have a software guy, or wire anything when they have an EE. I’m mechanical and I’m expected contribute within that realm, right?

I was wondering if anyone has this type of career or if things are generally split up in that way.  Any input is appreciated, thank you!",AskEngineers,False,reddittor1212,/r/AskEngineers/comments/an63mi/are_there_careers_that_blend_multiple_disciplines/
63,CAPSTONE: Who to call and what to say to get a project proposal?,1549309657,"I know you graduated engineers have been through capstone already, so I'll just fire away.

I've been cold calling a list of numbers given to me by my university for the past couple weeks with no response. The general consensus in my class is that the info is all severely outdated. Should I just google ""[company name] number"" and give that a ring? What's the move here? 

Many of these companies give you an answering machine to talk to that asks (some of them at least) if you have an extension or if you know who you're trying to call. How can I proceed from there with no information?

Finally, I'm just not the best at conversations, so what are some things I can say, sort of like a script, to quickly and professionally get my needs met in this call?

I may be asking too much, so just respond to what y'all can or want.",AskEngineers,False,nowherenew,/r/AskEngineers/comments/an5git/capstone_who_to_call_and_what_to_say_to_get_a/
64,difference between autocad and robot ?,1549308871,,AskEngineers,False,abdouh15,/r/AskEngineers/comments/an5bbf/difference_between_autocad_and_robot/
65,Abyone else here not an enginner yet but follows this subreddit anyways?,1549302873,"Currently in my 3rd year of uni, im following this subreddit just because I'm curious as to what kind of real-life application questions you guys might ask each other so that's why I follow, but I feel like a poser since I'm not actually an engineer yet. Am I being irrational or do engineers take this kind of thing very seriously because of the amount of actual posers out there?",AskEngineers,False,4dmiral_sn4ckbar,/r/AskEngineers/comments/an48ln/abyone_else_here_not_an_enginner_yet_but_follows/
66,Are there any engineering disasters where the cause is still unknown?,1549302062,For one of my classes I'm supposed to do a report on a engineering disaster where there's a lot of opposing explanations that are still being looked into. Does anyone have any ideas? ,AskEngineers,False,khatur,/r/AskEngineers/comments/an43bk/are_there_any_engineering_disasters_where_the/
67,[Aerospace] [sci-fi] What limitations might an area 51 conspiracy superplane face?,1549300110,"The area 51 conspiracy often references a secret nuclear-rocket super-spaceplane with gravity/inertia negating technology.

If it actually existed, what limitations might it face? Are there weapons or technologies that it wouldn't be able to use? What design challenges would it have to overcome?",AskEngineers,False,I_walked_east,/r/AskEngineers/comments/an3qq7/aerospace_scifi_what_limitations_might_an_area_51/
68,Good engineering/tech podcasts?,1549299567,[removed],AskEngineers,False,PoundingOnMyMan,/r/AskEngineers/comments/an3n3c/good_engineeringtech_podcasts/
69,Should I wait to apply for P.E. or apply now? (Georgia),1549299379," 

I have been looking for a while for a set list of requirements for applying to sit for the State of Georgia P.E. exam. I understand passing F.E. is a requirement, which I have done, however, I am a little confused on the experience part. I read 4 years of experience on a forum. Is this 4 years experience after obtaining EIT?

What is everyone's experience with applying? I graduated from ABET accredited school and have been working under a P.E. here at my current job for 2 years. Also, my internships (also working under P.E.) during college but before obtaining EIT, add up to another 2.5 years.

During both internships I was working under a P.E. and I can obtain the 5 recommendations with 3 being registered P.E. I am considering applying but am not sure if I should wait another 2 years to have the 4 years experience after EIT.

Any advice is greatly appreciated! I am in the Electrical Industry.",AskEngineers,False,IllConsideration0,/r/AskEngineers/comments/an3lvz/should_i_wait_to_apply_for_pe_or_apply_now_georgia/
70,P.E. Requirements (Georgia),1549297500,[removed],AskEngineers,False,IllConsideration0,/r/AskEngineers/comments/an3a03/pe_requirements_georgia/
71,Need career advice - waiting to hear back from interview,1549296628,"I hope this is okay to post here &amp; I apologize for the length (just want to have all the details &amp; background)
 
I am on my first year of my career, graduated on May 2018. I accepted an offer with the company that I last interned with but the position required me to move 10 hours away from home. At first everything was great – I loved my new city, made some friends, &amp; just really enjoyed my position. After about 4-5 months, my mom started having some serious health issues &amp; since I am far away from home, it has been extra difficult for me. This sent me into a deep depressive state. Once the new year started, I decided I would start applying to entry-level positions back home.
 
At one of the companies I applied at, I had an internal referral from a HS friend and within two days I had my first “interview” scheduled. This was just a quick 30 min screening with the recruiter but I was fully honest with her as to why I wanted to move back home (my mom’s health). She told me what the requirements were for the position, asked about my experience in relation to these requirement, told me about their hiring process &amp; asked what I was expecting for salary. The screening ended well with her saying that I would pass to the next phase – a formal phone interview with the position manager.
 
About a week after this screening, the position manager assistant contacted me to schedule the interview with him. We scheduled the interview for 2 days later and he asked about very specific general questions. What was my favorite project, if I’ve had a leadership experience, to expand on my senior design project &amp; he also asked why I want to move back home. When he asked about my favorite project, I mentioned something that is on my resume &amp; he responded with “I’m glad you mentioned that, it was something that I was going to ask you about”. Overall, I thought the interview with him would be a bit more technical but I felt good about it. He ended the call with “Well I’ll talk to [the recruiter] &amp; I’m sure she’ll be in contact with you in the next couple of days”
 
It has been about 1.5 weeks since I spoke with him or heard anything from them. I really enjoy the company’s vision &amp; the description of the position. The HS friend that referred me hasn’t heard anything but she’s also in their marketing department, not engineering. What should I do? Keep waiting? Contact them?
 ",AskEngineers,False,rowdybeanjuice,/r/AskEngineers/comments/an34n0/need_career_advice_waiting_to_hear_back_from/
72,Is it reasonable for me to ask the company thats offering me a co-op to pay for my parking ticket?,1549294966,I was offered a co-op position but I would need a car for transportation. I want to ask the company if they can pay for my parking pass at my university so I can bring my car to the city nearby. Is this a reasonable request and would they agree?,AskEngineers,False,mshimaro,/r/AskEngineers/comments/an2ufy/is_it_reasonable_for_me_to_ask_the_company_thats/
73,"What alloy are used for those metallic/non metallic things, and why? What will elements like Nickel and every other one change the property of the alloy?",1549294168,"* rocket engines

* thermal engines

* gun barrels

* artillery/tank cannon

* brakes disk and plates

* gearboxes gears

* jet plane engines

* railtracks

* bullets

* springs

* military grade armor (the not classified one, for example tank can have complicated armor tech, here I'm just asking about infantry armor. I heard there is ceramic plated armor, that break bullet, and absorbs energy with steel)

I guess those material have to endure those stresses, but I am not sure if this list is accurate:

* corrosion

* high/low temperature

* high temperature range, from low to high

* ability to bend without breaking, and going back to its original shape

* staying stiff without bending",AskEngineers,False,PenisShapedSilencer,/r/AskEngineers/comments/an2pwb/what_alloy_are_used_for_those_metallicnon/
74,New career in engineering opinions/advice,1549292715,"I hope this is ok to post here.

I am considering going back to school for some type of engineering. I am interested in electrical systems but also love dearly taking things apart and seeing how they work. I have a keen interest in construction also, so I am kind of at a point where I want to learn it all but I am 37 and will be starting fresh. I have to choose one field (for now I suppose) that would kind of incorporate these 3 things, or at least construction and mechanical. Is there a way to major in civil engineering and minor in mechanical, or should I just go with civil and learn some other stuff later? One thing I don't want is to be stuck in an office all day long. If anyone can provide some insight or opinions it would be greatly appreciated. Thanks!",AskEngineers,False,Dsadler82,/r/AskEngineers/comments/an2hm2/new_career_in_engineering_opinionsadvice/
75,How do I approach my boss about working from home on a semi-permanent basis?,1549287956,"Hello Askengineers,

I am currently employed in the automation industry in Ontario doing a variety of responsibilities that help sustain and support the other engineers in addition to detailing CAD and other documentation. Since I do not have much hands on work designing, I don't actively need to interact with the shop floor, this also allows me to pilot a wfh initiative to see how reliable and system is when working remotely, which my boss has encouraged.

Recently my wife has received a placement for her career specialization in a location known primarily for oil and gas (which I fully believe is dying and would be career suicide for me). Additionally I don't want to quit this job or leave automation/robotics. 

How should I approach my boss regarding this information and request more opportunities to wfh at this location. I figure my options are as follows:

- Work primarily in current location with the occasional wfh from the other location (1 week a month)
- Work half on site and half  remotely (2 weeks a month)
- Work primarily remotely and fly in when I am necessary to be on site

Performance evaluations are also coming out around March but I feel it would be too late to wait as my wife is starting her specialization in July.",AskEngineers,False,StasysPrime,/r/AskEngineers/comments/an1svu/how_do_i_approach_my_boss_about_working_from_home/
76,What modifications on an automobile engine will result is a more efficient engine,1549285687,,AskEngineers,False,Andrew7330,/r/AskEngineers/comments/an1hzi/what_modifications_on_an_automobile_engine_will/
77,"Will a straight pipe on a fully stock OR remapped engine, increase efficiency without damage?",1549285633,,AskEngineers,False,Andrew7330,/r/AskEngineers/comments/an1hq3/will_a_straight_pipe_on_a_fully_stock_or_remapped/
78,Putting fans back to back,1549285272,"I wonder if placing 2 fans back to back, without the heatsink in between, so that their frames are touching, increase anything in terms of air pressure or CFM. Same question for dual fans with a heatsink in between, as a resistance to the flow. I am still in high school so please keep it somewhat simple. Thanks in advance!",AskEngineers,False,QuillTheBoreal,/r/AskEngineers/comments/an1g3l/putting_fans_back_to_back/
79,Turnitin Drawbacks,1549280263,[removed],AskEngineers,False,mbantuog,/r/AskEngineers/comments/an0uou/turnitin_drawbacks/
80,Anyone here knows where I can find a corrugated thermal pad as shown here from? Or at least what is it called?,1549279621,"[https://imgur.com/OJMDCtt](https://imgur.com/OJMDCtt)

&amp;#x200B;

Its thermally conductive but electrically insulative like the silicone pad used in PCs but it has these ridges in it",AskEngineers,False,unknown2895,/r/AskEngineers/comments/an0s7m/anyone_here_knows_where_i_can_find_a_corrugated/
81,Copper Sheet Thickness for Vustome water tank,1549271166,"Hey all,

Im currently a senior mechanical engineer working on my final project. And have come to a phase where I need to create a simple copper water tank with very specific dimensions (300mm in diameter, 1600mm in height). Are there any standards on the thickness of copper sheet that can be used for this or does anyone know how to derive the required thickness. The tank is designed to act as a simple reservoir, open at the top with a tap at the bottom and should hold around 96l of water.

Any and all help is appreciated!",AskEngineers,False,F4ZE_D3M0N,/r/AskEngineers/comments/amzxpm/copper_sheet_thickness_for_vustome_water_tank/
82,A question for my engineers in robotics...,1549267035," 

2nd year electrical engineering student here, and I'm currently on the hunt for an internship. I'm having a bit of difficulty searching for an internship that is equally creative as it is technical.

I've looked up job opportunities, but its hard finding one that ISN'T manufacturing, power/energy, programming, or systems/controls. I actually had an internship that provided me some insight in each particular field, and I don't think its for me.

I haven't had any experience in robotics, but I'd like to ""try it out"" in an internship, maybe something along the lines of animatronics? I say that because [I saw this awhile ago](https://www.reddit.com/r/gifs/comments/a3xwum/disneyland_tokyo_is_making_a_beauty_and_the_beast/), and I want to be apart of it. A bit of a tough order, considering how specific my audience may be; if this was my end goal, is there a place I can apply to (as a 2nd year EE with little experience) that's in anyway related to this field? If not, what are some other recommended companies to work at- to garner experience and expertise, so that I can eventually get to my end goal?",AskEngineers,False,currentlyFriendzoned,/r/AskEngineers/comments/amzja7/a_question_for_my_engineers_in_robotics/
83,A question to my seniors in robotics,1549266233,"2nd year electrical engineering student here, and I'm currently on the hunt for an internship. I'm having a bit of difficulty searching for an internship that is equally creative as it is technical.

I've looked up job opportunities, but its hard finding one that ISN'T manufacturing, power/energy, programming, or systems/controls. I actually had an internship that provided me some insight in each particular field, and I don't think its for me.

I haven't had any experience in robotics, but I'd like to ""try it out"" in an internship, maybe something along the lines of animatronics? I say that because [I saw this awhile ago](https://www.reddit.com/r/gifs/comments/a3xwum/disneyland_tokyo_is_making_a_beauty_and_the_beast/), and I want to be apart of it. A bit of a tough order, considering how specific my audience may be; if this was my end goal, is there a place I can apply to (as a 2nd year EE with little experience) that's in anyway related to this field? If not, what are some other recommended companies to work at- to garner experience and expertise, so that I can eventually get to my end goal? ",AskEngineers,False,currentlyFriendzoned,/r/AskEngineers/comments/amzgac/a_question_to_my_seniors_in_robotics/
84,Is this type of motor available,1549265428,"I'm brainstorming a project idea and after doing some basic calculations, I found I need a motor that has a max torque of 165 Nm,  a minimum RPM of 15, and be able to withstand up to 270 N of axial force. Are these plausible specifications for a motor I can purchase and isn't too heavy (&lt;20 lbs)?

Sorry if this question's lacking detail or is very obvious",AskEngineers,False,iamdwang,/r/AskEngineers/comments/amzdaj/is_this_type_of_motor_available/
85,A question for my seniors in the robotics field.,1549265336," 

2nd year electrical engineering student here, and I'm currently on the hunt for an internship. I'm having a bit of difficulty searching for an internship that is equally creative as it is technical.

I've looked up job opportunities, but its hard finding one that ISN'T manufacturing, power/energy, programming, or systems/controls. I actually had an internship that provided me some insight in each particular field, and I don't think its for me.

I haven't had any experience in robotics, but I think that's what I'd love to do for a living, maybe like animatronics? I say that because \[I saw this awhile ago, and I wanted to be apart of it\]([https://www.reddit.com/r/gifs/comments/a3xwum/disneyland\_tokyo\_is\_making\_a\_beauty\_and\_the\_beast/](https://www.reddit.com/r/gifs/comments/a3xwum/disneyland_tokyo_is_making_a_beauty_and_the_beast/)) . A bit of a tough order, considering how specific my audience may be: if this was my end goal, is there a place I can apply to (as a 2nd year EE with little experience) that's in anyway related to this field? If not, what are some other recommended companies to work at- to garner experience and expertise, so that I can eventually get to my end goal? ",AskEngineers,False,currentlyFriendzoned,/r/AskEngineers/comments/amzczk/a_question_for_my_seniors_in_the_robotics_field/
86,Is it weird to include a Letter of Recommendation at the end of my resume? What about cover letters when not specifically requested?,1549262586,[removed],AskEngineers,False,tempgettajob,/r/AskEngineers/comments/amz1r1/is_it_weird_to_include_a_letter_of_recommendation/
87,First job out of college - not liking it at all,1549262446,"Hi All,

I am a recent grad and have been at my current job just over a month. Unfortunately I do not like the job at all and I cannot see my self at this position in the next year. Absolutely nothing I do interests me and I am not gaining any relevant skills toward what I want to do in the future (programming/software). Note, I’m not really struggling with my work currently - it’s pretty straightforward - I just have absolutely no interest in what I am doing. 


On the other hand, I really like the company and if possible I’d like to switch to a different department, but I am not sure how to do so. I was thinking of having a meeting with my manager when I have been with the company for 6 months and bringing this up. Should I go this route or should I try to find a new job entirely? Is it bad if I bring this up quicker than 6 months (I.e 3 months)?

 I am worried that a) it will look bad to him that I am looking to change departments so quickly and b) If it’s not possible for me to switch departments, he will know that I am unhappy and will be looking to change jobs.

Has anyone been in my situation before? Could really use some guidance right now.",AskEngineers,False,absvaling,/r/AskEngineers/comments/amz18m/first_job_out_of_college_not_liking_it_at_all/
88,Diff bw noise and sound,1549262025,Which instruments can be used to differentiate between sound and noise,AskEngineers,False,Deepak__0011,/r/AskEngineers/comments/amyzhj/diff_bw_noise_and_sound/
