index,title,created_utc,selftext,subreddit,media_only,author,permalink
0,What is the best alternative to sleeping pills??,1573542717,What is the best alternative to sleeping pills??,AskEngineers,False,bl3ndio,/r/AskEngineers/comments/dv6iff/what_is_the_best_alternative_to_sleeping_pills/
1,Cheap Portable Water TDS Meter Accuracy,1573541662,"HM TDS meter (Price: 10$). What do you guys think about this portable meter, is it good to test drinking water while travelling as it's not very accurate. I heard that the difference is 5 PPM maximum. Is it ok to use as a personal?",AskEngineers,False,Iron_fists121,/r/AskEngineers/comments/dv6cel/cheap_portable_water_tds_meter_accuracy/
2,An interview with an engineering manager,1573541359,"Hi, I was wondering if somebody is available for me to interview for my class? The assignment is to interview a engineering manager, and I don't really know anybody and if anybody who is willing to offer some time, and answer my questions would be great.

Thanks :)",AskEngineers,False,TheBaconDaddy,/r/AskEngineers/comments/dv6an7/an_interview_with_an_engineering_manager/
3,Math major and Biomedical Engineering minor. Is there hope for a career in industry?,1573537273,"I'm a senior undergrad and majoring in Math because I originally wanted to be a teacher.  After countless internships in public schools I realized it wasn't for me. I added a minor in Biomedical Engineering because I found this field to be very interesting. I thought it would be a great idea to add this minor to have a greater chance of finding a job. That is my main concern, NOT FINDING A JOB. I know it is difficult enough to find a job with a degree in engineering, but I would have a math degree. Should I pursue graduate school for biomedical engineering since I do not have internship experience in engineering? Or any other engineering field that you would recommend me looking into?

The only research experience I have is a summer Statistics REU on survival analysis where we determined the best method of estimating the survival of patients with cancer. We also worked with data of patients with pacemakers.

&amp;#x200B;

Any tips/advice would be greatly appreciated!",AskEngineers,False,let_it_be101,/r/AskEngineers/comments/dv5m2x/math_major_and_biomedical_engineering_minor_is/
4,[Need Advice] Feeling not good enough,1573536314,"TLDR: tend to compare w classmates who can understand and do better than me, feel like not good enough to continue this path, need advice to get through this.

as a title suggest, I'm a sophomore in university studying bioengineering.
this term I finally got to touch upon more engineering subjects and most of the concept are new to me so I try my best to ask for help whenever I don't understand a certain concept, to seek for classmates and TAs help with homework etc.
but lately as the concepts get harder, I tend to get more frustrated easily esp with homework and started to feel like I'm not doing good enough, I'm not as good as my classmate whom can understand the concept within a lesser time than I did, and manage to get a full/high score in homework and exams
when I ask one of my classmates for help, telling them this problem is hard for me, asking them if they could do it and let me know what they think. once they finished the problem, they got w full score in first try, and turn to me and said ""it's not hard, what do you mean it's hard?"" and that threw me off 
I know I shouldn't compare but it's been hard not to esp I'm studying w ppl who are far better than I am, I feel like I've reached the limit. idk if I should keep on going, I mean I know I should! because I have an ambition to help others w this degree, it's my value to do so, but it's so hard not to feel I'm good enough

I...don't know what to do, I need advice to get through this and develop a solid growing mindset to get better
thank you in advance",AskEngineers,False,akimi_desu,/r/AskEngineers/comments/dv5ga5/need_advice_feeling_not_good_enough/
5,How to remind professors about letters of recommendation?,1573531530,Maybe not the most engineering based question but i asked some professors for graduate school letters of rec a while back and they said yes. Now that the deadline is about a month away i thought i should remind them. Whats the most respectful way to remind them about these letters?,AskEngineers,False,FappyMcPappy,/r/AskEngineers/comments/dv4lzf/how_to_remind_professors_about_letters_of/
6,"When solving a thermodynamics or a heat transfer problem, when do you neglect radiation?",1573527647,"So I am taking modeling and simulations class, and our current unit is heat transfer. I was looking through my heat transfer textbook to find the answer, but what are the conditions, if you had to determine it mathematically, to neglect radiation from a problem. the problem I am working on is just a piece of copper heated in air. I am also asking from a more general standpoint, not specifically for this problem, as I know how to solve it, this is more of a conceptual question, hopefully that's allowed here.

Could you compare the convection and radiation heat coefficients, and say if the convection coefficient was much larger than the radiation coefficient, you could say that considering radiation wouldn't change the final result too much? Or is it dependent on the temperature difference between an object and the surroundings? I read in my textbook, that the radiation heat transfer coefficient is much more dependent on the temperature difference than the convection coefficient, which might be because the temperatures in the radiation coefficient are to the power of 4.

Thanks in advance.",AskEngineers,False,Batmanssecretfantasy,/r/AskEngineers/comments/dv3udi/when_solving_a_thermodynamics_or_a_heat_transfer/
7,durable clear material,1573525848,[removed],AskEngineers,False,stogush,/r/AskEngineers/comments/dv3h2i/durable_clear_material/
8,Has anyone here gotten fired during an internship?,1573524212,"Making my resume for the 3rd time, wondering if anyone here has (or know of) someone that got fired from a summer internship because their resume was misleading. Thought of this as I was writing ""enjoys working in a fast paced environment"" lol.",AskEngineers,False,Mshaw1103,/r/AskEngineers/comments/dv342m/has_anyone_here_gotten_fired_during_an_internship/
9,Plant Wide Interview Help,1573522475,"I have a plant wide interview where I'll be interviewed by many different employees throughout the day from different departments such as maintenance, production, process engineers and more. 

I just wanted to know if y'all have any tips?",AskEngineers,False,IMTran,/r/AskEngineers/comments/dv2qcp/plant_wide_interview_help/
10,I need a starter 3D printer can you guys give me recommendations?,1573521812,I will be 14 next year and am planning to work 20 hours a week at $11 a hour and I want a 3D printer so I can make layouts to cast swords or axes in my free time can you guys give recommendations?,AskEngineers,False,SeveringZeus691,/r/AskEngineers/comments/dv2l5u/i_need_a_starter_3d_printer_can_you_guys_give_me/
11,I was wondering where the best place to buy magnet wire was. I’m working on making a homemade bike dynamo and from there I can expand my knowledge into other areas of electricity. Oh and also what AWG is the best for what I’m doing? And what does AWG mean? Thanks to anyone who helps!,1573514234,,AskEngineers,False,MaxTyree,/r/AskEngineers/comments/dv0u7x/i_was_wondering_where_the_best_place_to_buy/
12,Discouraged about career prospects,1573513700,"I graduated in May 2019 with a Bachelor of Science in Electronic Engineering Technology (3.79 GPA) from a ABET-accredited public university. I've been job hunting ever since and during university I couldn't get an internship. I'm aware that most employers accept EE and EET degrees but not all like NASA. I can't help but feel that I may have already ruined my career by not pursuing the EE. I chose the EET because I didn't want to go into debt. I'm starting to feel hopeless about my situation even though I was able to get interviews, but they didn't fall through. I don't know whether I should pursue the EE as a second bachelor's degree, go to graduate school, or pursue a new career entirely.

Any advice is appreciated, Thank You.",AskEngineers,False,blackbreaker,/r/AskEngineers/comments/dv0pkg/discouraged_about_career_prospects/
13,I got an offer in a related industry. What factors must I consider before going Contractor? [UK],1573512226,"Hi, I am currently on £42,000 (about £2,300 monthly take-home) as an aerospace design engineer and have been with my current employer just two years. I was with my previous employer just two years, and the one before that just two years and four months.

My current job does not offer me advancement opportunities, doesn't have good work-life balance, has an overbearing (micro)manager, and there isn't a salary raise in sight. With that in mind I've just received a contractor offer in nuclear submarine propulsion for £52 ph. At `£52/hr x 38hr/wk x 45 wk/yr = £88,920` this is a significant increase in income. It's an absolute sell-out move as I've not been at all interested in marine engineering and it doesn't fit in with my background or aspirations. Using [a calculator](https://www.contractorcalculator.co.uk/) and the default expenses of £11,000 results in a profit of £74,800. Total taxes are £22,915, my net annual income is £59,884, and net monthly income is £4,990. 

Amongst my goals are achieving financial independence. However my career aspiration is to work in the space sector on chemical and electric propulsion. I am not sure whether changing jobs and becoming a contractor will weigh heavily against me when it comes to future job applications. On the plus side I can make some more cash, spend it on a 2nd masters degree in September 2020 or 2021, and some additional training to help break into the sector. 

With regards to contracting, the way I read it, an 'umbrella' company is simpler but reduces your net income. However, I'm not averse to finances and bookkeeping so should register with companies house. I will probably need an accountant and to set up a limited company and get insurance before starting. 

I am looking for advice around what else to consider before deciding to take this role.",AskEngineers,False,_Kinematic_,/r/AskEngineers/comments/dv0cw7/i_got_an_offer_in_a_related_industry_what_factors/
14,How is it possible to use the pump similarity laws when a different diameter impeller is used if geometric similarity is violated ?,1573511222,"Hey guys.

In undergrad while studying pumps we came across the similarity laws for pumps and one case involved changing the impeller diameter, then finding the new pump characteristics at a homologous operating point.

Now wouldn't using a different diameter impeller with the same original casing be a violation of geometric similarity, which means that the affinity laws no longer hold ?

Is there something I'm missing ?

Thanks in advance.",AskEngineers,False,theflyingegyptian,/r/AskEngineers/comments/dv05l2/how_is_it_possible_to_use_the_pump_similarity/
15,Question about Hydropower turbines,1573508723,"I am a business student, fascinated by Engineering though I do not know the Math part. Say there is a pipe that has a turbine in it (Whenever water flows inwards this turbine will move clockwise to generate electricity into a generator). Now is there a formula to estimate the watt generated from this turbine?  I want to hypothetically assume that an oil pipe has a turbine in it. Any help on how to calculate the Watts generated?",AskEngineers,False,mega-t,/r/AskEngineers/comments/duzm9f/question_about_hydropower_turbines/
16,Is my experience common? I feel like I am in between a rock and a hard place at work.,1573508040,"I've posted to this subreddit a few times in the last 6 months or so about my work situation. The basic overview is I was working as part of a project team supporting a project manager on a major technology expansion, a business-critical project. Basically scaling up a pilot operation to full production. This is an expansion of an existing unit, so it's not a totally greenfield construction, but it is still a very complex project. The previous PM quit, and my boss and the PM's boss decided I would take over as PM, despite being still relatively inexperienced in project management. I have managed very small, simple projects before. This project is about 50 times the budget and complexity of anything else I have managed. The previous manager had about 15-20 years of experience, I am sitting at about 3.5. Additionally, my request for a raise was denied. I have a wife in school and we plan on moving when she graduates anyway, so I felt I had no option but to just suck it up and take on the responsibility. 

Project management is not what I want to do, and I feel like I am ill-equipped to continue to perform in my role. Nothing has been catastrophic so far, but every week I come home feeling like I want less and less to do with this project or this company. I don't feel like I can be honest with my boss about my feelings. Considering how I got to this point in the first place, which feels like a drastic oversight on the part of my boss and the other leader, I can't envision a scenario where I tell them anything honestly and am met with anything but ""either you continue to do the job or you leave"". Considering I have 6 months till my wife graduates, I don't really feel like I have the option of leaving yet.

Is this experience normal? I really feel like if this project were as critical as everyone claims, they would have done better to ensure that it ended up in the hands of an experienced manager. I know that throughout my career I am going to have to accept more responsibility as I progress, but I can't help but feel like I was thrown into the fire with little training or support. I want to throw in the towel, but I really can't right now.",AskEngineers,False,radil,/r/AskEngineers/comments/duzfzc/is_my_experience_common_i_feel_like_i_am_in/
17,Grad student with industry experience applying for internships. Is that weird?,1573502527,"Hi! I'm a first year masters student in mechanical engineering. I went back to school after feeling restless at my job at a huge aerospace company in the US. I worked there for two years and did quite well -- I was promoted from Engineer I to II before I left. 

Now I am looking for internships, and it feels a bit weird. How bad does it actually look going from Engineer II to intern? I knew this wasn't going to be a step up, but I felt it would be an opportunity to pivot to work I find more interesting (and an opportunity to study abroad, which I did not get to do while in undergrad). 

Has anyone here gone back to school full-time after working? Were you in a position to ask for a better title/pay than the intern standard? Did you just skip the summer internship and finish your degree program, then go for a full-time job after graduation? Or something else?

Thanks!",AskEngineers,False,J1mbuktu,/r/AskEngineers/comments/duxznt/grad_student_with_industry_experience_applying/
18,What mechanical engineering fields make the most money?,1573502208,"I am a university student in one of the top unis in London in my final year of mechanical engineering. I'm predicted to get a first class degree (gpa 4.0 equivalent), and want an honest answer without any sugarcoating. I understand that all fields are profitable if you do well in them, however I have absolutely no preference and want to do whatever will earn me the most now, and in the future. I have a similar work ethic to that of an investment banker - I am cunning and have no morals. 

On this subreddit I know there are many of you with mediocre degrees and grades working for mediocre salaries. I understand that you guys love what you do and enjoy improving the world, but I simply want to know what the 1% engineers go off to do. Please don't be upset or offended by my arrogance or berate me for it, I can assure you I am more than capable of adjusting my persona in person and will have no problems landing a job after I graduate. I am simply after an answer of what fields are currently the most profitable.",AskEngineers,False,123jord3,/r/AskEngineers/comments/duxws0/what_mechanical_engineering_fields_make_the_most/
19,How can I utilize my skills as a Civil Engineer to work at a company with a better culture,1573501690,,AskEngineers,False,boxxoroxx,/r/AskEngineers/comments/duxru8/how_can_i_utilize_my_skills_as_a_civil_engineer/
20,Engineering contract work - what to charge?,1573499613,"I'm a recent grad and have picked up some engineering contract work (mechanical &amp; electrical prototyping).  I am working at home and being payed for my hours and any purchases to create the prototypes.

I've purchased a few items that didn't make it into the final prototype design -- should I charge the company for these? And some items were purchased in larger quantities (e.g. an assorted package of fasteners was cheaper than buying individual screws), should I charge the company for the whole package or just the parts used? Based on our discussions, the company is not interested in keeping anything other than the prototypes.

On one hand, it doesn't seem honest to charge the company for something they aren't going to have or use. But if I don't charge them, then I spent my own money to buy a bunch of things that I don't need...

I also am charging 10 cents/gram for 3D prints, should I be charging for any failed prints, infill, and iterative prints?",AskEngineers,False,Fourhourpower,/r/AskEngineers/comments/dux8eh/engineering_contract_work_what_to_charge/
21,Design Engineer (Substation) Considering Move to Estimator,1573497947," 

Hello, All.

I'm a substation design engineer (BSEE, 2.5 years experience). Although I understand the importance of design work early in my career to establish a foundation knowledge of the industry, I've known even while in school that I wanted to be on the business side rather than technical (PM, sales engineering, proposals, etc). My company offers a rotation program to new engineers, and they allowed me to be a construction PM/Estimator for about 6 months to get a taste of it. I loved it. I did not stay in the role because (1) I felt that I did not have enough technical experience and would be behind the curve, (2) pay was not as good as design engineer salary, and (3) the role does not require an engineering degree (construction management) and I could not justify taking on a role that did not require a BSEE after all the hard work I put in.

A recruiter reached out to me, and I'm currently in the running for an estimator role for a new company in the same field (substation/T&amp;D EPC). The pay is great, and it would allow me to get away from design (which I'm becoming very disinterested in after only 2.5 years). I think I would accept the job if offered. It also does not require a BSEE, but they find having one a big plus.

If there are any current/past estimators with an engineering background, advice would be highly appreciated.

1. First, are there any reasons I shouldn't consider this?
2. Am I able to use estimating experience toward PE experience (4 years required)?
3. Is a PE pointless in this realm? I'd be pursuing it for financial gain, not personal pride.
4. Am I pigeon-holing myself into this line of work?
5. Does this career have great earning and promotion potential over the course of one's professional years?

Thanks!",AskEngineers,False,andy_ryebull,/r/AskEngineers/comments/duwt65/design_engineer_substation_considering_move_to/
22,Do you insist on time on the factory floor (when possible) when considering a new position?,1573497407,"I'm an electrical engineer, and I have a rule that is apparently very odd in the field -- I insist on taking time to work on the production floor if possible when taking a new position, and even if that isn't possible I absolutely will not take anything other than a short commission without getting a chance to at least take an unscheduled walk around the line and then speak to the employees in the break room. 

&amp;#x200B;

I get that it's a very cumbersome rule that most people won't want to do, but it provides an excellent perspective on how the product is actually manufactured and where the opportunities for better/faster/cheaper/safer manufacturing methods exist, plus it makes the production managers a lot more comfortable pointing out a problem if they've seen me curse at a crappy torque driver or bonk my head on a low door frame a few times. 

&amp;#x200B;

Anyone else?  Or is it just me?",AskEngineers,False,JakobWulfkind,/r/AskEngineers/comments/duwo5k/do_you_insist_on_time_on_the_factory_floor_when/
23,Can I cut a hole in my foundation and add a separate entrance to my house?,1573497191,"Just like what the title says.  Can I cut a hole in my foundation and add a separate entrance to my house?  I would need to dig down the dirt, right to footing or so, and then just cut out the wall.  I think my foundation is poured concrete, not blocks.. but it might be blocks.  Then I would just add a door.  I would use wood to frame the steps.  

Does that need any special consideration or can I just go a
head and do that? 


(Caveat: Its not actually me who wants to do this, asking for a friend).",AskEngineers,False,Pouty_Cat,/r/AskEngineers/comments/duwm47/can_i_cut_a_hole_in_my_foundation_and_add_a/
24,How to find a job,1573496002,"So I graduated from college as a mechanical engineer last year, I’ve been struggling to find a job, I would like to get some advice on where to look for, I have tried Indeed, zip recruiter, monster etc, my resume has been reviewed and I believe looks good, I have an internship and one year of work related experience, still just cant seem to find anything.",AskEngineers,False,HiImSamau,/r/AskEngineers/comments/duwb1c/how_to_find_a_job/
25,"Electrical Engineerings, what do you do in your job? Are you in an office? I want to study EE but know very little about what EErings do",1573495846,[removed],AskEngineers,False,skyldrik,/r/AskEngineers/comments/duw9om/electrical_engineerings_what_do_you_do_in_your/
26,3D Facility Layout - Best CAD Tool,1573495190,"Hello all, I'm interested if anyone here has experience with 3D facility layout software.  
Currently using AutoCAD since I know it and it is my quick and dirty way to iterate designs. My management would like something a bit more spruced up and presentable, hence the 3D plant model.

I have made a model in Fusion360, but setting all the planar joints and modeling the components is quite cumbersome, and I am not able to iterate as flexibly. Additionally, when I have hundreds of components, Fusion360 slows down significantly, even when I model them outside of the assembly file, and simply link the parts. When I've presented this model in the past, it has been embarrassing trying to explain why turning off a sub process requires a minute of wait time to display.

I currently have access to AutoCAD, Creo, Fusion360. I haven't learned Creo, I know its a good tool, just haven't had time to commit to learning it.

Any suggestions?

I'm not looking to do any 3D plant scanning, need to model future state of our process line. Ideally would like existing libraries for pallet racks, generic workstations, etc.",AskEngineers,False,riceball2015,/r/AskEngineers/comments/duw3pb/3d_facility_layout_best_cad_tool/
27,I need to Interview an Engineer,1573493269,[removed],AskEngineers,False,feggamone,/r/AskEngineers/comments/duvmmc/i_need_to_interview_an_engineer/
