index,title,created_utc,selftext,subreddit,media_only,author,permalink
33,Looking to build a target holder robot chassis for archery/hunting curious about best approaches,1572236085," Howdy,  looking to build a 4/6 wheel outdoor (Sandy dirt, light snow and ice at most, mostly flat) target holding robot for archery hunting practice. A  minimal viable design should be able to hold a 25 lb target, consisting  of metal and cardboard, be able to travel max 15 mph, with the size  being irrelevant as to being able to hold a foot long target.

I've  gotten couple approaches to this, but coming from a frc background,  felt like some of the designs were overkill, and Arduino kits  underwhelming. There was a promising open source chassis with aluminum  extruders and frc spec tank drive, but since I'm not restrained by frc,  open to many solutions. A open source design I saw: [https://grabcad.com/library/junction-chassis-1](https://grabcad.com/library/junction-chassis-1)

It  would be awesome to be able to have it be mobile and support 200 lb as a  maximum constraint at a slower speed as well, but understandable if  this would bloat costs.

Any thoughts to the spec and a product/design to go by?

Edit: Commercial solutions motoshot, mvp tactical and marathon target",AskEngineers,False,15ykoh,/r/AskEngineers/comments/do3wzk/looking_to_build_a_target_holder_robot_chassis/
34,Biological (Not Biomedical) Engineering Student Math Advice,1572232224,"I know that this question has been asked countless times by other individuals but if any of you that are in chemical engineering or biological engineering, could you talk to me about the practical uses for our type of work that involve the extensive mathematics we have to take. I understand most concepts but actually following through with every step or solution is the crux of my curriculum and I was curious what kind of math is most prominent in our field?

Also I kind of feel a little lost in school right now as for paths to take after graduation because I'm on a degree track that is broad and not super industrial. I am doing Cellular and Biomolecular Engineering where we focus on a lot of research and development of technologies on a cellular level and I know that most people in my discipline fall into food engineering or pharma engineering by the end of it but I really don't want to change things up, I just wanted to know with this do you foresee a market for these positions in molecular biotechnology opening up in the near future or do you think I should settle into one of the bigger and founded disciplines?

I appreciate it a lot, thank you for any responses.",AskEngineers,False,Toadally_Rad98,/r/AskEngineers/comments/do3all/biological_not_biomedical_engineering_student/
35,!unsticky,1572231850,`!unsticky Failure Friday`,AskEngineers,False,AutoModerator,/r/AskEngineers/comments/do3870/unsticky/
36,"Electronic (or any) engineers, can you answer some questions about the *writing* you do for your job?",1572231417,"I'm an EE student, and this is an assignment for my engineering communication course. I need to interview three people in my prospective field, specifically about writing, and make a 300 word essay out of it. That being said, I'm sure there is a significant amount of overlap between the writing for EEs and everybody else. Any response from any engineer is welcome!

To keep things simple, I'll just paste the suggested questions below.

&gt;What kinds of writing do they do as part of their job performance?This includes any and all types of writing; examples include e-mails, reports for management or clients, standard methods, specifications to program a machine; any and all types of writing that involve composing sentences! 

&gt; What are their most common types of writing?

&gt; How much time is involved in their writing (either daily or weekly)?

&gt; Is their writing easy or difficult for them?

&gt; Is there any connection between promotion and writing skills in their job or company?

&gt; Did the interviewee expect writing to be important in their job?

&gt; Was he/she well prepared to do the writing needed?

I realize those are quite extensive, so don't feel the need to answer all of them! Thanks for reading.",AskEngineers,False,lapotronic,/r/AskEngineers/comments/do35dv/electronic_or_any_engineers_can_you_answer_some/
37,General Questions for Engineers,1572231189," Hi Reddit, I'm currently an undergraduate engineering student taking an Introduction to Engineering course. One of my assignments is to interview an engineer, and I was wondering if some of you guys could help me out.

1. What degree of engineering did you get, and what is your current job position? (if you are comfortable sharing this, it might be too personal)
2. What does a typical engineer's working day normally look like? (design, report writing, meetings, sales, research, operations)
3. What do you like most or least about being an engineer? What do you find satisfying about being an engineer?
4. What characteristics do you think an engineer should have, especially at an entry-level profession?

Any response would be greatly appreciated. Thank you so much!",AskEngineers,False,WhisperingWisteria,/r/AskEngineers/comments/do341e/general_questions_for_engineers/
38,Mixing different purity of oxygen,1572229479,Does mixing different purity of oxygen just a simple average calculation? will it be safe? Proof? Thank you!,AskEngineers,False,arjiomega,/r/AskEngineers/comments/do2tew/mixing_different_purity_of_oxygen/
39,Have you ever bailed from a new job?,1572228755,"At about the 10 month mark working for a new company, in a new city, in a new industry (automotive / trucking).  The first 5 months went great, lots of new people hired, lots of training from different locations, money spent -- we were making real progress to a very neglected segment of this company's business.

After those first 5 months, things started to change.  The outside visitors became fewer and fewer, temps started to get cut, as well as several full time employees (including my mentor).  Others either left by coincidence, or saw the writing on the wall.  Next week two smaller assembly lines are getting moved to a different location.  None of this directly affects me, other than having fewer people to ask for help.

&amp;#x200B;

I'm getting a bad feeling.  I moved here for this job and bought a house, but am worried about the job security going forward.  This location being sold is a constant fear.

&amp;#x200B;

When do you give up hope and bail from a once-good job?",AskEngineers,False,thrroow,/r/AskEngineers/comments/do2orc/have_you_ever_bailed_from_a_new_job/
40,Research Question,1572223258,[removed],AskEngineers,False,DeepBlueKasparov,/r/AskEngineers/comments/do1ohd/research_question/
41,How does the angle of a guillotine upper blade affect the necessary cutting force?,1572223045,"I am trying to do engineering analysis on shear cutting metal tape using a guillotine method of cutting. The tape will be aluminum 6061 H18 0.5"" wide and 0.005"" in thickness. I understand that the required cutting force is just shear stress multiplied by the cutting area. However, I have read literature that angling the blade will result in a lower cutting force. I have not been able to find any literature on how much the angle of the blade will lower the force. Furthermore, I have read that increasing this rake angle will cause twisting, crooking, and bowing to occur on the tape. If anyone could send anything on the relationship of these reactions that would be greatly appreciated. Lastly, I believe that the ductility of the aluminum will play a part in the necessary cutting force as the blade will only have to cut part way into the tape before burring will occur and finish the cut. Again I have not been able to find anything further on this topic.",AskEngineers,False,louisianajedi,/r/AskEngineers/comments/do1n3s/how_does_the_angle_of_a_guillotine_upper_blade/
42,Is there some sort of component design spec for headphones I can leisurely read,1572222860,I am interested in learning the components of what may go into a pair of headphones like AirPods. Something high level but shows how the components interact or something.,AskEngineers,False,tryingtoeat,/r/AskEngineers/comments/do1lvs/is_there_some_sort_of_component_design_spec_for/
43,Good machining resource recommendations?,1572221875,"I'm about going to do Electrical Engineering because I love embedded systems RF control systems power distribution , Robots that kind of stuff.

But I don't think the degree will provide me with the know how to make a physical body for a robot or a electromechanical machine and so on and the physics involved and I've debated doing a mechanical or mechatronics major before but I've settled with what I'm passionate about.

So are there any resources I can access that will Assist me in the mechanical side of things? To make the physical parts like how mark rober does it? I remember hearing about 1 specific book about machining Every  Electrical Engineer should read but I can't remember the name. 

Much appreciate the help!",AskEngineers,False,mikey10006,/r/AskEngineers/comments/do1fej/good_machining_resource_recommendations/
44,When was a time you fucked up big time and how did you fix it?,1572221437,Or what would you do different?,AskEngineers,False,jasonlarry,/r/AskEngineers/comments/do1cfe/when_was_a_time_you_fucked_up_big_time_and_how/
45,Why does the Fiber Timing Gear exist?,1572219436,"Through one conversation or another about cars, the subject of fiber timing gears comes up and nobody I've talked to really has a good answer for why the fiber timing gear exists.

It's a component that can be found on anything from Ford Model As to rather late model GM and Ford vehicles. 

Shade tree mechanics suggest it's a cost saving measure that ends up only hurting the customer by having to replace the timing gear more often than a metal one; I've also seen it suggested that a fiber timing gear stops catastrophic damage from occurring and sacrifices the timing gear instead of a much more expensive component(s). 

Are any of these correct?",AskEngineers,False,avagadrotoast,/r/AskEngineers/comments/do0ze4/why_does_the_fiber_timing_gear_exist/
46,What are jobs like in consulting compared to industry?,1572218922,"Hello everyone,

I'm an electrical engineering student in my last year, I'm currently looking for a full-time job. I landed an interview at a consulting company and I was just wondering how consulting compares to industry?

About me: I'm really interested in learning new skills and putting my education to work. I want to learn hard technical skills that can be transferred between positions, should I choose to transfer to another field. I prefer variety in my work and I'm not quite sure what I what to do yet so I'd like to keep my options open as much as possible. I would rather not be in a position of constant pressure. I did a 16-month internship in a position that had an endless stream of work that couldn't possibly be completed by one person, and I gradually grew to hate it. I would prefer a position where the pressure and work ebs and flows, something where the work isn't endless but I still contribute work and learn new skills.

Which industry do you guys think would better suit what I'm looking for? I have heard that consulting, although great for learning, is very stressful. The learning opportunities and variety of projects at a consulting firm sounds great, but if that's tied to being overworked and under constant pressure I think I would gradually grow to hate my job. Just looking for general advice. I'm Canadian, if that makes any difference. Thank you!",AskEngineers,False,kkemillie,/r/AskEngineers/comments/do0vyb/what_are_jobs_like_in_consulting_compared_to/
47,Consulting vs Industry,1572218253,[removed],AskEngineers,False,kkemillie,/r/AskEngineers/comments/do0rb0/consulting_vs_industry/
48,Does anyone teach at a community college?,1572217421,"Hi, I'm really interested in teaching at the college level at some point (currently getting an MS in Civil Engineering) but dont particularly have a desire to do research for the long term. So long story short, does anyone teach at a community college level? Is it enjoyable? Does it pay okay? What's your overall experience with it? 

Any insight is appreciated :)",AskEngineers,False,profoaktree7,/r/AskEngineers/comments/do0lky/does_anyone_teach_at_a_community_college/
49,Interview?,1572213523,"I'm a sophomore, currently enrolled in high school taking engineering class where we use PLTW (Project Lead The Way) for work and projects and such. We had started a project this year where we picked any ""engineering"" field and researched our field of choice. I picked Cyber Security Engineering since that is what I'm interested in and currently aiming towards as job in the future. I have to interview someone from the field and obviously ask them questions that'll most likely take less than 10 minutes. If there is anyone who is in this field, please contact me (or i can contact you by email sending you the interview questions and you can reply back with the answers.), since I need this by before Wednesday October 30, 2019. Anyways hopefully i can reach out to someone.",AskEngineers,False,xAurq,/r/AskEngineers/comments/dnzsnv/interview/
50,Need to Interview an Engineer for an Essay,1572213275,Is anyone willing to participate in this interview? I'll be asking a few questions regarding your thoughts on climate change and our best approach to tackle the crisis. I'll PM those who are interesting. Thank you.,AskEngineers,False,Kingsglavie,/r/AskEngineers/comments/dnzq16/need_to_interview_an_engineer_for_an_essay/
51,Hi! I'm looking for an engineer to interview.,1572210975,Hi! I am a high school student taking an engineering class called Principles of Engineering. Our class has been assigned to interview an engineer and I was wondering if any of you could spare some time and answer some questions I have for you. Please reply  as soon as you can. Thank you.,AskEngineers,False,erikaaa1230,/r/AskEngineers/comments/dnzb5c/hi_im_looking_for_an_engineer_to_interview/
52,Negotiating salary as a Masters Student,1572210818,"Hello!

I am a masters student studying electrical engineering, specifically focused on signal processing and machine learning.  I am planning on graduating in the summer and am currently in the middle of a job hunt.  I currently have a single job offer in the Washington D.C. area and expect another job offer soon, but in a less desirable location.  Unfortunately, the job offer I currently have has offered a considerably low starting salary.  Most other people I know, who went directly to work after receiving a bachelors, are receiving $80k.  My offer was much closer to $70k.  I'm currently preparing to make a counter offer, but I'm afraid that my expected salary of $90k may be much too high given the initial offer.  Does anyone have experience dealing with this kind of situation? Is it unrealistic to expect $90k starting with a masters and 3 internships?  Any advice would be welcome!",AskEngineers,False,All-American-Zero,/r/AskEngineers/comments/dnzacq/negotiating_salary_as_a_masters_student/
53,Why are torx heads not used more frequently?,1572210708,,AskEngineers,False,artificial_neuron,/r/AskEngineers/comments/dnz9t7/why_are_torx_heads_not_used_more_frequently/
54,"Does anyone know anything about piezoelectrics? For a concept idea, I group I am am involved with is looking at involving piezoelectrics in roads, and was wondering what the limits were on size and pressure that they had.",1572205756,,AskEngineers,False,Daedelus95,/r/AskEngineers/comments/dnyhba/does_anyone_know_anything_about_piezoelectrics/
55,So I had this idea the other day and I was wondering about the practicality.,1572205368,So my idea was a hydroelectric car with a fluid system running from a saltwater tank to electric motors on the axles. The water is energized by diodes connected to the water tank that rub back and forth on friction rings inside the water tank and are moved by the car's natural bouncing. As for how the car would start I thought about a key that contained a small charge to provide an initial start to the system and is charged back up as the car runs. Is this something that's actually achievable or a teenager's imagination not lining up with reality?,AskEngineers,False,beansprout2001,/r/AskEngineers/comments/dnyfcw/so_i_had_this_idea_the_other_day_and_i_was/
56,Calculating throat and exit areas of steam CD nozzle to avoid shockwaves for a given massflow,1572202089,"Trying to design a steam CD nozzle with a given inlet and exit pressure, and a given mass flow of steam. My model created using my hand calcs of area shows normal shockwaves in the pipe before the exhaust when cfd'd. I'm wondering if anyone has any experience with this, I can't quite figure out what aspects I'm missing.",AskEngineers,False,sean_183,/r/AskEngineers/comments/dnxpsh/calculating_throat_and_exit_areas_of_steam_cd/
57,CD nozzle design,1572201295,Looking to design a CD nozzle for steam with a given inlet and outlet pressure and a known mass flow rate. The areas for throat and exhaust I've calculated appear to give shockwaves in the nozzle when using cfd and cause the steam to leave subsonic. Anyone have any experience with this?,AskEngineers,False,sean_183,/r/AskEngineers/comments/dnxj71/cd_nozzle_design/
58,Explaining unemployment gap in my resume/cover letter,1572198966,[removed],AskEngineers,False,lazywhitegirl,/r/AskEngineers/comments/dnwzku/explaining_unemployment_gap_in_my_resumecover/
59,How to make an ok makeshift device for measuring battery capacity?,1572198434,"Can you give me advice for my makeshift battery-capacity measurement device? 



https://i.redd.it/h4kj6bhx74v31.png



Is there any better design? Should I use other components?



It's a simple concept. You have the clock to mechanically stop whenever the load is too small, and you have to check it every 12 hours. With some kind of good bulb or something to pull the juice and spend it, the battery should empty in a few days. I have a few rechargeable batteries that I know have a diminished capacity, but I have no way to measure it. 




Is there some other trick or design to measure battery capacity?



Tnx!",AskEngineers,False,asssed,/r/AskEngineers/comments/dnwuzx/how_to_make_an_ok_makeshift_device_for_measuring/
60,Job Environment for Engineers,1572196547,"I’m not an engineer but am interesting in pursuing engineering and like to learn how stuff works. I know that experiences widely varies, but do most engineers work behind a desk? Do many people much experience outside of an office?",AskEngineers,False,The-Real-Mike-Hunt,/r/AskEngineers/comments/dnwfn3/job_environment_for_engineers/
61,Is there any online courses for mechanical engineers to improve on the electrical side of engineering?,1572195653,I am a recent graduate mechanical engineer. I’ve recently started my first job as a subsea engineer but I’m a bit slow with the electronics side of it. I also want to eventually go into wind energy so thought it would be beneficial for that as well,AskEngineers,False,Scott976,/r/AskEngineers/comments/dnw806/is_there_any_online_courses_for_mechanical/
62,Is it too soon to leave my first job?,1572194470,"I graduated college at the beginning of May with an engineering degree and was lucky enough to find an engineering job right when I graduated. I graduated mechanical and work as an industrial.

I was given 1 project right when I started and finished that in about 4 weeks. Since then I have had nothing to do. I do about 5 hours of work a week, and that is either data entry or supervising the technicians on the shop floor. I  sit in my office doing nothing or hang out on the shop floor 90% of the time I'm there. I  just feel like an overpaid intern. I take all the initiative I can in trying to optimize processes, finding projects, etc, but being a new grad I'm so inexperienced and naive I feel like I really need a mentor. The only other engineer at the company focuses on a different part on the business so I never see or talk to him; I'm basically all on my own. I ask my manager 2 or 3x a week if there is anything more I can do/help her with but she says I'm doing great and to just keep doing what I'm doing. 

The company also hired 3 more salaried employees right after me (none are engineers), and laid off/fired 2 of them and several other employees after about 2 months when they saw how much money they lost last quarter. I'm worried that I will be laid off next due to lack of work. 

Am I overreacting or should I start looking at other jobs? I've looked at other jobs and have seen a couple that I'm interested in and that have actual technical work, which is what I want to do. Will it look bad that I left this job so soon? Or should I try to stick it out a year? What should I say to prospective employers? I obviously wouldn't quit until I had a better offer in a position I'm sure I would like better. 

TL;DR: Have a job I'm not interested in/don't like and have basically no work. Been here just over 6 months. Should I leave or stick it out a while?",AskEngineers,False,I_AM_NASA_AMA_,/r/AskEngineers/comments/dnvxeq/is_it_too_soon_to_leave_my_first_job/
63,Nuclear Engineering/ Physics PhD,1572191757,"Hi guys, I'm a nuclear engineering major right now. I want to get a Ph.D. in either nuclear physics or engineering. Should I double major/minor in physics even if it'll take me a year longer to finish both (both the minor and the major would take me a year longer)?",AskEngineers,False,darkPhoenix_Queen,/r/AskEngineers/comments/dnv9wq/nuclear_engineering_physics_phd/
64,Hi I am not an engineer but my dad is one and he is really stressed out. Do you guys know anything I can do to ease his nerves because he is doing his vertical exam and he is really stressed and overworking himself and I hate to see him like this.,1572189754,The reason I’m asking because normal things people do to ease their nerves isn’t working for him and he refuses to stop studying for even a second.,AskEngineers,False,yeteboi,/r/AskEngineers/comments/dnus6u/hi_i_am_not_an_engineer_but_my_dad_is_one_and_he/
65,Leaving a comfortable job?,1572189106,"I'm a mid-career engineer and worked the majority of my career at my current company (think F500 company).  The job is great.  I was promoted to a management position recently, they treat me well, salary/benefits are great, and it's in an area of my industry with a lot of opportunity for future growth.  It's a place I can honestly see myself working at until I retire.

All of that is great, especially in this era of unpredictable employment.  However, the commute has been wearing on me.  My fiancé and I commute in opposite directions, which means I'm commuting 1 hour each way on the highway.  I have a form of genetic arthritis, and the long commute has been wearing on me.  Due to the nature of the job, working from home is only an option in limited circumstances.

Recently, an opportunity with a new company has come up near my fiancé's work.  This would allow us to move and reduce both of our commutes, as well as live in the city near some of our friends.  The job itself is a bit of a pivot: It's in the same industry, but less technical, and more business/operational.

On one hand, this new job offers improved quality of life outside of work.  On the other hand, I feel nervous stepping from a known, good job into a new role with a new employer.

What advice does r/askengineers have for deciding whether to take a new job?",AskEngineers,False,engineer_throwaway_,/r/AskEngineers/comments/dnumdr/leaving_a_comfortable_job/
66,Is this something appropriate for a resume?,1572183862,[removed],AskEngineers,False,ducks-on-the-wall,/r/AskEngineers/comments/dntesr/is_this_something_appropriate_for_a_resume/
67,I really want my karma to be positive. Can you’ll help me put?,1572181698,,AskEngineers,False,DagmawiBabi,/r/AskEngineers/comments/dnszia/i_really_want_my_karma_to_be_positive_can_youll/
68,button which only moves when fully pressed?,1572174143,"What are these called?

I'm talking about press buttons which don't cause an internal trigger unless the button is fully pressed down. When the button is pully pressed down a relatively strong mechanical force moves something inside of or the opposite side of the button, so I'm guessing it's a spring-based system and it is somehow loaded while the button is pressed down and only released when the button is fully pressed down. But that's just a guess.",AskEngineers,False,viwenn,/r/AskEngineers/comments/dnru7a/button_which_only_moves_when_fully_pressed/
69,What is the maximum current i can draw from an car alternator.,1572172627,Hello. I have a renault megane 2 1.6 petrol. I want to build a 1000 w electrical heater conected to the car electricak system. I inted to conect it to the car lead. Will it be safe to draw 1000 w with the engine on? Thats about 83 A. Can the car electrical system handle it?,AskEngineers,False,unnamedtrack1,/r/AskEngineers/comments/dnrmwf/what_is_the_maximum_current_i_can_draw_from_an/
70,Why isn't the bird blown backwards?,1572157604," [https://gfycat.com/fittingjampackedirishdraughthorse](https://gfycat.com/fittingjampackedirishdraughthorse)

The wind's coming from the front of the bird, it looks like. So how does it stay in place without flapping? It's got to have some amount of drag that would push it backwards, I would think.",AskEngineers,False,ilovethemonkeyface,/r/AskEngineers/comments/dnpqo9/why_isnt_the_bird_blown_backwards/
